"0"	"From Idris Elba to Richard Gere: All the Sexiest Man Alive Covers"	"Some are familiar faces (Ben! Brad!) and some are shockers (here's looking at you, Richard!). Check out who's been named Sexiest through the years"
"0"	"Metal detectorists discover haul of gold coins worth at least 100k"	"This is the moment a metal detectorist looking for a friend's lost wedding ring discovered a haul of gold coins worth an estimated £100,000 and shouted - ''yee-ha - there's a f*cking fortune here!'. Paul Raynard, 44, screamed "'there's millions - this is the moment we dreamed of!" to best pal Michael Gwynne, 52, when he realised the scale of the find. Businessman Paul "broke down in tears" when he stumbled across his very own pot of gold - a cluster of 84 coins in a field near Ballycastle, Northern Ireland. Stunned Paul and Michael found the coins - dating back to the 1500s - whilst looking for the wedding ring a farmer friend had lost in his field."
"0"	"Judge calls USC dad a 'thief,' gives longest prison sentence so far in college admissions scandal"	"Toby MacFarlane, a California real estate executive, received six months for his actions in the college admissions scandal. It's the longest so far."
"0"	"Bolivians jam streets to celebrate president's resignation"	"Jubilant crowds packed the streets of La Paz Sunday to celebrate the abrupt resignation of Bolivian President Evo Morales, Latin America's longest serving leader, after weeks of protest over his disputed re-election. "THIS is my only flag," shouted a young masked man in a white helmet, waving the Bolivia's red, yellow and green emblem."
"0"	"50 amazing gifts for every type of person and budget"	"Let the product experts at Reviewed help you find the perfect gifts for everyone on your list."
"0"	"Venice Beach littered with needles and other medical supplies that washed up onshore"	"Lifeguards say the area has been cordoned off and Los Angeles Public Health has been notified."
"0"	"Divers salvage 100-year-old liquor from WWI shipwreck"	"A team of ocean explorers says it has retrieved cognac and liqueur from a ship that was bound for Russia when it was sunk by a German submarine in 1917."
"0"	"Two sisters raise thousands to buy 108 Thanksgiving meals and turkeys for families in need"	"From cherry pies to turkeys and mashed potatoes, two sisters are on a mission to make sure families in need have the Thanksgiving dinners they deserve. For the third year in a row, Alex Fischer, 9, and her sister Caroline, 6, are raising money to provide meals for North Carolina families that can't afford the traditional holiday feast."
"0"	"Atlanta college student Alexis Crawford was choked to death, dumped in park, police say"	"Authorities say Alexis Crawford and her roommate Jordyn Jones had a physical altercation and Jones' boyfriend intervened and choked Crawford to death."
"0"	"Celebrity plastic surgery transformations"	"See how stars like Sharon Osbourne, Cardi B, Pauly D, Kim Zolciak-Biermann, Gisele Bundchen, Kanye West and others have altered their looks."
"1"	"Why You Should Never Skip Chilling Your Cookie Dough"	"Have you ever wondered why sugar cookie recipes make you chill your dough before baking?"
"0"	"They bought a 1 euro house in Italy -- here's what happened next"	"CNN Travel caught up with some of the pioneering buyers -- or "€1 citizens," as the locals in Italy call them -- to discover whether it's been worth it to buy a house for a little more than $1."
"0"	"Man attacked by alligator in Palm Beach County transported to hospital"	"A man has been transported to a hospital after being attacked by an alligator near the DuPuis Wildlife and Environmental Area. When authorities were first notified, the man could not be found. Martin County Fire Rescue later located him after searching. Sign up for our Newsletters No other information is being released at this time. READ THE FULL STORY:Man attacked by alligator in Palm Beach County transported to hospital CHECK OUT WPBF:Get the..."
"1"	"The CEO taking on the gun lobby"	"Ed Stack didn't set out to be an activist. The chief executive of Dick's Sporting Goods, Mr. Stack spent his career selling fishing rods, camping gear and athletic equipment at big-box stores around the country. Dick's was founded by Mr. Stack's father in upstate New York. As a young man, Mr. Stack worked for the family business. But he didn't enjoy the experience. His father was a divisive boss who couldn't manage a supply chain, and was..."
"0"	"Survivor Contestant Accused of 'Inappropriate Touching,' 2 Players Admit to Using Allegations to Win"	"Survivor Faces 'Inappropriate Touching' Scandal: Dan Accused by Kellee"
"1"	"'The bridge has definitely been burned': Williams says Redskins have smeared him in aftermath of cancer diagnosis"	"Seven-time Pro Bowl left tackle Trent Williams won't play for the Redskins this season, and his future with the team is unclear."
"0"	"Why Ukraine and Russia are still at war"	"A long and draining war in eastern Ukraine has become embroiled in President Trump's attempts to undermine his opponents at home. But the war is real and still taking lives, and a way to end it will be very difficult to find."
"1"	"How To Clean Burnt Pans"	"If you've ever left your bacon on the stove a little too long, you've seen how yucky the pan can become. Instead of letting a burnt pan soak overnight, we recommend trying this trick with household ingredients to shine up your dishes quickly."
"0"	"I'm extremely introverted, but I challenged myself to be more outgoing for a week, and it made me feel more confident"	"I went from not speaking to anyone for an entire day to seeing movies by myself, chatting up strangers, and correcting my coffee order."
"1"	"The 11 Biggest Myths About Cellulite You Need to Stop Believing"	"You don't have to be female, overweight, or older to see cellulite. And some treatments work, however, tanning is not one. Dispel the myths and get the facts about cellulite."
"1"	"Cause determined in Jessi Combs' fatal speed record crash"	"Occurred at speeds near 550 mph"
"0"	"Photos: DIY shields of Chile's protests"	"Chilean protesters use everything from plywood and mirrors to the kitchen sink to shield themselves from riot police during demonstrations that have left at least 20 dead and wreaked billions of dollars of damage to public infrastructure and private businesses."
"1"	"I ate the same meal at America's three largest sub chains   here's the one that reigned supreme"	"I ate the same meal at Subway, Jimmy John's, and Jersey Mike's, and the winner scorched the others with the fastest service and best-tasting food."
"1"	"This town turned its opioid nightmare into a haunted house. And it's terrifying."	"Witches? Goblins? Nope. The horror of addiction is what scares these folks in Maryland the most."
"1"	"Is It Really Faster to Fly East Than West?"	"Ever wondered why your flight heading east was so much faster than your westward-bound flight? Here's the scientific reason."
"1"	"Space May Be Full of Tiny Bubbles with Teeny Universes Inside"	"Researchers say the universe could be made of "spacetime foam," or a bunch of incredibly tiny bubbles with teeny universes inside."
"0"	"This Is The Moment A Senior Shelter Dog Knew He Was Safe"	"Finding happiness is no guarantee for pets awaiting adoption at animal shelters   especially for dogs like Jack."
"0"	"Josh Gordon on track for debut with Seahawks"	"RENTON, Wash. (AP) Josh Gordon didn't know where he'd land following his release from the New England Patriots last week. He did have one place in particular he wanted to end up."
"1"	"Rockefeller Center Christmas Tree Arrives In New York City"	"The 14-ton tree was cut down Thursday in the Village of Florida, New York, in Orange County."
"0"	"AP Interview: Huawei founder says US woes not hardest crisis"	"SHENZHEN, China (AP)   For decades, Huawei's founder stayed out of sight as it grew to become the biggest maker of network gear for phone carriers and passed Apple as the No. 2 smartphone brand. Now, Ren Zhengfei is shedding that anonymity as China's first global tech brand mobilizes to fight back against U.S. sanctions and warnings Huawei Technologies Ltd. is a security risk."
"1"	"The 15 Longest Nonstop Flights in the World"	"Do you think you could handle being stuck inside a metal tube for this long?"
"1"	"Costco workers reveal 6 things they'd never buy from the store"	"Costco products are known for their reasonable prices and bulk sizes   but there are some employees say they choose to avoid."
"0"	"Here Are the Biggest Deals We're Anticipating for Black Friday"	"The Black Friday deals for 2019 have already begun leaking out. Get a sneak peek at what to expect from popular retailers like Costco, Walmart, and Best Buy. Browse our guide and use it to plan your attack for the biggest shopping event of the year."
"1"	"Florida air show crash: Pilot killed when plane crashes"	"An airplane crashed Friday afternoon at an air show in Florida, killing the pilot, Martin County Sheriff William Snyder said."
"0"	"Jennifer Lopez Just Got a Teeny Chop to Her Blond Lob, but it Changed the Entire Look"	"In September, Jennifer Lopez debuted a new hairstyle at the premiere of Hustlers."
"0"	"Steelers defense leads way in 17-12 win over Rams"	"The Steelers defense spoiled Aaron Donald's homecoming and derailed the Los Angeles Rams' momentum in the process, 17-12"
"0"	"Hall of Fame catcher Mike Piazza agrees to manage Team Italy"	"Baseball Hall of Fame catcher Mike Piazza, a 12-time All-Star, will manage Italian national baseball team for its upcoming international tournaments."
"0"	"The latest on Brad Pitt and Angelina Jolie's post-split relationship, plus more news"	"Brad Pitt reportedly wants to see his kids more than Angelina Jolie has made possible. Plus, more celebrity news for Nov. 14, 2019."
"0"	"'Lots of Tears!' Teresa Giudice Details Reuniting With Husband Joe in Italy"	"'Lots of Tears!' Teresa Giudice Details Reuniting With Husband Joe in Italy"
"1"	"11 Powerful Products That Cut Your Cleaning Time in Half"	"Save time without sacrificing cleanliness at home with these mighty cleaning products. No stain, scum, or smell can handle the battle against them. As an added bonus, many of the products on the list are free of harsh chemicals and scents."
"1"	"An abandoned nuclear missile site is next to one of New York City's most popular beaches, and this is what it's like inside"	"Insider visited an abandoned Cold War era military base secluded by maritime forest in New York City."
"1"	"Analysis: Extreme greed reigns on Wall Street. Here's why investors are so confident"	"It seems like nothing can go wrong on Wall Street these days."
"1"	"Jennifer Lawrence Hired A Food Truck For Her Wedding And The Owner Had No Idea Who She Was"	"Kinda mad I wasn't invited, TBH."
"0"	"Meghan Markle Says That Archie Has Two Teeth and Is Crawling"	"The cutest? Or the cutest ever?"
"0"	"Who has the chance to shine in Week 10?"	"The "Good Morning Football" crew discusses who has the chance to shine in Week 10."
"1"	"The Curious Pasta Dish I Found on My Solo Trip to Italy"	"Table for One is a column by Senior Editor Eric Kim, who loves traveling alone, and seeks to celebrate the beauty of solitude in its many forms."
"0"	"Mollie Tibbetts' accused killer wants confession thrown out, claims he wasn't read rights"	"New, gruesome details emerged in court during a pre-trial hearing in the case of murdered 20-year-old Iowa college student Mollie Tibbetts."
"0"	"Richest 1% of Americans Close to Surpassing Wealth of Middle Class"	"The U.S.'s historic economic expansion has so enriched one-percenters they now hold almost as much wealth as the middle- and upper-middle classes combined."
"0"	"Coast Guard suspends search for missing airman"	"The search for the missing Air Force airman has been suspended."
"0"	"Cindy McCain: John McCain 'Would Be Disgusted' By The State Of Politics"	"Cindy McCain, wife of late Sen. John McCain (R-Ariz.), said that her husband would have been deeply troubled by the current state of American politics as Republicans continue to defend President Donald Trump against a fast-moving impeachment inquiry. "I think he would be disgusted with some of the stuff that's going on," she CNN's David Axelrod in an interview that aired Saturday. "I really do. I think he'd be, he'd be railing against what's...""
"1"	"The Easiest 2-Ingredient Pancake Recipe (Without Milk or Flour)"	"Whether you're working with an empty pantry or a dairy and gluten allergy, you can still make a stack of delicious pancakes. Here's how."
"1"	"America's Next Major Food Destination Is Not Where You Think"	"While the shiny, lauded food scenes in cities like Portland, Austin, and L.A. continue to inflate, another, quieter culinary movement also thrives, likely unbeknownst to you. That movement lives in Florida. Beyond the scenic beaches, the Miami-bound bachelor parties, and the hordes of families fraternizing with life-size versions of their favorite cartoon characters, new, eclectic kitchens and classic haunts across the state are expanding the..."
"1"	"First Look! SEMA 2019 Move-In Gallery Inside the Las Vegas Convention Center"	"This is your first look at SEMA 2019 inside the Las Vegas Convention Center before the show begins."
"1"	"Intelligence From al-Baghdadi Raid, Including 2 Prisoners, Could Reveal Trove of ISIS Clues"	"WASHINGTON   Delta Force commandos took two Islamic State fighters as prisoners and a trove of intelligence from the now-destroyed compound where Abu Bakr al-Baghdadi, the world's most wanted terrorist, had been hiding, officials said Monday. The prisoners, who are being held in Iraq, are being questioned by the United States military. If the Trump administration follows its previous practice with captured Islamic State fighters, the men will..."
"0"	"40 Nutrition Experts Told Us The Foods You Should Be Eating Every Day"	"Here are the healthy staples top nutritionists swear by that you should stock your pantry and fridge with too."
"0"	"Hearing set for man charged in Alabama woman's disappearance"	"A man charged in the disappearance of a missing Alabama college student is due in court for a hearing that could reveal some evidence about the case."
"1"	"These 7 sports cars crushed their horsepower ratings in our dyno tests"	"Every manufacturer advertises a horsepower figure for their vehicles the metric is among car guys' and gals' favorites to argue over."
"0"	"7 Women Share What It's Really Like To Work On A Cruise Ship"	"If you've ever taken a cruise vacation, you know that it takes thousands of people to make sure you and your fellow travelers are housed, fed, and entertained well while on the trip. But, as travelers, there's a lot that goes into cruise ship hospitality we don't know about. To find out what it's really like to work and live on a cruise ship, we spoke to seven current and former employees. The folks we interviewed worked for Royal Caribbean..."
"0"	"Wall Street eyes Washington next week"	"Investors will be listening to what Fed chair Jerome Powell says on the Hill next week. Wall Street also gets the latest data on inflation, and Disney launches its streaming service. Fred Katayama reports."
"0"	"Family Claims Their Child Was Unfairly Punished, Forced To Watch Students Eat While Fasting For Religious Holiday"	"His parents say what happened to him at school in Bay Ridge, Brooklyn earlier this year is something no nine-year-old should ever go through."
"0"	"How to Make Sure You Have a Seat Next to Your Family on Your Next Flight"	"Because no one wants to get split up."
"0"	"10 more bodies found at mass grave in Rocky Point, bringing total to 58, officials say"	"The Mexican state of Sonora's Attorney General's office announced Saturday that it had discovered 10 additional bodies buried in Rocky Point."
"1"	"Mad About You Star Helen Hunt Taken to Hospital After Car Is T-Boned and Rolls Over in Accident"	"Helen Hunt Rushed to Hospital After Car Gets T-Boned in Accident"
"1"	"50 Shelter Dogs That Need Homes Before 2020"	"These adorable dogs are looking for their forever families. Welcome one of them into your home before the new year for lots of love and licks. The post 50 Shelter Dogs That Need Homes Before 2020 appeared first on Reader's Digest."
"0"	"Why the Amex Platinum card is best for active-duty military"	"Please note: the offers mentioned below are subject to change at any time and may not be available. I have my nine years of active-duty service in the Navy (Beat Army!) to thank for getting me interested in points and miles. Traveling and moving all the time was hurting my family's wallet and I knew there had …"
"1"	"4 frat deaths this month. 2 this week alone. What's going on with fraternity hazing?"	"As a wave of young men nationally die in circumstances that appear to be related to fraternities, experts are unsure what to do next"
"0"	"Reagan statue dedicated at US Embassy in Berlin"	"A statue of former President Ronald Reagan was dedicated at the U.S. Embassy in Berlin over the weekend."
"0"	"After Today, the Vise Tightens on Trump's Ukraine Point Man"	"Republicans' most fruitful line of attack during the first day of congressional impeachment hearings for Donald Trump has put even more pressure on a forthcoming witness who has flailed under it thus far: donor-turned ambassador Gordon Sondland. As two senior State Department officials spent nearly six hours recounting their alarm with an effort by Trump's allies that they said undermined U.S. national interests in favor of promoting the..."
"0"	"My Husband Doesn't Like What I Wear and It's Making Me Feel Terrible"	"My husband considers himself something of fashionista and always criticizes what I wear. What can I do about it."
"1"	"Disney World Decorates The Parks With More Than 40,000 Items Overnight In Only 7 Hours"	"The installation of 40,000 decorations is unreal."
"0"	"This 'Big Daddy Sea Spider' Made NOAA Lose Their Minds"	"At a closer look, the "fuzzy" sea spider spotted off the Florida coast by National Oceanic and Atmospheric Administration scientists is actually carrying precious cargo."
"1"	"Wall Street eyes Washington next week"	"Investors will be listening to what Fed chair Jerome Powell says on the Hill next week. Wall Street also gets the latest data on inflation, and Disney launches its streaming service. Fred Katayama reports."
"0"	"Halle Berry Shares Photo of 6-Pack Abs on Instagram and Her Fans are Freaking Out"	"The 53-year-old star worked hard for those washboard abs while training for her new movie, "Bruised.""
"1"	"Which Type of Butter Is Best for Your Recipe"	"A guide to all of the types of butter you'll find along the dairy aisle and when to use which."
"1"	"See the most expensive watch ever sold at auction"	"A Patek Philippe watch has sold for a record $31M at a charity auction hosted by Christie's in Switzerland."
"1"	"Former Obama White House Pastry Maestro Opens a French-American Bistro on the UES"	"Former White House chef Bill Yosses has opened his own NYC restaurant"
"0"	"Video shows miraculous escape for train passengers"	"Hundreds of Indian passengers had a narrow escape after two trains collided in Andhra Pradesh state."
"0"	"I Never Imagined Being A Grandmother At 35. Here's How It Changed My Life."	""She's a baby with a baby!" my mom joked to the cashier when I was 18. We wereshopping for maternity clothes for me, and looking back now, I guess I was ababy. But at the time I thought I had a plan.I met Larry when I was 16, working my first job at Red Lobster. I was ahostess and he worked in the kitchen. He was 20, kind and living in anapartment with friends. We started dating and then decided to get married onlya year later. My mom wanted us..."
"0"	"Hong Kong Colleges Become Besieged Citadels as Police Close In"	"HONG KONG   Seething with anger, the black-clad students hurled gasoline bombs, threw bricks and even aimed flaming arrows at the riot police, who answered with tear-gas volleys and rubber bullets that hurtled into Hong Kong's university grounds for the first time. And with those battles on Monday and Tuesday at the territory's largest universities, another unspoken rule in the antigovernment protests that have been convulsing Hong Kong for six..."
"0"	"Robert Freeman, Beatles Album Cover Photographer, Dies at 82"	"Paul McCartney said Freeman "was one of our favorite photographers during the Beatles years who came up with some of our most iconic album covers.""
"0"	"Book throws 4 TDs, No. 15 Notre Dame routs Duke 38-7"	"Ian Book rushed for a career-best 139 yards and threw four touchdown passes and No. 15 Notre Dame routed Duke 38-7 on Saturday night."
"0"	"Megyn Kelly Is Back to Work! Details on Her New Job"	"The journalist returned to work less than a year after leaving NBC."
"1"	"18 things flight attendants wish you would stop doing"	"From crowding the galley to walking around barefoot, here are things people do on a plane that are frustrating for these airline pros."
"0"	"McKinsey Faces Criminal Inquiry Over Bankruptcy Case Conduct"	"McKinsey & Company, the elite consulting firm that advises many of the world's largest and most powerful institutions, is facing a federal criminal investigation of its conduct advising bankrupt companies, according to five people familiar with the matter."
"0"	"Powerful side-by-side portraits show people over 100 years old next to their younger selves"	"Opava-based photographer Jan Langer captured sentimental portraits of elderly Czech people for his photo series, "Faces of Century.""
"0"	"We Had a Babysitter Come to Our Hotel Room at Disney World, and It Was SO Worth It"	"I love my children dearly, but having three small kids really limits what we can do on our annual Disney World vacations."
"1"	"Trump records 'strongly corroborate' sex assault claims, accuser says"	"President Trump's own records "strongly corroborate" the sexual assault accusations of Summer Zervos and belie the president's denials, a new court filing states"
"1"	"50 Budget-Friendly RV Campgrounds to Check Out"	"These budget-friendly RV campgrounds in each state may have more availability in the off-season, and go as low as $16 nightly for a spot with electricity. Even sites with amenities such as swimming holes, mini golf, fire pits, showers, movie theaters, and high-speed Wi-Fi can wind up being surprisingly affordable."
"1"	"How much land the government owns in every state and what it's used for"	"The U.S. government owns over 640 million acres of land across 50 states -- equal to more than one-quarter of the country's total landmass."
"0"	"65 Best Fall Soups That Will Warm You and Your Family Up All Season Long"	"These hearty bowls are the perfect companion for a rainy fall night."
"0"	"All of the Thanksgiving Items You Should Buy from Walmart"	"Walmart is making Thanksgiving shopping easy."
"1"	"Smorgasburg Moves Indoors for Fall in Williamsburg"	"Plus, chef Missy Robbins talks about her fight against breast cancer   and more intel"
"0"	"7 Must-see concerts to see in NYC this winter"	"There's nothing that warms you up quite like dancing and singing to your favorite songs. This winter, it's time to get cozy. Musicians from around the world are making their debut or returning to the Big Apple to perform this winter. Here seven must-see winter concerts in New York City. SuperM If K-pop is your thing, you do not want to miss the avengers of K-pop, Super M. Super M is comprised of members from various big-name k-pop groups such as..."
"0"	"Welcome to the World! All of the Celebrity Babies Who've Made Their Debuts in 2019"	"See who's made their debut so far this year"
"0"	"Democrats engineer multiple chances to make the case for Trump's impeachment"	"Televised hearings offer investigators a third bite of the media apple after details about the testimony from witnesses and the release of transcripts."
"1"	"50 famous foods you should eat in your lifetime"	"From dim sum to deep-dish pizza, these are some of the world's most famous foods and where to taste them."
"1"	"Kodak Black Sentenced to Over 3 Years in Prison in Weapons Case"	"Rapper Kodak Black has been sentenced to more than three years in federal prison after pleading guilty to weapons charges stemming from his arrest just before a scheduled concert performance in May."
"1"	"Behind-the-scenes facts about 'Sesame Street'"	"The iconic children's show is turning 50! And while you likely watched it as a child or with your own kids, this is what you didn't get to see. The post I've Worked on Sesame Street Here's What You Don't Know appeared first on Reader's Digest."
"0"	"'It's the biggest gift I've ever gotten:' Iraq War veteran who lost leg and suffered significant trauma will come home to a hero's house in Glastonbury"	"Home ownership is a dream for many and something that was the furthest from the mind of Army Specialist Craig Hall as he lay on top of his tank in the middle of a nightmare after an IED blew up while he was patrolling in Iraq. Hall lost a leg during the April 2007 incident and has suffered from post-traumatic stress disorder, traumatic brain injury, migraines, tinnitus and hearing loss. Now 12 ..."
"0"	"The most famous celebrity kids born this decade"	"See the most well-known children born in the last 10 years, from Blue Ivy Carter and the Cambridge kids to North West and more."
"0"	"Nikki Haley: I was asked by Cabinet members to take sides against the president"	"The former U.N. Ambassador - a Trump loyalist dismissive of the Ukraine scandal being investigated by Congress - also says she doesn't feel comfortable pursuing impeachment in an election year"
"0"	"Did Meghan Markle make a change to her hair?"	"Royal watchers noticed she looked a little different."
