"1"	"The Difference Between Green and Orange Antifreeze"	"What's the difference between different colors of antifreeze? Should different colors of coolant be mixed? Find out here."
"0"	"A Nutella Hotel Is Opening in California"	"The Hotella Nutella, a Nutella-themed hotel, is opening in Napa Valley for three lucky fans of the hazelnut spread."
"0"	"The Volkspod VW Beetle Minibikes Are Part Creepy, Part Adorable"	"The people's pods."
"1"	"23 Ways You're Wasting Money at Costco"	"The warehouse club can save you money, or it can cost you money if you're not careful."
"0"	"7 reasons not to be embarrassed about your debt"	"Don't be ashamed. Take control of your debt instead."
"0"	"Judge includes law student's toddler during sweet swearing-in ceremony"	"When Juliana Lamar was sworn in as an attorney, the judge made sure to include her 1-year-old son."
"0"	"WH plans "aggressive" strategy for open impeachment hearings"	"Staff will be set up to "react in real time" with a "rapid response.""
"0"	"Sarah Hyland documents painful tattoo removal"	"It looks like she's removing a dinosaur tattoo"
"1"	"Kevin Spacey Won't Be Charged in Sexual Assault Case After Accuser Dies"	"The Los Angeles County District Attorney's Office has formally dropped a case against actor Kevin Spacey, after the accuser died."
"0"	"Undeclared Viagra ingredient triggers libido-boosting supplement recall"	"The product is contaminated with sildenafil, an "FDA-approved prescription drug for erectile dysfunction.""
"0"	"'One in a million' deer captured on camera in Michigan woods"	"Retired Michigan lawmaker and amateur photographer Steven Lindberg took pictures of a deer. That deer had three antlers."
"1"	"Food Network star Carl Ruiz died of clogged arteries"	"Food Network's Carl Ruiz's cause of death was "atherosclerotic cardiovascular disease," The Maryland Department of Health confirmed."
"1"	"Taylor Swift Set to Receive Artist of the Decade Award at 2019 American Music Awards"	"Taylor Swift will be receiving the Artist of the Decade Award at the 2019 American Music Awards, where she is nominated for five awards and set to perform."
"1"	"Fort Worth shooting: Officers weren't asked to do welfare check. Here's how it changed things"	"When Atatiana Jefferson's neighbor called police, he says he expected them to go check and see if she was OK."
"0"	"Aging In NYC: Photographer Captures Senior Life In The City"	"Photographer Herb Bardavid focuses on seniors getting out on the town for a long-term project. Here are some stories he's shared with Patch."
"1"	"Walmart releases Black Friday ad with $129 Apple Watch, TV deals, electronics doorbusters"	"Walmart's Black Friday 2019 ad includes a 40-inch TV for $98, Apple iPad for $249, Xbox One, Playstation 4, deals on toys, Instant Pot and more."
"1"	"These two maps show how the trade war with China is hurting 'Trump country'"	"New study finds tariffs are taking their toll in battleground Midwestern states."
"0"	"Jury in trial of Trump adviser Stone ends first day of deliberations without verdict"	"The jury in the criminal trial of U.S. President Donald Trump's adviser Roger Stone ended its first day of deliberations on Thursday without reaching a verdict on whether he lied to Congress about his efforts to learn more about when WikiLeaks would publish damaging emails about 2016 Democratic presidential candidate Hillary Clinton."
"1"	"Maryland man, 46, gets probation after he killed a father and his four daughters when his SUV crossed a median and slammed into their minivan"	"Alvin Hubbard III, 46, of Cambridge, Maryland, was sentenced to one year of probation after he killed a father and his four daughters when his SUV slammed into a family's minivan in 2018"
"1"	"U.S. And Russia at 'Colossal' Danger of Conflict, Mikhail Gorbachev Warns: 'Nuclear Weapons Must Be Destroyed'"	"Gorbachev signed several pivotal anti-nuclear proliferation agreements with the U.S. during his time as the last leader of the Soviet Union."
"0"	"Prince Albert on Twins Jacques and Gabriella: They're Starting to Say, 'Are We There Yet?'"	"Prince Albert on Twins Prince Jacques and Princess Gabriella"
"0"	"How the biggest stars of the decade have changed"	"Find out what's happened to Hollywood's biggest stars over the last 10 years from 2010 to 2019."
"0"	"Should You Think Twice About Washing Your Hands on a Plane?"	"A recent study found that the water used on flights the same water used for hand washing and for coffee and tea might be unhealthy."
"0"	"Heat on lockdown regarding Dion Waiters' health situation"	"The Miami Heat have gone into lockdown when it comes to the status of guard Dion Waiters. In the wake of a report by South Florida Fox Sports Radio host Andy Slater, Heat officials declined to comment on where Waiters stands with the team in the wake of an incident on the team flight from Phoenix to Los Angeles overnight Thursday."
"1"	"Celebrity plastic surgery transformations"	"See how stars like Sharon Osbourne, Cardi B, Pauly D, Kim Zolciak-Biermann, Gisele Bundchen, Kanye West and others have altered their looks."
"0"	"Could Red Sox and Yankees make blockbuster trade?"	"The Sox would exchange Mookie Betts for young, affordable talent."
"0"	"Celine Dion Shares What She Misses Most About Late Husband Rene Angelil"	"'Rene will always be with me, but I'm not in pain.'"
"0"	"Trump, Erdogan to meet as thorny issues stress relations"	"Turkish President Recep Tayyip Erdogan and President Donald Trump will meet as relations between the two NATO allies are at their lowest point in decades, with Turkey rebuffing the U.S. and turning toward Russia on security issues and Ankara facing a Washington backlash over attacks on Kurdish civilians during its incursion into Syria last month."
"1"	"Air Force's X-37B space plane lands after record 780 days in orbit"	"There was no doubt that the US Air Force's X-37B was going to break its own record for time spent in orbit, but it's now clear by how much. The mysterious Boeing-made space plane has landed at Kennedy Space Center after 780 days in orbit, comfortably surpassing the earlier record of 717 days, 20 hours and 42 minutes."
"0"	"American woman apparently strangled in the Dominican Republic"	"Colleagues say Patricia Anton brought joy and laughter to the school she worked in, as police hunt leads in what they say looks like a deadly robbery at her home"
"1"	"Man mistakenly ID'd by Browns in beer-dumping incident sues team"	"Smith is seeking a public retraction and will pursue financial damages as well, according to his attorney, Bruce Taubman."
"1"	"1-ton boulder known as 'Wizard Rock' that disappeared from forest 'magically' returns"	"Wizard Rock, a famed 1-ton boulder in one of Arizona's national forests, has "magically" returned after visitors reported it missing last month."
"0"	"Deer stranded 5 miles offshore saved by Maine lobstermen"	"A group of Maine lobstermen spotted a deer in an unusual place Monday: open waters. The men quickly took action to save the animal, which had somehow ventured 5 miles away from shore, and hauled their catch of the day to safety."
"1"	"Home-Improvement Boom Is Forecast to Fizzle"	"Home-improvement retailers have proved to be a bright spot during an otherwise underwhelming stretch for retail stocks, but a popular predictor of remodeling spending suggests tougher times ahead."
"0"	"Astros' Verlander, Mets' deGrom win 2nd Cy Young Awards"	"Astros' Verlander, Mets' deGrom win 2nd Cy Young Awards"
"1"	"Lori Loughlin's 'Stress Is Only Mounting' Ahead of Pretrial Hearing"	"Lori Loughlin's 'Stress Is Only Mounting' Ahead of Pretrial Hearing"
"0"	"Biggest celeb weddings of the last decade"	"Take a look back at the most memorable and extravagant celeb weddings that went down in the 2010s."
"0"	"The Queen's Dressmaker Reveals She Uses Gin to Clean the Royal Jewels"	"The Queen's Jewels Are Polished with Gin and Water"
"0"	"The 50 cheapest places to buy land in America"	"Find out where you can get parcels of land for $10,000 or less."
"0"	"Celebrity Christmas albums: From beloved classics to big surprises"	"All we want for Christmas is to listen to this holiday music from the stars."
"1"	"This Is the Scariest Haunted House in Your State"	"BRB, gonna scream for days."
"1"	"American Airlines cabin crew fear return of Boeing 737 Max"	"Lori Bassani, who leads the Association of Professional Flight Attendants, wrote to Boeing CEO Dennis Muilenburg about the ongoing 737 Max crisis."
"1"	"U.S. bans all flights to Cuba outside Havana in latest crackdown"	"American Airlines and JetBlue, which fly routes to Cuba other than Havana, will have to submit to new regulations from the Transportation Department."
"1"	"Shut Down: 100s of Muscle Cars, EVs, and More Seized and Headed to Auction"	"From Teslas to trucks, Mustangs to Maseratis, RVs to Road Runners."
"0"	"Here's Why New York Ranks as One of America's Best Food Cities"	"An abundance of popular restaurants is one marker of a foodie-centric city. But so much more goes into figuring out what towns do food really, really well. Here is an in-depth take on what makes these 30 specific metropolises click   culinarily-speaking   and why they offer some of the best food and drink around."
"0"	"Can you answer these real Jeopardy questions about TV shows?"	"Culling data straight from the "Jeopardy!" archives, Stacker will provide a "clue" about TV shows and then present the answer in the form of a question on the following slide. Can you answer these real "Jeopardy!" questions about TV shows?"
"0"	"'Baby Trump' balloon slashed at Alabama appearance"	"TUSCALOOSA, Ala. (AP)   A towering "Baby Trump" protest balloon was knifed and deflated by someone unhappy with its appearance during President Donald Trump's Saturday trip to Alabama, organizers said."
"1"	"Richest 1% of Americans Close to Surpassing Wealth of Middle Class"	"The U.S.'s historic economic expansion has so enriched one-percenters they now hold almost as much wealth as the middle- and upper-middle classes combined."
"1"	"College hands out coasters that test for date rape drugs"	"Coasters that test for date rape drugs being handed out at the University of New Mexico."
"1"	"Past three months in Afghanistan have been the deadliest for civilians in a decade"	"The United Nations says more civilians have died between July and September this year than during any other three-month period in the last 10 years."
"0"	"Brodie Van Wagenen addresses Carlos Beltran being a possible target of MLB sign-stealing probe"	"SCOTTSDALE   The morning after a report from The Athletic indicated new Mets manager Carlos Beltran "played a key role in devising" the Astros' sign-stealing setup in 2017, general manager Brodie Van Wagenen said he has not heard from Major League Baseball or spoken to his skipper about the allegation. "I don't have nearly enough information and I would defer to MLB on any of those questions," Van Wagenen said Thursday morning before he..."
"0"	"WWE Wrestler Jordan Myles Quits in Expletive-Filled Rant as He Brands the Company Racist"	"WWE Wrestler Jordan Myles Quits, Calls Company Racist"
"1"	"Scarlett Johansson Regrets Being "Hyper-Sexualized" Early in Her Career"	"Johansson joined Jennifer Lopez, Renée Zellweger, Lupita Nyong'o, Laura Dern and Awkwafina for the Oscar Actress Roundtable."
"1"	"Eddie Van Halen thinks he developed cancer from sucking on metal guitar picks; a doctor disagrees"	"The guitarist lost a third of his tongue due to mouth cancer in 2000, and is reportedly receiving treatment for cancerous cells in his throat."
"0"	"All of the Thanksgiving Items You Should Buy from Trader Joe's"	"It's the holiday season, and Trader Joe's is ready for it."
"0"	"Mexico asks FBI to help probe killing of Americans"	"Mexico asks FBI to help probe killing of Americans"
"1"	"What Is the Strange Creature Haunting This Small Town?"	"The fearsome Hodag is a legendary creature that haunts the town of Rhinelander, Wisconsin. It has been said to possess "the head of a frog, the face of an elephant, and the body of a spiky lizard-like creature." Writer B.J. Hollars told InsideEdition.com that the creature is a 19th century hoax designed to attract tourists. It's become a kind of mascot for the town, Hollars said, and its "legend just continues to grow.""
"1"	"10 Amazing Things at Walmart You Can't Buy Anywhere Else"	"We rounded up the coolest, most unique, and most affordable items you can find only at Walmart. Get ready…get set…shop! The post 10 Amazing Things at Walmart You Can't Buy Anywhere Else appeared first on Reader's Digest."
"0"	"Top storylines for Week 11 in the NFL"	"We're heading toward crunch time of the NFL season and Week 11 has some huge games on the schedule."
"1"	"How Can a $1000 Motorcycle Jacket Prove Its Worth?"	"The Aether Divide motorcycle jacket is what you get when Armani meets asphalt."
"0"	"2019 CMA Awards: See all the photos from the red carpet"	"2019 CMA Awards: See all the photos from the red carpet"
"1"	"Two women joined GM more than a decade ago. Their futures couldn't be more different"	"Tentative labor deal aside, the transition to electric and autonomous vehicles is leaving a generation of workers behind."
"1"	"France says foiled September 11-inspired attack"	"France's interior minister said on Thursday that intelligence services had arrested a man for planning an attack inspired by plane attacks on the World Trade Center in New York in Sept. 2001."
"1"	"Plans pushed back to explode 2 cranes in New Orleans"	"NEW ORLEANS (AP)   Plans have been pushed back a day to bring down two giant, unstable construction cranes in a series of controlled explosions before they can topple onto historic New Orleans buildings, the city's fire chief said Friday, noting the risky work involved in placing explosive on the towers. With the possibility of winds picking up due to a tropical storm in the Gulf of Mexico, officials had hoped to bring the cranes down Friday...."
"1"	"The News In Cartoons"	"News as seen through the eyes of the nation's editorial cartoonists."
"0"	"Prince Charles just turned 71   here are the best photos from every year of his royal career so far"	"Prince Charles, heir to the throne, celebrates his 71st birthday on Thursday. Here are all the best photos from every year of his career."
"1"	"Top Defense Republican: Trump's Vivid Statement On Baghdadi 'A Little Uncomfortable'"	"Rep. Mac Thornberry (R-Texas) expressed unease with President Donald Trump's graphic description of a U.S. military raid that resulted in the death of so-called Islamic State leader Abu Bakr al-Baghdadi, who Trump said was "whimpering and crying and screaming" before detonating a suicide vest that killed himself and three of his children Saturday. Thornberry, the ranking member of the House Armed Services Committee, suggested on Sunday that he..."
"0"	"More Americans say now is a bad time to buy a home"	"There was also a drop in the share of people who think now is a good time to sell a home, from 44% to 41%, according to a monthly survey by Fannie Mae."
"1"	"Aluminum is replacing plastic as the greenest bottle"	"The drive to turn products more eco-friendly is sweeping through the U.S. beverage market, with plastic being replaced in everything from red Solo cups to Coca-Cola Co. and PepsiCo Inc. water bottles."
"0"	"Republicans Argue Impeachment Case Falls Short of Proving Trump Misconduct"	"House Republicans on Saturday offered the latest glimpse of their strategy to fight against impeachment by demanding testimony from figures at the center of President Trump's favorite unsubstantiated theories: the son of former Vice President Joseph R. Biden Jr., a researcher loosely connected to an anti-Trump dossier, a Democratic official and a board member of a Ukrainian energy company. Rather than shy away from conspiracies that..."
"1"	"These Whiskey Glasses Will Totally Change the Way You Drink"	"If you love nothing more than a glass of whiskey neat at the end a long day, you'll definitely want a Norlan Whiskey Glass in your collection."
"0"	"These Two New Oreo Flavors Are Coming in 2020 and We're OBSESSED"	"These new Oreo flavors are just what we were craving and we didn't even know it!"
"1"	"Rep. Katie Hill's lawyers send cease-and-desist letter to DailyMail.com over nude photos"	"The website is the second to publish alleged lewd photos of the Democratic congresswoman."
"0"	"ICE is ignoring California's ban on private immigrant detention centers"	"LOS ANGELES - Last month, California became the first state to kick out privately run immigrant detention centers. A new law that also bans private prisons prohibits new contracts or changes to existing ones after Jan. 1 and phases out existing detention facilities entirely by 2028. But on Oct. 16, five days after Gov. Gavin Newsom signed Assembly Bill 32 into law, U.S. Immigration and Customs ..."
"0"	"Kristen Stewart is planning to propose to her girlfriend, plus more celeb love life news for early November 2019"	"Keanu Reeves and girlfriend go public, Kylie Jenner's relationship with Drake turns romantic, Reba McEntire, Nina Dobrev and Ian Ziering end relationships."
"0"	"The stock market's 10-year run became the best bull market ever this month"	"The current bull market, which started March 9, 2009, has enjoyed a whopping 468% gain for the S&P 500 through the first day of November."
"0"	"Prince Harry and Meghan Markle just shared a never-before-seen photo of baby Archie with his 'Grandpa' Prince Charles to celebrate his birthday"	"The Duke and Duchess of Sussex shared a new photo of Archie, Harry, and Charles to mark the Prince of Wales' 71st birthday on Thursday."
"0"	"31 Dumb Things That Are Keeping You From Becoming Wealthy"	"These small financial mistakes chip away at your wealth."
"0"	"Ferrari's New Key Is Literally Just a Big Ferrari Badge"	"The valet will have no trouble finding a key like this."
"0"	"Sign-stealing penalties could be "unlike anything seen in the sport's recent history""	"A new report suggests MLB could bring the hammer down"
"1"	"Stocks close higher on optimism over China trade deal"	"Stocks ended at record highs Thursday after the world's two largest economies reportedly agreed to remove existing trade tariffs, sparking a huge rotation into equities and out of bonds."
"0"	"Best royal photos of 2019"	"Relive See the best pictures of Britain's royal family as well as other notable international monarchies this year."
"0"	"Stars who've had more than one wedding with the same spouse"	"See which celebs exchanged vows with their significant others more than once."
"1"	"Nationwide recall of Xanax due to possible 'foreign substance'"	"Drugmaker Mylan cites risk of infection posed by unnamed material in popular anti-anxiety prescription drug."
"0"	"Why aren't wages rising faster even with low unemployment? Trade war, weaker economy are among reasons"	"Why aren't average wages rising faster in light of low unemployment?"
"0"	"Groom Makes The Most Heartfelt Vows To His 9-Year-Old Stepdaughter"	"Jimmy Gisondi made not one, but two sets of vows on his wedding day: first to his new wife, Kelsea, then to his new stepdaughter, Olivia."
"0"	"100 Incredible Christmas Tree Decorating Ideas"	"It's the most wonderful time of the year! Get ready to decorate your Christmas tree. Check out these 100 ideas for Christmas tree decorations and get in the holiday spirit."
"1"	"Mid-Engine C8 Corvette Production Postponed Until February 2020"	"The car was supposed to be hitting dealers by the end of 2019. That's no longer happening."
"1"	"60 Clever Uses for Salt That Don't Involve Cooking"	"From relieving rashes to removing stains to restoring household items to their original luster, salt does more than just season food. The post 60 Clever Uses for Salt That Don't Involve Cooking appeared first on Reader's Digest."
"0"	"Oregon school bus driver accused of DUI after crashing bus with 10 students"	"There were no injuries to anyone on the bus. The district said it will take appropriate action once it has all the details."
"0"	"Suspect arrested in murder of 6-year-old girl who was shot while asleep in her home"	"A suspect has been arrested for the murder of a 6-year-old girl who was asleep in her Cleveland home when she was fatally shot in the head, authorities said Wednesday."
"0"	"Family told to take down Christmas display because it's too soon to decorate"	"A Texas couple was told by their homeowners association to pump the brakes on their Christmas cheer."
"0"	"Wisconsin bus driver saves children wandering in snow, as deadly Arctic air mass grips US"	"As bitter cold took hold across the Midwest earlier this week, a sharp-eyed bus driver in Wisconsin was credited with helping rescue two children who were very underdressed for the weather conditions."
"1"	"At Portale, One of NYC's Most Seasoned Chefs Aims to Put a Fresh Spin on Italian"	"Alfred Portale, the longtime former chef of Gotham, opens his highly anticipated first solo restaurant in Chelsea this week"
"0"	"'We Thought It Was An Earthquake': Car Slams Into Restaurant In Brooklyn"	"The accident happened around 10 a.m. at 676 Manhattan Avenue Saturday morning."
"0"	"Should I tip 20% in a restaurant even if the service is mediocre?"	"'Our 30-something waiter forgot our drink orders, never returned for refills and only checked back once before dropping off the check in front of our guest.'"
"0"	"Georgia executes man convicted of killing convenience store clerk"	"Georgia executes man convicted of killing convenience store clerk"
"0"	"American families fleeing Mexico arrive in Arizona days after cartel massacre"	"A caravan of Mormon families fleeing Mexico following this week's drug cartel ambush that killed nine Americans crossed into Arizona on Saturday."
"0"	"Walmart manager ready as store where El Paso mass shooting occurred reopens"	"Robert Evans was on hand at the Cielo Vista Walmart store Thursday morning to raise the U.S. flag that's been at half-staff since the Aug. 3 mass shooting, when 22 people were killed and dozens injured."
"0"	"Daring rescue attempt when dog winds up on roof"	"It took a lot of trust and time to get this scared pup off a two-story roof, but eventually he came down all thanks to one kind human."
"1"	"10 of the best fast-food taco chains across the US"	"Fast-food chains like Del Taco and Taco John's serve quick and reliable tacos for an affordable price."
"1"	"Your Car Is Most Likely to Be Stolen in These Cities"	"There were an estimated 748,841 vehicle thefts in the United States in 2018, or about 229 per 100,000 Americans."
"1"	"His first job was training service dogs in prison. The dogs go on to transform veterans' lives."	"As soon as one dog recognized the maximum-security prison where he was trained, he started wagging his tail."
"0"	"Ree Drummond Says a Low-Carb Diet Is the Secret to Her Incredible Weight Loss"	"The Pioneer Woman's new cookbook is out now!"
"0"	"Boomers Want to Stay Home. Senior Housing Now Faces a Budding Glut."	"The rise of technologies that help the elderly stay in their homes threatens to upend one of commercial real estate's biggest bets: Aging baby boomers will leave their residences in droves for senior housing."
"1"	"The Stunning Escape of El Chapo's Son: It's Like 'a Bad Netflix Show'"	"MEXICO CITY   Escape, it seems, is a trait shared in the Guzmán family. So is embarrassing the government of Mexico. Joaquín Guzmán Loera, the drug lord known as El Chapo, eluded the grasp of the government numerous times   in tunnels, behind closets, beneath bathtubs and through steep ravines in the remote mountains of Sinaloa. He even managed to escape prison, twice. The latest family member to escape apprehension   El Chapo's son, Ovidio..."
"0"	"Chin Hair: 7 Embarrassing Red Flags No Woman Should Ever Ignore"	"Here's how to know if your annoying chin hair is a sign of a more serious issue."
"0"	"Are Stores Open on Veterans Day? Target, Aldi, Walmart and More"	"Will shoppers be able to make the most of Veterans Day deals this public holiday?"
"1"	"Nor'easter to grind at US East Coast this weekend"	"High winds, heavy surf and drenching rain will pound part of the southern Atlantic coast this weekend, but some impact from the storm will expand to the coastal Northeast later this weekend to early next week."
"0"	"Trump urges Iran to release ex-FBI agent Levinson"	"President Trump took to Twitter late Sunday to urge Iran to release the retired FBI agent who had been missing in the country since 2007 and said it would be a very positive step toward easing tensions between the two countries since provocations on the Strait of Hormuz."
"0"	"Freed ex-president tells crowd Brazil's left can win in 2022"	"SAO BERNARDO DO CAMPO, Brazil (AP)   Freed from his cell, former President Luiz Inácio Lula da Silva told thousands of jubilant supporters Saturday that the left can take back Brazil's presidency in the 2022 election. Dressed in a black blazer and T-shirt, da Silva spoke from a stage outside the union near Sao Paulo that he once led and that served as the base for his political career."
"1"	"Customers Are Trolling Papa John's Over Their Jack-O'-Lantern Pizzas"	"This is truly scary."
"0"	"Millennials, Gen Xers to baby boomers: Can you retire so I can get a job promotion?"	"Baby boomers are putting off retirement and that may be making it harder for millennials and Gen Xers to get promoted: USA TODAY/LinkedIn survey."
"1"	"Gov. Andrew Cuomo Directs State Agencies To Investigate 'Horrifying' Conditions At Bronx Apartment Building"	"The building in question allegedly has bedbug infestations, and there are allegations of drug-related crime taking place there."
"0"	"Dog Doesn't Understand Why His Favorite Ball Won't Move"	"Meet Manson   a 10-year-old Boston terrier from Saskatoon, Canada, with a taste for tennis balls."
