"0"	"Australian fires burn through koala colonies, killing hundreds: 'It's a national tragedy'"	"Bushfires raging in eastern Australia have killed at least four people and killed so many koalas they may land on the endangered species list."
"1"	"Motorcycle Tires: How Old Is Too Old?"	"Sometimes tires are just too old to be useful."
"0"	"At Portale, One of NYC's Most Seasoned Chefs Aims to Put a Fresh Spin on Italian"	"Alfred Portale, the longtime former chef of Gotham, opens his highly anticipated first solo restaurant in Chelsea this week"
"0"	"Turkey Gathered Information in the U.S. Against Its Critics"	"Turkey's government used a Washington law firm to gather information about its critics, including residents of the U.S., who it believed were allied with a movement that President Recep Tayyip Erdogan regards as a central enemy."
"0"	"Land the best holiday gifts for AvGeeks"	"If you have an AvGeek on your holiday shopping list, finding that perfect gift is tricky. But not to worry   you won't have to wing it! TPG has compiled a list of items crafted for aviation lovers   these unique AvGifts are wearable, watchable and collectible and are sure to lift your AvGeek's holiday …"
"1"	"EarthRoamer XV-HD Super Camper Can Be Yours for $1.7 Million"	"The ultimate RV for the end of days."
"1"	"G.M. Workers Approve Contract and End U.A.W. Strike"	"The longest nationwide strike against General Motors in half a century ended on Friday after a solid majority of the company's union members delivered their support for the four-year contract hammered out by their leaders. The United Auto Workers union emerged with substantial wage increases and succeeded in ending a two-tier wage structure that had been a particular irritant in its ranks. It also won commitments to new G.M. investments in..."
"0"	"Chrissy Teigen's EPIC Reaction to Husband John Legend Being Named 2019 Sexiest Man Alive"	"Chrissy Teigen had the best response to John Legend becoming People Magazine's 2019 Sexiest Man Alive."
"0"	"50 Weird but Wonderful Facts That Will Leave You Totally Amazed"	"There's no doubt that the world is a weird place. Here are 50 weird facts about historical events, celebrities, and animals."
"0"	"The key impeachment question: What did Trump want from Ukraine   and what exactly did he do?"	"Testimony in the House impeachment inquiry shows aides struggling to please the president as they fret about his fits of rage and do their best to anticipate his ever-shifting impulses."
"1"	"Elton John calls Michael Jackson 'mentally ill,' Tina Turner a 'nightmare' in new book"	"In his candid new autobiography "Me," Elton John opens up about his friendships with Freddie Mercury and John Lennon, and past tiff with Tina Turner."
"0"	"See mayor sprint away from journalists"	"A Chilean mayor found an original way of avoiding journalists' questions - by literally running away from reporters."
"1"	"How to Cut a Cake Like a Pro"	"Here's how to cut a round cake properly, with even slices and no messy crumbs. The post How to Cut a Cake Like a Pro appeared first on Taste of Home."
"0"	"How Republican Defenses of Trump on Impeachment Have Shifted Over Time"	"Democrats paint the changing defense as evidence of its weakness. Republicans attribute it to another source: disorganization"
"0"	"Australia bushfires: Smoke from blazes can be seen in New Zealand"	"Thousands of people are in the path of deadly Australian bushfires that have produced clouds of smoke seen as far away as New Zealand."
"1"	"The 16 Best Italian Foods You Can Get at Trader Joe's"	"Trader Joe's has some of the best hidden gems among its stocked aisles, including amazing Italian foods that rival products from artisanal markets."
"1"	"25 bathrooms? Former Clinton labor secretary says Bezos' mansion helps make case for soaking the rich"	"Robert Reich served as labor secretary in the Clinton administration, where he was named by Time Magazine as one of the 10 most effective cabinet secretaries of the 20th century. He's a Rhodes scholar, a best-selling author, a documentarian and a professor of public policy at UC Berkeley. What he's not, apparently, is a fan of billionaires clinging to their riches."
"0"	"Deadly Arctic blast breaks records set more than 100 years ago"	"It was literally freezing in Florida and Alabama and parts of Maine, Michigan and New York were digging out a foot of snow. Blame an Arctic air mass."
"0"	"Demi Lovato debuts new boyfriend, plus more celeb love life news for mid-November 2019"	"Anna Faris seemingly confirms engagement rumors, JWoww and boyfriend aren't back together after all, Porsha Williams admits fiancé cheated and more."
"0"	"WEATHER: Break from bitter cold ends weekend, but frigid temps and maybe some wet snow return by Tuesday"	"NEW YORK (1010 WINS) - After a frigid, unseasonable couple of days in the tri-state, warmer temperatures are expected to finish off the weekend--but colder weather, and potentially some wet snow, is in the forecast for the workweek. Central Park hit 27 degrees Friday night, almost breaking the record of 24 degrees set back in 1976, AccuWeather says. We tied a few record lows this morning in the area! Islip, NY tied the record low of 23 (set in..."
"1"	"The News In Cartoons"	"News as seen through the eyes of the nation's editorial cartoonists."
"1"	"Halloween hangover! Here are 5 fun things to do with your kids' leftover candy"	"Wondering what to do with all that leftover Halloween candy? We have some ideas from donating it to hosting a beer-and-candy pairing party for adults."
"1"	"Quiet Riot Drummer Reveals Stage-Four Cancer Diagnosis"	"Quiet Riot drummer Frankie Banali has revealed that he has been battling stage-four pancreatic cancer since this past April. Since the 2007 death of singer Kevin DuBrow, Banali has been the only member of the band's classic lineup to continue to play with the band. He's also been the group's most consistent band member since 1982. "The original prognosis was very scary," he said in a statement posted to podcast host Mitch Lafon's Facebook page...."
"0"	"3 pieces of dated retirement advice you should ignore"	"Cookie-cutter rules aren't going to cut it for your retirement plan."
"1"	"Grieving Son Honors Late Christmas-Loving Dad with 20,000 Lights on Family Home"	"A touching tribute involved thousands of holiday lights in a display you have to see to believe. Buzz60's Sean Dowling has more."
"0"	"I'm a bartender, and here are 11 signs your drink was made improperly"	"You can often tell your order was made improperly from the color, taste, or presentation of a cocktail or beer. Here are the most obvious signs."
"1"	"From cat names to fruit, here are 11 bizarre things celebrities have tried to trademark"	"From Taylor Swift to Kylie Jenner, a lot of stars have tried to trademark things like commonly used terms, song lyrics, and signature catchphrases."
"1"	"These 4 words are the key to becoming rich"	"It's surprisingly simple advice, but it will have you on your way to an increased net worth."
"1"	"Here's How Often You Should Rotate Your Tires"	"Rotating your car's tires may not seem like a huge deal compared other common car maintenance tasks, but it's actually important for your overall safety."
"0"	"John Travolta Shares Rare Photo of Son Ben, 8, in Plane Cockpit: He's 'Taking My Place!'"	"John Travolta Shares Rare Photo of Son in Plane Cockpit"
"0"	"Manafort's 2016 Gambit: A Back Channel From Trump Camp to Labor"	"In the summer of 2016, Paul Manafort, Donald Trump's campaign chairman, proclaimed Midwestern states like Michigan and Wisconsin to be critical to the campaign's strategy. Behind the scenes, he was actively trying to execute that strategy   sometimes in highly unorthodox ways. According to three people close to the 2016 Trump campaign, Mr. Manafort sought to open a back channel to the A.F.L.-C.I.O., the nation's pre-eminent labor federation,..."
"0"	"New DNA methods could solve a 1980 cold case. But NY won't let investigators use it."	""It's not going to bring her back," Irene Wilkowitz said of using genetic genealogy to search for her sister's killer. "But it will help other people.""
"1"	"Stars who've debuted shocking hair colors or styles"	"See some of Hollywood's wildest and weirdest hair transformations."
"0"	"The Full-Size 2022 Jeep Grand Wagoneer SUV Is Finally On Its Way"	"The new, luxurious Wagoneers will be built in Detroit starting late in 2021"
"1"	"What it's really like to retire in an RV"	"Do your retirement plans include driving cross-country in your RV? If so, have you considered going all-in on RV living, leaving behind a standard address and all its annoying commitments? Here are some factors to take into consideration before you do, based on feedback from RVers already living on the road year-round."
"0"	"Take a sneak peek at construction of the Rams' stunning new stadium"	"SoFi Stadium, a 298-acre sports-and-entertainment complex, is scheduled to open in July 2020 and will be home to the Los Angeles Rams and Chargers."
"0"	"Rape victim rejects judge's offer: $150,000 for her, reduced sentence for attacker"	"A Louisiana judge asked a rape survivor if she would consider a $150,000 restitution payment from her attacker. She refused, saying the attack has left her "broken.""
"1"	"Ex-evangelical pastor says supporting Trump has been 'damaging' to church"	"Former megachurch pastor and evangelical author Joshua Harris said in a recent interview that he believes some of the massive support President Trump has enjoyed from the evangelical community has been "incredibly damaging to the Gospel and to the church."Harris, an influential evangelical teacher and writer during the late 1990s and up until he announced he'd abandoned his faith earlier this year, added that having "a leader like Trump I...""
"1"	"Malik McDowell sentenced to 11 months in jail"	"Free agent defensive lineman Malik McDowell was sentenced to 11 months in jail and three years of probation Wednesday after pleading guilty to a series of crimes earlier this year in Michigan, Brady Henderson of ESPN reports. McDowell never played a down in the NFL. After the Seahawks drafted him 35th overall in 2017, McDowell [more]"
"0"	"The best burger and fries joint in your state"	"There can't be any meal quite as satisfying as a juicy burger and crispy, fresh fries. But where can you find the best? We've chosen the top burger and fries joints in every single state to help make sure your next order is absolutely delicious."
"1"	"Ford Lifts, Enlarges, and Carpets Its Super Duty SEMA Concepts"	"If you can make pickup trucks as tall as a two-story home, why not?"
"1"	"How Often Should You Change Synthetic Oil?"	"There's more than one answer, so let us simplify it for you, starting with outlining the advantages of synthetic oil."
"0"	"Greg Hardy loses UFC fight in Moscow"	"Former Panthers and Cowboys defensive end Greg Hardy had another UFC fight today in Moscow, and it did not go well. Hardy was matched up with one of the UFC's top heavyweights, the Russian Alexander Volkov, and Volkov picked him apart for an easy victory. It was a unanimous decision, with all three judges awarding [more]"
"0"	"Starbucks unveils its 2019 holiday cups"	"The cups will be available starting Thursday, November 7, and the company is encouraging fans to get the reusable one"
"0"	"Eileen Filler-Corn: Virginia Democrats elect first female speaker of the House"	"For the first time in Virginia's 400-year legislative history, a woman will become speaker of the House."
"1"	"Stars who quit being vegan"	"Find out which celebs didn't stick with an animal-product-free diet."
"1"	"The Little-Known Airplane Feature That Could Save Your Life"	"Remembering this tiny device could be a big deal!"
"1"	"Failed operation underlines Mexico chaos"	"A daring operation to capture one of Mexico's most powerful drug lords failed disastrously when armed cartel members launched a deadly counterattack, laying siege to the northern city of Culiacan and taking several security officers hostage."
"0"	"No. 13 Minnesota tops No. 5 PSU 31-26 in match of unbeatens"	"Minnesota held on for a 31-26 victory on Saturday afternoon over Penn State for its first win over a top-five team in 20 years."
"1"	"Hotel collapse survivor speaks out as new questions arise about potential structural flaws"	""Somebody needs to be held accountable for it," said steelworker Derrick Pate, whose femur was broken in the New Orleans accident."
"0"	"Meghan Markle Smudged Makeup on a Fan's Coat & He Reacted Perfectly"	"We've all been there."
"0"	"Trump says he's not watching impeachment hearing   then critiques it"	"President Donald Trump on Wednesday dismissed the House's impeachment proceedings as a "hoax" and said he was "too busy to watch"   and then blasted Democrats' choice of questioners at a hearing he said he hadn't been briefed on."
"0"	"'At 237 Lbs., I Was Embarrassed To Go To The Gym. So I Did An At-Home BeachBody Program And Lost 117 Lbs.'"	""I wanted to be me again.""
"0"	"Families in NYCHA deal with heat, hot water problems during frigid weather"	"EAST HARLEM, Manhattan   New Yorkers dealt with record cold Tuesday and Wednesday and some of them did it with inconsistent heat in their homes. A resident at the Lexington Houses in East Harlem said families were freezing. There'd been no heat or hot water for 11 days, according to a tweet from the resident. He'd filed several complaints with the city, but said no one from the New York City ..."
"0"	"Highlights of the 2019 SEMA Show in Las Vegas"	"SEMA is the United Nations conference of all things aftermarket, and here's some of the best stuff we spotted."
"0"	"Trump: Transcript of 2nd call will "probably" be released Tuesday"	"Concerns about President Trump's July 25 call with the president of Ukraine sparked the ongoing impeachment inquiry."
"1"	"Police: Collision Sends SUV Off Overpass In Rockland County, 2 Teens Killed"	"Police said two cars collided on the Route 304 overpass. One of those cars plunged off the overpass about 50 feet to the train tracks below."
"1"	"Jeff Bezos: This is the 'smartest thing we ever did' at Amazon"	"Jeff Bezos has a nontraditional management style at Amazon. And according to Bezos, Amazon's twist on meeting structure is the "smartest thing we ever did.""
"1"	"Chuck Woolery: Supporting Trump 'pretty much destroyed my career'"	"Supporting President Trump and taking a conservative stance in public ruined Chuck Woolery's career and got him shadow-banned from Twitter, said the former game show host on "Fox & Friends," Wednesday."
"0"	"The 'Grecian goddess' snack a dietitian eats to fight acne"	"Oh, how very Mediterranean."
"1"	"Dodge Challenger Hellcat Redeye Test Drive Video: The Biggest and Baddest"	"Jethro gets behind the wheel of the ultimate factory muscle car"
"0"	"38 men who were worthy competitors for John Legend's Sexiest Man Alive title"	"John Legend was revealed as People's Sexiest Man Alive this year, but here are 38 other undeniably sexy men we think deserved the title."
"0"	"98 Cool Gifts Rising in Sales on the Internet - They're Less Than $25, After All"	"Brilliant gifts don't have to be expensive ones - we'll prove it to you."
"1"	"High-voltage PG&E power line broke near origin of massive fire in California wine country"	"After sparking late Wednesday night, the Kincade Fire has spread rapidly, covering more than 20,000 acres by Friday morning."
"0"	"Justin Bieber Says Popeyes Chicken Sandwich Is 'Not Worth the Hype'"	"Justin Bieber Says Popeyes Chicken Sandwich Is 'Not Worth the Hype'"
"1"	"Panera Bread worker fired after TikTok exposed frozen mac and cheese"	"On Friday, the poster said on Twitter that she was fired for the video, showing her place a frozen bag of macaroni and cheese into a vat of hot water."
"1"	"Soup Dumpling All-Star Nan Xiang Xiao Long Bao Is Back"	"Reopening at One Fulton Square with a swanky new space and expanded menu"
"0"	"Trump impeachment hearings: 5 key takeaways from the first day"	"The first day of public impeachment hearings resulted in new evidence supporting the Democrats' case that President Trump was leveraging U.S. aid to Ukraine to get President Volodymyr Zelensky to investigate former Vice President Joe Biden. State Department officials Bill Taylor and George Kent, career diplomats who have served under multiple presidents, were the witnesses Wednesday before the House Intelligence Committee. Taylor was not part of..."
"0"	"She called 911 after her baby fell. Weeks later, CPS took her children."	"After 5-month-old Mason Bright fell and fractured his skull, he and his 2-year-old sister were taken from their parents and placed in foster care."
"0"	"This Man Proposed By Tattooing a 'Check Yes or No' Box Over His Heart"	"This man in Gloucester decided to tattoo on his proposal. If he wanted to get likes and shares, this was a good way to do it! Buzz60's Keri Lumm reports."
"0"	"13 Ways You're Shortening the Life of Your Car"	"Put the brakes on these all-too-common mistakes to help keep your car on the road and out of the shop."
"0"	"Precious baby sees her mom clearly for the first time"	"Get the tissues out - this is absolutely priceless!"
"1"	"Ivanka Trump and Jared Kushner to host -- and pay for -- 10th anniversary party at Camp David"	"Ivanka Trump and Jared Kushner are having a "big party with friends" at Camp David to celebrate their 10th anniversary this weekend, a White House official confirmed to CNN on Friday."
"0"	"'We're fighting for our lives'   US apple farmers endure major crop and profit losses as climate changes"	"Climate change is posing an existential threat to the precarious lives of farmers across the country. "We've seen such dramatic, frightening crop losses," says Elizabeth Ryan, a longtime farmer in Hudson Valley, New York."
"1"	"Where to Find a Good, Cheap Sandwich in Every State"	"Have a craving for a great sandwich? These 50 restaurants have you covered whether your favorites include classic subs, Mexican tortas, Vietnamese banh mi, or old-fashioned barbecue. Take a look at what's available in your state and check out the unique combinations diners are enjoying all across the country."
"0"	"Still teaching at 95, Jimmy Carter draws devotees to church"	"PLAINS, Ga. (AP)   The pilgrims arrive early and from all over, gathering hours before daybreak in an old pecan grove that surrounds a country church. They come, they say, for a dose of simple decency and devotion wrapped up in a Bible lesson. The teacher is the 39th president of the United States, Jimmy Carter. Nearly four decades after he left office and despite a body that's failing after 95 years, the nation's oldest-ever ex-president still..."
"0"	"'Midway' Surprises 'Doctor Sleep' to Win Box Office Battle With $17 Million Debut"	"Early November has yielded major box office hits like "Thor: Ragnarok" and "Bohemian Rhapsody" in recent years, but no such juggernaut was in sight this weekend as Lionsgate's "Midway" only needed a $17.5 million opening from 3,242 screens to take the No. 1 spot. The chart-topping victory for Lionsgate and Roland Emmerich was a surprise for many analysts as Warner Bros.' "Doctor Sleep" was expected to open to a $25-30 million opening. Instead,..."
"0"	"Watch Kelly Clarkson's Kids Interview Their Hero Jason Momoa In The Cutest Video Ever"	"Kelly Clarkson's kids were in for a huge treat on Wednesday's The Kelly Clarkson Show when they got to meet their icon, Jason Momoa. Watch their adorable interview with Aquaman himself below."
"0"	"The News In Cartoons"	"News as seen through the eyes of the nation's editorial cartoonists."
"0"	"6 Very Good Recipes That Prove an Air Fryer Belongs in Your Kitchen"	"I'm a gadget geek, so it's no surprise that I was fascinated by the air fryer when it first came on the scene. Especially since I'm also a busy cook; if a gadget doesn't make my life easier, then I've got no time for it. (Too few hours in the day to mess with one that messes with me!) I am all about ruthless efficiency, in other words. Mostly, I loved the concept of frying without oil. And so began a period of intensive experimentation. (Thereby..."
"0"	"The morning before his family's Disney vacation, a firefighter died saving his comrades from a house fire"	"Just hours before a planned family vacation to Disney World, a veteran firefighter was killed early Wednesday when his ladder crew got trapped while searching for residents in a four-alarm fire, authorities in Worcester, Massachusetts, said."
"1"	"So you've ruined your cast iron pan? Don't panic! Here's how to fix it"	"Scorched pans can happen to the most diligent of cooks, but don't panic! Most mistakes have an easy fix."
"1"	"L.A.'s $1 billion trophy tower halted as China pulls back"	"It's meant to be one of the crown jewels of downtown Los Angeles' urban renaissance but now it's in limbo -- plagued by lawsuits from subcontractors, and victim of an ongoing trade dispute between China and the U.S. and a Beijing crackdown on credit and capital flight."
"0"	"Creepy fish with 'human-like face' found swimming in lake"	"Tourists in southwestern China spotted a carp fish that had human-like facial features resembling eyes, nose and a mouth."
"0"	"The 50 best burritos in America"	"The best burritos in America are well-constructed, made with fresh ingredients, and have becomed beloved in their home towns."
"0"	"5 Ways to Avoid Getting Sick on a Plane"	"Whether it's the holiday season or you're just a frequent flyer, don't bring home germs as a souvenir. Buzz60's Sean Dowling has more."
"1"	"Syrian Kurdish leader says Turkish attacks continue, contradicting US claims"	"The leader of the Syrian Kurds' civilian government accused Turkey and its forces of continuing its offensive into northern Syria, despite ceasefire agreements."
"1"	"The oldest town in every state"	"Here's the fascinating (and sometimes troubling) history behind the oldest town in every US state."
"0"	"American Outdoor to split into two firms, separating its gun business"	"American Outdoor Brands Corp. said it will split into two publicly traded companies, one focused on firearms and the other on outdoor products, in an effort to reverse a stock-market decline amid rising pressure for tougher U.S. gun restrictions."
"1"	"Demi Moore Says Her 'Addiction' to Ashton Kutcher Was 'Devastating': 'It Took Me Away Emotionally'"	"Demi Moore Says Her 'Addiction' to Ashton Kutcher Was 'Devastating'"
"0"	"Raised an only child, Southgate woman, 92, learns she has 19 half siblings"	"Self-proclaimed family historian, Robert Dumas, helps bring long-lost family together in metro Detroit."
"0"	"Paramedic finds magic solution to keep kids calm in emergencies"	"Ivan Mazurkiewicz's tricks are a regular part of the job on calls where kids are involved"
"0"	"Aston Martin DBX Luxury SUV: Price, First Interior Image Released"	"Take your first peek inside Aston Martin's first-ever SUV, but brace yourself for the cost."
"0"	"Fashion hits and misses from the 2019 Country Music Association Awards"	"From Nicole Kidman to Pink, see the best and worst dressed stars at the 2019 Country Music Association Awards."
"0"	"FCA And GM Unfazed By The Ford Bronco's Return"	"Should they be worried?"
"0"	"Hannah Brown on Whether She's Sworn Off Musicians After Dating Jed Wyatt (Exclusive)"	"The 'Bachelorette' was surrounded by plenty of eligible bachelors at Wednesday's CMA Awards."
"0"	"Here's How to Season a Turkey So It Actually Tastes Like Something"	"Want avoid a Thanksgiving bird that tastes like sawdust? Here's how to season a turkey so it actually tastes like something."
"1"	"Cincinnati Zoo pairs up cute rescue dog Remus and baby cheetah Kris for a 'BFF sleepover'"	"The Cincinnati Zoo paired up adorable rescue dog Remus and baby cheetah Kris for a sleepover as part of a program that pairs dogs with solo cheetahs."
"0"	"100 vintage baby names coming back into style"	"Stacker looks at 100 vintage baby names coming back into style along with their origins and some of the more popular bearers of that name. The Bible, literature, and royalty are just a few sources for these vintage names."
"1"	"Daily protests are paralyzing Haiti. Here's why."	"Demonstrators from across society are demanding the resignation of President Jovenel Moïse in the longest sustained protest of his term."
"0"	"The most exclusive hotel in every state"	"All these hotels have just one thing in common   guests just can't get enough of them. From celebrity favourites and ultra-small boutique stays to outrageously expensive suites, you'll have to either whip out the credit card or patiently wait to bag a night at one of these exclusive hotels in America."
"0"	"Tribe members: Ancient bison kill site desecrated by mining"	"SARPY CREEK, Montana (AP)   When a coal company contractor working under federal oversight used a backhoe to dig up one of the largest known Native American bison killing grounds and make way for mining, investigators concluded the damage on the Crow Indian Reservation broke federal law and would cost $10 million to repair, according to documents obtained by The Associated Press. Eight years later, Colorado-based Westmoreland Coal has not made..."
"0"	"Giuliani may have identified secret friend 'Charles' with accidental text"	"Another accidental message sent to a reporter may have revealed the identity of Rudy Giuliani's unknown friend "Charles.""
"1"	"Cape Cod Study Finds No Easy Way to Stop Shark Attacks"	"A new study considered everything from kelp-forest barriers to seal contraception to ward off sharks along Cape Cod's beaches but found no magic-bullet method for guaranteeing public safety."
"0"	"Supreme Court Justices Couldn't Stop Interrupting Each Other During DACA Oral Arguments"	"The first interruptions came just minutes into the start of proceedings."
