"0"	"100 vintage baby names coming back into style"	"lifestyleparenting"	"Stacker looks at 100 vintage baby names coming back into style along with their origins and some of the more popular bearers of that name. The Bible, literature, and royalty are just a few sources for these vintage names."
"0"	"Sean Spicer Admits He's Somewhat 'Relieved' to Be Eliminated from Dancing with the Stars"	"tvnews"	"DWTS: Sean Spicer Says He's Somewhat 'Relieved' to Be Eliminated"
"0"	"Eerie photos of an abandoned airport that hasn't been touched in 25 years"	"newsphotos"	"The airport in Abkhazia   a disputed region of Georgia   was built in the 1960s, but was abandoned after a violent war in the early 1900s."
"0"	"Sanders blasts Bloomberg: 'You ain't gonna buy this election'"	"elections-2020-us"	"The attack from Sanders is a preview of what the former N.Y. mayor would face if he enters the Democratic primary race."
"0"	"One of America's biggest solar panel makers quits manufacturing"	"finance-companies"	"SunPower Corp., one of America's largest solar-panel makers, is giving up its manufacturing business to focus on installing rooftop solar systems."
"1"	"Ryan Blaney wins Cup race at Talladega in photo finish over Ryan Newman"	"racing"	"Ryan Blaney beat Ryan Newman in a photo finish to cap off a two-lap shootout."
"0"	"The Latest Weight Loss Pills That Work And the Ones That Don't"	"nutrition"	"When diet and exercise aren't working, the answer may be at the drugstore."
"0"	"Selena Gomez Opens Up About Being Body Shamed for Gaining Weight Amidst Lupus Battle"	"wellness"	"The singer and actress is opening up feeling "attacked" while battling life-threatening health issues."
"0"	"Still teaching at 95, Jimmy Carter draws devotees to church"	"newsus"	"PLAINS, Ga. (AP)   The pilgrims arrive early and from all over, gathering hours before daybreak in an old pecan grove that surrounds a country church. They come, they say, for a dose of simple decency and devotion wrapped up in a Bible lesson. The teacher is the 39th president of the United States, Jimmy Carter. Nearly four decades after he left office and despite a body that's failing after 95 years, the nation's oldest-ever ex-president still..."
"1"	"Toyota Supra vs. Ford Mustang Shelby GT350: Kicking Tail!"	"autossports"	"Toyota's new sports coupe goes Head 2 Head against Ford's updated pony."
"0"	"Why You Should Go to New Orleans This Winter"	"traveltripideas"	"With the openings of a new airport terminal and a museum devoted to a cocktail, not to mention less sticky weather, New Orleans is perfect for an off-season adventure."
"0"	"Geno Smith trolls over coin flip 'controversy'"	"football_nfl"	"Geno Smith might have some trouble calling a coin flip, but at the very least he can take a joke."
"1"	"Niagara Falls: Boat stuck on rocks 101 years dislodged"	"weathertopstories"	"High winds and heavy rains dislodged the remains of a barge in the rapids above Niagara Falls that had been there 101 years."
"0"	"105 Black Friday Deals You Can Start Shopping Today"	"shop-holidays"	"Save with early bird deals from stores like Walmart, Target, Amazon, Costco, Sam's Club, Kohl's, Sears, JCPenney, and Macy's, which are offering deep Black Friday discounts on the hottest products on your Christmas list   and your wish list   starting on Thanksgiving, or even sooner."
"0"	"Why Prince Harry Wore His Remembrance Poppy Differently from the Rest of the Royal Family"	"lifestyleroyals"	"Why Prince Harry's Poppy Was Worn on His Cap"
"0"	"White House to use webcams to create live feed of border wall construction"	"newsus"	"The Jared Kushner proposal has been met by objections from the U.S. Army Corps of Engineers and border officials."
"1"	"Beat the crowds at these abandoned U.S. national parks"	"ustravel"	"These 7 spots might have lost their national status but you can still explore their rich history and natural beauty."
"0"	"3 New Ways to Upgrade to Business Class Without Paying Full Price"	"traveltips"	"These new services are all about getting you discounted seats at the front of the airplane cabin."
"1"	"Charlize Theron Talks 'White Privilege,' Growing Up During Apartheid in South Africa"	"movies-celebrity"	"Charlize Theron, during an onstage discussion with her "Gringo" costar David Oyelowo about philanthropy at Thursday's annual fundraiser for Nigerian children's educational and health program GEANCO, said she was a beneficiary of "white privilege" while growing up in Apartheid-torn South Africa. "I obviously am a white person who benefited from my white privilege," Theron said"
"0"	"Most countries aren't hitting 2030 climate goals, and everyone will pay the price"	"weathertopstories"	"Untold human suffering is in our future as nations miss their Paris Agreement targets by a long shot."
"0"	"No more fire in the kitchen: Cities are banning natural gas in homes to save the planet"	"newsus"	"Thirteen cities and one county in California have passed building codes encouraging   or requiring   all-electric appliances in new homes."
"1"	"Megyn Kelly Slams NBC News on 'Tucker Carlson Tonight' for Matt Lauer Investigation, Harvey Weinstein Coverage"	"tvnews"	"In Megyn Kelly's first televised interview since exiting NBC, the former Fox News and NBC News anchor took to "Tucker Carlson Tonight" Wednesday evening to criticize NBC News management for its handling of the outlet's Harvey Weinstein coverage and internal Matt Lauer investigation."
"0"	"This Record-Breaking 1800-HP Land Speed Car Is Coming up for Sale"	"autosenthusiasts"	"The 1968 Challenger II set a 448-mph speed record last year, and now, it can be yours."
"0"	"Trump Impeachment Inquiry Delves into Idea of Quid Pro Quo"	"newspolitics"	"At the heart of the House impeachment inquiry into President Trump's Ukraine dealings is a Latin term that is easy to translate but legally difficult to define and prove."
"0"	"A $5 billion bill and Japan tensions in focus as U.S. defense heads visit South Korea"	"newsworld"	"A $5 billion bill and Japan tensions in focus as U.S. defense heads visit South Korea"
"0"	"Halle Berry, 53, flaunts chiseled abs on Instagram: See the pic"	"movies-celebrity"	"Halle Berry is trying to motivate her social media followers with her incredible abs."
"1"	"These are the new cars that depreciate least"	"autosresearchguides"	"Don't want to lose a ton of money on your next new car? These are the new car models that hold the most value after five years."
"0"	"Britney Spears Reveals Her Secret Cheat Meal In All Its Chocolaty Glory"	"healthnews"	"On November 10, Britney Spears, world-class pop star and bona fide fitness guru, shared a glimpse at her cheat meals, and yes, they look delicious."
"0"	"Here Are the Biggest Deals We're Anticipating for Black Friday"	"shop-holidays"	"The Black Friday deals for 2019 have already begun leaking out. Get a sneak peek at what to expect from popular retailers like Costco, Walmart, and Best Buy. Browse our guide and use it to plan your attack for the biggest shopping event of the year."
"1"	"Catherine Deneuve Hospitalized After Mild Stroke"	"movies-celebrity"	"The French star was in location around Paris filming her upcoming project."
"0"	"I'd Choose This Rad Ford Edsel Camper Over a Motel Any Day"	"autosenthusiasts"	"And, no. It's not a one-off custom job."
"1"	"Porsche-Designed Superyacht Is a 135-Foot-Long Spaceship on Water"	"autosenthusiasts"	"Royal Falcon One looks like old money: stuffed with luxury, yet understated. My Other Porsche Is a Superyacht bumper sticker not included."
"0"	"A Texas woman was legally declared dead while still alive"	"newsus"	"Sherry Ellis found out she was dead November 1."
"1"	"Heidi Klum's 2019 Halloween Costume Transformation Is Mind-Blowing   But, Like, What Is It?"	"lifestylebuzz"	"You might say she's scary good at playing dress-up, because Heidi Klum's 2019 Halloween costume is even more impressive than we could have imagined   and that's saying a lot, considering transformative Halloween costumes are kind of her thing. But this year Klum took it up one more notch as she shared her metamorphosis into,"
"0"	"Kaiser Permanente CEO Bernard Tyson dies at 60"	"finance-companies"	"Kaiser Permanente CEO Bernard Tyson died unexpectedly Sunday at the age of 60.The cause of death was not immediately known. Tyson died early Sunday morning in his sleep, according to a statement from the company."
"1"	"Harley-Davidson beats forecasts as international sales rebound"	"finance-companies"	"Harley-Davidson beat expectations for profit Tuesday and stuck to its full-year shipment forecast, allaying fears of another major hit from European import tariffs and a further slump in sales in its main U.S. market."
"0"	"New Glue Can Stick and Stay Stuck Underwater"	"science"	"This glue uses electrical charge to adhere underwater."
"0"	"Wisconsin bus driver saves children wandering in snow, as deadly Arctic air mass grips US"	"newsgoodnews"	"As bitter cold took hold across the Midwest earlier this week, a sharp-eyed bus driver in Wisconsin was credited with helping rescue two children who were very underdressed for the weather conditions."
"1"	"45 Abandoned Places Around the World That Are Eerily Beautiful"	"traveltripideas"	"It's okay to be awed and creeped out at the same time."
"1"	"Best Ski Resorts in the US"	"traveltripideas"	"Heading to the mountains this winter? These are the best ski resorts in the US, from Park City to Telluride and beyond!"
"0"	"Atlanta college student Alexis Crawford was choked to death, dumped in park, police say"	"newscrime"	"Authorities say Alexis Crawford and her roommate Jordyn Jones had a physical altercation and Jones' boyfriend intervened and choked Crawford to death."
"1"	"EarthRoamer Introduces Carbon Fiber-Bodied LTi Expedition Vehicle"	"autosenthusiasts"	"This thing looks amazing, inside and out."
"0"	"The Perfect Family Road Trip along Florida's 30A"	"traveltripideas"	"Idyllic beach neighborhoods, family-friendly communities and stunning shorelines make 30A the perfect spot to road trip with your kids."
"0"	"Walmart releases Black Friday ad with $129 Apple Watch, TV deals, electronics doorbusters"	"finance-companies"	"Walmart's Black Friday 2019 ad includes a 40-inch TV for $98, Apple iPad for $249, Xbox One, Playstation 4, deals on toys, Instant Pot and more."
"0"	"Powell's Warning to Congress About the Next Recession"	"markets"	"The Fed will need help stimulating the economy when the next downturn hits."
"0"	"2 dead, 3 injured in a school shooting in Russia"	"newsworld"	"Russian police say a student has killed a fellow student and wounded three more in a shooting at a college before taking his own life. Russia's state Investigative Committee says the 19-year-old student in Blagoveshchensk near the border with China brought a hunting rifle to class Thursday and opened fire on students, shooting one dead and severely injuring three more."
"0"	"Unexpected Signs of an Unhealthy Heart"	"medical"	"Preventing heart disease has been at the forefront of researchers' agendas for years, involving things like physical activity, diet, and genetics"
"0"	"Do not try this at home: How to turn $3,000 into $1.7 million"	"finance-saving-investing"	"Reddit's Wall Street Bets group learned a valuable lesson in responsible investing this week and, after years of encouraging and celebrating extreme risk-taking, the crew has finally embraced a more conservative approach. Just kidding. YOLO!"
"0"	"Ilhan Omar tweet called anti-Semitic 'dog whistle'; tennis great Martina Navratilova among critics"	"newspolitics"	"A Twitter message posted Saturday by U.S. Rep. Ilhan Omar, D-Minn., has revived accusations of anti-Semitism against the freshman congresswoman and member of the far-left "Squad.""
"0"	"Zlatan Ibrahimovic Announces Departure From LA Galaxy With 'You're Welcome'"	"soccer"	"Zlatan Ibrahimovic will be moving on from the LA Galaxy and Major League Soccer. The 38-year-old striker tweeted out his thanks to the franchise and its fans, but also threw in a classic Zlatan comment along the way. It reminded us just how much the MLS is going to miss his personality."
"0"	"LeBron James becomes first Lakers to get 4 triple-double in 1st 10 games"	"basketball_nba"	"LeBron James made more franchise history for the Los Angeles Lakers even in their first loss in eight games."
"0"	"Venice 'on its knees' after second-worst flood ever recorded"	"newsworld"	"The worst flooding in Venice in more than 50 years prompted calls Wednesday to better protect the historic city from rising sea levels as officials calculated hundreds of millions of euros in damages."
"1"	"Woman, suspect dead at 'Tarzan' actor Ron Ely's California residence"	"tv-celebrity"	"Ron Ely, who portrayed Tarzan in the TV series in the 60s, was not harmed and is alive and well, a sheriff's office spokesman said."
"1"	"Hard Rock Hotel New Orleans collapse: Former site engineer weighs in"	"newsus"	"Structural engineer Walter Zehner worked on the project before it became a planned Hard Rock Hotel. A look at what he thinks could have happened:"
"0"	"A US cargo ship carrying 1,400 tonnes of TNT that sank at the end of the River Thames in 1944 is posing a threat to London from its salty grave"	"newsworld"	"75 years ago the SS Richard Montgomery went down at the end of the River Thames with 1,400 tonnes of TNT onboard. Its payload is becoming unstable."
"1"	"Simone Biles ties world gymnastics championships medal record, leads U.S. one-two"	"more_sports"	"Simone Biles tied a 1990s star for the world gymnastics championships medal record."
"0"	"Kelsey Grammer shreds 'Housewives' ex Camille, dubs her 'pathetic'"	"tv-celebrity"	"Kelsey Grammer has some very unpleasant things to say about his ex Camille Grammer."
"0"	"Supreme Court refuses to block lawsuit against gun manufacturer brought by Sandy Hook families"	"finance-companies"	"The Supreme Court refused to shield Remington Arms Co. from potential liability for the 2012 school shooting that left 26 dead in Newtown, Conn."
"1"	"Ionescu and No. 1 Oregon stun US women's national team"	"basketball_ncaa"	"Top-ranked Oregon stunned the U.S. women's national team 93-86 on Saturday to hand the Americans' their second loss to a college team in program history. The Americans haven't lost a major international game since falling in the semifinals of the 2006 World Championships to Russia. The only other loss to a college program came in 1999 when Tennessee won on a shot by Kara Lawson, who was a freshman that season, with 10 seconds..."
"1"	"Mid-Engined Hyundai Veloster Spied Looking Wild At The 'Ring"	"autosnews"	"If a Veloster looking like this arrives in showrooms, it would definitely make waves."
"0"	"NASA unveils its first electric airplane - a work in progress"	"newsworld"	"NASA, most prominent for its many Florida-launched exploits into space, showcased an early version of its first all-electric experimental aircraft, the X-57 "Maxwell," on Friday at its lesser-known aeronautics lab in the California desert."
"0"	"The Changing Demographics of America's Suburbs"	"markets"	"The changes in the demographic makeup of America's suburbs are so profound that some urbanists are calling for a new sociology of suburbia."
"1"	"Analysis: California is becoming unlivable"	"finance-real-estate"	"The state is plagued by two major issues: wildfires and a lack of affordable housing. Each problem exacerbates the other."
"1"	"California's legal weed profits going up in smoke"	"markets"	"Nearly three years after California legalized marijuana, the profit outlook for this budding business looks cloudy."
"0"	"The News In Cartoons"	"newsopinion"	"News as seen through the eyes of the nation's editorial cartoonists."
"0"	"SEMA 2019 Photo Highlights From Las Vegas"	"autossema"	"Photographic Highlights from the 2019 SEMA Show in Las Vegas.… The post SEMA 2019 Photo Highlights From Las Vegas appeared first on autoNXT.net."
"0"	"Fire Destroys Classic Porsche Cars And Parts Worth $3 Million"	"autosenthusiasts"	"Well-known for their vintage Porsche builds, Benton Performance has burnt down to the ground along with a bunch of irreplaceable vintage Porsche cars and parts."
"0"	"The most famous hotel in every state"	"travelnews"	"From Caesars Palace in Las Vegas to The Plaza Hotel in New York, these are the most famous hotels across the US."
"0"	"The cost to become a US citizen is going up 61 percent"	"markets"	"Critics call the proposed $1,170 application cost "an unprecedented weaponization of government fees.""
"1"	"My Father's Battle With Alzheimer's Revealed an Unsettling Truth About His Life"	"voices"	"After her father is diagnosed with Alzheimer's disease, Sascha Rothchild finds a man consumed by secrets."
"0"	"Kent, Taylor say they're not 'Never Trumpers' after Trump twitter offensive"	"newspolitics"	"Bill Taylor, the top U.S. diplomat in Ukraine, and George Kent, a top State Department official, denied during Wednesday's first public impeachment hearing that they are "never Trumpers."Rep. Eric Swalwell (D-Calif.) asked Kent and Taylor if they identify as "never Trumpers," a label the president assigned them on Twitter ahead of the hearing."Just about an hour before the two of you sat down to testify today the president tweeted multiple...""
"0"	"Ilhan Omar blasts Pete King as an 'Islamophobe' after he announces retirement: 'Good riddance'"	"elections-2020-us"	"Rep. Ilhan Omar (D-Minn.) on Monday denounced Rep. Pete King (R-N.Y.) as an "Islamophobe" after the longtime GOP lawmaker announced that he would not seek re-election in 2020. Omar, who earlier this year became one of the first Muslim women sworn into Congress, specifically called out controversial statements King made about the Muslim community and Eric Garner during his long tenure in Congress."Peter King is an Islamophobe who held...""
"0"	"Rape victim rejects judge's offer: $150,000 for her, reduced sentence for attacker"	"newscrime"	"A Louisiana judge asked a rape survivor if she would consider a $150,000 restitution payment from her attacker. She refused, saying the attack has left her "broken.""
"0"	"Iran's president: New oil field found with over 50B barrels"	"newsworld"	"Iran has discovered a new oil field in the country's south with over 50 billion barrels of crude, its president said Sunday, a find that could boost the country's proven reserves by a third as it struggles to sell energy abroad over U.S. sanctions. The announcement by Hassan Rouhani comes as Iran faces crushing American sanctions after the U.S. pulled out of its nuclear deal with world powers last year."
"0"	"Family told to take down Christmas display because it's too soon to decorate"	"lifestylebuzz"	"A Texas couple was told by their homeowners association to pump the brakes on their Christmas cheer."
"0"	"This is Chick-fil-A's most-ordered menu item"	"foodnews"	"There may be a lot of things you don't know about Chick-fil-A, but if there's one thing you definitely know about the fast food chain, it's that it has a massive following. Chick-fil-A is quickly growing and has become the third-most profitable chain restaurant in America. With millions of devoted fans and diners, we had to ask: What is Chick-fil-A's most popular menu item? 10 Ways Fast Food Chains Are Playing With Your Head The most-ordered..."
"0"	"Opinion: Other schools can learn from Oregon's hiring of Mario Cristobal"	"football_ncaa"	"Like Ed Orgeron at LSU, Oregon's Mario Cristobal failed at a smaller school and is now finding success on the biggest stage."
"0"	"Subprime mortgages keep minting cash for former Bear Stearns banker"	"markets"	"Subprime mortgages may have wreaked havoc on the U.S. economy over the past decade, but they have been very good to Tom Marano."
"1"	"Militarized Ford Ranger By Ricardo Looks Ready For Action"	"autostrucks"	"It's like most upgraded off-roaders, except for armor and provisions for big guns."
"0"	"The problem with diamonds is they keep getting cheaper"	"markets"	"Americans are buying more diamond jewelry than ever before, but prices for most polished gems are falling."
"0"	"65 Best Fall Soups That Will Warm You and Your Family Up All Season Long"	"recipes"	"These hearty bowls are the perfect companion for a rainy fall night."
"0"	"Inside the world's largest plane, which has a wingspan longer than a football field and a mysterious new owner"	"newsphotos"	"The Stratolaunch is 238 feet long, 50 feet tall, and has a 385-foot wingspan. It made its first flight in April."
"1"	"Tesla Model S gains enormous rear wing and front splitter on the Nurburgring"	"autosenthusiasts"	"It looks more like a race car each time we see it"
"0"	"2021 Ford Mustang Mach-E: This Electric SUV is a Mustang Family Member"	"autosnews"	"Ford confirms that its all-new, fully electric crossover will wear the iconic Mustang name."
"0"	"A teen received a response to a message in a bottle he wrote 9 years ago after it traveled over 3,000 miles"	"lifestylebuzz"	"The bottle, which was placed into the ocean on a beach in Rockport, Massachusetts, was found off the coast of France."
"1"	"Coaches poll: LSU jumps Ohio State, Oklahoma to No. 3; Georgia falls"	"football_ncaa"	"LSU moved up three spots to No. 3 in the Amway Coaches Poll behind Alabama and Clemson. Georgia dropped seven spots after losing to South Carolina."
"1"	"Dean McDermott Thought Tori Spelling Would 'Run for the Hills' After Cheating"	"tv-celebrity"	"Dean McDermott Thought Tori Spelling Would 'Run for the Hills' After Cheating"
"0"	"'Stay alert': millions of Australians brace for 'catastrophic' bushfires"	"newsworld"	"'Stay alert': millions of Australians brace for 'catastrophic' bushfires"
"1"	"MrBeast, YouTubers Band Together to Plant 20 Million Trees to Fight Climate Change"	"newsgoodnews"	"The #TeamTrees initiative has gone viral, racking up millions of dollars in donations so far."
"0"	"Ford Mustang Jack Roush Edition Has It All: 775 HP and a Manual Transmission"	"autosenthusiasts"	"The acclaimed Ford tuner outdoes even the Shelby GT500 in power, thanks to Roush's in-house-designed supercharger."
"0"	"Chevy C8 Corvette Z06 interior could look something like this"	"autosnews"	"A sole interior sketch might give us an idea of what Chevy designers have in mind for a new Corvette Z06."
"0"	"U.S. Drones Appear to Show Turkish- Backed Forces Targeting Civilians"	"newsworld"	"U.S. military officials watched live drone feeds last month that appeared to show Turkish-backed Arab gunmen targeting civilians during their assault on Kurdish fighters in Syria, according to current and former officials familiar with the incidents."
"0"	"2020 Ford Bronco: Everything we know about Ford's new SUV"	"autossuvs"	"It's only a matter of time until Ford pulls back the veil."
"1"	"Cat "repeatedly" breaks his friends out of animal shelter"	"newsus"	"A mischievous cat named Quilty has earned internet fame for repeatedly breaking himself out of his enclosure at a Texas animal shelter. But, he doesn't just escape   he brings all of his feline friends along with him."
"0"	"17 photos that show the ugly truth of living in a tiny house"	"lifestylehomeandgarden"	"From cramped lofts that are hard to access to small appliances, this is what it's really like to live in a tiny house."
"1"	"Huracan vs. Huracan? What Makes Lamborghini's New GT3 Evo Race Car So Different"	"autosenthusiasts"	"In search of the racer's edge"
"0"	"Top storylines for Week 11 in the NFL"	"football_nfl"	"We're heading toward crunch time of the NFL season and Week 11 has some huge games on the schedule."
"0"	"The Studio Ghibli Fans Guide to Tokyo"	"traveltripideas"	"Combining mythical storytelling and stunning visuals, Studio Ghibli is renowned as one of the world's greatest animation studios."
"0"	"Ford v Ferrari: the real story"	"autosnews"	"The film about the epic Le Mans rivalry promises to be a must for car fans - and this is the real story behind it"
"0"	"The lightest sports cars you can buy for under $30,000"	"autosbuying"	"Power-to-weight ratios matter, and what these sports cars lack in horsepower they more than make up for in their abilities to attack the roads with venom."
"0"	"San Diego State University freshman hurt in fraternity incident dies"	"newsus"	"SAN DIEGO - Dylan Hernandez, the 19-year-old San Diego State University freshman who required medical attention last week after an unspecified incident at one school's fraternities, has died, campus officials said on Monday. "His family gave their goodbyes late Sunday night," SDSU President Adela de la Torre said in a statement."
"0"	"Gwen Stefani Reveals New Nickname for Her and Blake Shelton"	"music-celebrity"	"The singer said she is 'really excited' about the couple's new combined moniker."
"0"	"Body of missing Salvadoran trans activist found"	"newsworld"	"The body of a Salvadoran trans activist missing since Tuesday has been found in the northeast of the country, authorities confirmed. Jade Camila Diaz, 27, is the second transgender woman killed in the country in the past 15 days, according to the advocacy group Comcavis Trans, who told local media there have been at least seven LGBT-related murders in 2019. "We regret to inform you that Jade Diaz's body was found in the waters of the Torola...""
"1"	"Iowan convicted of murder claims his life-sentence was served once he died, was revived in medical emergency. The court disagrees."	"newscrime"	"An Iowa convicted of murder was rushed from prison to the hospital where his heart was restarted five times. Now he claims he should be freed"
"0"	"Piracy crackdown may be next front in streaming wars"	"finance-companies"	"Controlling user access to platforms (password sharing) will be a priority as major conglomerates bet on new direct-to-consumer digital services."
"0"	"23 Worst Things You Can Say to a New Parent"	"lifestyleparenting"	"Before you stick your foot in your mouth with well-intentioned but offensive advice, make sure you know these things you should never say to a new parent."
