"1"	"Older people's most common regrets"	"lifestylesmartliving"	"For many, growing older and entering the "golden years" is a time of celebration. Worries about career are often over, their homes are paid off, and they have ample time to enjoy their families or favourite activities. But for many others, the passage of time is just a reminder of all the things they haven't done, or wish they'd done differently. These are the most common regrets older people have."
"0"	"50 amazing gifts for every type of person and budget"	"shop-holidays"	"Let the product experts at Reviewed help you find the perfect gifts for everyone on your list."
"1"	"Ford Baby Bronco Bare Body Allegedly Leaked In Exclusive Photo"	"autosnews"	"Ford had no comment, but it sure looks like the real deal."
"0"	"The Queen Had This Hilarious Reaction to (Unnecessary) Mouth-to-Mouth Resuscitation"	"lifestyle"	"The Queen had a hilarious reaction when someone tried to save her life. Buzz60's Keri Lumm reports."
"1"	"Abandoned farms for sale with plenty of promise"	"finance-real-estate"	"If you fancy snapping up your own farm without breaking the bank, these abandoned properties might just be of interest."
"0"	"18 Ingredients Nutritionists Say Should Be Banned From Your Kitchen"	"nutrition"	"Experts say that these cooking and baking essentials are weight loss saboteurs in disguise."
"0"	"Sour grapes: Trade war puts cork in US wine sales to China"	"markets"	"LIVERMORE, Calif. (AP)   Caught in the crossfire of President Donald Trump's trade war with China, U.S. vineyards are struggling to sell Syrah in Shanghai and Chardonnay in Shenzhen."
"0"	"Alibaba breaks Singles Day record of more than $30 billion in sales and climbing"	"finance-companies"	"Chinese e-commerce giant Alibaba set a new sales record on Singles Day, the world's largest 24-hour shopping event."
"0"	"What Happens If Your Oxygen Mask Doesn't Inflate on a Flight?"	"traveltips"	"Ever wondered what happens if your oxygen mask doesn't inflate during an in-flight emergency? Here's what you need to know."
"1"	"Lebanon 'days' away from economic collapse if no solution to protests found, central bank governor says"	"newsworld"	"Lebanon is on the verge of economic collapse unless an "immediate solution" can be found to end days of nationwide protests that have paralyzed the country, Central Bank Governor Riad Salame told CNN in an exclusive interview Monday."
"0"	"A Mining Town Buried in Mud Is Awash in Cash. It Will Soon Run Out."	"finance-companies"	"After a deadly dam collapse, Brazil's mining giant Vale SA showered money on survivors who spent like every day was their last. Now Vale plans to close the mine, a pillar of the local economy."
"0"	"Maggert holes out to win Champions finale; McCarron takes Schwab Cup"	"golf"	"Jeff Maggert holed out from 123 yards for eagle on the third playoff hole Sunday to win the Charles Schwab Cup Championship and hand Scott McCarron the season points title on the PGA Tour Champions."
"0"	"Jane Fonda Opens Up About the Possibility of Spending Her 82nd Birthday in Jail"	"movies-celebrity"	"The actress and activist has been protesting in Washington D.C. every Friday, in the name of spreading awareness about climate change."
"0"	"'We're fighting for our lives'   US apple farmers endure major crop and profit losses as climate changes"	"weathertopstories"	"Climate change is posing an existential threat to the precarious lives of farmers across the country. "We've seen such dramatic, frightening crop losses," says Elizabeth Ryan, a longtime farmer in Hudson Valley, New York."
"0"	"2019 People's Choice Awards fashion hits and misses"	"awards"	"See all the best and worst dressed stars at the 2019 People's Choice Awards."
"0"	"LSU, Ohio State, and Clemson control path to College Football Playoff, but who else does too?"	"football_ncaa"	"After a rather eventful day around the college football world, the big question is how did it all impact the College Football Playoff race. You would think that two of the top four teams falling on the first Saturday since the initial release of the College Football Playoff rankings would have a dramatic effect on Read more... The post LSU, Ohio State, and Clemson control path to College Football Playoff, but who else does too? appeared first on..."
"0"	"This Ford GT40 Movie Rig From "Ford V Ferrari" Looks Absurd"	"autosenthusiasts"	"It's half Ford GT40 race car, half camera platform."
"0"	"Top 100 country songs of all time"	"cma-awards"	"Stacker counts down the top 100 country songs of all time. From old-school honky-tonk to modern country pop, this list covers the biggest hits in Billboard history."
"0"	"Best country music albums of all time"	"cma-awards"	"Stacker has compiled a list of the best country albums of all time as per Billboard's Greatest of All Time Country Albums list. These ratings are based on albums' weekly performance on the Top Country Albums chart from January 1996 to June 2016."
"0"	"Kiss Cancel 'End of the Road' Tour of Australia and New Zealand Due to Illness"	"musicnews"	"Kiss won't be playing Australia and NZ after all."
"0"	"Aviation-Inspired Travel Experiences on the East and West Coast"	"traveltripideas"	"From hotels paying tribute to aviation to a retro-themed fine-dining experience, these are not to be missed."
"0"	"I moved from the US to the UK. Here are the 8 things that surprised me the most."	"voices"	"I've found that living in England comes with a lot of perks, especially when it comes to rent, grocery shopping, and travel."
"0"	"Carrie Underwood Praises Miranda Lambert as 'Super Supportive': 'We Lift Each Other Up'"	"cma-awards"	"Carrie Underwood Praises Miranda Lambert as 'Super Supportive'"
"0"	"Climate change could end mortgages as we know them"	"finance-real-estate"	"The traditional 30-year home loan   along with city and state budgets   face a grave threat from growing climate risks"
"1"	"Singer stands up to heckler who told her to take shirt off"	"popculture"	"After being heckled on stage and told to "free the nips" at a concert in Texas, singer Maggie Rogers voiced her anger about the harassment."
"1"	"Ken Block's Home Garage Is Surprisingly Tasteful But Still On-Brand"	"autosenthusiasts"	""My toys, my space.""
"0"	"Tarek El Moussa Shares Sweet Pic of Girlfriend Heather Rae Young 'Chillin' With Son at Daughter's Soccer Game"	"tv-celebrity"	"The 'Flip or Flop' star's ladylove spent some quality time with her boyfriend's adorable children over the weekend."
"0"	"691,145 Californians left last year: What state did they go to?"	"finance-real-estate"	"Look at the comings and goings as a ratio of ins to outs. Tiny Idaho wins this race with 497 arrivals from the Golden State for every 100 former Gem State residents who moved to California."
"0"	"Lexus just revealed the pricing for its first-ever luxury yacht   and a fully-loaded model will cost $4.85 million. Here's a closer look at LY 650."	"autosnews"	"The Lexus Sport Yacht Concept was first shown in January 2017, and the brand has finally delivered on making the LY 650 a reality."
"0"	"Russell Westbrook takes shot at Patrick Beverley"	"basketball_nba"	"Wednesday night's Houston Rockets-LA Clippers game was entertaining on many levels. Russell Westbrook's comments about Patrick Beverly's reputation stood out the most."
"0"	"These Two New Oreo Flavors Are Coming in 2020 and We're OBSESSED"	"foodnews"	"These new Oreo flavors are just what we were craving and we didn't even know it!"
"1"	"SR-71 Blackbird: The Cold War spy plane that's still the world's fastest aircraft"	"newsus"	"During the Cold War, the SR-71 Blackbird spy plane could fly higher and faster than any other -- and 55 years after its first flight, it still does."
"0"	"Here's How To Score Buy One Get One Free Whoppers From Burger King"	"restaurantsandnews"	"Feeling #blessed."
"0"	"Everyday heroes step up to help lone Waffle House employee"	"restaurantsandnews"	"Sometimes you just have to be the change you wish to see in a Waffle House."
"0"	"Demi Lovato Goes Instagram Official With Boyfriend Austin Wilson: See Their Sweet Synchronized Posts"	"music-celebrity"	"This is the singer's first social media-official romance since her July 2018 overdose."
"1"	"Kansas vs. Duke Basketball Highlights (2019)"	"basketball_ncaa_videos"	"The No.4 Duke Blue Devils took care of business in a narrow victory over No.3 Kansas, 68-66."
"0"	"We Tried 5 Brands of Toaster Pastries So You Don't Have To"	"foodnews"	"We tasted organic, generic, gourmet, and nostagic options. Here's what we thought."
"1"	"NFL bust Ryan Leaf explained why he's worried about Baker Mayfield"	"football_nfl"	"Time to worry about Baker Mayfield?"
"0"	"Fast food cashier and manager fired for refusing to serve police officer"	"newsus"	"Two fast food employees have been fired after one of them refused to serve a police officer who wanted to order food from the establishment."
"0"	"Trump juggles statecraft and impeachment on a historic day"	"newspolitics"	"Projecting unusual calm in the middle of a political firestorm, President Donald Trump pleaded ignorance Wednesday about the first public impeachment hearing, unexpectedly insisting that he really wasn't paying attention to sworn testimony in the House Intelligence Committee that could determine whether he serves out his term in office. The disclaimer might be more credible if ..."
"0"	"Amber Heard requests Johnny Depp undergo a mental health evaluation"	"movies-celebrity"	"Johnny Depp says the request is an invasion of privacy"
"0"	"This Arctic blast is in its final day. But the cold isn't over quite yet"	"weathertopstories"	"The hundreds of millions of people gripped by the Arctic blast can begin to peel off a layer or two of clothing starting Thursday."
"0"	"A master suite with an 'open-concept' bathroom that has no doors   or privacy   is asking for $1,200/month in rent"	"lifestylebuzz"	"People took to Twitter to share confusion about an "open-concept" bathroom featured in a Facebook rental listing."
"0"	"Week 10 storylines to watch: Casserly takes a look around NFL"	"football_nfl_videos"	"Week 10 storylines to watch: Charley Casserly takes a look around the league."
"0"	"97-year-old WWII veteran takes ride in B-17 bomber for Veteran's Day"	"newsus"	"A World War II veteran celebrated Veteran's Day by taking a flight to yesterday -- in an aircraft that first saw combat at the time of his service."
"1"	"Hong Kong crashes into recession as protests hit economy"	"markets"	"Hong Kong's economy contracted sharply in the third quarter as it entered a recession, exceeding economists' worst estimates of the damage from nearly five months of protests."
"1"	"Mercedes-AMG GT R Black Series Spied Testing With Lots Of Sensors"	"autossports"	"There are multiple body configurations on the vehicles in this clip."
"1"	"Frustrated with season so far, Melvin Gordon appears to regret his holdout"	"football_nfl"	"The Los Angeles Chargers rusher seems to have wished he attended training camp after all."
"0"	"Winners and losers in second College Football Playoff rankings include LSU and Alabama"	"football_ncaa"	"The College Football Playoff committee released its second rankings of the 2019 season. There were winners and losers including LSU and Alabama."
"0"	"Why Has This 1970 Chevrolet Camaro Z/28 Gone Just 8,500 Miles?"	"autosclassics"	"This 1970 Camaro Z/28 has less than 8,600 miles showing on the odometer. The car's original owner had it for nearly 30 years & put just 3,000 miles."
"0"	"Prince Albert on Twins Jacques and Gabriella: They're Starting to Say, 'Are We There Yet?'"	"lifestyleroyals"	"Prince Albert on Twins Prince Jacques and Princess Gabriella"
"1"	"Kenny Dixon, Drummer for Kane Brown, Dies in Car Accident"	"musicnews"	"Drummer Kenny Dixon, who performed in Kane Brown's band, was killed in a car crash."
"1"	"Former Cowboys Pro Bowler Marion Barber arrested on criminal mischief charges"	"football_nfl"	"It appears that Barber's life has taken a turn since he exited the NFL back in 2011."
"0"	"11 Unique and Quirky Cruise Destinations"	"traveltripideas"	"Venture off the beaten path for an authentic cruising experience."
"0"	"Hannah Brown on Being Surrounded By Exes Tyler Cameron and Colton Underwood"	"tv-celebrity"	"ET spoke with the former Bachelorette after 'Dancing With the Stars' on Monday."
"1"	"Hawk Can't Understand Why This Little 'Bunny' Isn't Scared Of Him"	"lifestylebuzz"	"This fearsome bird of prey has clearly never met a bunny nearly as brave as this one."
"0"	"Busy Philipps Has This Prediction for James Van Der Beek Following 'DWTS'"	"tv-celebrity"	"The actress dished to ET on the red carpet at this year's Glamour Women of the Year Awards in New York City on Monday."
"0"	"Can't-Miss Play: Jump-pass Pat! Mahomes' epic throw turns into 63-yard TD"	"football_nfl_videos"	"Kansas City Chiefs quarterback Patrick Mahomes completes 63-yard touchdown pass to wide receiver Mecole Hardman."
"0"	"Daisy Ridley plays coy about engagement speculation"	"movies-celebrity"	"Daisy Ridley won't confirm or deny that she's engaged."
"1"	"Mark Hurd, Oracle CEO who led 3 tech companies, dies at 62"	"finance-companies"	"Mark Hurd, who was chief executive officer of three major technology companies including Oracle Corp., has died. He was 62."
"1"	"MLB world reacts to Aníbal Sánchez losing no-hitter in eighth inning of NLCS Game 1"	"baseball_mlb"	"Washington Nationals' pitcher Anibal Sanchez stole the show of Game 1 of the NLCS and nearly became a part of MLB history before his no-hit bid was ended in the eighth."
"0"	"Trade War's Forgotten Farmers Get Crushed in U.S. Cotton Country"	"markets"	"American cotton farmers are having such a difficult year that even a potential trade deal between the U.S. and China is likely to offer them little comfort."
"1"	"Tom Brady explains why he's angry at this point in the football season"	"football_nfl"	"New England Patriots quarterback Tom Brady wasn't happy on Monday morning. That much was clear when he logged on for his call with WEEI sports radio. But he wasn't sad, even if he sounded a little down after his team's 37-20 loss to the Baltimore Ravens on Sunday night. "I'm more angry. I'm just an angry football   I'm like an angry during football season. It's always kind of at a boil   just below boil. It doesn't take much to push me over the...""
"1"	"'It's a joke': Astros livid about cheating accusations in ALCS vs. Yankees"	"baseball_mlb"	"In the midst of a hard-fought ALCS against the Yankees, the Astros are facing accusations of cheating to get an advantage."
"1"	"Harley-Davidson halts production of new electric motorcycles"	"finance-companies"	"Harley-Davidson has halted production and deliveries of its new LiveWire electric motorcycle after reportedly discovering a problem with its charging mechanism."
"1"	"25 Iconic Motorcycles From the Past 125 Years"	"autosmotorcycles"	"Legendary brands like Harley-Davidson, Honda, Indian, and Triumph have left indelible marks on motorcycle history with bold, powerful, aesthetically breathtaking bikes. See if any of your favorites are here and find out which manufacturers laid tracks before them."
"1"	"TV reporter fired after climbing on cars live at auto show"	"autosnews"	"He climbed atop a Ford Thunderbird and 2020 Explorer, and dinged the door of another T-bird"
"1"	"Uber passenger run over by police car after fleeing from fight with other rider"	"newscrime"	"An Uber passenger who got into a physical altercation with another rider was struck and killed by a California highway patrol car after jumping from the Uber."
"0"	"The 25 most iconic film quotes"	"movies-gallery"	"The most iconic quotes are the ones that are so famous that you can't even use those words in casual conversation without reminding the average person of the movie."
"0"	"Crypto Firm Rejects Paper Claiming It Was Used to Manipulate Bitcoin Price, Says Study 'Built on a House of Cards'"	"newsscienceandtechnology"	""It is reckless and utterly false to assert that Tether tokens are issued in order to enable illicit activity," executives at Tether said after a new research paper linked the firm to market manipulation."
"0"	"Iraq protests death toll rises to 305 with nearly 15,000 injured"	"newsworld"	"At least 305 people have been killed and nearly 15,000 have been injured in Iraq since the start of anti-government protests in October, according to activists and the Independent High Commission for Human Rights of Iraq (IHCHR)."
"0"	"Air Quality Index: What to do when the air quality is bad in your area"	"health-news"	"How to protect yourself from unhealthy or hazardous air pollution."
"0"	"Greta Thunberg to set sail back to Europe sooner than expected"	"newsworld"	"Climate activist Greta Thunberg plans to set sail for Spain Wednesday after the venue for United Nations-sponsored climate talks were moved from Chile due to political unrest."
"0"	"Abandoned 'unicorn' puppy has a tail on its head"	"animals"	"Abandoned 'unicorn' puppy has a tail on its head"
"0"	"Experts crack mystery of ancient Egypt's sacred bird mummies"	"newsscienceandtechnology"	"DNA analysis helps work out origin of nearly 6 million mummified ibises"
"0"	"Every touchdown from every Week 10 game"	"football_nfl_videos"	"Watch Every Touchdown From Every Game presented by Amazon Prime during Week 10."
"0"	"How Russia Meddles Abroad for Profit: Cash, Trolls and a Cult Leader"	"newsworld"	"The Russians were hard to miss. They appeared suddenly last year in Madagascar's traffic-snarled capital, carrying backpacks stuffed with cash and campaign swag decorated with the name of Madagascar's president."
"0"	"Democrats face make-or-break moment on impeachment"	"newspolitics"	"Democrats have reached a make-or-break moment on impeachment.For the first time, Democrats will bring their impeachment inquiry to the American public on Wednesday as they seek to showcase the most damaging testimony about President Trump's contacts with Ukraine and elevate their case that he is unfit for office.After weeks of closed-door witness depositions, the stakes are high for Democrats to deliver not just in terms of drawing in..."
"1"	"Luke DeCock: After Cole Anthony's spectacular UNC debut, he's not just talented. He's indispensable."	"basketball_ncaa"	"CHAPEL HILL -- Set aside for the moment the discussion about whether Cole Anthony's debut was the most anticipated by a North Carolina freshman, or where he fits -- or will fit -- in the pantheon of Tar Heels point guards. Both topics are worthy of debate after a spectacular, record-setting beginning to his college career, and will continue to be throughout his single season in Chapel ..."
"0"	"Trump, Erdogan to meet as thorny issues stress relations"	"newsworld"	"Turkish President Recep Tayyip Erdogan and President Donald Trump will meet as relations between the two NATO allies are at their lowest point in decades, with Turkey rebuffing the U.S. and turning toward Russia on security issues and Ankara facing a Washington backlash over attacks on Kurdish civilians during its incursion into Syria last month."
"0"	"Scientists may have just worked out why we hiccup"	"health-news"	"Although hiccups seem a nuisance, scientists have discovered they may play a crucial role in our development."
"1"	"This Man's Rattlesnake Bite Is a Warning to Everyone to Take Animal Bites More Seriously"	"lifestylebuzz"	"You wouldn't think a baby rattlesnake could do so much damage, but Austin McGee knows better after almost losing his finger to one."
"0"	"United States 'very actively' asking North Korea to return to talks: South Korea"	"newsworld"	"United States 'very actively' asking North Korea to return to talks: South Korea"
"0"	"Ancient cup given to 1st marathon victor returned to Greece"	"newsworld"	"ATHENS, Greece (AP)   An ancient Greek cup awarded as a prize to the marathon winner in the first modern Olympics of 1896 has been returned to Athens from a German university. Greece's Culture Ministry said Wednesday that the 6th century B.C. pottery vessel was considered lost for decades until research in 2014 by archaeologist Giorgos Kavvadias identified it in the University of Muenster's collections."
"0"	"FBI busts $6 million iPhone and iPad counterfeit ring"	"newsus"	"The FBI busted a counterfeit ring centered on iPhones and iPads that reportedly cost Apple over $6.1 million."
"0"	"The stock market's 10-year run became the best bull market ever this month"	"markets"	"The current bull market, which started March 9, 2009, has enjoyed a whopping 468% gain for the S&P 500 through the first day of November."
"0"	"Analysis: Two Impeachments, but Two Radically Different Accusations"	"newspolitics"	"Twenty-one years later, almost to the day, another House committee will open public hearings into whether to impeach another president."
"0"	"Thanksgiving side dishes: 11 unique recipes to try this season"	"foodnews"	"While there will always be dishes you're unwilling to leave off your table, consider changing it up with these unique Thanksgiving side dishes."
"0"	"Six pretenders entering the 2019 NFL home stretch"	"football_nfl"	"Thanksgiving is just around the corner and the home stretch for the 2019 NFL regular season is essentially here."
"0"	"Top 10 storylines for college football Week 12"	"football_ncaa"	"This Saturday is going to be a blast to watch unfold. These are the biggest stories we're following in college football Week 12."
"0"	"Big celebrity money moments of the last decade"	"entertainment-celebrity"	"From bankruptcy filings and huge paydays to reaching billionaire status, read up on the most fascinating money news involving the stars from 2010 to 2019."
"1"	"Wofford vs. Clemson Football Highlights (2019)"	"football_ncaa_videos"	"-"
"1"	"NASCAR driver's car got flipped over and then stuck the landing in wild wreck at Talladega"	"racing"	"Brendan Gaughan had the best reaction to getting flipped."
"1"	"DNA Test Leads Man to Biological Parents He Thought Died 50 Years Ago: 'It Was Surreal'"	"lifestylebuzz"	"Man Finds Biological Parents He Thought Died 50 Years Ago"
"1"	"'You're no Sully': Southwest pilot Tammie Jo Shults, who landed plane safely after passenger was sucked out of window, reveals how sexist critics undermined her heroic actions and branded her a failure"	"travelnews"	"Southwest Airlines Flight 1380 pilot Tammie Jo Shults says her landing in Philadelphia on April 17, 2018 hasn't received the same attention as Captain Chesley Sullenberger's 2009 New York landing."
"0"	"Saudi Aramco takes another step toward 1st public offering"	"finance-companies"	"DUBAI, United Arab Emirates (AP)   Saudi Arabia's state-owned oil giant Aramco revealed it will sell up to 0.5% of its shares to individual investors, but in a lengthy document published late Saturday it did not disclose how much of the company will be floated when it goes public on the country's domestic exchange."
"0"	"Evansville's upset at No. 1 Kentucky illustrates college basketball's uncertain landscape"	"basketball_ncaa"	"Two weeks, two No. 1 teams falling."
"0"	"Stolen treasures still waiting to be recovered"	"markets"	"Stolen treasures worth billions of dollars are still out there somewhere. Here we take a look at some of the most incredible heists and biggest lootings still waiting to be resolved."
"0"	"Less Than 1% of People Can Ace This Shapes Brain Teaser"	"lifestyledidyouknow"	"Who knew shapes could be so confounding?! The post Less Than 1% of People Can Ace This Shapes Brain Teaser appeared first on Reader's Digest."
"0"	"Why US miners are still digging new mines as coal prices plunge"	"finance-companies"	"As coal prices tumble and bankruptcies rise, a few U.S. miners are still pushing ahead with plans to expand."
"0"	"Travel etiquette: The final word on the right to recline"	"traveltips"	""The question of the recline is like a zero-sum game," award-winning aircraft cabin designer James Lee told TPG. "The gain of one person is the pain of the person behind.""
"0"	"The environmental toll of cremating the dead"	"weathertopstories"	"As cremation becomes more common, people around the world are seeking greener end-of-life options."
"0"	"Charlize Theron Just Ditched Her Bowl Cut for a Bright Blonde Pixie"	"lifestylecelebstyle"	"She looks like a whole new woman...again!"
"0"	"A $30,000 handbag. A disastrous wine spill. And now, a country club is suing its own waiter."	"markets"	"The pink Hermès Kelly clutch was worth $30,000, a lawsuit says. But it was soiled at a "very, very, very rich country club.""
"0"	"California crisis of fires, blackouts decades in the making"	"newsus"	"The utility that serves more than 5 million electrical customers in one of the world's most technologically advanced areas is now faced again and again with a no-win decision: risk starting catastrophic deadly wildfires, or turn off the lights and immiserate millions of paying customers."
"0"	"California regulators to open inquiry into power outages"	"newsus"	"California regulators will vote Wednesday on whether to open an investigation into pre-emptive power outages that blacked out large parts of the state for much of October as strong winds sparked fears of wildfires."
"0"	"Hawaiian Airlines marks 90 years with ceremonial flight"	"travelnews"	"Hawaiian Airlines marked nearly a centenary in the air Monday, recreating its first-ever flight from Honolulu to Hilo via Kahului."
"1"	"Here are the new income tax brackets for 2020"	"finance-taxes"	"The IRS released the federal tax rates and income brackets for 2020. The seven tax rates remain unchanged, while the income limits have been adjusted for inflation."
"1"	"Ford v Ferrari: the real story"	"autosnews"	"The film about the epic Le Mans rivalry promises to be a must for car fans - and this is the real story behind it"
