"0"	"Stella McCartney Deleted a Meghan Markle Instagram Post After Followers Called Her Out"	"lifestyleroyals"	"Stella McCartney deleted a photo of Meghan Markle on Remembrance Day following backlash from Instagram followers."
"0"	"Can you answer these real Jeopardy questions about TV shows?"	"tv-gallery"	"Culling data straight from the "Jeopardy!" archives, Stacker will provide a "clue" about TV shows and then present the answer in the form of a question on the following slide. Can you answer these real "Jeopardy!" questions about TV shows?"
"0"	"Eight dead as Cyclone Bulbul smashes into India, Bangladesh coasts"	"newsworld"	"Eight people died and more than two million others spent a night huddled in storm shelters as Cyclone Bulbul smashed into the coasts of India and Bangladesh with fierce gales and torrential rains, officials said Sunday."
"0"	"Burning questions for Seahawks vs 49ers on 'Monday Night Football'"	"football_nfl"	"One of the biggest games of the season is coming your way, folks. The Seattle Seahawks will visit the San Francisco 49ers for a pivotal Monday Night Football matchup with playoff implications."
"1"	"First Drive! 2020 Shelby GT500 Is an Apex Predator, Turning Drivers Into Track Stars"	"autosreview"	"Driving the 2020 Shelby GT500 on the street, dragstrip, and road course reveals an apex predator that turns any driver into a track star."
"0"	"Why you should give up alcohol for one month: From improved sleep to a glowing complexion - this is EXACTLY what happens to your body when you ditch booze for just four weeks"	"wellness"	"Penny Adams, an Australian doctor, reveals how quickly your health (and your looks) can improve after quitting drinking for just 30 days."
"0"	"Long-term celebrity couples who won't get married"	"celebrity"	"These committed celeb couples have opted not to tie the knot."
"0"	"Actress Accuses Roman Polanski of Raping Her in 1975"	"movies-celebrity"	"'Devil Fish' actor Valentine Monnier accuses the 'Officer and a Spy' director of violently raping her in 1975 in a Friday story in Le Parisien."
"1"	"Helen Hunt Posts First Pic Following Car Accident: 'Back at Work'"	"movies-celebrity"	"The actress is back on the set of the 'Mad About You' reboot."
"0"	"Bolivia's Jeanine Anez declares herself acting president as Evo Morales vows to fight from abroad"	"newsworld"	"Bolivian senator Jeanine Anez declared herself the country's acting leader Tuesday, despite a boycott by former President Evo Morales' allies that left the legislative chamber short of the legal minimum number of lawmakers required to appoint her."
"0"	"How to Turn Getting Kicked Off an Overbooked Flight Into a Payday"	"video"	"Overbooked flights and people being kicked out are now a common headline. Luckily, there are some ways you can be compensated for this. Veuer's Johana Restrepo has more."
"0"	"Israeli farmers lament the end of Jordan land deal"	"newsworld"	"Israeli farmers lament the end of Jordan land deal"
"1"	"2020 Performance Car of the Year"	"autosresearch"	"Eleven worthy competitors, one surprising winner."
"0"	"Last known Pearl Harbor survivor in Mass. dies at 98"	"newsus"	"Massachusetts' last known survivor of the Japanese attack on Pearl Harbor that drew the United States into World War II died Tuesday at 98."
"0"	"JuJu Smith-Schuster: Jalen Ramsey's right, I'm not Antonio Brown"	"football_nfl"	"In the days leading up to Sunday's game against the Steelers, Rams cornerback Jalen Ramsey shared his opinion that Steelers wide receiver JuJu Smith-Schuster isn't the same kind of threat that Antonio Brown was when he roamed football fields rather than the social media universe. Smith-Schuster may not be Brown, but the Rams paid him [more]"
"0"	"1969 Chevrolet Camaro Z/28 emerges from a garage after sitting for over 30 years"	"autosclassics"	"It's now for sale, and in need of a full restoration."
"0"	"Meghan Markle Smudged Makeup on a Fan's Coat & He Reacted Perfectly"	"lifestyleroyals"	"We've all been there."
"0"	"What Would It Take to Unify Korea? Germany Offers Lessons."	"newsworld"	"Thirty years after the fall of the Berlin Wall, there is still much to do. That bodes poorly for any potential Korean reunification."
"0"	"Jimmy Carter 'up and walking' after hospitalization, pastor says"	"newsus"	"Former President Jimmy Carter is "up and walking" after undergoing an operation Tuesday to relieve pressure on his brain, a family pastor said on Wednesday."
"0"	"New Movies and TV Shows You'll Be Able to Cozy Up With on Netflix in November"	"movies-gallery"	"Movie watchers divide themselves into two camps when November rolls around: those who aren't ready to stop watching all the horror flicks that creeped them out around Halloween, and those who can't wait to dive into cheesy holiday movie season."
"0"	"What did travel have to do with the fall of the Berlin Wall?"	"traveltripideas"	"Find out here and discover what the fascinating German capital offers to today's travelers."
"0"	"Cat "repeatedly" breaks his friends out of animal shelter"	"newsus"	"A mischievous cat named Quilty has earned internet fame for repeatedly breaking himself out of his enclosure at a Texas animal shelter. But, he doesn't just escape   he brings all of his feline friends along with him."
"0"	"See the most expensive watch ever sold at auction"	"viral"	"A Patek Philippe watch has sold for a record $31M at a charity auction hosted by Christie's in Switzerland."
"0"	"Photos of the Day"	"newsworld"	"Our top photos from the last 24 hours."
"0"	"What's the Best Oil for Frying?"	"tipsandtricks"	"Here, we bring you a heated debate on the best frying oil, plus a community-approved winner."
"1"	"32 things we learned from Week 9 of NFL season"	"football_nfl"	"The Raiders made noise in their long-awaited return to Oakland, and the Steelers could be gearing up to make a push in the AFC North."
"0"	"San Francisco's new DA pledges not to prosecute public urination, other quality-of-life-crimes"	"newsus"	"San Francisco's newly elected district attorney has promised to not prosecute public urination and other quality-of-life crimes that have plagued the highly-priced Bay Area amid a crippling homelessness crisis affecting urban communities across California."
"1"	"Kevin Spacey Won't Be Charged in Sexual Assault Case After Accuser Dies"	"movies-celebrity"	"The Los Angeles County District Attorney's Office has formally dropped a case against actor Kevin Spacey, after the accuser died."
"1"	"Colorado St. delayed nearly 7 hours getting into Albuquerque ahead of game against New Mexico"	"football_ncaa"	"The Rams reportedly arrived around midnight local time for a game at 6 p.m."
"0"	"Kaia Gerber Attends Pete Davidson's Comedy Show in Brooklyn"	"movies-celebrity"	"Kaia Gerber Attends Pete Davidson's Comedy Show in Brooklyn"
"0"	"The Queen's Dressmaker Reveals She Uses Gin to Clean the Royal Jewels"	"lifestyleroyals"	"The Queen's Jewels Are Polished with Gin and Water"
"1"	"Patriots reportedly release kicker Mike Nugent"	"football_nfl"	"Related: NFL trade deadline tracker: Patriots rumors, news, instant analysis"
"0"	"Snow crab sells for record price in Japan"	"foodnews"	"A "five shining star" snow crab was auctioned off in Tottori, Japan for a record-breaking 5 million yen ($46,000). wide."
"1"	"Porsche launches into second story of New Jersey building, killing 2"	"newsus"	"The Porsche went airborne off a median in Toms River, causing it to crash into a red brick building."
"1"	"Five questions the second College Football Playoff rankings will answer"	"football_ncaa"	"The second College Football Playoff rankings will answer five key questions Thursday after a big weekend that saw several changes to the Lan"
"1"	"SpaceX set to launch another 60 Starlink internet satellites"	"newsscienceandtechnology"	"Initial service is expected to begin next year with global connectivity expected in 2021"
"0"	"Instagram-famous pilot reveals secrets people don't know about the job"	"travelnews"	"Maria Fagerström, a pilot and Instagram influencer, shared some things passengers don't usually know about the job."
"0"	"FAA threatened to ground 38 Southwest Airlines jets over maintenance concerns, report says"	"travelnews"	"U.S. aviation regulators "threatened" to ground 38 Boeing 737 jets operated by Southwest Airlines last month because the carrier isn't able to verify that the aircraft meet all mandatory safety standards."
"0"	"Stephen Curry calls out Michael Jordan for being a 'hater'"	"sports_news"	"While the opinion of arguably the greatest NBA player of all time is certainly noteworthy, most people disagree with Jordan."
"0"	"This little Montana town is full of Power Wagons and Mustangs"	"autosenthusiasts"	"You never know what sorts of treasures hide down that unpaved backroad."
"1"	"Amazon's $1.5 million political gambit backfires in Seattle City Council election"	"finance-companies"	"Amazon's $1.5 million political gambit backfires in Seattle City Council election"
"0"	"200 Shocking Home Photos You Have to See"	"lifestylehomeandgarden"	"We know a good DIY project when we see it, but these aren't them. Some of these are goofy, some are head scratchers and some are downright dangerous. Check these photos out, you'll definitely learn a thing or two!"
"1"	"'Tarzan' Actor Ron Ely: Actor's son allegedly killed his mother before deputies shot and killed him, sheriff's office says"	"tv-celebrity"	"The son of "Tarzan" actor Ron Ely killed his mother before he was shot and killed by deputies on Tuesday, according to the Santa Barbara County Sheriff's Office."
"0"	"'The Voice' Recap: The Top 20 Hit The Stage For Their 1st Live Performances Of The Season"	"tv-recaps"	"And we're LIVE on season 17 of 'The Voice'! The remaining 20 artists each hit the stage during the live playoffs, with hopes of landing a spot in the top 13 after America's vote."
"0"	"WWE Wrestler Jordan Myles Quits in Expletive-Filled Rant as He Brands the Company Racist"	"tvnews"	"WWE Wrestler Jordan Myles Quits, Calls Company Racist"
"0"	"Fed up with Forest Service cuts, some California towns are plotting a recreation takeover"	"newsus"	"BISHOP, Calif. - Just west of this Sierra Nevada town, thousands of people trundle out to boulders as big as billboards, carrying climbing gear and foam pads to break their inevitable falls. They park haphazardly along dirt roads, litter and smash vegetation with their crash pads. On a recent morning, there were no rangers in sight at the Buttermilk Country climbing site, and only one ..."
"1"	"Why Do Cats Meow?"	"lifestylepetsanimals"	"Cats scratch, purr, and sleep, but haven't you always wondered, "why do cats meow"?"
"0"	"Dolly Parton on 'decorating' her body with hidden tattoos"	"music-celebrity"	"Dolly Parton reveals that she has a lot of hidden tattoos."
"0"	"Formula 1 racing will be carbon-neutral by 2030"	"autosenthusiasts"	"F1 has announced it plans to reach 'net zero carbon' by 2030, and make its events fully sustainable by 2025. The post Formula 1 racing will be carbon-neutral by 2030 appeared first on Motoring Research."
"0"	"China's pork crisis is bigger than you think"	"markets"	"African swine fever in world's second largest economy has shaken global meat markets, reports Tanner Brown."
"1"	"The Best Mexican Restaurant in Your State"	"restaurantsandnews"	"Thanks to our friends at Yelp, we determined which restaurant has the best Mexican cuisine in every state."
"0"	"Historic battlefields are finding new life as parks and refuges"	"newsworld"	"The sites of war can support wildlife conservation, reduce water and air pollution, and help regulate a warming climate."
"0"	"Car of Marine linked to Virginia slaying is found in South Carolina, authorities say"	"newscrime"	"A car belonging to a U.S. Marine who allegedly deserted his post last month in North Carolina -- and has been on the run since being accused of murdering his mother's boyfriend in Virginia -- has been located in South Carolina, authorities said Wednesday."
"1"	"45 Amazing Facts About Airplanes That Will Make Your Mind Soar"	"traveltips"	"Why do they really dim the lights on a plane? What's the safest airplane seat in case a crash? These amazing flying facts might just surprise you."
"0"	"50 Things You Never Knew About Pizza"	"tipsandtricks"	"Find out every tasty fact you need to know about the world's most popular food: pizza."
"1"	"New Hampshire Couple's Adventure Ends in Mysterious Death in Texas"	"newsus"	"Seeking adventure, James Butler, 48, and Michelle Butler, 45, rented out their house in New Hampshire in the summer of 2018, bought an R.V. and set out to live anywhere but home. Their travels took them to New York, Arizona and, in October, to a campground on the South Texas coast. But then the Butlers disappeared. On Friday, the authorities said they had found their bodies buried in a shallow grave on the beach southeast of Corpus Christi...."
"1"	"Britney Spears' Abs Are on Full Display In Her Newest Workout Video"	"fitness"	"Another week, another Britney Spears workout video   and this time the pop star is combining two of her favorite routines."
"1"	"College gymnast dies following training accident in Connecticut"	"newsus"	"Melanie Coleman, 20, of Milford, was practicing on the bars when she suffered a spinal cord injury."
"0"	"Fox legal analyst Napolitano emerges as Trump critic"	"newsus"	"NEW YORK (AP)   More than two decades into his career as a commentator at Fox News Channel, Andrew Napolitano reached a milestone of sorts when he was called a "fool" on his own network. Not to his face, of course. But Tucker Carlson guest Joseph diGenova's dismissal of Napolitano for saying that soliciting campaign aid from a foreign government is against the law illustrates the awkward place that the former New Jersey Superior Court judge..."
"1"	"Texas' Best-Kept Secret: The Second-Largest Canyon in the U.S."	"traveltripideas"	""The history of this area is game changing," Phyllis Nickum says as I stare into Palo Duro Canyon, a 120-mile-long chasm slicing through the level landscape of the Texas panhandle just south of Amarillo. Palo Duro marks the southern border of Nickum's Los Cedros Ranch, a 3,000-acre spread where she raises cattle, horses, and harvests wheat and water. It's also home to "Cowgirls and Cowboys in the West," the ranch's tourist arm, which celebrates..."
"0"	"'Dancing with the Stars': Why Sean Spicer survives despite the lowest judge scores"	"tvnews"	"A 'Dancing with the Stars' voting fix designed to prevent popularity contests hasn't stopped former Trump spokesman Sean Spicer, leading to criticism."
"0"	"This Is How Long Wine Lasts After You've Opened The Bottle"	"beverages"	"How long does open wine last? Is the rule of thumb different for red and white wines? We have the answers, plus a few tricks to keep your vino tasting fresh after you've popped the cork."
"1"	"The Best Roller Coasters Around the World"	"traveltripideas"	"Today, roller coasters have become instruments of adrenaline (or torture, depending on your perspective). They break speed records, hurl passengers through space, and some are even designed to trick riders."
"0"	"Happy Friday! What if You Always Had It Off? Why Don't You?"	"markets"	"The reasons that a four-day workweek hasn't yet taken hold are varied. Some barriers are institutional and some are cultural. And then there's the most human reason of all: inertia."
"0"	"Next Ford F-150 Spied By Motor1.com Reader"	"autostrucks"	"Work continues on America's favorite truck."
"0"	"Husband, 106, and wife, 105, are named world's oldest living couple"	"lifestylebuzz"	"John Henderson joked that that secret to their longevity could be never having kids."
"1"	"Robert Forster, Oscar-Nommed Star of 'Jackie Brown,' Dies at 78"	"movienews"	"Robert Forster, a prolific character actor who was nominated for an Oscar for Quentin Tarantino's "Jackie Brown" and appeared in more than 100 films, died Friday in Los Angeles of brain cancer. He was 78."
"0"	"GOP senator defends calling Pelosi 'dumb': 'What I said was accurate'"	"newspolitics"	"Sen. John Kennedy (R-La.) defended remarks this week in which he called Speaker Nancy Pelosi (D-Calif.) "dumb," saying that his comments were "accurate.""
"1"	"Michigan apples being recalled in eight states for possible Listeria contamination"	"healthnews"	"More than 2,000 cases Michigan apples, including popular varieties like Honeycrisp, are being recalled due to potential Listeria contamination."
"0"	"I spent a day in Astoria, Queens, and saw why it's one of the world's coolest neighborhoods"	"traveltripideas"	"I spent the day eating and walking around Astoria, Queens, to understand what all the hype is about   and left with a big smile and full stomach."
"0"	"Divers salvage 100-year-old liquor from WWI shipwreck"	"travelarticle"	"A team of ocean explorers says it has retrieved cognac and liqueur from a ship that was bound for Russia when it was sunk by a German submarine in 1917."
"0"	"Stunning photos of 27 places around the world that you should visit before they disappear forever"	"traveltripideas"	"From Patagonia's glaciers to Africa's Congo Basin, visit these threatened natural wonders before they're gone."
"1"	"Obama calls out call-out culture: "That's not activism""	"newsus"	"At the annual Obama Foundation summit, the former president said he's concerned about how people approach differences in opinion, especially on social media"
"0"	"Insiders predict: NFL week 10 winners"	"football_nfl"	"We've entered the portion of the season where peeking at the playoff picture following each game wouldn't be considered too premature. The Patriots suffering their first loss makes things a bit more interesting in the AFC, while the still-undefeated 49ers face a major test this week against a division rival. We take a look at the Week 10 NFL slate, and the betting lines accompanying it."
"1"	"How to get Halle Berry's 6-pack abs without spending 4 hours a day at the gym"	"fitness"	"A combination of good nutrition, circuit training, and patience can help women sculpt their cores at any age, but it's not easy."
"1"	"States that are falling apart"	"markets"	"State and local spending account for the vast majority of infrastructure investment, and some states are doing a better job than others at maintaining roads and bridges"
"0"	"Russell Wilson vs. 49ers' No. 1 defense: Monday night's prime-time matchup"	"football_nfl"	"What Russell Wilson does to a defense can't be replicated. Certainly not in practice. For example, 49ers backup C.J. Beathard attempted to simulate the Seahawks' quarterback on the scout team last week   trying to give the defense a sense of Wilson's scrambling style   and cornerback Richard Sherman said Beathard strained his back in the process. And Wilson can't be replicated in another game. The 49ers' last game was against Arizona rookie..."
"1"	"Tua Tagovailoa proves his value to Alabama in absence against Tennessee"	"football_ncaa"	"The Crimson Tide's offense wasn't the same after the junior quarterback left with a high ankle sprain. It's clear that as Tua goes, so, too, could Alabama."
"1"	"Rare Mustang! 1968 Shelby GT500 Prototype"	"autosclassics"	"Craig Jackson has restored what is likely the rarest Shelby Mustang of all, this 1968 Shelby GT500 Lime Gold prototype."
"1"	"Questions swirl for Michigan St., Dantonio after blowout loss to Penn St."	"football_ncaa"	"After three straight losses, a trio of ugliness, questions swirl around MSU coach Mark Dantonio"
"1"	"39 bodies found in a truck container in southeast England"	"newsworld"	"Police have launched a murder investigation in southeast England after 39 people were found dead in a truck container at an Essex industrial park."
"0"	"Losing Weight Overnight: How Your Sleep Pattern Helps Promote Weight Loss"	"weightloss"	"Sleep has been found helping maintain or reduce weight but is it possible to shed some pounds overnight?"
"0"	"The Infertility Secret I Kept From My Mother"	"voices"	"Although I've always enjoyed almost sitcom-level chumminess with my mother, I've also always kept certain things secret from her. Total transparency does neither a mother nor a daughter any favors, which is why, when I was in high school, I kept my cigarettes hidden in a shoebox and threw away underwhelming report cards before she could see them. Later, after I'd moved out of the house, I continued to bury select items deep in my closet before..."
"0"	"Bucket-List Food Experiences in Every State"	"newstrends"	"America offers foodies a mega-mosaic of cuisines to explore state by state. These unique favorites provide interesting insights and tastes of the local culture. Reindeer hot dogs, persimmon pudding, Rocky Mountain oysters (which don't come from the sea), and pig ear sandwiches are just some of treats to hunt down."
"0"	"Selena Gomez and Julia Michaels Share a Kiss Before Getting Matching Arrow Tattoos"	"music-celebrity"	"Selena Gomez and Julia Michaels Get Matching Arrow Tattoos"
"0"	"Why Do Cats Meow?"	"lifestylepetsanimals"	"Cats scratch, purr, and sleep, but haven't you always wondered, "why do cats meow"?"
"1"	"Winners, losers from Patriots' shutout win over Jets on Monday Night Football"	"football_nfl"	"The New York Jets hosted the New England Patriots to cap off NFL Week 7 on Monday Night Football, but unfortunately, this game was over before it began."
"0"	"15 people who became billionaires in 2019   and 14 who lost their status in the three-comma club"	"markets"	"A proliferation of IPOs created several new billionaires in 2019, but a turbulent stock market also knocked many entrepreneurs out of the billionaire ranks."
"1"	"Navy Submarine, Missing for 75 Years, Is Found Off Okinawa"	"newsworld"	"A 75-year-old mystery has been solved, and the families of 80 American sailors lost at sea will now have closure: the U.S.S. Grayback has finally been found. It was hidden from discovery all this time by a single errant digit. The mystery began on Jan. 28, 1944, when the Grayback, one of the most successful American submarines of World War II, sailed out of Pearl Harbor for its 10th combat patrol."
"0"	"See inside a woman's 270-square-foot tiny home complete with 2 bedrooms and a walk-in closet"	"lifestylebuzz"	"The tiny house is currently in Victoria, Australia, but it was built with wheels attached, allowing owner Dolly Rubiano to move it wherever she wants."
"0"	"This 1973 Ford Capri Race Car Makes the Ultimate V-6 Sound"	"autosclassics"	"You're out of your mind if you think all V-6 engines sound bad. This one is a masterpiece."
"0"	"This is the dirtiest spot on a plane"	"video"	"Science has identified the dirtiest spot on an airplane."
"1"	"Tom Brady: When it comes to the future, my focus is on this season"	"football_nfl"	""I'm not thinking about many things beyond this week.""
"0"	"10 Gazans dead as Israel hit on militant chief sparks rocket barrage"	"newsworld"	"Israel's military killed a commander from Palestinian militant group Islamic Jihad in a strike on his home in the Gaza Strip on Tuesday, triggering exchanges of fire in a violent escalation that left another nine Gazans dead. Islamic Jihad is the second most-powerful militant group in the Gaza Strip after Hamas."
"0"	"Maya Rockeymoore Cummings, widow of Baltimore Rep. Elijah Cummings, will seek his seat in Congress"	"elections-2020-us"	"Maryland Democratic Party Chairwoman Maya Rockeymoore Cummings, the widow of U.S. Rep. Elijah Cummings, is running for her husband's seat, arguing Monday she is the best option to carry out his legacy and continue his vision. "I am, of course, devastated at the loss of my spouse, but his spirit is with me," Rockeymoore Cummings, 48, said in an interview with The Baltimore Sun. "I'm going to ...""
"0"	"Evo Morales of Bolivia Accepts Asylum in Mexico"	"newsworld"	"Evo Morales, the former president of Bolivia who resigned under pressure from street protests and the military, was granted asylum in Mexico on Monday, departing from the country at a time when it is deeply polarized and leaderless."
"0"	"US Coast Guard is searching for two missing boaters after a storm capsized their vessel"	"newsus"	"A search is underway for two missing boaters after a storm capsized a vessel off the southeastern coast of Florida on Friday, the US Coast Guard said."
"0"	"How the Mid-Engine Corvette Helped Chevy Make a Better Small Block"	"autossports"	"We went to GM's racing headquarters in Pontiac, Michigan to learn all about the C8 Corvette's LT2 V-8, and how it improves on the legendary small block."
"1"	"The ice used to protect them. Now their island is crumbling into the sea."	"weathertopstories"	"Shrinking ice, rising sea levels and fierce storms are damaging the Magdalen Islands. Residents are trying to fend off the water in some places, and retreat from it in others."
"0"	"A$AP Rocky Will Return to Sweden to Perform"	"musicnews"	"A$AP Rocky isn't wasting any time in returning to see his fans in Sweden."
"0"	"Top-Exit Exhausts Make Supercars So Much Better"	"autosenthusiasts"	"If you're going to pay for an exotic engine, you might as well hear it."
"1"	"16 thrill-seeking adventures everyone should have in their lifetimes"	"traveltripideas"	"From skydiving and rock climbing to caving and zorbing, your next extreme adventure is right around the corner."
"0"	"Dog Throws A Total Tantrum When She Realizes Mom Wants To Take The Stairs"	"lifestylebuzz"	"Aurora Angel Beste Nala has always been the friendliest dog, and loves going out on adventures and meeting new people."
"0"	"These Are The Best Harley-Davidson Motorcycles You Can Get For The Cheap"	"autosmotorcycles"	"These are the best Harleys to buy right now."
