"0"	"I'm a bartender, and here are 11 signs your drink was made improperly"	"beverages"	"You can often tell your order was made improperly from the color, taste, or presentation of a cocktail or beer. Here are the most obvious signs."
"0"	"The Sexiest Photos Ever of Our 29 Sexiest Men Alive"	"celebrity"	"Warning: lots of heat ahead"
"0"	"Stocks close higher on optimism over China trade deal"	"markets"	"Stocks ended at record highs Thursday after the world's two largest economies reportedly agreed to remove existing trade tariffs, sparking a huge rotation into equities and out of bonds."
"0"	"'One in a million' deer captured on camera in Michigan woods"	"newsus"	"Retired Michigan lawmaker and amateur photographer Steven Lindberg took pictures of a deer. That deer had three antlers."
"1"	"Ford's Big Nugget is a tiny home built inside a Transit cargo van   see inside the 4-'room' vehicle"	"autosenthusiasts"	"Ford has unveiled the Big Nugget, a camper van with four separate living spaces, including a fully functioning bathroom."
"1"	"New Jersey woman sues waiter for spilling wine on her Hermès handbag"	"newsus"	"The woman is seeking $30,000 for the light-pink luxury handbag, which has been discontinued."
"0"	"The son of a Chinese billionaire has been banned from flying first class, playing golf, buying property, or going clubbing"	"newsworld"	"Wang Sicong, the heir of Chinese real estate mogul Wang Jianlin's estimated $12.5 billion fortune, is said to have a personal debt of $21.6 million."
"0"	"Nike will look into runner Mary Cain's allegations of abuse"	"more_sports"	"Nike will look into runner Mary Cain's allegations of abuse while she was part of Alberto Salazar's training group. The runner says it reached the point where she started having suicidal thoughts and cutting herself. Cain joined the disbanded Nike Oregon Project run by Salazar in 2013, soon after competing in the 1,500-meter final at track and field's world championships when she was 17. Now 23, Cain told The New York Times in a video essay that..."
"1"	"Frustrated Antonio Brown has active morning on Twitter"	"football_nfl"	"Receiver Antonio Brown continues to wait for his next opportunity, and he continues to be justifiably frustrated by the fact that the NFL's slow-moving investigation is essentially keeping Brown suspended without pay."
"0"	"15 key questions for NFL Week 10"	"football_nfl"	"Now that we're reaching Week 10 of the NFL season, they're numerous teams start that are providing us with some interesting storylines. What's worth watching in Week 10? Here are 15 key questions."
"1"	"Here's What an 1100-HP Naturally Aspirated V8 Sounds Like"	"autosenthusiasts"	"No forced induction needed."
"0"	"Richest 1% of Americans Close to Surpassing Wealth of Middle Class"	"newsus"	"The U.S.'s historic economic expansion has so enriched one-percenters they now hold almost as much wealth as the middle- and upper-middle classes combined."
"1"	"Watch speeding SUV nearly hit family with stroller"	"viral"	"Some heart-stopping moments were captured on camera in Phoenix where a family with a stroller was crossing the street when an SUV ran a red light. Another car slammed into the SUV at the last possible second, and no one was seriously injured."
"0"	"Hey, Millennials, look out below! Gen Z may already be catching up in the salary race"	"finance-career"	"Gen Zers are closing the pay gap with millennials even though they have far less experience. They're making the most of a tight labor market."
"0"	"Protesters blockade universities, business district as chaos grips Hong Kong"	"newsworld"	"Protesters blockade universities, business district as chaos grips Hong Kong"
"0"	"Judge calls USC dad a 'thief,' gives longest prison sentence so far in college admissions scandal"	"newscrime"	"Toby MacFarlane, a California real estate executive, received six months for his actions in the college admissions scandal. It's the longest so far."
"0"	"12 Things Sex Therapists Wish You Knew"	"wellness"	"Sex therapists set the rumors straight about what you can expect, when you might want to see them and what you can do to improve your sex life."
"0"	"1990s Mall Rats Will Definitely Remember These Iconic Stores and Activities"	"lifestyledidyouknow"	"How could we forget those creamsicle smoothies from Orange Julius?"
"0"	"US consumer prices up 0.4% in October; gasoline prices surge"	"markets"	"Surging gasoline prices caused U.S. consumer prices to rise last month at the fastest pace since March."
"0"	"PG&E is offering $13.5 billion in compensation to wildfire victims"	"finance-companies"	"Bankrupt utility giant PG&E Corp. is offering $13.5 billion in compensation to the victims of wildfires sparked by its power lines as part of a restructuring plan, according to people with knowledge of the situation."
"0"	"Vanna White hosts 'Wheel of Fortune' after Sajak has surgery"	"topnews"	"LOS ANGELES (AP)   "Wheel of Fortune" host Pat Sajak had to have emergency surgery, and his longtime co-host Vanna White will fill in for him while he recovers. The show said in a statement that Thursday's taping was canceled as the 73-year-old Sajak underwent successful surgery to correct a blocked intestine. The 62-year-old White stepped in as host when taping resumed Friday for episodes that will air starting Dec. 9."
"0"	"Beat the crowds at these abandoned U.S. national parks"	"ustravel"	"These 7 spots might have lost their national status but you can still explore their rich history and natural beauty."
"0"	"35 musicians you should see live at least once in your life"	"music-gallery"	"If you have a chance to see these musicians live, you absolutely need to take the chance and grab a ticket."
"1"	"The Corvette C5.R Race Car Makes a Brutal V-8 Noise"	"autosenthusiasts"	"V-8s don't get any better than this."
"0"	"Lady Gaga Threw Shade at Her Album 'ARTPOP' & Her Fans Are Really Upset About It"	"musicnews"	"Lady Gaga's Little Monsters are rallying on Twitter against...Lady Gaga."
"0"	"China's Commerce Ministry says trade war should be ended by removing tariffs"	"markets"	"China is still calling for the U.S. to roll back tariffs as part of any "phase one" agreement."
"0"	"Marlboro Man Bob Norris dies at 90, having reportedly never been a smoker"	"tv-celebrity"	"Robert "Bob" Norris, who played the iconic Marlboro Man for more than a decade in the '60s, has died at his Colorado ranch at 90. Norris landed the high-profile ad campaign for the Philip Morris cigarette brand by happenstance, as his son, Bobby Norris, told the local CBS affiliate, KKTV."
"0"	"Clemson routs NC State, claims ACC Atlantic title"	"football_ncaa_videos"	"Clemson vs. NC State: For the fifth consecutive year, the Clemson Tigers have won the ACC Atlantic Division and will head to the ACC Championship game."
"0"	"What Happens When a Plane Collides with a Flock of Birds?"	"travelnews"	"It's a bird...it's a plane...it's a midair nightmare?"
"1"	"If You're Not Doing This in Plank, You're Not Working Your Abs Effectively"	"fitness"	"Three minutes on the rower followed by quickly hopping on the ground to hold one minute of plank - that was part of my CrossFit workout today."
"0"	"Frackers Prepare to Pull Back, Exacerbating a Slowdown in U.S. Oil Growth"	"markets"	"After pushing U.S. oil and natural-gas production to record levels, some shale companies are doing the unthinkable: They are planning to pump less."
"1"	"Former NFL lineman Justin Bannan arrested for attempted murder"	"football_nfl"	"Former NFL defensive lineman Justin Bannan is sitting in a Colorado jail, on charges of suspicion of attempted first-degree murder."
"0"	"The biggest travel trends of the decade"	"travelnews"	"A lot can change in a decade, especially as our planet heats up and concerns for the environment loom large. With 2020 just around the corner, here's a look back at some of the top travel trends of the past decade. From taking it slow to taking selfies, which trends have you been following?"
"0"	"How to Deal With Your Partner's Annoying Habits"	"lifestylefamilyandrelationships"	"The toilet seat that's up. The empty milk carton in the fridge. The socks under the bed. Sigh. But you do things that annoy your partner, too and small changes could make a big difference for both of you."
"1"	"'The Voice': Night Three of Battles Ends on a Cliffhanger"	"tv-recaps"	"Kelly Clarkson successfully stole an artist."
"1"	"Former NBA first-round pick Jim Farmer arrested in sex sting operation"	"basketball_nba"	"Farmer, 55, was booked for trafficking a person for a commercial sex act."
"0"	"Celebrity plastic surgery transformations"	"entertainment-celebrity"	"See how stars like Sharon Osbourne, Cardi B, Pauly D, Kim Zolciak-Biermann, Gisele Bundchen, Kanye West and others have altered their looks."
"1"	"Cassius Winston posts heartfelt message to late brother on Instagram"	"basketball_ncaa"	"Remarkably, Winston was able to play in Sunday's game just a day after his brother passed. The senior played 26 minutes and registered a double-double with 17 points and 11 assists."
"0"	"Fans are divided after Drake was revealed as a surprise festival headliner, booed off stage"	"musicnews"	"Fans are divided after the audience at Tyler, The Creator's Camp Flog Gnaw festival booed Drake, who was revealed to be the surprise headliner."
"0"	"Dramatic Footage Shows Plane Skidding Off Runway at O'Hare Airport in Chicago"	"viral"	"A plane slid off the runway due to icy conditions at Chicago's O'Hare International Airport on Monday morning, November 11, as cold weather swept across the state. American Airlines told Storyful that flight 4125, which was traveling from Greensboro, North Carolina, to Chicago, slid off the runway upon landing at around 7.45 am on Monday as a result of icy conditions. The airline said no injuries were reported and all 38 passengers and three crew members were transported to the terminal at O'Hare airport safely. Local media reported that the incident prompted a ground stop at the airport, halting all landings until around 8.30 am. Airlines at O'Hare and Midway airports canceled hundreds of flights on Monday as the National Weather Service issued a winter weather advisory for the state. Credit: Joseph Lian via Storyful"
"0"	"America's Most and Least Popular Senators"	"newspolitics"	"Senators represent the interests of the residents of their home state on Capitol Hill by crafting and voting on new laws and by approving or rejecting cabinet and judicial nominations made by the president."
"0"	"Oil rises after OPEC's Barkindo says U.S. shale growth may slow in 2020"	"markets"	"Oil rises after OPEC's Barkindo says U.S. shale growth may slow in 2020"
"0"	"Best Dive Bar in Every State"	"beverages"	"The real challenge in compiling a list of America's best dive bars comes in defining just what a dive bar is and isn't."
"1"	"Halloween snowstorm wallops the Midwest"	"weathertopstories"	"A winterlike storm continued to unload snow over the Midwest on Thursday, making Halloween feel more like Christmas in many areas."
"0"	"Le'Veon Bell's advice to Antonio Brown: Try not to do too much over social media"	"football_nfl"	"Former Steelers teammates Antonio Brown and Le'Veon Bell have seen their careers unfold in very different ways. Bell, who now plays for the Jets, told #PFTPM on Tuesday that he has not kept in touch with Brown, who has played for and been released by both the Raiders and Patriots in 2019. Still, Bell offered [more]"
"0"	"Top Putin aide named by MH17 airliner investigators"	"newsworld"	"An international investigation into the 2014 downing of Malaysia Airlines flight MH17 on Thursday released a series of phone intercepts, including one between a top aide to Russian President Vladimir Putin and pro-Russian rebels accused in the crash."
"0"	"Steph Curry will need a second surgery, expects to return this season"	"basketball_nba"	"The star guard updated the media on his status Monday night."
"0"	"Amazon's $1.5 million political gambit backfires in Seattle City Council election"	"finance-companies"	"Amazon's $1.5 million political gambit backfires in Seattle City Council election"
"0"	"Barn Find: Large Collection Of Pontiac Firebirds Uncovered"	"autosclassics"	"A total of nine Firebirds were discovered in Minnesota and are now up for auction."
"1"	"9 Famous People You Probably Didn't Know Had Epilepsy"	"medical"	"Margaret Lenker lists nine famous people who had epilepsy."
"0"	"California teen killed in gang-related shooting, 2 people charged with murder, police say"	"newscrime"	"A man and a teenager suspected of killing a 17-year-old boy in a gang-related shooting in California on Friday night are in custody facing murder charges, police told Fox News on Sunday."
"1"	"Former US Senator Kay Hagan dead at 66"	"newspolitics"	"Former U.S. Sen. Kay Hagan, a one-time Capitol Hill intern who went on to become North Carolina's first Democratic female senator, died Monday at her Greensboro home. She was 66."
"0"	"Japan Wants You To Stop Buying All Its Skyline GT-Rs"	"autosenthusiasts"	"In recent years, no thanks to the sudden availability of interesting Bubble Era and Gran Turismo generation cars being legally available in the United States, there's been a mass exodus of iconic cars from the domestic market."
"0"	"Trainers Share The Best Ways To Get Abs And Keep Them"	"fitness"	"Spoiler alert: It's a lot of work. "It can take anywhere from three months to a year to get a six-pack, and it's not just about doing a ton of abs exercises," says one pro."
"0"	"Australia bushfires: Smoke from blazes can be seen in New Zealand"	"newsworld"	"Thousands of people are in the path of deadly Australian bushfires that have produced clouds of smoke seen as far away as New Zealand."
"0"	"Best all-inclusive resorts in the world"	"traveltripideas"	"Certain vacation destinations are known for having a wealth of all-inclusive resorts (the islands of Fiji and Jamaica come to mind). But resorts that wrap fun, food and drinks into a convenient package can be found all over the world. From a Cancun family favourite and an all-inclusive ski resort in the Alps to a far-flung locale that caters to scuba divers, you'll find a bit of everything on this roundup of the best all-inclusive resorts in the world."
"0"	"​'My Annoying Cough Turned Out To Be Lung Cancer'"	"ads-lung-health"	""As soon as I was coming out of anesthesia, he told me it was cancerous.""
"0"	"Trump Jr's 'Triggered' debuts at No. 1 on NY Times bestselling list"	"newspolitics"	"Donald Trump Jr.'s first book "Triggered: How the Left Thrives on Hate and Wants to Silence Us" debuted at #1 on The New York Times nonfiction bestseller list on Wednesday."Triggered," which was officially released on Tuesday, outlines Trump Jr.'s political views while also discussing President Trump's campaign and administration.The top-ranking comes amid a national book tour from the president's oldest son that included a contentious stop at..."
"0"	"8 Secret Spots You Never Knew Existed in Disney Parks"	"traveltips"	"Make your next trip even more magical."
"1"	"How Much Power Does the 2020 Chevrolet Corvette Really Make? We Take it to the Dyno and Find Out"	"autosenthusiasts"	"A lot more, it turns out"
"1"	"Michigan sends breakup tweet to Notre Dame as series goes on hold"	"football_ncaa"	"Parting is such sweet sorrow, say the Wolverines."
"1"	"Watch Gordon Ramsay Take a Dozen of His Hottest Cars to the Track"	"autosenthusiasts"	"The celebrity chef brought his McLaren Senna, Ferrari LaFerrari, and many more, saying he hadn't seen all of his cars in the U.K. on the track before."
"1"	"The world's largest nuclear power producer is melting down"	"markets"	"On the shores of the English channel in Normandy, engineers are struggling to fix eight faulty welds at a plant that's supposed to showcase France's savoir faire in nuclear power."
"0"	"Shortage of Gulf Oysters Threatens Southern Culinary Heritage"	"foodnews"	"Flooding along the Mississippi River this spring and summer killed oysters by the millions."
"1"	"Charles Rogers, former Michigan State football, Detroit Lions star, dead at 38"	"football_nfl"	"Charles Rogers, the former Michigan State football star whom the Detroit Lions selected with the second overall pick in 2003 NFL draft, has died."
"0"	"2019 CMA Awards: See the best photos from inside and backstage"	"cma-awards"	"2019 CMA Awards: See the best photos from inside and backstage"
"0"	"This Is What the 2020 Toyota Supra Should've Looked Like From the Start"	"autosenthusiasts"	"That wing should be standard on every Supra. The fact that it isn't is a tragedy."
"0"	"56 Hottest Holiday Gifts from Amazon"	"shop-holidays"	"We poured through Amazon's bestseller and most-wished-for lists to find the perfect gift for just about anyone in your life."
"0"	"A body-language expert says Meghan Markle is "politely disconnecting" from the public, and honestly, we would too"	"lifestyleroyals"	"Can we blame her? Meghan Markle is supposedly "politely disconnecting" from the public as seen in her body language, and girl, you do you."
"0"	"State Trooper Stops Banana Car Driver, Gives Him $20 Instead of a Ticket"	"autosenthusiasts"	"Is it a crime to be this ridiculous? Not in Kalamazoo, Michigan, where a 1993 Ford F-150 4x4 was turned into . . . this."
"0"	"How to Smoke a Turkey"	"tipsandtricks"	"The swoonworthy results and surprising ease of cooking an entire turkey over a wood-infused fire should make you rethink cranking up the oven."
"0"	"U.S.-born ISIS bride thinks she 'deserves a second chance'"	"newsus"	"Hoda Muthana says in an interview with NBC News that she worries for the future of her 2-year-old son, Adam, and wants to return home to Alabama."
"0"	"11 Fine-Dining Etiquette Rules You've Probably Broken Your Whole Life"	"videos"	"11 Fine-Dining Etiquette Rules You've Probably Broken Your Whole Life"
"0"	"Democrat Joe Biden proposes $1.3 trillion U.S. infrastructure plan"	"newselection2020"	"Democrat Joe Biden would invest $1.3 trillion over a decade on electric car charging stations, high-speed railroads, clean-energy research and other public infrastructure if he is elected U.S. president next year, his campaign said on Thursday."
"1"	"Two dead after small plane crashes into SUV in Florida: Police"	"newsus"	"Two people have died after a small plane crashed into an SUV while trying to make an emergency landing on Thursday in Florida, authorities said."
"0"	"This 'new' strain of HIV is actually a good thing"	"health-news"	"For starters, the "new" strain is… not new."
"0"	"Greta Thunberg sets sail from U.S. to Spain for climate summit"	"newsworld"	"She refuses to travel by plane to avoid contributing to a heavy carbon footprint"
"1"	"CTU Says Mayor 'Dashed Hopes' for Quick Settlement"	"newsus"	"It appears the Chicago Teachers Union strike won't end any time soon after Mayor Lori Lightfoot sent the union a letter on Monday that CTU President Jesse Sharkey said "dashed hopes" for a quick settlement. In the letter,"
"0"	"Celebrity chef 'Salt Bae' will pay $230,000 to four ex-servers"	"foodnews"	"Salt Bae must pay. Four former waiters have taken a $230,000 slice out of the Instagram-famous chef after he allegedly fired them from his Manhattan steakhouse for asking questions about tips. As part of the deal, a notice about workers' rights will be posted in the Nusr-Et restaurant on W. 53rd St. in Turkish and English. Salt Bae, whose real name is Nusret Gokce, agreed to the settlement on the eve of trial before a National Labor Relations..."
"0"	"Protesters seize state-run media in Bolivia as tensions soar"	"newsworld"	"Opposition demonstrators in Bolivia overran two state-run media outlets and forced them off the air Saturday and some police stopped guarding the square where President Evo Morales' palace is located, as tensions remained high after a disputed election."
"0"	"40 Restaurant Meals You Should Never Eat After 40"	"nutrition"	"As you age, you're at a higer risk for heart disease, diabetes, and muscle loss. Here's a list of 40 restaurant dishes to avoid after 40."
"0"	"Mulvaney Seeks Court Guidance Over House Demand for Testimony"	"newspolitics"	"President Donald Trump's acting Chief of Staff Mick Mulvaney asked a judge to determine whether he must comply with a House Intelligence committee subpoena to testify in its impeachment hearings."
"0"	"Most Unsafe Cars on the Road"	"autosresearch"	"Thanks to improvements in both vehicle and highway safety standards, driving deaths in the United States remain close to their lowest point in decades."
"0"	"AP: Thousands face life-threatening floods from aging dams"	"newsus"	"On a cold morning last March, Kenny Angel got a frantic knock on his door. Two workers from a utility company in northern Nebraska had come with a stark warning: Get out of your house. Just a little over a quarter-mile upstream, the 92-year-old Spencer Dam was straining to contain the swollen, ice-covered Niobrara River after an unusually intense snow and rainstorm."
"1"	"18 of the most iconic record-breaking songs in pop music history"	"music-gallery"	"What do "White Christmas" and "My Life Would Suck Without You" have in common? They've have achieved a spot in pop music history by breaking records."
"0"	"Rebirth, angst and the 'new normal' of California wildfires"	"newsus"	"California has long been seen as a golden land of opportunity. But this "new normal"   fires of enormous size and ferocity   is making everyone edgy and causing some to flee."
"0"	"'Monday Night Football' commentator under fire after belittling criticism of 49ers kicker for missed field goal"	"football_nfl"	"Joe Tessitore called out 49ers kicker Chase McLaughlin after he shanked a potential game-winning kick in San Francisco, and some fans weren't happy."
"0"	"12 Military-Themed TV Shows to Binge-Watch on Veterans Day"	"tv-gallery"	"From "M*A*S*H" to "JAG""
"1"	"Jane Fonda, Rosanna Arquette, Catherine Keener arrested at climate change protest: 'Women bear the brunt'"	"tv-celebrity"	"Jane Fonda was at the forefront of another climate strike as she hosted a fourth "Fire Drill Friday" outside of the Capitol Building before getting arrested for the fourth consecutive week. The 81-year-old actress was joined by fellow actors Rosanna Arquette and Catherine Keener to specifically address the burden that women carry when it comes to climate change and their role in fighting for the Green New Deal."
"0"	"U.S. proposes denying work permits to asylum seekers who enter illegally"	"newsus"	"U.S. proposes denying work permits to asylum seekers who enter illegally"
"0"	"Funny celeb pics for November 2019"	"humor"	"Heidi Klum ain't no keto queen and more celeb pics that will make you LOL."
"0"	"Groom Makes The Most Heartfelt Vows To His 9-Year-Old Stepdaughter"	"lifestylebuzz"	"Jimmy Gisondi made not one, but two sets of vows on his wedding day: first to his new wife, Kelsea, then to his new stepdaughter, Olivia."
"0"	"The Day in Sports: Sunday, November 10, 2019"	"more_sports"	"The Day in Sports: Sunday, November 10, 2019"
"1"	"'Wheel Of Fortune' Guest Delivers Hilarious, Off The Rails Introduction"	"tvnews"	"We'd like to solve the puzzle, Pat: Blair Davis' loveless marriage? On Monday, "Wheel of Fortune" welcomed as a new contestant trucking business owner Blair Davis, who offered a biting introduction for himself. When host Pat Sajak asked the man from Cardiff, California, about his family, Davis plunged into one of the darkest personal summaries the show has likely ever heard. "I've been trapped in a loveless marriage for the last 12 years to an...""
"1"	"10 farm-fresh pickup trucks worth buying before values rise"	"autosclassics"	"Pickup a bargain before it's too late…"
"0"	"Rare 1996 Chevrolet Corvette Grand Sport Convertible Up For Sale"	"autosclassics"	"Here's your chance to buy one of the rarest Corvette models ever built."
"0"	"Watch: Cowboys announce black cat as starter for 'SNF'"	"football_nfl"	"It was a pretty hilarious move by the Cowboys."
"0"	"Shooting investigation in Portland Taco Bell parking lot"	"newsus"	"Police shut down Northeast Broadway at 8th Avenue around 9:45 Friday night for a shooting investigation. One person, believed to be the victim in the case, showed up at a local hospital a short time later."
"0"	"ICE is ignoring California's ban on private immigrant detention centers"	"newsus"	"LOS ANGELES - Last month, California became the first state to kick out privately run immigrant detention centers. A new law that also bans private prisons prohibits new contracts or changes to existing ones after Jan. 1 and phases out existing detention facilities entirely by 2028. But on Oct. 16, five days after Gov. Gavin Newsom signed Assembly Bill 32 into law, U.S. Immigration and Customs ..."
"0"	"The 22 Wildest Celebrity Hair Transformations of the Last Decade"	"lifestylebeauty"	"The 2010s have seen a ton of celebrity hair changes, but who's had the best hair transformations of the decade?"
"0"	"People Pull Together To Save A Frightened Dog Loose On Highway"	"lifestylebuzz"	"What began as a frightening predicament for a poor pup trapped on a busy roadway in the end revealed something truly special: Humanity at its finest. Twitter/TobyTinelli On Sunday, Toby Tinelli and his wife were driving on a highway in Houston, Texas, when they suddenly spotted a dog loose and scared among the cars. Without hesitating, all the drivers around Tinelli made the dog's well-being their top priority   forming a protective blockade..."
"0"	"Stop! Read This Guide Before You Buy an Air Fryer."	"tipsandtricks"	"Shopping for air fryers? Or maybe air fryer toaster ovens? Our air fryer buying guide will help you find the perfect appliance for your needs."
