"1"	"Republicans urge Bevin to provide proof of election fraud or concede"	"newspolitics"
"1"	"11-month-old clinging to life after being shot four times in back seat of car"	"newscrime"
"1"	"Who has been the best and worst coach in each Power Five conference this season?"	"football_ncaa"
"1"	"Longtime pastor of Baptist church in Chicago resigns after confessing he sexually abused a relative decades ago: 'I own my sin'"	"newsus"
"1"	"College football Week 9: Picks and preview"	"football_ncaa"
"1"	"Zimbabwean girl, 11, says she wrestled crocodile, gouged out eyes to save 9-year-old friend: report"	"newsworld"
"1"	"Precious metals get crushed as end-of-the-world trade implodes"	"markets"
"1"	"Opinion: Colin Kaepernick is about to get what he deserves: a chance"	"football_nfl"
"1"	"AP Top 25: Navy gives AAC 4 teams, 3rd-most by conference"	"football_ncaa"
"1"	"I tried McDonald's, Burger King, Wendy's cheapest and most expensive burgers"	"restaurantsandnews"
"1"	"Aspen Ladd's suspension for scary weight cut lifted after showing focus on 'real weight loss'"	"mma"
"1"	"The biggest flaw of every top 25 college football team"	"football_ncaa"
"1"	"Inside Megyn Kelly's Fight Against NBC Amid New Matt Lauer Allegations"	"tvnews"
"1"	"Charles Barkley savagely tells Klay Thompson the Warriors won't make the playoffs"	"basketball_nba"
"1"	"Here's how rising car prices can hurt average Americans"	"personalfinance"
"1"	"Cracker Barrel Has Two Thanksgiving Options This Year, and They Both Sound Delicious"	"restaurantsandnews"
"1"	"Over 300 rats extracted from ratty 1990s Dodge Ram van"	"autosclassics"
"1"	"10 Amazing Things at Walmart You Can't Buy Anywhere Else"	"shop-all"
"1"	"6 surprising numbers from college football coaches salaries report"	"football_ncaa"
"1"	"Iowan convicted of murder claims his life-sentence was served once he died, was revived in medical emergency. The court disagrees."	"newscrime"
"1"	"How Do Cats Automatically Know How to Use a Litter Box?"	"lifestylepetsanimals"
"1"	"If You're Trying to Cut Down on Sugar, Use This Simple Ice Cube Hack"	"nutrition"
"1"	"Bill Murray Applied To Work At An Airport P.F. Chang's And They're Totally Down To Hire Him"	"foodnews"
"1"	"Cell Phone Forces Flight Diversion to Ireland"	"travelnews"
"1"	"States that are falling apart"	"markets"
"1"	"Amari Cooper underwent MRI on knee, won't practice today"	"football_nfl"
"1"	"Packers' Za'Darius Smith ticketed for marijuana in car"	"football_nfl"
"1"	"10 Unexpected Ways To Bond With A Cat"	"lifestylebuzz"
"1"	"10 biggest disappointments from college football Week 7"	"football_ncaa"
"1"	"14 Weird Rules Fast-Food Employees Have to Follow"	"restaurantsandnews"
"1"	"Brad Biggs: Where do Bears turn if Trubisky can't turn it around?"	"football_nfl"
"1"	"Jets' Osemele has shoulder surgery in 'unexcused absence'"	"football_nfl"
"1"	"Boise State AD 'kinda get(s)' 2-loss Tide getting picked for playoff over undefeated Broncos"	"football_ncaa"
"1"	"Most compelling matchups in college football Week 11"	"football_ncaa"
"1"	"Facing Investigation, Giuliani Needed a Lawyer, but Firms Stayed Away"	"newspolitics"
"1"	"I moved from Canada to the US, and 3 money differences surprised me"	"personalfinance"
"1"	"Tom Brady explains why he's angry at this point in the football season"	"football_nfl"
"1"	"Stanford, UCLA playing game in an empty stadium"	"football_ncaa"
"1"	"Why President Trump's kids are probably celebrating his move to Florida"	"personalfinance"
"1"	"The Permian Basin is facing its biggest threat yet"	"markets"
"1"	"Report: Ezekiel Elliott's dad investigated after police shoot wild cat near his home"	"football_nfl"
"1"	"For 53 million Americans in low-wage jobs, a difficult road out"	"markets"
"1"	"State Trooper Stops Banana Car Driver, Gives Him $20 Instead of a Ticket"	"autosenthusiasts"
"1"	"Discover the abandoned circus-themed house cloaked in secrets"	"lifestyledidyouknow"
"1"	"Can You Spot the One Image That Is Not Like the Others?"	"lifestylebuzz"
"1"	"Stocks close lower ahead of Fed's next interest rate decision"	"markets"
"1"	"A Los Angeles mansion once listed for $250 million has finally sold for 62% off after 3 years. Take a look inside what was once America's most expensive home."	"finance-homesandpropertysection"
"1"	"How the Panthers will approach their breakup with Cam Newton before 2020 season"	"football_nfl"
"1"	"The best and worst states to live in"	"finance-real-estate"
"1"	"South Carolina teen gets life in prison for deadly elementary school shooting"	"newsus"
"1"	"Former US Senator Kay Hagan dead at 66"	"newspolitics"
"1"	"Steelers cut Donte Moncrief, gain compensatory pick"	"football_nfl"
"1"	"Most Overrated College Football Teams After 9 Weeks: Nebraska, Army, Texas, and Others"	"football_ncaa"
"1"	"15 key questions for NFL Week 7"	"football_nfl"
"1"	"With season halfway over, let's take a look at playoff picture"	"football_ncaa"
"1"	"How Each Zodiac Sign Knows They've Found Their Soulmate"	"lifestylehoroscope"
"1"	"Trent Williams fails physical, experiencing discomfort with helmet"	"football_nfl"
"1"	"Best all-inclusive resorts in the world"	"traveltripideas"
"1"	"America's Priciest Real Estate Listings"	"finance-real-estate"
"1"	"Jets waive Luke Falk"	"football_nfl"
"1"	"Predicting the College Football AP Top 25 Poll for Week 11: Georgia Climbs After Big Win"	"football_ncaa"
"1"	"Huge seized car collection nets $8.2 million at largest ever U.S. Marshals auction"	"autosnews"
"0"	"Nine-year-old child genius to graduate from Dutch university"	"lifestylebuzz"
"1"	"Raiders trade third-year CB Gareon Conley to Texans for third-round pick"	"football_nfl"
"1"	"Woman Finds A Giant Wild Snake Just Chilling In Her Bed"	"lifestylebuzz"
"1"	"NFL midseason winners and losers: MVP race is wide open, 49ers surprise, kickers struggle"	"football_nfl"
"1"	"Yardbarker's Week 8 NFL picks, game previews"	"football_nfl"
"1"	"'Morbidly Obese' Cat Goes Viral for Refusing to Run on Underwater Treadmill in Hilarious Clip"	"lifestylebuzz"
"1"	"Trade wars, climate change plunge the family farm into crisis. Is it an endangered American institution?"	"newsus"
"1"	"Where do the Yankees go from here? Big decisions that New York must address this offseason"	"baseball_mlb"
"1"	"NFL world reacts to officials handing Packers win over Lions"	"football_nfl"
"1"	"This Foster Kitten Smiling for a Photo Will Make Your Friday"	"lifestylebuzz"
"1"	"Here's Why Harry and Meghan's Latest Interview Could Be the Final Straw for the Royal Family"	"lifestyleroyals"
"1"	"The most underrated players in the first half of the 2019 season"	"football_nfl"
"1"	"Biden on being denied communion: 'I'm a practicing Catholic, I practice my faith'"	"newspolitics"
"1"	"How much do you really need to save in an emergency fund? Probably not as much as you think"	"personalfinance"
"1"	"50 Things From the '90s That Could Make You Rich Today"	"lifestylesmartliving"
"1"	"Yardbarker's Week 9 NFL picks, game previews"	"football_nfl"
"1"	"Watch: 'The View' Versus Donald Trump Jr.: Loud, Low Blows, Politics, Scandals And Great TV"	"tvnews"
"1"	"The 2019 NFL Season"	"football_nfl"
"1"	"$166 water could dictate international iceberg law"	"markets"
"1"	"Antonio Brown is exposing Roger Goodell's unchecked power to shut players out of the NFL"	"football_nfl"
"1"	"Amazing houses for sale in surprising places"	"finance-real-estate"
"1"	"A New Zealand man accidentally bought 1,000 chickens online for $0.96"	"newsworld"
"1"	"A terrible pandemic is killing pigs around the world, and US pork producers fear they could be hit next"	"markets"
"1"	"Five unintended consequences of Trump's Syria withdrawal"	"newsworld"
"1"	"18 things to avoid at the dollar store"	"finance-savemoney"
"1"	"Randy Moss takes a perfect dig at Joe Buck's infamous 'disgusting act' call"	"football_nfl"
"0"	"The Real Reason McDonald's Keeps the Filet-O-Fish on Their Menu"	"restaurantsandnews"
"1"	"The Camp Fire's 85th victim: Nearly a year later, authorities still have no explanation"	"newsus"
"0"	"30 Best Black Friday Deals from Costco"	"shop-holidays"
"1"	"America's middle class is addicted to a new kind of credit"	"personalfinance"
"1"	"The Effect of Illinois' Upset Went Far Beyond Wisconsin"	"football_ncaa"
"1"	"Downturns in these four counties have foreshadowed past recessions. What are they doing now?"	"markets"
"1"	"College hands out coasters that test for date rape drugs"	"newsus"
"1"	"Giuliani Is Drawing Attention to Hunter Biden's Work in Romania. But There's a Problem."	"newspolitics"
"1"	"'Rich Dad, Poor Dad' Robert Kiyosaki says this is 'the only rule' for getting and staying rich"	"finance-saving-investing"
"1"	"The ice used to protect them. Now their island is crumbling into the sea."	"weathertopstories"
"1"	"50 Facts So Genius You'll Feel Like Einstein"	"lifestyledidyouknow"
"1"	"The 10 best NFL trade deadline deals of all-time"	"football_nfl"
"1"	"A controversial comedian and a former child star are eliminated on 'Masked Singer'"	"popculture"
"1"	"Missing West Point cadet found dead, officials say"	"newsus"
"1"	"Trump administration to pay $846G to California over failed bid to add citizenship question to census"	"newsus"
"1"	"Grading each NFL team at the halfway mark of the season"	"football_nfl"
"1"	"Corporate earnings are up. Markets are up. And yet analysts keep saying the R-word"	"markets"
"1"	"Dow closes 300 points higher on new trade deal with China"	"markets"
"1"	"Trump quietly cut legal immigration by up to 65%"	"newsus"
"1"	"1 dead, 10 sickened after multistate Salmonella outbreak linked to ground beef"	"newsus"
"0"	"Taylor Swift Says Scooter Braun, Scott Borchetta Are Blocking Her From Playing Old Hits at AMAs"	"musicnews"
"1"	"The one restaurant you need to visit in every state"	"restaurantsandnews"
"1"	"'Go back to work': Outcry over deaths on Amazon's warehouse floor"	"finance-companies"
"1"	""I was a passport to this man": Child marriage loopholes persist in U.S."	"newsus"
"1"	"No, I'm Not Missing Out On The 'Ultimate Love' Because I Chose Not To Be A Mom"	"voices"
"1"	"Kendall Jenner Wore the Tiniest Dress to Go Jewelry Shopping"	"lifestylebuzz"
"1"	"Opinion: Panthers star Christian McCaffrey faces huge test as 49ers' 'Steel Curtain' looms"	"football_nfl"
"1"	"One Supreme Court case could change the whole way the courts handle abortion cases"	"newsus"
"1"	"Stocks close higher on optimism over China trade deal"	"markets"
"1"	"Hawk Can't Understand Why This Little 'Bunny' Isn't Scared Of Him"	"lifestylebuzz"
"1"	"Climate change has finally caught up to this Alaska village"	"weathertopstories"
"1"	"Bill O'Reilly said he doubts mom works 4 jobs. She says he 'doesn't have a clue'"	"personalfinance"
"1"	"Urban Meyer "absolutely" would take Cowboys job"	"football_nfl"
"1"	"5 things that need to happen this weekend for maximum college football CHAOS"	"football_ncaa"
"1"	"Monday night's win over the Giants emblematic of bigger issue for Cowboys"	"football_nfl"
"1"	"Is the World Economy Sliding Into First Recession Since 2009?"	"markets"
"1"	"Yardbarker's NFL Week 8 game-by-game analysis, grades"	"football_nfl"
"1"	"Danica Patrick shared a sweet message congratulating Aaron Rodgers on perfect game"	"football_nfl"
"1"	"New images capture missing college student on night she vanished"	"newsus"
"1"	"College football hot seat: Who is in danger of losing their job?"	"football_ncaa"
"1"	"Burning questions for Lions vs Packers on 'Monday Night Football'"	"football_nfl"
"1"	"Nolan Ryan leaves advisory role, won't return as Astros shuffle front office"	"baseball_mlb"
"1"	"Week 9 College Football Playoff Picture: Four in, two out and four to watch"	"football_ncaa"
"1"	"Heidi Klum's 2019 Halloween Costume Transformation Is Mind-Blowing   But, Like, What Is It?"	"lifestylebuzz"
"1"	"Ben Affleck has a new girlfriend after using the Raya dating app, plus more celeb love life news for late October 2019"	"celebrity"
"1"	"Insiders predict: NFL Week 9 winners"	"football_nfl"
"1"	"This Dreaded $8,000 Home Renovation Offers the Highest Return on Investment, According to Realtors"	"finance-real-estate"
"1"	"Walmart Sparks Panic and Confusion in the Dish-Soap Aisle"	"finance-companies"
"1"	"6 NFL teams that should have a fire sale at the trade deadline"	"football_nfl"
"1"	"Texas inmate set to be executed for 2002 strangling death"	"newscrime"
"1"	"China wants tariffs cut to enable $50 billion imports from U.S.- Bloomberg"	"markets"
"1"	"10 questions you should always ask at an open house"	"finance-real-estate"
"1"	"Pirates kidnap nine crew members from cargo ship off coast of Benin"	"newsus"
"1"	"STDs at record high in the U.S."	"peopleandplaces"
"0"	"Treasury yields tick higher amid uncertainty over US-China trade deal"	"markets"
"1"	"Clippers set bad precedent resting Kawhi Leonard against Bucks"	"basketball_nba"
"1"	"Report: Mariota, Winston 'likely' done as 'franchise leaders'"	"football_nfl"
"1"	"Gronkowski suggests that he'll unretire if NFL legalizes CBD"	"football_nfl"
"1"	"Resort fees stack up at Las Vegas and US hotels. Could new bill help?"	"travelnews"
"1"	"Trump Tax Return Case Confronts Supreme Court With a Momentous Choice"	"newspolitics"
"1"	"30 American ghost towns"	"finance-real-estate"
"0"	"'This tarnishes everything': Astros cheating allegations have baseball world demanding punishment"	"baseball_mlb"
"1"	"Packers WR Adams ruled out vs. Raiders"	"football_nfl"
"1"	"Former Cowboys Pro Bowler Marion Barber arrested on criminal mischief charges"	"football_nfl"
"1"	"David Bakhtiari was lobbying ref before decisive calls"	"football_nfl"
"1"	"Behind-the-scenes facts about 'Sesame Street'"	"lifestyledidyouknow"
"1"	"Outer Banks storms unearth old shipwreck from 'Graveyard of the Atlantic'"	"newsus"
"1"	"Amari Cooper wants to play through latest injury against Eagles"	"football_nfl"
"1"	"Fox News contributor: 'Most likely' outcome is Trump doesn't run in 2020"	"newspolitics"
"1"	"Lions fans mock NFL refs with clever billboards in Detroit"	"football_nfl"
"1"	"12 Brain Teasers That Will Test How Much You Actually Know"	"lifestyledidyouknow"
"1"	"Felicity Huffman Is Scheduled to Be Released from Prison on October 27 After Serving 13 Days"	"newsus"
"1"	"These Are the Hardest Questions on the U.S. Citizenship Test"	"lifestyledidyouknow"
"1"	"Six things we learned from Saturday's MLB postseason action"	"baseball_mlb"
"1"	"Bills waive Tyrel Dodson after completing six-game suspension"	"football_nfl"
"1"	"Bag Explodes While Being Loaded On Volaris Flight At Midway Airport"	"travelnews"
"1"	"Dog 'Randomly' Drops By Family Reunion   Then People Check His Collar"	"lifestylebuzz"
"1"	"China Is Leasing an Entire Pacific Island. Its Residents Are Shocked."	"newsworld"
"1"	"Senate to try to override Trump emergency declaration veto Thursday"	"newspolitics"
"1"	"Elizabeth Warren to Bill Gates: I'll explain my wealth tax to you"	"elections-2020-us"
"1"	"Before his execution, a death row inmate told his victim's family he forgives them"	"newscrime"
"1"	"Chiefs QB Mahomes (knee) out for game vs. Packers"	"football_nfl"
"1"	"11 bold predictions for rest of college football season"	"football_ncaa"
"1"	"Police Surprise Woman Who Anonymously Baked Pizzelle Cookies for Years in Heartwarming Video"	"lifestylebuzz"
"1"	"Insiders predict: NFL Week 8 winners"	"football_nfl"
"1"	"Greg Schiano reportedly making 'significant demands' in Rutgers talks"	"football_ncaa"
"1"	"NFL midseason report cards: 32 things we learned while grading the teams"	"football_nfl"
"1"	"Eddy Merckx Hospitalized for Serious Head Injury Following Bike Crash"	"more_sports"
"1"	"The Difference Between Green and Orange Antifreeze"	"autosownership"
"1"	"Burning questions for CFB's biggest Week 10 games"	"football_ncaa"
"1"	"Report: Packers optimistic Davante Adams will play Sunday against Chargers"	"football_nfl"
"1"	"The 50 cheapest places to buy land in America"	"finance-real-estate"
"1"	"Former Fox News hosts want out of non-disclosure agreements"	"newsus"
"1"	"This stately home is having the ultimate yard sale"	"finance-real-estate"
"1"	"The oldest town in every state"	"lifestyledidyouknow"
"1"	"Do not try this at home: How to turn $3,000 into $1.7 million"	"finance-saving-investing"
"1"	"21 Things That Make Any House Feel Old and Outdated"	"lifestylehomeandgarden"
"1"	"How to pay off your mortgage early: 4 methods that work"	"finance-real-estate"
"1"	"Self-sufficient island hideouts for sale to survive the apocalypse"	"finance-real-estate"
"1"	"'A passionate guy': Ex-NASCAR team owner found dead in Ohio River near Louisville"	"racing"
"1"	"Moderate Democrats Back 4 Bills Aimed at Making Housing More Affordable"	"finance-real-estate"
"1"	"World's largest treehouse burns to the ground"	"newsus"
"1"	"3 Ways It's Still Possible to Buy a Home Without Financial Help From Family"	"finance-real-estate"
"1"	"Melting Ice Redraws the World Map and Starts a Power Struggle"	"newsworld"
"0"	"Meghan Markle and Hillary Clinton Secretly Spent the Afternoon Together at Frogmore Cottage"	"lifestyleroyals"
"1"	"Packers wide receiver Davante Adams to miss Monday's game with toe injury"	"football_nfl"
"1"	"Which NFL teams will rise, fall in second half of season?"	"football_nfl"
"1"	"This $12 million 'mansion yacht' is made entirely of stainless steel   and it's a first for the industry. Take a peek inside."	"travelnews"
"1"	"Forde-Yard Dash: 5 worst things we've seen this college football season"	"football_ncaa"
"1"	"Target kicks off its Black Friday deals this week"	"finance-companies"
