"0"	"How a preacher sent gunmen into Burkina Faso's schools"	"newsworld"	"When an Islamist preacher took up the fight in Burkina Faso's northern borderlands almost a decade ago, his only weapon was a radio station. The words he spoke kindled the anger of a frustrated population, and helped turn their homes into a breeding ground for jihad."
"1"	"Thousands of people have problems accessing Disney+, and they're not happy"	"finance-companies"	"The company says it's working 'quickly to resolve the current user issue.'"
"1"	"Stop! Read This Guide Before You Buy an Air Fryer."	"tipsandtricks"	"Shopping for air fryers? Or maybe air fryer toaster ovens? Our air fryer buying guide will help you find the perfect appliance for your needs."
"0"	"Time For Lunch! These Easy Recipes Are Good For Work, School, and Other Busy Weekdays"	"quickandeasy"	"If you're on the lookout for healthy, hearty, and satisfying lunches to bring to work, we rounded up the easiest recipes out there."
"0"	"20 Winter Wedding Color Schemes That Will Take Your Breath Away"	"lifestyleweddings"	"Funny, now I'm suddenly in the mood for a glass of champagne."
"0"	"Why Do Cats Meow?"	"lifestylepetsanimals"	"Cats scratch, purr, and sleep, but haven't you always wondered, "why do cats meow"?"
"0"	"Stars who've played royals"	"tv-gallery"	"See which celebs have played monarchs, princesses and more in films and on television."
"0"	"Barn Find: Large Collection Of Pontiac Firebirds Uncovered"	"autosclassics"	"A total of nine Firebirds were discovered in Minnesota and are now up for auction."
"1"	"A man dies in Hawaii after falling into a lava tube in his yard"	"newsus"	"An elderly man died after falling into a lava tube on his property in Hilo, Hawaii, police announced on Wednesday."
"0"	"This is the dirtiest spot on a plane"	"video"	"Science has identified the dirtiest spot on an airplane."
"0"	"Stephen Curry calls out Michael Jordan for being a 'hater'"	"sports_news"	"While the opinion of arguably the greatest NBA player of all time is certainly noteworthy, most people disagree with Jordan."
"1"	"Science Says: How daylight saving time affects health"	"health-news"	"Many sleep scientists and circadian biologists are pushing for a permanent ban."
"0"	"The best mac and cheese in every state"	"foodnews"	"Whether you're looking for a heap of truffle-infused macaroni or a reliable side dish, here are Yelp's best mac-and-cheese spots in each state."
"0"	"Travel etiquette: The final word on the right to recline"	"traveltips"	""The question of the recline is like a zero-sum game," award-winning aircraft cabin designer James Lee told TPG. "The gain of one person is the pain of the person behind.""
"0"	"Eager to witness 'history,' people, protesters huddle outside Trump impeachment inquiry hearing"	"newsus"	"Protesters wearing "arrest Trump" T-shirts and dozens of people anxious to witness the hearing crowded outside the hearing room at the U.S. Capitol."
"0"	"2021 Mercedes S-Class Drops Some Camo In New Spy Video"	"autosluxury"	"More W223 sightings before more official details come in."
"0"	"LeBron James becomes first Lakers to get 4 triple-double in 1st 10 games"	"basketball_nba"	"LeBron James made more franchise history for the Los Angeles Lakers even in their first loss in eight games."
"0"	"2020 Subaru Outback vs. 2019 Honda Passport: Which Is the Better Mid-Size Utility Vehicle?"	"autossuvs"	"Freshly redesigned, Subaru's popular lifted wagon challenges Honda's mid-size Passport SUV in real-world usability and performance."
"0"	"Climate change might hit the economy harder and faster than thought"	"markets"	"The economic effects of global warming may arrive sooner and with a bigger impact than previously thought, according to Oxford Economics in a report that compares recent scientific research with the economic literature on the costs of climate change."
"1"	"Principal Tobias Harris? Sixers star dreams of career in education after NBA"	"basketball_nba"	"Sixers forward Tobias Harris pledged $1 million to nine educational non-profits worldwide and started two initiatives to help students and teachers."
"0"	"9 Best Beaches in Charleston"	"traveltripideas"	"Sun, sand, surf, trails in this city, you're never far from a shoreline."
"0"	"Every outfit Duchess Kate has worn in 2019"	"lifestyleroyals"	"See Kate Middleton's style choices this year from glam gowns and coat dresses to re-wears, tiaras and hats."
"0"	"Marcia Cross' anal cancer may have been linked to HPV. She wants people to know they could have the virus, too."	"health-news"	"Marcia Cross said that getting an HPV-related cancer is "not something that you do wrong, it doesn't have to do with whatever sexual life you have.""
"0"	"Baker Mayfield's wife clarified her 'fair weather fans' comment after the Browns' win"	"football_nfl"	""Didn't expect to ruffle so many feathers.""
"0"	"This Is What It's Like to Give Up Alcohol For a Week"	"voices"	"I don't often examine my drinking, but I was curious about the less obvious effects of alcohol on my life. This is what I learned from a week of sobriety."
"1"	"All 44 Stephen King Movies, Ranked Worst to Best (Photos)"	"movies-gallery"	"Where does "Doctor Sleep" place among the many big-screen adaptations of the horror master's work?"
"0"	"I'm extremely introverted, but I challenged myself to be more outgoing for a week, and it made me feel more confident"	"voices"	"I went from not speaking to anyone for an entire day to seeing movies by myself, chatting up strangers, and correcting my coffee order."
"0"	"12 Military-Themed TV Shows to Binge-Watch on Veterans Day"	"tv-gallery"	"From "M*A*S*H" to "JAG""
"0"	"A body-language expert says Meghan Markle is "politely disconnecting" from the public, and honestly, we would too"	"lifestyleroyals"	"Can we blame her? Meghan Markle is supposedly "politely disconnecting" from the public as seen in her body language, and girl, you do you."
"0"	"Jenna Dewan flaunts her baby bump in red gown at People's Choice Awards"	"awards"	"She looks absolutely stunning."
"1"	"Grading the biggest NFL deals ahead of the 2019 trade deadline"	"football_nfl"	"Jalen Ramsey, Mohamed Sanu, and Emmanuel Sanders were all traded before the deadline, but which teams won those deals?"
"0"	"'One in a million' deer captured on camera in Michigan woods"	"newsus"	"Retired Michigan lawmaker and amateur photographer Steven Lindberg took pictures of a deer. That deer had three antlers."
"0"	"Tamron Hall Talks Leaving the Today Show, Jokes About Megyn Kelly's Reported Multimillion Payout"	"tvnews"	"Tamron Hall Talks Losing the Today Show"
"0"	"6 Cost-Saving Tips for Traveling in Retirement"	"video"	"Traveling is the number one goal of retirees."
"0"	"A Trump Tax Break To Help The Poor Went To a Rich GOP Donor's Superyacht Marina"	"markets"	"The Trump tax law gave governors the authority to distribute valuable tax breaks, and they have wielded it to benefit the politically connected."
"0"	"Ree Drummond Says a Low-Carb Diet Is the Secret to Her Incredible Weight Loss"	"weightloss"	"The Pioneer Woman's new cookbook is out now!"
"0"	"Trade War's Forgotten Farmers Get Crushed in U.S. Cotton Country"	"markets"	"American cotton farmers are having such a difficult year that even a potential trade deal between the U.S. and China is likely to offer them little comfort."
"0"	"Genesis GV80 Spy Photos Provide Our Best Look Yet At The New Crossover"	"autossuvs"	"The GV80 will be brand's first crossover."
"0"	"PEOPLE's Sexiest Men Alive: Still Sexy After All These Years"	"celebrity"	"PEOPLE's Sexiest Men Alive With Their Younger Selves"
"1"	"Illegal migration at southern border remains a "crisis" despite slowdown, U.S. says"	"newsus"	"Illegal migration at southern border remains a "crisis" despite slowdown, U.S. says"
"0"	"Can A Ford Raptor Fully Charge A Tesla Model 3 By Towing It?"	"autosenthusiasts"	"Theoretically, according to Engineering Explained, yes. Thank regenerative braking for that."
"0"	"40 Restaurant Meals You Should Never Eat After 40"	"nutrition"	"As you age, you're at a higer risk for heart disease, diabetes, and muscle loss. Here's a list of 40 restaurant dishes to avoid after 40."
"0"	"Big celebrity money moments of the last decade"	"entertainment-celebrity"	"From bankruptcy filings and huge paydays to reaching billionaire status, read up on the most fascinating money news involving the stars from 2010 to 2019."
"0"	"Do Women Really Have Different Heart Attack Symptoms Than Men?"	"health-news"	"A new study looking at patient-reported symptoms yields some surprising results."
"0"	"A Nutella Hotel Is Opening in California"	"travelnews"	"The Hotella Nutella, a Nutella-themed hotel, is opening in Napa Valley for three lucky fans of the hazelnut spread."
"0"	"U.S. proposes denying work permits to asylum seekers who enter illegally"	"newsus"	"U.S. proposes denying work permits to asylum seekers who enter illegally"
"0"	"Could Red Sox and Yankees make blockbuster trade?"	"baseball_mlb"	"The Sox would exchange Mookie Betts for young, affordable talent."
"0"	"I Kissed Dieting Goodbye, and Finally Lost 20 Pounds. Here's Why."	"voices"	"When one editor finally decided to stop dieting, her health significantly improved. Here's her story on how she decided to break up with dieting for good."
"0"	"The best independent bakery in every state"	"restaurantsandnews"	"When you want the best bread, the flakiest pastries and comforting cream cakes it's time to turn to the experts   and an independent, local bakery is sure to hit the spot. Here is our favorite in every state for tempting treats you wouldn't dare to make at home."
"1"	"What Is the Bermuda Triangle, and Do Pilots Really Avoid It?"	"travelnews"	"Ever wondered "What IS the Bermuda Triangle?" We answer all your questions about this mysterious section of the ocean and dispel the myths."
"0"	"Venice 'on its knees' after second-worst flood ever recorded"	"newsworld"	"The worst flooding in Venice in more than 50 years prompted calls Wednesday to better protect the historic city from rising sea levels as officials calculated hundreds of millions of euros in damages."
"0"	"The Best Photos of College Football"	"football_ncaa"	"The Best Photos of College Football"
"0"	"Kansas lands commitment from five-star guard Bryce Thompson"	"basketball_ncaa"	"This is an important get for Kansas."
"0"	"Bishop who investigated sex abuse accused of sex abuse"	"newsus"	"A Roman Catholic bishop named by Pope Francis to investigate the church's response to clergy sexual abuse in Buffalo, New York, has himself been accused of sexual abuse of a child, an attorney for the alleged victim notified the church this week."
"0"	"Kate Middleton's Maroon Trousers Gave Her a Pop of Color During Her Charity Outing"	"lifestyleroyals"	"Kate Middleton rocked some eye-catching statement trousers during a recent charity visit that were absolutely perfect for fall."
"0"	"Nine student deaths has USC trying to quell rumors, prevent triggering students"	"newsus"	"LOS ANGELES - The email arrived near midnight Saturday. USC President Carol Folt informed the campus community about a recent series of student deaths. She said she wanted to keep the university informed, but also clear up rumors and misinformation. "People are searching for answers and information as we attempt to make sense of these terrible losses," Folt said. "There is a great deal of ...""
"0"	"Winners, losers from Seahawks' wild overtime win over 49ers on 'Monday Night Football'"	"football_nfl"	"There were turnovers galore in this instant classic. Now the Seahawks are just one game behind the 49ers in the loss column, and there are no more undefeated teams in the NFL."
"0"	"Report: Giants hire Gabe Kapler as new manager"	"baseball_mlb"	"The Giants have reportedly chosen Gabe Kapler to manage the team in 2020. He beat out Joe Espada and Matt Quataro for the job."
"0"	"Don't be fooled: Costco says $75 coupon is a scam"	"finance-companies"	"Wholesale retailer Costco is warning customers about a new scam that is promising shoppers a $75 coupon."
"0"	"Off-Road Diesel Truck Showdown: GMC Sierra 1500 AT4 vs. Ram 1500 Rebel"	"autostrucks"	"Does GMC or Ram build the best jack-of-all-trades pickup?"
"0"	"How Ducati influenced the 2020 Corvette's design"	"autossports"	"The design team behind the mid-engine C8 Chevy Corvette Stingray looked to the fabled Italian motorcycle manufacturer for inspiration."
"0"	"Fox legal analyst Napolitano emerges as Trump critic"	"newsus"	"NEW YORK (AP)   More than two decades into his career as a commentator at Fox News Channel, Andrew Napolitano reached a milestone of sorts when he was called a "fool" on his own network. Not to his face, of course. But Tucker Carlson guest Joseph diGenova's dismissal of Napolitano for saying that soliciting campaign aid from a foreign government is against the law illustrates the awkward place that the former New Jersey Superior Court judge..."
"0"	"The Best Holiday Gifts From Best Buy at Any Price Point"	"shop-holidays"	"From kitchen appliances to high-end hair care, we've compiled the greatest Best Buy gifts that will work for practically anyone."
"0"	"The problem with diamonds is they keep getting cheaper"	"markets"	"Americans are buying more diamond jewelry than ever before, but prices for most polished gems are falling."
"1"	"This 'new' strain of HIV is actually a good thing"	"health-news"	"For starters, the "new" strain is… not new."
"0"	"56 Hottest Holiday Gifts from Amazon"	"shop-holidays"	"We poured through Amazon's bestseller and most-wished-for lists to find the perfect gift for just about anyone in your life."
"1"	"Neil Patrick Harris Has Surgery on His Hand After a Sea Urchin Accident While on Holiday"	"tv-celebrity"	"Neil Patrick Harris Has Surgery After a Sea Urchin Accident"
"1"	"If you want the American dream, move to Canada, Ford Foundation president says"	"markets"	""They've got a capitalist system, and they're doing better than us on providing opportunity," Darren Walker says."
"1"	"LeBron James evacuates LA home, relocates family to hotel because of wildfires"	"basketball_nba"	"Lakers star LeBron James and his family were forced to evacuate their home in Los Angeles due to wildfires that have engulfed Southern California."
"0"	"Republicans have spent millions at Trump resorts since his election: report"	"newspolitics"	"GOP-affiliated political groups and candidates have spent more than $8 million at the president's various resorts and properties since President Trump was elected in 2016, according to a new analysis.Politico on Monday reported that analysis from the left-leaning consumer rights group Public Citizen shows that the Trump Organization has become a haven for Republican groups hosting political events and fundraisers, an informal arrangement that..."
"1"	"2021 BMW 4 Series Coupe Caught Testing With Full Production Body"	"autosluxury"	"It won't be as glitzy as the concept, but maybe that's a good thing."
"0"	"Amazon's $1.5 million political gambit backfires in Seattle City Council election"	"finance-companies"	"Amazon's $1.5 million political gambit backfires in Seattle City Council election"
"1"	"California tribe regains island it calls center of universe"	"newsus"	"Indian Island off the coast of Northern California was the site of a massacre, a place that was contaminated by a shipyard and flush with invasive species. It's also the spiritual and physical center of the universe for the small Wiyot Tribe, and it now belongs to them almost entirely after a city deeded all the land it owns on the island to the tribe during a packed signing ceremony Monday. "It's a really good example of resilience because...""
"0"	"Evansville's upset at No. 1 Kentucky illustrates college basketball's uncertain landscape"	"basketball_ncaa"	"Two weeks, two No. 1 teams falling."
"0"	"How to Cure Jet Lag, According to an Airline CEO"	"traveltips"	"For KLM CEO Pieter Elbers, beating jet lag comes down to packing one simple item."
"0"	"13 Trader Joe's Party Staples For Busy Hosts"	"newstrends"	"When it comes to hosting parties, one of my favorite resources is Trader Joe's; not only does the supermarket offer up a variety of creative, international options, but the prices also can't be beat."
"0"	"Celebrity plastic surgery transformations"	"entertainment-celebrity"	"See how stars like Sharon Osbourne, Cardi B, Pauly D, Kim Zolciak-Biermann, Gisele Bundchen, Kanye West and others have altered their looks."
"0"	"All the hats Duchesses Kate and Meghan have worn in 2019"	"lifestyleroyals"	"See the royals' most fashionable hats, fascinators, headbands, headscarves and tiaras of the year!"
"0"	"Bucs release former first-round pick Vernon Hargreaves"	"football_nfl"	"TAMPA   Two days after he was benched for not hustling to a make a tackle, the Bucs released starting cornerback Vernon Hargreaves Tuesday morning. The 11th overall pick in 2016 from the University of Florida, Hargreaves struggled to hold up his reputation as a ball hawk in the NFL with only two career interceptions in four seasons. Hargreaves was informed of the decision Tuesday morning at ..."
"0"	"Texas High Schoolers Design and Build Prosthetic Arm for Student So She Can Play the Cello"	"newsgoodnews"	"Texas High Schoolers Build Prosthetic Arm for Student"
"0"	"Neil Young Says U.S. Citizenship Application Delayed By Marijuana Use"	"music-celebrity"	"Neil Young has revealed that his attempts to attain U.S. citizenship prior to the 2020 presidential election has been delayed in part due to the "good morale character" clause on the immigration application. "I want to be a dual citizen and vote. When I recently applied for American citizenship, I passed the test. It was a conversation where I was asked many questions. I answered them truthfully and passed," the rocker wrote Friday on his Neil..."
"0"	"Kyle Kuzma can be third star for Lakers with improved shot selection"	"basketball_nba"	"For the Los Angeles Lakers to continue their winning ways, they will need consistently good performances from third-year forward Kyle Kuzma."
"0"	"After push from Perry, backers got huge gas deal in Ukraine"	"newspolitics"	"Two political supporters of U.S. Energy Secretary Rick Perry secured a potentially lucrative oil and gas exploration deal from the Ukrainian government soon after Perry proposed one of the men as an adviser to the country's new president."
"0"	"Chevy C8 Corvette Z06 interior could look something like this"	"autosnews"	"A sole interior sketch might give us an idea of what Chevy designers have in mind for a new Corvette Z06."
"1"	"South Florida principal who made controversial comments about the Holocaust is fired"	"newsus"	"The South Florida principal who stirred national controversy after refusing to say the Holocaust was a "factual, historical event" was fired Wednesday during a school board meeting at the recommendation of the district's superintendent."
"0"	"Brian Cashman expresses interest in Madison Bumgarner"	"baseball_mlb"	"The New York Yankees are expected to go big-game hunting in free agency, and with the organization having already set its sights on two top-tier starters, Brian Cashman added another high-caliber pitcher to the potential mix."
"1"	"Four words from dermatologists that'll change your life: Stop showering every day"	"wellness"	"Whoa. "It doesn't matter what time of year it is   your entire body does not need to be washed daily," says one derm (and she has backup)."
"1"	"5 charged in alcohol poisoning death of UC Irvine fraternity brother"	"newscrime"	"Five young men have been charged in connection with the death of their fraternity brother, who succumbed to alcohol poisoning after a booze-soaked party this year."
"1"	"Keystone oil pipeline leaks 383,000 gallons in North Dakota"	"newsus"	"TC Energy's Keystone pipeline has leaked an estimated 383,000 gallons (1.4 million liters) of oil in northeastern North Dakota, marking the second significant spill in two years along the line that carries Canadian tar sands oil through seven states, regulators said Thursday. Crews on Tuesday shut down the pipeline after the leak was discovered, said Karl Rockeman, North Dakota's water quality division director."
"1"	"Anthony Davis is why you always trade for the superstar if you can"	"basketball_nba"	"This is the teammate LeBron James was waiting for."
"0"	"Shakira reflects on her career-threatening injury, depression in 2017"	"music-celebrity"	"Shakira said she went into a deep depression thinking she lost her voice for good."
"0"	"US government says Roger Stone 'undermined' Russia inquiry"	"newspolitics"	"Republican political operative Roger Stone undermined the effectiveness of the congressional investigation into Russian interference in the 2016 election by repeatedly and deliberately lying under oath to help Donald Trump's presidential campaign avoid embarrassment, prosecutors told jurors in closing arguments at his trial Wednesday. Defense attorneys countered that Stone had done nothing deliberately illegal and claimed the..."
"0"	"Deer stranded 5 miles offshore saved by Maine lobstermen"	"newsgoodnews"	"A group of Maine lobstermen spotted a deer in an unusual place Monday: open waters. The men quickly took action to save the animal, which had somehow ventured 5 miles away from shore, and hauled their catch of the day to safety."
"1"	"Opinion: Los Angeles Rams' trade for Ramsey follows aggressive trend, but feels desperate"	"football_nfl"	"The Los Angeles Rams' trade for Jalen Ramsey smacks of desperation following the first three-game losing streak under Sean McVay."
"0"	"The highlights and lowlights from the world of comedy in the 2010s"	"humor"	"Along with the great films, sitcoms and talk shows, there have been scandals, untimely deaths, cancellations both real and metaphorical, terrible sequels and comedies based on cell phone games."
"1"	"As Warren Gains in Race, Wall Street Sounds the Alarm"	"markets"	"Warren's rise in the Democratic primary polls is rattling bankers, investors and their affluent clients, who see in the Massachusetts senator a formidable opponent who could damage not only their industry but their way of life."
"0"	"My Immigrant Parents Wanted A Better Life For Me. This Is Why I Chose My Path Over Theirs."	"voices"	"My father's family left Greece and emigrated to the United States when he wasa teenager. As many come to learn when pursuing the American dream, it wasn'tall rainbows and white picket fences. My grandparents, who didn't speakEnglish at the time, struggled to adjust to their new life far from friendsand family. While they spent 12 to 14 hours a day working toward the betterlife that they had dreamed of, my dad skipped out on his high school..."
"0"	"Hey, Millennials, look out below! Gen Z may already be catching up in the salary race"	"finance-career"	"Gen Zers are closing the pay gap with millennials even though they have far less experience. They're making the most of a tight labor market."
"1"	"Here's how rising car prices can hurt average Americans"	"personalfinance"	"Car prices are rising rapidly, but Americans' wages have been slow to increase for decades. As a result, many take out long-term auto loans that can take years to pay off."
"0"	"2020 Ram 1500 Pros and Cons Review: Ram Returns With an EcoDiesel"	"autostrucks"	"The Ram 1500 EcoDiesel is a 2020 Truck of the Year finalist"
"0"	"Fastest American Muscle Cars EVER"	"autosenthusiasts"	"They deliver a horsepower high and clouds of tire smoke at bargain prices. Go from 0-60mph in under 4 seconds for as low as $36,350."
"0"	"The 2019-20 NBA Season"	"basketball_nba"	"The 2019-20 NBA Season"
"1"	"Refreshed Toyota 86/Subaru BRZ spied running around the Nurburgring"	"autossports"	"Styling elements from both the BRZ and 86 can be seen on this car"
"0"	"This Arctic blast is in its final day. But the cold isn't over quite yet"	"weathertopstories"	"The hundreds of millions of people gripped by the Arctic blast can begin to peel off a layer or two of clothing starting Thursday."
"0"	"See every outfit Duchess Meghan wore in 2019"	"lifestyleroyals"	"See the former Meghan Markle's style choices this year -- from maternity looks and glamorous gowns to casual dresses, trousers, hats and more."
"0"	"No, Not Everyone Is Beautiful, And We'd All Be Better Off If We Stopped Saying We Are"	"voices"	"After I recently made a comment on Twitter calling out a well-known game showhost on his privilege, I received a lot of support from people who also foundhis post problematic. Those who agreed with me gave specific reasons why theyfelt that way too. Those who did not agree with me went a different route.Instead of countering my argument with one of their own, they attacked mylooks. Some commented on my weight, others on my general appearance,..."
"1"	"It's Easy to Overdose on Acetaminophen and It Can Kill You, New Study Says"	"health-news"	"Acetaminophen, an analgesic (a compound that relieves pain), is the most common drug ingredient in America."
"1"	"San Diego State University freshman hurt in fraternity incident dies"	"newsus"	"SAN DIEGO - Dylan Hernandez, the 19-year-old San Diego State University freshman who required medical attention last week after an unspecified incident at one school's fraternities, has died, campus officials said on Monday. "His family gave their goodbyes late Sunday night," SDSU President Adela de la Torre said in a statement."
"0"	"Man runs race in full SWAT gear, saves a life, then proposes -- all in a matter of moments"	"newsgoodnews"	"The finish line of the Allstate Hot Chocolate 15K Run changed life-as-they-know it for Chicago Police Sgt. Mike Nowacki, his girlfriend, and a complete stranger with "serendipitous" timing."
