"0"	"The Volkspod VW Beetle Minibikes Are Part Creepy, Part Adorable"	"autosmotorcycles"	"The people's pods."
"0"	"Officials: At least 13 dead in Slovakia bus crash"	"newsworld"	"A bus collided with a truck in Slovakia on Wednesday, killing at least 13 people and injuring at least 20 more. Online news site tvnoviny.sk reported that the bus was carrying high school students."
"1"	"Anxious and Cooped Up, 1.5 Million Kashmiri Children Are Still Out of School"	"newsworld"	"Every day, Aliya Khan, a fifth-grader in Kashmir, steps out of her house and walks down a dirt lane lined by tall maple trees to check on what's happening at her school."
"1"	"Opinion: Why did the Nets start firestorm over Kyrie Irving's behavior?"	"basketball_nba"	"Are the Brooklyn Nets trying to alienate All-Star guard Kyrie Irving just a fraction into his four-year contract worth $136.4 million?"
"0"	"Photos of the Day"	"newsworld"	"Our top photos from the last 24 hours."
"0"	"On a frigid night in Dallas, one man who used to be homeless ushered people to shelter"	"weathertopstories"	"Monday night was harsh for many in Dallas as the strongest cold front of the season rolled through bringing below-freezing temperatures and single-digit wind chills. The city of Dallas opened up the Kay Bailey Hutchinson Convention Center for emergency overflow housing for the homeless in case other shelters filled up. A move the city hasn't made in cold weather situations and one that was applauded by local non-profits and faith leaders who..."
"0"	"Chuck Woolery: Supporting Trump 'pretty much destroyed my career'"	"tv-celebrity"	"Supporting President Trump and taking a conservative stance in public ruined Chuck Woolery's career and got him shadow-banned from Twitter, said the former game show host on "Fox & Friends," Wednesday."
"0"	"We Had a Babysitter Come to Our Hotel Room at Disney World, and It Was SO Worth It"	"voices"	"I love my children dearly, but having three small kids really limits what we can do on our annual Disney World vacations."
"0"	"1969 Chevrolet Camaro Z/28 emerges from a garage after sitting for over 30 years"	"autosclassics"	"It's now for sale, and in need of a full restoration."
"0"	"Bode Miller delivered his twin boys after midwife didn't make it time for the birth"	"more_sports"	"Bode Miller added yet another impressive title to his list of accomplishments Friday."
"0"	"A teen received a response to a message in a bottle he wrote 9 years ago after it traveled over 3,000 miles"	"lifestylebuzz"	"The bottle, which was placed into the ocean on a beach in Rockport, Massachusetts, was found off the coast of France."
"0"	"Trump puts economic growth at center of his 2020 campaign"	"markets"	"President Donald Trump laid out the central pillar of his 2020 re-election campaign on Tuesday, telling the Economic Club of New York that his policies have generated a boom in growth and jobs."
"0"	"Stars Who Served in the Military"	"entertainment-celebrity"	"Adam Driver, Jeff Bridges, Ice-T and more stars who served in the military."
"0"	"Tua Tagovailoa again considered game-time decision with ankle injury"	"football_ncaa"	"Tua Tagovailoa put up huge numbers in last week's shootout loss to LSU, but the Alabama quarterback is still not fully healed from an ankle injury he suffered less than a month ago."
"0"	"Kim Kardashian Looked Minty Fresh in Versace at the People's Choice Awards"	"awardstyle"	"Kim Kardashian was sizzling at the 2019 People's Choice Awards."
"0"	"Selena Gomez Opens Up About Being Body Shamed for Gaining Weight Amidst Lupus Battle"	"wellness"	"The singer and actress is opening up feeling "attacked" while battling life-threatening health issues."
"0"	"Supreme Court Justices Couldn't Stop Interrupting Each Other During DACA Oral Arguments"	"newsus"	"The first interruptions came just minutes into the start of proceedings."
"0"	"2020 Lincoln Corsair Review: The Sleeper Hit of 2020 SUV of the Year Testing"	"autossuvs"	"Lincoln's small luxury SUV is a 2020 SUV of the Year finalist"
"0"	"Drake Has Something to Say to the ''Kids'' Who Booed Him Off Stage"	"musicnews"	"Drake took to Instagram with an admittedly hilarious response to the Camp Flog Gnaw Carnival attendees that weren't pleased by his surprise performance"
"0"	"Taylor testifies he was told Trump cared more about 'investigations' than Ukraine"	"newspolitics"	"William Taylor said U.S. Ambassador to the European Union Gordon Sondland told a member of his staff in July that President Trump cared more about an investigation into former Vice President Joe Biden than he did about Ukraine."
"0"	"Detroit Lions' Darius Slay: Things will get 'ugly' if we don't win out"	"football_nfl"	"At 3-5-1, the Lions are in last place in the NFC North with seven games to play. But the season could go south if Detroit doesn't change its ways."
"0"	"Republicans shrug off impeachment hearings as 'boring'"	"newspolitics"	"Heading into Wednesday's first public impeachment hearing, Republicans had argued the facts weren't there to impeach President Donald Trump. And they complained the proceedings were taking place behind closed doors."
"0"	"The 50 cheapest places to buy land in America"	"finance-real-estate"	"Find out where you can get parcels of land for $10,000 or less."
"0"	"Martha Stewart shares the family favorites she serves during the holidays, including adding cream cheese to her mashed potatoes"	"foodnews"	"Martha Stewart swears by family recipes for Thanksgiving, Christmas, and Hanukkah dishes   from potato pancakes to mashed potatoes."
"0"	"A $30,000 handbag. A disastrous wine spill. And now, a country club is suing its own waiter."	"markets"	"The pink Hermès Kelly clutch was worth $30,000, a lawsuit says. But it was soiled at a "very, very, very rich country club.""
"0"	"Southwest's Spring Travel Sale Includes $39 One-way Tickets"	"travelnews"	"Southwest Airlines wants you to start planning your 2020 travels."
"0"	"4 reasons you shouldn't max out your 401(k)"	"finance-saving-investing"	"Making high-dollar contributions to your 401(k) can cost you."
"0"	"Chief Justice John Roberts, who's clashed with Trump, would oversee impeachment trial"	"newspolitics"	"John Roberts would be the first U.S. Supreme Court chief justice to preside over a Senate impeachment trial of a president with whom he's openly clashed."
"0"	"This Guy Lost 30 Pounds and Gained a Rock-Hard Six Pack"	"weightloss"	"Pizza, Chinese take-out, McDonald's, ice cream, you name it   "If it isn't good for you, I would enjoy eating it in large quantities," says Chris Anderson."
"0"	"Additional details emerge surrounding Colin Kaepernick's NFL workout"	"football_nfl"	"Since becoming a free agent, Kaepernick has only received a workout invitation from one team   the Seahawks   and that was in the summer of 2017."
"0"	"Trump Organization ordered to pay $290,000 after losing battle against Scottish wind farm"	"newspolitics"	"President Trump has a long-standing disdain for windmills, including the ones he said would harm views from his golf course."
"0"	"Family Reunited With Dog Who Had Been Missing Since August While Waiting in Line to Adopt Cat"	"lifestylebuzz"	"As soon as the family called out to their dog, Dopey ran over and began "covering them with kisses.""
"0"	"Rare Mustang! 1968 Shelby GT500 Prototype"	"autosclassics"	"Craig Jackson has restored what is likely the rarest Shelby Mustang of all, this 1968 Shelby GT500 Lime Gold prototype."
"1"	"Adorable Rescue 'Puppy' Turns Out To Be Wild Dingo"	"lifestylebuzz"	"A family in the small town of Wandiligong, Australia, made a very special discovery when a rare animal dropped from the sky and into their backyard."
"0"	"Reports: Knicks trying to hire Raptors president Masai Ujiri, could fire coach David Fizdale"	"basketball_nba"	"This isn't the first time the Knicks have been linked to Ujiri."
"0"	"Take a sneak peek at construction of the Rams' stunning new stadium"	"football_nfl"	"SoFi Stadium, a 298-acre sports-and-entertainment complex, is scheduled to open in July 2020 and will be home to the Los Angeles Rams and Chargers."
"1"	"He Never Smoked a Day in His Life. At 28, He Was Diagnosed With Lung Cancer."	"medical"	"These are the symptoms that made him seek help."
"0"	"Hugh Jackman Congratulates John Legend on Sexiest Man Alive While Poking Fun at Ryan Reynolds"	"movies-celebrity"	"Hugh Jackman Congratulates John Legend on Sexiest Man Alive"
"0"	"50 amazing gifts for every type of person and budget"	"shop-holidays"	"Let the product experts at Reviewed help you find the perfect gifts for everyone on your list."
"0"	"The McLaren Elva Is a $1.7 Million Topless, Windshield-less Hypercar"	"autosenthusiasts"	"Limited-production model honors a classic Bruce McLaren sports car design"
"0"	"'I Stayed Off Social Media Entirely Because Of My Weight. Then I Discovered Intermittent Fasting And Lost 109 Lbs.'"	"voices"	"After going through years of cancer treatment, Alicia Latrice Smith says she gained a lot of weight. She tweaked her diet   and lost 109 pounds."
"0"	"Unexpected Signs of an Unhealthy Heart"	"medical"	"Preventing heart disease has been at the forefront of researchers' agendas for years, involving things like physical activity, diet, and genetics"
"0"	"America's Most and Least Popular Senators"	"newspolitics"	"Senators represent the interests of the residents of their home state on Capitol Hill by crafting and voting on new laws and by approving or rejecting cabinet and judicial nominations made by the president."
"0"	"AP Exclusive: Buttigieg would pick VA's 1st female secretary"	"elections-2020-us"	"Democratic presidential candidate Pete Buttigieg says if elected he'd like to name a woman to lead the Department of Veterans Affairs for the first time as 2020 hopefuls take aim at President Donald Trump's record on stemming military suicide and helping female vets."
"0"	"I Have Smiling Depression This Is What It Feels Like"	"voices"	""I function but do not feel. My face says I'm happy, but inside I want to cry.""
"0"	"Instructions Came From Trump, Schiff Says: Impeachment Update"	"newspolitics"	"The first public hearing in the formal impeachment inquiry into President Donald Trump was held Wednesday, as the House Intelligence Committee heard testimony from two State Department officials."
"1"	"Eric Tse, 24, just became a billionaire overnight"	"markets"	"A 24-year-old business school graduate has just become an overnight billionaire."
"0"	"Still teaching at 95, Jimmy Carter draws devotees to church"	"newsus"	"PLAINS, Ga. (AP)   The pilgrims arrive early and from all over, gathering hours before daybreak in an old pecan grove that surrounds a country church. They come, they say, for a dose of simple decency and devotion wrapped up in a Bible lesson. The teacher is the 39th president of the United States, Jimmy Carter. Nearly four decades after he left office and despite a body that's failing after 95 years, the nation's oldest-ever ex-president still..."
"0"	"Which NFL teams would be a fit for Colin Kaepernick? Ranking all from 32 to 1"	"football_nfl"	"NFL teams will get the opportunity to assess Colin Kaepernick on Saturday, but which landing spots might actually make sense for the quarterback?"
"0"	"Visa, Mastercard draw FTC inquiry over debit card transactions"	"newsbusiness"	"Visa and Mastercard are once again in the cross hairs of U.S. antitrust regulators over policies that can prohibit merchants from routing card transactions over alternative debit networks."
"0"	"Shocking Daycare Rate List Sparks Outrage & Shines a Light on Child Care Crisis in America"	"lifestylebuzz"	"Parents everywhere are relating to these palpitation-inducing prices that rival those of rent or a mortgage payment."
"1"	"Subway just released a sandwich with green eggs and ham"	"foodnews"	"This new sandwich brings the classic dish from Dr. Seuss to life."
"0"	"Jess Lost 75 Pounds Without Counting Calories and Did This 1 Inspiring Thing Before Every Meal"	"weightloss"	"Jess Dukes makes a list of her "whys" and reads them before every meal and every workout."
"0"	"Mulvaney's move to join impeachment testimony lawsuit rankles Bolton allies"	"newspolitics"	"Former national security adviser John Bolton views the acting White House chief of staff as a key participant in the administration's effort to pressure Ukraine."
"0"	"Wealthy investors are bracing for a sharp stock sell-off in 2020"	"markets"	"More than half of the world's wealthiest investors are hedging for a sharp drop in financial markets before the end of next year, says UBS."
"0"	"See the most expensive watch ever sold at auction"	"viral"	"A Patek Philippe watch has sold for a record $31M at a charity auction hosted by Christie's in Switzerland."
"0"	"Do Pilots Actually Avoid Flying Over the Bermuda Triangle?"	"video"	"The Bermuda Triangle is in the Atlantic Ocean, bordered by the U.S., Bermuda, Cuba, Hispaniola, Jamaica, and, Puerto Rico."
"0"	"Luhnow says Astros 'try and follow the rules' amid sign-stealing inquiry"	"baseball_mlb"	"On Tuesday, Houston Astros general manager Jeff Luhnow addressed allegations that his team used technology to illegally steal signs during the 2017 season."
"0"	"Iran launches nuclear enrichment at underground Fordow plant, IAEA confirms"	"newsworld"	"Iran launches nuclear enrichment at underground Fordow plant, IAEA confirms"
"0"	"Kanye West is teaming up with pastor Joel Osteen: Details"	"music-celebrity"	"The rapper and the megachurch leader are planning to speak together at Houston's Lakewood Church."
"1"	"691,145 Californians left last year: What state did they go to?"	"finance-real-estate"	"Look at the comings and goings as a ratio of ins to outs. Tiny Idaho wins this race with 497 arrivals from the Golden State for every 100 former Gem State residents who moved to California."
"0"	"Fashion hits and misses from the 2019 Country Music Association Awards"	"cma-awards"	"From Nicole Kidman to Pink, see the best and worst dressed stars at the 2019 Country Music Association Awards."
"0"	"105 Black Friday Deals You Can Start Shopping Today"	"shop-holidays"	"Save with early bird deals from stores like Walmart, Target, Amazon, Costco, Sam's Club, Kohl's, Sears, JCPenney, and Macy's, which are offering deep Black Friday discounts on the hottest products on your Christmas list   and your wish list   starting on Thanksgiving, or even sooner."
"0"	"'DACA is everything': Dreamers, families rally as Supreme Court takes up its future"	"newsus"	""We are here to tell the justices that this is more than just a work permit," said a mother, 29, with DACA status. "This is about keeping families together.""
"0"	"Rising temperatures put U.S. troops at risk during training, report finds"	"newsus"	"By midcentury, troops could face an extra month of heat-index temperatures above 100 F every year, the Union of Concerned Scientists found."
"1"	"Failed operation underlines Mexico chaos"	"newsworld"	"A daring operation to capture one of Mexico's most powerful drug lords failed disastrously when armed cartel members launched a deadly counterattack, laying siege to the northern city of Culiacan and taking several security officers hostage."
"0"	"Dramatic Footage Shows Plane Skidding Off Runway at O'Hare Airport in Chicago"	"viral"	"A plane slid off the runway due to icy conditions at Chicago's O'Hare International Airport on Monday morning, November 11, as cold weather swept across the state. American Airlines told Storyful that flight 4125, which was traveling from Greensboro, North Carolina, to Chicago, slid off the runway upon landing at around 7.45 am on Monday as a result of icy conditions. The airline said no injuries were reported and all 38 passengers and three crew members were transported to the terminal at O'Hare airport safely. Local media reported that the incident prompted a ground stop at the airport, halting all landings until around 8.30 am. Airlines at O'Hare and Midway airports canceled hundreds of flights on Monday as the National Weather Service issued a winter weather advisory for the state. Credit: Joseph Lian via Storyful"
"0"	"Top Putin aide named by MH17 airliner investigators"	"newsworld"	"An international investigation into the 2014 downing of Malaysia Airlines flight MH17 on Thursday released a series of phone intercepts, including one between a top aide to Russian President Vladimir Putin and pro-Russian rebels accused in the crash."
"0"	"Myanmar accused at UN court of genocide against Rohingya"	"newsworld"	"Myanmar was accused Monday of genocide at the U.N.'s highest court for its campaign against the country's Rohingya Muslim minority, as lawyers asked the International Court of Justice to urgently order measures "to stop Myanmar's genocidal conduct immediately." Gambia filed the case on behalf of the Organization of Islamic Cooperation."
"1"	"Japan Wants You To Stop Buying All Its Skyline GT-Rs"	"autosenthusiasts"	"In recent years, no thanks to the sudden availability of interesting Bubble Era and Gran Turismo generation cars being legally available in the United States, there's been a mass exodus of iconic cars from the domestic market."
"0"	"The Most Addictive Casseroles You're Not Making Yet"	"recipes"	"If you love the ease of whipping up a casserole, then these incredibly unique recipes need to be on your radar. They won't fail to excite your taste buds."
"0"	"Report: Election vendors are 'prime targets,' need oversight"	"elections-2020-us"	"The private companies that make voting equipment and build and maintain voter registration databases lack any meaningful federal oversight despite the crucial role they play in U.S. elections, leaving the nation's electoral process vulnerable to attack, according to a new report."
"1"	"'I am scared all the time': Chimps and people are clashing in rural Uganda"	"newsworld"	"Forest clearing has forced hungry chimps to raid villagers' crops. At times, chimps kill children, and villagers kill chimps."
"1"	"Andrew Yang's Campaign Has a Lot of Money. Now What?"	"markets"	"CONCORD, N.H.   Andrew Yang arrived for the first New Hampshire event of his presidential campaign in a Subaru with a dented fender. It was the spring of 2018, and he and three staff members had taken his car to Concord, where they were hoping a few dozen voters would be waiting for them at a coffee shop. Inside, they found one. She listened politely while Mr. Yang explained universal basic income, though she was mostly focused on her coffee and..."
"0"	"What this week's 5 biggest upsets mean for the NFL playoff picture"	"football_nfl"	"This was an "Any Given Sunday" week in the NFL   and the results could end up having major consequences for playoff hopefuls."
"0"	"NFL reviewing Detroit Lions' handling of Matthew Stafford injury report"	"football_nfl"	"Several Detroit Lions offered different timeframes of when the team decided Stafford would not play in Sunday's game against the Chicago Bears"
"0"	"The world's first hybrid cruise ship is currently on its maiden voyage⁠ take a look inside"	"travelnews"	"The MS Roald Amundsen's maiden voyage is a polar expedition supported by battery power. Take a look inside the ship making cruising more eco-friendly."
"0"	"Jane Seymour, 68, claims many designers won't 'dress someone my age'"	"tv-celebrity"	"Jane Seymour says she often recycles her outfits since designers aren't loaning clothes to her."
"0"	"Why the College Football Playoff selection committee can't make a case for Alabama"	"football_ncaa"	"Given how the selection committee evaluates contenders, Alabama isn't a playoff team."
"1"	"Deer stranded 5 miles offshore saved by Maine lobstermen"	"newsgoodnews"	"A group of Maine lobstermen spotted a deer in an unusual place Monday: open waters. The men quickly took action to save the animal, which had somehow ventured 5 miles away from shore, and hauled their catch of the day to safety."
"0"	"What Menopause Does to Women's Brains"	"wellness"	"Two-thirds of Alzheimer's patients are women. My foggy 53-year-old brain could help explain why."
"0"	"Gwen Stefani's Gown Says "Fashion Icon," So Like, No Doubt That's What She Is"	"awardstyle"	"Gwen Stefani is being honored at the People's Choice Awards as a fashion icon, so it makes sense she'd tap someone like Vera Wang to create such a majestic gown, complete with the proper punk vibes we all know and love Gwen for."
"0"	"Meghan Markle Says That Archie Has Two Teeth and Is Crawling"	"lifestyleroyals"	"The cutest? Or the cutest ever?"
"0"	"GOP senators to meet with Turkey's Erdoğan, Trump amid tensions"	"newspolitics"	"A group of Republican senators will meet with Turkish President Recep Erdoğan and President Trump at the White House on Wednesday."
"1"	"VIDEO: Kevin Durant Seen Taking Shots at Nets Practice"	"basketball_nba"	"The Brooklyn Nets are patiently ticking down the days until Kevin Durant can return from his Achilles injury. Fans can at least take solace in the fact that KD seems to be progressing nicely in his rehab, however. The two-time Finals MVP was seen moving around reasonably well and taking shots at Nets practice Wednesday, and he has more spring in his step than he had shown previously. Need a Kevin Durant injury update? I don't think we've seen..."
"0"	"The Trendiest Hair Colors for Winter, From Mulled Wine to Greige Blonde"	"lifestylebeauty"	"Greige blonde, cold brew brown, icy platinum you can't go wrong with these trending shades."
"0"	"Trump, Erdogan to meet as thorny issues stress relations"	"newsworld"	"Turkish President Recep Tayyip Erdogan and President Donald Trump will meet as relations between the two NATO allies are at their lowest point in decades, with Turkey rebuffing the U.S. and turning toward Russia on security issues and Ankara facing a Washington backlash over attacks on Kurdish civilians during its incursion into Syria last month."
"0"	"Watch: Sixers' Ben Simmons throws down monster jam"	"basketball_nba"	"This looks more like the Ben Simmons we know."
"0"	"Dan Levy cried 'for 5 hours' on final day of 'Schitt's Creek'"	"tvnews"	"Dan Levy got really emotional on the last day of 'Schitt's Creek.'"
"0"	"These companies are revolutionizing how people get paid"	"finance-companies"	"The majority of Americans live paycheck to paycheck, and getting paid every two weeks can lead to problems when unexpected bills show up. But help is now on the way."
"0"	"Utah death-row inmate featured in best-selling book dies"	"newscrime"	"SALT LAKE CITY (AP)   A Utah death-row inmate who killed his brother's wife and her toddler because of his strong polygamist beliefs in a case made famous by the book "Under the Banner of Heaven" has died of natural causes, prison officials said Monday. Ron Lafferty, 78, died at the state prison in the Salt Lake City suburb of Draper, Utah Department of Corrections spokeswoman Kaitlin Felsted said. The state attorney general's office had..."
"0"	"Why Katie Holmes Has Loosened Up On Her Fitness Routine"	"wellness"	"Exercise is still a major part of the actress' life, but she reveals that she's had a change in perspective."
"0"	"Hyatt is eliminating travel-sized plastic toiletries"	"travelnews"	"Hyatt is the latest international hotel brand to ditch travel-sized toiletries from its rooms, following Holiday Inn-owner InterContinental Group and Marriott International."
"0"	"60+ Restaurants Where Veterans Eat for Free on Veterans Day This Year"	"personalfinance"	"Active military and veterans can score free donuts, burgers, pizza and more with their military ID."
"0"	"Video shows tourists and locals wading through thigh-deep water in Venice during its worst flooding in more than 50 years"	"travelnews"	"The mayor of Venice attributed this year's severe flooding to climate change in a tweet and said a state of emergency will be declared on Wednesday."
"0"	"'Monday Night Football' commentator under fire after belittling criticism of 49ers kicker for missed field goal"	"football_nfl"	"Joe Tessitore called out 49ers kicker Chase McLaughlin after he shanked a potential game-winning kick in San Francisco, and some fans weren't happy."
"0"	"'Dancing with the Stars': Why Sean Spicer survives despite the lowest judge scores"	"tvnews"	"A 'Dancing with the Stars' voting fix designed to prevent popularity contests hasn't stopped former Trump spokesman Sean Spicer, leading to criticism."
"0"	"Week in celebrity photos for Nov. 11-15, 2019"	"celebrity"	"Week in celebrity photos for Nov. 11-15, 2019"
"1"	"Surgeon Shocked After Doing Double Lung Transplant on Teen Vaper: 'Evil I Haven't Faced Before'"	"ads-lung-health"	"The surgeon who led the team that performed the first double lung transplant on a vaping patient in the United States, said that the damage to the previously healthy teen's organs was unparalleled."
"0"	"Meghan Markle Smudged Makeup on a Fan's Coat & He Reacted Perfectly"	"lifestyleroyals"	"We've all been there."
"0"	"Why You Shouldn't Ever Go for the Cheapest Brake Pads"	"autosbuying"	"Brakes are the most important part of your car. Here's why you shouldn't cut costs on them."
"0"	"Gwen Stefani Reveals New Nickname for Her and Blake Shelton"	"music-celebrity"	"The singer said she is 'really excited' about the couple's new combined moniker."
"0"	"Three school workers charged in death of special needs student"	"newscrime"	"The student was reportedly restrained face-down for nearly an hour before becoming unresponsive"
"1"	"Gross! What you need to know and do if your hotel room has bedbugs"	"traveltips"	"One of the last things anyone wants to see after entering a hotel room is a creepy, crawly bedbug   or to wake up with bedbug bites."
"0"	"SpaceX set to launch another 60 Starlink internet satellites"	"newsscienceandtechnology"	"Initial service is expected to begin next year with global connectivity expected in 2021"
