"1"	"Why Don't All Cars Have a Rear Windshield Wiper?"	"autosownership"
"0"	"10 most stunning early trends around the NBA"	"basketball_nba"
"0"	"SEMA 2019 Photo Highlights From Las Vegas"	"autossema"
"0"	"Kristaps Porzingis 'can't blame' Rick Carlisle for fourth-quarter benching"	"basketball_nba"
"0"	"Deval Patrick Will Enter 2020 Presidential Race on Thursday"	"elections-2020-us"
"0"	"Paul Sullivan: Baseball's hot stove league could use an NBA-style spark after the slow pace of the last few offseasons"	"baseball_mlb"
"0"	"200 Shocking Home Photos You Have to See"	"lifestylehomeandgarden"
"0"	"Thunberg, teen climate activist, leaves US aboard catamaran"	"newsus"
"1"	"The 2020 Porsche 911 Carrera S Is MotorTrend 's 2019 Best Driver's Car"	"autosresearch"
"1"	"California power outages hit more than 500,000 amid high winds and fires across the state"	"newsus"
"1"	"NFL coach has theory about why Trubisky is struggling"	"football_nfl"
"0"	"Comics - '9 to 5' by Harley Schwadron"	"humor"
"0"	"My Third Husband Is 102 Years Old. Here's What Our Marriage Is Like."	"voices"
"1"	"Opinion: Five issues facing the New Orleans Pelicans without rookie Zion Williamson"	"basketball_nba"
"1"	"A 2,000-pound great white shark is swimming off the coast of Florida"	"newsus"
"0"	"Hate crimes remain at heightened levels, FBI report finds"	"newsus"
"0"	"McConnell discounts quick dismissal of Trump impeachment articles: 'We'll have to have a trial'"	"newspolitics"
"0"	"Selena Gomez and Julia Michaels Share a Kiss Before Getting Matching Arrow Tattoos"	"music-celebrity"
"0"	"Flamingo Ends Up In One Of The Coldest Parts Of Russia!"	"animals"
"0"	"Welcome to the World! All of the Celebrity Babies Who've Made Their Debuts in 2019"	"celebrity"
"0"	"Ford v Ferrari: the real story"	"autosnews"
"0"	"How the 2020 Chevrolet Silverado 1500 Has Improved (and Where it Still Falls Behind)"	"autostrucks"
"0"	"The Geno Smith coin toss conspiracy is the dumbest thing in Seahawks' win over 49ers"	"football_nfl"
"0"	"Gordon Hayward Shares First Update Following Hand Surgery With Instagram"	"basketball_nba"
"0"	"Boeing expects 737 MAX to resume commercial service in January"	"finance-companies"
"0"	"Watch: John Harbaugh shared awesome moment with Lamar Jackson"	"football_nfl"
"0"	"Is it really easier for men to lose weight? Experts explain"	"weightloss"
"0"	"Jennifer Lopez Just Got a Teeny Chop to Her Blond Lob, but it Changed the Entire Look"	"lifestylecelebstyle"
"1"	"Don't be fooled: Costco says $75 coupon is a scam"	"finance-companies"
"0"	"Lamar Odom Is Engaged to Sabrina Parr: See Her Ring!"	"celebrity"
"0"	"How to Make Sure You Have a Seat Next to Your Family on Your Next Flight"	"traveltips"
"1"	"Deer fatally attacks hunter who shot him"	"newsus"
"1"	"Orlando Scandrick rips Eagles: They have 'accountability issues'"	"football_nfl"
"1"	"The most haunted roads in the US and the chilling stories behind them"	"travelnews"
"0"	"2020 Ford Explorer launch hardly went according to plan, company admits"	"autosnews"
"0"	"Gabbard Lawyers Demand Clinton Retract 'Defamatory' Russian Asset Comments"	"elections-2020-us"
"0"	"Less Than 1% of People Can Ace This Shapes Brain Teaser"	"lifestyledidyouknow"
"0"	"Aston Martin DBX Luxury SUV: Price, First Interior Image Released"	"autosnews"
"0"	"Amid Trump impeachment drama, Ukrainians ponder a Putin meeting"	"newsworld"
"1"	"This Simple Hack Will Keep Spiders Out of Your House"	"lifestylesmartliving"
"0"	"Bolivian Leader Evo Morales Steps Down"	"newsworld"
"0"	"NFL Week 10 awards: Worst parachute landing goes to ..."	"football_nfl"
"0"	"Consumer prices rise most in 7 months on higher gas prices"	"markets"
"0"	"Fans are divided after Drake was revealed as a surprise festival headliner, booed off stage"	"musicnews"
"1"	"Car club goes 'above and beyond' for local law enforcement"	"newsgoodnews"
"0"	"The son of a Chinese billionaire has been banned from flying first class, playing golf, buying property, or going clubbing"	"newsworld"
"0"	"Flight Attendants Have a Secret Language You Didn't Know About"	"travelnews"
"1"	"Adele Lost 20 Pounds with Pilates and Cardio After Splitting From Simon Konecki"	"weightloss"
"1"	"This Is What the 2020 Toyota Supra Should've Looked Like From the Start"	"autosenthusiasts"
"0"	"Here Are the Biggest Deals We're Anticipating for Black Friday"	"shop-holidays"
"1"	"4 High School Students Killed in Texas Car Crash That Also Injured 3: 'We Grieve Together'"	"newsus"
"0"	"50 Things You Never Knew About Pizza"	"tipsandtricks"
"0"	"Justice Dept. rolls out new program to combat gun violence"	"newsus"
"1"	"Foie Gras Is Banned by New York City"	"foodnews"
"0"	"2009 CMA Awards fashion flashback"	"cma-awards"
"0"	"These are the new cars that depreciate least"	"autosresearchguides"
"0"	"The Tiny Hair Detail We Almost Missed in Storm Reid's People's Choice Awards Look"	"awardstyle"
"1"	"Navy lieutenant and wife charged with defrauding the United States"	"newsus"
"1"	"Bill Polian: 'I was wrong' for saying Lamar Jackson should be a wide receiver in NFL"	"football_nfl"
"0"	"Lexus just revealed the pricing for its first-ever luxury yacht   and a fully-loaded model will cost $4.85 million. Here's a closer look at LY 650."	"autosnews"
"1"	"AT&T fined $60 million for throttling 'unlimited' data plans"	"finance-companies"
"0"	"Can you answer these real Jeopardy questions about TV shows?"	"tv-gallery"
"1"	"This Guy Lost 30 Pounds and Gained a Rock-Hard Six Pack"	"weightloss"
"0"	"Hero Police Officer Saves Driver From Fiery Crash"	"newsgoodnews"
"0"	"2020 Jeep Wrangler Plug-In Hybrid Spied Hiding Its Charging Port"	"autoshybrids"
"0"	"Chevy Silverado ZRX Spied Showing Off Rugged Details"	"autostrucks"
"0"	"Senate confirms Chad Wolf to DHS post"	"newsus"
"0"	"Whitney Way Thore Responds After Trolls Shamed Her for Attempting a Power Snatch"	"wellness"
"0"	"The Latest Weight Loss Pills That Work And the Ones That Don't"	"nutrition"
"0"	"Nunes brands impeachment hearing 'low-rent, Ukrainian sequel' to Russia collusion"	"newspolitics"
"0"	"Sanders lands endorsement from nurses union"	"elections-2020-us"
"0"	"Cincinnati Teen Arrested After Allegedly Making Up Story about Missing Autistic 13-Year-Old Who Never Existed"	"newscrime"
"0"	"US Forest Service shuts down vandalized Georgia park feature"	"newsus"
"0"	"Heat suspend guard Dion Waiters 10 games after reported THC edible incident"	"basketball_nba"
"0"	"99 of the world's most amazing bucket-list experiences for 2020"	"internationaltravel"
"1"	"Opinion: Separating NFL's pretenders from contenders at midseason"	"football_nfl"
"0"	"San Diego State University freshman hurt in fraternity incident dies"	"newsus"
"1"	"Several Warriors leave bench during altercation/stoppage (video)"	"basketball_nba"
"0"	"WWE Wrestler Jordan Myles Quits in Expletive-Filled Rant as He Brands the Company Racist"	"tvnews"
"0"	"The stock market's 10-year run became the best bull market ever this month"	"markets"
"0"	"Chrissy Teigen's EPIC Reaction to Husband John Legend Being Named 2019 Sexiest Man Alive"	"video"
"1"	"Something fishy happened in that Texans-Chiefs call"	"football_nfl"
"0"	"8 Secret Spots You Never Knew Existed in Disney Parks"	"traveltips"
"0"	"Hall of Fame catcher Mike Piazza agrees to manage Team Italy"	"baseball_mlb"
"1"	"Lindsay Lohan's dad weighs in on her relationship with the Saudi crown prince"	"movies-celebrity"
"0"	"The Queen's Dressmaker Reveals She Uses Gin to Clean the Royal Jewels"	"lifestyleroyals"
"1"	"Top takeaways from Sunday's Week 8 NFL action"	"football_nfl"
"0"	"My New Instant, Bare-Fridge Dinner Starring Eggs, Of Course"	"quickandeasy"
"0"	"Kent, Taylor say they're not 'Never Trumpers' after Trump twitter offensive"	"newspolitics"
"0"	"'I Have Waited 68 Years to See This': How Honor Flights Help Veterans Reflect"	"newsus"
"0"	"Daisy Ridley plays coy about engagement speculation"	"movies-celebrity"
"0"	"How to get the best Costco Black Friday 2019 deals"	"finance-savemoney"
"1"	"Man who inherited 6 figures shares advice he'd give his younger self"	"personalfinance"
"0"	"Homeless woman living in SUV with dogs moves into apartment with community's help"	"newsgoodnews"
"0"	"Week 10 winners, losers: Saints implode in stunning loss; Eagles win without playing"	"football_nfl"
"1"	"Road built by biblical villain uncovered in Jerusalem"	"travelnews"
"0"	"Most Americans say they are struggling financially"	"personalfinance"
"0"	"In Defense Of Left Foot-Braking During Normal Street Driving"	"autosenthusiasts"
"0"	"35 musicians you should see live at least once in your life"	"music-gallery"
"0"	"30 Speedy and Delicious Potato Recipes to Make Tonight"	"quickandeasy"
"0"	"How I Got Lung Cancer at 31 Without Ever Smoking a Single Cigarette"	"health-cancer"
"0"	"McDonald's launches first seasonal McFlurry in 7 years"	"foodnews"
"1"	"The HoopsHype Daily: Trae Young putting up monstrous numbers"	"basketball_nba"
"0"	"How Russia Meddles Abroad for Profit: Cash, Trolls and a Cult Leader"	"newsworld"
"0"	"A Trump administration strategy led to the child migrant backup crisis at the border"	"newsus"
"0"	"These Are The Best Harley-Davidson Motorcycles You Can Get For The Cheap"	"autosmotorcycles"
"0"	"Subprime mortgages keep minting cash for former Bear Stearns banker"	"markets"
"0"	"The best burger and fries joint in your state"	"restaurantsandnews"
"0"	"Dean Foods files for bankruptcy"	"finance-companies"
"0"	"Aston Martin Vantage Volante Spied Looking Dark On A Foggy Day"	"autosnews"
"0"	"Chevy Says This Isn't a Mid-Engine C8 Corvette Hybrid Prototype"	"autosnews"
"0"	"Every touchdown from every Week 10 game"	"football_nfl_videos"
"0"	"Country music's biggest scandals"	"music-awards"
"0"	"Cassius Winston posts heartfelt message to late brother on Instagram"	"basketball_ncaa"
"0"	"Chin Hair: 7 Embarrassing Red Flags No Woman Should Ever Ignore"	"wellness"
"0"	"The Disney+ 'Lady and the Tramp' remake: A guide to the new cast members"	"movies-gallery"
"0"	"Report: Knicks' brass will stay on if team shows 'progress' this season"	"basketball_nba"
"1"	"Bucks exercising 2020-21 option on DiVincenzo"	"basketball_nba"
"0"	"2020 Ford Mustang Shelby GT350 vs. GT500: Which Is the Better Sports Car?"	"autosenthusiasts"
"1"	"Katie Holmes Talks About That Bra and Cardigan Moment"	"lifestylebuzz"
"0"	"Look of the Day"	"lifestylebuzz"
"0"	"Meghan Markle Chose a Chic Black Ensemble for Remembrance Sunday Services"	"lifestyleroyals"
"0"	"Cherry disappointed with MacLean's apology: 'He buried me'"	"icehockey_nhl"
"0"	"Trump says he's not watching impeachment hearing   then critiques it"	"newspolitics"
"0"	"See All the Best Photos of the Royal Family at Remembrance Sunday"	"lifestyleroyals"
"1"	"Airline Passenger Rights That Most American Travelers Don't Know About"	"video"
"0"	"Stella McCartney Deleted a Meghan Markle Instagram Post After Followers Called Her Out"	"lifestyleroyals"
"0"	"10 biggest disappointments of NFL Week 10"	"football_nfl"
"0"	"GOP memo outlines party's plan to defend Trump ahead of public hearings"	"newspolitics"
"0"	"Red tide, the toxic algae bloom that kills wildlife, returns to southwest Florida"	"newsus"
"0"	"2020 Corvette Doesn't Like The Snow, Crashes On Detroit Highway"	"autosenthusiasts"
"0"	"Meteor streaks through the sky over St. Louis"	"weathertopstories"
"1"	"Charles Rogers, former Michigan State football, Detroit Lions star, dead at 38"	"football_nfl"
"0"	"JuJu Smith-Schuster: Jalen Ramsey's right, I'm not Antonio Brown"	"football_nfl"
"0"	"Walmart releases Black Friday ad with $129 Apple Watch, TV deals, electronics doorbusters"	"finance-companies"
"0"	"Faroe Islands 'closed for maintenance' in April 2020"	"travelnews"
"0"	"These Are America's Favorite Liquor Brands"	"beverages"
"0"	"US held record number of migrant children in custody in 2019"	"newsus"
"1"	"Michael Douglas Weighs In on College Admissions Scandal: It's 'Egregious'"	"movies-celebrity"
"0"	"John Travolta Shares Rare Photo with Daughter Ella and Son Benjamin"	"movies-celebrity"
"0"	"Ex-Astros say team electronically stole signs during 2017 season"	"baseball_mlb"
"0"	"9 Incredible Places You'd Never Even Think To Spend Thanksgiving"	"ustravel"
"0"	"Massachusetts fire lieutenant dies battling house fire"	"newsus"
"0"	"The 10 Best Nonfiction Books of the 2010s"	"entertainment-books"
"1"	"Hey, Millennials, look out below! Gen Z may already be catching up in the salary race"	"finance-career"
"0"	"The 2019-2020 NHL Season"	"icehockey_nhl"
"0"	"The Best Beaches in Hawaii to Visit in Your Lifetime"	"traveltripideas"
"1"	"Missing college student's parents meet with mother of Natalee Holloway"	"newscrime"
"1"	"Luke DeCock: After Cole Anthony's spectacular UNC debut, he's not just talented. He's indispensable."	"basketball_ncaa"
"0"	"Red and Blue Economies Are Heading in Sharply Different Directions"	"markets"
"0"	"How to Turn Getting Kicked Off an Overbooked Flight Into a Payday"	"video"
"1"	"LeBron sends message of support to Steph after injury"	"basketball_nba"
"0"	"UK flooding: army to help recovery effort as more rain forecast"	"newsworld"
"0"	"Volvo S90 Facelift Spied Showing Small Design Tweaks"	"autosnews"
"0"	"How and When to Watch the House Impeachment Hearings"	"newspolitics"
"0"	"Russell Wilson vs. 49ers' No. 1 defense: Monday night's prime-time matchup"	"football_nfl"
"0"	"Audi E-Tron S Possibly Spied Testing At The Nurburgring Again"	"autosnews"
"0"	"Top 100 country songs of all time"	"cma-awards"
"1"	"Hurts might be a better Oklahoma QB than Mayfield, Murray"	"football_ncaa"
"1"	"Shia LaBeouf Spoke to His Dad for the First Time in 7 Years After Court-Mandated 'Head Camp'"	"movies-celebrity"
"1"	"How I Got Lung Cancer at 31 Without Ever Smoking a Single Cigarette"	"health-cancer"
"0"	"'Grandma Joy,' grandson share photos of US as they try visiting all national parks"	"newsgoodnews"
"0"	"Please Don't Yell at Your Dog!"	"lifestylebuzz"
"0"	"Brainteaser challenges puzzlers to spot the reindeer headband in the sea of festive sweaters"	"lifestylebuzz"
"0"	"What to care/not care about from Week 10: Cowboys' crucial error wastes Dak's brilliance"	"football_nfl"
"0"	"Ohio-grown Christmas trees headed to troops overseas"	"newsgoodnews"
"0"	"Kaley Cuoco Says Having 'Separate Lives' Has Helped Her Marriage to Karl Cook"	"tv-celebrity"
"1"	"45 Abandoned Places Around the World That Are Eerily Beautiful"	"traveltripideas"
"1"	"Ashley Graham Says She Has a Major Case of Pregnancy Brain But What Is That?"	"wellness"
"0"	"Thanksgiving side dishes: 11 unique recipes to try this season"	"foodnews"
"0"	"Cook leads Vikings to 28-24 prime-time road win over Cowboys"	"football_nfl"
"0"	"Stars who've had more than one wedding with the same spouse"	"entertainment-celebrity"
"0"	"Exclusive: 2021 Kia Optima Could Look Like This"	"autosnews"
"0"	"Frackers Prepare to Pull Back, Exacerbating a Slowdown in U.S. Oil Growth"	"markets"
"0"	"Matthew Koma's New Tattoo for His Kids Will Melt Your Heart"	"tv-celebrity"
"0"	"Why Prince Harry Wore His Remembrance Poppy Differently from the Rest of the Royal Family"	"lifestyleroyals"
"0"	"Win Weeknights with These Crazy-Delicious Instant Pot Recipes"	"quickandeasy"
"0"	"Signs of Dementia: 8 Tips For Talking to Your Older Parents"	"mentalhealth"
"0"	"The Key to Mastering Goulash, the World's Most Famous Stew"	"recipes"
"0"	"AD impresses LeBron, Vogel by playing through injuries"	"basketball_nba"
"0"	"Opinion: All those predictions of the NFL's impending demise now seem quite silly"	"football_nfl"
"0"	"Prince Harry and Meghan Markle just shared a never-before-seen photo of baby Archie with his 'Grandpa' Prince Charles to celebrate his birthday"	"lifestyleroyals"
"0"	"What It Was Like Inside the Homes of the Pilgrims"	"lifestylehomeandgarden"
"0"	"Harry and Meghan Revive Feud Rumors By Staying Away From the Royal Family's Christmas"	"lifestyleroyals"
"0"	"5 reasons you might not want to book a cruise on a brand-new ship"	"traveltips"
"0"	"Cassius Winston posts double-double a day after his brother's death"	"basketball_ncaa"
"0"	"Sources: Clippers star Paul George plans to make season debut Thursday"	"basketball_nba"
"0"	"FCA And GM Unfazed By The Ford Bronco's Return"	"autosnews"
"0"	"These Are The 20 Greatest Female Country Singers In History"	"cma-awards"
"0"	"Mulvaney Request to Join Subpoena Lawsuit Opposed by House"	"newspolitics"
"0"	"All of the Thanksgiving Items You Should Buy from Trader Joe's"	"tipsandtricks"
"0"	"Stocks close higher on optimism over China trade deal"	"markets"
"0"	"Draymond criticizes official for ejection: 'Don't tell me not to talk'"	"basketball_nba"
"0"	"32 things we learned from Week 10 of NFL season"	"football_nfl"
"1"	"Doctors warn addiction of 'human Ken doll' has gotten dangerous"	"medical"
"1"	"Here's How to Make McDonald's Special Sauce at Home"	"recipes"
"1"	"Zion Williamson's knee injury history, explained"	"basketball_nba"
"0"	"Nurse takes in man with autism so he can get a new heart"	"newsgoodnews"
"1"	"Why the Patriots made a very un-Patriots trade for Mohamed Sanu"	"football_nfl"
"1"	"The 2019 NFL midseason MVP rankings"	"football_nfl"
"0"	"What Is a Sleep Divorce and Should You Get One?"	"wellness"
"0"	"Christopher Johnson has hitched his reputation to Adam Gase"	"football_nfl"
"1"	"17 photos that show the ugly truth of living in a tiny house"	"lifestylehomeandgarden"
"0"	"The 2019 NFL Season"	"football_nfl"
"1"	"Bucs not considering a QB change"	"football_nfl"
"0"	"SEMA 2019: Cars and Trucks Gone Wild"	"autossema"
"1"	"Student barred from reselling Krispy Kreme now teaming up with the doughnut chain"	"foodnews"
"0"	"Every Food Gift on Oprah's Favorite Things List"	"foodnews"
"1"	"Toyota Supra vs. Ford Mustang Shelby GT350: Kicking Tail!"	"autossports"
"1"	"IHOP Will Give You Free Dinner If You Eat At Its Teeny, Tiny New Restaurant"	"foodnews"
"0"	"These 7 sports cars crushed their horsepower ratings in our dyno tests"	"autossports"
"0"	"Prince Charles just turned 71   here are the best photos from every year of his royal career so far"	"lifestyleroyals"
"0"	"Rip Taylor's Cause of Death Revealed, Memorial Service Scheduled for Later This Month"	"tvnews"
"0"	"Anonymous anti-Trump book is already a hit and it's not on shelves until next week"	"newspolitics"
"0"	"65 Best Fall Soups That Will Warm You and Your Family Up All Season Long"	"recipes"
"0"	"Best, worst QB performances from NFL Week 10"	"football_nfl"
"0"	"New Zealand's euthanasia bill passes, referendum to be held"	"newsworld"
"0"	"Knicks execs 'not happy' with poor start; David Fizdale reaches to spin results"	"basketball_nba"
"0"	"EXTRA SHARP: One-Bowl Peanut Butter Cookies"	"videos"
"0"	"Longtime Republican Rep. Pete King won't seek reelection"	"elections-2020-us"
"0"	"The Volkspod VW Beetle Minibikes Are Part Creepy, Part Adorable"	"autosmotorcycles"
"0"	"Officials: At least 13 dead in Slovakia bus crash"	"newsworld"
"1"	"Anxious and Cooped Up, 1.5 Million Kashmiri Children Are Still Out of School"	"newsworld"
"1"	"Opinion: Why did the Nets start firestorm over Kyrie Irving's behavior?"	"basketball_nba"
"0"	"Photos of the Day"	"newsworld"
"0"	"On a frigid night in Dallas, one man who used to be homeless ushered people to shelter"	"weathertopstories"
"0"	"Chuck Woolery: Supporting Trump 'pretty much destroyed my career'"	"tv-celebrity"
"0"	"We Had a Babysitter Come to Our Hotel Room at Disney World, and It Was SO Worth It"	"voices"
"0"	"1969 Chevrolet Camaro Z/28 emerges from a garage after sitting for over 30 years"	"autosclassics"
"0"	"Bode Miller delivered his twin boys after midwife didn't make it time for the birth"	"more_sports"
"0"	"A teen received a response to a message in a bottle he wrote 9 years ago after it traveled over 3,000 miles"	"lifestylebuzz"
"0"	"Trump puts economic growth at center of his 2020 campaign"	"markets"
"0"	"Stars Who Served in the Military"	"entertainment-celebrity"
"0"	"Tua Tagovailoa again considered game-time decision with ankle injury"	"football_ncaa"
"0"	"Kim Kardashian Looked Minty Fresh in Versace at the People's Choice Awards"	"awardstyle"
"0"	"Selena Gomez Opens Up About Being Body Shamed for Gaining Weight Amidst Lupus Battle"	"wellness"
"0"	"Supreme Court Justices Couldn't Stop Interrupting Each Other During DACA Oral Arguments"	"newsus"
"0"	"2020 Lincoln Corsair Review: The Sleeper Hit of 2020 SUV of the Year Testing"	"autossuvs"
"0"	"Drake Has Something to Say to the ''Kids'' Who Booed Him Off Stage"	"musicnews"
"0"	"Taylor testifies he was told Trump cared more about 'investigations' than Ukraine"	"newspolitics"
"0"	"Detroit Lions' Darius Slay: Things will get 'ugly' if we don't win out"	"football_nfl"
"0"	"Republicans shrug off impeachment hearings as 'boring'"	"newspolitics"
"0"	"The 50 cheapest places to buy land in America"	"finance-real-estate"
"0"	"Martha Stewart shares the family favorites she serves during the holidays, including adding cream cheese to her mashed potatoes"	"foodnews"
"0"	"A $30,000 handbag. A disastrous wine spill. And now, a country club is suing its own waiter."	"markets"
"0"	"Southwest's Spring Travel Sale Includes $39 One-way Tickets"	"travelnews"
"0"	"4 reasons you shouldn't max out your 401(k)"	"finance-saving-investing"
"0"	"Chief Justice John Roberts, who's clashed with Trump, would oversee impeachment trial"	"newspolitics"
"0"	"This Guy Lost 30 Pounds and Gained a Rock-Hard Six Pack"	"weightloss"
"0"	"Additional details emerge surrounding Colin Kaepernick's NFL workout"	"football_nfl"
"0"	"Trump Organization ordered to pay $290,000 after losing battle against Scottish wind farm"	"newspolitics"
"0"	"Family Reunited With Dog Who Had Been Missing Since August While Waiting in Line to Adopt Cat"	"lifestylebuzz"
"0"	"Rare Mustang! 1968 Shelby GT500 Prototype"	"autosclassics"
"1"	"Adorable Rescue 'Puppy' Turns Out To Be Wild Dingo"	"lifestylebuzz"
"0"	"Reports: Knicks trying to hire Raptors president Masai Ujiri, could fire coach David Fizdale"	"basketball_nba"
"0"	"Take a sneak peek at construction of the Rams' stunning new stadium"	"football_nfl"
"1"	"He Never Smoked a Day in His Life. At 28, He Was Diagnosed With Lung Cancer."	"medical"
"0"	"Hugh Jackman Congratulates John Legend on Sexiest Man Alive While Poking Fun at Ryan Reynolds"	"movies-celebrity"
"0"	"50 amazing gifts for every type of person and budget"	"shop-holidays"
"0"	"The McLaren Elva Is a $1.7 Million Topless, Windshield-less Hypercar"	"autosenthusiasts"
"0"	"'I Stayed Off Social Media Entirely Because Of My Weight. Then I Discovered Intermittent Fasting And Lost 109 Lbs.'"	"voices"
"0"	"Unexpected Signs of an Unhealthy Heart"	"medical"
"0"	"America's Most and Least Popular Senators"	"newspolitics"
"0"	"AP Exclusive: Buttigieg would pick VA's 1st female secretary"	"elections-2020-us"
"0"	"I Have Smiling Depression This Is What It Feels Like"	"voices"
"0"	"Instructions Came From Trump, Schiff Says: Impeachment Update"	"newspolitics"
"1"	"Eric Tse, 24, just became a billionaire overnight"	"markets"
"0"	"Still teaching at 95, Jimmy Carter draws devotees to church"	"newsus"
"0"	"Which NFL teams would be a fit for Colin Kaepernick? Ranking all from 32 to 1"	"football_nfl"
"0"	"Visa, Mastercard draw FTC inquiry over debit card transactions"	"newsbusiness"
"0"	"Shocking Daycare Rate List Sparks Outrage & Shines a Light on Child Care Crisis in America"	"lifestylebuzz"
"1"	"Subway just released a sandwich with green eggs and ham"	"foodnews"
"0"	"Jess Lost 75 Pounds Without Counting Calories and Did This 1 Inspiring Thing Before Every Meal"	"weightloss"
"0"	"Mulvaney's move to join impeachment testimony lawsuit rankles Bolton allies"	"newspolitics"
"0"	"Wealthy investors are bracing for a sharp stock sell-off in 2020"	"markets"
"0"	"See the most expensive watch ever sold at auction"	"viral"
"0"	"Do Pilots Actually Avoid Flying Over the Bermuda Triangle?"	"video"
"0"	"Luhnow says Astros 'try and follow the rules' amid sign-stealing inquiry"	"baseball_mlb"
"0"	"Iran launches nuclear enrichment at underground Fordow plant, IAEA confirms"	"newsworld"
"0"	"Kanye West is teaming up with pastor Joel Osteen: Details"	"music-celebrity"
"1"	"691,145 Californians left last year: What state did they go to?"	"finance-real-estate"
"0"	"Fashion hits and misses from the 2019 Country Music Association Awards"	"cma-awards"
"0"	"105 Black Friday Deals You Can Start Shopping Today"	"shop-holidays"
"0"	"'DACA is everything': Dreamers, families rally as Supreme Court takes up its future"	"newsus"
"0"	"Rising temperatures put U.S. troops at risk during training, report finds"	"newsus"
"1"	"Failed operation underlines Mexico chaos"	"newsworld"
"0"	"Dramatic Footage Shows Plane Skidding Off Runway at O'Hare Airport in Chicago"	"viral"
"0"	"Top Putin aide named by MH17 airliner investigators"	"newsworld"
"0"	"Myanmar accused at UN court of genocide against Rohingya"	"newsworld"
"1"	"Japan Wants You To Stop Buying All Its Skyline GT-Rs"	"autosenthusiasts"
"0"	"The Most Addictive Casseroles You're Not Making Yet"	"recipes"
"0"	"Report: Election vendors are 'prime targets,' need oversight"	"elections-2020-us"
"1"	"'I am scared all the time': Chimps and people are clashing in rural Uganda"	"newsworld"
"0"	"Read: William Taylor's opening statement at impeachment hearing"	"newspolitics"
"1"	"Andrew Yang's Campaign Has a Lot of Money. Now What?"	"markets"
"0"	"What this week's 5 biggest upsets mean for the NFL playoff picture"	"football_nfl"
"0"	"NFL reviewing Detroit Lions' handling of Matthew Stafford injury report"	"football_nfl"
"0"	"The world's first hybrid cruise ship is currently on its maiden voyage⁠ take a look inside"	"travelnews"
"0"	"Jane Seymour, 68, claims many designers won't 'dress someone my age'"	"tv-celebrity"
"0"	"Why the College Football Playoff selection committee can't make a case for Alabama"	"football_ncaa"
"1"	"Deer stranded 5 miles offshore saved by Maine lobstermen"	"newsgoodnews"
"0"	"What Menopause Does to Women's Brains"	"wellness"
