"1"	"Why Don't All Cars Have a Rear Windshield Wiper?"	"autosownership"	"Why don't all cars have a rear windshield wiper? A number of factors go into the decision, like fuel economy and aerodynamics."
"0"	"10 most stunning early trends around the NBA"	"basketball_nba"	"Youngsters Luka Doncic and Pascal Siakam are taking their games to new heights, while a former No. 1 overall pick is doing his best to shed the "bust" label."
"0"	"SEMA 2019 Photo Highlights From Las Vegas"	"autossema"	"Photographic Highlights from the 2019 SEMA Show in Las Vegas.… The post SEMA 2019 Photo Highlights From Las Vegas appeared first on autoNXT.net."
"0"	"Kristaps Porzingis 'can't blame' Rick Carlisle for fourth-quarter benching"	"basketball_nba"	"Kristaps Porzingis has indicated he understands why Rick Carlisle benched him for the majority of the fourth quarter during the Dallas Mavericks' 116-106 loss to the Boston Celtics on Monday night, a game in which the star struggled mightily."
"0"	"Deval Patrick Will Enter 2020 Presidential Race on Thursday"	"elections-2020-us"	"Former Gov. Deval Patrick of Massachusetts told senior Democrats Wednesday that he will enter the presidential race, according to two party officials, reversing his decision last year to forgo a run and adding yet more volatility to an unusually fluid Democratic primary. Mr. Patrick will enter the race Thursday morning and head to New Hampshire's State House to file paperwork to be a candidate on the primary ballot there, according..."
"0"	"Paul Sullivan: Baseball's hot stove league could use an NBA-style spark after the slow pace of the last few offseasons"	"baseball_mlb"	"When discussing teams' interest in free agent Bryce Harper last year at the general managers meetings, agent Scott Boras cautioned that many suitors would be playing it cool over the winter."
"0"	"200 Shocking Home Photos You Have to See"	"lifestylehomeandgarden"	"We know a good DIY project when we see it, but these aren't them. Some of these are goofy, some are head scratchers and some are downright dangerous. Check these photos out, you'll definitely learn a thing or two!"
"0"	"Thunberg, teen climate activist, leaves US aboard catamaran"	"newsus"	"Swedish teen climate activist Greta Thunberg has left North America to begin her return trip across the Atlantic aboard a 48-foot (15-meter) catamaran sailboat whose passengers include an 11-month-old baby."
"1"	"The 2020 Porsche 911 Carrera S Is MotorTrend 's 2019 Best Driver's Car"	"autosresearch"	"Once more, with feeling: Porsche takes the BDC trophy. Again."
"1"	"California power outages hit more than 500,000 amid high winds and fires across the state"	"newsus"	"More than half a million people woke up without power Thursday as California faces hot weather, strong winds and fast-moving wildfires that have erupted across the state."
"1"	"NFL coach has theory about why Trubisky is struggling"	"football_nfl"	"Mitchell Trubisky has taken a major step back in his third season."
"0"	"Comics - '9 to 5' by Harley Schwadron"	"humor"	"Daily comics: '9 to 5' by Harley Schwadron"
"0"	"My Third Husband Is 102 Years Old. Here's What Our Marriage Is Like."	"voices"	"When I was 65 years old, I married a man 25 years my senior. This was thethird marriage for both of us, and he was almost 90. Mutual friends introducedus ― his best friend was married to my best friend ― because we were bothwidows, and apparently I needed more of a social life.It started out innocently as two friends hanging out. He liked to take me outto fancy Los Angeles restaurants. He had his handyman fix everything for me,and he brought his..."
"1"	"Opinion: Five issues facing the New Orleans Pelicans without rookie Zion Williamson"	"basketball_nba"	"Zion Williamson's knee injury will sideline him for at least 20 games and is likely to have a season-long impact on the New Orleans Pelicans."
"1"	"A 2,000-pound great white shark is swimming off the coast of Florida"	"newsus"	"A great white shark that weighs over 2,000 pounds and measures 15 feet, 5 inches long has been swimming along the US East Coast."
"0"	"Hate crimes remain at heightened levels, FBI report finds"	"newsus"	"The number of hate crime incidents reported to the FBI last year remain at the heightened levels they surged to in 2017, according to statistics released Tuesday by the bureau."
"0"	"McConnell discounts quick dismissal of Trump impeachment articles: 'We'll have to have a trial'"	"newspolitics"	"Senate Majority Leader Mitch McConnell (R-Ky.) brushed aside a question on Wednesday about trying to quickly dismiss the articles of impeachment against President Trump, noting the chamber would have to have a trial."I don't think there's any question that we have to take up the matter. The rules of impeachment are very clear, we'll have to have a trial. My own view is that we should give people the opportunity to put the case on," McConnell..."
"0"	"Selena Gomez and Julia Michaels Share a Kiss Before Getting Matching Arrow Tattoos"	"music-celebrity"	"Selena Gomez and Julia Michaels Get Matching Arrow Tattoos"
"0"	"Flamingo Ends Up In One Of The Coldest Parts Of Russia!"	"animals"	"When you think of flamingos, you probably think of warm temperatures and fun in the sun... Buzz60's Mercer Morrison has the story."
"0"	"Welcome to the World! All of the Celebrity Babies Who've Made Their Debuts in 2019"	"celebrity"	"See who's made their debut so far this year"
"0"	"Ford v Ferrari: the real story"	"autosnews"	"The film about the epic Le Mans rivalry promises to be a must for car fans - and this is the real story behind it"
"0"	"How the 2020 Chevrolet Silverado 1500 Has Improved (and Where it Still Falls Behind)"	"autostrucks"	"A few changes earn the 2020 Silverado 1500 finalist status at 2020 Truck of the Year"
"0"	"The Geno Smith coin toss conspiracy is the dumbest thing in Seahawks' win over 49ers"	"football_nfl"	"Did Geno Smith say "heads" or "tails" in the coin flip for overtime?"
"0"	"Gordon Hayward Shares First Update Following Hand Surgery With Instagram"	"basketball_nba"	"https://www.dailymotion.com/embed/video/x nww f Gordon Hayward had successful surgery on his left hand Monday but now we have an update from the forward himself. Hayward's procedure to repair a fourth metacarpal"
"0"	"Boeing expects 737 MAX to resume commercial service in January"	"finance-companies"	"Boeing now says it expects 737 MAX to resume commercial service in January"
"0"	"Watch: John Harbaugh shared awesome moment with Lamar Jackson"	"football_nfl"	"Lamar Jackson has done more this season than simply prove he is capable of being a starting quarterback in the NFL   he has turned himself into a full-blown superstar."
"0"	"Is it really easier for men to lose weight? Experts explain"	"weightloss"	"There are reasons men and women lose weight differently   and it starts with puberty."
"0"	"Jennifer Lopez Just Got a Teeny Chop to Her Blond Lob, but it Changed the Entire Look"	"lifestylecelebstyle"	"In September, Jennifer Lopez debuted a new hairstyle at the premiere of Hustlers."
"1"	"Don't be fooled: Costco says $75 coupon is a scam"	"finance-companies"	"Wholesale retailer Costco is warning customers about a new scam that is promising shoppers a $75 coupon."
"0"	"Lamar Odom Is Engaged to Sabrina Parr: See Her Ring!"	"celebrity"	"Lamar Odom Is Engaged to Sabrina Parr: See Her Ring!"
"0"	"How to Make Sure You Have a Seat Next to Your Family on Your Next Flight"	"traveltips"	"Because no one wants to get split up."
"1"	"Deer fatally attacks hunter who shot him"	"newsus"	"In what officials are calling a bizarre incident, an Arkansas hunter was killed by a deer that he thought he had killed."
"1"	"Orlando Scandrick rips Eagles: They have 'accountability issues'"	"football_nfl"	"Orlando Scandrick found himself released on Monday, one day after surrendering the first touchdown of the Week 7 game against his former team, the Dallas Cowboys."
"1"	"The most haunted roads in the US and the chilling stories behind them"	"travelnews"	"Here are 10 creepy roads said to be haunted by ghosts and paranormal activity. Drive them if you dare."
"0"	"Gabbard Lawyers Demand Clinton Retract 'Defamatory' Russian Asset Comments"	"elections-2020-us"	"Gabbard received bipartisan criticism over her foreign policy, especially her view that Syria's Bashar al Assad is "not an enemy" of the U.S."
"0"	"Less Than 1% of People Can Ace This Shapes Brain Teaser"	"lifestyledidyouknow"	"Who knew shapes could be so confounding?! The post Less Than 1% of People Can Ace This Shapes Brain Teaser appeared first on Reader's Digest."
"0"	"Aston Martin DBX Luxury SUV: Price, First Interior Image Released"	"autosnews"	"Take your first peek inside Aston Martin's first-ever SUV, but brace yourself for the cost."
"0"	"Amid Trump impeachment drama, Ukrainians ponder a Putin meeting"	"newsworld"	""The worst thing we can do is become a bargaining chip," Ukraine's foreign minister said of the impeachment hearings. "Unfortunately, we are such a chip now.""
"1"	"This Simple Hack Will Keep Spiders Out of Your House"	"lifestylesmartliving"	"It's chemical-free! The post This Simple Hack Will Keep Spiders Out of Your House appeared first on Reader's Digest."
"0"	"Bolivian Leader Evo Morales Steps Down"	"newsworld"	"President Evo Morales of Bolivia, who came to power more than a decade ago as part of a leftist wave sweeping Latin America, resigned on Sunday after unrelenting protests by an infuriated population that accused him of undermining democracy to extend his rule."
"0"	"Consumer prices rise most in 7 months on higher gas prices"	"markets"	"Americans paid higher prices for gasoline, medical treatment and recreation in October, but inflation more broadly remained low and fairly stable. The consumer price index rose 0.4% in October, with energy accounting for more than half the increase."
"0"	"Fans are divided after Drake was revealed as a surprise festival headliner, booed off stage"	"musicnews"	"Fans are divided after the audience at Tyler, The Creator's Camp Flog Gnaw festival booed Drake, who was revealed to be the surprise headliner."
"1"	"Car club goes 'above and beyond' for local law enforcement"	"newsgoodnews"	"For a year members of Small Town Cruizers car club worked countless hours in hopes of helping Tulare Police Department buy a new police dog."
"0"	"The son of a Chinese billionaire has been banned from flying first class, playing golf, buying property, or going clubbing"	"newsworld"	"Wang Sicong, the heir of Chinese real estate mogul Wang Jianlin's estimated $12.5 billion fortune, is said to have a personal debt of $21.6 million."
"0"	"Flight Attendants Have a Secret Language You Didn't Know About"	"travelnews"	"Here are some phrases only flight attendant use   and what they actually mean."
"1"	"Adele Lost 20 Pounds with Pilates and Cardio After Splitting From Simon Konecki"	"weightloss"	"She debuted her slimmer figure in early October."
"1"	"This Is What the 2020 Toyota Supra Should've Looked Like From the Start"	"autosenthusiasts"	"That wing should be standard on every Supra. The fact that it isn't is a tragedy."
"0"	"Here Are the Biggest Deals We're Anticipating for Black Friday"	"shop-holidays"	"The Black Friday deals for 2019 have already begun leaking out. Get a sneak peek at what to expect from popular retailers like Costco, Walmart, and Best Buy. Browse our guide and use it to plan your attack for the biggest shopping event of the year."
"1"	"4 High School Students Killed in Texas Car Crash That Also Injured 3: 'We Grieve Together'"	"newsus"	"4 High School Students Killed in Texas Car Crash"
"0"	"50 Things You Never Knew About Pizza"	"tipsandtricks"	"Find out every tasty fact you need to know about the world's most popular food: pizza."
"0"	"Justice Dept. rolls out new program to combat gun violence"	"newsus"	"MEMPHIS, Tenn. (AP)   Attorney General William Barr announced a new initiative Wednesday that would better enforce the U.S. gun background check system, coordinate state and federal gun cases and ensure prosecutors quickly update databases to show when a defendant can't possess a firearm because of mental health issues. The push, known as Project Guardian, was unveiled at a news conference in Memphis, Tennessee, alongside officials from the..."
"1"	"Foie Gras Is Banned by New York City"	"foodnews"	"Lutèce served it seared, with dark chocolate sauce and bitter orange marmalade. Le Cirque offered it in classic terrine form, but also served it with rabbit and bacon and made it the scene-stealer in a ravioli dish. But Lutèce closed in New York in 2004. Le Cirque shut its last Manhattan location in 2017. And foie gras, the calling card of fine French dining, is about to follow suit. The New York City Council overwhelmingly passed legislation on..."
"0"	"2009 CMA Awards fashion flashback"	"cma-awards"	"See what the stars wore to the Country Music Association Awards 10 years ago."
"0"	"These are the new cars that depreciate least"	"autosresearchguides"	"Don't want to lose a ton of money on your next new car? These are the new car models that hold the most value after five years."
"0"	"The Tiny Hair Detail We Almost Missed in Storm Reid's People's Choice Awards Look"	"awardstyle"	"Storm Reid arrived at the People's Choice Awards with a tiny hair accessory that was so stunning, you'd swear it was out of this world."
"1"	"Navy lieutenant and wife charged with defrauding the United States"	"newsus"	"A Navy lieutenant and his wife have been arrested for conspiracy to defraud the government, making false statements to investigators and illegally possessing a firearm."
"1"	"Bill Polian: 'I was wrong' for saying Lamar Jackson should be a wide receiver in NFL"	"football_nfl"	"A year and a half after suggesting Ravens QB Lamar Jackson should play WR in the NFL, Hall of Fame GM Bill Polian is admitting he was wrong."
"0"	"Lexus just revealed the pricing for its first-ever luxury yacht   and a fully-loaded model will cost $4.85 million. Here's a closer look at LY 650."	"autosnews"	"The Lexus Sport Yacht Concept was first shown in January 2017, and the brand has finally delivered on making the LY 650 a reality."
"1"	"AT&T fined $60 million for throttling 'unlimited' data plans"	"finance-companies"	"Unlimited should mean unlimited!"
"0"	"Can you answer these real Jeopardy questions about TV shows?"	"tv-gallery"	"Culling data straight from the "Jeopardy!" archives, Stacker will provide a "clue" about TV shows and then present the answer in the form of a question on the following slide. Can you answer these real "Jeopardy!" questions about TV shows?"
"1"	"This Guy Lost 30 Pounds and Gained a Rock-Hard Six Pack"	"weightloss"	"Pizza, Chinese take-out, McDonald's, ice cream, you name it   "If it isn't good for you, I would enjoy eating it in large quantities," says Chris Anderson."
"0"	"2020 Jeep Wrangler Plug-In Hybrid Spied Hiding Its Charging Port"	"autoshybrids"	"Classic looks, modern tech."
"0"	"Chevy Silverado ZRX Spied Showing Off Rugged Details"	"autostrucks"	"A skid plate and higher ride height are among the tweaks."
"0"	"Senate confirms Chad Wolf to DHS post"	"newsus"	"With a 54-41 vote, the Senate on Wednesday confirmed Chad Wolf as undersecretary of the Department of Homeland Security's Office of Strategy, Policy, and Plans. Wolf is now clear to take over the mantle as head of the entire agency from Kevin McAleenan, who resigned as acting DHS secretary more than a month ago. Wolf was nominated to the undersecretary position in February by President Donald Trump but was never confirmed. He has been performing..."
"0"	"Whitney Way Thore Responds After Trolls Shamed Her for Attempting a Power Snatch"	"wellness"	""My Big Fat Fabulous Life" star Whitney Way Thore attempted an Olympic weightlifting move known as a power snatch. The trolls came out, but Whitney let her progress speak for itself."
"0"	"The Latest Weight Loss Pills That Work And the Ones That Don't"	"nutrition"	"When diet and exercise aren't working, the answer may be at the drugstore."
"0"	"Nunes brands impeachment hearing 'low-rent, Ukrainian sequel' to Russia collusion"	"newspolitics"	"House Intelligence Committee ranking member Rep. Devin Nunes kicked off the first public hearing of the impeachment probe by dismissing the allegations against President Trump."
"0"	"Sanders lands endorsement from nurses union"	"elections-2020-us"	"Democratic presidential contender Sen. Bernie Sanders (I-Vt.) on Tuesday announced an endorsement from National Nurses United, the largest union of registered nurses in the U.S."
"0"	"Cincinnati Teen Arrested After Allegedly Making Up Story about Missing Autistic 13-Year-Old Who Never Existed"	"newscrime"	""There was no missing person, the story was fabricated. The person who reported to offense has been arrested and our investigation has been closed," the Cincinnati Police Department confirmed."
"0"	"US Forest Service shuts down vandalized Georgia park feature"	"newsus"	"GAINESVILLE, Ga. (AP)   The U.S. Forest Service says vandalism is forcing it to shut down a popular fall leaf viewing destination in Georgia. The agency posted photos to Facebook on Friday showing a wooden platform covered in white spray paint overlooking the mountainous north Georgia landscape at Chattahoochee-Oconee National Forests."
"0"	"Heat suspend guard Dion Waiters 10 games after reported THC edible incident"	"basketball_nba"	"The 27-year-old guard did not play in Friday's loss to the Lakers due to illness. Waiters is in the third year of a four-year, $52 million contract and has not played this season."
"0"	"99 of the world's most amazing bucket-list experiences for 2020"	"internationaltravel"	"We've all got a bucket list of those must-see sights and experiences we want to have around the world. Ours seems to be getting longer by the day and if yours could do with some extra inspiration for 2020, read on. From amazing adventures to dream destinations, here are 99 of the world's most unmissable travel experiences for 2020."
"1"	"Opinion: Separating NFL's pretenders from contenders at midseason"	"football_nfl"	"Midway through the season, the NFL's better teams have begun to distinguish themselves. A look at the pretenders, contenders and potential X-factors."
"0"	"San Diego State University freshman hurt in fraternity incident dies"	"newsus"	"SAN DIEGO - Dylan Hernandez, the 19-year-old San Diego State University freshman who required medical attention last week after an unspecified incident at one school's fraternities, has died, campus officials said on Monday. "His family gave their goodbyes late Sunday night," SDSU President Adela de la Torre said in a statement."
"1"	"Several Warriors leave bench during altercation/stoppage (video)"	"basketball_nba"	"The injury-ravaged Warriors got a satisfying win last night. But will the game leave them even more short-handed?"
"0"	"WWE Wrestler Jordan Myles Quits in Expletive-Filled Rant as He Brands the Company Racist"	"tvnews"	"WWE Wrestler Jordan Myles Quits, Calls Company Racist"
"0"	"The stock market's 10-year run became the best bull market ever this month"	"markets"	"The current bull market, which started March 9, 2009, has enjoyed a whopping 468% gain for the S&P 500 through the first day of November."
"0"	"Chrissy Teigen's EPIC Reaction to Husband John Legend Being Named 2019 Sexiest Man Alive"	"video"	"Chrissy Teigen had the best response to John Legend becoming People Magazine's 2019 Sexiest Man Alive."
"1"	"Something fishy happened in that Texans-Chiefs call"	"football_nfl"	"There was no pool report, no video from Al Riveron. And there likely will be no public admission regarding the conversation(s) that resulted in a key defensive pass interference foul being wiped out in the Texans-Chiefs game. But something fishy happened, as evidenced by the images broadcast by CBS. It occurred with the Chiefs leading [more]"
"0"	"8 Secret Spots You Never Knew Existed in Disney Parks"	"traveltips"	"Make your next trip even more magical."
"0"	"Hall of Fame catcher Mike Piazza agrees to manage Team Italy"	"baseball_mlb"	"Baseball Hall of Fame catcher Mike Piazza, a 12-time All-Star, will manage Italian national baseball team for its upcoming international tournaments."
"1"	"Lindsay Lohan's dad weighs in on her relationship with the Saudi crown prince"	"movies-celebrity"	"Michael Lohan denies that Lindsay is dating the controversial royal known as MBS but acknowledges that they're friends."
"0"	"The Queen's Dressmaker Reveals She Uses Gin to Clean the Royal Jewels"	"lifestyleroyals"	"The Queen's Jewels Are Polished with Gin and Water"
"1"	"Top takeaways from Sunday's Week 8 NFL action"	"football_nfl"	"A statement from the 49ers and questionable decisions from the Broncos and Bears highlight the top takeaways from Week 8 in the NFL."
"0"	"My New Instant, Bare-Fridge Dinner Starring Eggs, Of Course"	"quickandeasy"	"Every week in Genius Recipes often with your help! Food52 Creative Director and lifelong Genius-hunter Kristen Miglore is unearthing recipes that will change the way you cook. For the nights the many, many nights when I forget about dinner, I found a new escape hatch. It's faster than boiling a pot of pasta water, easier to clean up than grilled cheese, and only requires adding one more staple to your fridge that might not already be there...."
"0"	"Kent, Taylor say they're not 'Never Trumpers' after Trump twitter offensive"	"newspolitics"	"Bill Taylor, the top U.S. diplomat in Ukraine, and George Kent, a top State Department official, denied during Wednesday's first public impeachment hearing that they are "never Trumpers."Rep. Eric Swalwell (D-Calif.) asked Kent and Taylor if they identify as "never Trumpers," a label the president assigned them on Twitter ahead of the hearing."Just about an hour before the two of you sat down to testify today the president tweeted multiple...""
"0"	"'I Have Waited 68 Years to See This': How Honor Flights Help Veterans Reflect"	"newsus"	"In 2004, shortly after the national World War II Memorial was completed, Earl Morse, a retired Air Force captain working at the Department of Veterans Affairs clinic in Springfield, Ohio, realized that many of the veterans he knew would never get to see it. So he persuaded pilots at his local flying club to ferry a handful of veterans to Washington on small planes, and accompany them to the National Mall."
"0"	"Daisy Ridley plays coy about engagement speculation"	"movies-celebrity"	"Daisy Ridley won't confirm or deny that she's engaged."
"0"	"How to get the best Costco Black Friday 2019 deals"	"finance-savemoney"	"Win Black Friday and leave your budget intact."
"1"	"Man who inherited 6 figures shares advice he'd give his younger self"	"personalfinance"	"Brandon Neth inherited around $123,000 from his late father and grandfather when he was 20. He spent most of it on cars, clothes, and restaurants."
"0"	"Homeless woman living in SUV with dogs moves into apartment with community's help"	"newsgoodnews"	"Two friends in suburn Philadelphia reached out to residents via the Nextdoor app to get food and housing for a former pharmacist with health issues living in an SUV."
"0"	"Week 10 winners, losers: Saints implode in stunning loss; Eagles win without playing"	"football_nfl"	"The Saints' stunning loss to the Falcons dropped New Orleans from the top spot in the NFC, while the Eagles won without even playing in Week 10."
"1"	"Road built by biblical villain uncovered in Jerusalem"	"travelnews"	"A long-buried street that led pilgrims to the Jewish Temple 2,000 years ago was commissioned by Roman governor Pontius Pilate."
"0"	"Most Americans say they are struggling financially"	"personalfinance"	""Income is not keeping pace with expenses," expert says in noting the prevalence of financial hardships"
"0"	"35 musicians you should see live at least once in your life"	"music-gallery"	"If you have a chance to see these musicians live, you absolutely need to take the chance and grab a ticket."
"0"	"30 Speedy and Delicious Potato Recipes to Make Tonight"	"quickandeasy"	"Does it get any better than that?"
"0"	"How I Got Lung Cancer at 31 Without Ever Smoking a Single Cigarette"	"health-cancer"	"Rachael Malmberg was 31 when she received a deadly diagnosis. She is fighting her condition and has embarked upon a mission to educate others about the second leading cause of lung cancer and it has nothing to do with smoking."
"0"	"McDonald's launches first seasonal McFlurry in 7 years"	"foodnews"	"McDonald's fans are well acquainted with Oreo and M&M's McFlurries, but this month, the fast food giant is spicing things up with a national release of its first new seasonal McFlurry flavor in seven years. Back in 2012, the chain launched a Holiday Mint McFlurry, which seemed pretty on-brand considering the popularity of the Shamrock Shake. But the 2019 version ditches that minty fresh flavor for cinnamon   and it's loaded with chunks of a..."
"0"	"How Russia Meddles Abroad for Profit: Cash, Trolls and a Cult Leader"	"newsworld"	"The Russians were hard to miss. They appeared suddenly last year in Madagascar's traffic-snarled capital, carrying backpacks stuffed with cash and campaign swag decorated with the name of Madagascar's president."
"0"	"A Trump administration strategy led to the child migrant backup crisis at the border"	"newsus"	"Administration policies aimed at deterring migrants focused specifically on children, and authorities knew the approaches would clog Border Patrol facilities and strain bed space."
"0"	"These Are The Best Harley-Davidson Motorcycles You Can Get For The Cheap"	"autosmotorcycles"	"These are the best Harleys to buy right now."
"0"	"Subprime mortgages keep minting cash for former Bear Stearns banker"	"markets"	"Subprime mortgages may have wreaked havoc on the U.S. economy over the past decade, but they have been very good to Tom Marano."
