"0"	"The best burger and fries joint in your state"	"restaurantsandnews"	"There can't be any meal quite as satisfying as a juicy burger and crispy, fresh fries. But where can you find the best? We've chosen the top burger and fries joints in every single state to help make sure your next order is absolutely delicious."
"0"	"Dean Foods files for bankruptcy"	"finance-companies"	"Dean Foods, America's largest milk producer, is filing for bankruptcy."
"0"	"Aston Martin Vantage Volante Spied Looking Dark On A Foggy Day"	"autosnews"	"It's not a good day to open the roof."
"0"	"Chevy Says This Isn't a Mid-Engine C8 Corvette Hybrid Prototype"	"autosnews"	"There are some curious electronic extremeties on this test mule."
"0"	"Every touchdown from every Week 10 game"	"football_nfl_videos"	"Watch Every Touchdown From Every Game presented by Amazon Prime during Week 10."
"0"	"Country music's biggest scandals"	"music-awards"	"From Wynonna Judd's husband's arrest to the Dixie Chicks' vent about George W. Bush, relive country's biggest scandals."
"0"	"Cassius Winston posts heartfelt message to late brother on Instagram"	"basketball_ncaa"	"Remarkably, Winston was able to play in Sunday's game just a day after his brother passed. The senior played 26 minutes and registered a double-double with 17 points and 11 assists."
"0"	"Chin Hair: 7 Embarrassing Red Flags No Woman Should Ever Ignore"	"wellness"	"Here's how to know if your annoying chin hair is a sign of a more serious issue."
"0"	"The Disney+ 'Lady and the Tramp' remake: A guide to the new cast members"	"movies-gallery"	"Learn more about the stars of the Disney+ live-action remake."
"0"	"Report: Knicks' brass will stay on if team shows 'progress' this season"	"basketball_nba"	"The New York Knicks' front office appears to be safe for now. Owner James Dolan met with president of basketball operations Steve Mills and others in management on Monday. The Knicks' brass left with the impression that their jobs would be secure as long as the team "showed progress" this season, league sources told SNY's Ian Begley. However, it's unclear what Dolan deems as "progress," reports Begley. Mills and general manager Scott Perry are..."
"1"	"Bucks exercising 2020-21 option on DiVincenzo"	"basketball_nba"	"Despite a disappointing first year, the Bucks still believe in DiVincenzo, whose modest rookie contract would become a bargain if he develops into a reliable rotation player."
"0"	"2020 Ford Mustang Shelby GT350 vs. GT500: Which Is the Better Sports Car?"	"autosenthusiasts"	"Is the $12,460 more costly GT500 a better sports car than the already great GT350?"
"1"	"Katie Holmes Talks About That Bra and Cardigan Moment"	"lifestylebuzz"	"Katie Holmes Talks About That Bra and Cardigan Moment"
"0"	"Look of the Day"	"lifestylebuzz"	"Jennifer Lopez elevated a Sally Lapointe turtleneck ($1,650; modaoperandi.com) by cinching it with a narrow belt and styling it with silky trousers..."
"0"	"Meghan Markle Chose a Chic Black Ensemble for Remembrance Sunday Services"	"lifestyleroyals"	"She paired her outfit with a bold hat and a crimson poppy pin."
"0"	"Cherry disappointed with MacLean's apology: 'He buried me'"	"icehockey_nhl"	"Don Cherry isn't happy with former Hockey Night in Canada partner Ron MacLean. MacLean publicly apologized Sunday for Cherry's offensive comments from the night prior. Cherry, who was fired by Sportsnet on Monday, said MacLean "buried" him with his response. "Very disappointing," Cherry told Global News on Tuesday. "We're still friends, but I was very disappointed in the way he handled it. I don't want to go and condemn him or anything like...""
"0"	"Trump says he's not watching impeachment hearing   then critiques it"	"newspolitics"	"President Donald Trump on Wednesday dismissed the House's impeachment proceedings as a "hoax" and said he was "too busy to watch"   and then blasted Democrats' choice of questioners at a hearing he said he hadn't been briefed on."
"0"	"See All the Best Photos of the Royal Family at Remembrance Sunday"	"lifestyleroyals"	"Today, Prince Charles will lay a wreath on his mother's behalf in honor of those who have died in war."
"1"	"Airline Passenger Rights That Most American Travelers Don't Know About"	"video"	"Despite the legal responsibility airlines have to inform travelers of their rights, an astonishing number of passengers don't know them. These are some of the rights you should know about. Veuer's Johana Restrepo has more."
"0"	"Stella McCartney Deleted a Meghan Markle Instagram Post After Followers Called Her Out"	"lifestyleroyals"	"Stella McCartney deleted a photo of Meghan Markle on Remembrance Day following backlash from Instagram followers."
"0"	"10 biggest disappointments of NFL Week 10"	"football_nfl"	"From quarterback play to special teams disasters, there was plenty of disappointment to go around in Week 10 of the NFL."
"0"	"GOP memo outlines party's plan to defend Trump ahead of public hearings"	"newspolitics"	"Three top Republicans penned a memo outlining "key points of evidence.""
"0"	"Red tide, the toxic algae bloom that kills wildlife, returns to southwest Florida"	"newsus"	"Southwest Florida is warily watching the return of red tide, a toxic algae bloom that cost businesses nearly $150 million in losses last year"
"0"	"2020 Corvette Doesn't Like The Snow, Crashes On Detroit Highway"	"autosenthusiasts"	"It's going to be a long winter."
"0"	"Meteor streaks through the sky over St. Louis"	"weathertopstories"	"Hundreds reported seeing a bright flash of light across the sky in at least two counties"
"1"	"Charles Rogers, former Michigan State football, Detroit Lions star, dead at 38"	"football_nfl"	"Charles Rogers, the former Michigan State football star whom the Detroit Lions selected with the second overall pick in 2003 NFL draft, has died."
"0"	"JuJu Smith-Schuster: Jalen Ramsey's right, I'm not Antonio Brown"	"football_nfl"	"In the days leading up to Sunday's game against the Steelers, Rams cornerback Jalen Ramsey shared his opinion that Steelers wide receiver JuJu Smith-Schuster isn't the same kind of threat that Antonio Brown was when he roamed football fields rather than the social media universe. Smith-Schuster may not be Brown, but the Rams paid him [more]"
"0"	"Walmart releases Black Friday ad with $129 Apple Watch, TV deals, electronics doorbusters"	"finance-companies"	"Walmart's Black Friday 2019 ad includes a 40-inch TV for $98, Apple iPad for $249, Xbox One, Playstation 4, deals on toys, Instant Pot and more."
"0"	"Faroe Islands 'closed for maintenance' in April 2020"	"travelnews"	"The Danish archipelago has come up with a solution to the problem of mass tourism: closing access to visitors."
"0"	"These Are America's Favorite Liquor Brands"	"beverages"	"According to a new report published by Wine & Spirits Daily, the fastest-growing liquor brand in America is   yet again   Texas-made Tito's vodka. Launched by Bert "Tito" Beveridge (yes, that's his real name) in 1997 and financed with $90,000 he borrowed from some 19 credit cards, the brand got its big break in […]"
"0"	"US held record number of migrant children in custody in 2019"	"newsus"	"The 3-year-old girl traveled for weeks cradled in her father's arms, as he set out to seek asylum in the United States."
"1"	"Michael Douglas Weighs In on College Admissions Scandal: It's 'Egregious'"	"movies-celebrity"	"Michael Douglas Weighs In on College Admissions Scandal: It's 'Egregious'"
"0"	"John Travolta Shares Rare Photo with Daughter Ella and Son Benjamin"	"movies-celebrity"	"The family posed with a koala in Australia!"
"0"	"Ex-Astros say team electronically stole signs during 2017 season"	"baseball_mlb"	"While the Astros have denied the numerous sign-stealing allegations against them, the former members of their World Series team described the practice they used that season in detail."
"0"	"9 Incredible Places You'd Never Even Think To Spend Thanksgiving"	"ustravel"	"And I do mean incredible."
"0"	"Massachusetts fire lieutenant dies battling house fire"	"newsus"	"An early morning fire in a three-story home has left a Massachusetts fire lieutenant dead and another firefighter in serious condition."
"0"	"The 10 Best Nonfiction Books of the 2010s"	"entertainment-books"	"From sweeping histories to gripping memoirs, these are TIME's picks for the best nonfiction books of the decade"
"1"	"Hey, Millennials, look out below! Gen Z may already be catching up in the salary race"	"finance-career"	"Gen Zers are closing the pay gap with millennials even though they have far less experience. They're making the most of a tight labor market."
"0"	"The 2019-2020 NHL Season"	"icehockey_nhl"	"The 2019-2020 NHL Season"
"0"	"The Best Beaches in Hawaii to Visit in Your Lifetime"	"traveltripideas"	"Hang ten at great surf spots, relax at resort getaways, snorkel at stunning coral reefs, float in quiet coves, and dig your toes into silky sand whatever kind of beach experience you're dreaming of, Hawaii offers an opportunity to indulge your tropical getaway fantasies. But which Hawaiian beaches are best? We've got the sandy scoop! The post The Best Beaches in Hawaii to Visit in Your Lifetime appeared first on Reader's Digest."
"1"	"Missing college student's parents meet with mother of Natalee Holloway"	"newscrime"	"Investigators did not call the man a suspect, but said they wanted to identify him and speak with him in connection to Aniah Blanchard's disappearance."
"1"	"Luke DeCock: After Cole Anthony's spectacular UNC debut, he's not just talented. He's indispensable."	"basketball_ncaa"	"CHAPEL HILL -- Set aside for the moment the discussion about whether Cole Anthony's debut was the most anticipated by a North Carolina freshman, or where he fits -- or will fit -- in the pantheon of Tar Heels point guards. Both topics are worthy of debate after a spectacular, record-setting beginning to his college career, and will continue to be throughout his single season in Chapel ..."
"0"	"Red and Blue Economies Are Heading in Sharply Different Directions"	"markets"	"At a quick glance, red and blue metropolitan areas are performing equally well on average in the most watched indicators of labor market health. Employment growth in the year ending in the first quarter of 2019 was 1.4 percent in both Democratic-leaning and Republican-leaning metro areas, and the unemployment rate in both types of places is roughly equivalent. Silicon Valley (blue) is booming. So is Provo, Utah (red). But below the surface, red..."
"0"	"How to Turn Getting Kicked Off an Overbooked Flight Into a Payday"	"video"	"Overbooked flights and people being kicked out are now a common headline. Luckily, there are some ways you can be compensated for this. Veuer's Johana Restrepo has more."
"1"	"LeBron sends message of support to Steph after injury"	"basketball_nba"	"L.A. Lakers star LeBron James sent some "get well soon" wishes to Stephen Curry after the Warriors star suffered a broken hand on Wednesday."
"0"	"UK flooding: army to help recovery effort as more rain forecast"	"newsworld"	"Worst-hit areas of Yorkshire and Lincolnshire likely to bear brunt of further downpours"
"0"	"Volvo S90 Facelift Spied Showing Small Design Tweaks"	"autosnews"	"A new lower fascia and revised lighting are among the more noticeable revisions."
"0"	"How and When to Watch the House Impeachment Hearings"	"newspolitics"	"Americans will see live testimony Wednesday in House Democrats' bid to show that President Donald Trump abused his office and should be impeached for pressuring Ukraine to investigate a political rival while withholding U.S. aid."
"0"	"Russell Wilson vs. 49ers' No. 1 defense: Monday night's prime-time matchup"	"football_nfl"	"What Russell Wilson does to a defense can't be replicated. Certainly not in practice. For example, 49ers backup C.J. Beathard attempted to simulate the Seahawks' quarterback on the scout team last week   trying to give the defense a sense of Wilson's scrambling style   and cornerback Richard Sherman said Beathard strained his back in the process. And Wilson can't be replicated in another game. The 49ers' last game was against Arizona rookie..."
"0"	"Audi E-Tron S Possibly Spied Testing At The Nurburgring Again"	"autosnews"	"The new rear diffuser is a bit of a giveaway."
"0"	"Top 100 country songs of all time"	"cma-awards"	"Stacker counts down the top 100 country songs of all time. From old-school honky-tonk to modern country pop, this list covers the biggest hits in Billboard history."
"1"	"Hurts might be a better Oklahoma QB than Mayfield, Murray"	"football_ncaa"	"Comparing Jalen Hurts' Heisman campaign with Baker Mayfield's and Kyler Murray's winning seasons."
"1"	"Shia LaBeouf Spoke to His Dad for the First Time in 7 Years After Court-Mandated 'Head Camp'"	"movies-celebrity"	"'He could have folded me if he had said something off-color.'"
"1"	"How I Got Lung Cancer at 31 Without Ever Smoking a Single Cigarette"	"health-cancer"	"Rachael Malmberg was 31 when she received a deadly diagnosis. She is fighting her condition and has embarked upon a mission to educate others about the second leading cause of lung cancer and it has nothing to do with smoking."
"0"	"'Grandma Joy,' grandson share photos of US as they try visiting all national parks"	"newsgoodnews"	"Brad and Joy Ryan have been traveling together for four years attempting to visit all 61 U.S. national parks."
"0"	"Please Don't Yell at Your Dog!"	"lifestylebuzz"	"A new study shows it can cause long-term psychological impacts."
"0"	"Brainteaser challenges puzzlers to spot the reindeer headband in the sea of festive sweaters"	"lifestylebuzz"	"A brainteaser, created by Missy Empire, challenges members of the public to spot the reindeer headband amongst the sea of festive jumpers - but can you beat the 12 second record?"
"0"	"Ohio-grown Christmas trees headed to troops overseas"	"newsgoodnews"	"Tree farmers in Ohio are joining forces with the state to send a little holiday cheer to the troops overseas. The Ohio Department of Agriculture and the Ohio Christmas Tree Association are partnering on an effort that will ship more than 100 Christmas trees to military members stationed overseas. Sign up for our Newsletters Growers will donate the trees and state inspectors will make sure they are free of pests and disease. Both groups will work..."
"0"	"Kaley Cuoco Says Having 'Separate Lives' Has Helped Her Marriage to Karl Cook"	"tv-celebrity"	"Kaley Cuoco and husband Karl Cook couldn't be a more perfect match."
"1"	"45 Abandoned Places Around the World That Are Eerily Beautiful"	"traveltripideas"	"It's okay to be awed and creeped out at the same time."
"1"	"Ashley Graham Says She Has a Major Case of Pregnancy Brain But What Is That?"	"wellness"	"It's super common   but it's actually not a bad thing."
"0"	"Thanksgiving side dishes: 11 unique recipes to try this season"	"foodnews"	"While there will always be dishes you're unwilling to leave off your table, consider changing it up with these unique Thanksgiving side dishes."
"0"	"Cook leads Vikings to 28-24 prime-time road win over Cowboys"	"football_nfl"	"The Minnesota Vikings beat the Dallas Cowboys 28-24 on Sunday night."
"0"	"Stars who've had more than one wedding with the same spouse"	"entertainment-celebrity"	"See which celebs exchanged vows with their significant others more than once."
"0"	"Exclusive: 2021 Kia Optima Could Look Like This"	"autosnews"	"Highly detailed renderings reveal a sharp-looking sedan."
"0"	"Frackers Prepare to Pull Back, Exacerbating a Slowdown in U.S. Oil Growth"	"markets"	"After pushing U.S. oil and natural-gas production to record levels, some shale companies are doing the unthinkable: They are planning to pump less."
"0"	"Matthew Koma's New Tattoo for His Kids Will Melt Your Heart"	"tv-celebrity"	"Matthew Koma's New Tattoo for His Kids Will Melt Your Heart"
"0"	"Why Prince Harry Wore His Remembrance Poppy Differently from the Rest of the Royal Family"	"lifestyleroyals"	"Why Prince Harry's Poppy Was Worn on His Cap"
"0"	"Win Weeknights with These Crazy-Delicious Instant Pot Recipes"	"quickandeasy"	"Turn the menu planning pressure off."
"0"	"Signs of Dementia: 8 Tips For Talking to Your Older Parents"	"mentalhealth"	"When a parent begins to exhibit early signs of dementia or Alzeimer's, it's difficult for families to address it. These tips will make the process easier."
"0"	"AD impresses LeBron, Vogel by playing through injuries"	"basketball_nba"	"Anthony Davis put up 24 points, 12 rebounds, and four assists in the Los Angeles Lakers' 123-115 win over the Phoenix Suns on Tuesday. The performance was even more impressive given the right shoulder issue he's dealt with since the season began and a ribs injury suffered during the contest. "He wants to play," teammate LeBron James told reporters postgame, including ESPN's Dave McMenamin. "He wants to play, and we just have to pick it up. "For..."
"0"	"Opinion: All those predictions of the NFL's impending demise now seem quite silly"	"football_nfl"	"Through first 10 weeks of the NFL season, 103 games have been within a score in the fourth quarter and 77 have been decided by touchdown or less"
"0"	"Prince Harry and Meghan Markle just shared a never-before-seen photo of baby Archie with his 'Grandpa' Prince Charles to celebrate his birthday"	"lifestyleroyals"	"The Duke and Duchess of Sussex shared a new photo of Archie, Harry, and Charles to mark the Prince of Wales' 71st birthday on Thursday."
"0"	"What It Was Like Inside the Homes of the Pilgrims"	"lifestylehomeandgarden"	"There's a lot of folklore surrounding the first Thanksgiving, and plenty of lively debate. When did it actually occur? Was this meeting with the Wampanoags truly amicable? Did they really eat turkey? Despite, or perhaps because of, this murky history, we continue to be fascinated with the Pilgrims and life in 17th-century America. While we all learned about the Mayflower, the Pilgrims, and that first Thanksgiving way back in elementary school, what do we really know about the day-to-day lives of these English settlers? Here are a few things that may surprise you about home life in early America."
"0"	"Harry and Meghan Revive Feud Rumors By Staying Away From the Royal Family's Christmas"	"lifestyleroyals"	"So, what are you doing for Christmas?"
"0"	"5 reasons you might not want to book a cruise on a brand-new ship"	"traveltips"	"There's nothing quite like the thrill of being on the maiden voyage of a new cruise ship."
"0"	"Cassius Winston posts double-double a day after his brother's death"	"basketball_ncaa"	"Michigan State Spartans guard Cassius Winston came into Sunday's game against Binghamton with a heavy heart. His brother, Zachary Winston, died Saturday night when he stepped in front of an Amtrak train, according to the Detroit Free Press."
"0"	"FCA And GM Unfazed By The Ford Bronco's Return"	"autosnews"	"Should they be worried?"
"0"	"These Are The 20 Greatest Female Country Singers In History"	"cma-awards"	"From Patsy Cline and Dolly Parton to Faith Hill and Shania Twain"
"0"	"Mulvaney Request to Join Subpoena Lawsuit Opposed by House"	"newspolitics"	"The U.S. House of Representatives opposed a request by Mick Mulvaney, President Donald Trump's acting chief of staff, to join a lawsuit seeking a judge's guidance whether he must comply with a subpoena to testify at impeachment hearings."
"0"	"All of the Thanksgiving Items You Should Buy from Trader Joe's"	"tipsandtricks"	"It's the holiday season, and Trader Joe's is ready for it."
"0"	"Stocks close higher on optimism over China trade deal"	"markets"	"Stocks ended at record highs Thursday after the world's two largest economies reportedly agreed to remove existing trade tariffs, sparking a huge rotation into equities and out of bonds."
"0"	"Draymond criticizes official for ejection: 'Don't tell me not to talk'"	"basketball_nba"	"Golden State Warriors forward Draymond Green made Chase Center history during Monday's loss to the Utah Jazz, becoming the first player ejected from a game in the new venue after arguing with an official. The three-time All-Star was given a second technical foul for continuing to plead his case after disagreeing with a blocking call, but it seems Green's spat with the official went beyond just that foul. "I disagreed with that call," Green told..."
"0"	"32 things we learned from Week 10 of NFL season"	"football_nfl"	"How's that for a wild week in the NFL? From last-minute scores to goal-line stands, several teams delivered unexpected outcomes."
"1"	"Doctors warn addiction of 'human Ken doll' has gotten dangerous"	"medical"	"Rodrigo Alves has spent more than $750,000 on 72 cosmetic surgeries."
"1"	"Here's How to Make McDonald's Special Sauce at Home"	"recipes"	"Follow these easy steps to make McDonald's special sauce and create your own delicious Big Mac in your own kitchen."
"1"	"Zion Williamson's knee injury history, explained"	"basketball_nba"	"Injuries have been a theme throughout Williamson's young career. Please, let him stay healthy."
"0"	"Nurse takes in man with autism so he can get a new heart"	"newsgoodnews"	"You can't get on the transplant list if you don't have a home or some kind of support system to help you post-surgery"
"1"	"Why the Patriots made a very un-Patriots trade for Mohamed Sanu"	"football_nfl"	"The Patriots haven't traded a second-round pick for an age 30 player since ... Corey Dillon."
"1"	"The 2019 NFL midseason MVP rankings"	"football_nfl"	"The 2019 NFL regular season is now half-complete, and the MVP race is wide-open. November is here, but at least half a dozen players continue to be in contention for the league's ultimate individual award. Here's how we rank the current candidates."
"0"	"What Is a Sleep Divorce and Should You Get One?"	"wellness"	"It might actually *help* your relationship."
"0"	"Christopher Johnson has hitched his reputation to Adam Gase"	"football_nfl"	"Jets CEO Christopher Johnson broke his 182-day silence by confirming a Daily News report that he has no plans to fire Adam Gase. The team's acting owner, who took shelter amid the team's nightmarish first two months, made it clear that Gase will be back in 2020 despite growing unrest from a frustrated fan base at the team's poor play and lack of competitiveness during their 2-7 start. "I understand it," Johnson said of fans' frustrations in a..."
"1"	"17 photos that show the ugly truth of living in a tiny house"	"lifestylehomeandgarden"	"From cramped lofts that are hard to access to small appliances, this is what it's really like to live in a tiny house."
"0"	"The 2019 NFL Season"	"football_nfl"	"The 2019 NFL Season"
"1"	"Bucs not considering a QB change"	"football_nfl"	"The No. 2 pick of the 2015 NFL Draft was benched on Sunday and no one would have been too surprised if the No. 1 pick of that draft had found himself in the same situation as Marcus Mariota. Jameis Winston threw five interceptions and lost a fumble in a 37-26 loss to the Panthers [more]"
"0"	"SEMA 2019: Cars and Trucks Gone Wild"	"autossema"	"Auto aftermarket antics at the annual trade show in Las Vegas.… The post SEMA 2019: Cars and Trucks Gone Wild appeared first on autoNXT.net."
"1"	"Student barred from reselling Krispy Kreme now teaming up with the doughnut chain"	"foodnews"	"Krispy Kreme said it would work with Jayson Gonzalez as an independent operator to ensure consistent delivery to fans in Minnesota."
"0"	"Every Food Gift on Oprah's Favorite Things List"	"foodnews"	"Perfect presents for everyone on your list."
"1"	"Toyota Supra vs. Ford Mustang Shelby GT350: Kicking Tail!"	"autossports"	"Toyota's new sports coupe goes Head 2 Head against Ford's updated pony."
"1"	"IHOP Will Give You Free Dinner If You Eat At Its Teeny, Tiny New Restaurant"	"foodnews"	"HGTV fans, this one's for you."
"0"	"These 7 sports cars crushed their horsepower ratings in our dyno tests"	"autossports"	"Every manufacturer advertises a horsepower figure for their vehicles the metric is among car guys' and gals' favorites to argue over."
"0"	"Prince Charles just turned 71   here are the best photos from every year of his royal career so far"	"lifestyleroyals"	"Prince Charles, heir to the throne, celebrates his 71st birthday on Thursday. Here are all the best photos from every year of his career."
"0"	"Rip Taylor's Cause of Death Revealed, Memorial Service Scheduled for Later This Month"	"tvnews"	"The comedian died at the age of 84 last month."
"0"	"Anonymous anti-Trump book is already a hit and it's not on shelves until next week"	"newspolitics"	""A Warning," written by an anonymous person who has worked at a senior level in the Trump administration, is already a hit, according to the book's publisher."
"0"	"65 Best Fall Soups That Will Warm You and Your Family Up All Season Long"	"recipes"	"These hearty bowls are the perfect companion for a rainy fall night."
"0"	"Best, worst QB performances from NFL Week 10"	"football_nfl"	"Lamar Jackson continues to excel. Philip Rivers Continues to... not excel."
"0"	"New Zealand's euthanasia bill passes, referendum to be held"	"newsworld"	"New Zealand lawmakers voted Wednesday in favour of making euthanasia legal, paving the way for the issue to be put to voters in a referendum next year. The law, enabling terminally ill people to request a medically assisted death was passed 69-51 at its final reading, ending years of passionate debate in parliament."
"0"	"Knicks execs 'not happy' with poor start; David Fizdale reaches to spin results"	"basketball_nba"	"Yes, the Knicks are just two wins out of the eighth seed, but they're also looking up at every other team in the East."
"0"	"EXTRA SHARP: One-Bowl Peanut Butter Cookies"	"videos"	"These peanut butter-packed cookies with crisp edges and chewy centers are sure to be your new go-to."
"0"	"Longtime Republican Rep. Pete King won't seek reelection"	"elections-2020-us"	"The New York Republican has served in Congress since 2003"
