"1"	"Infamous food hacks you need to ignore"	"tipsandtricks"
"0"	"66 Cool Tech Gifts Anyone Would Be Thrilled to Receive"	"shop-holidays"
"1"	"This Halloween Corn Maze Wedding Is Dark, Sophisticated, and Bone-Chillingly Beautiful"	"lifestyleweddings"
"1"	"Photos show the White House decked out in spooky trees and pumpkins as the Trumps celebrated Halloween a few days early"	"lifestylebuzz"
"0"	"One New Thing to Check Out on Every Hawaiian Island"	"traveltripideas"
"0"	"Nurses face an epidemic of workplace violence"	"markets"
"1"	"Lori Loughlin's Daughters No Longer Enrolled at USC"	"tv-celebrity"
"1"	"Eric Tse, 24, just became a billionaire overnight"	"markets"
"1"	"These Wickedly Easy Halloween Appetizers Will Get the Party Started"	"quickandeasy"
"1"	"American-Made Cheese Named World's Best for the First Time Ever"	"foodnews"
"1"	"Woman in 'Carrie' costume totals car, terrifies first responders"	"newsus"
"0"	"Watch These Two Love Birds Perform a Heart-Shaped Swan Dance"	"popculture"
"1"	"The Royal Tiaras Are Out in Full Force at Emperor Naruhito's Enthronement Celebration"	"lifestyleroyals"
"0"	"Liver transplant leads to unbreakable bond between strangers"	"newsgoodnews"
"1"	"7 Pieces of Advice to Take from Your Grandparents and 5 to Forget"	"lifestylefamilyandrelationships"
"0"	"THEN AND NOW: What all your favorite '90s stars are doing today"	"celebrity"
"0"	"6 Trump associates have been convicted in Mueller-related investigations"	"newspolitics"
"1"	"After Mormon Family's Terror in Mexico, a Message Emerges: No One Is Safe"	"newsworld"
"1"	"LA firefighter banked $360,010 in overtime pay in one year, city audit finds"	"newsus"
"0"	"Boy uses his Make-A-Wish to get special space that other schoolchildren can use"	"newsgoodnews"
"1"	"We Found the Best Bakery in Every State"	"restaurantsandnews"
"1"	"It's Not Your Imagination, Brussels Sprouts Really Do Taste Better Now"	"foodnews"
"1"	"Bag Explodes While Being Loaded On Volaris Flight At Midway Airport"	"travelnews"
"0"	"George Conway and Trump Jr. trade personal insults during impeachment hearing"	"newspolitics"
"0"	"Debunking the week's tabloid stories: Nov. 15, 2019"	"celebrity"
"0"	"Halle Berry Shares Photo of 6-Pack Abs on Instagram and Her Fans are Freaking Out"	"fitness"
"0"	"Opinion: NFL had no choice but to send a clear message with Garrett punishment"	"football_nfl"
"1"	"Surprising Ingredients That Will Make You Think Twice About Your Favorite Foods"	"foodnews"
"0"	"Maze of tunnels reveals remains of ancient Jerusalem"	"travelnews"
"0"	"He was a member of a boy band in the 90s. Now he's an ER doctor in Dallas"	"health-news"
"1"	"Trump Taxes: Appeals Court Rules President Must Turn Over 8 Years of Tax Returns"	"newspolitics"
"1"	"2 charged in murder of Alabama girl Kamille 'Cupcake' McKinney"	"newscrime"
"1"	"The King of Thailand abruptly stripped all royal titles from his 34-year-old consort, who is accused of plotting against the queen to take her place"	"lifestyleroyals"
"0"	"Ex-Envoy to Ukraine 'Devastated' as Trump Vilified Her"	"newspolitics"
"0"	"Morris Commercial Introduces Sentimental Electric Morris JE Van"	"autosenthusiasts"
"1"	"'The Office' star Jenna Fischer responds to Chrissy Teigen's theory that Jim and Pam are divorced"	"tv-celebrity"
"1"	"What Is the Bermuda Triangle, and Do Pilots Really Avoid It?"	"travelnews"
"1"	"HGTV star Jasmine Roth and husband Brett 'overjoyed' about expecting their first child next April"	"tv-celebrity"
"0"	"There's a place in the US where its been over 80 degrees since March"	"weathertopstories"
"1"	"Family of toddler who fell from cruise ship 'utterly crushed' after grandfather charged"	"newsus"
"0"	"Attorney: Garrett's actions against QB to be 'reviewed thoroughly'"	"football_nfl"
"0"	"Daring rescue attempt when dog winds up on roof"	"viral"
"0"	"Studies show these are the best and worst states for your retirement"	"finance-retirement"
"1"	"Couple take in 80 children in their home"	"newsgoodnews"
"0"	"Federal Prosecutors Probe Giuliani's Links to Ukrainian Energy Projects"	"newspolitics"
"1"	"Girl Scouts earn STEM badges at free Microsoft Store workshops"	"causes"
"0"	"Democrats vow court fight to block new N.C. congressional map"	"elections-2020-us"
"0"	"20 Tourist Attractions Travel Editors Actually Love Visiting"	"traveltips"
"0"	"Golfer and girlfriend pull amazing trick shot"	"viral"
"1"	"Dog Learning to Talk By Using a Custom Soundboard to Speak: 'I'm in Constant Amazement'"	"lifestylebuzz"
"1"	"The Best Photos from Emperor Naruhito's Enthronement Ceremony in Japan's Imperial Palace"	"lifestyleroyals"
"1"	"85 Thanksgiving Recipes You Can Make Ahead"	"quickandeasy"
"1"	"South Carolina teen gets life in prison for deadly elementary school shooting"	"newsus"
"1"	"The keto diet is hard work   but this hack makes it so much easier"	"nutrition"
"1"	"This Pomona College senior is living out of a converted school bus and saving $10,000 a year on student housing"	"lifestylebuzz"
"1"	"Customers Are Trolling Papa John's Over Their Jack-O'-Lantern Pizzas"	"restaurantsandnews"
"1"	"Costco workers reveal 6 things they'd never buy from the store"	"tipsandtricks"
"0"	"Santa Clarita shooting: Unregistered guns found in home of Saugus suspect; motive a mystery"	"newsus"
"1"	"Kentucky man dies trying to save sons from Florida rip current during family trip"	"newsus"
"1"	"Is This the Creepiest State in America?"	"travelnews"
"1"	"The Best Photos from Kate Middleton and Prince William's Royal Tour of Pakistan"	"lifestyleroyals"
"1"	"What Kids Did a Decade Ago That They Don't Do Anymore"	"lifestyledidyouknow"
"0"	"I'm A Queer Woman Dating A Trans Man   & No One Knows"	"voices"
"1"	"30 Funny Dog Photos You Need to See"	"lifestylepetsanimals"
"1"	"Comics - 'Pluggers' by Gary Brookins"	"humor"
"1"	"Xerox offers HP $22 a share in takeover bid, sources say"	"finance-companies"
"1"	"What I Want You To Know Before You Judge Me (Or Anyone Else) Working In Fast Food"	"voices"
"0"	"U.S. Troops Will Die If They Remain in Syria, Bashar Al-Assad Warns"	"newsworld"
"0"	"Staffer who overheard Trump call with Sondland testifies in closed hearing"	"newspolitics"
"1"	""I was a passport to this man": Child marriage loopholes persist in U.S."	"newsus"
"1"	"'When I smelled that smoke ... here we go again': Weary Californians seek shelter amid latest wildfire outbreak"	"newsus"
"1"	"35 Thanksgiving Cupcakes That Are Worth Making Room for After Dinner"	"recipes"
"0"	"Meghan Markle and Hillary Clinton Secretly Spent the Afternoon Together at Frogmore Cottage"	"lifestyleroyals"
"0"	"Opinion: Colin Kaepernick is about to get what he deserves: a chance"	"football_nfl"
"1"	"Funny celeb pics for October 2019"	"humor"
"1"	"Meghan Markle Personally Calls British Politician to Thank Her for Orchestrating Letter of 'Solidarity'"	"lifestyleroyals"
"0"	"LASIK eye surgery should be taken off market, ex-FDA adviser says"	"health-news"
"1"	"Missing woman's husband arrested after carpet found soaked with blood, bleach"	"newscrime"
"0"	"Court puts hold on Rodney Reed's scheduled execution"	"newscrime"
"0"	"Why I'm Done Celebrating The Accomplishments Of Couples"	"voices"
"1"	"Chipotle's "Boorito" Deal Is Back Again, So Get Your Costume Ready And You Can Get A Burrito For $4"	"recipes"
"1"	"Florida's rare ghost orchids are getting cut off from water"	"lifestylebuzz"
"1"	"They paid $800 a month to live without water or power in an abandoned L.A. church"	"finance-real-estate"
"0"	"American Airlines flight attendants have literally begged not to work on the Boeing 737 Max when it returns, union boss says"	"newsus"
"0"	"Model, 23, Didn't Know She Was Pregnant Until She Gave Birth to a Full-Term Baby in Her Bathroom"	"health-news"
"1"	"Science Says: How daylight saving time affects health"	"health-news"
"1"	"Mexico's Chocolate Clams Are Worth the Trip"	"traveltripideas"
"1"	"Kate Middleton Shows Off Motherly Side as She Bonds with Families at Opening of Children's Hospice"	"lifestyleroyals"
"0"	"Man suspected of fatal shooting said he was man from 'Joker'"	"newscrime"
"1"	"Billionaires who live in the smallest American towns"	"markets"
"1"	"A body-language expert says Meghan Markle is "politely disconnecting" from the public, and honestly, we would too"	"lifestyleroyals"
"0"	"Prince Harry Talked to Another Royal About His Desire for Privacy"	"lifestyleroyals"
"1"	"Tree Falls Through Home with Teens Inside   and They Avoid Being 'Crushed' Thanks to Fridge"	"lifestyle-news-feature"
"0"	"Why did Santa Clarita shooting happen? Detectives search for motive"	"newsus"
"1"	"Missouri man missing for a week found alive in car that crashed into ravine"	"newsus"
"0"	"The Kardashians Face Backlash Over 'Insensitive' Family Food Fight in KUWTK Clip"	"tv-celebrity"
"1"	"'Yabba Dabba Doo!' Kimye and Kids Rock Flintstone Halloween Costumes"	"tv-gallery"
"0"	"7 possible landing spots for Anthony Rendon"	"baseball_mlb"
"0"	"At NATO summit, Trump to stress US allies' defense spending"	"newsworld"
"0"	"Ford v Ferrari: the real story"	"autosnews"
"1"	"These YouTube Channels are Changing How We Learn to Cook"	"foodnews"
"1"	"Can you spot the hidden gift in this brainteaser in under 11 seconds?"	"lifestylebuzz"
"0"	"Alex Rodriguez Jokingly Talks About Marrying Jennifer Lopez During Super Bowl Halftime Show"	"tv-celebrity"
"1"	"This Waitress Was Tipped With A Winning Lottery Ticket That Made Her $50,000 Richer"	"foodnews"
"1"	"Kristen Bell and Dax Shepard both forgot their wedding anniversary"	"tv-celebrity"
"1"	"Stop Looking at Restaurant Menus Ahead of Time"	"restaurantsandnews"
"0"	"Texas parole board recommends delaying Rodney Reed execution"	"newscrime"
"1"	"Bed, Bath and Beyond Pulls 'Blackface Pumpkins From the Shelves"	"lifestylebuzz"
"0"	"50 Best Movie Sequels of All Time"	"movies-gallery"
"1"	"Our 39 Best Pumpkin Dessert Recipes"	"recipes"
"0"	"How to make the most of a day trip in a new city: Charleston edition"	"voices"
"0"	"Mustang: all the wild and wonderful offshoots - US edition"	"autosenthusiasts"
"1"	"Ian Poulter posts incredible video of flooded Japan golf course hosting PGA Tour"	"golf"
"0"	"Audience applauds, GOP microphone turned off at end of Yovanovitch hearing"	"newspolitics"
"0"	"Australia's fragile koala colonies are being ravaged by brush fires: 'It's a national tragedy'"	"causes-disaster-relief"
"0"	"The stock market warning that everyone is overlooking"	"finance-saving-investing"
"1"	"Johnson, in phone call, urges Trump to lift tariffs on scotch whisky"	"newsworld"
"0"	"Koalas face threat from historic brush fires"	"weathertopstories"
"1"	"Celebrity Halloween costume fails"	"celebrity"
"1"	"Mississippi woman found after being missing for days by writing S.O.S. with rocks"	"newsus"
"0"	"A New York City-themed Aquarium Is Opening in the American Dream Mall"	"travelnews"
"1"	"Christie Brinkley's Ex-Husband Peter Cook, 60, Engaged to Alba Jancou, 21"	"tv-celebrity"
"0"	"13 Reasons Why's Christian Navarro Slams Disney for Casting 'the White Guy' in The Little Mermaid"	"movienews"
"1"	"The 16 Best Italian Foods You Can Get at Trader Joe's"	"tipsandtricks"
"0"	"Five Great Holiday Cruises Worth Taking"	"internationaltravel"
"1"	"Police find 26 children behind false wall at Colorado day care"	"newscrime"
"0"	"Dozens of Colorado sheriffs say they won't enforce red flag gun law"	"newsus"
"1"	"These Middle School Students Baked Cookies Shaped Like Tampons To Protest For Free Menstrual Products"	"recipes"
"1"	"Here's Why We Pass Out Candy on Halloween"	"foodnews"
"0"	"Jordan Brings Pugnacious Style to Impeachment Defense of Trump"	"newspolitics"
"1"	"Nicki Minaj gets married and more ICYMI celeb news"	"entertainment-celebrity"
"0"	"Texas Dad Says Apple Watch Changed Autistic Son's Life"	"newsgoodnews"
"0"	"Celebrity PDA of 2019"	"celebrity"
"1"	"15+ Vegan Dinner Recipes Everyone Will Love"	"recipes"
"0"	"Wilson deletes tweet of him standing over concussed Smith-Schuster"	"football_nfl"
"0"	"Pair Of 'New' 1987 Buick Grand Nationals Pulled From Garage After 30 Years"	"autosclassics"
"1"	"What to Do After You've Cheated On Your Husband"	"lifestylelovesex"
"1"	"North Texas Couple Moving Into New Home Sees It Destroyed By Tornado"	"newsoffbeat"
"1"	"A New Zealand man accidentally bought 1,000 chickens online for $0.96"	"newsworld"
"1"	"Last survivor of the Hindenburg disaster dies at age 90"	"newsworld"
"0"	"How Google Interferes With Its Search Algorithms and Changes Your Results"	"finance-companies"
"1"	"Walmart Sparks Panic and Confusion in the Dish-Soap Aisle"	"finance-companies"
"1"	"Jennifer Aniston's 'Friends'-filled first Instagram post crashes her feed, plus more news"	"entertainment-celebrity"
"1"	"8 television shows that didn't age well"	"tv-gallery"
"1"	"A Seattle man broke into an office building, ate $200 worth of chocolate, and collapsed in a sugar coma"	"foodnews"
"0"	"The most talked about movie moments of the 2010s"	"movies-gallery"
"1"	"21 Trader Joe's Products That Make Dinner Especially Easy"	"tipsandtricks"
"1"	"At stressful time, Boy Scouts top boss goes on medical leave"	"newsus"
"1"	"How Amazon's quest for more, cheaper products has resulted in a flea market of fakes"	"finance-companies"
"0"	"Will you get dementia? Many may not understand their risk"	"health-news"
"1"	"Caterpillar just flashed the latest warning sign for the global economy"	"finance-top-stocks"
"1"	"How Google Interferes With Its Search Algorithms and Changes Your Results"	"finance-companies"
"1"	"Here's Jennifer Lopez Wearing the Most Extra Bejeweled Wedding Dress"	"lifestylebuzz"
"1"	"Secrets shopping malls don't want you to know"	"lifestylesmartliving"
"1"	"How many Tootsie Rolls is a Snickers worth? Kids know"	"personalfinance"
"0"	"'A fighter': President Jimmy Carter's neighbors know they'll say goodbye one day, but not yet"	"newsus"
"0"	"Oregon Riesling Is the Best Wine You've Probably Never Had"	"beverages"
"1"	"Supporting your adult children can ruin your retirement plans"	"finance-retirement"
"1"	"17 hours a day, 7 days a week: Cruise-ship workers describe the grueling conditions they face on the job"	"travelnews"
"0"	"Pete Davidson, Kaia Gerber Are Dating, Trying to Stay 'Low Profile'"	"tv-celebrity"
"0"	"How to Get Rid of Skin Tags, According to a Dermatologist"	"medical"
"1"	"9 Vegetables You Shouldn't Eat Raw"	"nutrition"
"1"	"Photos: NICU Babies Celebrate Halloween"	"newsgoodnews"
"1"	"Comics - '9 to 5' by Harley Schwadron"	"humor"
"0"	"This stately home is having the ultimate yard sale"	"finance-real-estate"
"0"	"I've been writing about tiny homes for a year and finally spent 2 nights in a 300-foot home to see what it's all about   here's how it went"	"voices"
"0"	"Missing woman's husband arrested after carpet found soaked with blood, bleach"	"newscrime"
"1"	"Before his execution, a death row inmate told his victim's family he forgives them"	"newscrime"
"1"	"Trump rule on health insurance leaves immigrants, companies scrambling for answers"	"newsus"
"1"	"The biggest travel trends of the decade"	"travelnews"
"0"	"Steelers vs. Browns highlights | Week 11"	"football_nfl_videos"
"1"	"Photo of emotional nurse after 'particularly hard day' goes viral"	"health-news"
"0"	"Myles Garrett on attacking Mason Rudolph: 'I made a mistake, I lost my cool'"	"football_nfl"
"1"	"Over 70 Female British Politicians Sign Letter Supporting Meghan Markle"	"lifestyleroyals"
"1"	"Can You Spot the One Image That Is Not Like the Others?"	"lifestylebuzz"
"0"	"Eggo Waffle Cereal Is Finally Back And There's A New Blueberry Flavor"	"foodnews"
"0"	"20 huge retailers that are no longer with us"	"finance-companies"
"1"	"Pregnant Shawn Johnson Marks 2nd Anniversary of Her Miscarriage"	"entertainment-celebrity"
"0"	"Doctors warn addiction of 'human Ken doll' has gotten dangerous"	"medical"
"0"	"Cows swept away by Hurricane Dorian found alive   but how?"	"lifestylebuzz"
"1"	"Postal Worker Honors Wife's Request to Hide Packages"	"lifestylebuzz"
"0"	"'Return culture' is hurting the environment and costing retailers billions"	"finance-video"
"1"	"10 over-the-top foods you can only find at festivals"	"foodnews"
"0"	"Greek donkeys are still being abused as 'tourist taxis,' PETA claims"	"travelnews"
"1"	"Dentist who gives free smile makeovers to Brazil's poorest proudly reveals their life-changing transformations in uplifting before and after photos"	"lifestylebuzz"
"1"	"Airline passengers share photos of their worst in-flight meals"	"travelnews"
"1"	"Sarah Michelle Gellar evacuates home during LA wildfires, runs into Selma Blair"	"movies-celebrity"
"1"	"AT&T fined $60 million for throttling 'unlimited' data plans"	"finance-companies"
"0"	"Chris Evans' Hilarious Reason Why He Continues Acting"	"video"
"1"	"$16.8 Million In Campaign Funds Went To Trump Businesses, Latest Records Reveal"	"newspolitics"
"0"	"Why This Couple Is Getting a 'Sleep Divorce'"	"lifestylevideo"
"1"	"The Fabulous Life of Judge Judy: Multiple Estates, Celebrity BFFs, Yachts and More"	"tv-celebrity"
"1"	"This Foster Kitten Smiling for a Photo Will Make Your Friday"	"lifestylebuzz"
"1"	"9 Most Confusing Driving Rules Explained"	"autosownership"
"1"	"50 secrets it's OK to keep from your partner"	"lifestylefamilyandrelationships"
"1"	"What Happens When You Leave Your Belongings Behind on a Plane?"	"travelnews"
"1"	"52 Easy Thanksgiving Recipes, Because You Deserve to Be Stress-Free"	"quickandeasy"
"1"	"This fast food chain has the best fries, according to customers"	"restaurantsandnews"
"0"	"Prince Andrew says he let the Royal Family down in his relationship with Jeffrey Epstein"	"newsworld"
"0"	"Stars   They're Just Like Us!"	"celebrity"
"0"	"12 Cars Lose Consumer Reports' Recommendation Over Reliability Issues"	"autosnews"
"0"	"Whoopi Goldberg Doesn't Stress About The View's Tense Debates"	"more_sports"
"1"	"Deer fatally attacks hunter who shot him"	"newsus"
"1"	"The Queen Mary: The Most Haunted Hotel in America"	"traveltripideas"
"0"	"Envoy Was 'Obstacle' to Trump, Schiff Says: Impeachment Update"	"newspolitics"
"0"	"4 takeaways from Marie Yovanovitch's testimony"	"newspolitics"
"0"	"Iran moves on ultra-cheap petrol, starts rationing"	"newsworld"
"1"	"A couple's attempt to re-create a picture-perfect engagement photo with a bottle of Champagne totally backfired, but the result is going viral"	"lifestylebuzz"
"1"	"Meet the pet detective who helps people find their lost dogs   for free"	"lifestylebuzz"
"0"	"Woman donates nearly 600 Barbies with prosthetic legs to St. Louis hospital"	"newsgoodnews"
"1"	"Cornell student, 18, found dead in gorge after frat party, reports say"	"newsus"
"0"	"Top 5 Craziest Motorcycles From EICMA 2019"	"autosmotorcycles"
"0"	"Meghan Markle's Lawyers Debunk Multiple False Tabloid Stories in New Court Documents"	"lifestyleroyals"
"0"	"Homeless woman living in SUV with dogs moves into apartment with community's help"	"newsgoodnews"
"1"	"India's capital restricts cars as people choke in dirty air"	"newsworld"
"1"	"Amtrak Launches 50-Percent Off Fall Getaway Flash Sale"	"travelnews"
"1"	"Girl, 7, critically wounded in shooting while trick-or-treating in Little Village on Southwest Side; suspect in custody"	"newscrime"
"0"	"How Amazon's quest for more, cheaper products has resulted in a flea market of fakes"	"finance-companies"
"0"	"Here's how much and who you should be tipping at American hotels"	"traveltips"
"0"	"In Japan's vanishing rural towns, newcomers are wanted"	"markets"
"1"	"3 Generations of a Family Lose Everything After California Wildfire Destroys Ranch"	"causes"
"1"	"Fisherman faces prison, fine for cruel act on rare fish"	"more_sports"
"0"	"50 Worst Movie Sequels of All Time"	"movies-gallery"
"0"	"Louisiana governor's race is the latest test of Trump's clout"	"elections-2020-us"
"1"	"4 High School Students Killed in Texas Car Crash That Also Injured 3: 'We Grieve Together'"	"newsus"
"0"	"Ohio GOP lawmakers want to ban all abortions, charge doctors who perform them with murder"	"newsus"
"1"	"Comics - 'Bliss' by Harry Bliss"	"humor"
"1"	"110 Awesome but Affordable Gifts For Men"	"shop-holidays"
"1"	"Jennifer Lawrence Hired A Food Truck For Her Wedding And The Owner Had No Idea Who She Was"	"foodnews"
"0"	"Widow of ex-KGB agent plans legal action on UK's Russia report"	"newsworld"
"1"	"17 Things You Should Never Do During a Conversation"	"lifestylesmartliving"
"0"	"GoFundMe Honors Good Samaritans at First Heroes Celebration: 'Amazing Things Are Happening'"	"newsgoodnews"
"1"	"30 Best Black Friday Deals from Costco"	"shop-holidays"
"1"	"Cameroon landslide kills at least 42"	"newsworld"
"0"	"Taylor Swift Rep Hits Back at Big Machine, Claims She's Actually Owed $7.9 Million in Unpaid Royalties"	"musicnews"
"1"	"Felicity Huffman Smiles as She Begins Community Service Following Prison Release"	"newscrime"
"0"	"Stephanie Parze's Car Is at Home. So Is Her Phone. But She's Missing."	"newscrime"
"0"	"I Overate at Dinner Until I Started Doing This 1 Simple Thing on Sundays (It Takes 10 Minutes!)"	"nutrition"
"0"	"Video shows miraculous escape for train passengers"	"viral"
"1"	"This Post Proves Jennifer Aniston Is Already an Instagram Expert"	"tv-celebrity"
"1"	"This Simple Hack Will Keep Spiders Out of Your House"	"lifestylesmartliving"
"1"	"Fall TV Scheduling Hits & Misses (2019)"	"tv-gallery"
"1"	"A Complete Guide to Every Food You Can (and Cannot) Fly With"	"traveltips"
"1"	"Twin baby girls were delivered by twin nurses at a Georgia hospital"	"health-news"
"1"	"Planning to live on Social Security alone? Consider doing this"	"finance-retirement"
"1"	"33 eerie photos show just how polluted China's air has become"	"newsworld"
"0"	"Smart People May Learn to Play Music Faster"	"science"
"0"	"Report: Police investigating woman's death after Redskins' player Montae Nicholson took her to hospital"	"football_nfl"
"1"	"7 'Italian' foods Americans eat that you typically won't find in Italy"	"foodnews"
"1"	"Pollution around the world: 30 shocking photos"	"causes-green-living"
"0"	"'Dream-Maker' Man Wants to Grant Wishes Through Social Media: 'I Do My Best for Everyone'"	"newsgoodnews"
"1"	"Which Royal Wore It Best?"	"lifestyleroyals"
"1"	"All The Best New Trader Joe's Pumpkin Products"	"tipsandtricks"
"1"	"Woman's Halloween 'devil teeth' turn into dental emergency"	"health-news"
"0"	"California man convicted of torture-murder dies on death row"	"newscrime"
"1"	"American Dream Nickelodeon Universe giant indoor theme park sells out for first weekend"	"travelnews"
"1"	"A wave crashed over a couple during their beach wedding photo shoot, and now the stunning picture is going viral"	"lifestylebuzz"
"0"	"Man sets Guinness World Record for highest standing jump"	"viral"
"0"	"Metal detectorists discover haul of gold coins worth at least 100k"	"viral"
"1"	"Costco Is Selling Pumpkin Pie Filling In A Jar So You Can Be Really Lazy This Thanksgiving"	"foodnews"
"1"	"Prince Harry and Prince William's Rift Is "One of the Main Reasons" the Sussexes Are Skipping Royal Christmas"	"lifestyleroyals"
"1"	"What handing out full-size candy bars on Halloween says about you, according to behavioral economists"	"personalfinance"
"1"	"These 3 foods are the worst for your metabolism, according to Jillian Michaels"	"nutrition"
