"1"	"Cuba Gooding Jr. pleads not guilty to new sexual misconduct charges"	"movies-celebrity"	"Cuba Gooding Jr. was back in Manhattan Criminal Court on Thursday for his groping case. The actor pleaded not guilty to new misdemeanor charges of forcible touching and sexual abuse, according to Reuters. A smirking Cuba Gooding was smirking as he was lead into court in handcuffs for his arraignment in new sex assault charges. Page Six also reported that a detective refused to shake the star's hand as they passed each other outside the Manhattan..."
"1"	"Apple is laying the groundwork for an iPhone subscription"	"finance-companies"	"Apple could bundle hardware upgrades with services like iCloud storage or Apple TV+ content and hardware."
"0"	"Emma Stone transforms into a young Cruella de Vil as she ditches the character's iconic black and white hair for a brunette wig on the set of Disney's live action film in London"	"movienews"	"The La La Land star, 31, looked every inch the villainess as she ditched her fiery red locks for a brunette wig and silk paisley patterned headscarf."
"0"	"Boston College can't wrap up tackles or bowl eligibility in loss to Florida State"	"football_ncaa"	"Bowl eligibility was right there in the Boston College football team's grasp Saturday afternoon with a reeling Florida State visiting Alumni Stadium and the powerful BC offense humming, but the Eagles couldn't wrap it up because they couldn't tackle."
"1"	"Watch This Gross 300,000-Mile Chevy Work Truck Get a Much-Needed Detail"	"autosenthusiasts"	"Larry Kosilla goes in on a tired Tahoe desperately in need of attention."
"0"	"When I Bring This Pie to Thanksgiving, People Always Go For Seconds"	"recipes"	"The key is in the topping."
"1"	"Costco is going to extremes to keep its rotisserie chickens at $4.99"	"finance-companies"	"At the back of Costco's stores, past the televisions, jewelry, jumbo-sized ketchup jugs and tubs of mixed nuts, is one of the retailer's most prized items: The rotisserie chicken that costs just $4.99."
"0"	"Cannabis Use Disorder is Rising in U.S. States Where Weed is Legal"	"health-news"	"Cannabis use disorder is where a person's use of the drug negatively affects their life over the course of 12 months."
"0"	"Red Sox manager Alex Cora on reported involvement in Astros cheating scandal: 'I have talked to MLB and I'll leave it at that'"	"baseball_mlb"	"Boston Red Sox manager Alex Cora was identified as one of the individuals involved in the Houston Astros sign-stealing scandal that has consumed MLB headlines over the past week. Cora, who served as the Astros bench coach during the 2017 championship season that's come under scrutiny, was given was chance to respond to the allegations during an appearance on WEEI's Dale & Keefe show. Cora did ..."
"0"	"Every touchdown from every Week 10 game"	"football_nfl_videos"	"Watch Every Touchdown From Every Game presented by Amazon Prime during Week 10."
"0"	"Malik McDowell sentenced to 11 months in jail"	"football_nfl"	"Free agent defensive lineman Malik McDowell was sentenced to 11 months in jail and three years of probation Wednesday after pleading guilty to a series of crimes earlier this year in Michigan, Brady Henderson of ESPN reports. McDowell never played a down in the NFL. After the Seahawks drafted him 35th overall in 2017, McDowell [more]"
"0"	"2021 Ford Mustang Mach-E: This Electric SUV is a Mustang Family Member"	"autosnews"	"Ford confirms that its all-new, fully electric crossover will wear the iconic Mustang name."
"1"	"The One Thing Kourtney Kardashian Drinks Every Morning for Younger-Looking Skin"	"wellness"	"Instead of waking up with a hot cup of coffee, the "Keeping Up with The Kardashians" star makes a warm collagen powder beverage to kick-start her day."
"0"	"'Unthinkable': Accused killer of Georgia college student Alexis Crawford spent holidays with victim's family"	"newscrime"	"Jordyn Jones and boyfriend Barron Brantley were being held at Fulton County Jail on murder charges in the death of Alexis Crawford, Jones' roommate."
"1"	"Dog Tries To Jump On Recliner With Dad   And It Doesn't Quite Go As Planned"	"lifestylebuzz"	"Marybeth Parker He might be 5 years old, but Herbert is a huge baby at heart."
"0"	"Powerful side-by-side portraits show people over 100 years old next to their younger selves"	"lifestylebuzz"	"Opava-based photographer Jan Langer captured sentimental portraits of elderly Czech people for his photo series, "Faces of Century.""
"0"	"Ahead of this week's rematch, Tom Brady says he's still not quite over Super Bowl loss to Eagles"	"football_nfl"	"Plus, maybe you shouldn't expect to see a trick play from the Patriots."
"0"	"Choosing the right winter tires for snow and ice: A quick guide"	"autosownership"	"For many people, wintry drives are a fact of life. Here's how to make them less of a pain."
"0"	"Wealthy investors are bracing for a sharp stock sell-off in 2020"	"markets"	"More than half of the world's wealthiest investors are hedging for a sharp drop in financial markets before the end of next year, says UBS."
"0"	"Martha Stewart shares the family favorites she serves during the holidays, including adding cream cheese to her mashed potatoes"	"foodnews"	"Martha Stewart swears by family recipes for Thanksgiving, Christmas, and Hanukkah dishes   from potato pancakes to mashed potatoes."
"0"	"Millennials, Gen Xers to baby boomers: Can you retire so I can get a job promotion?"	"finance-career-education"	"Baby boomers are putting off retirement and that may be making it harder for millennials and Gen Xers to get promoted: USA TODAY/LinkedIn survey."
"0"	"Global debt surges above $250 trillion as US, China lead way"	"markets"	"Global debt hit a fresh record above $250 trillion in the first half of 2019, with China and the U.S. accounting for more than 60% of new borrowing, the Institute of International Finance said."
"1"	"Former Los Angeles police chief named interim in Chicago"	"newsus"	"CHICAGO (AP)   Chicago's mayor on Friday named former Los Angeles police Chief Charlie Beck to serve as Chicago's interim police superintendent, a day after the city's top police officer announced he is retiring. Mayor Lori Lightfoot said Beck was the perfect choice for the job leading the police force in the nation's third-largest city. She noted that he implemented many of the same reforms in Los Angeles that Chicago has undertaken in recent..."
"0"	"Ugly From the Outset: Hong Kong's Day of Widespread Violence"	"newsworld"	"HONG KONG   Hong Kong was a city on edge on Monday following escalating violence, in which one demonstrator was shot point blank by a police officer and one man was doused with a flammable liquid and set on fire after he scolded protesters. At nightfall, both men were fighting for their lives in a city seething with resentments. Protesters have voiced outrage at police officers they see as increasingly resorting to force, and at a government..."
"0"	"Prince Charles just turned 71   here are the best photos from every year of his royal career so far"	"lifestyleroyals"	"Prince Charles, heir to the throne, celebrates his 71st birthday on Thursday. Here are all the best photos from every year of his career."
"0"	"7 Women Share What It's Really Like To Work On A Cruise Ship"	"travelnews"	"If you've ever taken a cruise vacation, you know that it takes thousands of people to make sure you and your fellow travelers are housed, fed, and entertained well while on the trip. But, as travelers, there's a lot that goes into cruise ship hospitality we don't know about. To find out what it's really like to work and live on a cruise ship, we spoke to seven current and former employees. The folks we interviewed worked for Royal Caribbean..."
"0"	"50 Things Popular Restaurant Chains Don't Want You to Know"	"restaurantsandnews"	"You'll want to be aware of these restaurant secrets next time you go out to eat. (For example, you really don't have to ask for unsalted fries.)"
"0"	"Nikki Haley claims top aides tried to recruit her to 'save the country' by undermining Trump"	"indepth"	"In a new book, the potential White House aspirant slams Rex Tillerson as 'exhausting' and John Kelly as suspicious of her access to the president, and argues they should have quit if they disagreed with him."
"0"	"NFL could meet with Brown multiple times to discuss case"	"football_nfl"	"It seems highly unlikely that Brown will play again this season. The NFL has yet to give any indication of what   if any   disciplinary action he is up against."
"0"	"'Load management' isn't actually a problem, but it might expose one"	"basketball_nba"	""Load management" won't meaningfully impact the NBA's bottom line. But it might expose a broader issue that could. Because it isn't a problem. It's actually a solution   to another problem of the NBA's own making."
"0"	"America's Most and Least Popular Senators"	"newspolitics"	"Senators represent the interests of the residents of their home state on Capitol Hill by crafting and voting on new laws and by approving or rejecting cabinet and judicial nominations made by the president."
"0"	"Broadway Actress Laurel Griggs Dies at Age 13"	"musicnews"	"Broadway star Laurel Griggs has died, according to multiple reports. She was 13."
"0"	"Family Brings Snow Inside So Obsessed Indoor Cat Can Play In It"	"lifestylebuzz"	"Dibs the #SnowKitty When Dibs was just 6 months old and living as a stray on the streets, he met his future dad, Nate Troy, in a parking lot."
"0"	"Flight Attendants Have a Secret Language You Didn't Know About"	"travelnews"	"Here are some phrases only flight attendant use   and what they actually mean."
"1"	"Popeyes announces return date of its chicken sandwich and takes a dig at Chick-fil-A"	"foodnews"	"Popeyes is preparing to relaunch its popular chicken sandwich Sunday, which sold out in about two weeks. Sunday also is National Sandwich Day."
"0"	"2020 Ford Bronco: Everything we know about Ford's new SUV"	"autossuvs"	"It's only a matter of time until Ford pulls back the veil."
"0"	"2020 Lincoln Corsair Review: The Sleeper Hit of 2020 SUV of the Year Testing"	"autossuvs"	"Lincoln's small luxury SUV is a 2020 SUV of the Year finalist"
"0"	"North Korea says Trump administration sought reopening of nuclear talks"	"newsworld"	"North Korea on Thursday said the United States has proposed a resumption of stalled nuclear negotiations in December as they approach an end-of-year deadline set by North Korean leader Kim Jong Un for the Trump administration to offer an acceptable deal to salvage the talks."
"0"	"The 1 reason you shouldn't hesitate to claim Social Security early"	"finance-retirement"	"Seniors are often told to wait on Social Security, but here's a good argument for filing sooner."
"1"	"Trump to host G7 summit at his Doral resort, White House says"	"newspolitics"	"President Trump intends to host next year's G7 conference at his Doral International Resort in Miami in June."
"0"	"'Dancing with the Stars': Why Sean Spicer survives despite the lowest judge scores"	"tvnews"	"A 'Dancing with the Stars' voting fix designed to prevent popularity contests hasn't stopped former Trump spokesman Sean Spicer, leading to criticism."
"0"	"Camila Cabello and boyfriend Shawn Mendes get tattoos together: Photos"	"music-celebrity"	"The pop stars got inked together after four months of dating -- and this is Camilla's first tat!"
"0"	"Harrods accused of ruining the spirit of Christmas after limiting Santa visits to customers who spend over $2,500"	"finance-companies"	"A spokesperson for Harrods said that this policy is in place to cope with the overwhelming demand for its Christmas grotto."
"1"	"This 190-pound dog had to be carried down a mountain after refusing to continue hike"	"lifestylebuzz"	"Floyd, a mastiff, decided he was absolutely done while hiking the Grandeur Peak Trail near Salt Lake City."
"1"	"President Donald Trump greeted with boos at Game 5 of World Series, fans chant 'lock him up'"	"newspolitics"	"President Donald Trump was greeted with a thunderous chorus of boos from the sold-out crowd of baseball fans at Nationals Park."
"1"	"Janelle Monae's Sparkly See-Through Dress Has Me Feeling Some Type of Way"	"lifestylebuzz"	"We are truly blessed."
"0"	"'Lots of Tears!' Teresa Giudice Details Reuniting With Husband Joe in Italy"	"tv-celebrity"	"'Lots of Tears!' Teresa Giudice Details Reuniting With Husband Joe in Italy"
"0"	"15 secrets of the $4.99 Costco rotisserie chicken"	"foodnews"	"Though the price is widely known, there are some facts about Costco's most popular poultry that you might not know."
"1"	"Ranking the hottest coaching seats in the NFL"	"football_nfl"	"Whether due to a crushing lack of discipline, a distinct lack of command or just the end of a long road for one particular coach, these guys are in danger of being jettisoned."
"0"	"Stella McCartney Deleted a Meghan Markle Instagram Post After Followers Called Her Out"	"lifestyleroyals"	"Stella McCartney deleted a photo of Meghan Markle on Remembrance Day following backlash from Instagram followers."
"0"	"Lawyer says Trump budget official will testify in impeachment inquiry if subpoenaed"	"newspolitics"	"A career attorney for the Office of Management and Budget plans to testify behind closed doors for the impeachment inquiry should he receive a subpoena, his attorney told CNN on Thursday."
"0"	"Sears is laying off hundreds of corporate employees after announcing 96 store closings"	"finance-companies"	"Sears gathered employees in a room at a San Francisco office on Wednesday and told them all that they would lose their jobs, according to a source."
"0"	"Chuck Woolery: Supporting Trump 'pretty much destroyed my career'"	"tv-celebrity"	"Supporting President Trump and taking a conservative stance in public ruined Chuck Woolery's career and got him shadow-banned from Twitter, said the former game show host on "Fox & Friends," Wednesday."
"0"	"Disney is betting everything on its Disney+ streaming service"	"finance-companies"	"On Nov. 12, the company will launch Disney+, hoping to prove to investors   and the world   that it has a strong vision for the future."
"0"	"C8 Corvette Dyno Test Follow-Up: What Really Happened"	"autosnews"	"Key parameters were botched, but the C8's still plenty powerful"
"0"	"Yu Darvish sends hilarious tweet about Astros cheating scandal"	"baseball_mlb"	"Darvish is extremely entertaining on social media, which we were reminded of when he took a swipe at Justin Verlander during the playoffs this year."
"0"	"Walmart manager ready as store where El Paso mass shooting occurred reopens"	"newsus"	"Robert Evans was on hand at the Cielo Vista Walmart store Thursday morning to raise the U.S. flag that's been at half-staff since the Aug. 3 mass shooting, when 22 people were killed and dozens injured."
"1"	"Tiger Woods is finally writing a memoir and it has the perfect title"	"golf"	"HarperCollins Publishers has acquired the rights to the first-ever memoir authored by Tiger Woods."
"0"	"Your Guide to the Best Burger Spots in America"	"restaurantsandnews"	"Don't worry. We didn't forget D.C.!"
"0"	"Chuck E. Cheese just got major makeover   and axed the animal band"	"foodnews"	"The kid-friendly pizzeria is updating its menu, too."
"0"	"Can we stop with the Rob Gronkowski comeback talk?"	"football_nfl"	"Face it, Patriots fans: Gronk isn't coming back."
"0"	"The 23 Best Kitchen Gifts Under $25 in 2019"	"foodnews"	"How to give to the cooks, entertainers, and eaters in your life without spending a fortune."
"0"	"Answers remain elusive in Virginia Beach shooting rampage"	"newsus"	"Independent auditor's report says gunman didn't display warning signs."
"1"	"Queen Elizabeth Has Someone on Staff Break in Her Shoes Before Wearing Them"	"lifestyleroyals"	"Queen Elizabeth Has Her Shoes Broken in Before Wearing Them"
"0"	"Democrats' impeachment lawyer cut his teeth prosecuting mobsters, Wall Street cheats"	"newspolitics"	"Daniel Goldman will lead witness questioning during the hearings that begin Wednesday."
"1"	"Matt Lauer allegations: Megyn Kelly lauds Meredith Vieira, Ann Curry"	"newsus"	"Former NBC host Megyn Kelly is recognizing some of the females whom she described as "forces for good" in the Matt Lauer scandal."
"0"	"3 pieces of dated retirement advice you should ignore"	"finance-retirement"	"Cookie-cutter rules aren't going to cut it for your retirement plan."
"1"	"Eminem Says He Sides With Chris Brown Over Rihanna Assault on Alleged Leaked Song"	"musicnews"	"Leaked audio of Eminem allegedly rapping that he'd side with Chris Brown over Rihanna assault is making rounds on social media and fans are not happy."
"0"	"Report: Red Sox manager Alex Cora, Mets' Carlos Beltrán implicated in Astros sign-stealing scheme"	"baseball_mlb"	"On Tuesday, The Athletic reported that the Houston Astros engaged in an elaborate sign-stealing scheme that involved cameras, electronic transmissions and trash cans during their 2017 World Series run."
"1"	"Hillary Clinton Suggests Russia Is Grooming Current Democratic Candidate To Run as a Third Party Nominee"	"newspolitics"	"Hillary Clinton was a guest on David Plouffe's Campaign HQ podcast Thursday where she weighed in on possible Russian interference in the 2020 election."
"1"	"Porsche launches into second story of New Jersey building, killing 2"	"newsus"	"The Porsche went airborne off a median in Toms River, causing it to crash into a red brick building."
"0"	"COLLEGE BASKETBALL: Stonehill women look to build on successful season"	"basketball_ncaa"	"EASTON   The 2018-19 season was supposed to be a time of transition for the Stonehill College women's basketball team. One year earlier, with four senior starters, the Skyhawks went 29-4, won the NCAA Division 2 East Regional and advanced to the Elite Eight for the first time since 1995. Stonehill had to replace key players last season, including All-America guard Kelly Martin, after putting ..."
"0"	"Ruth Bader Ginsburg misses court due to illness"	"newsus"	"Supreme Court Justice Ruth Bader Ginsburg was not on the bench for oral arguments Wednesday due to illness, according to Chief Justice John Roberts."
"0"	"It's National Pickle Day So Here Are All The Ways To Celebrate The Momentous Occasion"	"foodnews"	"Choose whatever pickles your fancy."
"0"	"Fashion hits and misses from the 2019 Country Music Association Awards"	"cma-awards"	"From Nicole Kidman to Pink, see the best and worst dressed stars at the 2019 Country Music Association Awards."
"0"	"Here's how social media tricks you into overspending"	"finance-savemoney"	"How social media causes overspend"
"0"	"Freed ex-president tells crowd Brazil's left can win in 2022"	"newsworld"	"SAO BERNARDO DO CAMPO, Brazil (AP)   Freed from his cell, former President Luiz Inácio Lula da Silva told thousands of jubilant supporters Saturday that the left can take back Brazil's presidency in the 2022 election. Dressed in a black blazer and T-shirt, da Silva spoke from a stage outside the union near Sao Paulo that he once led and that served as the base for his political career."
"1"	"Jets' Osemele has shoulder surgery in 'unexcused absence'"	"football_nfl"	"Jets guard Kelechi Osemele had surgery on his ailing right shoulder Friday despite the team not approving the procedure."
"1"	"Chrissy Teigen Apologizes for Her 'Tone Deaf' Joke About Her Mom"	"tv-celebrity"	""I'm sorry and I will do better to not be such an a------.""
"0"	"The Giudice family reunites and more ICYMI celeb news"	"entertainment-celebrity"	"Giudice family reunites in Italy, Keanu Reeves has a girlfriend, Kevin O'Leary sued over boating accident and more news you might have missed this week."
"0"	"The most talked about movie moments of the 2010s"	"movies-gallery"	"Let's try to emphasize the positive, but there's one particular sequence that was so special in its awfulness, it had to go on this list. See if you can guess which one it is."
"0"	"A body-language expert says Meghan Markle is "politely disconnecting" from the public, and honestly, we would too"	"lifestyleroyals"	"Can we blame her? Meghan Markle is supposedly "politely disconnecting" from the public as seen in her body language, and girl, you do you."
"1"	"Exclusive: U.S. withholding $105 million in security aid for Lebanon - sources"	"newsworld"	"U.S. President Donald Trump's administration is withholding $105 million in security aid for Lebanon, two U.S. officials said on Thursday, two days after the resignation of Lebanese Prime Minister Saad al-Hariri."
"1"	"Bruce Willis brought Demi Moore to tears after reading her book"	"movies-celebrity"	"Demi wasn't sure how her ex would feel about her book until he called her."
"1"	"Marcus Smart laments his treatment by officials"	"basketball_nba"	"Terry Rozier's landing in Charlotte is certainly producing the kind of volume the former Celtic envisioned. He's playing an average of 32.7 minutes a night and filling that kind of opportunity with hefty results across the board   16.9 points, 5.6 assists and 4.1 rebounds."
"0"	"Democrats engineer multiple chances to make the case for Trump's impeachment"	"newspolitics"	"Televised hearings offer investigators a third bite of the media apple after details about the testimony from witnesses and the release of transcripts."
"0"	"Which NFL teams would be a fit for Colin Kaepernick? Ranking all from 32 to 1"	"football_nfl"	"NFL teams will get the opportunity to assess Colin Kaepernick on Saturday, but which landing spots might actually make sense for the quarterback?"
"0"	"Charles Rogers, former Michigan State football, Detroit Lions star, dead at 38"	"football_nfl"	"Charles Rogers, the former Michigan State football star whom the Detroit Lions selected with the second overall pick in 2003 NFL draft, has died."
"1"	"A Chef Shares the Secret Ingredient Your Mac and Cheese Is Missing"	"tipsandtricks"	"Want to know exactly how to make the best, homemade mac and cheese recipe? An executive chef gave us his recipe so you won't need the boxed stuff again."
"0"	"Muslim woman says Denver arena worker told her to remove hijab, refused to let her enter"	"newsus"	"Gazella Bensreiti said the Pepsi Center employee told her to "take that thing off" and said she could not come in until she removed her hijab."
"0"	"Judge calls USC dad a 'thief,' gives longest prison sentence so far in college admissions scandal"	"newscrime"	"Toby MacFarlane, a California real estate executive, received six months for his actions in the college admissions scandal. It's the longest so far."
"0"	"DE John Simon added to Patriots injury report"	"football_nfl"	"FOXBOROUGH -- The Patriots injury report was the same as Wednesday, except for one minor addition. Defensive end John Simon was limited was an elbow injury. Simon, along with three others were limited, while Nate Ebner missed the session for a second straight day due to ankle and back ailments. The Patriots will practice one final time before leaving for Philadelphia on Saturday. Here's the complete Thursday injury report. DID NOT PARTICIPATE S..."
"1"	"'We all had a good chuckle': Cowboys' 70-year-old defensive coordinator got his message across vs. Eagles"	"football_nfl"	"Cowboys defensive coordinator, 70, told his defense to 'blitz with some swagger' in a meeting, and the Cowboys delivered Sunday night against Eagles."
"0"	"The 15 Longest Nonstop Flights in the World"	"traveltrivia"	"Do you think you could handle being stuck inside a metal tube for this long?"
"0"	"Kristina Went From 'Drastic Diets' to Losing 105 Pounds With WW - Here's How She Did It"	"weightloss"	"Kristina had tried "drastic diets" and would stick to them for a while, but eventually she'd resort to "old habits and the weight would be put back on," she says."
"0"	"University suspends 14 frats after college freshman ends up in hospital"	"newsus"	"More than a dozen fraternities at San Diego State University have been suspended after a freshman was hospitalized following an event last week."
"0"	"I'm Child-Free and Couldn't Be Happier About It. What's So Bad About That?"	"voices"	"Women need to stop pressuring other women to want children"
"0"	"Fans are divided after Drake was revealed as a surprise festival headliner, booed off stage"	"musicnews"	"Fans are divided after the audience at Tyler, The Creator's Camp Flog Gnaw festival booed Drake, who was revealed to be the surprise headliner."
"1"	"Funny celeb pics for October 2019"	"humor"	"Helen Mirren does ride share differently and more pics that will make you LOL."
"0"	"Women in Japan were told not to wear glasses to work. Their response has been fiery."	"newsworld"	"Glasses, according to some companies in Japan, give women a "cold impression.""
"0"	"Dwayne Johnson Announces 'Black Adam' 2021 Release Date"	"movienews"	"The New Line movie, Black Adam, based on the DC comics property will hit cinemas on Wednesday Dec. 22, 2021, five days after Fox's Avatar sequel on Dec. 17. Pic is directed by Jaume Collet-Serra, who recently directed star Dwayne Johnson in Disney's upcoming Jungle Cruise. Black Adam will open up against Sony's Hotel Transylvania 4, Universal's feature adaptation of the"
"0"	"Knicks fans welcome Porzingis back with hearty round of boos"	"basketball_nba"	"Kristaps Porzingis returned to Madison Square Garden Thursday night for the first time since he was traded to the Dallas Mavericks."
"0"	"David Beckham Gives a Sneak Peek at His First Hotel, The Londoner Macao"	"travelnews"	"One of the most successful soccer players of all time, David Beckham has a new goal in his sights   the hotel industry."
