"1"	"This is What Will Happen When Queen Elizabeth Dies"	"lifestylevideo"	"Queen Elizabeth is the longest ruling monarch in British history but her unavoidable death will mark the end of an era and have huge repercussions all through the United Kingdom and the world. Veuer's Susana Victoria Perez has more."
"0"	"The Volkspod VW Beetle Minibikes Are Part Creepy, Part Adorable"	"autosmotorcycles"	"The people's pods."
"0"	"Pepper spray incident at Boston school sends 13 to hospital"	"newscrime"	"More than a dozen people were taken to area hospitals after an incident involving pepper spray at a school in Roslindale, according to first responders. Boston police responded to Washington Irving Middle School on Cummings Highway at about 10:30 a.m. Thursday after a report of a gas odor. "It was determined that a student sprayed pepper spray in the cafeteria," said Dan O'Brien, spokesman for Boston Public Schools. Sign up for our Newsletters..."
"0"	"Sky Bars are coming back to stores and classic candy fans are freaking out"	"foodnews"	"Get your sweet tooth ready."
"0"	"Mo'Nique Files Race and Sex Discrimination Suit Against Netflix"	"tvnews"	"Mo'Nique filed a discrimination suit against Netflix on Thursday, alleging that the streaming service broke the law when it gave her a lowball offer for a comedy special. The comedian   whose legal name is Monique Hicks   accused Netflix of race and sex discrimination. In January 2018, Mo'Nique called for a boycott of Netflix,"
"0"	"Here's What 'Cultural Appropriation' Actually Means   and Why It's Wrong"	"lifestylebuzz"	"The questions you've been afraid to ask, answered."
"1"	"Pentagon leader appeals to Trump to allow military justice cases to proceed unfettered"	"newspolitics"	"Trump has expressed interest in taking action on cases in which service members have faced war-crimes or other serious charges."
"0"	"John Legend Leads a Pack of Gorgeous Men in the Sexiest Man Alive Issue: From Sterling to Jason, Peek at 10 More Hot Guys"	"celebrity"	"Get to know some of our picks for Men of the Year"
"0"	"Stars turning 70 in 2019"	"celebrity"	"Seventy and sensational! Join us as we celebrate the stars who were born in 1949."
"0"	"Could this court case be the key to finding Dubai's missing princesses?"	"newsworld"	"Sheikh Mohammed of Dubai and his wife are locked in a child custody battle in the UK, and the case could shed light on the fate of Dubai's missing princesses."
"1"	"Patriots reportedly trying to acquire a star wide receiver"	"football_nfl"	"The Patriots reportedly would prefer a receiver who could "instantly command a defense's respect, alleviate Edelman's burden and help Brady.""
"0"	"'At 237 Lbs., I Was Embarrassed To Go To The Gym. So I Did An At-Home BeachBody Program And Lost 117 Lbs.'"	"voices"	""I wanted to be me again.""
"1"	"16 transgender celebrities who are changing television"	"tv-gallery"	"Shows like "Euphoria," "Pose," "The Fosters," and "Shameless" have all introduced trans actors and characters in recent years."
"0"	"Buffalo Wild Wings reopens after manager is killed in chemical accident"	"newsus"	"The Buffalo Wild Wings in Burlington reopened late Saturday morning after its general manager died Thursday evening in an accident involving cleaning chemicals, according to restaurant representatives. Ryan Baldera, 32, was overcome by the fumes and died after being rushed to Lahey Hospital, according to the Burlington Fire Department. Sign up for our Newsletters Representatives of the Buffalo Wild Wings told Josh Brogadir, of NewsCenter 5, that..."
"1"	"2 charged in murder of Alabama girl Kamille 'Cupcake' McKinney"	"newscrime"	"Two suspects have been charged with murder in the death of a 3-year-old Alabama girl who went missing from an outdoor birthday party on Oct. 12."
"0"	"Barn Find: Large Collection Of Pontiac Firebirds Uncovered"	"autosclassics"	"A total of nine Firebirds were discovered in Minnesota and are now up for auction."
"0"	"50 amazing gifts for every type of person and budget"	"shop-holidays"	"Let the product experts at Reviewed help you find the perfect gifts for everyone on your list."
"1"	"Jerry Jones hopes loss to Vikings isn't 'terminal'"	"football_nfl"	"The Cowboys had chances to win the game late, so Jones was obviously speaking from a place of great frustration."
"0"	"Utah death-row inmate featured in best-selling book dies"	"newscrime"	"SALT LAKE CITY (AP)   A Utah death-row inmate who killed his brother's wife and her toddler because of his strong polygamist beliefs in a case made famous by the book "Under the Banner of Heaven" has died of natural causes, prison officials said Monday. Ron Lafferty, 78, died at the state prison in the Salt Lake City suburb of Draper, Utah Department of Corrections spokeswoman Kaitlin Felsted said. The state attorney general's office had..."
"0"	"Memphis declares James Wiseman ineligible while it works toward resolution with NCAA"	"basketball_ncaa"	"James Wiseman withdrew his lawsuit against the NCAA, indicating a settlement could be in the works."
"0"	"Unwanted tourist types: The kinds of travelers becoming more unwelcome"	"travelarticle"	"Not long ago, destinations welcomed most any kind of traveler. Not these days. From rowdy partiers to cruise ship hordes, more places are discouraging unwanted types of tourists."
"0"	"He was a member of a boy band in the 90s. Now he's an ER doctor in Dallas"	"health-news"	"Just when he attained everything he had ever wanted, he realized it wasn't what he wanted."
"0"	"Early-season temperature check: Which team trends are for real?"	"icehockey_nhl"	"We've identified four early-season team trends and taken a temperature check on each of them."
"1"	"Rip Taylor's Cause of Death Revealed, Memorial Service Scheduled for Later This Month"	"tvnews"	"The comedian died at the age of 84 last month."
"0"	"READ: House Republican witness list for impeachment hearings"	"newspolitics"	"House Republicans plan to call Hunter Biden, the Ukraine whistleblower and others to testify in the upcoming public impeachment hearings."
"1"	"Trump Organization said to be weighing sale of D.C. hotel lease"	"newspolitics"	"The Trump Organization has hired the firm JLL to market the project, people close to the discussions say. Trump's D.C. hotel has been a center of controversy since he entered office   Trump continues to own his business, which runs properties including the hotel, leading to conflict-of-interest charges."
"0"	"Celebrity plastic surgery transformations"	"entertainment-celebrity"	"See how stars like Sharon Osbourne, Cardi B, Pauly D, Kim Zolciak-Biermann, Gisele Bundchen, Kanye West and others have altered their looks."
"0"	"Weird And Wild Photos From The Lone Star Motorcycle Rally"	"autosmotorcycles"	"20 photos of the crazy motorcycles, costumes, and attendees from the rally in Galveston, Texas."
"1"	"Opinion: Eagles need to make a trade to become contenders in 2019 NFL season"	"football_nfl"	"The Eagles got their season back on track with a win over the Bills, but they still need reinforcements at the NFL trade deadline."
"0"	"The Bakery Behind Doubletree's Famous Chocolate Chip Cookie Bakes More Than 100 Million Cookies A Year"	"foodnews"	"And they keep the recipe a complete secret."
"0"	"'I'm not so sure I would be laughing': Lindsey Graham says Hillary Clinton would be tough 2020 opponent"	"elections-2020-us"	"Republican Sen. Lindsey Graham expects Hillary Clinton would be a tough rival to beat if she decides to enter the 2020 fray."
"1"	"Ian Rapoport: Dallas Cowboys likely to franchise tag quarterback Dak Prescott"	"football_nfl_videos"	"NFL Insider Ian Rapoport reports Dallas Cowboys are likely to franchise tag quarterback Dak Prescott."
"1"	"UAW President Gary Jones to take leave of absence as corruption investigation escalates"	"financenews"	"UAW President Gary Jones has taken a leave of absence in the midst of the federal corruption probe; Rory Gamble will take over."
"0"	"RANKED: The 30 countries where expats are happiest"	"travelarticle"	"The ranking, done by InterNations, is based on 20,000 expats' happiness with life in general and with their personal relationships."
"0"	"Google Maps Says This Is the Worst Time to Leave for Thanksgiving Travel"	"traveltips"	"The tech giant recently unveiled its new time and stress-saving holiday travel tips, and we have to say, they really can help bring down your blood pressure in a holiday pinch."
"0"	"56 Hottest Holiday Gifts from Amazon"	"shop-holidays"	"We poured through Amazon's bestseller and most-wished-for lists to find the perfect gift for just about anyone in your life."
"1"	"Daily protests are paralyzing Haiti. Here's why."	"newsworld"	"Demonstrators from across society are demanding the resignation of President Jovenel Moïse in the longest sustained protest of his term."
"1"	"Chuck E. Cheese just got major makeover   and axed the animal band"	"foodnews"	"The kid-friendly pizzeria is updating its menu, too."
"0"	"Dean Foods files for bankruptcy"	"finance-companies"	"Dean Foods, America's largest milk producer, is filing for bankruptcy."
"0"	"Wynonna Judd's Daughter, 23, Released from Prison 6 Years Early After Being Granted Parole"	"music-celebrity"	"Wynonna Judd's Daughter Released from Prison 6 Years Early"
"1"	"Explaining Why LSU Jumped Ahead of Alabama for No. 1 in the AP Poll"	"football_ncaa_videos"	"LSU jumped over Alabama for No. 1 in the AP Poll. Chris Martin and Michael Kim discuss why the Tigers moved up a spot."
"0"	"Tuscan Kitchen To Offer Free Lunch To Veterans, 1 Guest Monday"	"newstrends"	"Salem and Portsmouth, New Hampshire, and Boston and Burlington, Massachusetts, locations will be closed in order to serve lunch to vets."
"0"	"Miranda Lambert Is Pretty in Pink at 2019 CMA Awards With Husband Brendan McLoughlin"	"awardstyle"	"Simply stunning!"
"0"	"These Two New Oreo Flavors Are Coming in 2020 and We're OBSESSED"	"foodnews"	"These new Oreo flavors are just what we were craving and we didn't even know it!"
"0"	"LSU, Ohio State, and Clemson control path to College Football Playoff, but who else does too?"	"football_ncaa"	"After a rather eventful day around the college football world, the big question is how did it all impact the College Football Playoff race. You would think that two of the top four teams falling on the first Saturday since the initial release of the College Football Playoff rankings would have a dramatic effect on Read more... The post LSU, Ohio State, and Clemson control path to College Football Playoff, but who else does too? appeared first on..."
"0"	"Hate crimes remain at heightened levels, FBI report finds"	"newsus"	"The number of hate crime incidents reported to the FBI last year remain at the heightened levels they surged to in 2017, according to statistics released Tuesday by the bureau."
"0"	"Mexico's security strategy called into question after Mormon killings and other violence"	"newsworld"	"After three women and six children were slaughtered on a remote dirt road in Mexico, relatives and members of their small religious community stood around the smoldering carnage for hours before local authorities arrived."
"1"	"USWNT star Carli Lloyd: World Cup was 'worst time of my life'"	"soccer"	"Even though she set records and won her second consecutive Women's World Cup, USWNT star Carli Lloyd said she was frustrated by a diminished role."
"1"	"Dwayne 'The Rock' Johnson Says Goodbye To 'Ballers' In Instagram"	"tv-celebrity"	"Going out like ballers."
"0"	"School district to give students easier access to birth control"	"newsus"	"A school committee in a Massachusetts city voted Thursday in favor of a proposal that will give high school students greater access to condoms, birth control pills and emergency contraception. The Lynn school committee voted unanimously to allow the community health center to provide better access for students to obtain condoms and contraceptives. Sign up for our Newsletters The decision was made in front of a crowded, standing room only meeting..."
"0"	"Why Prince Harry Wore His Remembrance Poppy Differently from the Rest of the Royal Family"	"lifestyleroyals"	"Why Prince Harry's Poppy Was Worn on His Cap"
"0"	"Mixed-race mother reveals strangers question whether she's related to her fair-skinned daughter - including a suspicious church-goer who asked the girl: 'Is this your Mummy?'"	"lifestylebuzz"	"Davina Moon, 32, from Surrey, who has a mixed heritage including Sri Lanka and Ireland, told how society often treats her differently because she doesn't look like her children."
"0"	"I moved from the US to the UK. Here are the 8 things that surprised me the most."	"voices"	"I've found that living in England comes with a lot of perks, especially when it comes to rent, grocery shopping, and travel."
"0"	"Dramatic Footage Shows Plane Skidding Off Runway at O'Hare Airport in Chicago"	"viral"	"A plane slid off the runway due to icy conditions at Chicago's O'Hare International Airport on Monday morning, November 11, as cold weather swept across the state. American Airlines told Storyful that flight 4125, which was traveling from Greensboro, North Carolina, to Chicago, slid off the runway upon landing at around 7.45 am on Monday as a result of icy conditions. The airline said no injuries were reported and all 38 passengers and three crew members were transported to the terminal at O'Hare airport safely. Local media reported that the incident prompted a ground stop at the airport, halting all landings until around 8.30 am. Airlines at O'Hare and Midway airports canceled hundreds of flights on Monday as the National Weather Service issued a winter weather advisory for the state. Credit: Joseph Lian via Storyful"
"1"	"Prince Harry and Meghan Markle just shared a never-before-seen photo of baby Archie with his 'Grandpa' Prince Charles to celebrate his birthday"	"lifestyleroyals"	"The Duke and Duchess of Sussex shared a new photo of Archie, Harry, and Charles to mark the Prince of Wales' 71st birthday on Thursday."
"0"	"American suspected of ISIS connections trapped in no man's land between Turkish, Greek borders: reports"	"newsworld"	"A U.S. citizen suspected of being a member of ISIS, is reportedly stuck in a heavily militarized no-man's land between the borders of the country that kicked him out, Turkey, and the one that refuses to accept him, Greece, officials say."
"0"	"Petition To 'Bring Back' Don Cherry Gains Traction After Hockey Commentator Fired For Comments About Immigrants"	"icehockey_nhl"	"Cherry's dismissal was announced on Monday by Sportsnet following his comments during his 'Coach's Corner' segment on Saturday's 'Hockey Night in Canada' program."
"0"	"This 'new' strain of HIV is actually a good thing"	"health-news"	"For starters, the "new" strain is… not new."
"1"	"Trooper accused of lewd crime at Gillette Stadium headed to court"	"newscrime"	"A Massachusetts State Police trooper charged in a lewd crime at Gillette Stadium is expected to be arraigned Friday. Trooper Andrew Patterson allegedly exposed himself to a woman at a concert in June. Sign up for our Newsletters Witnesses said he allegedly committed a lewd act while sitting next to a woman and later pretended to "grind" against her while recording on his cellphone. A man who was with the woman said he slapped the phone from..."
"1"	"Ford Lifts, Enlarges, and Carpets Its Super Duty SEMA Concepts"	"autossema"	"If you can make pickup trucks as tall as a two-story home, why not?"
"0"	"Judge agrees Alabama Islamic State recruit is not US citizen"	"newsus"	"A judge agreed Thursday with President Donald Trump's administration that an Alabama woman who joined the Islamic State group was not a US citizen, leaving the 25-year-old and her son in limbo in Syria. Reggie Walton, a federal judge in Washington, agreed with the government's position that Hoda Muthana's father was still a diplomat when she was born, making her ineligible for US citizenship, a lawyer for Muthana said. The lawyer, Christina..."
"1"	"Prince Harry and Prince William's Rift Is "One of the Main Reasons" the Sussexes Are Skipping Royal Christmas"	"lifestyleroyals"	"Santa is shook."
"1"	"Football Four: As Ohio State rolls and Oklahoma falls, Alabama and LSU ready for showdown"	"football_ncaa"	"As Ohio State rolls and Oklahoma falls, the SEC dreams of getting two teams into College Football Playoff. Out West, Oregon and Utah climb back in."
"0"	"Chick-fil-A's Peppermint Chocolate Chip Milkshake Is Finally Back For The Holidays"	"restaurantsandnews"	"Is it too cold for milkshakes?"
"0"	"The Shojo and Ruckus Team Will Continue Its Chinatown Takeover With Another Restaurant"	"newstrends"	"The unnamed new venture will join Shojo, BLR by Shojo, and Ruckus in the neighborhood in the spring"
"0"	"Nicole Kidman and Keith Urban Are Still Country's Hottest Couple at 2019 CMA Awards"	"cma-awards"	"The couple looked so in love while walking the red carpet."
"0"	"How Many Calories Can the Brain Burn by Thinking?"	"wellness"	"Our brains are ravenous, guzzling up to a quarter of the body's energy. So thinking really hard should be an easy way to burn more calories   right?"
"0"	"The week in entertainment history: Nov. 10-16"	"celebrity"	"Each week we take a look back through history at the world of entertainment to highlight major events, notable births and deaths."
"0"	"This Is the Hottest Destination in America for a Road Trip"	"video"	"64 percent of Americans want to go on a spontaneous road trip with friends. A Sixt study looked at the most desirable road trip destinations. Buzz60's Sam Berman has the full story."
"0"	"Stella McCartney removes Instagram post plugging her $1,900 coat that Meghan Markle wore amid backlash"	"lifestyleroyals"	"The designer has been slammed for plugging her £1,545 belted wool Stella McCartney coat which was worn by Meghan Markle at the Cenotaph yesterday."
"1"	"Michelle Obama Shows Off Her Abs in New Workout Photo: 'I'm Always Glad I Hit the Gym'"	"entertainment-celebrity"	"The former First Lady shared an inspirational workout selfie in honor of #SelfCareSunday."
"0"	"With latest sign-stealing revelations, Houston Astros once again toe baseball's ethical lines"	"baseball_mlb"	"Accused of electronically stealing signs in 2017, the Astros organization faces even more questions about its culture."
"1"	"Burlington woman who allegedly struck 4 children in Stoneham hit-and-run crash arraigned"	"newscrime"	"A $1,000 cash bail was set for 30-year-old Stephanie DeTomasi, officials said."
"0"	"He was one of the first prisoners released under Trump's criminal justice reform law. Now he's accused of murder."	"newscrime"	"In February, Joel Francisco became one of the first federal prisoners to walk free as a result of the First Step Act, a landmark piece of criminal justice reform legislation. Last month, he was handcuffed again, accused this time of fatally stabbing another man."
"0"	"American ISIS fighter stranded in no-man's to be repatriated to U.S., Turkey says"	"newsworld"	"Turkish media identified the Islamic State group fighter as Mohammad Darwis B. and said he was an American citizen of Jordanian background."
"0"	"American Outdoor to split into two firms, separating its gun business"	"finance-companies"	"American Outdoor Brands Corp. said it will split into two publicly traded companies, one focused on firearms and the other on outdoor products, in an effort to reverse a stock-market decline amid rising pressure for tougher U.S. gun restrictions."
"1"	"Ford Baby Bronco Bare Body Allegedly Leaked In Exclusive Photo"	"autosnews"	"Ford had no comment, but it sure looks like the real deal."
"0"	"The Full-Size 2022 Jeep Grand Wagoneer SUV Is Finally On Its Way"	"autossuvs"	"The new, luxurious Wagoneers will be built in Detroit starting late in 2021"
"0"	"Popeyes' chicken sandwich is back on the menu, but it seems smaller and less exciting the second time around"	"restaurantsandnews"	"Popeyes finally brought back its long-awaited chicken sandwich, but it may not be the chicken sandwich fans were waiting for."
"0"	"My wife and I have bailed out our son, yet we have the daughter-in-law from hell"	"personalfinance"	"'We have lent them considerable money, but his wife now denies it was a loan.'"
"0"	"A Texas woman was legally declared dead while still alive"	"newsus"	"Sherry Ellis found out she was dead November 1."
"0"	"13 Popular Foods People Hated Eating 100 Years Ago"	"foodnews"	"Culinary trends are just as fickle as fashion. Find out which gourmet foods you love used to only be fed to animals or prisoners. The post 13 Popular Foods People Hated Eating 100 Years Ago appeared first on Reader's Digest."
"1"	"Gronkowski suggests that he'll unretire if NFL legalizes CBD"	"football_nfl"	"As the clock continues to tick toward the deadline for a 2019 return from tight end Rob Gronkowski, Gronk has hinted that he'll return in 2020   if the NFL makes one specific change to its rules. Via Stefan Geller of the Boston Herald, Gronkowski called on the NFL to permit players to use CBD, [more]"
"1"	"Mike Johnson asks out Keke Palmer after Demi Lovato date, plus more news"	"entertainment-celebrity"	"Mike Johnson tried to ask out Keke Palmer in a conversation about his date with Demi Lovato. Plus, more celebrity news for Oct. 14, 2019."
"0"	"A Russian professor was pulled from a river. Police said a woman's arms were found in his rucksack"	"newsworld"	"Russian law enforcement agencies are questioning a prominent historian over the death of a former student in the city of St. Petersburg, in a case that has grabbed headlines across the country."
"0"	"4 reasons you shouldn't max out your 401(k)"	"finance-saving-investing"	"Making high-dollar contributions to your 401(k) can cost you."
"0"	"'One in a million' deer captured on camera in Michigan woods"	"newsus"	"Retired Michigan lawmaker and amateur photographer Steven Lindberg took pictures of a deer. That deer had three antlers."
"0"	"Russian spies likely intercepted ambassador's cell phone call with Trump"	"newsworld"	"US Ambassador to the European Union Gordon Sondland's cell phone call to President Donald Trump from a restaurant in Ukraine this summer appears to be a shocking security breach that raises significant counterintelligence concerns, according to several former officials, who told CNN there is a high probability that intelligence agencies from numerous foreign countries, including Russia, were listening in on the conversation."
"0"	"American Idol Winner Phillip Phillips Welcomes First Child, Son Patch"	"music-celebrity"	"Phillip Phillips and Wife Hannah Welcome First Child, a Son"
"1"	"A Texas mom is going to prison after putting her son through unnecessary medical procedures"	"newscrime"	"A Dallas mother made her son go through unnecessary medical procedures throughout the first years of his life, court documents say."
"0"	"Google's totally creepy, totally legal health-data harvesting"	"finance-companies"	"Google is an emerging health-care juggernaut, and privacy laws weren't written to keep up."
"1"	"Bucs release former first-round pick Vernon Hargreaves"	"football_nfl"	"TAMPA   Two days after he was benched for not hustling to a make a tackle, the Bucs released starting cornerback Vernon Hargreaves Tuesday morning. The 11th overall pick in 2016 from the University of Florida, Hargreaves struggled to hold up his reputation as a ball hawk in the NFL with only two career interceptions in four seasons. Hargreaves was informed of the decision Tuesday morning at ..."
"0"	"Malik Hooker on Adam Vinatieri: 'I don't give a damn how many field goals he has missed'"	"football_nfl"	"Frank Reich and the Indianapolis Colts announced Wednesday that they are standing by future Hall of Fame kicker Adam Vinatieri."
"0"	"Kendall Jenner Wore the Tiniest Dress to Go Jewelry Shopping"	"lifestylebuzz"	"No fall layers to see here."
"1"	"7 New Bronco Design Details Directly Previewed By the Wild Baja Race Truck Version"	"autosnews"	"Yes, the Bronco R is insane, but several aspects of it are pulled straight from the production Bronco"
"1"	"This Guy Lost 30 Pounds and Gained a Rock-Hard Six Pack"	"weightloss"	"Pizza, Chinese take-out, McDonald's, ice cream, you name it   "If it isn't good for you, I would enjoy eating it in large quantities," says Chris Anderson."
"0"	"What Happens When a Plane Collides with a Flock of Birds?"	"travelnews"	"It's a bird...it's a plane...it's a midair nightmare?"
"0"	"They bought a 1 euro house in Italy -- here's what happened next"	"travelnews"	"CNN Travel caught up with some of the pioneering buyers -- or "€1 citizens," as the locals in Italy call them -- to discover whether it's been worth it to buy a house for a little more than $1."
"0"	"Can you answer these real Jeopardy questions about TV shows?"	"tv-gallery"	"Culling data straight from the "Jeopardy!" archives, Stacker will provide a "clue" about TV shows and then present the answer in the form of a question on the following slide. Can you answer these real "Jeopardy!" questions about TV shows?"
"0"	"The Infertility Secret I Kept From My Mother"	"voices"	"Although I've always enjoyed almost sitcom-level chumminess with my mother, I've also always kept certain things secret from her. Total transparency does neither a mother nor a daughter any favors, which is why, when I was in high school, I kept my cigarettes hidden in a shoebox and threw away underwhelming report cards before she could see them. Later, after I'd moved out of the house, I continued to bury select items deep in my closet before..."
"0"	"The best burger and fries joint in your state"	"restaurantsandnews"	"There can't be any meal quite as satisfying as a juicy burger and crispy, fresh fries. But where can you find the best? We've chosen the top burger and fries joints in every single state to help make sure your next order is absolutely delicious."
