"1"	"J.Lo Just Posted A Sweaty Gym Selfie That Proves Her Workouts Are Definitely Paying Off"	"fitness"	"Jennifer Lopez shared a post-workout pic showing that those abs don't come easy! Here are more details on her routine."
"1"	"Titans' Delanie Walker calls out team Twitter for fueling QB controversy"	"football_nfl"	"The Tennessee Titans have a decision to make on their Week 7 starting quarterback, and their Twitter account is embracing it more than it perhaps should."
"0"	"Matthew Stafford uncertain for Week 10"	"football_nfl"	"The Lions quarterback Matthew Stafford has not missed a start since the 2010 season but Week 10 is uncertain."
"0"	"North Korea calls Biden 'rabid dog' that 'must be beaten to death'"	"newsworld"	"North Korea has launched a visceral diatribe against US Democratic presidential candidate Joe Biden, calling the former vice-president a "rabid dog" -- while also borrowing the terminology of Donald Trump. KCNA appeared to cite one of Trump's favoured insults for the candidate -- "Sleepy Joe" -- when it said Americans called him "Biden not awakened from a sleep"."
"0"	"Six pretenders entering the 2019 NFL home stretch"	"football_nfl"	"Thanksgiving is just around the corner and the home stretch for the 2019 NFL regular season is essentially here."
"0"	"A Trump Tax Break To Help The Poor Went To a Rich GOP Donor's Superyacht Marina"	"markets"	"The Trump tax law gave governors the authority to distribute valuable tax breaks, and they have wielded it to benefit the politically connected."
"0"	"See inside a woman's 270-square-foot tiny home complete with 2 bedrooms and a walk-in closet"	"lifestylebuzz"	"The tiny house is currently in Victoria, Australia, but it was built with wheels attached, allowing owner Dolly Rubiano to move it wherever she wants."
"0"	"Ferrari's New Key Is Literally Just a Big Ferrari Badge"	"autosnews"	"The valet will have no trouble finding a key like this."
"1"	"Air Canada will no longer call passengers 'ladies and gentlemen,' and will use the gender-neutral term 'everybody' instead"	"travelnews"	"The policy comes four months after Canada started allowing citizens mark their gender as "X," rather than male or female, on their passports."
"0"	"Survivor Contestant Accused of 'Inappropriate Touching,' 2 Players Admit to Using Allegations to Win"	"tvnews"	"Survivor Faces 'Inappropriate Touching' Scandal: Dan Accused by Kellee"
"0"	"Colorado's buffalo mascot, Ralphie V, gets the boot for being too fast"	"football_ncaa"	"Ralphie V's 12-year tenure as Colorado's live mascot is coming to an end due to safety concerns. Ralphie was running too fast for her handlers."
"1"	"Papa John's introduces first new pizza crust flavor in 35 years"	"foodnews"	"Say "cheese!"   because it's going on your pizza crust. Papa John's on Monday introduced a new flavor of crust: Garlic Parmesan. It's the first time in 35 years that the popular pizza chain has rolled out a new crust flavor. "There's a lot of fan love for Papa John's signature Garlic Sauce, so we knew our first-ever innovation of our original crust had to feature it," said Paul Fabre, a senior vice president at Papa John's. "The new Garlic...""
"0"	"'Priceless' finds that turned out to be worthless"	"markets"	"From a bottle of rare Scotch whisky to a fake Picasso painting, we take a look at items from around the world that were believed to be highly valuable... but turned out to be worthless."
"0"	"Deval Patrick To Join 2020 Presidential Race: Sources"	"newspolitics"	"The former governor of Massachusetts has made his decision and will make an announcement this week, source said."
"0"	"Celine Dion Shares What She Misses Most About Late Husband Rene Angelil"	"music-celebrity"	"'Rene will always be with me, but I'm not in pain.'"
"0"	"Impeachment hearing TV audience less than for Kavanaugh or Comey -Nielsen data"	"newspolitics"	"The first televised hearing of the impeachment inquiry into U.S. President Donald Trump on Wednesday attracted an estimated 13.8 million viewers across 10 broadcast and cable television networks, according to Nielsen ratings data."
"1"	"Prosecutors want black judge who criticized incarceration rates of African Americans removed"	"newsus"	"Iberia Parish judge Lori Landry has questioned the large number of black Louisianans incarcerated by the district attorney's office"
"1"	"Young and the Restless Star William Wintersole Dies at 88"	"tvnews"	"Soap Opera Star William Wintersole Dies at 88"
"0"	"Opinion: NFL owes Colin Kaepernick a fair shot at weekend workout in Atlanta"	"football_nfl"	"The NFL finally has a chance to do right by Colin Kaepernick, who will do on-field drills and interview at a workout all 32 teams were invited to."
"0"	"2020 Corvette Doesn't Like The Snow, Crashes On Detroit Highway"	"autosenthusiasts"	"It's going to be a long winter."
"1"	"Mixed-race mother reveals strangers question whether she's related to her fair-skinned daughter - including a suspicious church-goer who asked the girl: 'Is this your Mummy?'"	"lifestylebuzz"	"Davina Moon, 32, from Surrey, who has a mixed heritage including Sri Lanka and Ireland, told how society often treats her differently because she doesn't look like her children."
"0"	"Shortage of Gulf Oysters Threatens Southern Culinary Heritage"	"foodnews"	"Flooding along the Mississippi River this spring and summer killed oysters by the millions."
"1"	"World's largest White Castle runs out of burgers on day 1"	"foodnews"	"To some, White Castle may just be another fast food burger joint. To others  myself included it is a religion. It's the kind of place we take our loves on Valentine's Day; it's where we marry them when we realize they're "the one". It's a restaurant that, for some of us, becomes more than a restaurant. While there are those who are aghast at the chaos that occurred yesterday when White Castle opened its first-ever location in Arizona, there are..."
"0"	"I went to Peter Luger after it received zero stars from New York Times"	"restaurantsandnews"	"The burger was so juicy I had to wipe my fingers after every bite. And everyone from regulars to tourists couldn't stop singing Peter Luger's praises."
"0"	"Nor'easter to grind at US East Coast this weekend"	"weathertopstories"	"High winds, heavy surf and drenching rain will pound part of the southern Atlantic coast this weekend, but some impact from the storm will expand to the coastal Northeast later this weekend to early next week."
"0"	"A former royal bodyguard shared the challenges that come with protecting the royal family"	"newsoffbeat"	"Simon Morgan says there are many behind the scenes aspects to royal tours and engagements that the public don't see."
"0"	"How this couple built a $100 million company without killing each other"	"finance-companies"	"When the boundaries between work and life get fuzzy."
"1"	"These Are The World's Most Magical Christmas Villages to Visit This Year"	"travelarticle"	"It's the most wonderful time of the year, after all."
"1"	"Porzingis has 1 regret after messy divorce from Knicks"	"basketball_nba"	"The divorce from the Knicks "wasn't ideal," according to Kristaps Porzingis."
"0"	"15 mouthwatering photos of stylish restaurants around the world"	"restaurantsandnews"	"Here's a look inside some of the world's most colorful, impeccably designed eateries that will inspire your next trip."
"0"	"Stars Who Served in the Military"	"entertainment-celebrity"	"Adam Driver, Jeff Bridges, Ice-T and more stars who served in the military."
"0"	"Instagram-famous pilot reveals secrets people don't know about the job"	"travelnews"	"Maria Fagerström, a pilot and Instagram influencer, shared some things passengers don't usually know about the job."
"0"	"The Geno Smith coin toss conspiracy is the dumbest thing in Seahawks' win over 49ers"	"football_nfl"	"Did Geno Smith say "heads" or "tails" in the coin flip for overtime?"
"1"	"$16.8 Million In Campaign Funds Went To Trump Businesses, Latest Records Reveal"	"newspolitics"	"Not only have the U.S. and foreign governments spent money at properties owned by Donald Trump, but the president's own political campaign and affiliated political committees have also spent about $16.8 million at his businesses since he launched his 2016 bid for the presidency, according to an analysis of federal election spending records. Republican political campaigns and PACs have spent just under $1.8 million at Trump-owned businesses so..."
"0"	"Kiss Cancel 'End of the Road' Tour of Australia and New Zealand Due to Illness"	"musicnews"	"Kiss won't be playing Australia and NZ after all."
"0"	"Report: Antonio Brown not expected to play again this season"	"football_nfl"	"Three teams have reportedly shown interest in the star wide receiver and been in contact with him, but the NFL is still investigating Brown."
"0"	"'Baby Shark' Devoured Your Brain. Your Wallet Is Harder to Swallow."	"finance-companies"	"By the time the confetti cannons burst, the toddlers were shouting in ecstasy, their eyes fixed on the superstars onstage. Ten costumed performers were delivering the climax of "Baby Shark Live!"   a 75-minute adaptation of a two-minute music video, and an edge case in translating viral popularity into an enduringly profitable real-world franchise. The global premiere took place on a Thursday night in October at South Carolina's Spartanburg..."
"1"	"Cardio Isn't the Best Way to Burn Belly Fat - Here's What Trainers Want You to Do Instead"	"fitness"	"Consistent diet and exercise play a role in blasting your belly, but it's true that some workouts do burn fat faster and more efficiently than others."
"0"	"Arby's tells parents that 'only well behaved children' are allowed"	"restaurantsandnews"	"A location of the fast-food chain said only those who remained seated and kept food on their trays would be welcome."
"0"	"Senior Trump official embellished résumé, had face on fake Time cover"	"newspolitics"	"State Dept. official Mina Chang claimed to be a Harvard Business School "alumna" who ran a nonprofit that worked in 40 countries."
"0"	"Greg Hardy loses UFC fight in Moscow"	"mma"	"Former Panthers and Cowboys defensive end Greg Hardy had another UFC fight today in Moscow, and it did not go well. Hardy was matched up with one of the UFC's top heavyweights, the Russian Alexander Volkov, and Volkov picked him apart for an easy victory. It was a unanimous decision, with all three judges awarding [more]"
"1"	"Chrissy Teigen Predicts The Office's Jim and Pam Are Divorced Now, Sends Twitter into a Tailspin"	"tv-celebrity"	"Chrissy Teigen Predicts The Office's Jim and Pam Are Divorced"
"0"	"Deval Patrick Joins the 2020 Race: 'This Won't Be Easy, and It Shouldn't Be'"	"elections-2020-us"	"Former Gov. Deval Patrick of Massachusetts officially entered the presidential race, adding an 18th candidate and an 11th-hour twist to a turbulent Democratic primary."
"0"	"The 50 cheapest places to buy land in America"	"finance-real-estate"	"Find out where you can get parcels of land for $10,000 or less."
"1"	"Fox News contributor: 'Most likely' outcome is Trump doesn't run in 2020"	"newspolitics"	"Fox News contributor Christopher Hahn predicted that President Trump will not run for reelection in 2020."
"0"	"Winners and losers from college basketball's signing day deadline"	"basketball_ncaa"	"College basketball's early signing day period left some teams ecstatic (such as Duke and UNC) and others devastated (sorry, Kentucky)."
"0"	"California to overhaul insurance plan after wildfires"	"newsus"	"Californians who lost their home insurance because of the threat of wildfires will be able to buy comprehensive policies next year through a state-mandated plan under an order issued by the state insurance commissioner."
"0"	"LA Sweep: Angels' Trout, Dodgers' Bellinger win MVP Awards"	"baseball_mlb"	"LA Sweep: Angels' Trout, Dodgers' Bellinger win MVP Awards"
"0"	"Controversial products that had to be pulled"	"finance-companies"	"Every now and again a retailer launches a product that clearly hasn't been thought through."
"0"	"Drake Has Something to Say to the ''Kids'' Who Booed Him Off Stage"	"musicnews"	"Drake took to Instagram with an admittedly hilarious response to the Camp Flog Gnaw Carnival attendees that weren't pleased by his surprise performance"
"0"	"Trump Has Considered Firing Intelligence Community Inspector General"	"newspolitics"	"President Trump has discussed dismissing the intelligence community's inspector general, Michael Atkinson, because Mr. Atkinson reported a whistle-blower's complaint about Mr. Trump's interactions with Ukraine to Congress after concluding it was credible, according to four people familiar with the discussions. Mr. Trump first expressed his dismay about Mr. Atkinson around the time the whistle-blower's complaint became public in September. In..."
"1"	"Kim Kardashian West says she's gained 18 pounds in the past year"	"health-news"	"The reality TV star is determined to whip herself back into shape."
"0"	"Stunning photos of redheads from around the world"	"lifestylebuzz"	"Photographer Brian Dowling has traveled to 20 countries to photograph redheads around the world in order to celebrate their natural beauty."
"0"	"I Never Imagined Being A Grandmother At 35. Here's How It Changed My Life."	"voices"	""She's a baby with a baby!" my mom joked to the cashier when I was 18. We wereshopping for maternity clothes for me, and looking back now, I guess I was ababy. But at the time I thought I had a plan.I met Larry when I was 16, working my first job at Red Lobster. I was ahostess and he worked in the kitchen. He was 20, kind and living in anapartment with friends. We started dating and then decided to get married onlya year later. My mom wanted us..."
"1"	"How To Make Cast-Iron Skillet Lasagna By Rachael"	"videos"	"This cast-iron skillet lasagna is just as delicious as traditional lasagna, but easier to make   AND you can serve it straight from the skillet."
"0"	"Jilmar Ramos-Gomez, US citizen detained by ICE, to get $190K"	"newsus"	"A Michigan city will pay $190,000 to a Marine veteran and United States citizen who was arrested by the police and turned over to Immigration and Customs Enforcement officials."
"1"	"Elijah Cummings to lie in state in Statuary Hall ahead of Friday funeral"	"newspolitics"	"Rep. Elijah E. Cummings will lie in state in the Capitol's Statuary Hall Thursday before a Friday funeral in his home district of Baltimore. Many lawmakers are expected to attend the memorial service for the House Oversight and Reform Committee chairman, which will be held Thursday morning. The ceremony will be held Thursday morning and will be open to members of Congress, the Cummings family and invited guests."
"0"	"No firsthand knowledge is GOP rallying cry in defense of Trump on impeachment"	"newspolitics"	"The White House and congressional Republicans argue that they can undercut the Democrats' case, but the strategy could backfire on Trump."
"1"	"Southwest Airlines flight attendant: Pilots streamed airplane bathroom video to cockpit"	"newsus"	"A Phoenix-based Southwest Airlines flight attendant says she was retaliated against after reporting two pilots for livestreaming a plane's lavatory."
"0"	"Six teams on upset alert in NFL Week 10"	"football_nfl"	"Can the Bears right the ship on offense against a tougher-than-expected Lions team? And will the Seahawks be the team to deal San Francisco its first loss? These two games, as well as a few others, seem to be ripe for an upset."
"0"	"Selena Gomez and Julia Michaels Share a Kiss Before Getting Matching Arrow Tattoos"	"music-celebrity"	"Selena Gomez and Julia Michaels Get Matching Arrow Tattoos"
"0"	"Chipotle Says It Will Keep Serving Carne Asada into Early 2020, Fans Rejoice"	"foodnews"	"Chipotle announced that their latest menu addition, carne asada steak, would stick around, and people are rejoicing on social."
"1"	"Nunes Raised Steele Dossier in Sondland Hearing"	"newspolitics"	"During a closed-door impeachment meeting on Capitol Hill, Rep. Devin Nunes (R-CA) brought up a topic that surprised some attendees: the Steele dossier. The context, according to three sources familiar with the episode, was his effort to explain why President Trump might be "upset" about Ukraine. Nunes, the top Republican on the House Intelligence Committee that is leading the impeachment probe, said some of the dossier's contents dealt with..."
"0"	"Trump's Deal Allowing 3D-Printed Guns Online Deemed Illegal"	"newsus"	"The Trump administration broke a federal law when it reached a settlement allowing a small gun-technology company to post online the digital blueprints for making weapons with a 3D printer, a judge ruled."
"1"	"Panera Bread worker fired after TikTok exposed frozen mac and cheese"	"foodnews"	"On Friday, the poster said on Twitter that she was fired for the video, showing her place a frozen bag of macaroni and cheese into a vat of hot water."
"0"	"Chrissy Teigen's weekend was basically a clapback double-header, plus more news"	"entertainment-celebrity"	"Chrissy Teigen gives us two more lessons in the art of the clapback. Plus, more celebrity news for Nov. 12, 2019."
"0"	"Clinton warns U.K. headed for 'fascism' as politics turns nasty"	"newsworld"	""That's the path of authoritarianism, that's the path of fascism   when you are told you are in danger or your family is.""
"0"	"Gabbard Lawyers Demand Clinton Retract 'Defamatory' Russian Asset Comments"	"elections-2020-us"	"Gabbard received bipartisan criticism over her foreign policy, especially her view that Syria's Bashar al Assad is "not an enemy" of the U.S."
"0"	"Klobuchar: Woman with Buttigieg's record would miss debate"	"elections-2020-us"	"Sen. Amy Klobuchar says she and other top female presidential candidates wouldn't be on the debate stage if they had the same experience as Mayor Pete Buttigieg."
"0"	"Myanmar accused at UN court of genocide against Rohingya"	"newsworld"	"Myanmar was accused Monday of genocide at the U.N.'s highest court for its campaign against the country's Rohingya Muslim minority, as lawyers asked the International Court of Justice to urgently order measures "to stop Myanmar's genocidal conduct immediately." Gambia filed the case on behalf of the Organization of Islamic Cooperation."
"1"	"Raiders trade third-year CB Gareon Conley to Texans for third-round pick"	"football_nfl"	"Conley represents yet another Reggie McKenzie-era first-rounder the Jon Gruden regime has jettisoned."
"0"	"Stunning photos of 27 places around the world that you should visit before they disappear forever"	"traveltripideas"	"From Patagonia's glaciers to Africa's Congo Basin, visit these threatened natural wonders before they're gone."
"0"	"We Tried 9 Packaged Stuffings and There Was a Clear Winner"	"tipsandtricks"	"Don't sleep on supermarket classics."
"0"	"Former U.S. President Carter recovering in hospital after successful brain procedure"	"newsus"	"Former U.S. President Jimmy Carter was recovering at an Atlanta hospital on Tuesday after safely undergoing a procedure to relieve pressure on his brain from bleeding caused by recent falls, the Carter Center said in a statement."
"0"	"How To Make Texas Chicken-Fried Steak & Creamed Gravy By Rachael"	"videos"	"Chicken-fried steak & gravy gets some Texas spice PLUS a side of cheesy, bacon-studded hasselback potatoes."
"0"	"The keto diet is hard work   but this hack makes it so much easier"	"nutrition"	"Let's face it: Healthy, keto-friendly meals require some form of food prep."
"1"	"Sallie Mae execs tan at Maui retreat while student debt crisis tops $1.6 trillion"	"finance-career-education"	"As borrowers struggle to keep up with their payments, Sallie Mae flew more than 100 employees on its sales team to Hawaii to celebrate $5 billion in sales."
"0"	"Model, 23, Didn't Know She Was Pregnant Until She Gave Birth to a Full-Term Baby in Her Bathroom"	"health-news"	"An Australian model recently had a life-changing surprise when she gave birth to a baby in her bathroom, despite not knowing that she had been carrying her daughter for nine months."
"0"	"Meghan Markle Smudged Makeup on a Fan's Coat & He Reacted Perfectly"	"lifestyleroyals"	"We've all been there."
"0"	"Before you sign up for Disney+, this calculator adds up the 'true' cost of your streaming services"	"personalfinance"	"Netflix for $12.99, Disney+ for $70 a year, Hulu with no ads for $11.99, and add on HBO for $14.99… wait, how much is this all costing? Welcome to the next phase of the streaming wars."
"0"	"Kelly Clarkson forgot the Jonas Brothers opened for her in 2005 and Nick Jonas isn't surprised"	"musicnews"	"Kelly Clarkson forgot the Jonas Brothers opened for her in 2005 and Nick Jonas isn't surprised"
"0"	"Sweet Cat Walks Extra Slowly To Stay Next To His Best Friend On Crutches"	"lifestylebuzz"	"Gerard Keane and his sweet cat, Mitcho, have always been inseparable."
"0"	"Chick-fil-A owner fights back against 'slowest drive-thru' accusations"	"foodnews"	"The owner of two Chick-fil-A restaurants in Ohio isn't taking accusations against the company sitting down."
"0"	"Why Your Connecting Gate May Be a Mile Walk"	"travelarticle"	"We've all experienced the adrenaline rush of racing to a connecting airport gate. Sometimes it's right there, and other times it's more than a mile away. So why does this happen?"
"0"	"How the Trump Administration Eroded Its Own Legal Case on DACA"	"newsus"	"WASHINGTON   When Attorney General Jeff Sessions appeared before news cameras at the Justice Department in early September 2017 to announce that President Trump was ending deportation protections for young undocumented immigrants, he knew the administration had left itself more legally vulnerable than it should have."
"0"	"Should You Try the Controversial Cabbage Soup Diet? See What Experts Have to Say"	"nutrition"	"Have you tried the cabbage soup diet, the 7-day program where soup is most of your food? We asked the experts to chime in on its effectiveness and safety."
"1"	"Dez Bryant plans to reach out to NFL teams in two weeks"	"football_nfl"	"The former Cowboys' WR1 is just looking for a chance."
"1"	"Who Is on the Masked Singer Season 2? The Ultimate Guide to the Stars Under Those Masks"	"tv-gallery"	"The Masked Singer's second season is under way, you guys!"
"1"	"MLB bans women who flashed their chests behind home plate during Game 5 of World Series"	"baseball_mlb"	"MLB has indefinitely banned two women who flashed their chests on television during the seventh inning of Game 5 of the World Series on Sunday night."
"1"	"Nickelodeon Universe -- the largest indoor theme park in North America -- opens this week"	"travelnews"	"All your favorite Nickelodeon characters are coming to New Jersey."
"0"	"Body found in Athol identified as Leominster woman"	"lifestylefamily"	"A 26-year-old Leominster resident has been identified as the woman whose body was found Monday near the entrance to the Athol Wastewater Treatment Plant. Family members and friends announced the passing of Kelsey Lynne Clifford on Facebook on Tuesday. A press release from the Northwestern District Attorney's Office followed on Wednesday. According to her obituary notice from the Silas F. ..."
"0"	"Dog Throws A Total Tantrum When She Realizes Mom Wants To Take The Stairs"	"lifestylebuzz"	"Aurora Angel Beste Nala has always been the friendliest dog, and loves going out on adventures and meeting new people."
"0"	"Turkey Gathered Information in the U.S. Against Its Critics"	"newsworld"	"Turkey's government used a Washington law firm to gather information about its critics, including residents of the U.S., who it believed were allied with a movement that President Recep Tayyip Erdogan regards as a central enemy."
"1"	"3 Foods You Should Eat at Breakfast If You Want to Lose Belly Fat, According to a Dietitian"	"nutrition"	"If you're trying to lose belly fat, you're probably paying more attention to your diet, working to get more exercise, and cutting down on sugar."
"0"	"Amid Trump impeachment drama, Ukrainians ponder a Putin meeting"	"newsworld"	""The worst thing we can do is become a bargaining chip," Ukraine's foreign minister said of the impeachment hearings. "Unfortunately, we are such a chip now.""
"0"	"What the End of Bolivia's President Means for the Country"	"newsworld"	"Evo Morales, the President of Bolivia, fled to Mexico on Nov. 12, and his country now faces an uncertain future."
"1"	"Giuliani Associate Ordered to Testify About Source of Funds"	"newspolitics"	"A judge in Florida ordered an associate of Rudy Giuliani to testify within 30 days about the source of funds that were used to make campaign donations to the America First political action committee and former U.S. Congressman Pete Sessions, after a creditor claimed they were misappropriated from a family trust."
"0"	"The Latest: Israel resumes strikes on Gaza after rocket fire"	"newsworld"	"Israel says it has resumed strikes on targets linked to the Islamic Jihad militant group in Gaza after it fired a number of rockets into Israel."
"1"	"Urban Meyer "absolutely" would take Cowboys job"	"football_nfl"	"Many coaches would never comment publicly about a job that is currently filled by someone else."
"0"	"'I Have Waited 68 Years to See This': How Honor Flights Help Veterans Reflect"	"newsus"	"In 2004, shortly after the national World War II Memorial was completed, Earl Morse, a retired Air Force captain working at the Department of Veterans Affairs clinic in Springfield, Ohio, realized that many of the veterans he knew would never get to see it. So he persuaded pilots at his local flying club to ferry a handful of veterans to Washington on small planes, and accompany them to the National Mall."
"0"	"Biggest celeb weddings of the last decade"	"celebrity"	"Take a look back at the most memorable and extravagant celeb weddings that went down in the 2010s."
