"0"	"The 15 Best Breakfast Habits to Drop 10 Pounds"	"Not only will you trim your muffin top and banish belly fat, you'll also set a healthy foundation for the rest of the day."
"1"	"Extremely Rare Islamic Coin Could Fetch $2 Million At Auction"	"An extremely rare coin with Islamic inscriptions is set to be auctioned off later this month, with an estimated sale price of between $1.7 million to just over $2 million."
"1"	"Marines correct 74-year-old Iwo Jima error"	"Historians determined that Cpl. Harold 'Pie' Keller was one of the six men who raised the flag."
"1"	"Missing New Hampshire couple's bodies found buried on a Texas beach"	"James and Michelle Butler had been camping in their RV along the South Texas coast when they went missing in mid-October."
"1"	"Woman, 78, gets 22 years for attempted murder of lawyer"	"A 78-year-old Louisiana woman has been sentenced to 22 years in prison for trying to kill her attorney. Patricia Currie of Mandeville was 75 when she raised a loaded shotgun toward Keith Couture in 2016."
"1"	"Multiple guns stolen during home break-in on Indy's west side after homeowner went on vacation"	"INDIANAPOLIS, Ind. -- Multiple guns are in the hands of criminals following an early morning home break-in Monday. The crime took place on Indy's west side near Clermont. Police were called to a home in the 8800 block of Mario Creek Drive after crooks smashed the glass overnight and broke inside. It turns out the people who live inside left over the weekend for a week-long cruise. "They're out ...""
"1"	"Thomas D'Alesandro III: Former Baltimore mayor and brother of Nancy Pelosi dies"	"Thomas D'Alesandro III, a former Baltimore mayor and brother of Democratic House Speaker Nancy Pelosi, has died."
"0"	"This 10-Year-Old Girl's Demanding Christmas Wish List Will Blow Your Mind"	"A father recently shared his 10-year-old daughter's demanding Christmas wish list on Twitter. It includes a Chanel bag, $4,000, "purfum," and so much more."
"1"	"Charles Darwin 'may have been wrong about where life came from'"	"Did life start on the surface of our planet in a "warm little pond" as Charles Darwin believed   or did it bubble up from deep beneath the sea?"
"1"	""Serial stowaway" arrested at Chicago airport for 2nd time"	"Hartman was taken into custody was charged with one felony count of criminal trespass"
"1"	"Where have Cape Town's great whites gone?"	"Shark spotters say Cape Town's world-famous great whites have disappeared. So where have they gone?"
"0"	"Bill Gates tops Jeff Bezos as world's richest person with Amazon slide"	"This time it's official."
"1"	"Suspected white supremacist arrested in thwarted synagogue attack, FBI says"	"The suspect, identified as Richard Holzer, was allegedly planning to target a synagogue"
"1"	"Wildfires, power outages, now flooding? California has a dam problem   and desert communities might be in danger"	"A new report by the Army Corps of Engineers says Californians may have to add risk of flooding in desert communities to their list of hardships."
"1"	"For the first time, a man has been sentenced for sexual slavery by the International Criminal Court. He got 30 years."	"Bosco Ntaganda is a former Congolese rebel nicknamed the "Terminator." The ICC convicted him on 18 counts including murder, sexual slavery and using child soldiers."
"1"	"Dog 'Randomly' Drops By Family Reunion   Then People Check His Collar"	"The other day, Leslie Kowash was at a family reunion in Georgia when a friendly local decided to drop in on the party, seemingly out of nowhere. It was a sweet brown pup   and a rather plump one, at that."
"1"	"Former US Senator Kay Hagan dead at 66"	"Former U.S. Sen. Kay Hagan, a one-time Capitol Hill intern who went on to become North Carolina's first Democratic female senator, died Monday at her Greensboro home. She was 66."
"1"	"The Before-And-After Photos of This Man Who's Three Years Sober Will Amaze You"	"Alcohol was destroying Kenny Dunn's life. Now three years clean, his sobriety progression photos and the inspiring story behind them are going viral."
"1"	"Security camera spots SOS from woman lost for three days in Australia"	""There was a bit of euphoria that, wow there's our break," police said of the the SOS message."
"1"	"Convicted Newport News murderer sentenced for drug, firearm charges"	"A Newport News man was sentenced on Thursday to 25 years in prison for possession of a firearm in furtherance of drug trafficking crime, felon in possession of a firearm and possession with intent to distribute marijuana. Court documents said 47-year-old Willie M. Hardy Jr. participated in drug trafficking while he was armed and while on federal supervision. In May 2018, the Newport News Police Department received a tip that Hardy was..."
"1"	"Jerry Fogel Dies: 'The Mothers-In-Law' & 'The White Shadow' Co-Star Was 83"	"Jerry Fogel, a longtime screen actor best remembered as the beleaguered bridegroom Jerry Buell on the NBC sitcom The Mothers-in-Law, has died, He was 83. Fogel, who diagnosed with non-Hodgkin's lymphoma in 2008, died Monday at the Kansas City Hospice House in Kansas City, Missouri, his family announced. The son of a Rochester, N.Y, movie theater owner,"
"1"	"Powerful king tide causes minor flooding on Boston waterfront"	"Visitors to the waterfront near the New England Aquarium around 12:30 p.m. had to dodge waves slamming over docks and maneuver around water pooling on walkways. Experts say the scene will probably be replayed in the future as sea levels rise."
"1"	"UPDATE 1-Resurgent Boeing 737 MAX could trigger jet surplus, analyst warns"	"BOEING-737MAX/SUPPLY (UPDATE 1, PIX):UPDATE 1-Resurgent Boeing 737 MAX could trigger jet surplus, analyst warns"
"0"	"Pair Of 'New' 1987 Buick Grand Nationals Pulled From Garage After 30 Years"	"This pair of Grand Nationals have only 1,400 miles combined!"
"1"	"Obama calls out call-out culture: "That's not activism""	"At the annual Obama Foundation summit, the former president said he's concerned about how people approach differences in opinion, especially on social media"
"1"	"Former top U.S. diplomat urges unity, sidesteps impeachment debate in speech"	"Former top U.S. diplomat urges unity, sidesteps impeachment debate in speech"
"1"	"She Fought for Muslim Women. Then She Was Found Dead."	"Ola Salem was, by all accounts, fearless. As a teenager, she stood up to the managers of an amusement park after she was not allowed on rides because she was wearing a head scarf."
"1"	"Italian town of Cammarata offers free houses to lure new residents"	"The Sicilian community of Cammarata is offering homes for absolutely nothing in an effort to revive its dwindling community."
"1"	"Lots of good terns: Bird ready to fly off endangered list"	"A tiny Midwestern bird is ready to fly off the endangered species list."
"1"	"Keystone oil pipeline leaks 383,000 gallons in North Dakota"	"TC Energy's Keystone pipeline has leaked an estimated 383,000 gallons (1.4 million liters) of oil in northeastern North Dakota, marking the second significant spill in two years along the line that carries Canadian tar sands oil through seven states, regulators said Thursday. Crews on Tuesday shut down the pipeline after the leak was discovered, said Karl Rockeman, North Dakota's water quality division director."
"0"	"California and nearly two dozen other states sue Trump administration for the right to set fuel-efficiency standards"	"California and nearly two dozen other states on Friday sued the Environmental Protection Agency, arguing that the Trump administration doesn't have the legal authority to strip the nation's most populous state of its longstanding authority to set strict fuel-efficiency standards on cars and trucks."
"1"	"Fact check: Trump falsely claims his 2000 book demanded the killing of Osama bin Laden"	"After announcing the death of ISIS leader Abu Bakr al-Baghdadi, President Donald Trump on Sunday took questions from journalists -- and made a major false claim about his past statements on Osama bin Laden."
"1"	"Gunmen kill 15 in southern Thailand's worst attack in years"	"Officials say at least 15 killed in attack in Thailand's restive south"
"1"	"Accused Capital Gazette Shooter Jarrod Ramos To Plead Guilty To All 23 Criminal Counts"	"He is now asking for a jury trial on whether he is criminally responsible for Capital Gazette murders."
"1"	"Garth Brooks Got Called Out by Jimmy Carter for Taking Break During Habitat for Humanity Build"	"Garth Brooks Called Out by Jimmy Carter"
"1"	"Trump blasts 'Never Trump' Republicans as 'human scum'"	"President Trump on Wednesday excoriated so-called Never Trump Republicans."
"1"	"US Rep. Ilhan Omar divorces husband in Minnesota"	"Rep. Ilhan Omar has officially divorced from her husband in Minnesota, just a month after she filed a petition saying there was an "irretrievable breakdown" in their marriage. Omar and Ahmed Hirsi had been married since January 2018 but were longtime partners. Omar says Hirsi is the father of her three children. The marriage was dissolved Tuesday after paperwork was signed by court personnel. The divorce comes months after a..."
"1"	"State Court Bars Using North Carolina House Map in 2020 Elections"	"A North Carolina state court effectively threw out the state's map of congressional districts on Monday, saying critics were poised to show "beyond a reasonable doubt" that it was an unconstitutional partisan gerrymander favoring Republicans."
"1"	"Trump tweets fake image of him putting medal around dog from al-Baghdadi raid"	"The U.S. military dog was injured in the raid that killed ISIS leader Abu Bakr al-Baghdadi."
"1"	"Indiana attorney general tries barring testimony against him"	"INDIANAPOLIS (AP)   Indiana Attorney General Curtis Hill is trying to block two women from testifying about allegations of sexual misconduct as he prepares for an upcoming disciplinary hearing on separate claims that he drunkenly groped four women at a bar last year. The Indiana Supreme Court Disciplinary Commission wants the women to testify about Hill's actions when they were employees under him as the Elkhart County prosecutor before becoming..."
"1"	"Australia's Qantas finds cracks in three of its 737NG planes"	"Australian carrier Qantas found hairline cracks in three of its Boeing 737NG planes as airlines worldwide inspect their fleets of the troubled aircraft, the company said Friday. "Of the 33 of Qantas' 737 aircraft that required inspection, three were found to have a hairline crack in the pickle fork structure," the airline said in a statement, referring to a part which helps bind the wing to the fuselage."
"1"	"Adam Driver in Talks to Star Alongside Matt Damon in Ridley Scott's 'The Last Duel'"	"The period film is based on a real-life thriller about the last legal duel in France."
"1"	"Former NBA first-round pick Jim Farmer arrested in sex sting operation"	"Farmer, 55, was booked for trafficking a person for a commercial sex act."
"0"	"How Bad Is It to Reuse a Tissue?"	"We all do it. But will sneezing in your hankie or tissue over and over derail your recovery?"
"1"	"A security empire deployed guards with violent pasts across the US. Some went on to rape, assault or kill"	"G4S, the largest private security company in the world, sells armed guards as a high-quality, low-cost alternative to police. This is the price."
"1"	"Greatest eBay Listing Of 2019? Or In All Of Human History? You Decide!"	"This clever eBay ad made our day!"
"1"	"Hours before passing, Elijah Cummings signed subpoenas directed to two US immigration agencies"	"In one of his last official acts before his death, the late House Oversight and Reform Committee Chairman Elijah Cummings signed two subpoenas for documents related to a temporary end to a policy change that allowed some immigrants with severe health issues to remain in the US."
"1"	"Watch this Missouri bridge be demolished after 90 years"	"A portion of the Old Champ Clark Bridge in Louisiana, Missouri, has been demolished. The bridge had been standing over the Mississippi River since 1928, connecting Illinois to Missouri."
"1"	"Notre Dame delays plan to cover Columbus murals until 2022"	"SOUTH BEND, Ind. (AP)   The University of Notre Dame is delaying its plan to cover up 19th century murals depicting Christopher Columbus in America that have long been criticized for their stereotypical images of Native Americans and blacks submissively posing before white European explorers. The Catholic university based in South Bend, Indiana, announced in January that it would conceal the offending artwork. The decision came after students,..."
"1"	"Mark Hurd, Oracle CEO who led 3 tech companies, dies at 62"	"Mark Hurd, who was chief executive officer of three major technology companies including Oracle Corp., has died. He was 62."
"1"	"Road built by biblical villain uncovered in Jerusalem"	"A long-buried street that led pilgrims to the Jewish Temple 2,000 years ago was commissioned by Roman governor Pontius Pilate."
"1"	"California's legal weed profits going up in smoke"	"Nearly three years after California legalized marijuana, the profit outlook for this budding business looks cloudy."
"1"	"Air Force Academy instructor pleads guilty, will have to register as sex offender"	"A captain who taught ethics at the U.S. Air Force Academy in Colorado Springs will have to register as a sex offender after he pleaded guilty to one count of sexual exploitation of a child, according to the 18th Judicial District. Paul Sikkema, 29, faces up to 90 days in jail and will also have to serve 10 years of Sex Offender Intensive Supervised Probation. An investigator with the Arapahoe County Sheriff's Office posed as a 14-year-old girl..."
"1"	"Fisherman In Middle Of Lake Makes An Adorably Unexpected Catch"	"Brett Hereford was out fishing on a lake in Montana with his family earlier this month when he made the catch of a lifetime."
"1"	"Trump's steel tariffs were supposed to save the industry. They made things worse"	"Benchmark steel prices have fallen well below their level before the tariffs took effect."
"1"	"Ohio man pleads guilty in July 4 Cleveland terror plot on behalf of Al Qaeda"	"An Ohio man accused of scouting locations for a potential July 4 terror attack in downtown Cleveland on behalf of Al Qaeda pleaded guilty Tuesday to federal charges including attempting to provide support to a terrorist group and threatening to kill President Trump and his family."
"1"	"Exclusive: Ukraine to fire prosecutor who discussed Bidens with Giuliani - source"	"Exclusive: Ukraine to fire prosecutor who discussed Bidens with Giuliani - source"
"1"	"'Return culture' is hurting the environment and costing retailers billions"	"Americans return millions of packages a year, something that is hurting the environment by producing tons of CO2 emissions. Veuer's Johana Restrepo has more."
"1"	"Kevin Spacey Won't Be Charged in Sexual Assault Case After Accuser Dies"	"The Los Angeles County District Attorney's Office has formally dropped a case against actor Kevin Spacey, after the accuser died."
"1"	"AT&T fined $60 million for throttling 'unlimited' data plans"	"Unlimited should mean unlimited!"
"1"	"Why Boeing can't recoup CEO's $23 million payout from crash year"	"Jet maker's compensation "clawback" policy doesn't include safety or loss of life as a factor in recovering exec pay"
"1"	"A bodybuilder showed how fitness influencers can make their bodies look Instagram-perfect in before-and-after photos"	"Connor Murphy posted a video to his YouTube channel in 2016 that highlights the ways people can manipulate their appearance for photos."
"1"	"The Rock's Gnarly Palm Is a Testament to Life Without Lifting Gloves"	"Dwayne "The Rock" Johnson's gnarly palm was on display in a recent Instagram snap. But don't be grossed out   think of it as a testament to hard work and loads of reps."
"1"	"First Look! SEMA 2019 Move-In Gallery Inside the Las Vegas Convention Center"	"This is your first look at SEMA 2019 inside the Las Vegas Convention Center before the show begins."
"1"	"Air Force's X-37B space plane lands after record 780 days in orbit"	"There was no doubt that the US Air Force's X-37B was going to break its own record for time spent in orbit, but it's now clear by how much. The mysterious Boeing-made space plane has landed at Kennedy Space Center after 780 days in orbit, comfortably surpassing the earlier record of 717 days, 20 hours and 42 minutes."
"1"	"Oscar Wilde's stolen ring found by Dutch 'art detective'"	"A golden ring once given as a present by the famed Irish writer Oscar Wilde has been recovered by a Dutch "art detective" nearly 20 years after it was stolen from Britain's Oxford University. The friendship ring, a joint gift from Wilde to a fellow student in 1876, was taken during a burglary in 2002 at Magdalen College, where the legendary dandy studied."
"1"	"Trump 'surprised' at pushback to hosting G-7 at his Doral resort, chief of staff says"	"President Donald Trump changed his mind about hosting a summit of world leaders at his own resort in Doral after being "surprised at the level of push-back" to last week's announcement, his acting chief of staff, Mick Mulvaney, said Sunday."
"1"	"Court puts hold on Rodney Reed's scheduled execution"	"With new, compelling evidence in Reed's case, the call to halt his Nov. 20 execution has been building in recent weeks."
"1"	"Supreme Court seems prepared to rule for police in traffic-stop case"	"The question before the court is whether it is reasonable to believe someone with a suspended license is behind the wheel."
"1"	"Grandpa Brings Dog To Furniture Store To Make Sure She Likes Chair Too"	"Believe it or not, there was a once a time when Aleecia Dahl's grandfather didn't want a dog at all   but now he pretty much epitomizes what it means to be a proud pet parent. It all started the moment he met Coco. "Coco is the dog Grandpa never wanted but cannot live without," Dahl told The Dodo."
"1"	"Here are the 96 Sears and Kmart stores that are closing next"	"Going-out-of-business sales in the 96 stores slated to close will begin Dec. 2."
"1"	"Reporter Can't Stop Laughing After Cat Interrupts News Segment"	"This just in   this cat, to be precise. Artur Lira The other day, Brazilian journalist Artur Lira was filming a news segment outside a police station when, much to his surprise, a far more adorable story broke right before his eyes. Smack-dab in the middle of Lira's report, a cat appeared at his feet   demanding both his and the camera's attention.As you'll see, Lira couldn't help but laugh at the unexpected interruption (especially when the..."
"1"	"Michael Bloomberg Actively Prepares to Enter 2020 Presidential Race"	"Michael R. Bloomberg is actively preparing to enter the Democratic presidential primary and is expected to file paperwork this week designating himself as a candidate in at least one state with an early filing deadline, people briefed on Mr. Bloomberg's plans said."
"1"	"Trump Allies Craft List of Potential Mulvaney Replacements"	"Some of Donald Trump's closest associates are assembling a roster of possible replacements if the president decides to replace Mick Mulvaney, his acting chief of staff, said three people close to the situation."
"1"	"'Supernatural' star arrested for multiple altercations in Texas"	"Jared Padalecki reportedly got into fights inside and outside an Austin nightclub."
"1"	"Maryland driver gets probation for Delaware crash that killed 5 NJ family members"	"A horrific crash in Delaware last year left a New Jersey man and his four daughters dead   but the Maryland driver whose pickup truck crossed a highway median, according to authorities, won't be going to prison."
"1"	"Chicago police superintendent will skip President Trump's speech to police chiefs"	"CHICAGO - Chicago police Superintendent Eddie Johnson will be hosting the International Association of Chiefs of Police conference in town next week, but he's going to skip President Donald Trump's speech, according to a spokesman. "While the superintendent is looking forward to leading the International Chiefs of Police Conference and he's looking forward to participating in discussions about ...""
"1"	"Hulk Hogan's jet grounded after 'melted' brakes, blown tires"	"Hulk was headed to Saudi Arabia, but had a pit stop in Iceland."
"1"	"Watch Hilarious Moment When A Gorilla Encounters Aggressive Goose"	"Watch the hilarious moment when a gorilla encounters a goose."
"1"	"Niagara Falls: Boat stuck on rocks 101 years dislodged"	"High winds and heavy rains dislodged the remains of a barge in the rapids above Niagara Falls that had been there 101 years."
"1"	"Trade war losses for the US and China grow into the tens of billions of dollars"	"U.S. imports from China have fallen a sharp $53 billion through the first nine months of the year compared to the same time last year."
"1"	"Divers Find Giant Mysterious 'Egg' Floating In Ocean"	"A team of divers set off to explore a sunken World War II ship off the Norwegian coast, but what they found was something far more mysterious. While making their way back to shore, Ronald Raasch, Nils Baadness and Brynjar Aarnseth came face-to-face with a giant floating orb. The bubble hovered 17 meters (56 feet) below the surface and appeared to be see-through. The divers turned their flashlights on it and realized that the sphere was filled..."
"1"	"Qantas grounds Boeing 737 plane with crack, inspects others"	"Australian flag carrier Qantas said Thursday it had grounded one Boeing 737NG due to a structural crack, and was urgently inspecting 32 others for the flaw. The grounding is the latest safety concern for Boeing, as it reels from two 737 MAX crashes that killed 346 people and highlighted problems with the planes' flight handling software. The US aviation authority this month ordered checks of Boeing 737NG planes that had flown more than 30,000..."
"1"	"Police: Man Shot, Killed During Robbery At His Home In North Dallas"	"A man was shot and killed late Wednesday evening during a robbery at his home in north Dallas, police say."
"1"	"MLB world reacts to Aníbal Sánchez losing no-hitter in eighth inning of NLCS Game 1"	"Washington Nationals' pitcher Anibal Sanchez stole the show of Game 1 of the NLCS and nearly became a part of MLB history before his no-hit bid was ended in the eighth."
"1"	"World's largest treehouse burns to the ground"	"The entire structure collapsed in less than 15 minutes"
"1"	"Creepy fish with 'human-like face' found swimming in lake"	"Tourists in southwestern China spotted a carp fish that had human-like facial features resembling eyes, nose and a mouth."
"1"	"The world's largest nuclear power producer is melting down"	"On the shores of the English channel in Normandy, engineers are struggling to fix eight faulty welds at a plant that's supposed to showcase France's savoir faire in nuclear power."
"1"	"Indiana deputy helps out homeless man by giving him pair of shoes"	"In a given day, more than 1,000 people can pass through security at the Clark County Courthouse. But one day, a person stood out to Lt. Shanon Grant. The man, known only as Brandon, is homeless, and told Grant his shoes had recently been stolen. Without hesitation, Grant went to his truck and grabbed his pair of black Nikes. "I know how it feels not to have something," Grant said. "So I went and got them and gave them to him." Brandon normally wears a size 10 shoe, and Grant's shoes were a size 13.But that didn't seem to matter to Brandon. "He was happy," Grant said. "(He) put them on, jumped around the floor and took off.""
"1"	"Procession planned for Arizona jail officer killed by inmate"	"A procession in Phoenix is planned for an Arizona jail officer killed by an inmate. The Maricopa County Sheriff's Office says Officer Gene Lee's body will be escorted from Banner Health Medical Center to the Maricopa County Medical examiner's Office. The procession is planned for about 9 a.m. Saturday. Jail authorities say 59-year-old Daniel Davitt knocked Lee to the ground leaving the officer comatose with a head injury."
"0"	"4 takeaways from Marie Yovanovitch's testimony"	"All the highlights, with fact-checking and analysis."
"1"	"EU ambassador's miraculous 'now I remember' moment"	"How did Gordon Sondland get back his memory to correct his testimony? CNN's Jeanne Moos looks for the cure."
"1"	"Survivor Contestant Rudy Boesch Dies at 91 After Long Battle with Alzheimer's Disease"	"Survivor's Rudy Boesch Dead at 91"
"1"	"Elijah Cummings to 'lie in state' in Capitol's Statuary Hall in new arrangement"	"The late Rep. Elijah Cummings, D-Md., will "lie in state" this Thursday in Statuary Hall of the Capitol ahead of his funeral in Baltimore on Friday, officials announced."
"1"	"Where America gets its cocoa and 20 other agricultural imports"	"Think you know where your favorite food products come from? Stacker looked at some of the most common foods the United States imports from abroad."
"0"	"Report: At least 24 teams expected to attend Kaepernick's workout"	"It looks like the majority of the teams in the league are at least curious to see whether or not Colin Kaepernick has lost a step."
"1"	"Regis Philbin Lists Longtime Connecticut Estate at a Loss for $4.6 Million   See Inside!"	"Regis Philbin Lists $4.5 Million Connecticut Home   See the Property"
"1"	"Bag Explodes While Being Loaded On Volaris Flight At Midway Airport"	"A bag being loaded onto an airplane at Midway Aiport exploded on Monday and the Chicago bomb unit has responded."
"0"	"Joshua Jackson and Jodie Turner-Smith spark marriage speculation"	"Joshua Jackson and Jodie Turner Smith may be secretly married."
"1"	"Ex-All-Star slugger Josh Hamilton charged with child injury"	"KELLER, Texas (AP) Former All-Star slugger Josh Hamilton has been charged with injury to a child after his 14-year-old daughter told his ex-wife that he'd struck her."
