"1"	"Zimbabwean girl, 11, says she wrestled crocodile, gouged out eyes to save 9-year-old friend: report"	"An 11-year-old Zimbabwean girl claims she wrestled a crocodile and gouged out its eyes to save her 9-year-old friend last week, according to a local report."
"1"	"Woman Comes Up With The Best Costume For Her 7 Dogs"	"Sasha Hobson loves dressing up with her family for Halloween."
"1"	"Fox News contributor: 'Most likely' outcome is Trump doesn't run in 2020"	"Fox News contributor Christopher Hahn predicted that President Trump will not run for reelection in 2020."
"1"	"Joe Hogsett details policies and programs considered to be his black agenda"	"Seeking to clarify his stance, Indianapolis Mayor Joe Hogsett outlined plans and policies he considers to be his agenda to address racial inequities."
"1"	"Elijah Cummings to lie in state in Statuary Hall ahead of Friday funeral"	"Rep. Elijah E. Cummings will lie in state in the Capitol's Statuary Hall Thursday before a Friday funeral in his home district of Baltimore. Many lawmakers are expected to attend the memorial service for the House Oversight and Reform Committee chairman, which will be held Thursday morning. The ceremony will be held Thursday morning and will be open to members of Congress, the Cummings family and invited guests."
"1"	"Matthew McConaughey Served Dinner to California Wildfires First Responders"	"Matthew McConaughey and his bourbon brand, Wild Turkey, partnered with Operation BBQ Relief to serve 800 dinners to first responders to the California wildfires."
"1"	"The Grateful Dead's Bob Weir Is Unbelievably Shredded at 72"	"He's been "Truckin'" for 56 years, but you wouldn't know it by his physique. The rock legend does CrossFit, Tabata workouts, and can swing a mighty mace."
"0"	"Parole rejected for Charles Manson follower after 50 years"	"A third consecutive California governor is blocking parole for a former follower of late cult leader Charles Manson who has been in prison for decades for two of the Manson family's slayings in the 1960s. Gov. Gavin Newsom on Friday reversed a parole recommendation for Bruce Davis, now 77, for the 1969 slayings of musician Gary Hinman and stuntman Donald "Shorty" Shea."
"0"	"MLB GM wants Jeff Luhnow 'banned for life' if he knew of Astros' sign-stealing"	"Another team executive said he wanted to see the league throw the book at the Astros."
"1"	"He faced off with Nixon. See his advice to whistleblower"	"American journalist Daniel Ellsberg, who was responsible for leaking the Pentagon Papers in 1971, tells CNN's Anderson Cooper his message for today's whistleblower."
"1"	"South Dakota set to execute man who stabbed former co-worker"	"Donnivan Schaeffer was delivering supplies to the South Dakota doughnut shop where he worked when a former co-worker who was in the middle of burglarizing the place ambushed the 22-year-old, stabbing him in the stomach. Bleeding from his wound, Schaeffer begged to be taken to a hospital, vowing to keep silent about the crime; instead, he was forced into a storeroom, tied up and stabbed to death."
"1"	"Egypt uncovers 'huge cache' of ancient sealed coffins"	"Archaeologists have discovered more than 20 wooden coffins at a necropolis in Luxor, according to Egypt's Ministry of Antiquities."
"1"	"Train, semi truck involved in collision near Fortville"	"FORTVILLE, Ind.   A semi truck and train collided early Monday morning near Fortville. According to the Fortville Police Department, the truck was heading southbound on North 400 West near State Road 67 when it became stuck on the railroad tracks. The driver got out of his truck and tried to warn a train heading eastbound to slow down. While he was trying to get that train to stop, a second ..."
"1"	"Amelia Bambridge: Body of missing backpacker found in sea"	"The body of a 21-year-old British backpacker who went missing after a beach party on a Cambodian island has been found, according to the charity assisting her family."
"1"	"Family of man killed in Hard Rock collapse file wrongful death lawsuit"	"The family of one of the men killed in the Hard Rock collapse has sued."
"1"	"One of FBI's Most Wanted fugitives offers surrender"	"One of the FBI's Most Wanted fugitives says he wants to surrender but claims his offers are being ignored by the United States government."
"1"	"Alvarez stops Kovalev in 11th round to win 175-pound title"	"LAS VEGAS (AP) Canelo Alvarez used a big punch to beat a big fighter."
"1"	"Man charged with 5 counts of first-degree murder in shooting rampage at Chicago condo"	"Chicago police Monday morning announced charges against a man in connection with a shooting rampage that left five people dead Saturday night."
"1"	"The Queen just read out Boris Johnson's stump speech"	"The pageantry of the State Opening of Parliament may be over, but the UK's bumper Brexit week has only just begun."
"1"	"California is first state to ban the sale of fur clothing, beginning in 2023"	"SACRAMENTO   People in the market for mink coats or chinchilla vests will soon need to shop elsewhere, now that California will become the first state in the nation to ban new fur clothing."
"1"	"Trump claim brings new pain to relatives of lynching victims"	"MONTGOMERY, Ala. (AP)   Willie Edwards Jr., a black truck driver, was killed by Ku Klux Klansmen who forced him to jump off a bridge in Alabama in 1957. Two years earlier, white men had bludgeoned black teenager Emmett Till to death in Mississippi. No one went to prison for either slaying. Both people died in racist lynchings, and relatives of each were aghast Tuesday after President Donald Trump compared his own possible impeachment to lynching..."
"1"	"Indiana trooper dies in crash while headed to help colleague"	"LAFAYETTE, Ind. (AP)   An Indiana state trooper has been killed in a car crash while he was headed to help another trooper. Indiana State Police said in a news release that 27-year-old Peter R. Stephan of Lafayette died late Friday after his car struck a utility pole in Tippecanoe County. Police said the crash happened after his car went off the road and rolled on Old State Road 25 while heading toward Americus."
"1"	"Hero Saves Panicked Drivers From California Fires"	"A hero helped panicked drivers escape danger as a raging wildfire took over a freeway in Northern California Monday. The smoke from the flames was so blinding that drivers couldn't see where they were going. Good Samaritan Gerald Contreras came to their rescue. He directed motorists to escape through a torn down fence, and he was even able to record the drama that unfolded near Sacramento. "They had no idea what was going on," he told Inside Edition. "You could see the fear on their face.""
"1"	"Meteorite That Fell In Costa Rica Smells Like Brussels Sprouts"	"A meteorite that fell in Costa Rica smalls like Brussels sprouts."
"0"	"The most talked about movie moments of the 2010s"	"Let's try to emphasize the positive, but there's one particular sequence that was so special in its awfulness, it had to go on this list. See if you can guess which one it is."
"1"	"Boeing CEO Muilenburg won't get most of his 2019 pay"	"Boeing CEO Dennis Muilenburg will not get stock or bonuses in 2019 that provide most of his compensation, according to the new chairman of the company."
"1"	"BART worker rescues man from oncoming train"	"A California rapid transit employee is being hailed as a hero for rescuing a man who fell onto the tracks as a train was approaching the platform."
"1"	"Indiana agency: Steelmaker too slow to act on chemical spill"	"PORTAGE, Ind. (AP)   The state environmental agency said a northwestern Indiana steel mill knew it was leaking dangerous chemicals into Lake Michigan but failed to report the spill or act quickly to mitigate the risks. The cyanide and ammonia spill in August at the ArcelorMittal plant in Burns Harbor closed beaches and killed nearly 3,000 fish. The Indiana Department of Environmental Management announced this week that the steel mill didn't..."
"1"	"Man dies after becoming stuck on top of 290-foot tall smokestack"	"A man dangling from the top of a 290 foot smoke stack for more than six hours, apparently suspended only by his pants, died shortly after he was rescued by authorities."
"1"	"7 Reasons Potato Flakes are Magic"	"Potato flakes are pure magic. Here are seven reasons why you need to keep these in your pantry."
"1"	"Officer who shot naked man found not guilty of murder"	"DECATUR, Ga. (AP)   A former Georgia police officer who fatally shot an unarmed, naked man was found not guilty of murder Monday but was convicted of aggravated assault and other charges that could send him to prison for more than 30 years. Robert "Chip" Olsen's face turned red and he squeezed his eyes shut tightly as the verdict was read. His wife, Kathy Olsen, began sobbing and had to be led from the courtroom. DeKalb County Superior Court..."
"1"	"Prosecutors want black judge who criticized incarceration rates of African Americans removed"	"Iberia Parish judge Lori Landry has questioned the large number of black Louisianans incarcerated by the district attorney's office"
"1"	"Body of missing Alabama girl found; 2 being charged"	"Investigators searching through garbage found the body of a 3-year-old girl who was missing more than a week, and authorities are charging two people with murder, police said Tuesday."
"1"	"'Old Town Road' becomes the second country single to reach top-selling Diamond status"	"Lil Nas X joins Florida Georgia Line in the country history books."
"1"	"Clinton mocks Trump's Turkey letter with Jimmy Kimmel joke -- but move quickly appears to backfire"	"Hillary Clinton -- an increasingly visible critic of both the White House and the 2020 Democratic presidential field -- on Sunday posted a flowery faux letter from John F. Kennedy to Nikita Khrushchev to mock President Trump's recent, casually-worded missive to Turkish President Recep Tayyip Erdoğan."
"1"	"Eric Tse, 24, just became a billionaire overnight"	"A 24-year-old business school graduate has just become an overnight billionaire."
"0"	"Fashion hits and misses from the 2019 Latin Grammy Awards"	"See the best and worst dressed stars at this year's Latin Grammys."
"1"	"Kmart, Sears store closings 2020: These stores are closing in January"	"More than 100 Kmart and Sears stores will close by the end of 2019 and more closures are expected to continue into early 2020."
"1"	"New Interstellar Mission in the Works for NASA"	"The mission would send a probe farther and faster than any other spacecraft. It took both Voyager 1 and 2 nearly 40 years to travel 13 billion miles, but NASA aims for this new probe to go 92 billion miles in less than 15 years!"
"1"	"Amber Guyger's lawyer files paperwork for possible appeal of murder conviction"	"Amber Guyger's appellate attorney has filed paperwork preserving her ability to appeal her murder conviction and sentence."
"1"	"'Do your job!': Kentucky Sen. Rand Paul demands media reveal whistleblower's identity"	"Kentucky Sen. Rand Paul called on the media to report the whistleblower's identity: "I say tonight to the media, do your job and print his name.""
"1"	"Meghan McCain GOES IN on Donald Trump Jr. on 'The View'"	"The daytime talk show co-host sparred with the president's son during his stop by the show Thursday."
"1"	"White House Ukraine Expert Sought to Correct Transcript of Trump Call"	"Lt. Col. Alexander S. Vindman told investigators that the White House transcript of a July call between President Trump and Ukraine's president omitted crucial words and phrases."
"1"	"Oprah Winfrey Just Bought Jeff Bridges' Ranch in Montecito"	"How many homes does one person need? Well, if you're Oprah, the answer is at least 7. And if you're wondering specifically how many homes a person needs in Montecito, California, the answer, according to Oprah, is three. She just added to her Montecito home collection by purchasing a ranch previously owned by The Dude"
"1"	"Popeyes will hire more staff to deal with return of hit sandwich"	"The Popeyes restaurant chain is bringing back its overwhelmingly popular chicken sandwich, but this time it's calling in reinforcements."
"1"	"Boeing says up to 50 planes grounded globally over cracks: AFP"	"Boeing says up to 50 planes grounded globally over cracks: AFP"
"1"	"Ukrainian man arrested in New Hampshire crash that killed 7 bikers is indicted"	"A 23-year-old pickup truck driver with a history of traffic arrests, who is accused of killing seven motorcyclists in a fiery crash in New Hampshire this past summer, has been indicted on 23 charges and could face up to 378 years in prison if convicted."
"1"	"Some state parks set to close for a pair of 2-day controlled deer hunts"	"Some Indiana State Park properties will close in the coming weeks for controlled deer hunts. According to the Department of Natural Resources, each hunt will last two days. The first is set for Monday, Nov. 18, and Tuesday, Nov. 19. The second is scheduled for Monday, Dec. 2, and Tuesday, Dec. 3. The designated state parks will close to the general public on the evening before each hunt. Here ..."
