"0"	"A $15 latte shows how the supply of premium coffee is shrinking"	"markets"	"The world is flooded with coffee, but it's mostly boring beans. For the hand-crafted, artisanal specialty brews, you have to pay up."
"1"	"Husband of missing woman arrested, booked on murder charges"	"newscrime"	"Police in Missouri are searching for a missing woman who was last seen leaving her St. Louis area home on Tuesday."
"0"	"A birthday, a walk to school and a blast that tore an Afghan family apart"	"newsworld"	"Dunya, 10, and Hadis, 7, were among the 12 dead in Wednesday's suicide bombing in Kabul."
"1"	"No, I'm Not Missing Out On The 'Ultimate Love' Because I Chose Not To Be A Mom"	"voices"	"On a recent afternoon talk show, which I'm ashamed to admit I had on in thebackground while grading essays, the hosts were discussing an interview thathad just come out in which Oprah Winfrey proclaimed she never regretted nothaving children or not marrying her longtime partner Stedman Graham.Having recently published a book based on my difficult decision to opt out ofmotherhood, I'd been dreaming of the day I could have a conversation withOprah..."
"0"	"Oregon may face ICE push-back on new limits for courthouse arrests"	"newsus"	"Under a new rule enacted Thursday by Oregon Supreme Court Chief Justice Martha Walters, agents with U.S. Immigration and Customs Enforcement are forbidden from arresting immigrants inside or near the state's courthouses unless the agents first receive warrants from a judge."
"1"	"Fact Checker: Trump's shiny new talking point about income growth"	"newsfactcheck"	"The president is touting numbers that favorably compare his record to Obama and Bush, but he's cherry-picking the data."
"0"	"What Menopause Does to Women's Brains"	"wellness"	"Two-thirds of Alzheimer's patients are women. My foggy 53-year-old brain could help explain why."
"0"	"House to hear from US official who said he overheard Trump, Sondland call"	"newspolitics"	"In a closed-door deposition, House investigators will hear from David Holmes, the U.S. embassy official who overheard Trump and Sondland speak about "the investigations.""
"1"	"Hennessey Maximus Is a 1000-HP Jeep Gladiator from Hell"	"autossema"	"If a 2020 Jeep Gladiator is not aggressive-looking enough, Hennessey has this even more intense version, which it's bringing to the SEMA show."
"1"	"How Google Interferes With Its Search Algorithms and Changes Your Results"	"finance-companies"	"Pressed by businesses, interest groups and governments, the internet giant uses blacklists, algorithm tweaks and an army of contractors to shape what you see."
"1"	"Celebrity Headshots from Before They Were Famous"	"celebrity"	"Prepare for some straight-up baby faces."
"0"	"What Not to Miss on the Harry Potter Studio Tour"	"traveltips"	"Why it is a must-do for even casual fans"
"0"	"12 Cars Lose Consumer Reports' Recommendation Over Reliability Issues"	"autosnews"	"The Ford F-150, Honda Passport, and others no longer have the designation, but 20 models gain it"
"1"	"Cute and Capable? We Test the Updated 2019 Jeep Renegade and Its New Engine"	"autossuvs"	"Pros and Cons on this 2020 SUV of the Year contender"
"1"	"The 25 best "Weird Al" Yankovic parody songs"	"humor"	"Some of his tunes are originals, but the Prince of Parodies is obviously best known for lampooning other artists. Even when just considering the latter group of songs, picking the greatest is no easy task, but we're just the oddballs to tackle it."
"1"	"10 farm-fresh pickup trucks worth buying before values rise"	"autosclassics"	"Pickup a bargain before it's too late…"
"0"	"Southwest's Spring Travel Sale Includes $39 One-way Tickets"	"travelnews"	"Southwest Airlines wants you to start planning your 2020 travels."
"1"	"10 Amazing Things at Walmart You Can't Buy Anywhere Else"	"shop-all"	"We rounded up the coolest, most unique, and most affordable items you can find only at Walmart. Get ready…get set…shop! The post 10 Amazing Things at Walmart You Can't Buy Anywhere Else appeared first on Reader's Digest."
"1"	"What Kids Did a Decade Ago That They Don't Do Anymore"	"lifestyledidyouknow"	"The world is changing rapidly, as evidenced by these once-beloved interests of kids that have gone by the wayside within the past ten years. The post What Kids Did a Decade Ago That They Don't Do Anymore appeared first on Reader's Digest."
"1"	"A bodybuilder showed how fitness influencers can make their bodies look Instagram-perfect in before-and-after photos"	"fitness"	"Connor Murphy posted a video to his YouTube channel in 2016 that highlights the ways people can manipulate their appearance for photos."
"1"	"Bill Gates: I'm happy to pay $20 billion in taxes, but Warren's plan would make me do a little math"	"markets"	"Bill Gates, the Microsoft co-founder, waded deep in to the hotly debated topic of taxing the wealthy to redistribute money to the have-nots   a contentious issue that Sen. Elizabeth Warren has been at the forefront of as she bids to become the 2020 Democratic presidential nominee."
"0"	"I'm A Queer Woman Dating A Trans Man   & No One Knows"	"voices"	"I'm a queer woman partnered with a transgender man, but everyone assumes we're a heterosexual couple. On the surface, we're the quintessential Brooklyn duo: We have tasteful tattoos and piercings, we shop at food co-ops, we attend spin class together, and we're creative yet gainfully employed. But while this relationship afforded me the privilege of banal nonconformity, I lost a piece of myself when I got together with my once-gym buddy, James...."
"1"	"19 Mysterious Old Home Features That Aren't Useful Anymore"	"lifestylehomeandgarden"	"Many old homes have perplexing features that baffle their modern-day owners. Here we've solved 19 of those mysteries!!"
"1"	"Obey White House or subpoena? Witness in impeachment probe asks judge to decide"	"newspolitics"	"A witness in the House impeachment probe is asking a judge to decide whether he should obey a congressional subpeona or the White House, which wants to block him."
"0"	"California man convicted of torture-murder dies on death row"	"newscrime"	"A 49-year-old inmate convicted of torturing and burning his victim alive has died on California's death row. Prison officials say Spencer Brasure was found unresponsive alone in his San Quentin State Prison cell shortly after midnight Thursday. Officials are awaiting an autopsy to determine the cause of death but say it doesn't appear to be foul play."
"1"	"Celebrity mug shots"	"celebrity"	"Check out the best celebrity mug shots of all time!"
"1"	"The 5 biggest retirement mistakes people make all the time"	"finance-retirement"	"Avoid these common mistakes and enjoy your post-work years to the fullest."
"1"	"33 Most Common Reasons Why Relationships Fail"	"lifestylefamilyandrelationships"	"We've gathered some expert tips and scientific tidbits to explain reasons why relationships fall apart, and what you can do to fix it."
"1"	"Property Brothers' J.D. Scott Marries Annalee Belle in Vintage Theatre-Themed Wedding"	"tv-celebrity"	"J.D. Scott is Married! Third Property Brother Ties Knot"
"0"	"50 Best Movie Sequels of All Time"	"movies-gallery"	"A successful film franchise can ensure box office earnings like few other movie offerings can."
"0"	"Missouri took 'extreme actions' to limit reproductive rights, House panel hears"	"newsus"	"Tracking patients' periods and medically unnecessary pelvic exams amount to 'state-sponsored abuse', says congresswoman"
"1"	"Woman Spots Deadly Animal Hiding In Photo Of Her Kids"	"lifestylebuzz"	"Her unsuspecting children weren't the only ones posing for the pictures."
"1"	"Ford owners love this little-known feature other companies can't match"	"autoscartech"	"The Ford SecuriCode touchpad feature is only offered by the Dearborn automaker and lets drivers in without a key."
"1"	"Archie's Photo Album: Prince Harry, Duchess Meghan's Royal Baby"	"lifestyleroyals"	"So cute!"
"0"	"'Charlie's Angels' stars: Where are they now?"	"movies-gallery"	"We're checking up on former Charlie's Angels actresses to find out what they're up to today."
"0"	"Thieves Steal $40K Worth Of Equipment From Volunteer Fire Station"	"newscrime"	"Tens of thousands of dollars in gear stolen were from the Mountain View volunteer fire department."
"0"	"Intimidation among key takeaways from the Trump impeachment hearing with Marie Yovanovitch"	"newspolitics"	"Former U.S. ambassador Marie Yovanovitch testified Friday in the House's impeachment inquiry into President Trump's efforts to pressure Ukraine."
"1"	"5 charged in alcohol poisoning death of UC Irvine fraternity brother"	"newscrime"	"Five young men have been charged in connection with the death of their fraternity brother, who succumbed to alcohol poisoning after a booze-soaked party this year."
"1"	"7 Signs You Have Too Much Debt"	"personalfinance"	"We all have our debt limits. Here's how to know when you've reached yours."
"1"	"Burger King's new 'Ghost Whopper' is here to haunt your Halloween order"	"restaurantsandnews"	"The Ghost Whopper will be available at 10 select restaurants beginning Oct. 24. The only thing scarier than Burger King's new Ghost Whopper is the thought of having no Whoppers at all."
"0"	"Federal Prosecutors Probe Giuliani's Links to Ukrainian Energy Projects"	"newspolitics"	"Federal prosecutors in New York are investigating whether Rudy Giuliani stood to personally profit from a Ukrainian natural-gas business pushed by two associates who also aided his efforts there to launch investigations that could benefit President Trump, people familiar with the matter said."
"0"	"The latest on Brad Pitt and Angelina Jolie's post-split relationship, plus more news"	"entertainment-celebrity"	"Brad Pitt reportedly wants to see his kids more than Angelina Jolie has made possible. Plus, more celebrity news for Nov. 14, 2019."
"0"	"What 40 Celebrities Look Like Without Their Signature Looks"	"lifestylecelebstyle"	"If you think Taylor Swift is unrecognizable, wait until you see Gwen Stefani."
"1"	"Franchise players? NBA sophomore class full of rising stars"	"basketball_nba"	"Deandre Ayton strolled around the practice court, talking and laughing with coaches and teammates following a two-hour workout with the Phoenix Suns. It is clear he is comfortable operating in lofty surroundings, even on a morning in the mountains of Flagstaff, despite a sign on the wall that warned of the dangers of physical exertion at 7,000 feet of altitude. "What's that, 7,000? Nah, I need more like 15. That was pretty light," Ayton quipped...."
"0"	"See Princess Sofia of Sweden's Unexpected Green Leopard Print Dress   Complete with Tiara!"	"lifestyleroyals"	"Princess Sofia of Sweden's Leopard Print Dress with Tiara"
"0"	"5 arrested in connection with deadly shooting at Airbnb Halloween party"	"newscrime"	"Police have arrested five suspects in the Halloween shooting at a California Airbnb that left five partygoers dead. The arrests came during a coordinated police operation in four Northern California cities, reported San Francisco ABC station KGO. Five partygoers were killed on Halloween night at a house in the affluent town of Orinda, just east of Berkeley, that had been rented through Airbnb."
"1"	"10 ways the average American home is different today than it was in the '60s"	"lifestylehomeandgarden"	"While the typical American home in the '60s was filled with bright colors and wood paneling, a home today is more subdued and prioritizes comfort."
"0"	"How to Watch the Leonid Meteor Shower This Weekend"	"science"	"Look up this weekend to catch shooting stars radiating from the constellation Leo."
"1"	"Your DNA Profile is Private? A Florida Judge Just Said Otherwise"	"newsus"	"For police officers around the country, the genetic profiles that 20 million people have uploaded to consumer DNA sites represent a tantalizing resource that could be used to solve cases both new and cold."
"1"	"Ford v Ferrari: the real story"	"autosnews"	"The film about the epic Le Mans rivalry promises to be a must for car fans - and this is the real story behind it"
"1"	"Analysis: The House is not voting on impeaching Trump today. But here's why the vote still matters"	"newspolitics"	"The House of Representatives is expected to vote on a resolution that outlines the next phase of the impeachment inquiry."
"1"	"2019 Tokyo Motor Show preview: Debuts from Honda, Mazda, Toyota and more"	"autostokyo"	"Whether you're after electric cars, sports cars or something out of left field, Tokyo's got it."
"1"	"Greatest eBay Listing Of 2019? Or In All Of Human History? You Decide!"	"autosclassics"	"This clever eBay ad made our day!"
"0"	"Opinion: Colin Kaepernick is about to get what he deserves: a chance"	"football_nfl"	"The end may be near for the 3-year-old saga of Colin Kaepernick as the quarterback is scheduled to work out for teams on Saturday."
"0"	"Archie's Photo Album: Prince Harry, Duchess Meghan's Royal Baby"	"lifestyleroyals"	"So cute!"
"0"	"Highway blockade reveals splits in Hong Kong protest movement"	"newsworld"	"Highway blockade reveals splits in Hong Kong protest movement"
"0"	"Greek donkeys are still being abused as 'tourist taxis,' PETA claims"	"travelnews"	"The animal rights group claims that legislation recently passed to protect the animals is not being enforced."
"1"	"The Warriors' fall from glory, explained"	"basketball_nba"	"Things are getting bad quick for the Warriors."
"0"	"5 Things You Didn't Know About Campbell's Iconic Green Bean Casserole"	"foodnews"	"We even got our hands on the original 1955 recipe card from the test kitchen."
"1"	"MLB free-agent predictions: Rankings, rumors for the top players on the market"	"baseball_mlb"	"We'll take a quick look at why 10 players will be attractive as free agents, a couple of places they might wind up and then a prediction."
"0"	"New Ant Species Discovered in Ant Expert's Backyard"	"science"	"Global ant expert Jack Longino was surprised to find long-hidden species in his backyard garden that he named Strumigenys ananeotes, meaning "newly emerged.""
"0"	"Bold predictions for Week 12 in college football"	"football_ncaa"	"Expect the unexpected in college football each weekend. USA TODAY experts weigh in with their bold predictions for Week 12 of the season."
"1"	"First Drive! 2020 Shelby GT500 Is an Apex Predator, Turning Drivers Into Track Stars"	"autosreview"	"Driving the 2020 Shelby GT500 on the street, dragstrip, and road course reveals an apex predator that turns any driver into a track star."
"1"	"13 Popular Foods People Hated Eating 100 Years Ago"	"foodnews"	"Culinary trends are just as fickle as fashion. Find out which gourmet foods you love used to only be fed to animals or prisoners. The post 13 Popular Foods People Hated Eating 100 Years Ago appeared first on Reader's Digest."
"0"	"Schiff accuses Trump of 'witness intimidation'"	"newspolitics"	"House Intelligence Committee Chairman Adam Schiff issued a veiled threat against President Trump for tweeting about former Ukraine Ambassador Marie Yovanovich as she testified before the panel in Day Two of the public impeachment proceedings."
"0"	"'Our entire community is changed forever': CA shooting victims face a new reality"	"newsus"	"Students at Saugus High School in Santa Clarita, California, say they're facing a new reality after a fellow student shot five classmates and them himself Thursday."
"0"	"Here's What 'Cultural Appropriation' Actually Means   and Why It's Wrong"	"lifestylebuzz"	"The questions you've been afraid to ask, answered."
"1"	"I've been writing about tiny homes for a year and finally spent 2 nights in a 300-foot home to see what it's all about   here's how it went"	"voices"	"I stayed in a tiny house for three days to see what the fuss was all about, and I was surprised by what I saw."
"1"	"16 transgender celebrities who are changing television"	"tv-gallery"	"Shows like "Euphoria," "Pose," "The Fosters," and "Shameless" have all introduced trans actors and characters in recent years."
"0"	"Raise Billions From Billionaires? Tax Experts Say It's Not That Simple"	"finance-taxes"	"One of the signature initiatives of Elizabeth Warren's presidential campaign is a wealth tax that, she says, would pay for many of the programs she proposes."
"1"	"10 Things Polite People Never Do on Cruises"	"traveltips"	"Don't be the person who ruins someone's vacation!"
"1"	"18 of the most iconic record-breaking songs in pop music history"	"music-gallery"	"What do "White Christmas" and "My Life Would Suck Without You" have in common? They've have achieved a spot in pop music history by breaking records."
"0"	"20 IRS audit red flags"	"finance-taxes"	"20 IRS Audit Red Flags"
"0"	"Pregnant Eva Amurri Martino Reveals Split From Husband Kyle Martino"	"movies-celebrity"	"Eva Amurri announced she and her husband are "lovingly" parting ways after eight years of marriage."
"1"	"7 possible landing spots for Anthony Rendon"	"baseball_mlb"	"The most coveted position player hitting the open market this winter is undoubtedly third baseman Anthony Rendon. Rendon's expected price tag - and the fact a compensatory draft pick must be surrendered upon signing him - will eliminate a handful of suitors outright."
"1"	"The Rock rolls out $9M for massive, rural Georgia mansion"	"movies-celebrity"	"Hollywood's biggest leading man just bought an even bigger mansion."
"0"	"Aston Martin has a lot riding on its new $189,000 SUV"	"finance-companies"	"The company's cars are missing sales targets, and the stock has lost more than 70% since its IPO in 2018."
"0"	"Kate Middleton Took Public Transit to Her Royal Engagement Today"	"lifestyleroyals"	"It's not every day you see a royal wearing Oscar de la Renta on your morning commute."
"1"	"Ready to Try CrossFit? Give This Beginner's WOD a Try."	"fitness"	"Top CrossFit athlete Spencer Hendel shares a workout to get you started."
"0"	"Cows swept away by Hurricane Dorian found alive   but how?"	"lifestylebuzz"	"A trio of wild cows believed to have been swept away by the storm surge from Hurricane Dorian have been found on a nearby island in North Carolina"
"1"	"9 renovation tips to boost resale value"	"finance-real-estate"	"Making the right renovation decisions can help you sell your house quicker, and for more money."
"1"	"41 Heartwarming Photos That Will Restore Your Faith in Humanity"	"causes"	"These true stories might make your heart swell three times bigger."
"0"	"At NATO summit, Trump to stress US allies' defense spending"	"newsworld"	"President Donald Trump will try to convince U.S. allies that they should increase defense spending when he attends a meeting of NATO leaders next month in London, the White House said Friday."
"1"	"Why I Dropped Out Of An Ivy League College Just 3 Weeks Into Freshman Year"	"voices"	"At the end of August, I packed my bags and said goodbye to the University ofPennsylvania after having moved into my new dorm as a first-year student onlya couple weeks prior. I came home to Medford, Massachusetts, to shocked familyand friends, everyone wondering where I had gone wrong, including myself.I immigrated to the United States from China at the age of 6 with my motherand a much older brother more than a decade ago, with the primary..."
"0"	"The Unlikely Star of My Family's Thanksgiving Table"	"recipes"	"It's hard to remember life before broccoli cheese rice casserole. Or, B.B.C.R.C.E. (Before Broccoli Cheese Rice Casserole Era). What did the Kim clan have to look forward to every Thanksgiving before the cheesy family-favorite side dish entered our lives? Stuffing, maybe. Green bean casserole. Macaroni and cheese. Ham in cola, a quirky recipe from Nigella Lawson that she picked up from the American South. Certainly nothing from the Korean..."
"1"	"The 60 Best Gift Ideas Under $100 for Everyone on Your List"	"shop-holidays"	"From fashion girls to frequent fliers, we've got them covered."
"0"	"I Overate at Dinner Until I Started Doing This 1 Simple Thing on Sundays (It Takes 10 Minutes!)"	"nutrition"	"Another reason Sunday is the best day to meal prep."
"0"	"Amari gets heroic birthday surprise"	"newsgoodnews"	"Meet this week's inspiring kid."
"0"	"Washington police announce arrest of 'Potomac River rapist'"	"newscrime"	"A man known as the "Potomac River rapist" who sexually assaulted at least 10 women and murdered one in the Washington area in the 1990s has been arrested, police said Thursday. Giles Warrick, 60, was taken into custody on Wednesday in the state of South Carolina, Washington police chief Peter Newsham announced at a press conference."
"0"	"Emails Outline Anti-Immigration Group's Connection to Stephen Miller"	"newsus"	"WASHINGTON   Stephen Miller, President Trump's hard-line immigration adviser, has long relied on data produced by the Center for Immigration Studies, a right-leaning think tank, to shape policy at the White House."
"0"	"New Trump rule to make more health care rates public"	"health-news"	"The hospital industry says it will sue to stop it from taking effect."
"0"	"Pete Davidson, Kaia Gerber Are Dating, Trying to Stay 'Low Profile'"	"tv-celebrity"	"Pete Davidson, Kaia Gerber Are Dating, Trying to Stay 'Low Profile'"
"1"	"I tried to eat like Kate Middleton for a week, but I couldn't get through it without cheating"	"nutrition"	"Following Kate Middleton's diet helped me feel energized throughout the week, but there were some meals I could only stomach once."
"0"	"Video shows a Boeing 737 plane carrying 196 people burst into flames just after landing at an Egyptian airport"	"travelnews"	"The plane, operated by EgyptAir and owned by Ukrainian budget airline SkyUp, burst into flames while it was still taxiing to its gate."
"1"	"His Mood Changed and Our Marriage Imploded. Then He Took a Blood Test."	"voices"	"His condition came on so gradually he couldn't tell he had changed."
"0"	"Will James Wiseman play for Memphis again? Explaining next steps in NCAA eligibility process"	"basketball_ncaa"	"James Wiseman and Memphis agreed on Thursday to follow the NCAA's rule of law in determining his eligibility. Here is what that most likely means for the rest of their 2019-20 season."
"0"	"Survivor Contestants Missy Byrd and Elizabeth Beisel Apologize For Their Actions"	"tvnews"	"Survivor contestants Missy Byrd and Elizabeth Beisel posted apologies to Twitter after they were shown onscreen using a fellow contestant's assault story to their advantage in the game"
"0"	"Police find 26 children behind false wall at Colorado day care"	"newscrime"	"The state of Colorado has suspended the license for Play Mountain Place daycare in Colorado Springs after they uncovered 26 children behind a false wall in the owner's basement, all under the age of three-years-old."
"0"	"U.S. Troops Will Die If They Remain in Syria, Bashar Al-Assad Warns"	"newsworld"	"President Donald Trump has said a force of Americans will remain in the east of the country to guard the oil fields there."
"1"	"10 Cool Camper-Van Conversions You Can (Probably) Afford"	"autosenthusiasts"	"Where to start if you want to go #vanlife for your next getaway."
"0"	"Supporting your adult children can ruin your retirement plans"	"finance-retirement"	"Prepare your children early in life to be financially independent. If not, your retirement plan may need to include funding your irresponsible adult child's lifestyle, in addition to funding your own retirement."
"1"	"2020 Jeep Gladiator Sport Manual First Test: Unhappy Marriage"	"autostrucks"	"Pentastar V-6 and six-speed stick an imperfect match"
"1"	"Why I stopped shopping at Marshall's and Trader Joe's"	"finance-savemoney"	"They're money pits. There, I said it."
"1"	"Jessica Simpson's latest Birdie Mae post suggests she's done having kids, plus more news"	"entertainment-celebrity"	"Is Jessica Simpson done having kids? Plus, more celebrity news for Nov. 6, 2019."
"0"	"You can start cooking your pasta in cold water   Alton Brown has been doing it for years"	"tipsandtricks"	"I put the Food Network star's unconventional trick for cooking pasta to the test and found that it actually works."
"0"	"Prince Harry and Prince William's Rift Is "One of the Main Reasons" the Sussexes Are Skipping Royal Christmas"	"lifestyleroyals"	"Santa is shook."
"0"	"Female Thunderbird pilot inspiring others to chase their dreams"	"newsgoodnews"	"Michelle Curran flew 160 combat hours in Afghanistan before joining the team"
"1"	"15 great words that will make you sound smarter"	"lifestyledidyouknow"	"Even if you consider yourself a walking dictionary, there's always room for a few more great words in your vocabulary   especially these 15 terms that people should really be using way more often."
"0"	"DHS Sued for Answers About Its Use of DNA Testing at the Border"	"newsus"	""DHS has deployed this privacy-invasive technology without explaining how accurate the testing is, whether families can challenge the results, or how the program may be expanded in the future," said EFF Staff Attorney Saira Hussain."
"0"	"Best Bets: Previewing the best games of the weekend in college basketball"	"basketball_ncaa"	"Let's get rich!"
"0"	"Week in celebrity photos for Nov. 11-15, 2019"	"celebrity"	"Week in celebrity photos for Nov. 11-15, 2019"
"0"	"First Drive! Steeda transforms the Bullitt from leading man to action hero with the Steve McQueen Edition"	"autossports"	"Driving the first supercharged Steve McQueen Edition Bullitt reveals an modern Mustang action hero"
"0"	"Read: Marie Yovanovitch's testimony at today's impeachment hearings"	"newspolitics"	"Former U.S. Ambassador to Ukrane Marie Yovanovitch is testifying to the House Intelligence Committee Friday."
"0"	"A third of boomers make this critical retirement mistake"	"finance-saving-investing"	"And it's putting their retirement security at risk"
"1"	"Pictures so perfect it's hard to believe they're real"	"lifestylebuzz"	"Photos taken by people from across the world that capture amazing optical illusions."
