"1"	"The Greek Royals Dressed as the Royal Tenenbaums for Halloween"	"lifestyleroyals"	"The word play here..."
"0"	"Impeachment inquiry: White House releases rough transcript of Trump's earlier call with Zelensky"	"newspolitics"	"Trump spoke with Zelensky in the hours after he won the presidency in April, preceding the July phone call between the two leaders that launched an impeachment inquiry."
"0"	"All the times royals have met A-list celebs"	"celebrity"	"See all the moments the British royal family rubbed elbows with Hollywood stars."
"0"	"South Carolina teen gets life in prison for deadly elementary school shooting"	"newsus"	"Jesse Osborne, the teenager responsible for a shooting at a South Carolina elementary school in 2016, was sentenced to life in prison."
"1"	"Opinion: Mad at Clippers for sitting Kawhi Leonard? Get used to it"	"basketball_nba"	"The Clippers sat Kawhi Leonard for the second time this week as part of their load management program. It's the new reality in the NBA and its stars."
"1"	"Bruce Willis brought Demi Moore to tears after reading her book"	"movies-celebrity"	"Demi wasn't sure how her ex would feel about her book until he called her."
"1"	"Everything We Think We Know About the 2020 Ford Bronco"	"autosnews"	"Ford is bringing back the beloved 4x4 SUV. Here's what to expect."
"1"	"Justin Bieber uses Instagram to sell his house, plus more proof stars are nothing like us"	"entertainment-celebrity"	"Justin Bieber used Instagram to sell his house and even more reasons stars aren't like the rest of us in October 2019."
"0"	"Corbyn launches plan to give free broadband to everyone in Britain"	"newsworld"	"Labour leader says proposed roll-out would bolster economy and help tackle climate crisis"
"0"	"'This tarnishes everything': Astros cheating allegations have baseball world demanding punishment"	"baseball_mlb"	"The Houston Astros are facing public backlash over revelations that the team may have been using electronic means to steal signs."
"1"	"Camila Cabello Explains the Sweet Meaning Behind Her First Tattoo"	"music-celebrity"	"The singer is sharing the significance behind her new ink."
"0"	"Lena Waithe Reveals She Secretly Married Her Longtime Love"	"tv-celebrity"	"Lena Waithe and longtime love Alana Mayo secretly got married! Watch the Masters of None star talk about their wedding on The Ellen DeGeneres Show with guest host John Legend here."
"1"	"12 Things U.S. Presidents Have to Pay for on Their Own"	"lifestyledidyouknow"	"Not everything comes for free with the (White) house. The post 12 Things U.S. Presidents Have to Pay for on Their Own appeared first on Reader's Digest."
"0"	"Surviving Santa Clarita school shooting victims on road to recovery: Latest"	"newsus"	"What should have been a normal Thursday spiraled into a nightmare for students and teachers at Saugus High School in Santa Clarita, California."
"1"	"Walmart's Pre-Holiday Deals Are Live Right Now"	"shop-holidays"	"Don't get trampled! Shop these online sales from the comfort of your couch."
"0"	"Why This Couple Is Getting a 'Sleep Divorce'"	"lifestylevideo"	"A New Jersey couple is getting an unusual "divorce." Liz and Rich Alterman have been happily married for almost 20 years. They have three children and are now on the brink of getting "sleep divorced.""
"0"	"Audi E-Tron S Possibly Spied Testing At The Nurburgring Again"	"autosnews"	"The new rear diffuser is a bit of a giveaway."
"1"	"Funny celeb pics for October 2019"	"humor"	"Helen Mirren does ride share differently and more pics that will make you LOL."
"0"	"Pittsburgh Steelers quarterback Mason Rudolph on 'TNF' incident: 'I thought it was pretty cowardly'"	"football_nfl_videos"	"Pittsburgh Steelers quarterback Mason Rudolph tell us what he thinks about the "TNF" incident."
"1"	"Celebrities who changed their names"	"celebrity"	"What's in a name? For a celebrity, a lot. Name recognition is vital. And yet that hasn't stopped some celebrities from changing their names."
"1"	"Why You Shouldn't Ever Go for the Cheapest Brake Pads"	"autosbuying"	"Brakes are the most important part of your car. Here's why you shouldn't cut costs on them."
"0"	"50 Things Popular Restaurant Chains Don't Want You to Know"	"restaurantsandnews"	"You'll want to be aware of these restaurant secrets next time you go out to eat. (For example, you really don't have to ask for unsalted fries.)"
"1"	"General knowledge quiz: How many questions can you get right?"	"lifestylebuzz"	"A new quiz asking players to correctly answer questions on history, culture and science is putting the internet's general knowledge to the test."
"0"	"Ford's Mach E Electric SUV Spied Looking...Interesting"	"autosnews"	"We're not sure how we feel about this new EV's Mustang-inspired styling cues."
"0"	"Queen Elizabeth Just Rode Horseback at Age 93"	"lifestyleroyals"	"The British monarch isn't letting a small thing like age keep her from living her life."
"0"	"THEN AND NOW: What all your favorite '90s stars are doing today"	"celebrity"	"These heartthrobs and fan favorites made the 1990s one of the best decades of the century. Here's what they're up to now."
"0"	"AP Interview: Evo Morales wants UN mediation in Bolivia"	"newsworld"	"Bolivia's Evo Morales called for the United Nations, and possibly Pope Francis, to mediate in the Andean nation's political crisis following his ouster as president in what he called a coup d'etat that forced him into exile in Mexico."
"1"	"What Fiat Chrysler and PSA Peugeot Citroën Merger Will Mean for U.S. Car Buyers"	"autosnews"	"Now that FCA and PSA confirm they're doing a 50/50 merger, we're more likely to see technology being shared than cars being added to the U.S. market."
"0"	"'Don't stay silent': Democrats lash out as GOP blocks gun measure amid school shooting"	"newsus"	"News of the California school shooting broke as Connecticut's two Democratic senators were making an emotional case for gun control."
"0"	"Your Thanksgiving Guests Will Be Very Thankful for Our Favorite Turkey Recipes"	"recipes"	"What's Thanksgiving without the star of the show?"
"1"	"Celebrities who were born on Halloween"	"entertainment-celebrity"	"These stars' birthdays are on Oct. 31."
"0"	"Automakers around the world await Trump's tariff decision"	"markets"	"Automakers around the world are awaiting a decision from President Donald Trump on whether he will impose up to 25% tariffs on U.S. car and auto part imports after a 180-day review period elapsed this week."
"1"	"Stores that opened for business the year you were born"	"finance-companies"	"Which retail brand was born in the same year as you? Find out in this gallery charting the opening of famous stores from 1946 to 2000."
"0"	"End Of An Era As Chevy Has Built The Last Front-Engined Corvette"	"autossports"	"It's a Z06 coupe previously sold for $2.7 million for a noble cause."
"0"	"Billionaires' success boils down to 3 simple traits, a new report says"	"personalfinance"	"Intelligence isn't what makes billionaires successful, a new report by investment bank UBS and PricewaterhouseCoopers found."
"0"	"Police look for motive behind California school shooting"	"newsus"	"Police look for motive behind California school shooting"
"0"	"Boy uses his Make-A-Wish to get special space that other schoolchildren can use"	"newsgoodnews"	"Boy uses his Make-A-Wish to get special space that other schoolchildren can use"
"1"	"7 'Italian' foods Americans eat that you typically won't find in Italy"	"foodnews"	"Things like spaghetti and meatballs or even a single slice of pizza seem normal and standard in the US, but that's not the case in Italy."
"0"	"Stars   They're Just Like Us!"	"celebrity"	"Stars   They're Just Like Us!"
"0"	"Why You Shouldn't Work For Money   and What To Work For Instead"	"lifestylecareer"	"Increase your money IQ by changing the way you think."
"0"	"The world's most profitable company is about to go public"	"finance-companies"	"The oil company that made Saudi Arabia rich is going public. Some say the timing couldn't be worse."
"1"	"Riding The Completely-New 2020 Indian Motorcycle Challenger"	"autosmotorcycles"	"All-new liquid-cooled engine, frame-mounted fairing, and 122 hp."
"1"	"66 Cool Tech Gifts Anyone Would Be Thrilled to Receive"	"shop-holidays"	"Let's face it: everyone wants the newest, coolest tech gadget on the market, and we don't blame 'em."
"0"	"Aston Martin Vantage Volante Spied Looking Dark On A Foggy Day"	"autosnews"	"It's not a good day to open the roof."
"0"	"Metal detectorists discover haul of gold coins worth at least 100k"	"viral"	"This is the moment a metal detectorist looking for a friend's lost wedding ring discovered a haul of gold coins worth an estimated £100,000 and shouted - ''yee-ha - there's a f*cking fortune here!'. Paul Raynard, 44, screamed "'there's millions - this is the moment we dreamed of!" to best pal Michael Gwynne, 52, when he realised the scale of the find. Businessman Paul "broke down in tears" when he stumbled across his very own pot of gold - a cluster of 84 coins in a field near Ballycastle, Northern Ireland. Stunned Paul and Michael found the coins - dating back to the 1500s - whilst looking for the wedding ring a farmer friend had lost in his field."
"1"	"The Hottest Tech Gifts This Holiday Season"	"shop-holidays"	"If you need tech gifts for people on your list this holiday season but don't know what's affordable   while still being useful and maybe even dazzling   consult this list. We've got devices that will please television watchers, music lovers, fitness fans, gamers, neat freaks, and more, as well as smart-home users."
"1"	"Celebrity kids then and now: See how they've grown"	"entertainment-celebrity"	"See what the children of Bobby Cannavale, Ray Liotta, Jude Law, Jamie Foxx, Sylvester Stallone, James Gandolfini and more stars look like now."
"0"	"Model, 23, Didn't Know She Was Pregnant Until She Gave Birth to a Full-Term Baby in Her Bathroom"	"health-news"	"An Australian model recently had a life-changing surprise when she gave birth to a baby in her bathroom, despite not knowing that she had been carrying her daughter for nine months."
"0"	"'Ghost ship' found in Lake Michigan"	"viral"	"The wreck of a 'mysterious ghost ship' has been discovered in Lake Michigan."
"1"	"Joe Giudice Speaks Out For the First Time Since Leaving For Italy"	"tv-celebrity"	""At the end of the day, people make mistakes," the reality star said in a video posted on Bravo's The Daily Dish. "Nobody's perfect.""
"0"	"22 Smart Tax Moves to Make Before the End of the Year"	"finance-taxes"	"Have you done your charitable giving for the year? Paid off medical bills? Those are just two smart tax moves you should make to lock in savings when the taxman comes to call in April. But you'll have to hurry if you want to make these last-minute plays work. Deadline is Dec. 31, and the clock is running."
"0"	"Russia lands forces at former U.S. air base in northern Syria"	"newsworld"	"Russia lands forces at former U.S. air base in northern Syria"
"1"	"Week in celebrity photos for Oct. 21-25, 2019"	"entertainment-celebrity"	"Week in celebrity photos for Oct. 21-25, 2019"
"0"	"Experts Explain Why You Might Want to Stop Sleeping on Your Stomach and How to Do It"	"wellness"	"It may be time to make over your sleep habits   here's why and how to do it."
"1"	"Halloween tales from the ER: Doctors share their spooky stories"	"medical"	"The revelry of one of the most festive holidays of the year -- and the spookiest -- often carries over to emergency departments all over the country."
"0"	"Report: Carmelo Anthony returning to NBA with Trail Blazers"	"basketball_nba"	"After months on the open market and fans clamoring for an NBA return, Carmelo Anthony finally has a new home."
"0"	"Taylor Swift Rep Hits Back at Big Machine, Claims She's Actually Owed $7.9 Million in Unpaid Royalties"	"musicnews"	"Taylor Swift's team responds to Big Machine's denial."
"0"	"Homeless woman living in SUV with dogs moves into apartment with community's help"	"newsgoodnews"	"Two friends in suburn Philadelphia reached out to residents via the Nextdoor app to get food and housing for a former pharmacist with health issues living in an SUV."
"0"	"Lebanon protesters angered by PM pick"	"newsworld"	"Lebanese protesters who have been demanding radical reform reacted with anger Friday to the reported designation of a new prime minister they regard as emblematic of a failed political system."
"1"	"Stars   They're Just Like Us!"	"celebrity"	"Stars   They're Just Like Us!"
"1"	"From cat names to fruit, here are 11 bizarre things celebrities have tried to trademark"	"celebrity"	"From Taylor Swift to Kylie Jenner, a lot of stars have tried to trademark things like commonly used terms, song lyrics, and signature catchphrases."
"0"	"29 Savory Tart and Quiche Recipes"	"recipes"	"There's no better way to feature the season's fresh produce than in quiches, savory tarts, and galettes."
"1"	"Georgia governor unveils Medicaid plan with work requirement"	"newsus"	"Georgia Gov. Brian Kemp released a plan Monday to expand Medicaid to the state's poorest able-bodied adults, on the condition that they work, volunteer, receive job training or attend school."
"0"	"Meghan Markle and Hillary Clinton Secretly Spent the Afternoon Together at Frogmore Cottage"	"lifestyleroyals"	"Meghan Markle Invites Hillary Clinton to Her Frogmore Cottage Home"
"1"	"This Wedding Photo of a Canine Best Man Captures Just How Deep a Dog's Love Truly Is"	"lifestylebuzz"	"When Mark Doublet made his dog, Marley, the best man at his wedding, he took his duties very seriously, and a photo of them together has gone viral."
"0"	"Debunking the week's tabloid stories: Nov. 15, 2019"	"celebrity"	"A round-up of the week's tabloid stories that totally missed the mark."
"0"	"2020 Toyota Supra Review: Why the Supra Is a Finalist and the BMW Z4 Isn't"	"autossports"	"The new Supra is a 2020 Car of the Year finalist"
"1"	"Meghan Markle is being criticized for doing the same things that Kate Middleton is praised for, and a royal expert says it wouldn't be happening if she were white"	"lifestyleroyals"	"Markle received backlash when her bodyguard told fans not to take photos. However, Middleton was recently called "down to earth" for the same thing."
"0"	"2021 Ford Mustang Mach-E: This Electric SUV is a Mustang Family Member"	"autosnews"	"Ford confirms that its all-new, fully electric crossover will wear the iconic Mustang name."
"1"	"Four ways Trump's tax returns could come to light"	"newspolitics"	"President Donald Trump broke with a decades-long tradition of U.S. presidential candidates by not releasing his tax returns during his campaign, prompting state and Congressional investigators to seek the returns through other means. Here are four ways investigators could get his tax returns."
"0"	"Kate Middleton Shows Off Motherly Side as She Bonds with Families at Opening of Children's Hospice"	"lifestyleroyals"	"Kate Middleton Celebrates Opening of Children's Hospice"
"1"	"Rainbow Baby! Shawn Johnson, Andrew East Welcome 1st Child After Miscarriage"	"tv-celebrity"	"Rainbow Baby! Shawn Johnson, Andrew East Welcome 1st Child After Miscarriage"
"1"	"Ford Baby Bronco Bare Body Allegedly Leaked In Exclusive Photo"	"autosnews"	"Ford had no comment, but it sure looks like the real deal."
"0"	"Celebrity beach cruising for 2019"	"celebrity"	"See all the stars who hit the beach this year!"
"1"	""The Rock" Just Shared His Gym Bag Essentials And Whipped Out a Bag of Hot Dogs"	"fitness"	"He starts his day at the gym at 4 a.m. So let's take a peek into Dwayne "The Rock" Johnson's bag of tricks . . ."
"1"	"Impeachment inquiry: White House releases rough transcript of Trump's earlier call with Zelensky"	"newspolitics"	"Trump spoke with Zelensky in the hours after he won the presidency in April, preceding the July phone call between the two leaders that launched an impeachment inquiry."
"0"	"READ: Memo of Trump's first call with Zelensky"	"newspolitics"	"The White House on Friday released a memo of a call between President Trump and Ukraine's President Volodymyr Zelensky that took place shortly after Zelensky's election earlier this year."
"0"	"Why I'm Done Celebrating The Accomplishments Of Couples"	"voices"	""What is real? How do you define real?" - Morpheus, The Matrix, 1999 I've had the "summer of six weddings." The "spring of seven baby showers." The "year with nine bachelorette weekends"   not parties, but whole weekends for some reason. And while I could tell tales of the financial strain imposed when a single person celebrates other people for their entire adulthood   and I do serve that tea boiling   instead I want to talk about feelings...."
"0"	"Nurses face an epidemic of workplace violence"	"markets"	""I got punched in the face," said one emergency room nurse, while others worry for their safety"
"1"	"Classic muscle cars and trucks set for auction in the Windy City"	"autosclassics"	"More than 1,000 cars and trucks ready for sale at Mecum Chicago 2019"
"1"	"17 of the best things to get at Aldi this month for under $5"	"newstrends"	"From flavored cold-brew coffees to seasonal pecan pies, here are some of the most affordable items to get at the retailer this November."
"0"	"Envoy Was 'Obstacle' to Trump, Schiff Says: Impeachment Update"	"newspolitics"	"The House Intelligence Committee held its second public hearing on Friday to hear testimony by former U.S. Ambassador to Ukraine Marie Yovanovitch, who was removed from that post in May by President Donald Trump."
"1"	"Meet The Jackal, A Silverado-Based Raptor Killer Chevy Won't Build"	"autostrucks"	"It's available in three flavors, from mild to wild."
"1"	"25 awesome gifts men actually want this year"	"shop-holidays"	"By clicking one of our links you're supporting our labs and our independence, as we may earn a small share of revenue. Recommendations are separate from any business incentives. Shopping for guys can be tricky business. Though "traditional" men's gifts think neckties and whiskey stones seem like safe bets, in truth, men have a wide variety of tastes and those "safe" gifts rarely get real use. This year, we've got you covered with the best gift..."
"0"	"11 Regional Thanksgiving Recipes That Food Bloggers Swear By"	"recipes"	"Turkey may be the quintessential Thanksgiving dish, but it's not the only attraction feasters look forward to on this food coma-inducing holiday. Families nationwide anticipate the annual spread of grandma's best stuffing or dad's secret sweet potato recipe. What many Americans don't realize, though, is these staples can vary drastically by location. In some regions, families pack extra cream in their potatoes. In others, Thanksgiving sides come..."
"0"	"Man suspected of fatal shooting said he was man from 'Joker'"	"newscrime"	"Nevada authorities have said a man suspected of a fatal shooting last month was dressed as the Joker from the recently released movie of the same name and identified himself as the main character Arthur Fleck."
"1"	"50 Awful Foods That Should Never Be in Your Kitchen"	"nutrition"	"Think your cabinets are stocked with mostly good-for-you foods? Take a second look."
"0"	"Liver transplant leads to unbreakable bond between strangers"	"newsgoodnews"	"In 2016, David Landes sent a desperate email in search of living liver transplant. When Mark Henderson heard Landes' story from a friend, he made the ultimate sacrifice. They both join the 3rd hour of TODAY to talk about the incredible act of kindness and the friendship that has come from it."
"0"	"Please Don't Yell at Your Dog!"	"lifestylebuzz"	"A new study shows it can cause long-term psychological impacts."
"0"	"He was a member of a boy band in the 90s. Now he's an ER doctor in Dallas"	"health-news"	"Just when he attained everything he had ever wanted, he realized it wasn't what he wanted."
"0"	"The 30 best shows of Comedy Central's 30 years"	"humor"	"Comedy Central has been on the air now for 30 years. Since Nov. 15, 1989   when it was The Comedy Channel   it has been the go-to network for comedy, from original programming and movies to favorites and cult classics in syndication."
"0"	"Stephanie Parze's Car Is at Home. So Is Her Phone. But She's Missing."	"newscrime"	"Her car was in the driveway. Her phone was on the couch. Her dog was running around. Everything about Stephanie Parze's home in New Jersey, her father says, seemed undisturbed   except that she was not there. The last time her mother saw Ms. Parze, they had kissed goodbye after a night out with friends and family, according to a report."
"1"	"10 Best Home Renovations to Squeeze in Before Winter"	"lifestylehomeandgarden"	"Create a "wow!"-worthy home before snuggle-weather hits. The post 10 Best Home Renovations to Squeeze in Before Winter appeared first on Reader's Digest."
"1"	"Yes, We Analyzed the Royal Family's Birth Charts"	"lifestyleroyals"	"Ten points if you can guess George's rising sign."
"1"	"95% of tested baby foods in the US contain toxic metals, report says"	"healthnews"	"Tests of 168 baby foods by an advocacy group found 95% contain toxic metals that can lead a loss of IQ and developmental delays in infants."
"1"	"Trump's 2016 team sounds alarm as Democrats make gains"	"elections-2020-us"	"Senior members of President Trump's 2016 campaign are sounding the alarm, warning that Democratic enthusiasm for impeachment and Republican weakness in the suburbs could spell trouble for the president as he embarks on his reelection campaign.Democrats won back the House majority in 2018, in part due to their success in the suburbs, and those trends held firm in the off-cycle elections on Tuesday. Democrats took control of both chambers..."
"1"	"Famous couples who've worked together"	"entertainment-celebrity"	"These Hollywood stars have mixed business and pleasure."
"0"	"Home Values in These Cities Have Grown the Most Since the Last Recession"	"finance-video"	"Home prices reached their lowest point in 2012 following the Great Recession. Many Americans who purchased homes during this time now are reaping the rewards. Here are five cities where home prices have increased in value since the last recession."
"1"	"Celeb couples with big age gaps"	"celebrity"	"Age is just a number for some stars!"
"0"	"Dow tops 28,000 for first time, capping 4-week win streak"	"markets"	"The Dow Jones Industrial Average ended at another record high Friday after White House economic adviser Larry Kudlow said China and the U.S. were getting close to reaching a trade deal."
"1"	"'The Office' star Jenna Fischer responds to Chrissy Teigen's theory that Jim and Pam are divorced"	"tv-celebrity"	"Jenna, who played Pam opposite John Krasinski's Jim on the hit NBC sitcom, thinks Chrissy got it wrong."
"1"	"Celebs celebrate Halloween 2019"	"entertainment-celebrity"	"Here's how the stars dressed up while celebrating Halloween this year!"
"1"	"22 times celebrities completely nailed their Halloween costumes as your favorite fictional characters"	"celebrity"	"These celebrities pulled out all the stops to transform into fan-favorite TV and film characters, from Daenerys Targaryen to Cruella de Vil."
"0"	"The most talked about movie moments of the 2010s"	"movies-gallery"	"Let's try to emphasize the positive, but there's one particular sequence that was so special in its awfulness, it had to go on this list. See if you can guess which one it is."
"1"	"Guess What New Car James May Just Bought"	"autosenthusiasts"	"Nope, it's not a Ferrari."
"1"	"There's A Black Turtleneck Shortage Because People Are Dressing Up Like Elizabeth Holmes for Halloween"	"lifestylebuzz"	"Are that many people dressing up as scammers for Halloween?"
"1"	"Here's How Bad BMW's Big Grille Problem Could Get"	"autosnews"	"Ladies and gentlemen, it pains us to bring you this most tragic of slideshows. Actually, it really doesn't. In fact, we're rather excited to showcase what the future might hold for BMW should this current fascination with fantastically large grilles be allowed to continue unchecked. Perhaps this in-your-face display of kidneys gone wild will at least encourage designers in Munich to think twice before traveling further down this road. Us Motor1.com scribes work very hard to keep a neutral tone, but frankly, we're a bit worried about BMW. This big-grille fad is as ridiculous as the pet rock only without the cool hipster factor. It's as off-putting as listening to glam rock on a scratched-up record. We blame Lexus for this, and while some brands have pulled off the gaping grille with admirable results   we're looking at you, Audi RS6 Avant   oversized kidneys basically turn every BMW into a beaver joke waiting to happen. That's not a good thing. Bigger Isn't Better: BMW Concept 4 Debuts With Massive Double Kidney Grille Reviled BMW Concept 4 Grille Redesigned By Another Fan We aren't alone on this. Peruse the comments of any Motor1.com articles referencing this bonkers nose and you'll find plenty of criticism. Rendering artists the world over have attempted to make the big grille look better, while others   including the anonymous designer who graciously sent us the designs featured above   are ready to show us a world where every BMW is, in a word, ugly. And yes, with BMW's deep involvement in the Toyota Supra, we couldn't resist leading with a makeover that could well come to the Supra's convertible twin, the Z4. Sure, the facelift could've been on an actual Z4, but seeing the double kidney on a Supra has a bit more shock factor. Jump into the slideshow at the top of this article to see just how deep   and how big   this kidney-shaped rabbit hole can grow."
"1"	"Long-term celebrity couples who won't get married"	"celebrity"	"These committed celeb couples have opted not to tie the knot."
