"0"	"Luhnow says Astros 'try and follow the rules' amid sign-stealing inquiry"	"baseball_mlb"
"1"	"Boil water order issued for Reading, officials say"	"newsus"
"1"	"Facebook threat against N.H. school was made by relative of former student, police say"	"newsus"
"0"	"Pregnant firefighter tackles bushfires: 'I don't care if you don't like it'"	"newsworld"
"1"	"Hawaii airport and homes evacuated as fast-moving fire hits West Maui"	"weathertopstories"
"0"	"Facing lawsuit, DeVos erases student loans for 1,500"	"newsus"
"0"	"Suspect charged after shooting man in leg, deputies say"	"newscrime"
"0"	"U.S. proposes denying work permits to asylum seekers who enter illegally"	"newsus"
"1"	"Barricaded suspect sets apartment on fire before surrendering to Denton police"	"newscrime"
"0"	"The 22 Wildest Celebrity Hair Transformations of the Last Decade"	"lifestylebeauty"
"0"	"House GOP asks for Hunter Biden and whistleblower to testify in impeachment probe"	"newspolitics"
"1"	"Off-duty Chicago police officer in clown makeup arrested on suspicion of slapping on-duty officer"	"newscrime"
"0"	"38 men who were worthy competitors for John Legend's Sexiest Man Alive title"	"celebrity"
"0"	"A $30,000 handbag. A disastrous wine spill. And now, a country club is suing its own waiter."	"markets"
"0"	"Broadway Star Laurel Griggs Suffered Asthma Attack Before She Died at Age 13"	"music-celebrity"
"0"	"The Milky Way's black hole kicked a star out of our galaxy"	"newsscienceandtechnology"
"0"	"C8 Corvette Dyno Test Follow-Up: What Really Happened"	"autosnews"
"1"	"Carlos Correa lost his mind while saving Astros vs. Yankees in ALCS"	"baseball_mlb"
"0"	"Myanmar accused at UN court of genocide against Rohingya"	"newsworld"
"0"	"Walmart releases Black Friday ad with $129 Apple Watch, TV deals, electronics doorbusters"	"finance-companies"
"0"	"UK flooding: army to help recovery effort as more rain forecast"	"newsworld"
"1"	"World's largest treehouse burns to the ground"	"newsus"
"1"	"Another Palm Beach County juror may be jailed in new contempt case"	"newscrime"
"1"	"Armed Man Wearing Body Armor Arrested At Dallas Trump Rally"	"newsus"
"1"	"Piracy crackdown may be next front in streaming wars"	"finance-companies"
"1"	"Internal NOAA emails detail blowback to Trump hurricane claims: 'This has really gotten out of hand'"	"newsus"
"1"	"Trump 'surprised' at pushback to hosting G-7 at his Doral resort, chief of staff says"	"newspolitics"
"1"	"Fox News Is Trump's Chief TV Booster. So Why Is He Griping About It?"	"newspolitics"
"1"	"Senate to try to override Trump emergency declaration veto Thursday"	"newspolitics"
"1"	"Kasich to Congress: 'Look in the mirror at how you want to be remembered'"	"newspolitics"
"1"	"Trump to spend $300 million on border wall "quality assurance""	"newsus"
"0"	"Is the Alabama Football Dynasty Ending?"	"football_ncaa_videos"
"0"	"Russell Wilson vs. 49ers' No. 1 defense: Monday night's prime-time matchup"	"football_nfl"
"1"	"At least 12 white supremacists have been arrested since Pittsburgh shooting: ADL"	"newsus"
"0"	"Stars Who Served in the Military"	"entertainment-celebrity"
"0"	"Bucs release former first-round pick Vernon Hargreaves"	"football_nfl"
"0"	"Wisconsin bus driver saves children wandering in snow, as deadly Arctic air mass grips US"	"newsgoodnews"
"0"	"Between 1,000 to 2,000 people get the plague every year -- including about 7 in the US"	"health-news"
"0"	"Flamingo Ends Up In One Of The Coldest Parts Of Russia!"	"animals"
"1"	"Boxer Patrick Day dies after suffering traumatic brain injury in super welterweight fight"	"boxing"
"1"	"New Jersey woman sues waiter for spilling wine on her Hermès handbag"	"newsus"
"0"	"Rape victim rejects judge's offer: $150,000 for her, reduced sentence for attacker"	"newscrime"
"1"	"'When you're in a hole, stop digging': Clinton lawyer Greg Craig to President Trump"	"newspolitics"
"0"	"Republican Mark Sanford drops out of presidential race"	"elections-2020-us"
"0"	"18 Quiet Dogs That Don't Bark (Too Much)"	"lifestylepetsanimals"
"1"	"Donald Trump Jr walks out of Triggered book launch after heckling   from supporters"	"newspolitics"
"1"	"Three school workers charged in death of special needs student"	"newscrime"
"0"	"Today in History: November 9"	"newsworld"
"0"	"SEMA 2019 Photo Highlights From Las Vegas"	"autossema"
"0"	"North Korea says Trump administration sought reopening of nuclear talks"	"newsworld"
"0"	"Ala. lawmen help get hitchhiking disabled veteran to doctor's appointment across state"	"newsgoodnews"
"1"	"Officials responding to oil spill from cargo ship in Hawaii"	"newsus"
"1"	"Iowa woman killed by explosion at gender reveal party"	"newsus"
"0"	"Lamar Odom Is Engaged to Sabrina Parr: See Her Ring!"	"celebrity"
"0"	"Trump urges Iran to release ex-FBI agent Levinson"	"newsworld"
"0"	"Divers salvage 100-year-old liquor from WWI shipwreck"	"travelarticle"
"0"	"Browns cut WR Antonio Callaway hours before kickoff amid reported substance-abuse ban"	"football_nfl"
"0"	"Supreme Court Justices Couldn't Stop Interrupting Each Other During DACA Oral Arguments"	"newsus"
"1"	"'Only God could help us': Man's 8-month odyssey in the immigration detention system"	"newsus"
"0"	"The 1 reason you shouldn't hesitate to claim Social Security early"	"finance-retirement"
"0"	"Nike will look into runner Mary Cain's allegations of abuse"	"more_sports"
"0"	"Celine Dion Shares What She Misses Most About Late Husband Rene Angelil"	"music-celebrity"
"0"	"I've had it with this former friend"	"lifestylefamily"
"0"	"'Priceless' finds that turned out to be worthless"	"markets"
"1"	"Freshman Georgia Southern offensive lineman Jordan Wiggins dies at 18"	"football_ncaa"
"1"	"3 arrested in $7 million mortgage fraud that targeted the elderly"	"newscrime"
"0"	"Memphis declares James Wiseman ineligible while it works toward resolution with NCAA"	"basketball_ncaa"
"0"	"See the most expensive watch ever sold at auction"	"viral"
"1"	"Surfing executive sentenced to prison in college admissions scam"	"newscrime"
"0"	"2020 Ford Explorer launch hardly went according to plan, company admits"	"autosnews"
"0"	"3 dead, dozens injured as Australia wildfires raze homes"	"newsworld"
"1"	"Too soon to sue over vehicle emissions standards, federal court tells California"	"newsus"
"0"	"Selfies In Sports"	"more_sports"
