"0"	"Iran moves on ultra-cheap petrol, starts rationing"	"newsworld"	"Iran imposed petrol rationing and raised pump prices by at least 50 percent Friday, saying the move aims to help the needy with cash handouts and is not due to a budget deficit. - Divisive measure - Rouhani had tried hike fuel prices in the budget last December but was blocked by parliament in the wake of protests that rocked Iran for days."
"0"	"Opinion: NFL should suspend Browns' Myles Garrett for rest of season   at minimum   for helmet swing"	"football_nfl"	"The Browns won on Thursday, but only in the most literal sense. Pro Bowl defensive end Myles Garrett changed everything with the swing of a helmet."
"0"	"After Saugus High School shooting, prayer unites a grieving community"	"newsus"	"A day that began with the shock of a school shooting in Santa Clarita ended in prayer for many families who gathered for vigils in the area. Standing before hundreds of people at Grace Baptist Church in Santa Clarita on Thursday night, Pastor David Hegg acknowledged that students and parents may be grappling with how to make sense of the shooting at Saugus High School, which left two students ..."
"0"	"Father-daughter first dance medley had every guest on their feet"	"viral"	"How awesome is this first dance medley? They got the moves down!"
"0"	"What to Cook This Weekend: November 15 17, 2019"	"recipes"	"An autumnal palette of yellow, orange, and red makes us feel cozy so this weekend, we're putting those colors on our plates."
"0"	"How much turkey do you need to buy per person?"	"tipsandtricks"	"When hosting Thanksgiving dinner, there are a lot of questions regarding the menu that may come up."
"1"	"How tall are your favorite male stars?"	"entertainment-celebrity"	"Alexander Skarsgard, Bruno Mars and more celebs' real heights are revealed..."
"0"	"The Day in Sports: Thursday, November 14, 2019"	"more_sports"	"The Day in Sports: Thursday, November 14, 2019"
"1"	"50 Unique Holiday Gift Ideas for Him Under $50"	"shop-holidays"	"From gadgets for grooming to games, food, and more, these thoughtful gifts are sure to impress the men in your life. Find the perfect gift for him, whether he's an outdoorsman or fitness enthusiast, home chef or gadget lover, or just a kid at heart. These inexpensive gift options offer plenty of variety."
"0"	"There are 14 cheap days to fly left in 2019: When are they and what deals can you score?"	"travelnews"	"There are 14 days left in 2019 that are so cheap for flights, you may want to haul out the carry-on one last time. See when you can score a deal."
"0"	"Sterling K. Brown Emotionally Recalls Seeing His Dad for the Last Time Before His Death"	"tv-celebrity"	"Sterling K. Brown Recalls Last Moment He Saw His Dad Alive"
"1"	"25 candid photos of icons who shaped pop culture"	"celebrity"	"Photographer Oscar Abolafia captured images of Elvis, Madonna, Robert Redford, Lucille Ball, and many more."
"1"	"50 Best Movie Sequels of All Time"	"movies-gallery"	"A successful film franchise can ensure box office earnings like few other movie offerings can."
"1"	"10 Exercises You Should Never Do Again, According to Trainers"	"fitness"	"Newsflash: Some moves (and exercise machines) don't actually do that much for you   and some can be downright dangerous."
"1"	"Death row inmate Rodney Reed maintains innocence weeks before execution"	"newscrime"	"Reed has been on death row for 21 years. His family and legal team say new developments in the case exonerate Reed."
"0"	"The Real Reason McDonald's Keeps the Filet-O-Fish on Their Menu"	"restaurantsandnews"	"It's something of an underdog story."
"0"	"Disparity in home lending costs minorities millions"	"finance-real-estate"	"Researchers found that blacks and Latinos face higher mortgage costs   and tech is no panacea"
"0"	"The Coolest Way to See NYC Is in a Vintage Car From the Roaring '20s on This Midtown Tour"	"ustravel"	"A new tour company called Nowaday, in New York City, will take you around in a restored, vintage car."
"0"	"Ohio GOP lawmakers want to ban all abortions, charge doctors who perform them with murder"	"newsus"	"Republicans in the Ohio House of Representatives have signed onto a bill to ban all abortions in Ohio and charge doctors who perform them with murder."
"1"	"This Is What the 2020 Toyota Supra Should've Looked Like From the Start"	"autosenthusiasts"	"That wing should be standard on every Supra. The fact that it isn't is a tragedy."
"1"	"Top 5 Craziest Motorcycles From EICMA 2019"	"autosmotorcycles"	"Bikes from legendary British and Italian marques and electric upstarts."
"1"	"An architect who built his dream tiny home in Colorado shares photos"	"finance-real-estate"	"Creating a customized tiny house is a big task. From sketches to real-life infrastructure, here's how an architect builds and designs tiny houses."
"1"	"There's a place in the US where its been over 80 degrees since March"	"weathertopstories"	"The Weather Service reports the last time the daily high was below 80 degrees was on March 27 when the high only reached 78 degrees -- which, let's be honest, is still pretty warm."
"0"	"3 Indiana judges suspended after a night of drinking turned into a White Castle brawl"	"newsus"	"Hours before they were to attend an educational conference in Indianapolis, three judges went out drinking for a few hours and decided to walk to a strip joint."
"1"	"Load up on vintage trucks and SUVs crossing the block in Iowa"	"autosclassics"	"Classic trucks set to star at Mecum Auctions Davenport sale"
"0"	"Report: Myles Garrett facing lengthy suspension, could be five games"	"football_nfl"	"Myles Garrett was guilty of one of the most aggressive and dangerous acts we have ever seen on a football field during Monday night's game between the Pittsburgh Steelers and Cleveland Browns."
"0"	"Turkey removed more than 6,000 Syrians from Istanbul -governor's office"	"newsworld"	"Turkey removed more than 6,000 Syrians from Istanbul -governor's office"
"0"	"How to Make Air-Fried Cookies"	"videos"	"Did you know that you can bake cookies in your air fryer? After a little bit of experimentation, Nicole is impressed with the results."
"1"	"Man who advocated caning for adultery gets caned for adultery"	"newsus"	"An Indonesian man has been publicly flogged for adultery, under a draconian law he helped create."
"0"	"Pair Of 'New' 1987 Buick Grand Nationals Pulled From Garage After 30 Years"	"autosclassics"	"This pair of Grand Nationals have only 1,400 miles combined!"
"0"	"Taylor Swift Says Scooter Braun, Scott Borchetta Are Blocking Her From Playing Old Hits at AMAs"	"musicnews"	"Taylor Swift has taken to social media to tell fans that Scott Borchetta, her former label head at Big Machine Records, and his new partner Scooter Braun are trying to nix her plans for a retrospective performance at the American Music Awards, as well as denying the use of her recordings for a documentary she"
"0"	"Trump attacks ambassador on Twitter as she testifies that his words in Ukraine call made her feel threatened"	"newspolitics"	"President Donald Trump on Friday lashed out at former U.S. Ambassador to Ukraine Marie Yovanovitch, as she testified in a public impeachment hearing in the House that his words about her in a phone call with the Ukraine president "sounded like a threat.""
"0"	"30 Best Black Friday Deals from Costco"	"shop-holidays"	"Costco members love shopping at the warehouse store, and they'll love shopping there for holiday gifts just as much."
"0"	"2021 BMW M3 Loses Some Camouflage In New Spy Shots"	"autosnews"	"The taillights are completely exposed, and we can also see a good chunk of the headlights."
"1"	"How Often Should You Change Synthetic Oil?"	"autosownership"	"There's more than one answer, so let us simplify it for you, starting with outlining the advantages of synthetic oil."
"0"	"Here's What It Means If You Have Ridges on Your Nails"	"medical"	"They don't make for the prettiest of manicures, but are they something more than a cosmetic problem?"
"0"	"Husband of missing woman arrested, booked on murder charges"	"newscrime"	"Police in Missouri are searching for a missing woman who was last seen leaving her St. Louis area home on Tuesday."
"1"	"'Despair': Hundreds of inmates serving life for juvenile crimes await resentencing"	"newscrime"	"Now the Supreme Court is revisiting the constitutionality of juvenile sentences of life without parole in a case involving Lee Boyd Malvo of the Beltway Sniper attacks."
"1"	"Christina Anstead's Anniversary to Ant Proves Life "Has a Funny Way" of Working Out"	"tv-celebrity"	"Flip or Flop's Christina Anstead celebrates a special anniversary with Ant Anstead. The couple got married in a secret ceremony and have a baby together."
"1"	"84-Year-Old Army Veteran Challenges TSA Agent to Push-Up Contest Before Her Flight"	"health-news"	"This veteran's age isn't stopping her from acing a pushup competition!"
"1"	"Supreme Court Justices Brett Kavanaugh and Samuel Alito Urged to Recuse Themselves From LGBT Cases"	"newsus"	"After posing for a picture with the leader of an anti-gay group, Supreme Court Justices Brett Kavanaugh and Samuel Alito have been sent a letter by the president of a judicial activist group, demanding the pair recuse themselves from upcoming court cases centered on LGBT rights."
"1"	"Old school Grammy-winning songs we're still listening to"	"music-grammys"	"Some of the songs that have won major awards are truly worthy of praise. We decided to look back at some of the best songs to win a Grammy to see which ones have stood the test of time."
"0"	"2019 Los Angeles Auto Show Preview"	"autoslosangeles"	"Get ready for the 2019 Los Angeles Auto Show"
"0"	"Testimony and texts: How the Trump-Ukraine allegations fit together in a timeline"	"newspolitics"	"With so many current U.S. officials testifying in open hearings, here is how the Trump-Ukraine allegations fit together in a timeline."
"0"	"Five Great Holiday Cruises Worth Taking"	"internationaltravel"	"These trips will make it the merriest of seasons."
"0"	"Ford v Ferrari: the real story"	"autosnews"	"The film about the epic Le Mans rivalry promises to be a must for car fans - and this is the real story behind it"
"0"	"Kentucky woman charged in death of woman missing since May"	"newscrime"	"A Kentucky woman has been charged in the death of a woman missing since spring whose remains may have been found last week."
