"0"	"Federal Prosecutors Probe Giuliani's Links to Ukrainian Energy Projects"	"Federal prosecutors in New York are investigating whether Rudy Giuliani stood to personally profit from a Ukrainian natural-gas business pushed by two associates who also aided his efforts there to launch investigations that could benefit President Trump, people familiar with the matter said."
"1"	"This video of a runaway dog sled police chase is the most absurd, delightful thing you'll see today"	"The sled dogs lost their owner when the sled tipped and she fell off."
"1"	"Women as young as 27 who are going prematurely gray show off their natural hair"	"The global movement Grombre has now seen women of all ages, from all over the world, embrace their silver locks."
"1"	"12 Surprising Things You Should Never Clean with Water"	"Wait! Before you fill up your cleaning bucket with good old H2O, think first about what you plan on cleaning. Though water may be your go-to for cleanup, it can damage or shorten the life of certain furnishings and fixtures. Read on to find out which household objects should never be subjected to water."
"0"	"'A fighter': President Jimmy Carter's neighbors know they'll say goodbye one day, but not yet"	"The folks in President Jimmy Carter's hometown of Plains, Georgia, say he will bounce back yet again from the latest medical concern."
"0"	"9 Best Beaches in Charleston"	"Sun, sand, surf, trails in this city, you're never far from a shoreline."
"1"	"Climate change has finally caught up to this Alaska village"	""Many folks are not happy to be leaving the place they've known their whole lives." After 20 years of melting permafrost, residents of Newtok now must move."
"1"	"Man Goes To Adoption Event And Finds His Long-Lost Dog"	"Shannon McCann and Nick Pizio hadn't planned on adopting another dog."
"0"	"Disparity in home lending costs minorities millions"	"Researchers found that blacks and Latinos face higher mortgage costs   and tech is no panacea"
"1"	"Jennifer Garner Shares a Relatable Mom Moment Taking Her Daughter to the Bus: 'Kept It Classy'"	"Jennifer Garner Shares a Relatable Mom Moment"
"0"	"17 Home Maintenance Tasks Everyone Should Do Before It Snows"	"Winter poses real danger to your home. We've asked experts for the winter home maintenance tasks you must complete before it starts snowing."
"0"	"THEN AND NOW: What all your favorite '90s stars are doing today"	"These heartthrobs and fan favorites made the 1990s one of the best decades of the century. Here's what they're up to now."
"1"	"We asked 14 travel experts to share their No. 1 tip for saving money when they're on vacation"	"Being flexible with your travel dates, being open to where you stay, and even simple things like bringing food to the airport can help save you money."
"1"	"AP Analysis: Iran, US still captive to 1979 hostage crisis"	"The 1979 U.S. Embassy takeover in Tehran may have ended after 444 days, but both America and Iran still remain captive to a crisis that began 40 years ago. While those held hostage at the embassy ultimately would be released, Iran to this day holds dual nationals and those with Western ties as bargaining chips for negotiating deals."
"0"	"A decommissioned nuclear missile complex in Arizona that was abandoned for decades is now on sale for $400,000"	"This complex used to be home to the US's largest land-based missile, Titan II, which sat there armed for 24 years. Now, it's on sale."
"1"	"Pamela Anderson gets backlash after wearing a Native American headdress for Halloween"	"Pamela Anderson is under fire after posting risqué photos of herself wearing a Native American headdress in honor of Halloween. The Canadian actress and animal rights activist, who rose to fame for her role as a lifeguard on the series Baywatch, took to Twitter like many other celebrities to post photos of herself in her Halloween costume. In the first photo, the 51-year-old sports a pair of high-waisted underwear, and appears to be drenched in..."
"1"	"The Navy Wants to Push Out Problem SEALs. But Trump May Get in the Way."	"Spiking drinks with cocaine, shooting Iraqi civilians, strangling a Green Beret: The Navy SEAL teams have been rocked by one high-profile scandal after another in recent months, and the leader of the elite commando force, Rear Adm. Collin P. Green, has vowed to clean house."
"0"	"Pregnant Eva Amurri Martino Reveals Split From Husband Kyle Martino"	"Eva Amurri announced she and her husband are "lovingly" parting ways after eight years of marriage."
"1"	"'Rich Kids' Stars Morgan Stewart and Brendan Fitzpatrick to Divorce After 3 Years of Marriage"	"ET confirmed earlier this month that Fitzpatrick is now dating 'Bachelor' alum Amanda Stanton."
"1"	"Chris, the famously woolly sheep, has died"	"Chris made headlines in 2015 after he became the unofficial world record holder for having grown the heaviest fleece."
"1"	"Officer in viral-video shoplifting incident to be fired: Police chief"	"The police chief of Phoenix said the Disciplinary Review Board's recommendation of a six-week unpaid suspension was not "sufficient" for Officer Chris Meyer."
"0"	"Louisiana governor's race is the latest test of Trump's clout"	"On Saturday, the final governor's race of the year is the next test of how much Trump's clout can lift a candidate. In Kentucky, the GOP candidate lost, but in Mississippi, the Republican won"
"0"	"Australia's fragile koala colonies are being ravaged by brush fires: 'It's a national tragedy'"	"Rescuers wandering through charred eucalyptus trees in New South Wales found bleak signs of devastation: koalas incinerated while seeking refuge, leaving ash where conservationists hoped to tally the dead."
"1"	"High school soccer: Chloe DeLyser sets record for most goals scored"	"Chloe DeLyser, an Ohio State commit, scored her 317th goal Tuesday night, setting a new national record for a high school girls soccer player."
"1"	"D.A. seeks murder charge against former Fort Worth officer who fatally shot Atatiana Jefferson"	""We will prosecute this case to the fullest extent of the law," the Tarrant County Criminal District Attorney's Office said."
"1"	"Prosecutors want black judge who criticized incarceration rates of African Americans removed"	"Iberia Parish judge Lori Landry has questioned the large number of black Louisianans incarcerated by the district attorney's office"
"1"	"Texas man claims he nearly died after vicious attack by 'psychotic' cow: report"	"A Texas man who claims he was almost killed by his "psychotic" cow several weeks ago reportedly says he plans to continue caring for her despite sustaining broken ribs and a punctured lung following the latest attack."
"0"	"50 Best Movie Sequels of All Time"	"A successful film franchise can ensure box office earnings like few other movie offerings can."
"1"	"Millions of Americans Are Drinking Water That Is Contaminated Yet Legal: Environmental Working Group Analysis"	""The majority of water systems in the U.S. get a passing grade from the U.S. government," EWG toxicologist Alexis Temkin told Newsweek. But "legal doesn't necessarily mean safe.""
"1"	"New Trump rule to make more health care rates public"	"The hospital industry says it will sue to stop it from taking effect."
"0"	"66 Cool Tech Gifts Anyone Would Be Thrilled to Receive"	"Let's face it: everyone wants the newest, coolest tech gadget on the market, and we don't blame 'em."
"1"	"Health-care system causing rampant burnout among doctors, nurses"	"As many as half of all clinicians suffer from burnout symptoms, creating risks to patients, malpractice claims and absenteeism, a national study finds."
"1"	"A wave crashed over a couple during their beach wedding photo shoot, and now the stunning picture is going viral"	"The couple, who say they met on Tinder, told Insider they would do the photo shoot "all over again in a heartbeat.""
"0"	"Husband of missing woman arrested, booked on murder charges"	"Police in Missouri are searching for a missing woman who was last seen leaving her St. Louis area home on Tuesday."
"0"	"15 Themed Christmas Trees That Will Make You Rethink Your Holiday Decor"	"Break from tradition with a tree designed for you."
"0"	"General knowledge quiz: How many questions can you get right?"	"A new quiz asking players to correctly answer questions on history, culture and science is putting the internet's general knowledge to the test."
"1"	"17 Wacky Things That Are Actually Good for Your Body"	"Everyone knows that diet and exercise lead to better health. But you can do a whole lot more. For proof, just check out these surprising health hacks."
"0"	"Supporting your adult children can ruin your retirement plans"	"Prepare your children early in life to be financially independent. If not, your retirement plan may need to include funding your irresponsible adult child's lifestyle, in addition to funding your own retirement."
"1"	"13 Reasons Why's Christian Navarro Slams Disney for Casting 'the White Guy' in The Little Mermaid"	"13 Reasons Why's Christian Navarro Slams Little Mermaid's Eric Casting"
"1"	"I've been writing about tiny homes for a year and finally spent 2 nights in a 300-foot home to see what it's all about   here's how it went"	"I stayed in a tiny house for three days to see what the fuss was all about, and I was surprised by what I saw."
"0"	"You can now rent a suite in a real-life royal palace on Airbnb, and it comes with a private butler"	"A luxurious suite in the 300-year-old City Palace of Jaipur, India, will be available for booking on Airbnb starting November 23."
"0"	"Celebrity PDA of 2019"	"See the stars kissing and hugging on the red carpet and out and about!"
"1"	"Eric Tse, 24, just became a billionaire overnight"	"A 24-year-old business school graduate has just become an overnight billionaire."
"0"	"Starbucks opens its biggest store ever"	"Chicago just got a major caffeine jolt from Starbucks."
"1"	"Police: Off-Duty Dallas Officer Mistakenly Shoots, Injures Adult Son Thinking He Was An Intruder"	"An off-duty Dallas officer accidentally shot and injured his adult son in DeSoto Saturday evening, police say."
"0"	"Kristen Bell's Cozy Look Is a Lesson in Winter Airport Fashion"	"Kristen Bell wore the coziest sweater dress, combat boots, and wool coat to the airport, and you can shop her outfit at Nordstrom."
"1"	"Scrutiny of vaccine exemptions banishes some from schools"	"Carl and Kerri Schwartz say they have good medical reason for not vaccinating their disabled 11-year-old son, Thorn, and until recently his local public school went along with their family doctor's advice. That changed, the Schwartzes said, when New York state did away with religious exemptions for vaccines in the middle of a measles outbreak, and then clamped down on medical exemptions like theirs."
"1"	"A heartbreaking photo of a dog riding a bus alone went viral, and now people want to adopt her"	"A kennel is seeking the dog's owner. If no one comes forward, she will be put up for adoption."
"1"	"Kelly Ripa Jokes Son Michael Is Experiencing 'Extreme Poverty' in Brooklyn"	"Kelly Ripa Jokes Son Michael Is Experiencing 'Extreme Poverty' in Brooklyn"
"1"	"In manufacturing Midwest, signs of trouble amid good times"	"A Wisconsin town shows the disparate fortunes of global and U.S. consumer markets as the economy starts slowing."
"1"	"Serena Williams Just Wore the Coolest Sneakers with This Affordable Bridesmaid Dress"	"Serena Williams's bridesmaid dress is from Azazie. Find out all of the details here. Plus, see pictures of the champion athlete's daughter in her adorable flower girl outfit."
"1"	"Hong Kong government withdraws bill that sparked protests"	"Secretary for Security John Lee told the semi-autonomous Chinese territory's legislature that the government suspended the bill because it had resulted in "conflicts in society.""
"1"	"This is Why Your Dog Follows You to the Bathroom"	"Ever get the feeling you're being followed? Then odds are, you've got a dog. As for why your canine companion follows you everywhere you go, read on 'cause we got the scoop!"
"0"	"Raise Billions From Billionaires? Tax Experts Say It's Not That Simple"	"One of the signature initiatives of Elizabeth Warren's presidential campaign is a wealth tax that, she says, would pay for many of the programs she proposes."
"0"	"California man convicted of torture-murder dies on death row"	"A 49-year-old inmate convicted of torturing and burning his victim alive has died on California's death row. Prison officials say Spencer Brasure was found unresponsive alone in his San Quentin State Prison cell shortly after midnight Thursday. Officials are awaiting an autopsy to determine the cause of death but say it doesn't appear to be foul play."
"0"	"Impeachment inquiry: White House releases rough transcript of Trump's earlier call with Zelensky"	"Trump spoke with Zelensky in the hours after he won the presidency in April, preceding the July phone call between the two leaders that launched an impeachment inquiry."
"1"	"A Texas mom is going to prison after putting her son through unnecessary medical procedures"	"A Dallas mother made her son go through unnecessary medical procedures throughout the first years of his life, court documents say."
"1"	"Robert Blake's Daughter Speaks Out for First Time About 'Traumatic Childhood' After Mom's Murder"	"Robert Blake's Daughter Speaks Out for First Time"
"1"	"Harry Potter's Childhood Home in England Is Now on Airbnb"	"I think I can die happy now."
"1"	"TobyMac says late son 'had an untamable grand personality,' shares last text exchange"	"TobyMac's 21-year-old son, Truett Foster McKeean, died Wednesday in Nashville. The Christian star released a statement Thursday on the sudden death."
"1"	"World's largest treehouse burns to the ground"	"The entire structure collapsed in less than 15 minutes"
"1"	"This town turned its opioid nightmare into a haunted house. And it's terrifying."	"Witches? Goblins? Nope. The horror of addiction is what scares these folks in Maryland the most."
"1"	"This girl nails the wave pool   then fails the exit spectacularly"	"The wave pool isn't easy, but this girl managed to stay on her board and dismount gracefully. But then watch what happens. Carson Daly shares TODAY's Daly Click."
"0"	"Taylor Swift Rep Hits Back at Big Machine, Claims She's Actually Owed $7.9 Million in Unpaid Royalties"	"Taylor Swift's team responds to Big Machine's denial."
"1"	"Allegations against entertainer Todrick Hall are piling up, from stories of nonpayment to accusations of backlash for reporting sexual assault"	"Todrick Hall became prominent in Broadway musicals, for his friendship with Taylor Swift, and more. Now, accusations against him are piling up."
"1"	"MLB umpire Joe West suing former All-Star Paul Lo Duca for claiming he took bribes"	"Lo Duca, a four-time All-Star made comments on a podcast earlier this year alleging that the longtime umpire had taken bribes from a teammate."
"1"	"Thomas Rhett Gushes Over His Wife Lauren in Heartfelt 7-Year Anniversary Tribute"	"They are also expecting their third child, another baby girl!"
"0"	"A 16-second spasm of violence leaves 2 dead at Saugus High School"	"Two students were killed and three other teens were wounded in a shooting at Saugus High School in Santa Clarita on Thursday morning, authorities said."
"1"	"Meghan McCain confronts Trump Jr.: 'You and your family have hurt a lot of people'"	"Donald Trump Jr., the president's son, defended his family after "View" co-host Meghan McCain suggested they were responsible for the lack of "character" in American politics."
"1"	"Can a Restored Pompeii Be Saved From 'Clambering' Tourists?"	"It's easy to imagine lounging in the garden at the sprawling villa of Julia Felix, a savvy Roman business woman who lived in the ancient Roman city of Pompeii in the first century A.D. There would have been wine to drink, and fresh figs, apricots and walnuts to savor. The warm sea breeze would have blended the dry scent of cypress and bay leaves with the stench of rubbish and excrement from the street, and the gurgle of water in the baths would..."
"1"	"Why I Dropped Out Of An Ivy League College Just 3 Weeks Into Freshman Year"	"At the end of August, I packed my bags and said goodbye to the University ofPennsylvania after having moved into my new dorm as a first-year student onlya couple weeks prior. I came home to Medford, Massachusetts, to shocked familyand friends, everyone wondering where I had gone wrong, including myself.I immigrated to the United States from China at the age of 6 with my motherand a much older brother more than a decade ago, with the primary..."
"1"	"17 Hallmark Movies That Are Totally Worth Watching"	"From festive flicks to cheesy romantic comedies, here are all the best Hallmark movies that are worth watching at least once."
