"0"	"There have already been at least 30 shooting attacks at schools resulting in death or injury in 2019"	"According to data from gun safety group Everytown, there have been at least 30 shooting attacks at schools in 2019 resulting in death or injury."
"0"	"Ford v Ferrari: the forgotten car at the heart of the Le Mans '66 clash"	"The Ferrari-beater you've probably never heard of"
"1"	"Christina Anstead's Anniversary to Ant Proves Life "Has a Funny Way" of Working Out"	"Flip or Flop's Christina Anstead celebrates a special anniversary with Ant Anstead. The couple got married in a secret ceremony and have a baby together."
"1"	"Kelly Ripa responds to backlash over son in 'extreme poverty' joke"	"Kelly RIpa is defending a joke she made about her son on "Jimmy Kimmel Live!""
"1"	"'Old Town Road' becomes the second country single to reach top-selling Diamond status"	"Lil Nas X joins Florida Georgia Line in the country history books."
"0"	"Surviving Santa Clarita school shooting victims on road to recovery: Latest"	"What should have been a normal Thursday spiraled into a nightmare for students and teachers at Saugus High School in Santa Clarita, California."
"1"	"Nicki Minaj gets married and more ICYMI celeb news"	"Nicki Minaj gets married, Lori Loughlin has more legal problems, Joe Giudice speaks out from Italy, more news you might have missed this week."
"0"	"A $15 latte shows how the supply of premium coffee is shrinking"	"The world is flooded with coffee, but it's mostly boring beans. For the hand-crafted, artisanal specialty brews, you have to pay up."
"1"	"Here's how much house flippers actually make"	"The reality shows make it seem like a surefire way to rake in some dough, but is flipping a house truly a royal road to riches?"
"0"	"Meghan Markle and Hillary Clinton Secretly Spent the Afternoon Together at Frogmore Cottage"	"Meghan Markle Invites Hillary Clinton to Her Frogmore Cottage Home"
"1"	"John Legend clarifies his recent Kanye West comments, plus more news"	"John Legend explains what he told Vanity Fair about Kanye West, plus more celebrity news for Oct. 31, 2019."
"1"	"13 Animal Adoptions That Will Melt Your Heart"	"Get the hankies ready and the sound the cute alarms: These touching tales of animal friends will hit you right in the "aww" spot. The post 13 Animal Adoptions That Will Melt Your Heart appeared first on Reader's Digest."
"1"	"Louis Vuitton owner offers $14.5 billion for jeweler Tiffany"	"LVMH has offered $14.5 billion for jeweler Tiffany in a bid that could result in chairman Bernard Arnault's biggest takeover and expand the Louis Vuitton owner's reach into the U.S."
"0"	"Wilson deletes tweet of him standing over concussed Smith-Schuster"	"The fallout from one of the most bitter games in NFL history rages on."
"1"	"3 reasons to invest in real estate, according to a financial planner who owns 10 rental properties"	"Brent Sutherland, CFP, says real estate can diversify your income, produce near-immediate results, and help you become financially independent sooner."
"0"	"U.S. Troops Will Die If They Remain in Syria, Bashar Al-Assad Warns"	"President Donald Trump has said a force of Americans will remain in the east of the country to guard the oil fields there."
"0"	"'Absolutely Terrifying': 3 Students Describe Moments After Shots Rang Out At Saugus High School"	"The three unidentified girls said they ran away as far as they could when they heard gunshots in the quad of Saugus High School."
"1"	"7 Things Smart Parents Do When Dealing With an Angry Teenager"	"Here's what to do when the eye-rolls and outbursts start."
"1"	"Woman Spots Deadly Animal Hiding In Photo Of Her Kids"	"Her unsuspecting children weren't the only ones posing for the pictures."
"1"	"Bartenders share 13 things they'd love to tell customers but can't"	"There are some things that bartenders just won't tell you, even if it's to everyone's benefit."
"1"	"Country Singer Ned LeDoux's 2-Year-Old Daughter Dies After 'Tragic Choking Accident' at Home"	"Ned LeDoux's Daughter Dies After 'Tragic Choking Accident' at Home"
"1"	"30 Ways to Get Creative With Christmas Garland This Year"	"Before you deck the halls, deck out your decor."
"1"	"16 of the Most Historically Inaccurate Movies Ever"	"Facts, schmacts! You won't want to look to Hollywood for history trivia here's why."
"1"	"Strange Dog Shows Up On Woman's Lawn   And Seems To Recognize Her"	"Kate Howard was sitting outside her home one afternoon after a memorial service when something amazing happened."
"0"	"Celebrity beach cruising for 2019"	"See all the stars who hit the beach this year!"
"1"	"Taylor Swift can't shake 'Shake It Off' copyright suit reinstated by federal court panel"	"A federal appeals court panel Monday reinstated a dismissed copyright lawsuit claiming Taylor Swift's "Shake It Off" infringed on an earlier song."
"1"	"Couple Cancels Wedding, Keeps $30K as "Donation" for Honeymoon Instead"	"In a viral Facebook post, a couple announces they're canceling their wedding, but keeping the $30,000 in gifts for a honeymoon instead."
"1"	"27 Amazing Home Upgrades for Every Budget"	"Whether your home improvement budget is $50 or $5,000, these incredible home upgrades are perfect for every style and every price range."
"1"	"9 renovation tips to boost resale value"	"Making the right renovation decisions can help you sell your house quicker, and for more money."
"1"	"A 911 supervisor was streaming Netflix at work when dispatchers mishandled a shooting call"	"A woman in South Florida called 911 after a bullet came through her car's windshield -- but dispatchers didn't send help right away. Police say they mishandled the call while their supervisor was streaming a Netflix movie."
"1"	"A sixth horse dies at Santa Anita since fall meeting started"	"Santa Anita, struggling to regain public confidence with safe racing during its fall meeting, had a sixth horse fatality at the track since Sept. 18 when Bye Bye Beautiful, a 2-year-old filly, broke down on the backstretch Sunday and was euthanized. Bye Bye Beautiful was running in a six-furlong maiden special weight race when she suddenly seemed in distress because of an injury to her front ..."
"1"	"Body of missing Alabama girl found; 2 being charged"	"Investigators searching through garbage found the body of a 3-year-old girl who was missing more than a week, and authorities are charging two people with murder, police said Tuesday."
"1"	"Twitter mocks Sam Darnold over 'seeing ghosts' comment"	"Sam Darnold was the target of some lighthearted mockery after his 'seeing ghosts' made it live on his 'Monday Night Football' matchup with the Patriots' No. 1-ranked defense."
"0"	"'Our entire community is changed forever': CA shooting victims face a new reality"	"Students at Saugus High School in Santa Clarita, California, say they're facing a new reality after a fellow student shot five classmates and them himself Thursday."
"0"	"19 Home Renovations That Give Owners the Most Joy"	"These home upgrades score highly based on how happy homeowners are with them."
"0"	"3 Indiana judges suspended after a night of drinking turned into a White Castle brawl"	"Hours before they were to attend an educational conference in Indianapolis, three judges went out drinking for a few hours and decided to walk to a strip joint."
"1"	"Kevin Spacey Won't Be Charged in Sexual Assault Case After Accuser Dies"	"The Los Angeles County District Attorney's Office has formally dropped a case against actor Kevin Spacey, after the accuser died."
"1"	"A 'one in a million' yellow cardinal, dubbed 'Sunny,' seen in Florida"	"Only three yellow cardinal sightings are reported a year, making the bird's appearance a rare "one in a million" finding, an Auburn professor said."
"1"	"They Woke Up Like This: Celebs' Best Makeup-Free Selfies"	"See the stars (Kesha! Alicia! Kylie!) -- who have shared selfies sans makeup"
"1"	"Father of Atatiana Jefferson takes legal action regarding memorial services for slain daughter"	"This story has been updated with information about next week's scheduled funeral. The father of Atatiana Jefferson has taken legal action to halt her funeral and burial. According to court documents that were signed by a judge Friday, Marquis Jefferson was granted a restraining order against the family. The court order states Marquis has full authority of Atatiana's internment services. Marquis held a news conference Friday evening. During the..."
"1"	"Panera Bread worker fired after TikTok exposed frozen mac and cheese"	"On Friday, the poster said on Twitter that she was fired for the video, showing her place a frozen bag of macaroni and cheese into a vat of hot water."
"1"	"Pregnant Florida woman uses AR-15 to fatally shoot armed intruder"	"Two armed men broke into the house and pistol whipped husband, before wife pulled out their legally possessed weapon and opened fire."
"0"	"17 Biggest Holiday Dos and Don'ts for Your Home"	"Following these holiday decorating tips including dos and don'ts from top professionals will turn any space into a winter wonderland."
"1"	"10 Shelter Dogs Who Saved Their Owners' Lives"	"When you rescue a dog, you never know if you might ultimately be rescuing yourself."
"1"	"Where You Should Definitely Consider Spending Christmas This Year"	"Tempted to skip town for the holidays? Here are a few spots we recommend."
"1"	"Video allegedly shows police officer roughing up 11-year-old girl"	""There's no excuse for the way this girl was treated," the Farmington police chief said."
"1"	"Property Brothers' J.D. Scott Marries Annalee Belle in Vintage Theatre-Themed Wedding"	"J.D. Scott is Married! Third Property Brother Ties Knot"
"0"	"Who is Marie Yovanovitch? Ambassador testifying at the impeachment hearing"	"She was recalled from her post on the orders of the president, who called her 'bad news' in a phone call with his Ukrainian counterpart."
"1"	"Woman found dead in Ohio home was likely killed by her Great Danes, police say"	"An officer responding to a possible overdose found a woman lying on the floor with "numerous" cuts and puncture wounds."
"1"	"7 Surprising Features That Boost Your Home Value"	"You don't need to hire a contractor or do extensive renovations to add value to your home."
"1"	"I never realized I was different until I had to buy a plus-size prom dress"	"Related Slideshow: 15 prom fashion trends that you'll see everywhere in 2019 For my friends and me, shopping for a prom dress was a rite of passage. But apparently I was too big for it."
"1"	"219,000 Lose Power In Massachusetts, Some Schools Closed After Storm"	"More than 200,000 customers lost electricity across Massachusetts early Thursday morning after strong wind and heavy rain brought down power lines and trees overnight."
"0"	"Why Teach Your Dog to Sit, When You Can Teach Them to Make a Sandwich Instead?"	"Man's best friend continues to amaze!"
"0"	"20 Ways You're Not Prepping Your Home for Winter, According to Experts"	"Is your home ready for the snow, ice, and frost? Even if you think you have it all figured out, these are the ways you're not prepping your home for winter."
"1"	"Cornell student, 18, found dead in gorge after frat party, reports say"	"A top Ivy League student was found dead Saturday afternoon in a New York gorge after he left a fraternity party and disappeared Thursday night, according to reports."
"1"	"Why ex-NFL star Kellen Winslow II finally pleaded guilty to sex crimes"	"Ex-NFL tight end Kellen Winslow II struggled between two difficult choices before finally pleading guilty to rape and sexual battery."
"1"	"12 Fall Landscaping Mistakes to Know and Avoid"	"Whether you have a green thumb when it comes to your home garden, or you can hardly tell the difference between a rose and a weed, you should know that there are certain landscaping tasks that need to be done right to keep your home exterior looking its best. But to do that, you must avoid the most common fall landscaping blunders."
"1"	"One Supreme Court case could change the whole way the courts handle abortion cases"	"Perhaps the best outcome of the case June Medical Services LLC vs. Gee, which the Supreme Court will hear this term, will be for the nine justices to abandon the "undue burden" test and get the Supreme Court out of the role of "abortion referee" for all 50 states."
"0"	"RHOA's Cynthia Bailey Supports Daughter Coming Out as Sexually Fluid: 'Her Truth is Her Truth'"	"Cynthia Bailey Supports Daughter Noelle Robinson Coming Out as Sexually Fluid"
"1"	"Hawaii airport and homes evacuated as fast-moving fire hits West Maui"	"A fast-moving blaze is burning near the airport in West Maui, Hawaii, as firefighters scrambled to save nearby homes."
"0"	"Will James Wiseman play for Memphis again? Explaining next steps in NCAA eligibility process"	"James Wiseman and Memphis agreed on Thursday to follow the NCAA's rule of law in determining his eligibility. Here is what that most likely means for the rest of their 2019-20 season."
"1"	"I looked into 'house hacking' to live for free, but there are a few reasons I've decided it's not for me"	"House hacking is where you utilize your primary residence to help you earn income, so you can live for free or drastically reduce expenses."
"1"	"Gastonia, N.C. woman's social media post about stranger's act of kindness goes viral"	"When her tire blew on the highway, Erica Usinger was not sure what to do, stranded on the side of I-85."
"1"	"Millennials are swamped in debt, and it's not just student loans"	"Mortgages are millennials' biggest debts. And nearly as many millennials have a mortgage as undergraduate student loan debt."
"1"	"41 Heartwarming Photos That Will Restore Your Faith in Humanity"	"These true stories might make your heart swell three times bigger."
"0"	"This is it, this is the luckiest break in the history of golf"	"Belgium's Thomas Detry was the beneficiary of one of the all-time luckiest bounces you'll ever see in golf, and maybe all of sports."
"1"	"Duchess Meghan Describes 'Really Challenging' Life as New Royal: I'm Not OK"	"Duchess Meghan Describes 'Really Challenging' Life as New Royal: I'm Not OK"
"0"	"Court puts hold on Rodney Reed's scheduled execution"	"With new, compelling evidence in Reed's case, the call to halt his Nov. 20 execution has been building in recent weeks."
"0"	"Why I'm Done Celebrating The Accomplishments Of Couples"	""What is real? How do you define real?" - Morpheus, The Matrix, 1999 I've had the "summer of six weddings." The "spring of seven baby showers." The "year with nine bachelorette weekends"   not parties, but whole weekends for some reason. And while I could tell tales of the financial strain imposed when a single person celebrates other people for their entire adulthood   and I do serve that tea boiling   instead I want to talk about feelings...."
"1"	"How one student loan strategy drives you deeper into debt"	"A new report from The Pew Charitable Trusts offers key insights when it comes to showing how some college borrowers may end up in default."
"1"	"How to Adopt a Retired Police Dog"	"Help our brave pups in blue track down the perfect forever homes."
"0"	"Our Ultimate Holiday Cleaning Countdown"	"If you're feeling overwhelmed by all the cleaning you have to do before the holidays, let this cleaning countdown be your guide."
"0"	"Week in celebrity photos for Nov. 11-15, 2019"	"Week in celebrity photos for Nov. 11-15, 2019"
"1"	"She Fought for Muslim Women. Then She Was Found Dead."	"Ola Salem was, by all accounts, fearless. As a teenager, she stood up to the managers of an amusement park after she was not allowed on rides because she was wearing a head scarf."
"1"	"Big changes could be in store for student loan borrowers"	"Presidential campaign proposals and recently introduced legislation aim to rewrite the rules around student loan interest, repayment and refinancing. Some of the plans would reduce   or altogether erase   people's balances."
"1"	"Deer fatally attacks hunter who shot him"	"In what officials are calling a bizarre incident, an Arkansas hunter was killed by a deer that he thought he had killed."
"0"	"This Is the Hottest Destination in America for a Road Trip"	"64 percent of Americans want to go on a spontaneous road trip with friends. A Sixt study looked at the most desirable road trip destinations. Buzz60's Sam Berman has the full story."
"1"	"Multiple Houses on Fire After Plane Crashes in NJ"	"At least two houses are on fire in Colonia, New Jersey, after a plane crash, according to the Colonia Fire Department. A Cessna 414 crashed into a home on Berkley Avenue at 11 a.m. Tuesday, according to the FAA. The FAA will conduct an investigation into the cause of the crash. The number of people aboard and their conditions are unknown. The area is a heavy residential area with tree-lined streets. News 4's Dennis Protsko, who is part of the..."
"1"	"26 places most tourists overlook that are worth adding to your bucket list"	"Some of these countries have been long overlooked by tourists simply because of their location near tourist hot spots."
"1"	"Arizona 'Wizard Rock,' missing 1-ton boulder, mysteriously returns"	"Forest officials in Arizona were mystified in October when local landmark Wizard Rock, a 1-ton boulder, suddenly vanished from its position along Highway 89 in Prescott."
"1"	"Tour the 17-Room Inn Named "Most Romantic Hotel in the U.S.""	"Recently deemed the Most Romantic Hotel in the U.S. by USA Today, the Hamilton-Turner Inn has been a fan-favorite getaway for years. Its interior designer, Linn Gresham, gives us a tour of the space in Savannah, GA, revealing what it is that makes the inn so perfect for couples."
"1"	"A man dies in Hawaii after falling into a lava tube in his yard"	"An elderly man died after falling into a lava tube on his property in Hilo, Hawaii, police announced on Wednesday."
"1"	"Liam Payne on Zayn Malik's abrupt 1D exit: 'He didn't even say goodbye'"	"Liam Payne said the group hasn't heard from Zayn Malik since he left One Direction."
"0"	"Abandoned mansions of the world's billionaires"	"From a marble mansion whose owner fled to the extravagant wastelands of Billionaire's Row, take a look inside these abandoned mansions once owned by the world's super-rich..."
"1"	"Four flight attendants were arrested in Miami's airport after bringing in thousands in cash, police say"	"Four American Airlines flight attendants were arrested at the Miami International Airport and charged with money laundering after bringing large amounts of cash into the country, police said."
"1"	"Wisconsin students walk out to protest racial slur firing"	"Students at a Wisconsin high school skipped class Friday and marched through the streets of the state capital to protest the firing of a black security guard who was terminated for repeating a racial slur while telling a student not to call him that word."
"1"	"Keanu Reeves Holds Hands with Artist Alexandra Grant on the Red Carpet"	"Keanu Reeves Holds Hands with Frequent Collaborator and Artist"
"1"	"Dog 'Randomly' Drops By Family Reunion   Then People Check His Collar"	"The other day, Leslie Kowash was at a family reunion in Georgia when a friendly local decided to drop in on the party, seemingly out of nowhere. It was a sweet brown pup   and a rather plump one, at that."
"1"	"These Are The World's Most Magical Christmas Villages to Visit This Year"	"It's the most wonderful time of the year, after all."
"1"	"Police Surprise Woman Who Anonymously Baked Pizzelle Cookies for Years in Heartwarming Video"	"Once the Medford Police learned the identity of the mystery woman who baked for them, AKA the "Pizzelle Lady," they surprised her in this sweet viral video."
"0"	"This stately home is having the ultimate yard sale"	"Nicky Haslam's English country estate, The Hunting Lodge, is filled with precious treasures and almost all of them will be sold at auction next month."
"1"	"MLB bans women who flashed their chests behind home plate during Game 5 of World Series"	"MLB has indefinitely banned two women who flashed their chests on television during the seventh inning of Game 5 of the World Series on Sunday night."
"1"	"Video captures terrifying moment woman slips at Grand Canyon"	"Emily Koford was visiting the national park with her mom when a step backward left her clinging to the rocks."
"1"	"Missing dog reunited with owner 12 years later"	""I'm just so happy to have her back. I cried so many nights without her," Dutchess's owner, Katheryn Strang, said"
"0"	"Colin Kaepernick heads to Atlanta for workout"	"Despite speculation that he might not go through with Saturday's PR stunt, Colin Kaepernick will participate in the NFL's hastily organized workout."
"1"	"Fort Worth shooting: Officers weren't asked to do welfare check. Here's how it changed things"	"When Atatiana Jefferson's neighbor called police, he says he expected them to go check and see if she was OK."
"0"	"Interior designers reveal the 10 decorating rules you should never break"	"The professionals told Insider about the things you should absolutely avoid when decorating any space, from your kitchen to your living room."
"1"	"16 thrill-seeking adventures everyone should have in their lifetimes"	"From skydiving and rock climbing to caving and zorbing, your next extreme adventure is right around the corner."
"1"	"Pennsylvania Woman's Giant Cookie Monster Front Door Display for Trick-or-Treaters Goes Viral"	"Pennsylvania Woman Creates Giant Cookie Monster Front Door Display"
"1"	"TikTok national security inquiry is the latest US show of force on Chinese access to American data"	"The TikTok inquiry stems in part from the dangers the U.S. government perceives from China's access to the app's data and user profiles, a source said."
"1"	"Kyoto's Gion neighborhood cracks down on photography"	"Kyoto's historic Gion neighborhood is banning photography in certain areas in response to ongoing issues with bad tourist behavior."
"0"	"The Hottest Tech Gifts This Holiday Season"	"If you need tech gifts for people on your list this holiday season but don't know what's affordable   while still being useful and maybe even dazzling   consult this list. We've got devices that will please television watchers, music lovers, fitness fans, gamers, neat freaks, and more, as well as smart-home users."
"1"	"Kentucky man dies trying to save sons from Florida rip current during family trip"	"Stephone Ritchie Sr. was on a family vacation in Florida when he died. "He got caught in the waves," after ushering sons out of water, a cousin said."
"1"	"Freshman Georgia Southern offensive lineman Jordan Wiggins dies at 18"	"Georgia Southern freshman offensive lineman Jordan Wiggins has died. He was 18 years old."
"0"	"Home values in these cities have grown the most since the last recession"	"Home values have more than doubled in some places."
"1"	"Daughters stage wedding photo shoot and first dance with dying dad"	""Our hope is that it inspires someone else to be able to take the time to change their perspective of something awful and make it beautiful.""
"1"	"Cows swept away by Hurricane Dorian found alive   but how?"	"A trio of wild cows believed to have been swept away by the storm surge from Hurricane Dorian have been found on a nearby island in North Carolina"
"1"	"Korean Pop Star Sulli Dies at 25"	"Korean pop star Sulli was found dead at her home near Seoul on Monday. She was 25. Her manager found her body and alerted the police. The manager reported that the star, whose real name was Choi Jin-ri, suffered from depression, and police said that they were working on the assumption that she had died"
"1"	"Hackers use e-skimming to hover near online shopping carts"	"Holiday shoppers warned to watch out for e-skimming threats. Any business accepting online payments on their website is at risk, FBI says."
"1"	"At height of crisis, Walgreens handled nearly one in five of the most addictive opioids"	"Federal lawsuit alleges that Walgreens failed to stop opioid diversion as the epidemic spread."
"0"	"The Real Reason McDonald's Keeps the Filet-O-Fish on Their Menu"	"It's something of an underdog story."
"1"	"Opioid epidemic cost U.S. more than $600 billion over 4 years"	"Along with ruining lives, the public health crisis has had a devastating impact on the nation's economy"
"0"	"11 Unique and Quirky Cruise Destinations"	"Venture off the beaten path for an authentic cruising experience."
"1"	"Photo of emotional nurse after 'particularly hard day' goes viral"	"Her sister revealed that she had just wrapped up four days worth of work that included assisting in the delivery of a stillborn baby."
"1"	"Family of slain ISIS hostage says they secretly met with her captors in Iraq"	"Kayla Mueller, a humanitarian worker from Arizona, was held captive, tortured and killed by ISIS."
"1"	"Opinion: Colin Kaepernick is about to get what he deserves: a chance"	"The end may be near for the 3-year-old saga of Colin Kaepernick as the quarterback is scheduled to work out for teams on Saturday."
"0"	"These are the best times to visit New York City"	"The Big Apple, the City That Never Sleeps, Gotham   whatever you call it, New York City is alluring all year round. We might be biased, given the location of our headquarters, but we think it's one of the greatest cities in the country. Between the museums, the parks, the red-hot restaurant scene and the …"
"1"	"Gretchen Wilson booted from New Mexico hotel"	"Gretchen Wilson railed against the hotel after getting kicked out for noise."
"1"	"Nurses face an epidemic of workplace violence"	""I got punched in the face," said one emergency room nurse, while others worry for their safety"
