"0"	"This 'new' strain of HIV is actually a good thing"	"For starters, the "new" strain is… not new."
"1"	"Wedding shooter may have been avenging late stepfather's murder, authorities say"	"Brandon Castiglione, the groom's son, was previously charged with second-degree murder in the death of the suspect's stepfather."
"1"	"A 13-year-old murder suspect who escaped in North Carolina is back in custody"	"A 13-year-old murder suspect who escaped from officers following a court appearance in the North Carolina city of Lumberton this week is back in custody, officials said Wednesday."
"0"	"Halle Berry Shares Photo of 6-Pack Abs on Instagram and Her Fans are Freaking Out"	"The 53-year-old star worked hard for those washboard abs while training for her new movie, "Bruised.""
"0"	"A $30,000 handbag. A disastrous wine spill. And now, a country club is suing its own waiter."	"The pink Hermès Kelly clutch was worth $30,000, a lawsuit says. But it was soiled at a "very, very, very rich country club.""
"0"	"Prince Harry and Meghan Markle Will Reportedly Visit Oprah While in California"	"During their six-week break from their royal duties, Prince Harry and Meghan Markle are planning to visit Oprah Winfrey, according to a royal insider."
"1"	"17 photos that show the ugly truth of living in a tiny house"	"From cramped lofts that are hard to access to small appliances, this is what it's really like to live in a tiny house."
"1"	"Here's Every Soup Recipe You'll Ever Need"	"If you're craving a cozy bowl of soup, chili or chowder, you're in the right place. We rounded up all of our favorite recipes. Now, pass the crackers, please!"
"0"	"2009 CMA Awards fashion flashback"	"See what the stars wore to the Country Music Association Awards 10 years ago."
"0"	"Tamron Hall Talks Leaving the Today Show, Jokes About Megyn Kelly's Reported Multimillion Payout"	"Tamron Hall Talks Losing the Today Show"
"0"	"Arkansas town renames a bridge after Maleah Davis"	"Red Lake Bridge will now be known as Maleah Davis Memorial Bridge."
"0"	"Steph Curry seems to have added Michael Jordan to his list of haters"	"M.J. may have made an enemy."
"0"	"2020 Democratic Voters Divided Down Demographic Lines"	"As Democratic voters assess their choices for the 2020 presidential nominee, they are dividing into clear groups by ideology, race and other personal qualities. As a result, three candidates are dominating the primary contest."
"1"	"Charles Rogers, former Michigan State football, Detroit Lions star, dead at 38"	"Charles Rogers, the former Michigan State football star whom the Detroit Lions selected with the second overall pick in 2003 NFL draft, has died."
"0"	"30 hot new design trends landing in 2020"	"Discover 2020's biggest interior trends"
"0"	"Lawmakers spar over impeachment witnesses as probe enters public phase"	"Democrats on Sunday dismissed GOP efforts to call the anonymous whistleblower and Hunter Biden."
"1"	"Pregnant Mom of 2 Who Was PTA President Is Killed After Going Outside to Check Car Alarm"	"Pregnant Mom of 2 Killed After Going Outside to Check Car Alarm"
"0"	"John Travolta Shares Rare Photo of Son Ben, 8, in Plane Cockpit: He's 'Taking My Place!'"	"John Travolta Shares Rare Photo of Son in Plane Cockpit"
"1"	"Queens boy, 14, shot dead playing hoops in South Jamaica housing project"	"A 14-year-old Queens boy was shot dead Saturday on the basketball court of a NYCHA project in South Jamaica, police said. Cops responded around 8 p.m. to the court behind 116-80 Guy R. Brewer Blvd. in the Baisley Park Houses and found the teen with a gunshot wound to his neck. Neighbors and the boyfriend of the teen's mother identified him as Amir Griffin. A woman who lives in the project and declined to give her name heard gunfire. "It's...""
"0"	"Luxury rentals only the superrich can afford"	"The world's costliest luxury lettings come with eye-watering rents only a billionaire could contemplate   mere millionaires need not apply."
"1"	"10 more bodies found at mass grave in Rocky Point, bringing total to 58, officials say"	"The Mexican state of Sonora's Attorney General's office announced Saturday that it had discovered 10 additional bodies buried in Rocky Point."
"0"	"Meghan Markle Chose a Chic Black Ensemble for Remembrance Sunday Services"	"She paired her outfit with a bold hat and a crimson poppy pin."
"0"	"Gabbard Lawyers Demand Clinton Retract 'Defamatory' Russian Asset Comments"	"Gabbard received bipartisan criticism over her foreign policy, especially her view that Syria's Bashar al Assad is "not an enemy" of the U.S."
"0"	"The most common turkey mistakes and how to avoid them"	"These turkey buying, roasting and carving mistakes can make or break your Thanksgiving dinner; here are turkey cooking tips and tricks for beginners."
"0"	"Number of $1 million retirement nest eggs hits a new high"	"The number of Fidelity 401(k) plans with a balance of $1 million or more jumped to a record 200,000 in the third quarter of 2019, while the number of IRA millionaires also increased to an all-time high of 182,400."
"0"	"Miranda Lambert Is at a 'Comfortable Place' After She 'Struggled with Ups and Downs in Weight'"	"Miranda Lambert has "struggled" with her weight and body insecurities for her "whole life"   but the country singer is finally feeling good about herself."
"0"	"35 musicians you should see live at least once in your life"	"If you have a chance to see these musicians live, you absolutely need to take the chance and grab a ticket."
"0"	"Widow Sues Truth Aquatics Owner In Conception Boat Fire That Killed 34"	"The widow of a man who died in when a dive boat caught fire off the Santa Barbara coast and left 34 people dead is suing the vessel's owners."
"0"	"Broadway Actress Laurel Griggs Dies at Age 13"	"Broadway star Laurel Griggs has died, according to multiple reports. She was 13."
"1"	"Two teenage girls missing from Kansas City, Missouri"	"Police are looking for two teenage girls who are missing from Kansas City, Missouri. 14-year-old Ava Armato and 15-year-old Dani Pandolfi haven't been seen since early Saturday morning. Sign up for our Newsletters Family members tell us the girls left a home with a male friend at 4:30 a.m. That friend reportedly dropped the girls off at the Gladstone Walmart, off NE 72nd Street, at 11:00 a.m. Ava has reportedly dyed her hair brown."
"1"	"Adele Has Been 'Incredibly Dedicated' to Her New Workout Routine: Source"	"Adele Is 'Incredibly Dedicated' to Her New Workouts: Source"
"0"	"Speed Camera Photos Help Man Get His Stolen Bike Back"	"... but not how you probably think."
"1"	"A Russian professor was pulled from a river. Police said a woman's arms were found in his rucksack"	"Russian law enforcement agencies are questioning a prominent historian over the death of a former student in the city of St. Petersburg, in a case that has grabbed headlines across the country."
"0"	"Pensions Venture Into Risky Corners of the Market in Hunt for Returns"	"Some pension-fund managers are venturing further into unusual investment territory as this year's plunge in bond yields makes it even harder to find decent long-term returns."
"0"	"Here's What It Means If You Have Ridges on Your Nails"	"They don't make for the prettiest of manicures, but are they something more than a cosmetic problem?"
"1"	"Multiple Houses on Fire After Plane Crashes in NJ"	"At least two houses are on fire in Colonia, New Jersey, after a plane crash, according to the Colonia Fire Department. A Cessna 414 crashed into a home on Berkley Avenue at 11 a.m. Tuesday, according to the FAA. The FAA will conduct an investigation into the cause of the crash. The number of people aboard and their conditions are unknown. The area is a heavy residential area with tree-lined streets. News 4's Dennis Protsko, who is part of the..."
"0"	"C8 Corvette Dyno Test Follow-Up: What Really Happened"	"Key parameters were botched, but the C8's still plenty powerful"
"0"	"30 home trends that ruled the last decade"	"From velvet sofas to Edison light bulbs, these home design trends have dominated our interiors over the last 10 years! Let's see how many you've adopted..."
"1"	"What Causes Vertigo? 15 Things Doctors Wish You Knew"	"The spinning, dizzying loss of balance that indicates vertigo can come without warning."
"0"	"Man cuffed for eating sandwich on train platform gets an apology"	"Bay Area Rapid Transit was slammed for its handling of a man who was handcuffed and cited for eating a sandwich"
"0"	"Just Try Not Going Back for Seconds of This Over-the-Top Cabbage Gratin"	"Waistline be damned, this is the holidays we're talkin' about!"
"1"	"Jeremy Roloff Vows to Pay More 'Attention' to His Health After Undergoing Hernia Surgery"	"Jeremy Roloff Reveals He Had Surgery for a Hernia"
"0"	"Republicans Argue Impeachment Case Falls Short of Proving Trump Misconduct"	"House Republicans on Saturday offered the latest glimpse of their strategy to fight against impeachment by demanding testimony from figures at the center of President Trump's favorite unsubstantiated theories: the son of former Vice President Joseph R. Biden Jr., a researcher loosely connected to an anti-Trump dossier, a Democratic official and a board member of a Ukrainian energy company. Rather than shy away from conspiracies that..."
"0"	"Megyn Kelly Is Back to Work! Details on Her New Job"	"The journalist returned to work less than a year after leaving NBC."
"0"	"Hey, Millennials, look out below! Gen Z may already be catching up in the salary race"	"Gen Zers are closing the pay gap with millennials even though they have far less experience. They're making the most of a tight labor market."
"0"	"Kaia Gerber Attends Pete Davidson's Comedy Show in Brooklyn"	"Kaia Gerber Attends Pete Davidson's Comedy Show in Brooklyn"
"1"	"Homeless woman living in SUV with dogs moves into apartment with community's help"	"Two friends in suburn Philadelphia reached out to residents via the Nextdoor app to get food and housing for a former pharmacist with health issues living in an SUV."
"1"	"Family Reunited With Dog Who Had Been Missing Since August While Waiting in Line to Adopt Cat"	"As soon as the family called out to their dog, Dopey ran over and began "covering them with kisses.""
"0"	"What Is a Sleep Divorce and Should You Get One?"	"It might actually *help* your relationship."
"0"	"Report: Ohio State asks NCAA to reinstate star DL Chase Young immediately"	"The NCAA still has not made its final ruling on Young's penalty as the regular season reaches its final weeks."
"0"	"Police searching park with bloodhounds for missing woman"	"Authorities are using bloodhounds to search a Staten Island park in the hunt for a New Jersey woman who has been missing since October."
"1"	"Frustrated Antonio Brown has active morning on Twitter"	"Receiver Antonio Brown continues to wait for his next opportunity, and he continues to be justifiably frustrated by the fact that the NFL's slow-moving investigation is essentially keeping Brown suspended without pay."
"0"	"Firefighters who saved house leave milk 'apology'"	"They saved a New South Wales home - then apologised to the owner for taking milk from the fridge."
"0"	"25+ Quick Instant Pot Recipes Ready in 30 Minutes (or Less!)"	"Put a meal on the table in record time. The post 25+ Quick Instant Pot Recipes Ready in 30 Minutes appeared first on Taste of Home."
"0"	"18 Ingredients Nutritionists Say Should Be Banned From Your Kitchen"	"Experts say that these cooking and baking essentials are weight loss saboteurs in disguise."
"0"	"AP: Thousands face life-threatening floods from aging dams"	"On a cold morning last March, Kenny Angel got a frantic knock on his door. Two workers from a utility company in northern Nebraska had come with a stark warning: Get out of your house. Just a little over a quarter-mile upstream, the 92-year-old Spencer Dam was straining to contain the swollen, ice-covered Niobrara River after an unusually intense snow and rainstorm."
"0"	"55 Best Outdoor Christmas Decorations to Get Your Yard in the Spirit"	"They're the festive touches your porch and yard need."
"0"	"Bishop who investigated sex abuse accused of sex abuse"	"A Roman Catholic bishop named by Pope Francis to investigate the church's response to clergy sexual abuse in Buffalo, New York, has himself been accused of sexual abuse of a child, an attorney for the alleged victim notified the church this week."
"1"	"Watch: 'The View' Versus Donald Trump Jr.: Loud, Low Blows, Politics, Scandals And Great TV"	"Updated throughout, videos added Whoopi Goldberg wouldn't say his name, Sunny Hostin said he was lying, Abby Huntsman accused him of using "dictator" tactics. And Donald Trump Jr. gave it back, accusing Joy Behar of once wearing blackface and resurrected Goldberg's defense of Roman Polanski as not committing "rape rape," all in a"
"0"	"Air Quality Index: What to do when the air quality is bad in your area"	"How to protect yourself from unhealthy or hazardous air pollution."
"0"	"35 Christmas Tree Decorating Ideas You Haven't Seen Before"	"We've got you covered with these tree-trimming tips."
"0"	"Report: Election vendors are 'prime targets,' need oversight"	"The private companies that make voting equipment and build and maintain voter registration databases lack any meaningful federal oversight despite the crucial role they play in U.S. elections, leaving the nation's electoral process vulnerable to attack, according to a new report."
"0"	"This Sturdy Cutting Board Will Last for a Lifetime and It's On Super Sale Right Now"	"It also makes the perfect holiday gift."
"0"	"Buffalo Wild Wings reopens after manager is killed in chemical accident"	"The Buffalo Wild Wings in Burlington reopened late Saturday morning after its general manager died Thursday evening in an accident involving cleaning chemicals, according to restaurant representatives. Ryan Baldera, 32, was overcome by the fumes and died after being rushed to Lahey Hospital, according to the Burlington Fire Department. Sign up for our Newsletters Representatives of the Buffalo Wild Wings told Josh Brogadir, of NewsCenter 5, that..."
"0"	"Fashion hits and misses from the 2019 Country Music Association Awards"	"From Nicole Kidman to Pink, see the best and worst dressed stars at the 2019 Country Music Association Awards."
"0"	"Man At Large After Allegedly Attempting To Run Down Officer After Calif. Pursuit"	"A man remains at large after allegedly leading officers on a pursuit in Southern California, which ended in a cul-de-sac before the suspect reportedly drove toward officers prompting one to open fire."
"0"	"'Stay alert': millions of Australians brace for 'catastrophic' bushfires"	"'Stay alert': millions of Australians brace for 'catastrophic' bushfires"
"1"	"Missing New Hampshire couple's bodies found buried on a Texas beach"	"James and Michelle Butler had been camping in their RV along the South Texas coast when they went missing in mid-October."
"0"	"How Russia Meddles Abroad for Profit: Cash, Trolls and a Cult Leader"	"The Russians were hard to miss. They appeared suddenly last year in Madagascar's traffic-snarled capital, carrying backpacks stuffed with cash and campaign swag decorated with the name of Madagascar's president."
"0"	"US government says Roger Stone 'undermined' Russia inquiry"	"Republican political operative Roger Stone undermined the effectiveness of the congressional investigation into Russian interference in the 2016 election by repeatedly and deliberately lying under oath to help Donald Trump's presidential campaign avoid embarrassment, prosecutors told jurors in closing arguments at his trial Wednesday. Defense attorneys countered that Stone had done nothing deliberately illegal and claimed the..."
"1"	"Authorities believe 'foul play' involved in UFC star's missing stepdaughter"	"Blanchard, a student at Southern Union State Community College in Wadley, was reported missing by her family on Oct. 24."
"0"	"Bucket-List Food Experiences in Every State"	"America offers foodies a mega-mosaic of cuisines to explore state by state. These unique favorites provide interesting insights and tastes of the local culture. Reindeer hot dogs, persimmon pudding, Rocky Mountain oysters (which don't come from the sea), and pig ear sandwiches are just some of treats to hunt down."
"0"	"A master suite with an 'open-concept' bathroom that has no doors   or privacy   is asking for $1,200/month in rent"	"People took to Twitter to share confusion about an "open-concept" bathroom featured in a Facebook rental listing."
"0"	"Memphis declares James Wiseman ineligible while it works toward resolution with NCAA"	"James Wiseman withdrew his lawsuit against the NCAA, indicating a settlement could be in the works."
"1"	""I was a passport to this man": Child marriage loopholes persist in U.S."	""Our immigration laws shouldn't be used to encourage child marriage," said Senator Tom Cotton"
"0"	"French Baguettes From a Vending Machine? 'What a Tragedy.'"	"The lights inside the village bakery used to come on before dawn, an hour or so before the smell of baking bread would waft into neighbors' homes. The storefront door would soon be heard, opening and closing, the rhythm as predictable as the life stirring awake across the French countryside. But everything changes."
"0"	"Guaido backers enter Venezuela embassy in Brasilia, sparking standoff"	"Supporters of Venezuelan opposition leader Juan Guaido gained access to the country's embassy in Brasilia on Wednesday morning, leading to a standoff with backers of leftist President Nicolas Maduro, according to diplomatic representatives."
"1"	"West Hollywood school administrator embroiled in college admissions scandal pleads guilty"	"The administrator of a small West Hollywood school where the rich and powerful went to rig their children's college entrance exams pleaded guilty in a Boston courtroom Wednesday to conspiracy to commit racketeering."
"0"	"Trump campaign raises $3.1M on first day of impeachment hearings"	"President Trump's reelection campaign announced that on Wednesday it raised over $3.1 million in donations   the same day as the first public hearing of the House's impeachment inquiry into Trump."
"0"	"Hannah Brown on Being Surrounded By Exes Tyler Cameron and Colton Underwood"	"ET spoke with the former Bachelorette after 'Dancing With the Stars' on Monday."
"0"	"Owner shocked after his 60s Porsche roadster gets stolen from classic car show in Pleasanton"	"Since 1983, thousands of car lovers have come from all over to the Goodguys Rod & Custom Association shows, never dreaming their antique collector's items would be stolen."
"0"	"Americans now have a record $14 trillion in debt"	"US households are now sitting on a record $14 trillion in mortgages, credit cards, student loans and other forms of debt."
"0"	"Rip Taylor's Cause of Death Revealed, Memorial Service Scheduled for Later This Month"	"The comedian died at the age of 84 last month."
"1"	"New Report Exposes Dolphin Cruelty in Travel Industry"	"Behind the Smile says unsuspecting tourists are fueling a multibillion-dollar industry while travel companies reap the rewards."
"0"	"How to Turn Getting Kicked Off an Overbooked Flight Into a Payday"	"Overbooked flights and people being kicked out are now a common headline. Luckily, there are some ways you can be compensated for this. Veuer's Johana Restrepo has more."
"1"	"Queen's Speech in Parliament: Black Rod, hostage-taking and a gold stick"	"Even by British standards, the pomp and pageantry of the State Opening of Parliament is off the scale."
"0"	"Big celebrity money moments of the last decade"	"From bankruptcy filings and huge paydays to reaching billionaire status, read up on the most fascinating money news involving the stars from 2010 to 2019."
"0"	"2019 People's Choice Awards fashion hits and misses"	"See all the best and worst dressed stars at the 2019 People's Choice Awards."
"1"	"Miguel Cervantes' Wife Reveals Daughter, 3, 'Died in My Arms' After Entering Hospice Care"	"Miguel Cervantes' Wife Reveals Daughter 'Died in My Arms' After Hospice Care"
"0"	"Justices take up high-profile case over young immigrants"	"The Supreme Court is taking up the Trump administration's plan to end legal protections that shield 660,000 immigrants from deportation, a case with strong political overtones amid the 2020 presidential election campaign."
"1"	"Kate Middleton's brother James says he's 'had enough of big weddings' ahead of his marriage to his French fiancée"	"His sister the Duchess of Cambridge had a somewhat grand ceremony for her marriage to Prince William in 2011."
"0"	"Alexis Crawford: Clark Atlanta student filed a police report on unwanted kissing before she vanished"	"A Clark Atlanta University student who was found dead in a park had filed a police report describing unwanted kissing and touching days before she went missing, authorities said."
"0"	"These Two New Oreo Flavors Are Coming in 2020 and We're OBSESSED"	"These new Oreo flavors are just what we were craving and we didn't even know it!"
"0"	"Here's how much it will cost to travel to Africa like Meghan Markle and Prince Harry"	"The travel company Classic Escapes is offering a package that promises a 10-day trip throughout South Africa, full of the same cultural and philanthropic pit stops Prince Harry and Meghan, Duchess of Sussex, made this September."
"1"	"Rip Taylor's Cause of Death Revealed, Memorial Service Scheduled for Later This Month"	"The comedian died at the age of 84 last month."
"0"	"97-year-old WWII veteran takes ride in B-17 bomber for Veteran's Day"	"A World War II veteran celebrated Veteran's Day by taking a flight to yesterday -- in an aircraft that first saw combat at the time of his service."
"0"	"Photos of Celebrities at the Airport Are Here to Inspire Your Holiday Travel Style"	"Even the rich and famous aren't spared the most annoying place in the world: the airport."
"0"	"People Pull Together To Save A Frightened Dog Loose On Highway"	"What began as a frightening predicament for a poor pup trapped on a busy roadway in the end revealed something truly special: Humanity at its finest. Twitter/TobyTinelli On Sunday, Toby Tinelli and his wife were driving on a highway in Houston, Texas, when they suddenly spotted a dog loose and scared among the cars. Without hesitating, all the drivers around Tinelli made the dog's well-being their top priority   forming a protective blockade..."
"0"	"Stars who've had more than one wedding with the same spouse"	"See which celebs exchanged vows with their significant others more than once."
"0"	"Luhnow says Astros 'try and follow the rules' amid sign-stealing inquiry"	"On Tuesday, Houston Astros general manager Jeff Luhnow addressed allegations that his team used technology to illegally steal signs during the 2017 season."
"0"	"45 Abandoned Places Around the World That Are Eerily Beautiful"	"It's okay to be awed and creeped out at the same time."
"0"	"50 Ways Thanksgiving Foods Have Changed in the Last 50 Years"	"What's considered traditional Thanksgiving food has changed a lot over the years. From new sides to old recipes, see how Thanksgiving has evolved."
"1"	"Soldier wounded searching for Bergdahl dies"	"Allen's unit was ambushed when they were looking for Bergdahl after he deserted his base in 2009"
"0"	"30+ Elegant White Rooms To Inspire Your Own Home Decor"	"Be awed time and time again by this sophisticated color scheme."
"1"	"Two dead following explosion involving 18-wheeler in Texas"	"The multi-vehicle crash occurred in the northbound lanes, the Denton Police Department said."
"0"	"A teen received a response to a message in a bottle he wrote 9 years ago after it traveled over 3,000 miles"	"The bottle, which was placed into the ocean on a beach in Rockport, Massachusetts, was found off the coast of France."
"0"	"Last known Pearl Harbor survivor in Mass. dies at 98"	"Massachusetts' last known survivor of the Japanese attack on Pearl Harbor that drew the United States into World War II died Tuesday at 98."
"0"	"Miranda Lambert Is Pretty in Pink at 2019 CMA Awards With Husband Brendan McLoughlin"	"Simply stunning!"
"0"	"'Baby Trump' balloon slashed at Alabama appearance"	"TUSCALOOSA, Ala. (AP)   A towering "Baby Trump" protest balloon was knifed and deflated by someone unhappy with its appearance during President Donald Trump's Saturday trip to Alabama, organizers said."
"0"	"3 awful reasons to take Social Security benefits at 65"	"If these are the reasons you're claiming benefits at 65, you may want to rethink that decision."
"0"	"Case of the stolen lemur: man who took animal from US zoo wanted a monkey"	"This week the FBI released more details of the investigation into the brief 2018 abduction of Isaac, a 33-year-old ring-tailed lemur"
"1"	"2-year-old shot dead in Philadelphia day after 11-month-old shot 4 times"	"A 2-year-old child was shot and killed one day after an 11-month-old was shot four times."
"0"	"Thanksgiving side dishes: 11 unique recipes to try this season"	"While there will always be dishes you're unwilling to leave off your table, consider changing it up with these unique Thanksgiving side dishes."
"1"	"Feds take down the world's 'largest dark web child porn marketplace'"	"Prosecutors say the vast on-line store was run by Jong Woo Son, currently serving a prison sentence in South Korea on charges related to child pornography."
"1"	"24 Cozy Pies & Cobblers Perfect for Fall"	"Hello, glorious pie season!"
"0"	"Model, 23, Didn't Know She Was Pregnant Until She Gave Birth to a Full-Term Baby in Her Bathroom"	"An Australian model recently had a life-changing surprise when she gave birth to a baby in her bathroom, despite not knowing that she had been carrying her daughter for nine months."
