"0"	"This 'new' strain of HIV is actually a good thing"	"For starters, the "new" strain is… not new."
"1"	"Boxer Patrick Day dies after suffering traumatic brain injury in super welterweight fight"	"Boxer Patrick Day, 27, died on Wednesday after being knocked out against Charles Conwell on Saturday. He had surgery and had been in a coma."
"0"	"China's pork crisis is bigger than you think"	"African swine fever in world's second largest economy has shaken global meat markets, reports Tanner Brown."
"0"	"The Top Thanksgiving Recipe from Every State"	"From Buckeyes to blackberry muffins, see what dish is perfect for every state's Thanksgiving dinner. (Or just borrow another state's recipe.)"
"1"	"Lorde Pens Emotional Letter After Her Dog Pearl's Death: 'I Have Lost My Boy'"	"Lorde Pens Emotional Letter After Her Dog Pearl's Death"
"0"	"Do not try this at home: How to turn $3,000 into $1.7 million"	"Reddit's Wall Street Bets group learned a valuable lesson in responsible investing this week and, after years of encouraging and celebrating extreme risk-taking, the crew has finally embraced a more conservative approach. Just kidding. YOLO!"
"0"	"Demi Lovato debuts new boyfriend, plus more celeb love life news for mid-November 2019"	"Anna Faris seemingly confirms engagement rumors, JWoww and boyfriend aren't back together after all, Porsha Williams admits fiancé cheated and more."
"0"	"Here are the best cruise lines for families, couples and those on a budget"	"U.S. News & World Report released its annual ranking of cruise lines, taking into account multiple factors, including amenities, cost and family-friendly features."
"1"	"Flames' Brodie collapsed, started convulsing at practice"	"A scary incident occurred at Calgary Flames practice on Thursday."
"1"	"Mariah Carey's biggest career moments"	"Celebrate the anniversary of Mariah Carey's Rainbow album with with a look back at her biggest career moments."
"0"	"Aston Martin DBX Luxury SUV: Price, First Interior Image Released"	"Take your first peek inside Aston Martin's first-ever SUV, but brace yourself for the cost."
"1"	"A heartbreaking photo of a dog riding a bus alone went viral, and now people want to adopt her"	"A kennel is seeking the dog's owner. If no one comes forward, she will be put up for adoption."
"0"	"Judge includes law student's toddler during sweet swearing-in ceremony"	"When Juliana Lamar was sworn in as an attorney, the judge made sure to include her 1-year-old son."
"0"	"Nutritionists share their favorite packaged foods for quick meals"	"Dinner is about to get a whole lot easier."
"1"	"'My heart fell in love!' Heartwarming moment adopted girl and her mother discuss meeting"	"This is the beautiful moment when precious little girl Gabby started talking to her mother about the first time they met when she was adopted. Gabby started to explain to her mom what happened to her heart the first time she met them. "Well when we were born we became two little babies and then Lily was still a baby and I was 4 years old! I got so big and Lily was still a baby!" exclaimed the adorable girl, who now lives in the US with her family. "And when the time you saw me I was four years old! And we were very excited to see you and our daddy. And we love you guys and we want to be here for you and daddy," she explains further. "Do you know what happened to my heart? Well, when the first time I saw you my heart fall in love with you!" said the little girl in the precious moment from September 26."
"0"	"There have already been at least 30 shooting attacks at schools resulting in death or injury in 2019"	"According to data from gun safety group Everytown, there have been at least 30 shooting attacks at schools in 2019 resulting in death or injury."
"0"	"Rep. Ilhan Omar is accused of 'dog whistle' anti-Semitism after she posts tweet implying billionaire businessman Leon Cooperman is only supporting Michael Bloomberg's presidential run because he is Jewish"	"Rep. Ilhan Omar came under fire on Saturday for sharing a tweet revealing billionaire Leon Cooperman will back Michael Bloomberg's 2020 bid and allegedly implying it's because he is Jewish."
"0"	"Opinion: Don Cherry's popularity with his fans couldn't save him this time from anti-immigrant remark"	"Hockey Night in Canada analyst Don Cherry was popular with fans but also made comments that came across as xenophobic. The latest got him fired."
"0"	"15 Themed Christmas Trees That Will Make You Rethink Your Holiday Decor"	"Break from tradition with a tree designed for you."
"0"	"America's best inexpensive steakhouses"	"Most steakhouses are far outside most people's price range, but there are plenty of steakhouses that are downright affordable."
"1"	"Jessica Simpson 'Relieved' After Daughter Maxwell and Son Ace Recover From Illness"	"See the famous mama's new sweet post."
"1"	"American families fleeing Mexico arrive in Arizona days after cartel massacre"	"A caravan of Mormon families fleeing Mexico following this week's drug cartel ambush that killed nine Americans crossed into Arizona on Saturday."
"0"	"T-Mobile CEO John Legere in talks to take over top job at WeWork"	"T-Mobile and Sprint are hoping to complete their merger soon. But the man positioned to head that new company is in talks to lead another major undertaking: a rescue mission for WeWork."
"0"	"Jess Lost 75 Pounds Without Counting Calories and Did This 1 Inspiring Thing Before Every Meal"	"Jess Dukes makes a list of her "whys" and reads them before every meal and every workout."
"0"	"The 24 Most Beautiful Castles in Europe"	"Eat your heart out, Disney."
"0"	"Rape victim rejects judge's offer: $150,000 for her, reduced sentence for attacker"	"A Louisiana judge asked a rape survivor if she would consider a $150,000 restitution payment from her attacker. She refused, saying the attack has left her "broken.""
"0"	"Boeing stock soars: It still thinks 737 Max will fly next month"	"Boeing still believes it can get permission before the end of this year to fly the 737 Max again."
"0"	"The son of a Chinese billionaire has been banned from flying first class, playing golf, buying property, or going clubbing"	"Wang Sicong, the heir of Chinese real estate mogul Wang Jianlin's estimated $12.5 billion fortune, is said to have a personal debt of $21.6 million."
"0"	"For the Most Even Seasoning, Use a Spice Strainer"	"Having a dedicated spice sieve among your kitchen tools means that every spice mix you ever deploy will be perfectly distributed."
"0"	"San Francisco's new DA pledges not to prosecute public urination, other quality-of-life-crimes"	"San Francisco's newly elected district attorney has promised to not prosecute public urination and other quality-of-life crimes that have plagued the highly-priced Bay Area amid a crippling homelessness crisis affecting urban communities across California."
"0"	"Evo Morales of Bolivia Accepts Asylum in Mexico"	"Evo Morales, the former president of Bolivia who resigned under pressure from street protests and the military, was granted asylum in Mexico on Monday, departing from the country at a time when it is deeply polarized and leaderless."
"0"	"SEMA 2019 Photo Highlights From Las Vegas"	"Photographic Highlights from the 2019 SEMA Show in Las Vegas.… The post SEMA 2019 Photo Highlights From Las Vegas appeared first on autoNXT.net."
"1"	"At height of crisis, Walgreens handled nearly one in five of the most addictive opioids"	"Federal lawsuit alleges that Walgreens failed to stop opioid diversion as the epidemic spread."
"0"	"Gwen Stefani's biggest career moments"	"Relive the career highs and lows that made Gwen Stefani the music star she is today."
"0"	"The European Travel Experience Most People Don't Know About"	"You've heard about ship cruises and river cruises, but barge cruises just might be the best way to experience Europe. The post The European Travel Experience Most People Don't Know About appeared first on Reader's Digest."
"0"	"Cheering crowds greet Japan's new emperor in rare parade"	"Thousands of people gathered in Tokyo on Sunday ahead of a rare open-top car parade featuring newly enthroned Emperor Naruhito and Empress Masako, with heavy security in place for the event."
"0"	"How Celebs Are Dressing for Winter In New York, On a Scale of Kaley Cuoco to Kanye"	"The past 24 hours have been a wild ride, fashion-wise, in NYC."
"0"	"Taliban to release 2 professors in prisoner swap"	"Kevin King, a U.S. citizen, and Timothy Weeks were kidnapped at gunpoint from the American University of Afghanistan in Kabul in August 2016."
"0"	"'Unthinkable': Accused killer of Georgia college student Alexis Crawford spent holidays with victim's family"	"Jordyn Jones and boyfriend Barron Brantley were being held at Fulton County Jail on murder charges in the death of Alexis Crawford, Jones' roommate."
"1"	"El Chapo's son led dramatic rescue of his half brother in Mexico battle"	"Ivan Archivaldo Guzman, the leader of Los Chapitos wing of the Sinaloa Cartel, was behind the assault on security forces that prompted the release of his half-brother from a house in the city of Culiacan last week, a top Mexican official said."
"1"	"They Crossed an Ocean to Butcher Pigs. It Was No American Dream."	"Anthony Pretrick was scraping by as a fisherman in his Pacific island homeland of Micronesia when he met a job recruiter with an irresistible offer:"
"0"	"'Priceless' finds that turned out to be worthless"	"From a bottle of rare Scotch whisky to a fake Picasso painting, we take a look at items from around the world that were believed to be highly valuable... but turned out to be worthless."
"1"	"Strange Dog Shows Up On Woman's Lawn   And Seems To Recognize Her"	"Kate Howard was sitting outside her home one afternoon after a memorial service when something amazing happened."
"0"	"Stars turning 70 in 2019"	"Seventy and sensational! Join us as we celebrate the stars who were born in 1949."
"0"	"Miley Cyrus Undergoes Vocal Cord Surgery, Will Require Weeks of Silence to Recover: Sources"	"Miley Cyrus Undergoes Vocal Cord Surgery: Sources"
"0"	"Husband, 106, and wife, 105, are named world's oldest living couple"	"John Henderson joked that that secret to their longevity could be never having kids."
"0"	"The Sexiest Photos Ever of Our 29 Sexiest Men Alive"	"Warning: lots of heat ahead"
"1"	"See Princess Sofia of Sweden's Unexpected Green Leopard Print Dress   Complete with Tiara!"	"Princess Sofia of Sweden's Leopard Print Dress with Tiara"
"0"	"The Best Backstage Moments From the 2019 E! People's Choice Awards"	"Check out Kevin Hart, Adam Sandler, Gwen Stefani and more backstage during the 2019 PCAs."
"0"	"Meghan Markle and Prince Harry Reunite with Kate Middleton and Prince William for Remembrance Service"	"Meghan Markle, Harry Reunite Kate and William at Remembrance Day"
"1"	"How the US stole thousands of Native American children"	"The long and brutal history of the US trying to "kill the Indian and save the man.""
"0"	"She called 911 after her baby fell. Weeks later, CPS took her children."	"After 5-month-old Mason Bright fell and fractured his skull, he and his 2-year-old sister were taken from their parents and placed in foster care."
"1"	"Prince Harry Has the Sweetest Response When Young Student Calls Him Handsome During Japan Trip"	"Prince Harry Has Sweet Response When Student Calls Him Handsome"
"0"	"Lisa Vanderpump Reveals Why She Left RHOBH: 'I Don't Have Room in My Life for Nastiness'"	"Lisa Vanderpump Reveals Why She Left RHOBH"
"1"	"Prince Harry acknowledges tensions with William in ITV interview"	"Britain's Prince Harry has acknowledged tensions with his older brother Prince William for the first time, saying they are on "different paths.""
"1"	"Dallas NBC station apologizes for delaying tornado warning during Cowboys' game vs. Eagles"	"Dallas' local NBC affiliate waited six minutes to interrupt the Cowboys' game against the Eagles to provide a tornado warning."
"0"	"Fans are divided after Drake was revealed as a surprise festival headliner, booed off stage"	"Fans are divided after the audience at Tyler, The Creator's Camp Flog Gnaw festival booed Drake, who was revealed to be the surprise headliner."
"0"	"Katie Couric Says Matt Lauer 'Ultimately Turned Out to Be Two Very Different People'"	"Katie Couric discussed Matt Lauer, the Me Too movement and female leadership in business at the Dress for Success annual Women Who Inspire breakfast in New York City on Wednesday. Couric, who spoke during a fireside chat at the nonprofit's female empowerment event, was asked about Lauer's ouster from the "Today" show, and the many"
"0"	"These Are The Best Harley-Davidson Motorcycles You Can Get For The Cheap"	"These are the best Harleys to buy right now."
"1"	"Mom Wakes Up to Find Intruder Bathing Her Toddler"	"The mom reportedly fought off the intruder and called 911."
"0"	"Fast food cashier and manager fired for refusing to serve police officer"	"Two fast food employees have been fired after one of them refused to serve a police officer who wanted to order food from the establishment."
"0"	"Liver transplant leads to unbreakable bond between strangers"	"In 2016, David Landes sent a desperate email in search of living liver transplant. When Mark Henderson heard Landes' story from a friend, he made the ultimate sacrifice. They both join the 3rd hour of TODAY to talk about the incredible act of kindness and the friendship that has come from it."
"0"	"Chin Hair: 7 Embarrassing Red Flags No Woman Should Ever Ignore"	"Here's how to know if your annoying chin hair is a sign of a more serious issue."
"1"	"Which Royal Wore It Best?"	"Consider this classiest version of "who wore it best?" you've ever read."
"1"	"Three takeaways from Yankees' ALCS Game 1 win over the Astros"	"Masahiro Tanaka had the Astros off balance all night and that's honestly not all that surprising."
"1"	"Accused killer's girlfriend reveals Colorado mom's last words"	"Krystal Lee, who was having an affair with Frazee, is expected back on the stand Thursday"
"1"	"Pie Lovers Will Want to Make Room For These Thanksgiving Cake This Year"	"We dare anyone to turn down a slice of browned butter pecan layer cake."
"0"	"How Did Armistice Day Become Veterans Day in the United States?"	"In 1954, in response to calls for recognition of veterans of World War II and the Korean War, President Dwight D. Eisenhower changed the name of the holiday to Veterans Day."
"0"	"This is the dirtiest spot on a plane"	"Science has identified the dirtiest spot on an airplane."
"1"	"4 High School Students Killed in Texas Car Crash That Also Injured 3: 'We Grieve Together'"	"4 High School Students Killed in Texas Car Crash"
"0"	"'Signs of concern': What Laura Cooper told impeachment investigators"	"Laura Cooper, the deputy assistant secretary of defense for Russia and Ukraine, told impeachment investigators in a deposition made public Monday that President Donald Trump's abrupt hold on military aid to Ukraine sent all corners of the Trump administration into a frenzy to get it released   and to understand what motivated Trump's decision."
"1"	"The most surprising confessions made by the Queen's dressmaker in her new tell-all book about life at Buckingham Palace"	"Angela Kelly began her post in 1994 as the Queen's senior dresser, before becoming Her Majesty's in-house designer."
"0"	"See inside a woman's 270-square-foot tiny home complete with 2 bedrooms and a walk-in closet"	"The tiny house is currently in Victoria, Australia, but it was built with wheels attached, allowing owner Dolly Rubiano to move it wherever she wants."
"1"	"Prince Harry and Meghan Markle Will Reportedly Visit Oprah While in California"	"During their six-week break from their royal duties, Prince Harry and Meghan Markle are planning to visit Oprah Winfrey, according to a royal insider."
"0"	"Stunning photos of 27 places around the world that you should visit before they disappear forever"	"From Patagonia's glaciers to Africa's Congo Basin, visit these threatened natural wonders before they're gone."
"1"	"Popeyes quietly launched a new pumpkin pie and it's the best fast-food dessert I've ever tasted"	"Popeyes still doesn't have the chicken sandwich, but it does have a delicious new deep-fried pumpkin and cream cheese pie. Run, don't walk."
"0"	"FAA threatened to ground 38 Southwest Airlines jets over maintenance concerns, report says"	"U.S. aviation regulators "threatened" to ground 38 Boeing 737 jets operated by Southwest Airlines last month because the carrier isn't able to verify that the aircraft meet all mandatory safety standards."
"0"	"An investor's guide to space, Wall Street's next trillion-dollar industry"	"This is your guide to investing in space right now, with insight on the top space companies from analysts and investors."
"0"	"The highlights and lowlights from the world of comedy in the 2010s"	"Along with the great films, sitcoms and talk shows, there have been scandals, untimely deaths, cancellations both real and metaphorical, terrible sequels and comedies based on cell phone games."
"1"	"This Is What Queen Elizabeth Is Doing About the Prince William-Prince Harry Feud"	"According to royal insiders, Queen Elizabeth has directed Prince Charles to put a stop to the feud between William and Harry. Here's why she's so worried."
"0"	"Why the Amex Platinum card is best for active-duty military"	"Please note: the offers mentioned below are subject to change at any time and may not be available. I have my nine years of active-duty service in the Navy (Beat Army!) to thank for getting me interested in points and miles. Traveling and moving all the time was hurting my family's wallet and I knew there had …"
"0"	"Nurse took in disabled teen, then tortured and killed her, police say."	"Peggy Lynn Johnson was 23 when her body was found covered in burns and bruises along a Wisconsin road. Linda LaRoche has been charged in her murder."
"1"	"﻿﻿Princess Charlene of Monaco Has the Most Daring Style of All the Royals"	"She loves to show off her shoulders."
"0"	"Mammoth skeletons found in 15,000-year-old human-made traps"	"Researchers think that prehistoric hunters used torches and branches to herd the mammoths into the pits."
"0"	"A teenager thought his leukemia was a death sentence. A college football player saved his life."	"William & Mary offensive lineman Mark Williamson on Friday finally met Rusty Plemons, whose life he helped save three years ago."
"0"	"Pentagon official testifies Trump directed freeze on aid to Ukraine"	"Asked if the president was authorized to order that type of hold, Laura Cooper said there were concerns that he wasn't."
"0"	"Andrew Yang's Campaign Has a Lot of Money. Now What?"	"CONCORD, N.H.   Andrew Yang arrived for the first New Hampshire event of his presidential campaign in a Subaru with a dented fender. It was the spring of 2018, and he and three staff members had taken his car to Concord, where they were hoping a few dozen voters would be waiting for them at a coffee shop. Inside, they found one. She listened politely while Mr. Yang explained universal basic income, though she was mostly focused on her coffee and..."
"0"	"Abandoned farms for sale with plenty of promise"	"If you fancy snapping up your own farm without breaking the bank, these abandoned properties might just be of interest."
"0"	"Former U.S. top diplomat Rice concerned by shadow diplomacy on Ukraine"	"Former U.S. top diplomat Rice concerned by shadow diplomacy on Ukraine"
"0"	"The Most Amazing Photos of a Young Dolly Parton"	"The country star's look has evolved dramatically over the years."
"0"	"Lamar Odom Is Engaged to Sabrina Parr: See Her Ring!"	"Lamar Odom Is Engaged to Sabrina Parr: See Her Ring!"
"0"	"'I Have Waited 68 Years to See This': How Honor Flights Help Veterans Reflect"	"In 2004, shortly after the national World War II Memorial was completed, Earl Morse, a retired Air Force captain working at the Department of Veterans Affairs clinic in Springfield, Ohio, realized that many of the veterans he knew would never get to see it. So he persuaded pilots at his local flying club to ferry a handful of veterans to Washington on small planes, and accompany them to the National Mall."
"0"	"Celebrity Christmas albums: From beloved classics to big surprises"	"All we want for Christmas is to listen to this holiday music from the stars."
"1"	"BEL MOONEY: My family disowned me when I said I was a woman"	"This week Bel advises a 77-year-old who was disowned by her family when she said she was a woman."
"1"	"The Amelia Earhart Mystery Stays Down in the Deep"	"For two weeks in August, a multimillion-dollar search from air, land and sea sought to solve the 80-year mystery of Amelia Earhart's disappearance."
"1"	"Sears and Kmart to close more than 120 stores by January"	"Business Insider compiled a list of the closing stores based on company filings and statements to local media outlets."
"1"	"Zion, 8, saw his aunt Atatiana Jefferson get shot. Family is trying to help him cope"	"Zion, 8, used to bound into rooms with the madcap enthusiasm of a child, not looking to see who was inside before he would burst through an open doorway."
"0"	"The Best Beaches in Hawaii to Visit in Your Lifetime"	"Hang ten at great surf spots, relax at resort getaways, snorkel at stunning coral reefs, float in quiet coves, and dig your toes into silky sand whatever kind of beach experience you're dreaming of, Hawaii offers an opportunity to indulge your tropical getaway fantasies. But which Hawaiian beaches are best? We've got the sandy scoop! The post The Best Beaches in Hawaii to Visit in Your Lifetime appeared first on Reader's Digest."
"1"	"10 things New Englanders always have on their Thanksgiving table"	"These New England-inspired Thanksgiving dishes are perfect for a classic holiday celebration from America's original colonies."
"1"	"Tom Brady's trainer hints at how long QB intends to keep playing"	"Tom Brady continues to defy Father Time, but the end of his career has to come at some point, right?"
"0"	"Walmart manager ready as store where El Paso mass shooting occurred reopens"	"Robert Evans was on hand at the Cielo Vista Walmart store Thursday morning to raise the U.S. flag that's been at half-staff since the Aug. 3 mass shooting, when 22 people were killed and dozens injured."
"0"	"Chow Mein vs. Lo Mein: What's the Real Difference Between Them?"	"When it comes to chow mein vs. low mein, the similar-looking dishes are popular in Chinese cuisine, but they are very different. Here's how."
"0"	"Stella McCartney Deleted a Meghan Markle Instagram Post After Followers Called Her Out"	"Stella McCartney deleted a photo of Meghan Markle on Remembrance Day following backlash from Instagram followers."
"0"	"'The Voice' Recap: The Top 20 Hit The Stage For Their 1st Live Performances Of The Season"	"And we're LIVE on season 17 of 'The Voice'! The remaining 20 artists each hit the stage during the live playoffs, with hopes of landing a spot in the top 13 after America's vote."
"1"	"Daylight saving time is ending this weekend. These states want to make DST permanent"	"Adjust your clocks back one hour Nov. 3 at 2 a.m.   lest you wake up an hour early to everything in the days ahead. But some states might change that."
"0"	"America's Most and Least Popular Senators"	"Senators represent the interests of the residents of their home state on Capitol Hill by crafting and voting on new laws and by approving or rejecting cabinet and judicial nominations made by the president."
"1"	"Inside Liam Hemsworth and Maddison Brown's PDA-Filled NYC Date Night"	"ET breaks down everything you need to know about Hemsworth and ex Miley Cyrus' new love interests!"
"0"	"Fox legal analyst Napolitano emerges as Trump critic"	"NEW YORK (AP)   More than two decades into his career as a commentator at Fox News Channel, Andrew Napolitano reached a milestone of sorts when he was called a "fool" on his own network. Not to his face, of course. But Tucker Carlson guest Joseph diGenova's dismissal of Napolitano for saying that soliciting campaign aid from a foreign government is against the law illustrates the awkward place that the former New Jersey Superior Court judge..."
"0"	"How I Got Lung Cancer at 31 Without Ever Smoking a Single Cigarette"	"Rachael Malmberg was 31 when she received a deadly diagnosis. She is fighting her condition and has embarked upon a mission to educate others about the second leading cause of lung cancer and it has nothing to do with smoking."
"0"	"The Best Thanksgiving Brunch Recipes to Start Turkey Day off on a Delicious Note"	"Brunch is always a must, even on Turkey Day."
"1"	"Photos of the Day"	"Our top photos from the last 24 hours."
"0"	"4 reasons you shouldn't max out your 401(k)"	"Making high-dollar contributions to your 401(k) can cost you."
"0"	"Unexpected Signs of an Unhealthy Heart"	"Preventing heart disease has been at the forefront of researchers' agendas for years, involving things like physical activity, diet, and genetics"
"1"	"Woman Finds A Giant Wild Snake Just Chilling In Her Bed"	"A 7-foot-long carpet python was slithering over her bed."
"0"	"Social Security: 5 smart ways to get more benefits"	"Your decisions can dictate the size of your Social Security benefit. Use these five smart strategies to increase yours."
"0"	""We, the People": Mary Whyte's portraits of 50 veterans from 50 states"	"The South Carolina artist's subjects, exemplars of patriotism, are as diverse as the nation they served"
"0"	"Carrie Underwood Praises Miranda Lambert as 'Super Supportive': 'We Lift Each Other Up'"	"Carrie Underwood Praises Miranda Lambert as 'Super Supportive'"
"0"	"Mulvaney won't sue over impeachment, declines to cooperate"	"White House acting chief of staff Mick Mulvaney said Tuesday that he no longer plans to sue over the House impeachment proceedings and will instead follow President Donald Trump's directions and decline to cooperate."
