"0"	"This 'new' strain of HIV is actually a good thing"	"For starters, the "new" strain is… not new."
"0"	"Eight dead as Cyclone Bulbul smashes into India, Bangladesh coasts"	"Eight people died and more than two million others spent a night huddled in storm shelters as Cyclone Bulbul smashed into the coasts of India and Bangladesh with fierce gales and torrential rains, officials said Sunday."
"0"	"American woman apparently strangled in the Dominican Republic"	"Colleagues say Patricia Anton brought joy and laughter to the school she worked in, as police hunt leads in what they say looks like a deadly robbery at her home"
"1"	"Simone Biles Shares Sweet Birthday Tribute for "Man of My Dreams" Stacey Ervin Jr."	"The accomplished gymnast has a lot to celebrate right now."
"1"	"Freshman Georgia Southern offensive lineman Jordan Wiggins dies at 18"	"Georgia Southern freshman offensive lineman Jordan Wiggins has died. He was 18 years old."
"1"	"Cornell student, 18, found dead in gorge after frat party, reports say"	"A top Ivy League student was found dead Saturday afternoon in a New York gorge after he left a fraternity party and disappeared Thursday night, according to reports."
"0"	"Why Prince Harry Wore His Remembrance Poppy Differently from the Rest of the Royal Family"	"Why Prince Harry's Poppy Was Worn on His Cap"
"0"	"What It Was Like Inside the Homes of the Pilgrims"	"There's a lot of folklore surrounding the first Thanksgiving, and plenty of lively debate. When did it actually occur? Was this meeting with the Wampanoags truly amicable? Did they really eat turkey? Despite, or perhaps because of, this murky history, we continue to be fascinated with the Pilgrims and life in 17th-century America. While we all learned about the Mayflower, the Pilgrims, and that first Thanksgiving way back in elementary school, what do we really know about the day-to-day lives of these English settlers? Here are a few things that may surprise you about home life in early America."
"0"	"Labor unrest again lurks just below the surface as baseball's Hot Stove heats up"	"Many of the same forces that made last winter's market so frustrating and polarizing are back a year later. And if anything, things are even worse this winter."
"1"	"Baby dies of the same cancer his identical twin is currently battling"	"Elijah and his brother, who were diagnosed at just 4 months old, shared an "unbreakable" love."
"0"	"Kiss Cancel 'End of the Road' Tour of Australia and New Zealand Due to Illness"	"Kiss won't be playing Australia and NZ after all."
"0"	"When You See Paris Jackson's Wheat-Blond Hair, You'll Run to the Salon"	"Paris Jackson stepped out on Nov."
"0"	"Mom named person of interest in 5-year-old girl's disappearance"	"The search for Taylor Rose Williams, 5, began in Jacksonville on Wednesday."
"0"	"Here's the Very Best of Oprah's Favorite Things"	"This holiday season, we're thankful for Oprah."
"0"	"How the Trump Administration Eroded Its Own Legal Case on DACA"	"WASHINGTON   When Attorney General Jeff Sessions appeared before news cameras at the Justice Department in early September 2017 to announce that President Trump was ending deportation protections for young undocumented immigrants, he knew the administration had left itself more legally vulnerable than it should have."
"1"	"Queen Elizabeth Finally Had Her Dream Photoshoot, Thanks to Royal Dresser Angela Kelly"	"Her advisors worried that her casual pose would "bring the monarchy down." (It didn't.)"
"0"	"20 Winter Wedding Color Schemes That Will Take Your Breath Away"	"Funny, now I'm suddenly in the mood for a glass of champagne."
"0"	"Ex-Astros say team electronically stole signs during 2017 season"	"While the Astros have denied the numerous sign-stealing allegations against them, the former members of their World Series team described the practice they used that season in detail."
"0"	"'One in a million' deer captured on camera in Michigan woods"	"Retired Michigan lawmaker and amateur photographer Steven Lindberg took pictures of a deer. That deer had three antlers."
"0"	"99 of the world's most amazing bucket-list experiences for 2020"	"We've all got a bucket list of those must-see sights and experiences we want to have around the world. Ours seems to be getting longer by the day and if yours could do with some extra inspiration for 2020, read on. From amazing adventures to dream destinations, here are 99 of the world's most unmissable travel experiences for 2020."
"0"	"2021 Kia Optima Raises the Style Bar for Mid-Size Sedans"	"The new Optima looks as good as we'd hoped given the promising teaser photos."
"1"	"Christie's Auctioned a $40 Million Diamond. Was It Stolen?"	"This is the story of one of those diamonds so exquisite it was given a cute little name: the Princie. Yet despite its diminutive moniker, the Princie is a big stone   34.65 carats   that sparkles in the cheerful color of a flamingo and is valued at $40 million."
"1"	"Chrissy Teigen Predicts The Office's Jim and Pam Are Divorced Now, Sends Twitter into a Tailspin"	"Chrissy Teigen Predicts The Office's Jim and Pam Are Divorced"
"1"	"Queen Elizabeth Has Someone on Staff Break in Her Shoes Before Wearing Them"	"Queen Elizabeth Has Her Shoes Broken in Before Wearing Them"
"0"	"The Easiest 2-Ingredient Pancake Recipe (Without Milk or Flour)"	"Whether you're working with an empty pantry or a dairy and gluten allergy, you can still make a stack of delicious pancakes. Here's how."
"0"	"Divers salvage 100-year-old liquor from WWI shipwreck"	"A team of ocean explorers says it has retrieved cognac and liqueur from a ship that was bound for Russia when it was sunk by a German submarine in 1917."
"0"	"Should You Think Twice About Washing Your Hands on a Plane?"	"A recent study found that the water used on flights the same water used for hand washing and for coffee and tea might be unhealthy."
"0"	"60+ Restaurants Where Veterans Eat for Free on Veterans Day This Year"	"Active military and veterans can score free donuts, burgers, pizza and more with their military ID."
"0"	"Family told to take down Christmas display because it's too soon to decorate"	"A Texas couple was told by their homeowners association to pump the brakes on their Christmas cheer."
"1"	"Uber driver buys baby clothes for new mom who has sick infant in hospital"	"A new mom says she is incredibly grateful for the generosity and kindness her Uber driver showed her last week."
"0"	"Joe Giudice Calls His Family 'Italian Strong' During Reunion with Wife Teresa and Their Daughters"	"Joe Giudice Shares Sweet Photo During Family Reunion in Italy"
"1"	"Adele Lost 20 Pounds with Pilates and Cardio After Splitting From Simon Konecki"	"She debuted her slimmer figure in early October."
"0"	"Best Dive Bar in Every State"	"The real challenge in compiling a list of America's best dive bars comes in defining just what a dive bar is and isn't."
"1"	"Kenny Dixon, Drummer for Kane Brown, Dies in Car Accident"	"Drummer Kenny Dixon, who performed in Kane Brown's band, was killed in a car crash."
"1"	"FBI joins search for 14-year-old girl believed abducted from her home"	"Isabel Hicks was last seen by her sister in their shared bedroom. The sister woke Monday morning to find Isabel gone."
"0"	"Powerful side-by-side portraits show people over 100 years old next to their younger selves"	"Opava-based photographer Jan Langer captured sentimental portraits of elderly Czech people for his photo series, "Faces of Century.""
"0"	"House Democrat: 'Sham' investigation of Bidens will not dominate impeachment hearings"	"Rep. Adam Schiff outlined some rules for the public impeachment hearings."
"1"	"Family of missing teen desperate for answers: 'She would never not contact somebody'"	"The father of missing college student Aniah Haley Blanchard spoke exclusively to ABC News."
"1"	"Dean Foods files for bankruptcy"	"Dean Foods, America's largest milk producer, is filing for bankruptcy."
"1"	"An architect who built his dream tiny home in Colorado shares photos"	"Creating a customized tiny house is a big task. From sketches to real-life infrastructure, here's how an architect builds and designs tiny houses."
"0"	"Piracy crackdown may be next front in streaming wars"	"Controlling user access to platforms (password sharing) will be a priority as major conglomerates bet on new direct-to-consumer digital services."
"1"	"Couple with 21 Grandchildren Snag $80 Million Powerball Prize"	"Over the river and through the woods, to grandmother's house we go because she is $80 million dollars richer."
"1"	"Banish The Cold This Winter With These Hearty Dutch Oven Recipes"	"Winter is the perfect time to make hearty recipes in your Dutch oven. These wholesome recipes will keep you and your family toasty and warm even on the chilliest nights. The post 35 Dutch Oven Recipes for Winter appeared first on Taste of Home."
"1"	"Birmingham couple charged with murder after abducted 3-year-old's body found in dumpster"	"An Alabama couple have been charged with capital murder in the suffocation death of 3-year-old Kamille "Cupcake" McKinney who was found in a dumpster"
"1"	"Help! My Daughter Stole My Granddaughter's College Fund."	"She refuses to say where the money went."
"0"	"Watergate redux? Trump impeachment inquiry heads for live TV"	"Back in 1973, tens of millions of Americans tuned in to what Variety called "the hottest daytime soap opera"   the Senate Watergate hearings that eventually led to President Richard Nixon's resignation. It was a communal experience, and by some estimates, more than 80% of Americans tuned in to at least part of the Watergate telecasts. They were offered by ABC, CBS and NBC, as well as PBS, which won acclaim and viewers by showing not only the..."
"0"	"Dramatic Footage Shows Plane Skidding Off Runway at O'Hare Airport in Chicago"	"A plane slid off the runway due to icy conditions at Chicago's O'Hare International Airport on Monday morning, November 11, as cold weather swept across the state. American Airlines told Storyful that flight 4125, which was traveling from Greensboro, North Carolina, to Chicago, slid off the runway upon landing at around 7.45 am on Monday as a result of icy conditions. The airline said no injuries were reported and all 38 passengers and three crew members were transported to the terminal at O'Hare airport safely. Local media reported that the incident prompted a ground stop at the airport, halting all landings until around 8.30 am. Airlines at O'Hare and Midway airports canceled hundreds of flights on Monday as the National Weather Service issued a winter weather advisory for the state. Credit: Joseph Lian via Storyful"
"0"	"Was Trump call with Ukraine 'perfect'? GOP has many answers"	"WASHINGTON (AP)   Republicans have no unified argument in the impeachment inquiry of Donald Trump, in large part because they can't agree on how best to defend the president   or for some, if they should. That would require a level of consensus that Trump's call with the Ukraine president was "perfect," as he insists. Or it would take a measure of GOP independence from Trump to suggest there may be a need to investigate. Instead, it's every..."
"0"	"3 Weekend Baking Projects for When Your Heart Needs a Little Help"	"Several years ago, at the worst possible time, my dresser began to fall apart. The drawers groaned complaints when I pulled at them. Splinters pricked my palms as I grabbed for socks in the middle of the night. The handle of the bottom drawer had come off altogether, so I just left it open, and the legs of my jeans were always trying to sneak out to party on their own. Even though it had seen better days, I didn't want to let it go. I didn't..."
"0"	"37 Years After His Wife Is Found Dead with an Ax in Her Skull, Husband Is Arrested"	"37 Years After His Wife Is Found Dead with Ax in Her Skull, Husband Is Arrested"
"0"	"Top 100 country songs of all time"	"Stacker counts down the top 100 country songs of all time. From old-school honky-tonk to modern country pop, this list covers the biggest hits in Billboard history."
"1"	"Mother Is Freed After 15 Years in Prison for Father's Abuse"	"A domestic violence survivor in Oklahoma walked free from prison on Friday, according to a corrections spokeswoman, after spending 15 years behind bars for failing to report that her boyfriend was also abusing their children."
"0"	"Hundreds rally at Texas Governor's Mansion in support of death row inmate Rodney Reed"	"AUSTIN, Texas - Hundreds rallied Saturday afternoon in front of the Texas Governor's Mansion in Austin, hoping their pleas for death row inmate Rodney Reed's execution to be stayed would reach the ears of the man who has the power to do so: Gov. Greg Abbott. Standing just feet from Abbott's residence, Rodney Reed's mother, Sandra Reed, had a message for him. "It is time for change.""
"0"	"51 children injured in chemical attack at China kindergarten"	"More than 50 people, mostly children, were injured by a man who broke into a kindergarten in southwest China and sprayed them with corrosive liquid, local authorities said Tuesday. Later in 2018, a knife-wielding woman injured 14 children at a kindergarten in Sichuan province."
"0"	"The Unexpected Tool That Stands Between You & Perfectly Round Cookies"	"Isn't it frustrating when you pull out a tray of warm cookies, only to discover that each one is mismatched? Some are too small; others, your high school geometry teacher would hesitate to call, well, circles."
"1"	"Prince Harry and Meghan Markle just shared a never-before-seen photo of baby Archie with his 'Grandpa' Prince Charles to celebrate his birthday"	"The Duke and Duchess of Sussex shared a new photo of Archie, Harry, and Charles to mark the Prince of Wales' 71st birthday on Thursday."
"1"	"The Queen's Dressmaker Reveals She Uses Gin to Clean the Royal Jewels"	"The Queen's Jewels Are Polished with Gin and Water"
"0"	"We Should Have Seen This '90s Hair Trend Coming"	"Flipped out ends or the "hair flip" is making a comeback. See how celebrities are wearing this retro hairstyle here."
"0"	"From Jay-Z's involvement to Goodell's actions: How Kaepernick's NFL workout materialized and what's next"	"Colin Kaepernick's workout for NFL teams seemed to materialize in startling fashion. But there were plenty of talks within the league about the QB."
"0"	"100 vintage baby names coming back into style"	"Stacker looks at 100 vintage baby names coming back into style along with their origins and some of the more popular bearers of that name. The Bible, literature, and royalty are just a few sources for these vintage names."
"1"	"650 people formed a human chain to move children's books from one library to another"	"There was a GoPro camera on the library's "Chicken Little" book as it was passed from hand to hand."
"0"	"San Diego State University freshman hurt in fraternity incident dies"	"SAN DIEGO - Dylan Hernandez, the 19-year-old San Diego State University freshman who required medical attention last week after an unspecified incident at one school's fraternities, has died, campus officials said on Monday. "His family gave their goodbyes late Sunday night," SDSU President Adela de la Torre said in a statement."
"1"	"This Foster Kitten Smiling for a Photo Will Make Your Friday"	"Blossom the cat clearly loves her new foster family. Photos of the kitten smiling for the camera have gone viral and melted hearts everywhere."
"0"	"All eyes on Texas governor as calls grow to halt execution"	"AUSTIN, Texas (AP)   In his five years as Texas' governor, Republican Greg Abbott has overseen the execution of nearly 50 prisoners while only once sparing a condemned man's life."
"0"	"Our 30 Favorite Recipes for Brussels Sprouts"	"They're not actually baby cabbages. But they are adorable and delicious."
"0"	"Israeli farmers lament the end of Jordan land deal"	"Israeli farmers lament the end of Jordan land deal"
"0"	"Sanders blasts Bloomberg: 'You ain't gonna buy this election'"	"The attack from Sanders is a preview of what the former N.Y. mayor would face if he enters the Democratic primary race."
"0"	"Officials: At least 13 dead in Slovakia bus crash"	"A bus collided with a truck in Slovakia on Wednesday, killing at least 13 people and injuring at least 20 more. Online news site tvnoviny.sk reported that the bus was carrying high school students."
"0"	"This little Montana town is full of Power Wagons and Mustangs"	"You never know what sorts of treasures hide down that unpaved backroad."
"0"	"Senate confirms White House lawyer as appeals court judge"	"A White House lawyer won Senate confirmation as a federal appeals court judge Thursday despite complaints by lawmakers from both parties about his record on immigration, race, women's equality and LGBTQ rights."
"1"	"Philadelphia shooting: 10-year-old boy shot in head while walking home from school"	"A 10-year-old boy walking home from school in Philadelphia was critically injured Wednesday when he was shot in the back of the head by a stray bullet, according to police."
"1"	"3 Weekend Baking Projects for When Your Heart Needs a Little Help"	"Several years ago, at the worst possible time, my dresser began to fall apart. The drawers groaned complaints when I pulled at them. Splinters pricked my palms as I grabbed for socks in the middle of the night. The handle of the bottom drawer had come off altogether, so I just left it open, and the legs of my jeans were always trying to sneak out to party on their own. Even though it had seen better days, I didn't want to let it go. I didn't..."
"1"	"Kate & Meghan Head to Separate Events in Gorgeous Blue Outfits"	"Kate wore sapphire earrings that belonged to Diana."
"0"	"Josh Gordon Admits Patriots' Decision To Waive Him Was Surprising"	"The New England Patriots made a move that was surprising to fans just weeks ago and it appears the player who got let go had a similar reaction"
"1"	"Suspect arrested in murder of 6-year-old girl who was shot while asleep in her home"	"A suspect has been arrested for the murder of a 6-year-old girl who was asleep in her Cleveland home when she was fatally shot in the head, authorities said Wednesday."
"0"	"AP Top 25: LSU landslide No. 1; Minnesota jumps into top 10"	"LSU is an overwhelming No. 1 in The Associated Press college football poll after beating Alabama in a 1-2 matchup, and Minnesota moved into the top 10 for the first time in 57 years. After two weeks of historically close voting at the top of poll, LSU received 54 first-place votes in the AP Top 25 presented by Regions Bank. Ohio State was No. 2 with five first-place votes and Clemson was third with three first-place votes. Alabama fell two spots..."
"1"	"Goldman predicts the Fed will make 2 big changes next week"	"The Fed likely will finish its "mid-cycle adjustment" and remove language that it will "act as appropriate to sustain the expansion," according to Goldman Sachs."
"0"	"The Most Popular Family Dinners from Every Decade"	"Find a quintessential family dinner for every decade over the past 100 years. The post The Most Popular Family Dinner from Every Decade appeared first on Taste of Home."
"1"	"A secretive family landing a $4 billion haul has everyone guessing"	"One of the world's richest and most discreet families must decide what to do with a massive pile of cash."
"0"	"Uber CEO's defense of Saudi murder sparks calls for boycott"	"Uber Technologies Inc. Chief Executive Officer Dara Khosrowshahi said in an interview on the television show "Axios on HBO" that the murder of journalist Jamal Khashoggi was "a mistake" by the Saudi Arabian government, and compared it to Uber's accident with a self-driving car that killed a woman."
"0"	"Christopher Johnson has hitched his reputation to Adam Gase"	"Jets CEO Christopher Johnson broke his 182-day silence by confirming a Daily News report that he has no plans to fire Adam Gase. The team's acting owner, who took shelter amid the team's nightmarish first two months, made it clear that Gase will be back in 2020 despite growing unrest from a frustrated fan base at the team's poor play and lack of competitiveness during their 2-7 start. "I understand it," Johnson said of fans' frustrations in a..."
"0"	"Watch: John Harbaugh shared awesome moment with Lamar Jackson"	"Lamar Jackson has done more this season than simply prove he is capable of being a starting quarterback in the NFL   he has turned himself into a full-blown superstar."
"1"	"3-year-old Alabama girl kidnapped from birthday party, believed to be in 'extreme danger'"	"An Alabama toddler is missing after police say she was kidnapped at a birthday party Saturday night. Kamille (Cupcake) McKinney went missing about 8:30 p.m. from Tom Brown Village public housing community in Avondale."
"0"	"Father of Atatiana Jefferson dies of heart attack, family spokesperson says"	"The father of Atatiana Jefferson, the black woman who was fatally shot by a Fort Worth police officer, died of a heart attack, a spokesperson said."
"1"	"2 reported dead after plane that vanished from radar and crashed in North Carolina"	"Authorities in North Carolina have found the small plane that vanished from radar near the Raleigh-Durham International Airport on Sunday night -- two are reported dead."
"1"	"Creepy fish with 'human-like face' found swimming in lake"	"Tourists in southwestern China spotted a carp fish that had human-like facial features resembling eyes, nose and a mouth."
"1"	"Police desperately searching for missing 3-year-old, 2 persons of interest in custody"	"Kamille "Cupcake" McKinney was playing at a birthday party when she disappeared."
"0"	"WATCH: Trump Greeted by Cheers at LSU-Alabama Football Game"	"President Donald Trump was greeted by a round of cheers while attending the University of Alabama's football home game against Louisiana State University Videos of the event appear to show loud cheers greeting Trump, though one reporter noted there were some "lingering boos.""
"0"	"2 BOYS ESCAPE from juvenile corrections facility in NC, could be in Asheville area, officials say"	"Officials with the North Carolina Department of Public Safety (NCDPS) said they believe two boys who escaped a local juvenile corrections facility may be in the Black Mountain area near Asheville. The NCDPS is asking members of the Black Mountain community to be cautious as authorities continue to search for those two minors. Sign up for our Newsletters The two boys, identified by NCDPS as Chris H. and Mikal M., escaped about 2:45 p.m. Sunday..."
"0"	"Why You Shouldn't Ever Go for the Cheapest Brake Pads"	"Brakes are the most important part of your car. Here's why you shouldn't cut costs on them."
"0"	"Here's What 'Cultural Appropriation' Actually Means   and Why It's Wrong"	"The questions you've been afraid to ask, answered."
"0"	"Body of missing Salvadoran trans activist found"	"The body of a Salvadoran trans activist missing since Tuesday has been found in the northeast of the country, authorities confirmed. Jade Camila Diaz, 27, is the second transgender woman killed in the country in the past 15 days, according to the advocacy group Comcavis Trans, who told local media there have been at least seven LGBT-related murders in 2019. "We regret to inform you that Jade Diaz's body was found in the waters of the Torola...""
"1"	"Eddie Van Halen thinks he developed cancer from sucking on metal guitar picks; a doctor disagrees"	"The guitarist lost a third of his tongue due to mouth cancer in 2000, and is reportedly receiving treatment for cancerous cells in his throat."
"0"	"How the biggest stars of the decade have changed"	"Find out what's happened to Hollywood's biggest stars over the last 10 years from 2010 to 2019."
"0"	"A body-language expert says Meghan Markle is "politely disconnecting" from the public, and honestly, we would too"	"Can we blame her? Meghan Markle is supposedly "politely disconnecting" from the public as seen in her body language, and girl, you do you."
"0"	"I Was A Psychic Phone Line Operator. Here's What Really Happened Behind The Scenes."	"A phone psychic reveals the behind-the-scenes of the job."
"1"	"Dakota Johnson's Tribute to Former Stepdad Antonio Banderas Will Leave You In Tears"	"Dakota Johnson gushed over former stepfather Antonio Banderas while presenting him with the Hollywood Actor Award on Sunday. Read her touching speech below."
"0"	"Charlize Theron Just Ditched Her Bowl Cut for a Bright Blonde Pixie"	"She looks like a whole new woman...again!"
"0"	"'Don't stay silent': Democrats lash out as GOP blocks gun measure amid school shooting"	"News of the California school shooting broke as Connecticut's two Democratic senators were making an emotional case for gun control."
"1"	"Mom named person of interest in 5-year-old girl's disappearance"	"The search for Taylor Rose Williams, 5, began in Jacksonville on Wednesday."
"0"	"Meghan Markle Smudged Makeup on a Fan's Coat & He Reacted Perfectly"	"We've all been there."
"1"	"Dwayne Johnson Jokingly Warns His Mom About Her 'Magic Mike' Birthday Celebration in Vegas"	"Dwayne Johnson Jokingly Warns Mom About 'Magic Mike' Birthday Celebration"
"1"	"Cummings' widow responds to Trump's attacks, gets standing ovation"	"Dr. Maya Rockeymoore Cummings, the widow of the late Rep. Elijah Cummings, appeared to respond to President Trump's previous attacks of her husband during a speech at his funeral."
"0"	"Easy Turkey Breast Recipes To Make When You Don't Feel Like Cooking A Whole Bird"	"Spoiler: You can get your turkey fix with way less work."
"0"	"Deer stranded 5 miles offshore saved by Maine lobstermen"	"A group of Maine lobstermen spotted a deer in an unusual place Monday: open waters. The men quickly took action to save the animal, which had somehow ventured 5 miles away from shore, and hauled their catch of the day to safety."
