"0"	"This 'new' strain of HIV is actually a good thing"	"For starters, the "new" strain is… not new."
"1"	"Prince William and Kate Middleton arrive in Pakistan for royal tour"	"She and Prince William just touched down at Nur Khan Airbase."
"0"	"NYC is selling 'air rights' to city housing buildings, first big deal goes to de Blasio donors"	"It may not be a bridge, but the city has something to sell you in Brooklyn   and donors to Mayor de Blasio are first in line to benefit. In what appears to be a textbook "pay-to-play" move, the city is selling NYCHA development rights to builders who gave de Blasio's campaigns more than $20,000."
"1"	"Kate Middleton Wore a Shalwar Kameez for the First Time While Arriving in Pakistan"	"The Duchess of Cambridge honored her host country by wearing the traditional ensemble."
"1"	"If You Don't Eat a Banana Every Day, This Might Convince You to Start"	"An apple a day keeps the doctor away? Not so much. Try this fruit, instead."
"0"	"A birthday, a walk to school and a blast that tore an Afghan family apart"	"Dunya, 10, and Hadis, 7, were among the 12 dead in Wednesday's suicide bombing in Kabul."
"0"	"4 takeaways from the Seahawks' wild, overtime win over the 49ers"	"If the NFC championship is a rematch of this Monday Night Football game, we're in for a treat. The Seattle Seahawks' 27-24 overtime win over the San Francisco 49ers in Week 10 was wild, messy and exciting. It may have been the most fun game of the season."
"1"	"Charlize Theron Talks 'White Privilege,' Growing Up During Apartheid in South Africa"	"Charlize Theron, during an onstage discussion with her "Gringo" costar David Oyelowo about philanthropy at Thursday's annual fundraiser for Nigerian children's educational and health program GEANCO, said she was a beneficiary of "white privilege" while growing up in Apartheid-torn South Africa. "I obviously am a white person who benefited from my white privilege," Theron said"
"0"	"These Christmas Dinner Menus Will Create an Unforgettable Meal"	"We've got you covered for any type of crowd."
"1"	"Holocaust survivor under guard amid death threats"	"Liliana Segre, 89, is assigned two police officers in Italy after hundreds of anti-Semitic messages."
"1"	"Bette Midler mocks Lori Loughlin's college admission scandal"	"In a new tweet, Bette Midler pokes fun at Lori Loughlin's involvement in the college admission scandal."
"0"	"AP Interview: Huawei founder says US woes not hardest crisis"	"SHENZHEN, China (AP)   For decades, Huawei's founder stayed out of sight as it grew to become the biggest maker of network gear for phone carriers and passed Apple as the No. 2 smartphone brand. Now, Ren Zhengfei is shedding that anonymity as China's first global tech brand mobilizes to fight back against U.S. sanctions and warnings Huawei Technologies Ltd. is a security risk."
"1"	"Elijah Cummings to be remembered by Obama, Clintons at funeral"	"Rep. Elijah Cummings' legacy and life will continue to be honored Friday morning."
"0"	"A Man and His Shelby G.T. 350 51 Years On"	"Jim Walsh has owned and driven this Ivy Green 1966 Shelby G.T. 350 Mustang since 1968."
"0"	"U.S. Drones Appear to Show Turkish- Backed Forces Targeting Civilians"	"U.S. military officials watched live drone feeds last month that appeared to show Turkish-backed Arab gunmen targeting civilians during their assault on Kurdish fighters in Syria, according to current and former officials familiar with the incidents."
"1"	"Dying father watches son graduate from hospice bed"	"A Modesto, California father received his dying wish and watched his son graduate from high school from his hospice bed. Paul Espinoza passed away later that day after a battle with cancer."
"0"	"American Towns That Used to Be Poor but Are Now Rich"	"These cities gone from bust to boom thanks to their thriving arts scenes, vibrant downtown digs, and more. The post American Towns That Used to Be Poor but Are Now Rich appeared first on Reader's Digest."
"0"	"Martha Stewart shares the family favorites she serves during the holidays, including adding cream cheese to her mashed potatoes"	"Martha Stewart swears by family recipes for Thanksgiving, Christmas, and Hanukkah dishes   from potato pancakes to mashed potatoes."
"0"	"Dodge Put the Wrong Wheels on 173 New Challengers and Chargers"	"It's now recalling the affected cars because the tires could rub against the steering knuckles."
"0"	"7-year-old Boy Fighting for His Life After Falling 9 Floors From Apartment Window"	"The boy suffered several broken bones and internal bleeding after falling from a Bronx River Houses apartment building in New York City."
"1"	"Driver who fatally struck 3 siblings is found guilty of reckless homicide"	"An Indiana woman who failed to stop for a school bus and struck four children with her pickup truck, killing three of them, has been found guilty of reckless homicide."
"1"	"Dog Tries To Jump On Recliner With Dad   And It Doesn't Quite Go As Planned"	"Marybeth Parker He might be 5 years old, but Herbert is a huge baby at heart."
"0"	"What Happens To Your Brain And Body When You're Stressed About Money"	"Americans are stressed out. And, in many cases, money is the top cause of that stress."
"0"	"81 Bean Recipes You'll Be Making All Year Long"	"What's for dinner tonight? These 55 great recipes for beans."
"0"	"10 Gazans dead as Israel hit on militant chief sparks rocket barrage"	"Israel's military killed a commander from Palestinian militant group Islamic Jihad in a strike on his home in the Gaza Strip on Tuesday, triggering exchanges of fire in a violent escalation that left another nine Gazans dead. Islamic Jihad is the second most-powerful militant group in the Gaza Strip after Hamas."
"0"	"Rex Tillerson denies he tried to undermine Trump, says Nikki Haley was 'rarely present' at meetings"	"The former secretary of state refuted Haley's claims contained in a new book and says he remains proud of his tumultuous time in the Trump administration."
"0"	"LSU, Ohio State, and Clemson control path to College Football Playoff, but who else does too?"	"After a rather eventful day around the college football world, the big question is how did it all impact the College Football Playoff race. You would think that two of the top four teams falling on the first Saturday since the initial release of the College Football Playoff rankings would have a dramatic effect on Read more... The post LSU, Ohio State, and Clemson control path to College Football Playoff, but who else does too? appeared first on..."
"0"	"The 'Grecian goddess' snack a dietitian eats to fight acne"	"Oh, how very Mediterranean."
"0"	"Iran's president: New oil field found with over 50B barrels"	"Iran has discovered a new oil field in the country's south with over 50 billion barrels of crude, its president said Sunday, a find that could boost the country's proven reserves by a third as it struggles to sell energy abroad over U.S. sanctions. The announcement by Hassan Rouhani comes as Iran faces crushing American sanctions after the U.S. pulled out of its nuclear deal with world powers last year."
"0"	"Myanmar accused at UN court of genocide against Rohingya"	"Myanmar was accused Monday of genocide at the U.N.'s highest court for its campaign against the country's Rohingya Muslim minority, as lawyers asked the International Court of Justice to urgently order measures "to stop Myanmar's genocidal conduct immediately." Gambia filed the case on behalf of the Organization of Islamic Cooperation."
"0"	"Democrats release three new transcripts as part of impeachment inquiry"	"House Democrats released three new transcripts Monday as they charge closer towards the open hearing phase of their impeachment inquiry later this week.The release included the transcript of Laura Cooper, top Defense official who oversees Ukraine, who testified about the Trump administration's decision to withhold nearly $400 million in aid to Ukraine, which Democrats are examining as part of the House investigation into whether President..."
"1"	"Jennifer Garner Shares a Relatable Mom Moment Taking Her Daughter to the Bus: 'Kept It Classy'"	"Jennifer Garner Shares a Relatable Mom Moment"
"0"	"Les Miles Has Some Thoughts on the Shape of the Earth"	"Sports are filled with some weirdos and, as such, we're privy to plenty of divergent thoughts on the shape of the Earth. Kyrie Irving made big news by doubling down on a conspiracy theory before backing away from it and apologizing. Les Miles, long a fellow who marches to the beat of his own drum, got philosophical or maybe literal about the topography contour of our planet in response to a fairly simple question today. Les Miles on what he's..."
"1"	"Prosecutors want black judge who criticized incarceration rates of African Americans removed"	"Iberia Parish judge Lori Landry has questioned the large number of black Louisianans incarcerated by the district attorney's office"
"0"	"Why Kate & Meghan Were on Different Balconies for Remembrance Sunday"	"There's no scandal here. It's all about the order of precedence."
"1"	"A body-language expert says Meghan Markle is "politely disconnecting" from the public, and honestly, we would too"	"Can we blame her? Meghan Markle is supposedly "politely disconnecting" from the public as seen in her body language, and girl, you do you."
"0"	"20 Style Lessons Chrissy Teigen Taught Us That We'll Remember Until the End of Time"	"There are plenty of stylish women whose wardrobes we'd love to raid: Meghan Markle's, with all her colorful dresses."
"0"	"US held record number of migrant children in custody in 2019"	"The 3-year-old girl traveled for weeks cradled in her father's arms, as he set out to seek asylum in the United States."
"1"	"The size of a bus, rare and endangered whale shark spotted off Florida coast"	"Bigger than Jaws, but not nearly as dangerous, the largest fish in the sea, a whale shark, was spotted off the Florida coast."
"0"	"Hearing set for man charged in Alabama woman's disappearance"	"A man charged in the disappearance of a missing Alabama college student is due in court for a hearing that could reveal some evidence about the case."
"0"	"How the Mid-Engine Corvette Helped Chevy Make a Better Small Block"	"We went to GM's racing headquarters in Pontiac, Michigan to learn all about the C8 Corvette's LT2 V-8, and how it improves on the legendary small block."
"1"	"Fisherman faces prison, fine for cruel act on rare fish"	"A fisherman faces serious consequences for using a power saw to cut off the nose of a rare smalltooth sawfish off the Florida coast."
"1"	"Albuquerque police say robbery witness fatally shot"	"Police say a 21-year-old woman was shot and killed as she tried to drive away from an area near an Albuquerque park where she witnessed a late-night robbery. A police spokesman said in an email late Saturday that Cayla Campos had been playing Pokémon Go with her boyfriend the previous night when she and others saw a robbery of people seated in another vehicle."
"1"	"Pregnant Florida woman uses AR-15 to fatally shoot armed intruder"	"Two armed men broke into the house and pistol whipped husband, before wife pulled out their legally possessed weapon and opened fire."
"1"	"Top Putin aide named by MH17 airliner investigators"	"An international investigation into the 2014 downing of Malaysia Airlines flight MH17 on Thursday released a series of phone intercepts, including one between a top aide to Russian President Vladimir Putin and pro-Russian rebels accused in the crash."
"0"	"North Korea says Trump administration sought reopening of nuclear talks"	"North Korea on Thursday said the United States has proposed a resumption of stalled nuclear negotiations in December as they approach an end-of-year deadline set by North Korean leader Kim Jong Un for the Trump administration to offer an acceptable deal to salvage the talks."
"0"	"Trump Organization ordered to pay $290,000 after losing battle against Scottish wind farm"	"President Trump has a long-standing disdain for windmills, including the ones he said would harm views from his golf course."
"0"	"10 Funny Christmas Gifts to Make Your Friends Giggle"	"We've found cute and funny Christmas gifts perfect for your family and friends with great senses of humor. The post 10 Funny Christmas Gifts to Make Your Friends Giggle appeared first on Taste of Home."
"0"	"111 Great Gluten-Free Thanksgiving Recipes"	"It's easy to be gluten-free at Thanksgiving with these crowd-pleasing recipes."
"0"	"Iraq protests death toll rises to 305 with nearly 15,000 injured"	"At least 305 people have been killed and nearly 15,000 have been injured in Iraq since the start of anti-government protests in October, according to activists and the Independent High Commission for Human Rights of Iraq (IHCHR)."
"1"	"Locals crawl under burning car to rescue trapped puppies in west India"	"Locals in west India formed a human chain to rescue four newborn puppies from under a burning car. The incident took place on October 13 in the state's Surendranagar district, Gujarat. Locals rushed to the spot after seeing an abandoned police jeep catch fire. Inspecting the area around the vehicle, one of the rescuers saw the puppies under the jeep and decided to carry out the operation. As he bent down to pull out the puppies, others joined in to help him. The puppies were taken out one by one while the mother dog could not be seen anywhere - it is not known if she abandoned them or had gone out to look for food. Reports said the dog had given birth to four puppies under the abandoned police van."
"0"	"3 retirement numbers you absolutely need to know"	"These numbers can be the key to a happy and comfortable retirement."
"1"	"'Go back to work': Outcry over deaths on Amazon's warehouse floor"	"Billy Foister died last month after a heart attack at work. The incident was just one in a series of recent accidents and fatalities"
"0"	"Why You Should Cook Turkey Breast This Year, Not the Whole Bird."	"Instead of wrestling a massive 25-pound bird into your oven, we propose that you roast a turkey breast instead. Yes, just the breast. Here's why (and how to do it)."
"0"	"US Coast Guard is searching for two missing boaters after a storm capsized their vessel"	"A search is underway for two missing boaters after a storm capsized a vessel off the southeastern coast of Florida on Friday, the US Coast Guard said."
"0"	"Trump Impeachment Inquiry Delves into Idea of Quid Pro Quo"	"At the heart of the House impeachment inquiry into President Trump's Ukraine dealings is a Latin term that is easy to translate but legally difficult to define and prove."
"0"	"7 Women Share What It's Really Like To Work On A Cruise Ship"	"If you've ever taken a cruise vacation, you know that it takes thousands of people to make sure you and your fellow travelers are housed, fed, and entertained well while on the trip. But, as travelers, there's a lot that goes into cruise ship hospitality we don't know about. To find out what it's really like to work and live on a cruise ship, we spoke to seven current and former employees. The folks we interviewed worked for Royal Caribbean..."
"0"	"10 Landscaping Must-Dos to Help Your Plants Survive the Winter"	"Winter has a way of wreaking havoc on the landscape, leaving in its wake heaved plants and wind-torn trees and shrubs. This year, don't just sit back and wait to see how your garden fares over the cold months. Take action now to make sure your landscape will be healthy and beautiful come spring."
"0"	"Missing California hiker found dead at top of glacier just weeks before baby was due"	"A missing hiker from Huntington Beach California was found dead on Thursday at the top of the Darwin glacier in the Inyo National Forest."
"0"	"Fire Destroys Classic Porsche Cars And Parts Worth $3 Million"	"Well-known for their vintage Porsche builds, Benton Performance has burnt down to the ground along with a bunch of irreplaceable vintage Porsche cars and parts."
"0"	"Republicans attempt to move impeachment inquiry away from Trump"	"A list of witnesses demanded Saturday fits a pattern for GOP lawmakers, who have focused heavily on pushing various conspiracy theories and attacking Democrats as unfairly partisan."
"0"	"A Trump Tax Break To Help The Poor Went To a Rich GOP Donor's Superyacht Marina"	"The Trump tax law gave governors the authority to distribute valuable tax breaks, and they have wielded it to benefit the politically connected."
"0"	"Jennifer Lopez Just Got a Teeny Chop to Her Blond Lob, but it Changed the Entire Look"	"In September, Jennifer Lopez debuted a new hairstyle at the premiere of Hustlers."
"0"	"Red tide, the toxic algae bloom that kills wildlife, returns to southwest Florida"	"Southwest Florida is warily watching the return of red tide, a toxic algae bloom that cost businesses nearly $150 million in losses last year"
"0"	"Porsche launches into second story of New Jersey building, killing 2"	"The Porsche went airborne off a median in Toms River, causing it to crash into a red brick building."
"1"	"Taylor Swift's emotional moment with Kelly Clarkson's 'Voice' contestant"	"Taylor Swift shares an emotional moment with Kelly Clarkson's team member, who revealed she was only there because of Taylor."
"1"	"Meghan Markle's estranged brother says 'she is only in Buckingham Palace with Harry because of her dad' after he 'paid for her education and fancy clothes'"	"Earlier this year, Thomas Markle Sr. leaked a private letter Meghan sent to him to the Mail on Sunday."
"0"	"Christmas tree decorating ideas for every style and budget"	"Whether you love creating a traditional show-stopper or prefer to keep it country, we've got a Christmas tree decorating idea that will make yours stand out from the festive crowd."
"0"	"What Joe Biden Actually Did in Ukraine"	"When Russia invaded Ukraine in early 2014, Vice President Joseph R. Biden Jr. pressed President Barack Obama to take decisive action, and fast, to make Moscow "pay in blood and money" for its aggression."
"1"	"Roommate, her boyfriend charged in death of missing Atlanta student"	"Missing Atlanta student Alexis Crawford was found dead."
"0"	"The Volkspod VW Beetle Minibikes Are Part Creepy, Part Adorable"	"The people's pods."
"0"	"Country music's biggest scandals"	"From Wynonna Judd's husband's arrest to the Dixie Chicks' vent about George W. Bush, relive country's biggest scandals."
"1"	"Eddy Merckx Hospitalized for Serious Head Injury Following Bike Crash"	"The five-time Tour de France winner was injured Sunday during a bike outing with friends."
"0"	"13 Popular Foods People Hated Eating 100 Years Ago"	"Culinary trends are just as fickle as fashion. Find out which gourmet foods you love used to only be fed to animals or prisoners. The post 13 Popular Foods People Hated Eating 100 Years Ago appeared first on Reader's Digest."
"0"	"Josh Gordon on track for debut with Seahawks"	"RENTON, Wash. (AP) Josh Gordon didn't know where he'd land following his release from the New England Patriots last week. He did have one place in particular he wanted to end up."
"0"	"12 Fall Landscaping Mistakes to Know and Avoid"	"Whether you have a green thumb when it comes to your home garden, or you can hardly tell the difference between a rose and a weed, you should know that there are certain landscaping tasks that need to be done right to keep your home exterior looking its best. But to do that, you must avoid the most common fall landscaping blunders."
"0"	"Charles Rogers, former Michigan State football, Detroit Lions star, dead at 38"	"Charles Rogers, the former Michigan State football star whom the Detroit Lions selected with the second overall pick in 2003 NFL draft, has died."
"0"	"How the 2020 Corvette C8 Turned This Vette Hater Into a Believer"	"The one thing keeping the Corvette from greatness has been thoroughly rectified."
"0"	"18 Quiet Dogs That Don't Bark (Too Much)"	"Looking for a dog that keeps its bark on the down-low? Animal behaviorists say these quiet breeds could be a perfect match. The post 18 Quiet Dogs That Don't Bark (Too Much) appeared first on Reader's Digest."
"1"	"Kate Middleton Wore a Simple Black Dress and Embellished Headband to the Festival of Remembrance"	"The Duchess of Cambridge and the rest of the royal family are honoring those who have died in battle this weekend."
"0"	"What Happens When a Plane Collides with a Flock of Birds?"	"It's a bird...it's a plane...it's a midair nightmare?"
"0"	"Lance Altimeter Is A Delicious Drop-In Truck Camper Debuting At SEMA"	"The all-in-one Overlanding package sleeps four and is fully equipped for an off-grid weekend."
"1"	"Lamb takes revenge on man who tried to ride it"	"Shaquille decided to play a prank on his brother, Mykel. He introduced him to very special (and angry) sheep in Dunedin, New Zealand. When his brother tried to ride it, he felt, and the lamb attacked him!"
"0"	"The 1 reason you shouldn't hesitate to claim Social Security early"	"Seniors are often told to wait on Social Security, but here's a good argument for filing sooner."
"1"	"See inside the 300-square-foot tent that a couple transformed into a tiny home for their family"	"The family has lived in the tent for two years. It runs on solar power and features two beds, a composting toilet, and an outdoor shower."
"0"	"Is retirement dying? The old work model is disappearing for Boomers, Gen Xers"	"More Americans are opting to work well into retirement, a growing trend that threatens to upend the old workforce model."
"0"	"The Geno Smith coin toss conspiracy is the dumbest thing in Seahawks' win over 49ers"	"Did Geno Smith say "heads" or "tails" in the coin flip for overtime?"
"0"	"The most exclusive hotel in every state"	"All these hotels have just one thing in common   guests just can't get enough of them. From celebrity favourites and ultra-small boutique stays to outrageously expensive suites, you'll have to either whip out the credit card or patiently wait to bag a night at one of these exclusive hotels in America."
"1"	"Fiancee of victim killed in Hard Rock Hotel accident describes his final moments"	"The body of Hard Rock Hotel collapse victim Quinnyon Wimberly will not be recovered before a demolition of the building."
"1"	"'Pioneer Woman' star Ree Drummond shows off weight loss in new selfie"	"Ree Drummond is known for her skills in the kitchen but now she's a gym pro as well. The 50-year-old says she went down a pants size thanks to hard work."
"0"	"Ilhan Omar blasts Pete King as an 'Islamophobe' after he announces retirement: 'Good riddance'"	"Rep. Ilhan Omar (D-Minn.) on Monday denounced Rep. Pete King (R-N.Y.) as an "Islamophobe" after the longtime GOP lawmaker announced that he would not seek re-election in 2020. Omar, who earlier this year became one of the first Muslim women sworn into Congress, specifically called out controversial statements King made about the Muslim community and Eric Garner during his long tenure in Congress."Peter King is an Islamophobe who held...""
"1"	"College gymnast dies following training accident in Connecticut"	"Melanie Coleman, 20, of Milford, was practicing on the bars when she suffered a spinal cord injury."
"0"	"Stylish Living Room Ideas, From Floral to Family-Friendly"	"Bookmark this for the next time you need a refresh."
"0"	"691,145 Californians left last year: What state did they go to?"	"Look at the comings and goings as a ratio of ins to outs. Tiny Idaho wins this race with 497 arrivals from the Golden State for every 100 former Gem State residents who moved to California."
"0"	"13 Ways You're Shortening the Life of Your Car"	"Put the brakes on these all-too-common mistakes to help keep your car on the road and out of the shop."
"1"	"Jeff Bezos is set to lose his crown as world's richest person"	"Jeff Bezos is about to relinquish the title of world's richest person to Bill Gates, as Amazon.com Inc. stock tumbled in late trading Thursday."
"0"	"Saudi Aramco takes another step toward 1st public offering"	"DUBAI, United Arab Emirates (AP)   Saudi Arabia's state-owned oil giant Aramco revealed it will sell up to 0.5% of its shares to individual investors, but in a lengthy document published late Saturday it did not disclose how much of the company will be floated when it goes public on the country's domestic exchange."
"0"	"Every Team's Best Play | Week 10"	"Check out every team?s best play from Week 10 of the 2019 NFL season."
"0"	"The biggest wastes of money in 2019"	"Relive 2019 with this look at some of the biggest wastes of money of the year."
"1"	"Lindsay Lohan's dad weighs in on her relationship with the Saudi crown prince"	"Michael Lohan denies that Lindsay is dating the controversial royal known as MBS but acknowledges that they're friends."
"0"	"White House struggles to get in sync on impeachment"	"A White House that has repeatedly struggled to get in sync is sending messages of disharmony days before the first televised public impeachment hearings, which are expected to highlight the divide in the administration over President Trump's efforts in Ukraine.The scattershot White House messaging and strategy is nothing new in and of itself. GOP lawmakers and some outside allies have repeatedly criticized the administration for failing to get..."
"1"	"Kate Middleton fired her longtime personal assistant amid split from Meghan Markle and Prince Harry"	"Sophie Agnew, Middelton's longtime aide of seven years, was fired after she returned home from her honeymoon."
"0"	"The best Airbnb under $100 in every state"	"When the holiday budget doesn't stretch to upmarket hotels and 5-star resorts, Airbnb is a great way of finding one-of-a-kind stays for reasonable prices. From log cabins in the mountains to artsy lofts in the country's coolest downtowns, we've found the best Airbnb under $100 in every state."
