"1"	"Trump's attempt to hire Trey Gowdy for legal team unravels over lobbying rules"	"newspolitics"
"0"	"38 men who were worthy competitors for John Legend's Sexiest Man Alive title"	"celebrity"
"1"	"Surfing executive sentenced to prison in college admissions scam"	"newscrime"
"0"	"50 Weird but Wonderful Facts That Will Leave You Totally Amazed"	"lifestyledidyouknow"
"1"	"LASIK eye surgery should be taken off market, ex-FDA adviser says"	"health-news"
"0"	"The Queen's Dressmaker Reveals She Uses Gin to Clean the Royal Jewels"	"lifestyleroyals"
"0"	"For three decades, one man, now 75, has cared for Philly's Vietnam and Korean War memorials"	"newsus"
"0"	"Report: Ohio State asks NCAA to reinstate star DL Chase Young immediately"	"football_ncaa"
"0"	"Jerry Jones hopes loss to Vikings isn't 'terminal'"	"football_nfl"
"0"	"7 Women Share What It's Really Like To Work On A Cruise Ship"	"travelnews"
"1"	"See Vin Diesel's 21st birthday post to Paul Walker's daughter Meadow"	"movies-celebrity"
"0"	"3 awful reasons to take Social Security benefits at 65"	"finance-retirement"
"0"	"Here's how pumpkin is prepared in 13 countries around the world"	"videos"
"1"	"Longtime Republican Rep. Pete King won't seek reelection"	"elections-2020-us"
"1"	"Cartel gunmen terrorize Mexican city, free El Chapo's son"	"newsworld"
"1"	"No bulletproof vests and poor pay: Rural police struggle to recruit new officers"	"newsus"
"0"	"Trump, Macron to meet after French president criticized NATO"	"newsworld"
"0"	"15 of the Best Towing Vehicles That Aren't Trucks"	"autosresearchguides"
"0"	"Chuck E. Cheese just got major makeover   and axed the animal band"	"foodnews"
"1"	"5 Signs of Protein Deficiency You Should Never Ignore"	"nutrition"
"0"	"49ers' dream season veers off-road in OT loss to Seahawks"	"football_nfl"
"0"	"49ers' Jaquiski Tartt rips ball from Seattle's D.K. Metcalf on amazing play"	"football_nfl"
"0"	"49ers' Ronald Blair done for the year with an ACL tear"	"football_nfl"
"1"	"The 12 Texas cities everyone in the country is moving to"	"newsphotos"
"1"	"Kasich to Congress: 'Look in the mirror at how you want to be remembered'"	"newspolitics"
"0"	"Every touchdown from every Week 10 game"	"football_nfl_videos"
"0"	"NFL halfway awards: Russell Wilson AP's clear MVP favorite"	"football_nfl"
"0"	"FCA And GM Unfazed By The Ford Bronco's Return"	"autosnews"
"0"	"Golden Gums! 200-Year-Old Gold Teeth Made of Ivory & Gold Set to Go for Thousands at Auction!"	"viral"
"1"	"Fox News contributor: 'Most likely' outcome is Trump doesn't run in 2020"	"newspolitics"
"1"	"'Prepare to die' Trump adviser Stone texted witness, trial jury hears"	"newspolitics"
"1"	"They bonded over football years ago. Now President Trump sees Mitt Romney as his harshest GOP foe."	"newspolitics"
"0"	"After push from Perry, backers got huge gas deal in Ukraine"	"newspolitics"
"1"	"Woman Finds A Giant Wild Snake Just Chilling In Her Bed"	"lifestylebuzz"
"0"	"Stella McCartney Deleted a Meghan Markle Instagram Post After Followers Called Her Out"	"lifestyleroyals"
"1"	"The Last Truly Wild Horses Are Alive and Well in Chernobyl"	"lifestylebuzz"
"0"	"One of America's biggest solar panel makers quits manufacturing"	"finance-companies"
"0"	"Gwen Stefani Reveals New Nickname for Her and Blake Shelton"	"music-celebrity"
"0"	"Couples of CMA Awards past"	"music-celebrity"
"1"	"Rising California gasoline prices highlight growing divide in US"	"markets"
"0"	"With latest sign-stealing revelations, Houston Astros once again toe baseball's ethical lines"	"baseball_mlb"
"0"	"My Third Husband Is 102 Years Old. Here's What Our Marriage Is Like."	"voices"
"0"	"AP sources: Deval Patrick mulling Democratic White House run"	"elections-2020-us"
"0"	"Bloomberg leads Trump by 6 points in 2020 election matchup"	"elections-2020-us"
"0"	"How a preacher sent gunmen into Burkina Faso's schools"	"newsworld"
"0"	"Joey Fatone explains the 'dumb idea' that led to pant-splitting 'DWTS' wardrobe malfunction"	"music-celebrity"
"1"	"Air Canada will no longer call passengers 'ladies and gentlemen,' and will use the gender-neutral term 'everybody' instead"	"travelnews"
"0"	"Mexico makes arrests in massacre of American women, children: minister"	"newsworld"
"1"	"Little Feat Guitarist Paul Barrere Dead at 71"	"musicnews"
"0"	"40 Nutrition Experts Told Us The Foods You Should Be Eating Every Day"	"nutrition"
"1"	"NFL draft winners and losers: Joe Burrow not the only standout in LSU-Bama thriller"	"football_ncaa"
"1"	"The best places to raise a family in the West"	"finance-real-estate"
"0"	"Mo'Nique Files Race and Sex Discrimination Suit Against Netflix"	"tvnews"
"0"	"Analysis: Two Impeachments, but Two Radically Different Accusations"	"newspolitics"
"0"	"Senior Trump official embellished résumé, had face on fake Time cover"	"newspolitics"
"1"	"Fleeing Carjacking Suspect Crashes Into Vehicle Killing Newly Married Couple"	"newscrime"
"0"	"Eerie photos of an abandoned airport that hasn't been touched in 25 years"	"newsphotos"
"0"	"Browns cut WR Antonio Callaway hours before kickoff amid reported substance-abuse ban"	"football_nfl"
"1"	"Veterinary students strip down for calendar to promote mental health"	"health-news"
"1"	"The best independent bakery in every state"	"restaurantsandnews"
"0"	"Feud Between Trump Advisers Underscores a White House Torn by Rivalries"	"newspolitics"
"0"	"Arby's tells parents that 'only well behaved children' are allowed"	"restaurantsandnews"
"1"	"Willie Brown, Hall of Famer and Raiders legend, dies at 78"	"football_nfl"
"1"	"Common Joint Pain Treatment Dubbed 'Unsafe' By Experts"	"medical"
"0"	"Brooklyn Brewery Shows Craft Beer Can Be Nonalcoholic Too"	"beverages"
"0"	"Impeachment team releases transcript of defense official"	"newspolitics"
"0"	"39 Appetizers for a Crowd That Are Easy and Unexpected"	"quickandeasy"
"0"	"11 reasons to watch Week 11 of the 2019 NFL season"	"football_nfl_videos"
"1"	"This Is What Happens When You Take Ibuprofen Too Often, According to a Doctor"	"medical"
"0"	"A Man and His Shelby G.T. 350 51 Years On"	"autosclassics"
"1"	"Tensions, tears, trauma: the Democratic voters suffering under Trump"	"newspolitics"
"0"	"New Type of the World's Oldest Meat-Eating Dinosaur Discovered"	"science"
"0"	"Nikki Haley grilled over Trump's Ukraine conduct, truthfulness"	"newspolitics"
"0"	"Mets' Alonso, Astros' Alvarez named Rookies of the Year"	"baseball_mlb"
"0"	"Sears is laying off hundreds of corporate employees after announcing 96 store closings"	"finance-companies"
"0"	"Hailey Bieber Sends Aunt Hilaria Baldwin Love After Her Second Miscarriage"	"celebrity"
"0"	"Stars who've had more than one wedding with the same spouse"	"entertainment-celebrity"
"0"	"C8 Corvette Dyno Test Follow-Up: What Really Happened"	"autosnews"
"1"	"Ireland has a hate crime problem and its legislation is not fit to deal with it"	"newsworld"
"1"	"Former Trump advisor John Bolton's lawyers are in contact with impeachment probe panels"	"newspolitics"
"0"	"Distressing photos show glaciers that are disappearing or on the brink of collapse around the world"	"weathertopstories"
"1"	"Why Ukraine and Russia are still at war"	"newsworld"
"1"	"My Doctors Told Me I Had IBS. 4 Years Later, I Found out It Was a Completely Different Disorder"	"voices"
"1"	"Trump Jr. says "there are very few people" his dad can "fully trust""	"newspolitics"
"1"	"Lil Pump bit by snake on set of music video"	"musicnews"
"0"	"105 Black Friday Deals You Can Start Shopping Today"	"shop-holidays"
"0"	"Nikki Haley claims top aides tried to recruit her to 'save the country' by undermining Trump"	"indepth"
"0"	"White House to use webcams to create live feed of border wall construction"	"newsus"
"0"	"15 key questions for NFL Week 10"	"football_nfl"
"1"	"Security camera spots SOS from woman lost for three days in Australia"	"newsworld"
"0"	"Richard Sherman tells NFL players to save their money and prepare for a strike"	"football_nfl"
"0"	"Rep. Ilhan Omar is accused of 'dog whistle' anti-Semitism after she posts tweet implying billionaire businessman Leon Cooperman is only supporting Michael Bloomberg's presidential run because he is Jewish"	"newspolitics"
"1"	"My late sister stole my inheritance and swindled our mother"	"personalfinance"
"1"	"Health-care system causing rampant burnout among doctors, nurses"	"finance-healthcare"
"1"	"Two women joined GM more than a decade ago. Their futures couldn't be more different"	"finance-companies"
"0"	"13 Popular Foods People Hated Eating 100 Years Ago"	"foodnews"
"1"	"Panera Bread worker fired after TikTok exposed frozen mac and cheese"	"foodnews"
"1"	"I've had it with this former friend"	"lifestylefamily"
"1"	"8 Relationship Anxieties That Harm a Marriage   And How to Avoid Them"	"lifestylefamilyandrelationships"
"1"	"Aspen Ladd's suspension for scary weight cut lifted after showing focus on 'real weight loss'"	"mma"
"0"	"Man cuffed for eating sandwich on train platform gets an apology"	"newsus"
"0"	"10 Gazans dead as Israel hit on militant chief sparks rocket barrage"	"newsworld"
"1"	"Yardbarker's NFL Week 7 game-by-game analysis, grades"	"football_nfl"
"0"	"Cook leads Vikings to 28-24 prime-time road win over Cowboys"	"football_nfl"
"0"	"In Less Than a Decade, You Won't Be Able To Afford a Home in These Cities"	"finance-real-estate"
"0"	"11 Fine-Dining Etiquette Rules You've Probably Broken Your Whole Life"	"videos"
"1"	"Where is 'Kokomo?' People are still searching for The Beach Boys' tropical island getaway"	"travelnews"
"0"	"How to Choose Piston Rings and Gap Them Correctly"	"autosenthusiasts"
"1"	"U.S. And Russia at 'Colossal' Danger of Conflict, Mikhail Gorbachev Warns: 'Nuclear Weapons Must Be Destroyed'"	"newsworld"
"1"	"'Tarzan' Actor Ron Ely: Actor's son allegedly killed his mother before deputies shot and killed him, sheriff's office says"	"tv-celebrity"
"1"	"NFL world reacts to officials handing Packers win over Lions"	"football_nfl"
"0"	"America's Most and Least Popular Senators"	"newspolitics"
"1"	"Yardbarker's NFL Week 6 game-by-game analysis, grades"	"football_nfl"
"0"	"New Report Exposes Dolphin Cruelty in Travel Industry"	"travelnews"
"0"	"How to Winterize a House"	"finance-real-estate"
"0"	"Can A Ford Raptor Fully Charge A Tesla Model 3 By Towing It?"	"autosenthusiasts"
"0"	"50 Ways Thanksgiving Foods Have Changed in the Last 50 Years"	"foodnews"
"1"	"Analysis: Trump's Presidency on Treacherous New Ground After House Vote"	"newspolitics"
"0"	"Judge includes law student's toddler during sweet swearing-in ceremony"	"newsgoodnews"
"0"	"AP-NORC poll: Many youths say high school diploma is enough"	"newsus"
"0"	"Why aren't wages rising faster even with low unemployment? Trade war, weaker economy are among reasons"	"markets"
"0"	"Flight Attendants Have a Secret Language You Didn't Know About"	"travelnews"
"0"	"Best Dive Bar in Every State"	"beverages"
"0"	"These are the words your teen applying to college needs to hear from you"	"lifestyleparenting"
"0"	"9 things we learned from Sunday's games of Week 10 of NFL season"	"football_nfl"
"0"	"Andrew Yang's Campaign Has a Lot of Money. Now What?"	"markets"
"1"	"Nobody Waved Goodbye: Trump's Relationship With New York Was Already Over"	"newspolitics"
"0"	"Mexico asks FBI to help probe killing of Americans"	"newsworld"
"1"	"'Supernatural' star arrested for multiple altercations in Texas"	"tv-celebrity"
"0"	"The 32 most affordable winter vacation spots in the US"	"travelarticle"
"0"	"San Francisco's new DA pledges not to prosecute public urination, other quality-of-life-crimes"	"newsus"
"0"	"Cherry disappointed with MacLean's apology: 'He buried me'"	"icehockey_nhl"
"0"	"Big celebrity money moments of the last decade"	"entertainment-celebrity"
"1"	"Michigan Wolverines QB commit JD Johnson must retire from football due to heart issue"	"football_ncaa"
"1"	"Why Are Dressers Vanishing from Hotel Rooms?"	"travelnews"
"0"	"Kaiser Permanente CEO Bernard Tyson dies at 60"	"finance-companies"
"1"	"A Northeast storm is intensifying into a bomb cyclone, forecasters say"	"weathertopstories"
"0"	"6 ways to use CO2 to cut emissions and generate trillions of dollars"	"markets"
"0"	"Jane Fonda Opens Up About the Possibility of Spending Her 82nd Birthday in Jail"	"movies-celebrity"
"0"	"200 Shocking Home Photos You Have to See"	"lifestylehomeandgarden"
"0"	"The 21 most iconic CMA Awards performances"	"cma-awards"
"0"	"Man lost his house over $8.41 in unpaid property taxes"	"finance-real-estate"
"1"	"Robert Forster, Oscar-Nommed Star of 'Jackie Brown,' Dies at 78"	"movienews"
"1"	"At stressful time, Boy Scouts top boss goes on medical leave"	"newsus"
"1"	"Tearful Murray wins at Antwerp for 1st ATP title since 2017"	"tennis"
"0"	"These are the new cars that depreciate least"	"autosresearchguides"
"0"	"Ilhan Omar blasts Pete King as an 'Islamophobe' after he announces retirement: 'Good riddance'"	"elections-2020-us"
"0"	"Wealthy investors are bracing for a sharp stock sell-off in 2020"	"markets"
"1"	"'The Giuliani problem' and other takeaways from diplomats' impeachment testimony"	"newspolitics"
"0"	"37 Years After His Wife Is Found Dead with an Ax in Her Skull, Husband Is Arrested"	"newscrime"
"0"	"Neil Young Says U.S. Citizenship Application Delayed By Marijuana Use"	"music-celebrity"
"0"	"The Geno Smith coin toss conspiracy is the dumbest thing in Seahawks' win over 49ers"	"football_nfl"
"0"	"What Teens Did a Decade Ago That They Don't Do Anymore"	"lifestyledidyouknow"
"0"	"Fans are divided after Drake was revealed as a surprise festival headliner, booed off stage"	"musicnews"
"0"	"How Long Does Alcohol Stay in Your System? We Asked an Expert"	"wellness"
"1"	"Harold Bloom, author of 'Anxiety of Influence,' dies at 89"	"entertainment-books"
"1"	"Before-and-after photos reveal how landmarks have been ravaged by fires, floods, and melting ice over the last decade"	"weathertopstories"
"0"	"13 Ways You're Shortening the Life of Your Car"	"autosownership"
"0"	"Welcome to the World! All of the Celebrity Babies Who've Made Their Debuts in 2019"	"celebrity"
"1"	"The One Thing Kourtney Kardashian Drinks Every Morning for Younger-Looking Skin"	"wellness"
"0"	"7 Easy-to-Miss Milestones That Indicate You're On Track to Becoming Successful"	"lifestylecareer"
"1"	"Strange Dog Shows Up On Woman's Lawn   And Seems To Recognize Her"	"lifestylebuzz"
"1"	"Deer fatally attacks hunter who shot him"	"newsus"
"0"	"Predicting the winners of the 2019 CMA Awards"	"cma-awards"
"0"	"Three school workers charged in death of special needs student"	"newscrime"
"0"	"Chick-fil-A's Peppermint Chocolate Chip Milkshake Is Finally Back For The Holidays"	"restaurantsandnews"
"1"	"Chrissy Teigen Predicts The Office's Jim and Pam Are Divorced Now, Sends Twitter into a Tailspin"	"tv-celebrity"
"0"	"The Key to Mastering Goulash, the World's Most Famous Stew"	"recipes"
"0"	"Cows swept out to sea by Hurricane Dorian are found months later   on the Outer Banks"	"newsus"
"1"	"Meghan Markle says her friends warned her not to date Prince Harry because 'the British tabloids will destroy your life'"	"lifestyleroyals"
"0"	"Maggert holes out to win Champions finale; McCarron takes Schwab Cup"	"golf"
"0"	"Pompeo's Impeachment Role Draws Outcry From Diplomats, Staffers"	"newspolitics"
"0"	"Choosing the right winter tires for snow and ice: A quick guide"	"autosownership"
"0"	"Meghan Markle and Prince Harry Honor Veterans Day Through Instagram"	"lifestyleroyals"
"0"	"Ranking the 11 most disappointing NFL teams of 2019"	"football_nfl"
"0"	"Hate crimes remain at heightened levels, FBI report finds"	"newsus"
"1"	"'It's not over': Sarah Palin says she is fighting to repair her marriage"	"newsus"
"1"	"A bodybuilder showed how fitness influencers can make their bodies look Instagram-perfect in before-and-after photos"	"fitness"
"0"	"What happens in your body when you sneeze?"	"wellness"
"0"	"The Best (and Worst) Store-Bought Onion Rings, Ranked"	"tipsandtricks"
"0"	"The 1 reason you shouldn't hesitate to claim Social Security early"	"finance-retirement"
"0"	"Why You Should Cook Turkey Breast This Year, Not the Whole Bird."	"tipsandtricks"
"0"	"How the Trump Administration Eroded Its Own Legal Case on DACA"	"newsus"
"1"	"Does Tire Rotation Include Tightening Lug Nuts? Michigan Court Thinks About It For Awhile, Concludes 'No'"	"autosnews"
"0"	"Ohio-grown Christmas trees headed to troops overseas"	"newsgoodnews"
"0"	"Marie Osmond 'chipped off a piece' of her kneecap when she fell on stage during performance"	"tv-celebrity"
"1"	"LSU makes case as No. 1 while massive upset shakes up SEC picture"	"football_ncaa"
"0"	"Supreme Court weighs fate of DACA, 700,000 young immigrants"	"newsus"
"0"	"The 25 most iconic film quotes"	"movies-gallery"
"0"	"Meghan Markle and Prince Harry Reunite with Kate Middleton and Prince William for Remembrance Service"	"lifestyleroyals"
"1"	"Energy chief Perry says departure has 'absolutely nothing' to do with Ukraine"	"newspolitics"
"0"	"Stephanie Parze's Car Is at Home. So Is Her Phone. But She's Missing."	"newscrime"
"0"	"'Monday Night Football' commentator under fire after belittling criticism of 49ers kicker for missed field goal"	"football_nfl"
"0"	"Fear spreads among Iraqi protesters as government cracks down, keeps death toll secret"	"newsworld"
"0"	"Why You Shouldn't Ever Go for the Cheapest Brake Pads"	"autosbuying"
"0"	"Pastor Evan Mawarire says life after Mugabe is more brutal than ever in Zimbabwe"	"newsworld"
"1"	"Donald Trump Jr. reflects on explosive 'View' chat: 'I don't think they like me much anymore'"	"tvnews"
"0"	"In Defense Of Left Foot-Braking During Normal Street Driving"	"autosenthusiasts"
"0"	"Trump warns Wall Street his defeat would endanger market gains"	"markets"
"1"	"Frequent Urination At Night: A Sign Of Serious Health Problem"	"medical"
"0"	"Prince Harry and Meghan Markle just shared a never-before-seen photo of baby Archie with his 'Grandpa' Prince Charles to celebrate his birthday"	"lifestyleroyals"
"0"	"Hong Kong protester shot at close range, counterprotester set on fire in latest escalation of violence"	"newsworld"
"0"	"Who will be best team in the NFL after Week 11?"	"football_nfl_videos"
"1"	"Lawsuits, payouts, opioids crisis: what happened to Johnson & Johnson?"	"finance-companies"
"1"	"Boris Johnson Loses a Critical Brexit Vote, Throwing the Process Into Disarray"	"newsworld"
"0"	"The Sexiest Photos Ever of Our 29 Sexiest Men Alive"	"celebrity"
"0"	"Dog Doesn't Understand Why His Favorite Ball Won't Move"	"lifestylebuzz"
"0"	"25 Biggest Grocery Store Mistakes Making You Gain Weight"	"nutrition"
"0"	"Halle Berry Shares Photo of 6-Pack Abs on Instagram and Her Fans are Freaking Out"	"fitness"
"0"	"A$AP Rocky Will Return to Sweden to Perform"	"musicnews"
"0"	"Consumer prices rise most in 7 months on higher gas prices"	"markets"
"1"	"Ukrainian lawmakers are still advancing Trump's goal of probes into Bidens, 2016 election"	"newspolitics"
"1"	"How Often Should You Change Synthetic Oil?"	"autosownership"
"0"	"Cashman: Yankees will pursue free agents Cole, Strasburg"	"baseball_mlb"
"1"	"Trump's War on the 'Deep State' Turns Against Him"	"newspolitics"
"0"	"Seattle Sounders 3, Toronto FC 1: Takeaways from MLS Cup"	"soccer"
"1"	"Patriots wanted a test. Now, they need some answers"	"football_nfl"
"0"	"How Russia Meddles Abroad for Profit: Cash, Trolls and a Cult Leader"	"newsworld"
"0"	"How to Sell a House in Southern California: Make a Movie"	"finance-real-estate"
"1"	"Bette Midler mocks Lori Loughlin's college admission scandal"	"music-celebrity"
"1"	"EXCLUSIVE: Given up for adoption at two, a grueling Soviet childhood and a violent marriage: The true story of the homeless 'voice of an angel' is revealed as friends and family rejoice over finding the prodigy they feared they had lost forever"	"newsworld"
"0"	"The NFL Hot Seat: Sean McVay ran out of magic, and Jared Goff isn't helping"	"football_nfl"
"1"	"GOP senator defends calling Pelosi 'dumb': 'What I said was accurate'"	"newspolitics"
"0"	"Family Holiday Get-Togethers Get a Bad Rap, but I Actually Really Love Mine"	"voices"
"0"	"2 dead, 3 injured in a school shooting in Russia"	"newsworld"
"1"	"Report: Mariota, Winston 'likely' done as 'franchise leaders'"	"football_nfl"
"1"	"New Mexico's 'Little Texas' Booms, Igniting Battles Over Oil Windfall"	"newsus"
"0"	"U.S. Drones Appear to Show Turkish- Backed Forces Targeting Civilians"	"newsworld"
"1"	"Subtle Signs You May Have Clogged Arteries"	"medical"
"1"	"Shia LaBeouf Thanks Officer Who Arrested Him in 2017 for 'Changing My Life' in Emotional Speech"	"movies-awards"
"0"	"Lori Loughlin's 'Stress Is Only Mounting' Ahead of Pretrial Hearing"	"tv-celebrity"
"0"	"What this week's 5 biggest upsets mean for the NFL playoff picture"	"football_nfl"
"1"	"The Permian Basin is facing its biggest threat yet"	"markets"
"1"	"Demi Moore Names Male Co-Star Who Didn't Deserve to Make More Money Than Her"	"tvnews"
"0"	"Walmart releases Black Friday ad with $129 Apple Watch, TV deals, electronics doorbusters"	"finance-companies"
"0"	"The 50 most common job interview questions"	"lifestylecareer"
"0"	"The 10 Most Popular Wines in America, Ranked"	"beverages"
"1"	"Singer stands up to heckler who told her to take shirt off"	"popculture"
"1"	"College gymnast dies following training accident in Connecticut"	"newsus"
"1"	"Sleep paralysis: Why we sometimes jerk awake and can't move"	"wellness"
"1"	"Outrage in Spain over verdict in gang sex attack on teen"	"newsworld"
"0"	"University of Florida student president faces impeachment for Trump Jr.'s $50K campus talk"	"newsus"
"1"	"'I am scared all the time': Chimps and people are clashing in rural Uganda"	"newsworld"
"0"	"University suspends 14 frats after college freshman ends up in hospital"	"newsus"
"0"	"Scared Rabbit Abandoned In Box Clings To His Favorite Teddy Bear"	"lifestylebuzz"
"0"	"The healthiest fast food option at every well-known chain"	"restaurantsandnews"
"1"	"Opinion: Other schools can learn from Oregon's hiring of Mario Cristobal"	"football_ncaa"
"0"	"Falling investment revives attacks against Trump's tax cuts"	"finance-taxes"
"0"	"Here's how much it will cost to travel to Africa like Meghan Markle and Prince Harry"	"internationaltravel"
"1"	"Lorde Pens Emotional Letter After Her Dog Pearl's Death: 'I Have Lost My Boy'"	"music-celebrity"
"0"	"Advocacy groups push Senate to include election security money in funding bill"	"elections-2020-us"
"0"	"French Baguettes From a Vending Machine? 'What a Tragedy.'"	"newsworld"
"0"	"Stars who've played royals"	"tv-gallery"
"0"	"The Latest Weight Loss Pills That Work And the Ones That Don't"	"nutrition"
"1"	"Former NBA first-round pick Jim Farmer arrested in sex sting operation"	"basketball_nba"
"1"	"Jaguars Owner Shad Khan Made Some Startling Remarks About Jacksonville on Jags Website"	"football_nfl"
"1"	"'Batwoman' star Ruby Rose says she was misdiagnosed while battling depression"	"movies-celebrity"
"0"	"Top 100 country songs of all time"	"cma-awards"
"0"	"The most famous celebrity kids born this decade"	"celebrity"
"0"	"The highlights and lowlights from the world of comedy in the 2010s"	"humor"
"0"	"John Legend Is PEOPLE's Sexiest Man Alive 2019: 'I'm Excited but a Little Scared at the Same Time'"	"music-celebrity"
"0"	"Gwen Stefani's biggest career moments"	"music-gallery"
"0"	"Alibaba breaks Singles Day record of more than $30 billion in sales and climbing"	"finance-companies"
"0"	"Top storylines for Week 11 in the NFL"	"football_nfl"
"1"	"They Are Racist; Some of Them Have Guns. Inside the White Supremacist Group Hiding in Plain Sight."	"newsus"
"0"	"Dwayne Johnson Announces 'Black Adam' 2021 Release Date"	"movienews"
"0"	"NFL flexes 49ers-Packers to prime time in Week 12 for Eagles-Seahawks"	"football_nfl"
"1"	"America's factories are in trouble, and the trade war is only part of the problem"	"markets"
"0"	"Watch: 49ers score after Seahawks fumble … twice"	"football_nfl"
"0"	"A former royal bodyguard shared the challenges that come with protecting the royal family"	"newsoffbeat"
"0"	"I've had it with this former friend"	"lifestylefamily"
"1"	"Donald Trump Jr walks out of Triggered book launch after heckling   from supporters"	"newspolitics"
"1"	"Industries that will struggle to survive the next 20 years"	"finance-companies"
"1"	"This 73-Year-Old Fitness Fanatic Is Defying Expectations On Every Level"	"fitness"
"0"	"Palestinian death toll from Israeli strikes rises to 22: Gaza ministry"	"newsworld"
"1"	"Mitch McConnell snubbed by Elijah Cummings' pallbearer in handshake line at U.S. Capitol ceremony"	"newspolitics"
"1"	"With an offense like this, Tom Brady might be tempted to do too much"	"football_nfl"
"0"	"Stocks close little changed amid lingering trade worries"	"markets"
"1"	"Four words from dermatologists that'll change your life: Stop showering every day"	"wellness"
"1"	"The World's Largest Desert Is Covered In Ice"	"science"
"0"	"'Dancing with the Stars': Why Sean Spicer survives despite the lowest judge scores"	"tvnews"
"0"	"There are 14 cheap days to fly left in 2019: When are they and what deals can you score?"	"travelnews"
"0"	"65 Best Fall Soups That Will Warm You and Your Family Up All Season Long"	"recipes"
"0"	"Cat "repeatedly" breaks his friends out of animal shelter"	"newsus"
"0"	"China aims to build its own Yellowstone on Tibetan plateau"	"newsworld"
"0"	"Prosecutor Who Asked If Sex Crime Victim Was 'Illegal' Is Fired"	"newsus"
"0"	"Kristen Stewart is planning to propose to her girlfriend, plus more celeb love life news for early November 2019"	"celebrity"
"0"	"The Dow was perfectly unchanged on Tuesday, a rare occasion on Wall Street"	"markets"
"0"	"American families fleeing Mexico arrive in Arizona days after cartel massacre"	"newsus"
"0"	"The son of a Chinese billionaire has been banned from flying first class, playing golf, buying property, or going clubbing"	"newsworld"
"1"	"How climate change is shaping Iowa's physical and political landscape"	"newsus"
