"0"	"Trump Has Considered Firing Intelligence Community Inspector General"	"newspolitics"
"0"	"Donald Trump Jr. says 'View' hosts 'tried to smear me': 'They were totally triggered'"	"newspolitics"
"0"	"The Man Trump Trusts for News on Ukraine"	"newspolitics"
"0"	"Why US miners are still digging new mines as coal prices plunge"	"finance-companies"
"1"	"The world's largest nuclear power producer is melting down"	"markets"
"0"	"Drake Has Something to Say to the ''Kids'' Who Booed Him Off Stage"	"musicnews"
"0"	"Marlboro Man Bob Norris dies at 90, having reportedly never been a smoker"	"tv-celebrity"
"0"	"Fed likely to defy history with steady rates through elections"	"markets"
"0"	"Kris Bryant, Mookie Betts on the block? Four marquee MLB franchises ready for crazy winter"	"baseball_mlb"
"1"	"Scarlett Johansson Says 'Black Widow' Will Give Fans 'Closure'"	"movienews"
"1"	"Bill Macy, Bea Arthur's Husband on 'Maude,' Dies at 97"	"newsus"
"0"	"Joanna Gaines' Friensdgiving Casserole Recipe Has Us Ready to Throw a Party Tonight"	"recipes"
"0"	"Protesters demonstrate against Donald Trump Jr.'s appearance at UCLA"	"newsus"
"0"	"Chase Young to continue practicing with team as Ohio State awaits resolution on NCAA issue"	"football_ncaa"
"1"	"Chuck Woolery: Supporting Trump 'pretty much destroyed my career'"	"tv-celebrity"
"1"	"Montana Men Arrested With $4.25 Million Worth of Marijuana Go Free"	"newsus"
"0"	"We Test the 2020 Jeep Wrangler EcoDiesel"	"autossuvs"
"0"	"Ahead of this week's rematch, Tom Brady says he's still not quite over Super Bowl loss to Eagles"	"football_nfl"
"1"	"This Solo Dining Trend Is Changing the Way People Eat"	"restaurantsandnews"
"0"	"Stop! Read This Guide Before You Buy an Air Fryer."	"tipsandtricks"
"1"	"Why I Stayed in An Abusive Relationship"	"voices"
"0"	"Chris Paul feels he got 'stabbed in the back' with trade from Rockets"	"basketball_nba"
"0"	"This Guy Lost 30 Pounds and Gained a Rock-Hard Six Pack"	"weightloss"
"0"	"Madonna sued because of late start to concert"	"musicnews"
"0"	"The most exclusive hotel in every state"	"traveltripideas"
"0"	"Family told to take down Christmas display because it's too soon to decorate"	"lifestylebuzz"
"0"	"Can you answer these real Jeopardy questions about TV shows?"	"tv-gallery"
"1"	"From unknown to US Congress, Alexandria Ocasio-Cortez says sudden fame is like 'a tattoo on your face'"	"newspolitics"
"1"	"Here's What Bill Belichick Told Patriots' Defense In Sideline Huddles Vs. Jets"	"football_nfl"
"0"	"You can start cooking your pasta in cold water   Alton Brown has been doing it for years"	"tipsandtricks"
"1"	"NFL players who should be traded before the deadline"	"football_nfl"
"0"	"McKinsey Faces Criminal Inquiry Over Bankruptcy Case Conduct"	"finance-companies"
"1"	"James Brolin On the Hollywood Advice He Gave Son Josh: 'Don't Be a Leading Man, Ever'"	"movies-celebrity"
"0"	"The 5 college majors American students most regret picking"	"finance-career-education"
"0"	"See inside a woman's 270-square-foot tiny home complete with 2 bedrooms and a walk-in closet"	"lifestylebuzz"
"0"	"Nor'easter to grind at US East Coast this weekend"	"weathertopstories"
"0"	"100 vintage baby names coming back into style"	"lifestyleparenting"
"1"	"30 places that will be hit the hardest by the next recession"	"markets"
"0"	"Shakira reflects on her career-threatening injury, depression in 2017"	"music-celebrity"
"0"	"Migrants Find Different Fates at Texas, Arizona Borders"	"markets"
"0"	"This 'new' strain of HIV is actually a good thing"	"health-news"
"1"	"Tamron Hall says she 'never dealt' cocaine after reports say she confessed to doing so"	"tv-celebrity"
"0"	"Russell Crowe's property scorched by Australian bushfires"	"movies-celebrity"
"1"	"'When I smelled that smoke ... here we go again': Weary Californians seek shelter amid latest wildfire outbreak"	"newsus"
"0"	"Do This One Thing Every Day and You'll Increase Your Risk of Stroke by 29 Percent"	"health-news"
"0"	"In speech, Bolton suggested Trump's policy decisions guided by personal interest"	"newspolitics"
"1"	"Science Says Only a Third of People Experience This Health Downside of Breakups"	"healthnews"
"0"	"Experts crack mystery of ancient Egypt's sacred bird mummies"	"newsscienceandtechnology"
"0"	"'Unthinkable': Accused killer of Georgia college student Alexis Crawford spent holidays with victim's family"	"newscrime"
"0"	"Car of Marine linked to Virginia slaying is found in South Carolina, authorities say"	"newscrime"
"0"	"SEMA 2019 Photo Highlights From Las Vegas"	"autossema"
"0"	"Tourists, Venetians slosh through flooded lagoon city"	"weathertopstories"
"1"	"32 Popular Slang Terms and Phrases That No One Uses Anymore"	"lifestyledidyouknow"
"1"	"Under Armour founder Kevin Plank to step down as CEO"	"finance-companies"
"0"	"Losing Weight Overnight: How Your Sleep Pattern Helps Promote Weight Loss"	"weightloss"
"0"	"A Trump administration strategy led to the child migrant backup crisis at the border"	"newsus"
