"0"	"Steelers C Maurkice Pouncey will appeal after being suspended three games, fined"	"Pittsburgh Steelers center Maurkice Pouncey became a hero in the eyes of many when he punched and kicked Myles Garrett after the Cleveland Browns star assaulted Mason Rudolph with his own helmet on Thursday night."
"1"	"This girl nails the wave pool   then fails the exit spectacularly"	"The wave pool isn't easy, but this girl managed to stay on her board and dismount gracefully. But then watch what happens. Carson Daly shares TODAY's Daly Click."
"0"	"Will James Wiseman play for Memphis again? Explaining next steps in NCAA eligibility process"	"James Wiseman and Memphis agreed on Thursday to follow the NCAA's rule of law in determining his eligibility. Here is what that most likely means for the rest of their 2019-20 season."
"0"	"Can A Ford Raptor Fully Charge A Tesla Model 3 By Towing It?"	"Theoretically, according to Engineering Explained, yes. Thank regenerative braking for that."
"0"	"Trump's Washington hotel has fallen behind competitors, with rooms running nearly half empty, marketing materials show"	"A real estate firm hired by Trump's company distributed the materials to potential buyers."
"0"	"Sterling K. Brown Emotionally Recalls Seeing His Dad for the Last Time Before His Death"	"Sterling K. Brown Recalls Last Moment He Saw His Dad Alive"
"1"	"9 Types of Retirement Income That Are Tax-Free"	"Believe it or not, there are lots of things Uncle Sam can't touch   so long as you play by the rules."
"0"	"The most talked about movie moments of the 2010s"	"Let's try to emphasize the positive, but there's one particular sequence that was so special in its awfulness, it had to go on this list. See if you can guess which one it is."
"0"	"These Diabetes-Friendly Thanksgiving Dishes Won't Spike Your Blood Sugar"	"Eat and be merry without going overboard."
"0"	"How to Winterize a House"	"Keep your house warm and disaster-free all winter with these tips."
"0"	"Why did Santa Clarita shooting happen? Detectives search for motive"	"Investigators are still trying to determine why a 16-year-old Saugus High School student allegedly opened fire in a campus quad Thursday, killing two classmates and injuring three others before turning the weapon on himself."
"1"	"Eddie Van Halen traveling to Germany to treat throat cancer"	"You won't believe how Eddie Van Halen thinks he got cancer."
"1"	"Winners and losers from Week 8 in college football led by Wisconsin, Oregon"	"There were highs and lows during Week 8 of the college football seasons. A look at the winners and losers, led by Wisconsin and Oregon."
"0"	"Ford v Ferrari: the forgotten car at the heart of the Le Mans '66 clash"	"The Ferrari-beater you've probably never heard of"
"1"	"MLB bans women who flashed their chests behind home plate during Game 5 of World Series"	"MLB has indefinitely banned two women who flashed their chests on television during the seventh inning of Game 5 of the World Series on Sunday night."
"0"	"The 2019-20 NBA Season"	"The 2019-20 NBA Season"
"0"	"Former North Carolina State, NBA player Anthony Grundy dies in stabbing, police say"	"Anthony Grundy starred at North Carolina State before playing professionally. He was killed in a stabbing Thursday in Louisville."
"1"	"How Often Should You Change Synthetic Oil?"	"There's more than one answer, so let us simplify it for you, starting with outlining the advantages of synthetic oil."
"1"	"Stocks close lower as Boeing and Johnson & Johnson plunge"	"Stocks fell Friday as Netflix led technology shares lower and as traders grappled with weak overseas data."
"1"	"Why You Should Always Order Ginger Ale on a Flight"	"Ginger ale: the unsung hero of the sky."
"0"	"Olive Garden Actually Has A Ton Of Keto-Friendly Options That Aren't Sauce On A Plate"	"You just have to follow this mix-and-match formula."
"1"	"Deer fatally attacks hunter who shot him"	"In what officials are calling a bizarre incident, an Arkansas hunter was killed by a deer that he thought he had killed."
"1"	"Chiefs star TE Travis Kelce 'disgusted with how I played' against Packers in loss"	"Chiefs TE Travis Kelce hauled in four of eight targets in loss against the Packers, but he felt his performance, especially at the end, was lacking."
"1"	"Planning to live on Social Security alone? Consider doing this"	"It's not easy and not advisable, but it's possible in some cases."
"0"	"GoFundMe Honors Good Samaritans at First Heroes Celebration: 'Amazing Things Are Happening'"	"GoFundMe Honors Good Samaritans at Heroes Celebration: Watch"
"0"	"Browns' Kitchens: Garrett 'will learn from' suspension"	"Cleveland Browns head coach Kitchens: Myles Garrett 'will learn from' suspension."
"0"	"Why 17-Year-Old Can't Get Out of Her Seatbelt"	"It was an unusual emergency when a 17-year-old girl got hopelessly tangled in her seatbelt."
"0"	"New Face of Boeing Jets Tries to Win Back Rattled 737 Max Buyers"	"Days after Stanley Deal took the helm of Boeing Co.'s jetliner business last month, he was winging across the globe to meet with the airline bosses most shaken by the deadly crashes that have plunged the manufacturer into crisis."
"0"	"Antonio Brown offers to play catch with Colin Kaepernick in private workout"	"Brown's talent would certainly be beneficial for Kaepernick to work with during the workout."
"1"	"Fox News contributor: 'Most likely' outcome is Trump doesn't run in 2020"	"Fox News contributor Christopher Hahn predicted that President Trump will not run for reelection in 2020."
"1"	"New benefits are coming to Medicare Advantage plans"	"New benefits are on the horizon for 2020. Find out what they are."
"0"	"2-game suspensions for La. Tech's starting QB, star WR"	"La. Tech is in the midst of an eight-game winning streak, sits atop Conference USA West."
"0"	"United Auto Workers union approves new labor deal with Ford"	"The deal requires Ford to invest more than $6 billion in its U.S. manufacturing operations and create or retain 8,500 U.S. jobs, while also allowing the automaker to close an engine plant in Michigan."
"0"	"'National tragedy': Surveillance, staffing under review after deaths at VA hospital"	"After 10 patients died in a suspected serial killing case at a West Virginia VA hospital, the agency is reviewing surveillance and staffing protocols."
"1"	"4 habits that could wreck your finances beyond repair"	"Avoid these at all costs."
"0"	"'Charlie's Angels' stars: Where are they now?"	"We're checking up on former Charlie's Angels actresses to find out what they're up to today."
"0"	"How to make the most of a day trip in a new city: Charleston edition"	"Make the best of a spontaneous short trip by skipping the planning. Start walking, ask for directions and talk to people."
"0"	"Warriors on pace for worst drop in winning percentage in NBA history"	"After their first twelve games of the 2019-20 season, the once-mighty Golden State Warriors currently have the worst record in the league."
"1"	"4 takeaways from Marie Yovanovitch's testimony"	"All the highlights, with fact-checking and analysis."
"1"	"Climate change has finally caught up to this Alaska village"	""Many folks are not happy to be leaving the place they've known their whole lives." After 20 years of melting permafrost, residents of Newtok now must move."
"0"	"Debunking the week's tabloid stories: Nov. 15, 2019"	"A round-up of the week's tabloid stories that totally missed the mark."
"0"	"This stately home is having the ultimate yard sale"	"Nicky Haslam's English country estate, The Hunting Lodge, is filled with precious treasures and almost all of them will be sold at auction next month."
"1"	"Arik Gilbert, 5-star TE, commits to LSU"	"One of the top-rated tight end prospects of all-time, Arik Gilbert committed to Alabama at his All American Bowl jersey ceremony Wednesday."
"0"	"Golfer and girlfriend pull amazing trick shot"	"Press LaBrie from Montreux, Nevada, USA, is a long drive golf pro who has recently started working on trick shots. He asked his girlfriend Adrianna Moritz to help him pull a challenging trick shot, and it worked brilliantly!"
"1"	"Off to the World Series, these Nationals have proved everyone wrong"	"This unexpected joyride of a season could hold more promise yet."
"0"	"NBA dynamic duos: What pairings are rocking, struggling?"	"In One-On-One, Sean Keane and Pat Heery dish on LeBron-AD, Doncic-Porzingis, Harden-Westbrook, McCollum-Lillard and more."
"0"	"How much turkey do you need to buy per person?"	"When hosting Thanksgiving dinner, there are a lot of questions regarding the menu that may come up."
"0"	"Meghan Markle's Lawyers Debunk Multiple False Tabloid Stories in New Court Documents"	"False, divisive, and completely untrue."
"0"	"Raise Billions From Billionaires? Tax Experts Say It's Not That Simple"	"One of the signature initiatives of Elizabeth Warren's presidential campaign is a wealth tax that, she says, would pay for many of the programs she proposes."
"0"	"This 10-Year-Old Girl's Demanding Christmas Wish List Will Blow Your Mind"	"A father recently shared his 10-year-old daughter's demanding Christmas wish list on Twitter. It includes a Chanel bag, $4,000, "purfum," and so much more."
"1"	"'At 237 Lbs., I Was Embarrassed To Go To The Gym. So I Did An At-Home BeachBody Program And Lost 117 Lbs.'"	""I wanted to be me again.""
"1"	"China asks WTO for $2.4 billion sanctions against U.S. in latest clash"	"China asks WTO for $2.4 billion sanctions against U.S. in latest clash"
"0"	"No. 2 Ohio State heads to Rutgers as 51-point favorite"	"There aren't many ranked teams who bring a backup quarterback into a meeting with the media to preview their next opponent late in the season. No. 2 Ohio State (9-0, 6-0 Big Ten) isn't your ordinary team."
"0"	"10 most underrated food cities we explored in 2019"	"We've spent the year exploring cities around the country through the eyes of our food experts and celebrity chefs. Here are what we think are the most unsung food scenes of 2019."
"0"	"Er, Never Eating Dinner Together Could Be A Sign That You're Headed For Divorce"	"Deep. Breaths."
"0"	"Russia lands forces at former U.S. air base in northern Syria"	"Russia lands forces at former U.S. air base in northern Syria"
"0"	"The most festive town in every state in America"	"For a truly rewarding holiday experience, you need to go to a town, village or city that is totally dedicated to creating a magical wonderland a snowy one in the North or a sultry one down South. The experience requires lots of lights, family-friendly activities to burn off the kids' sugar highs, great or plentiful food and drink, music everywhere, and opportunities to buy the perfect gift that has eluded you thus far. It also helps to have a place with a centuries-old tradition, brought there by the first festive immigrants."
"0"	"Kate Middleton Shows Off Motherly Side as She Bonds with Families at Opening of Children's Hospice"	"Kate Middleton Celebrates Opening of Children's Hospice"
"0"	"Ukraine 'invisible' as impeachment hearings focus on Washington drama"	""There is a long standing issue of countries overlooking Ukraine," said Duncan Allan, a former British diplomat who served in embassies in Kyiv and Moscow."
"1"	"Nutrition Experts Eat Halloween Candy, Too - Here Are 8 Brands They're Trick-or-Treating For"	"When Halloween season hits, there are suddenly rich and decadent sweets all over the place: getting swapped around at school, sitting on every desk at work, looking tempting in your own front hallway, just waiting for trick-or-treaters."
"0"	"Santa Clarita shooting: Unregistered guns found in home of Saugus suspect; motive a mystery"	"LOS ANGELES - The teenage shooter who opened fire at Saugus High School died Friday of a self-inflicted gunshot wound as investigators seized unregistered firearms from his home and tried to determine the origin of the handgun used in the deadly attack."
"0"	"Antonio Brown completes interview with NFL"	"Antonio Brown's interview Thursday with NFL investigators went "as well as it could have," a source briefed on the meeting told ESPN.com's Dan Graziano."
"1"	"Mikaela Shiffrin stunned by New Zealand 17-year-old in World Cup opener"	"Alice Robinson beat Mikaela Shiffrin, becoming the youngest World Cup winner in nearly seven years."
"0"	"20 Tourist Attractions Travel Editors Actually Love Visiting"	"AFAR is all about traveling deeper, but our editors also love these classic tourist attractions. Here's why we think you should visit them, too. Yes, even Times Square."
"0"	"30 Best Black Friday Deals from Costco"	"Costco members love shopping at the warehouse store, and they'll love shopping there for holiday gifts just as much."
"1"	"Trump could slap steep tariffs on imported cars next week"	"The Center for Automotive Research estimated Trump's proposed 25% tariff would add up to $6,875 to imported vehicle prices."
"0"	"Report: Police investigating woman's death after Redskins' player Montae Nicholson took her to hospital"	"Police are investigating an apparent drug-overdose death of a woman after the Redskins' Montae Nicholson took her to a hospital, according to reports."
"1"	"Sondland faces local backlash denying Trump deal in Ukraine"	"President Donald Trump's man in Brussels found events spinning out of control when he arrived in Washington, D.C., expecting to testify before House committees this week. Gordon Sondland, appointed U.S. ambassador to the European Union after contributing $1 million to Trump's inauguration, was to be deposed in the impeachment inquiry for his apparent role in pushing Ukraine to ..."
"0"	"Browns apologize to Mason Rudolph, call Myles Garrett's actions 'unacceptable'"	"Players often defend their teammates when commenting on an incident like the one we saw Thursday, but the immediate reaction from Mayfield and others proves just how far Garrett crossed the line."
"0"	"22 of the world's most beautiful restaurants"	"Carved into oceanside caverns, perched 820 feet in the sky, or sunk 16 feet below sea level, these are world's most stunning places to eat."
"1"	"Ukraine's Zelensky Bowed to Trump's Demands, Until Luck Spared Him"	"It was early September, and Ukraine's new president, Volodymyr Zelensky, faced an agonizing choice: whether to capitulate to President Trump's demands to publicly announce investigations against his political enemies or to refuse, and lose desperately needed military aid."
"1"	"Analysis: California is becoming unlivable"	"The state is plagued by two major issues: wildfires and a lack of affordable housing. Each problem exacerbates the other."
"1"	"Deceptive 'Healthy' Snacks That Are Actually Sugar and Calorie Bombs"	"Sorry, but "made with real fruit juice" doesn't mean you're in the clear."
"0"	"These are the best times to visit New York City"	"The Big Apple, the City That Never Sleeps, Gotham   whatever you call it, New York City is alluring all year round. We might be biased, given the location of our headquarters, but we think it's one of the greatest cities in the country. Between the museums, the parks, the red-hot restaurant scene and the …"
"0"	"Who's scheduled to publicly testify next in Trump's impeachment hearings"	"The House committees pursuing the committee have announced that eight more diplomats and national security officials will testify in the next week."
"0"	"Kristen Bell's Cozy Look Is a Lesson in Winter Airport Fashion"	"Kristen Bell wore the coziest sweater dress, combat boots, and wool coat to the airport, and you can shop her outfit at Nordstrom."
"0"	"Best Bets: Previewing the best games of the weekend in college basketball"	"Let's get rich!"
"0"	"Every Intermittent Fasting Beginner Should Know About These 4 Side Effects"	"Prepare to feel a little crabby at first."
"0"	"Opinion: NFL should suspend Browns' Myles Garrett for rest of season   at minimum   for helmet swing"	"The Browns won on Thursday, but only in the most literal sense. Pro Bowl defensive end Myles Garrett changed everything with the swing of a helmet."
"0"	"Porzingis forgets which locker room to go to at Madison Square Garden"	"After the buzzer went off to end the second quarter, instincts kicked in for Kristaps Porzingis."
"1"	"Trump records 'strongly corroborate' sex assault claims, accuser says"	"President Trump's own records "strongly corroborate" the sexual assault accusations of Summer Zervos and belie the president's denials, a new court filing states"
"1"	"'This is what you live for': Max Scherzer, 'rising from the dead,' ready to lead Nationals into Game 7"	"Max Scherzer is set to take the mound in the winner-take-all Game 7 on Wednesday, just three days after being scratched from Game 5 due to neck pain."
"0"	"Georgia Tech appeals NCAA sanctions against basketball team"	"Georgia Tech has formally appealed sanctions levied by the NCAA against its men's basketball program."
"0"	"I'm A Queer Woman Dating A Trans Man   & No One Knows"	"I'm a queer woman partnered with a transgender man, but everyone assumes we're a heterosexual couple. On the surface, we're the quintessential Brooklyn duo: We have tasteful tattoos and piercings, we shop at food co-ops, we attend spin class together, and we're creative yet gainfully employed. But while this relationship afforded me the privilege of banal nonconformity, I lost a piece of myself when I got together with my once-gym buddy, James...."
"1"	"Here Are the Biggest Deals We're Anticipating for Black Friday"	"The Black Friday deals for 2019 have already begun leaking out. Get a sneak peek at what to expect from popular retailers like Costco, Walmart, and Best Buy. Browse our guide and use it to plan your attack for the biggest shopping event of the year."
"0"	"LeBron James on he and Tom Brady: 'We're gonna play until we can't walk'"	"LeBron James was asked if he thought about the end of his career and compared himself 42-year old New England Patriots star Tom Brady."
"1"	"Singer stands up to heckler who told her to take shirt off"	"After being heckled on stage and told to "free the nips" at a concert in Texas, singer Maggie Rogers voiced her anger about the harassment."
"0"	"Significant others"	"Taking a look at the significant others of professional athletes."
"0"	"Protests grip major Iran cities over gas prices; 1 killed"	"DUBAI, United Arab Emirates (AP)   Protesters angered by Iran raising government-set gasoline prices by 50% blocked traffic in major cities and occasionally clashed with police Saturday after a night of demonstrations punctuated by gunfire, in violence that reportedly killed at least one person."
"0"	"I used 3 strategies to save more than 50% on furniture for my new home"	"Draining your savings to furnish a house really takes the shine off buying your first home. Being strategic about furniture shopping can pay off."
"1"	"Photographer Captures Icelandic Horses That 'Look Like Rock Band Members'"	"Check out these stylish steeds!!! Veuer's Mercer Morrison has the story."
"0"	"Ethnic Rifts in Bolivia Burst Into View With Fall of Evo Morales"	"In the days since the ouster of Evo Morales, Bolivia's first Indigenous president, deep ethnic tensions that have long divided the country have erupted, complicating efforts to move Bolivia out of political crisis. Mr. Morales, a champion of the Indigenous, has now been replaced by an acting president of European descent, and resentments have surfaced."
"1"	"If I Don't Eat Fish, Do I Still Need to Take a Fish Oil Supplement?"	"I overheard someone at my gym complaining about an injury, and their buddy asked, "Are you taking fish oil for the inflammation?""
"0"	"Court puts hold on Rodney Reed's scheduled execution"	"With new, compelling evidence in Reed's case, the call to halt his Nov. 20 execution has been building in recent weeks."
"0"	"The 30 best shows of Comedy Central's 30 years"	"Comedy Central has been on the air now for 30 years. Since Nov. 15, 1989   when it was The Comedy Channel   it has been the go-to network for comedy, from original programming and movies to favorites and cult classics in syndication."
"0"	"Off-duty officers rushed to Saugus High after hearing shots: 'Their actions saved lives'"	"Three off-duty officers were the first to arrive at Saugus High School in Santa Clarita after a shooting. One rushed back after dropping off his kid."
"1"	"A bet on America: The sports gambling gold rush"	"The boardwalk in Atlantic City, New Jersey, looks like a forgotten film set. Scant tourists look in vain for its Prohibition-era glory."
"0"	"The Reason You Should Never Rinse a Turkey"	"Rinsing raw poultry is the worst turkey sin people commit at Thanksgiving. Here's what you should really do to minimize your salmonella risk."
"0"	"The latest on Brad Pitt and Angelina Jolie's post-split relationship, plus more news"	"Brad Pitt reportedly wants to see his kids more than Angelina Jolie has made possible. Plus, more celebrity news for Nov. 14, 2019."
"1"	"The Top Deals at Costco Right Now"	"Costco shoppers can find some impressive deals at the popular warehouse giant as stores shift gears toward the holidays. You can snag specials on home goods and appliances from companies like Crock-Pot, Keurig, Oster, Thomasville, and Dyson, as well as tech toys from brands like HP."
"0"	"Five Great Holiday Cruises Worth Taking"	"These trips will make it the merriest of seasons."
"1"	"Opinion: Here's how to create a pension and save on taxes"	"Get income security later in life."
"0"	"Attorney: Garrett's actions against QB to be 'reviewed thoroughly'"	"Legal action could be taken against Garrett by Rudolph and his representatives"
"1"	"Neil Patrick Harris Has Surgery on His Hand After a Sea Urchin Accident While on Holiday"	"Neil Patrick Harris Has Surgery After a Sea Urchin Accident"
"0"	"Ford v Ferrari: the real story"	"The film about the epic Le Mans rivalry promises to be a must for car fans - and this is the real story behind it"
"1"	"Do not try this at home: How to turn $3,000 into $1.7 million"	"Reddit's Wall Street Bets group learned a valuable lesson in responsible investing this week and, after years of encouraging and celebrating extreme risk-taking, the crew has finally embraced a more conservative approach. Just kidding. YOLO!"
"0"	"Chuck E. Cheese just got major makeover   and axed the animal band"	"The kid-friendly pizzeria is updating its menu, too."
"0"	"The Best Photos of College Basketball"	"The Best Photos of College Basketball"
"1"	"Michigan sends breakup tweet to Notre Dame as series goes on hold"	"Parting is such sweet sorrow, say the Wolverines."
"0"	"Jordan Brings Pugnacious Style to Impeachment Defense of Trump"	"Representative Jim Jordan, a scrappy former wrestler and firebrand founder of the conservative House Freedom Caucus, has always relished a fight. So it was no surprise this week when, as President Trump's chief defender in the impeachment inquiry, he interrupted the staid tone of the first public hearing and let it rip. "And you're their star witness?" he thundered at William B. Taylor Jr., the top diplomat in Ukraine, after..."
"0"	"Woman donates nearly 600 Barbies with prosthetic legs to St. Louis hospital"	"A former patient from Shriners Hospitals for Children returned to the hospital to make a special donation. Ashleigh Bentz, who uses a prosthesis, donated nearly 600 Barbie dolls with prosthetics and wheelchairs to patients."
"1"	"Should you eat red meat or not? A dietitian explains the latest nutrition science"	"Is it OK to eat red and processed meat   and what about eggs and butter? A registered dietitian clears up the nutrition confusion."
"1"	"The millennial urban lifestyle is about to get more expensive"	"As WeWork crashes and Uber bleeds cash, the consumer-tech gold rush may be coming to an end."
"0"	"60 of the Most Adorable Animal Pictures That Will Make You Say "Awww""	"These cute animal pictures will have you making puppy dog eyes at your computer screen. The post 60 of the Most Adorable Animal Pictures That Will Make You Say "Awww" appeared first on Reader's Digest."
"1"	"Joshua Jackson and Jodie Turner-Smith spark marriage speculation"	"Joshua Jackson and Jodie Turner Smith may be secretly married."
"0"	"'Velvety' Appearance of Woman's Palms Was a Sign of Lung Cancer"	"She had a condition called "tripe palms" and it's extremely rare."
"1"	"This Is What's New at Trader Joe's for Fall"	"Grab your little red cart and be on the lookout for Chilly the Penguin! It's time to dive into new fall finds and pumpkin everything with the best Trader Joe's products for fall."
"0"	"A birthday, a walk to school and a blast that tore an Afghan family apart"	"Dunya, 10, and Hadis, 7, were among the 12 dead in Wednesday's suicide bombing in Kabul."
"0"	"Here's what it's like to live at the top of the second-tallest apartment building in the world for less than $1,400 a month"	"Taller than the Empire State Building and barely half the median New York City rent   living in Dubai's Princess Tower felt like a fantasy."
"0"	"At NATO summit, Trump to stress US allies' defense spending"	"President Donald Trump will try to convince U.S. allies that they should increase defense spending when he attends a meeting of NATO leaders next month in London, the White House said Friday."
"0"	"Treasury yields tick higher amid uncertainty over US-China trade deal"	"U.S. government debt prices were lower Friday morning, as traders monitored U.S.-China trade developments."
"1"	"There are doubts about China's promise to purchase more US farm products"	"President Trump said China promised to increased their purchase of U.S. farm goods, but the details of the agreement are causing concerns."
"0"	"Aviation-Inspired Travel Experiences on the East and West Coast"	"From hotels paying tribute to aviation to a retro-themed fine-dining experience, these are not to be missed."
