"1"	"Bannon says Stone was Trump campaign link to WikiLeaks"	"WASHINGTON (AP)   Donald Trump's campaign viewed Roger Stone as an "access point" to WikiLeaks and tried to use him to get advanced word about hacked emails damaging to Hillary Clinton, a former top presidential adviser testified Friday. In reluctant testimony, former campaign CEO Steve Bannon told a federal court that Stone, on trial for lying to Congress and witness tampering, had boasted about his ties to WikiLeaks and its founder Julian..."
"0"	"Selfies In Sports"	"The best images of sports figures saying cheese!"
"0"	"Billionaires' success boils down to 3 simple traits, a new report says"	"Intelligence isn't what makes billionaires successful, a new report by investment bank UBS and PricewaterhouseCoopers found."
"1"	"Opinion: NFL had no choice but to send a clear message with Garrett punishment"	"The NFL decision to suspend Myles Garrett for the rest of the Cleveland Browns season was not surprise and sent a clear message from the NFL."
"0"	"End Of An Era As Chevy Has Built The Last Front-Engined Corvette"	"It's a Z06 coupe previously sold for $2.7 million for a noble cause."
"0"	"Bill Russell finally accepts Basketball Hall of Fame ring"	"SPRINGFIELD, Mass. (AP)   Bill Russell finally accepted his Basketball Hall of Fame ring. The 11-time NBA champion, five-time MVP, Olympic gold medalist and two-time NCAA champ said on Twitter on Friday that he was presented with his Hall of Fame ring in a private ceremony. The 85-year-old Boston Celtics great didn't attend the induction ceremony in 1975. He said he didn't deserve to be the first black player inducted, tweeting: "I felt others...""
"1"	"2020 Chevrolet Corvette vs. 2020 Porsche 911 Comparison: Two Icons on Equal Footing"	"Z51 vs. Carrera S: The Corvette and 911 are closer than ever before"
"1"	"Photo of emotional nurse after 'particularly hard day' goes viral"	"Her sister revealed that she had just wrapped up four days worth of work that included assisting in the delivery of a stillborn baby."
"1"	"A nasty Japan-style market drop looms if this chart is any indication"	"Jesse Felder, the former hedge-fund investor behind the popular Felder Report financial blog, says the U.S. stock market could be on the verge of a Japan-style slowdown."
"1"	"This is it, this is the luckiest break in the history of golf"	"Belgium's Thomas Detry was the beneficiary of one of the all-time luckiest bounces you'll ever see in golf, and maybe all of sports."
"1"	"3 Months of Full Body Workouts Helped This Guy Get Shredded at 40"	"Mat Smith ramped up his workouts and found an online support group to share fitness goals."
"1"	"EU ambassador's miraculous 'now I remember' moment"	"How did Gordon Sondland get back his memory to correct his testimony? CNN's Jeanne Moos looks for the cure."
"0"	"Prince Harry and Prince William's Rift Is "One of the Main Reasons" the Sussexes Are Skipping Royal Christmas"	"Santa is shook."
"1"	"'Embrace it': Stephen Strasburg's legendary postseason hits its apex with gritty Game 2 win"	"Washington's starter shrugged off a first-inning homer to battle back and hold the Astros to two runs in six innings in Game 2."
"1"	"Young Lions fan wins Halloween with Patricia costume"	"NFL fans are in a festive mood on the final Sunday before Halloween. A young Detroit Lions supporter might have already won the costume contest."
"0"	"Texas parole board recommends delaying Rodney Reed execution"	"The Texas Board of Pardons and Paroles on Friday recommended delaying the execution of inmate Rodney Reed, whose conviction is being questioned by new evidence that his supporters say raises serious doubts about his guilt."
"1"	"Exxon profit plummets with plenty of oil to go around"	"Exxon Mobil's profit tumbled with crude prices down about 15% from where they were last year, though a $300 million boost from a tax-related item helped."
"1"	"40 Nutrition Experts Told Us The Foods You Should Be Eating Every Day"	"Here are the healthy staples top nutritionists swear by that you should stock your pantry and fridge with too."
"1"	"Costco unveils holiday savings with early Black Friday deals"	"Costco's Black Friday sale includes deals on televisions, appliances, Xbox gaming systems, Apple MacBook and other laptops."
"1"	"At home and in the Senate, here's the price Mitt Romney is paying for standing against Trump"	"The Senate's most outspoken GOP critic of the president finds his motives are questioned, and worse."
"0"	"Watch These Two Love Birds Perform a Heart-Shaped Swan Dance"	"Were they already a couple or is this love at first sight? Buzz60's Tony Spitz has the details."
"1"	"Ian Poulter posts incredible video of flooded Japan golf course hosting PGA Tour"	"A ridiculous amount of rain hit Japan on Friday, pushing back the second round of the PGA Tour's Zozo Championship."
"0"	"Gates sentencing set for next month"	"President Donald Trump's former deputy campaign chairman Rick Gates will be sentenced in his criminal case on Dec. 17, according to a court filing published Friday."
"1"	"This is the average Social Security check in each state"	"1"
"0"	"California, 22 other states sue to defend stricter auto-emissions standards"	"California's fight with the Trump administration over its ability to shape climate policy is headed to court   again   as the state pushes to keep its authority to set stricter auto-emissions standards."
"0"	"Opinion: Colin Kaepernick is about to get what he deserves: a chance"	"The end may be near for the 3-year-old saga of Colin Kaepernick as the quarterback is scheduled to work out for teams on Saturday."
"0"	"Police find 26 children behind false wall at Colorado day care"	"The state of Colorado has suspended the license for Play Mountain Place daycare in Colorado Springs after they uncovered 26 children behind a false wall in the owner's basement, all under the age of three-years-old."
"0"	"How to Make Chicken Parm Spaghetti Squash"	"This family friendly spaghetti squash dinner is a delicious (and low-carb) twist on an old favorite: chicken Parmesan. Loads of melty cheese will make this dish an easy sell for the kids, and the veggie vessel means you're packing in plenty of nutrie"
"0"	"10 Things You Should Never Buy on Black Friday"	"It's the biggest and craziest shopping day of the year, but not every gift category is priced to move. Here's when to keep your credit card in your pocket."
"0"	"Maze of tunnels reveals remains of ancient Jerusalem"	"Controversial excavations under the Holy City uncover layers of history and stoke long-standing tensions."
"1"	"Falling Rates Boost Mortgage Market to Precrisis Levels"	"Lenders extended $700 billion of home loans in the July-to-September quarter, the most in 14 years, according to industry research group Inside Mortgage Finance."
"0"	"How to Watch the Leonid Meteor Shower This Weekend"	"Look up this weekend to catch shooting stars radiating from the constellation Leo."
"1"	"George Conway and Trump Jr. trade personal insults during impeachment hearing"	"Conservative commentator George Conway and Donald Trump Jr. squared off via Twitter during Marie Yovanovitch's public impeachment hearing Friday."
"0"	"There's a place in the US where its been over 80 degrees since March"	"The Weather Service reports the last time the daily high was below 80 degrees was on March 27 when the high only reached 78 degrees -- which, let's be honest, is still pretty warm."
"0"	"2020 Ford Mustang Shelby GT350 vs. GT500: Which Is the Better Sports Car?"	"Is the $12,460 more costly GT500 a better sports car than the already great GT350?"
"0"	"The Unlikely Star of My Family's Thanksgiving Table"	"It's hard to remember life before broccoli cheese rice casserole. Or, B.B.C.R.C.E. (Before Broccoli Cheese Rice Casserole Era). What did the Kim clan have to look forward to every Thanksgiving before the cheesy family-favorite side dish entered our lives? Stuffing, maybe. Green bean casserole. Macaroni and cheese. Ham in cola, a quirky recipe from Nigella Lawson that she picked up from the American South. Certainly nothing from the Korean..."
"0"	"Lions rule out QB Stafford (back) for game vs. Cowboys"	"The Detroit Lions have ruled out Matthew Stafford for Sunday's game against the Dallas Cowboys, and Jeff Driskel will make his second straight start."
"1"	"Oregon may face ICE push-back on new limits for courthouse arrests"	"Under a new rule enacted Thursday by Oregon Supreme Court Chief Justice Martha Walters, agents with U.S. Immigration and Customs Enforcement are forbidden from arresting immigrants inside or near the state's courthouses unless the agents first receive warrants from a judge."
"0"	"Bushfires rage across Australia's east and west as danger rises"	"Bushfires rage across Australia's east and west as danger rises"
"0"	"Opinion: NFL had no choice but to send a clear message with Garrett punishment"	"The NFL decision to suspend Myles Garrett for the rest of the Cleveland Browns season was not surprise and sent a clear message from the NFL."
"1"	"Eddy Merckx Hospitalized for Serious Head Injury Following Bike Crash"	"The five-time Tour de France winner was injured Sunday during a bike outing with friends."
"1"	"Former Trump adviser who testified to Ukraine pressure campaign said she was victim of harassment"	"Fiona Hill told Congress that Rudy Giuliani and E.U. ambassador Gordon Sondland pursued a shadow policy on Ukraine."
"1"	"How 'Handmade' Is America's Most Popular Vodka?"	"Tito's Handmade Vodka proudly cultivates an artisanal, small-batch brand image, even as it's recently claimed the mantle of America's best-selling spirit"
"0"	"How Bad Is It to Reuse a Tissue?"	"We all do it. But will sneezing in your hankie or tissue over and over derail your recovery?"
"0"	"4 takeaways from Marie Yovanovitch's testimony"	"All the highlights, with fact-checking and analysis."
"0"	""Ford v Ferrari": How Much the Stars Drove, Where the Cars Came From, and More"	"A conversation with the film's stunt coordinator, Robert Nagle."
"1"	"Home-Improvement Boom Is Forecast to Fizzle"	"Home-improvement retailers have proved to be a bright spot during an otherwise underwhelming stretch for retail stocks, but a popular predictor of remodeling spending suggests tougher times ahead."
"0"	"Anne Hathaway Celebrates Her Birthday With a Glowing Baby Bump Pic"	"Anne Hathaway Celebrates Her Birthday With a Glowing Baby Bump Pic"
"0"	"Someone Finally Invented a Jar Lid That Won't Get Stuck"	""Once people try it, they're hooked," the company claims."
"1"	"Here are the new income tax brackets for 2020"	"The IRS released the federal tax rates and income brackets for 2020. The seven tax rates remain unchanged, while the income limits have been adjusted for inflation."
"1"	"New Hampshire shooting: Man barged into a church and wounded bride and bishop"	"A gunman barged into a church in New Hampshire and opened fire, wounding a bride and the bishop before wedding guests tackled him, authorities said. Investigators want to know if the attack is related to another fatal shooting this month."
"0"	"Please Don't Yell at Your Dog!"	"A new study shows it can cause long-term psychological impacts."
"0"	"Morris Commercial Introduces Sentimental Electric Morris JE Van"	"It's a premium all-electric van with retro styling and 200 miles (320 km) of range, capable of taking 1,000 kg of payload."
"0"	"Ex-Browns receiver Antonio Callaway gets 10-game drug ban"	"Former Browns wide receiver Antonio Callaway has been suspended 10 games by the NFL for another violation of the league's substance-abuse policy. League spokesman Brian McCarthy said Friday that Callaway will begin serving the suspension immediately. The 22-year-old player was suspended four games earlier this season for a drug violation."
"0"	"Bronny James Jr. and Sierra Canyon to have 15 games streaming on ESPN"	"The high school squad of LeBron James Jr. and Zaire Wade will be broadcast 15 times on ESPN streaming services."
"1"	"These Are The World's Most Magical Christmas Villages to Visit This Year"	"It's the most wonderful time of the year, after all."
"0"	"Wendy's Is Turning 50 Years Old, And Is Gifting Us With Free Food Through 2020"	"How thoughtful."
"0"	"House to hear from US official who said he overheard Trump, Sondland call"	"In a closed-door deposition, House investigators will hear from David Holmes, the U.S. embassy official who overheard Trump and Sondland speak about "the investigations.""
"0"	"Brady on Kaepernick workout: 'Pretty cool that he's getting that opportunity'"	"Whether this opportunity is something that translates to a real chance for Kaepernick to play in the NFL again remains to be seen."
"0"	"Dominique Crenn Proves Fine Dining Does Not Have to Be a Meaty Domain"	"The Bay Area chef's latest move suggests that fish and produce can be the centrepiece of fine dining"
"0"	"THEN AND NOW: What all your favorite '90s stars are doing today"	"These heartthrobs and fan favorites made the 1990s one of the best decades of the century. Here's what they're up to now."
"1"	"The 'Blue Zones' diet: Foods that help people live to 100"	"The five places author Dan Buettner found people living past 100 have these foods in common."
"0"	"13 Reasons Why's Christian Navarro Slams Disney for Casting 'the White Guy' in The Little Mermaid"	"13 Reasons Why's Christian Navarro Slams Little Mermaid's Eric Casting"
"1"	"Goldman predicts the Fed will make 2 big changes next week"	"The Fed likely will finish its "mid-cycle adjustment" and remove language that it will "act as appropriate to sustain the expansion," according to Goldman Sachs."
"1"	"Republican Rep. Matt Gaetz kicked out of impeachment inquiry hearing"	"Rep. Matt Gaetz, R-Fla., an ardent supporter of President Trump, got the boot on Monday when he tried to sit in on the testimony of a former top National Security Council expert on Russia who was appearing on Capitol Hill as part of the House impeachment inquiry into the president."
"0"	"Taylor Swift Says Scooter Braun, Scott Borchetta Are Blocking Her From Playing Old Hits at AMAs"	"Taylor Swift has taken to social media to tell fans that Scott Borchetta, her former label head at Big Machine Records, and his new partner Scooter Braun are trying to nix her plans for a retrospective performance at the American Music Awards, as well as denying the use of her recordings for a documentary she"
