"0"	"Koalas face threat from historic brush fires"	"Hundreds of vulnerable koalas are feared dead or injured in the wake of brushfires that have torn through the eastern Australian coast in early November."
"0"	"U.S. 'flexible' on military exercises with South Korea as North demands cancellation"	"The United States will consider changing plans to conduct joint military exercises with South Korea if that helps support diplomatic efforts to restart a dialogue with North Korea, Defense Secretary Mark T. Esper said Friday."
"0"	"Daring rescue attempt when dog winds up on roof"	"It took a lot of trust and time to get this scared pup off a two-story roof, but eventually he came down all thanks to one kind human."
"0"	"Here's what comfort food looks like in 26 countries around the world"	"From a creamy and cheesy onion soup in France to a hearty heap of chilaquiles in Mexico, here are 26 of the world's most delicious comfort foods."
"0"	"VW ID.3 Electric Motor Is So Compact That Fits In A Sports Bag"	"From 2023 on, Volkswagen intends to produce 1.4 million of similar electric drive units annually."
"0"	"Opinion: Kitchens unqualified to lead undisciplined Browns"	"The Browns' first-year head coach is at the helm of a team that lacks discipline, direction and even a dash of humility, Jon Gold writes"
"1"	"It's Already Ski Season Here's Where You Can Hit the Slopes This Weekend"	"Can't wait to hit the slopes this winter? Now you don't have to, thanks to a few resorts that have opened early this year."
"0"	"The Kardashians Face Backlash Over 'Insensitive' Family Food Fight in KUWTK Clip"	"Kardashian's Face Backlash Over Family Food Fight"
"0"	"LeBron James: 'Everyone had doubt' whether an NBA team would sign Carmelo Anthony"	"LeBron James had doubts Carmelo Anthony would get another chance to play in the NBA, had hoped Los Angeles Lakers would sign him last season."
"1"	"Mark Hurd, Oracle CEO who led 3 tech companies, dies at 62"	"Mark Hurd, who was chief executive officer of three major technology companies including Oracle Corp., has died. He was 62."
"0"	"Top 5 Craziest Motorcycles From EICMA 2019"	"Bikes from legendary British and Italian marques and electric upstarts."
"1"	"Jeff Bezos is set to lose his crown as world's richest person"	"Jeff Bezos is about to relinquish the title of world's richest person to Bill Gates, as Amazon.com Inc. stock tumbled in late trading Thursday."
"0"	"Southwest's Spring Travel Sale Includes $39 One-way Tickets"	"Southwest Airlines wants you to start planning your 2020 travels."
"0"	"Chris Evans' Hilarious Reason Why He Continues Acting"	"ET's Keltie Knight spoke with Chris Evans at the premiere of 'Knives Out,' in theaters Nov. 27."
"0"	"12 Cars Lose Consumer Reports' Recommendation Over Reliability Issues"	"The Ford F-150, Honda Passport, and others no longer have the designation, but 20 models gain it"
"1"	"Maleficent: Mistress of Evil delivers an empty, CG-dazzled fairytale"	"Review: Maleficent: Mistress of Evil delivers empty, CG-dazzled fairytale"
"0"	"Home values in these cities have grown the most since the last recession"	"Home values have more than doubled in some places."
"0"	"Bill Plaschke: Trout and Bellinger deserve MVPs, but fans deserve more in postseason"	"LOS ANGELES - The hometown sweep of baseball's Most Valuable Player awards Thursday officially anoints Los Angeles as the center of the baseball universe! No, actually, that would be Washington. The American League MVP victory by the Angels' Mike Trout and the National League MVP win by the Dodgers' Cody Bellinger validates Los Angeles as baseball's city of stars! Yeah, in a sky that goes ..."
"0"	"How Google Interferes With Its Search Algorithms and Changes Your Results"	"Pressed by businesses, interest groups and governments, the internet giant uses blacklists, algorithm tweaks and an army of contractors to shape what you see."
"0"	"In Japan's vanishing rural towns, newcomers are wanted"	"Facing declining birthrates and rural depopulation, hundreds of "marginal villages" could vanish in a few decades. But some small towns are fighting back."
"0"	"Taylor Swift Rep Hits Back at Big Machine, Claims She's Actually Owed $7.9 Million in Unpaid Royalties"	"Taylor Swift's team responds to Big Machine's denial."
"0"	"College football Week 12 players to watch"	"Week 12 is a bit of a break from last Saturday, but there are some important games on tap. You still don't believe in Minnesota or Baylor? Well you may if they win their games this week. LSU and Alabama go on the road to (hopefully) avoid letdowns, while Clemson get its one real threat to its playoff push. What this weekend lacks in heft, it makes up for in depth."
"1"	"The best destinations to visit in November"	"With autumn in full force, you may want to embrace the season by traveling to a destination where you can admire the remaining foliage, warm up around a fireplace or sneak in some early turns on the ski slope. Or, maybe you're in escape mode, searching for a way to get a healthy dose of …"
"1"	"Opinion: What the New Orleans Saints learned about themselves while Drew Brees was out"	"Drew Brees came back Sunday from his six-week rehab for a fractured thumb, and it was just like old times for the New Orleans Saints and their icon"
"0"	"Catholic high school in Ohio to drug test all students"	"The school said the "aggressive stance against the threat of drug use" is a tool to fight peer pressure and "can provide parents greater peace of mind.""
"0"	"The 15 Best Breakfast Habits to Drop 10 Pounds"	"Not only will you trim your muffin top and banish belly fat, you'll also set a healthy foundation for the rest of the day."
"0"	"Survivor Contestants Missy Byrd and Elizabeth Beisel Apologize For Their Actions"	"Survivor contestants Missy Byrd and Elizabeth Beisel posted apologies to Twitter after they were shown onscreen using a fellow contestant's assault story to their advantage in the game"
"0"	"How to Get Rid of Skin Tags, According to a Dermatologist"	"They seem harmless, but there's a very good reason you shouldn't ignore them. The post How to Get Rid of Skin Tags, According to a Dermatologist appeared first on Reader's Digest."
"0"	"A New York City-themed Aquarium Is Opening in the American Dream Mall"	"A New York City-themed SEA LIFE Aquarium will in the American Dream mall in New Jersey in the spring of 2020."
"0"	"Federal Prosecutors Probe Giuliani's Links to Ukrainian Energy Projects"	"Federal prosecutors in New York are investigating whether Rudy Giuliani stood to personally profit from a Ukrainian natural-gas business pushed by two associates who also aided his efforts there to launch investigations that could benefit President Trump, people familiar with the matter said."
"1"	"Kate Middleton Wears Same Hat Diana Wore as She and Prince William Head to Pakistan Mountains"	"Kate Middleton and Prince William Visit Melting Glacier Pakistan"
"0"	"Father-daughter first dance medley had every guest on their feet"	"How awesome is this first dance medley? They got the moves down!"
"0"	"Why Men Take So Much Pride in Eating a Lot of Food"	"Who doesn't know that guy who brags about demolishing as many plates of wings as possible?"
"1"	"4 Bold Predictions for Alabama vs. LSU Heavyweight SEC Matchup"	"Saturday will provide us the biggest matchup of the 2019 college football season so far when Joe Burrow and No. 2 LSU travel to Tuscaloosa to lock horns with Tua Tagovailoa, Nick Saban, and No. 3 Alabama. Given how potent these teams are on both sides of the ball, this game could turn into a Burrow-Tua shootout just as easily as it could a 14-7 slugfest like the Bama-LSU games of yesteryear. While these matchups rarely go according to plan,..."
"1"	"The 2020 Porsche 911 Carrera S Is MotorTrend 's 2019 Best Driver's Car"	"Once more, with feeling: Porsche takes the BDC trophy. Again."
"1"	"Why would the Fed cut rates again with stocks near records?"	"A scant few think that Jerome Powell & Co. will opt not to cut interest rates next week for a third time in as many gatherings of the rate-setting Federal Open Market Committee on Wednesday."
"1"	"Caterpillar just flashed the latest warning sign for the global economy"	"The construction equipment titan   a bellwether for global industry   posted a 6% drop in sales and an 8% drop in profit per share."
"0"	"Police not pursuing charges against Browns' Myles Garrett"	"Cleveland police say they are not investigating Browns player Myles Garrett for striking a Pittsburgh Steelers quarterback in the head with a helmet. Sgt. Jennifer Ciaccia said Friday that police hadn't received a complaint from Mason Rudolph. And a city spokeswoman says the prosecutor can't comment because Rudolph hasn't filed a complaint"
"0"	"5 arrested in connection with deadly shooting at Airbnb Halloween party"	"Police have arrested five suspects in the Halloween shooting at a California Airbnb that left five partygoers dead. The arrests came during a coordinated police operation in four Northern California cities, reported San Francisco ABC station KGO. Five partygoers were killed on Halloween night at a house in the affluent town of Orinda, just east of Berkeley, that had been rented through Airbnb."
"0"	"Here's how much and who you should be tipping at American hotels"	"To tip or not to tip: That is the question. Well, one of them. Here's everything you should know about hotel tipping in the U.S."
"1"	"Here's How Often You Should Really Be Working Out for a Flat Belly"	"You've cleaned up your diet and started a workout plan, but how many days a week should you really work out to achieve a flat stomach?"
"0"	"Celebrity PDA of 2019"	"See the stars kissing and hugging on the red carpet and out and about!"
"1"	"Ranking the College Football Teams Most Likely to Enter December Unbeaten"	"Seven undefeated teams remain after Week 10. The post Ranking the College Football Teams Most Likely to Enter December Unbeaten appeared first on Stadium."
"0"	"Joshua Jackson and Jodie Turner-Smith spark marriage speculation"	"Joshua Jackson and Jodie Turner Smith may be secretly married."
"0"	"Bold predictions for Week 12 in college football"	"Expect the unexpected in college football each weekend. USA TODAY experts weigh in with their bold predictions for Week 12 of the season."
"0"	"Alex Rodriguez Jokingly Talks About Marrying Jennifer Lopez During Super Bowl Halftime Show"	"Alex Rodriguez Talks Marrying Jennifer Lopez During Super Bowl"
"1"	"The stock market warning that everyone is overlooking"	"Forget the yield-curve inversion. This is a more telltale sign that trouble is brewing."
"0"	"Texas Dad Says Apple Watch Changed Autistic Son's Life"	"Dad on How Apple Watch Noise App Helped Son with Autism"
"1"	"Wilson deletes tweet of him standing over concussed Smith-Schuster"	"The fallout from one of the most bitter games in NFL history rages on."
"0"	"5 Things You Didn't Know About Campbell's Iconic Green Bean Casserole"	"We even got our hands on the original 1955 recipe card from the test kitchen."
"0"	"The Coolest Way to See NYC Is in a Vintage Car From the Roaring '20s on This Midtown Tour"	"A new tour company called Nowaday, in New York City, will take you around in a restored, vintage car."
"1"	"Used-car price tumble spells trouble for the US auto market"	"Falling used-car prices last month were a major contributor to subdued inflation for the U.S. economy. Auto analysts warn this could be a lasting trend with major negative implications for new-vehicle demand."
"1"	"Mitch McConnell snubbed by Elijah Cummings' pallbearer in handshake line at U.S. Capitol ceremony"	"A pallbearer appeared to refuse to shake Mitch McConnell's hand as Rep. Elijah Cummings was lying in state at the Capitol."
"0"	"After Saugus High School shooting, prayer unites a grieving community"	"A day that began with the shock of a school shooting in Santa Clarita ended in prayer for many families who gathered for vigils in the area. Standing before hundreds of people at Grace Baptist Church in Santa Clarita on Thursday night, Pastor David Hegg acknowledged that students and parents may be grappling with how to make sense of the shooting at Saugus High School, which left two students ..."
"0"	"Trump's Doral resort was a last-minute addition in search for G-7 site, newly released email shows"	"President Trump canceled plans to host the summit of world leaders there after a bipartisan outcry."
"1"	"McDonald's apologizes for 'Sundae Bloody Sundae' Halloween promotion"	"McDonald's has canceled a promotion for a "Sundae Bloody Sundae" ice cream that was available in Portugal for Halloween."
"0"	"My City Was Named The 'Worst Place For Black Women To Live.' Is That My Cue To Leave?"	"In September 2019, City Lab published an article stating that Pittsburgh "was the worst place for black women to live for just about every indicator of livability." As a black woman from Pittsburgh who also happens to be the mother of a black girl, my first inclination was to throw all of ourbelongings into a moving truck and drive to D.C. where my husband's family lives.The article, titled "Pittsburgh: A 'Most Livable' City, but Not for Black Women"..."
"0"	"The 2019 NFL Season"	"The 2019 NFL Season"
"1"	"Most Underrated College Football Teams After 9 Weeks: Louisville, SMU, and Others"	"Louisville was 102nd in my preseason college football rankings. After a historically awful two-win season, I thought the Cardinals were worse than 101 other FBS teams. I misfired...badly. Eleven months after Louisville closed a two-win season with their ninth consecutive loss -- and their fourth straight 30-point loss -- the Cardinals are 5-3 and within striking distance of an eight- or nine-win season. With their win over Virginia in Week 9,..."
"0"	"20 huge retailers that are no longer with us"	"The retail graveyard is expanding."
"0"	"Stars   They're Just Like Us!"	"Stars   They're Just Like Us!"
"0"	"Parole rejected for Charles Manson follower after 50 years"	"A third consecutive California governor is blocking parole for a former follower of late cult leader Charles Manson who has been in prison for decades for two of the Manson family's slayings in the 1960s. Gov. Gavin Newsom on Friday reversed a parole recommendation for Bruce Davis, now 77, for the 1969 slayings of musician Gary Hinman and stuntman Donald "Shorty" Shea."
"0"	"Colin Kaepernick heads to Atlanta for workout"	"Despite speculation that he might not go through with Saturday's PR stunt, Colin Kaepernick will participate in the NFL's hastily organized workout."
"0"	"19 Home Renovations That Give Owners the Most Joy"	"These home upgrades score highly based on how happy homeowners are with them."
"1"	"This Is Exactly How Long You Need to Hold a Plank to Flatten Your Belly"	"All hail the plank!"
"1"	"17 Wacky Things That Are Actually Good for Your Body"	"Everyone knows that diet and exercise lead to better health. But you can do a whole lot more. For proof, just check out these surprising health hacks."
"1"	"Wealthy investors double up on fear that another market drop is coming"	"Investors with $1 million or more are much more concerned about the U.S. economy and stock market than they were just one quarter ago, according to a new survey from E-Trade Financial."
"1"	"Golfer and girlfriend pull amazing trick shot"	"Press LaBrie from Montreux, Nevada, USA, is a long drive golf pro who has recently started working on trick shots. He asked his girlfriend Adrianna Moritz to help him pull a challenging trick shot, and it worked brilliantly!"
"1"	"Minshew pulls Houdini act, finds Conley for 70-yard TD"	"Minshew avoided what appeared to be a sure sack, then threw a dart to Conley, who capped off the 70-yard touchdown with a sweet run down the right sideline."
"0"	"8 Clear Signs You're Not Eating Enough Vegetables"	"You know veggies are healthy for you. You know you should probably eat more. But here are obvious clues you need to up your produce game."
"0"	"Dow tops 28,000 for first time, capping 4-week win streak"	"The Dow Jones Industrial Average ended at another record high Friday after White House economic adviser Larry Kudlow said China and the U.S. were getting close to reaching a trade deal."
"0"	"'I Told My Partner I Cheated For All The Wrong Reasons But I'm Still Glad I Did It'"	""I learned how to show myself forgiveness and compassion.""
"0"	"Some of the World's Best Beaches Are in Countries You May Not Expect"	"You may know and love these destinations for their bustling urban centers or lush outdoor spaces, but they probably wouldn't top your list for a top-notch seaside getaway. That is, until now."
"0"	"Ohio GOP lawmakers want to ban all abortions, charge doctors who perform them with murder"	"Republicans in the Ohio House of Representatives have signed onto a bill to ban all abortions in Ohio and charge doctors who perform them with murder."
"1"	"Corporate earnings are up. Markets are up. And yet analysts keep saying the R-word"	"Three in four companies that have posted earnings so far have beaten Wall Street forecasts. But analysts still warn of an earnings recession."
"1"	"This is how much water you need to drink for weight loss"	"Drinking plenty of water is one of the major tenets of weight loss. But just how much water is enough? Here's how you can drink water to lose weight."
"1"	"The 25 US cities where it's easiest to get a mortgage"	"Mortgage rates have fallen in 2019 to some of the lowest levels in years, and lenders have found themselves flooded with applications for mortgages to buy homes or refinance existing home loans."
"1"	"Shake Shack stock tanks after it says it will temporarily shutter locations in 2020 for upgrades"	"Shack Shack is investing in remodeling, new locations, technology upgrades and a move to a single delivery provider, Grubhub."
"0"	"White House releases summary of Trump's first call with Ukraine's Zelensky"	"The White House has released a document summarizing President Donald Trump's first phone call with newly elected Ukrainian President Volodymyr Zelensky in April of this year."
"0"	"A decommissioned nuclear missile complex in Arizona that was abandoned for decades is now on sale for $400,000"	"This complex used to be home to the US's largest land-based missile, Titan II, which sat there armed for 24 years. Now, it's on sale."
"0"	"New Jersey football game: 5 men are arrested; 3 people hurt"	"Police have charged five men in connection with a shooting at a New Jersey high school football game that injured one adult and two minors."
"0"	"These are the new cars that depreciate least"	"Don't want to lose a ton of money on your next new car? These are the new car models that hold the most value after five years."
"0"	"Pair Of 'New' 1987 Buick Grand Nationals Pulled From Garage After 30 Years"	"This pair of Grand Nationals have only 1,400 miles combined!"
"1"	"Tesla Model S Plaid: Everything We Know"	"A three-motor track-ready version of the big Tesla sedan is on its way. Here's what to expect."
"0"	"7 possible landing spots for Anthony Rendon"	"The most coveted position player hitting the open market this winter is undoubtedly third baseman Anthony Rendon. Rendon's expected price tag - and the fact a compensatory draft pick must be surrendered upon signing him - will eliminate a handful of suitors outright."
"0"	"'Dream-Maker' Man Wants to Grant Wishes Through Social Media: 'I Do My Best for Everyone'"	"Charles Ressler Grants Wishes Through #DreamMaker Campaign"
"0"	"Bill Gates tops Jeff Bezos as world's richest person with Amazon slide"	"This time it's official."
"1"	"Agave Is Billed as a 'Healthy Sugar.' But Is That Even a Thing?"	"Here's what's really in that trendy smoothie you just ordered."
"0"	"Opinion: Baylor football back on top four years after sexual assault scandal rocked campus"	"For many watching Saturday night, it will be difficult to get past the name Baylor when the undefeated Bears play Oklahoma. Perhaps that's fair."
"1"	"Myles Garrett bashes Mason Rudolph with helmet in Browns-Steelers fight"	"A major melee broke out at the end of the Pittsburgh Steelers-Cleveland Browns game on Thursday night, and a fight between Myles Garrett and Mason Rudolph led to it all."
"1"	"Firestorm puts Astros closer Roberto Osuna back in the spotlight at World Series"	"Astros closer Roberto Osuna, pitching for the first time in the World Series since being part of team controversy, gets Game 3 save in Washington."
"0"	"Oilers in awe of McDavid's gigantic night: He's 'just unstoppable'"	"Edmonton Oilers captain Connor McDavid lit up the hockey world on Thursday night with a remarkable six-point performance versus the Colorado Avalanche, and his teammates were blown away."
"0"	"Experts Explain Why You Might Want to Stop Sleeping on Your Stomach and How to Do It"	"It may be time to make over your sleep habits   here's why and how to do it."
"0"	"Cows swept away by Hurricane Dorian found alive   but how?"	"A trio of wild cows believed to have been swept away by the storm surge from Hurricane Dorian have been found on a nearby island in North Carolina"
"0"	"MLB GM wants Jeff Luhnow 'banned for life' if he knew of Astros' sign-stealing"	"Another team executive said he wanted to see the league throw the book at the Astros."
"1"	"4 takeaways from Bill Taylor's huge opening statement"	"Pretty much everything we thought was a quid pro quo was in fact a quid pro quo, Bill Taylor testified Tuesday."
"0"	"6 teams on upset alert in NFL Week 11"	"A week ago, the Niners were the juggernauts of the NFC, but now they find themselves on upset alert against the 3-6-1 Cardinals. San Francisco and these five other teams may go down to lesser opponents."
"1"	"Miguel Cervantes' Wife Reveals Daughter, 3, 'Died in My Arms' After Entering Hospice Care"	"Miguel Cervantes' Wife Reveals Daughter 'Died in My Arms' After Hospice Care"
"1"	"Massive American Dream mall to open but will shoppers come?"	"After endless fits and starts and billions of dollars spent, American Dream is officially opening its doors to the public as the second largest mall in the country, and third largest in North America. It will showcase 3 million square feet of leasable space dedicated to more than a dozen entertainment attractions like a 16-story indoor ski slope, rollercoaster, waterpark and eventually 450 retail, food and specialty shops."
"0"	"Greek donkeys are still being abused as 'tourist taxis,' PETA claims"	"The animal rights group claims that legislation recently passed to protect the animals is not being enforced."
"0"	"South Carolina teen gets life in prison for deadly elementary school shooting"	"Jesse Osborne, the teenager responsible for a shooting at a South Carolina elementary school in 2016, was sentenced to life in prison."
"1"	"His Mood Changed and Our Marriage Imploded. Then He Took a Blood Test."	"His condition came on so gradually he couldn't tell he had changed."
"1"	"Dangers of tattoos are more than just skin deep"	"Skin experts say people should consider sanitation and potential allergic reactions before getting a tattoo."
"1"	"Explosive new wildfire drives thousands from homes near Los Angeles"	"The Maria fire ignited in Ventura County early Thursday night and raced westward, consuming 4,000 acres in just three hours."
"1"	"The 'Whimpering' Terrorist Only Trump Seems to Have Heard"	"It was a vivid scene worthy of the ending of a Hollywood thriller, the image of a ruthless terrorist mastermind finally brought to justice "whimpering and crying and screaming all the way" to his death. But it may be no more true than a movie script."
"0"	"Lena Waithe Reveals She Secretly Married Her Longtime Love"	"Lena Waithe and longtime love Alana Mayo secretly got married! Watch the Masters of None star talk about their wedding on The Ellen DeGeneres Show with guest host John Legend here."
"0"	"Knicks fans welcome Porzingis back with hearty round of boos"	"Kristaps Porzingis returned to Madison Square Garden Thursday night for the first time since he was traded to the Dallas Mavericks."
"1"	"Dow posts another record close on strong economic data"	"The Dow Jones Industrial Average rose slightly to another record close Tuesday as investors assessed new economic data and developments between the U.S. and China on trade."
"1"	"Stocks close higher after Fed signals pause on rate cuts"	"Stocks ended higher Wednesday as traders cheered the Federal Reserve's third rate cut of the year and comments from Chairman Jerome Powell that signaled it would be a while before the central bank hikes rates."
"0"	"Envoy Was 'Obstacle' to Trump, Schiff Says: Impeachment Update"	"The House Intelligence Committee held its second public hearing on Friday to hear testimony by former U.S. Ambassador to Ukraine Marie Yovanovitch, who was removed from that post in May by President Donald Trump."
"0"	""Cake Boss" made Carlo's Bakery famous, but the New Jersey bakery was a staple for Italian pastries 100 years before the show aired -- here's why"	"Buddy Valastro is known from the TLC show "Cake Boss," but his small-town bakery, Carlo's Bakery, has been a staple in Hoboken, New Jersey, since 1910. The bakery is loved for more than its extraordinary cakes, wowing customers with its signature Italian pastries. Insider's Taryn Varricchio met up with the Cake Boss to find out what makes this historic bake shop iconic beyond its cakes."
"0"	"2 Seminole County students arrested in school shooting plot"	"Two students were arrested after they threatened to shoot up a Seminole County middle school."
"1"	"Kasich to Congress: 'Look in the mirror at how you want to be remembered'"	"Former Ohio Gov. John Kasich said his advice for fellow Republicans in Congress during the impeachment process was to "look in the mirror at how you want to be remembered.""
