"1"	"Popeyes mocks Chick-fil-A for National Sandwich Day blunder, reignites sandwich wars"	"foodnews"
"1"	"The best & worst states for US veterans"	"causes"
"1"	"2 murder suspects escape from jail, still on the run"	"newscrime"
"1"	"Why Prince Harry Wore His Remembrance Poppy Differently from the Rest of the Royal Family"	"lifestyleroyals"
"1"	"Chef Gordon Ramsay Donates $10K To Beachwood Girl's GoFundme"	"foodnews"
"1"	"10 over-the-top foods you can only find at festivals"	"foodnews"
"0"	"2021 Ford Mustang Mach-E: This Electric SUV is a Mustang Family Member"	"autosnews"
"1"	"Florida man demands deputies take down his mug shot. They replaced it with his booking photo."	"newscrime"
"1"	"Notorious Low Bridge Known For Decapitating Box Trucks Getting Raised"	"autosnews"
"0"	"4 takeaways from the Seahawks' wild, overtime win over the 49ers"	"football_nfl"
"0"	"Fox legal analyst Napolitano emerges as Trump critic"	"newsus"
"0"	"Wendy's Is Rolling Out Birthday Cake Frostys for Its 50th Anniversary"	"foodnews"
"0"	"A Nutella Hotel Is Opening in California"	"travelnews"
"0"	"Do Pilots Actually Avoid Flying Over the Bermuda Triangle?"	"video"
"0"	"California Nike store robbed by thieves who walked out with armfuls of merchandise"	"newscrime"
"1"	"'He fought them,' father says of son killed on birthday defending his family in home"	"newscrime"
"0"	"21 Ways Restaurants Are Going to Change"	"restaurantsandnews"
"0"	"How to Drink Coffee Without Any Sweetener"	"tipsandtricks"
"0"	"Shooting under investigation outside Stafford hotel"	"newscrime"
"1"	"Police shoot naked, gun-wielding man in Renton"	"newscrime"
"1"	"Dean Foods files for bankruptcy"	"finance-companies"
"0"	"Joanna Gaines reveals her family's favorite recipes in new cookbook"	"foodnews"
"1"	"2 arrested after third Indiantown shooting in a week; woman taken to hospital"	"newscrime"
"0"	"The 22 Wildest Celebrity Hair Transformations of the Last Decade"	"lifestylebeauty"
"0"	"Abandoned farms for sale with plenty of promise"	"finance-real-estate"
"0"	"Celebrity Engagements of 2019"	"celebrity"
"1"	"Not out of woods yet, but winds driving California fires die"	"weathertopstories"
"1"	"45 Recipes Grandma Stole from Her Church Friends"	"recipes"
"0"	"7 Easy-to-Miss Milestones That Indicate You're On Track to Becoming Successful"	"lifestylecareer"
"1"	"School bus driver charged with DUI after crashing with 10 students on board"	"newscrime"
"0"	"Opinion: Consensus at the top of the College Football Playoff rankings, but who's No. 4?"	"football_ncaa"
"1"	"New York City man apprehended for punching woman, 53, outside church, police say"	"newscrime"
"0"	"Tom Brady says he is not expecting Rob Gronkowski to return"	"football_nfl"
"0"	"Gwen Stefani Reveals New Nickname for Her and Blake Shelton"	"music-celebrity"
"1"	"CC Sabathia says goodbye to Yankees and baseball with special note"	"baseball_mlb"
"1"	"Woman flags down officer, asks for ride to stolen car, Lincoln police say"	"newscrime"
"0"	"My New Instant, Bare-Fridge Dinner Starring Eggs, Of Course"	"quickandeasy"
"0"	"5-foot-6 Tarik Cohen complains about towels being placed too high in hilarious video"	"football_nfl"
"1"	"Divers salvage 100-year-old liquor from WWI shipwreck"	"travelarticle"
"1"	"United Airlines to take flyers far, far away in new Star Wars-themed plane"	"travelnews"
"1"	"See the most expensive watch ever sold at auction"	"viral"
"0"	"Bucs release former first-round pick Vernon Hargreaves"	"football_nfl"
"1"	"My Third Husband Is 102 Years Old. Here's What Our Marriage Is Like."	"voices"
"0"	"Funny celeb pics for November 2019"	"humor"
"0"	"Anna Faris and Michael Barrett may have just confirmed their engagement, plus more news"	"entertainment-celebrity"
"0"	"Tom Brady's trainer hints at how long QB intends to keep playing"	"football_nfl"
"0"	"The Latest: Judge denies new claim in Georgia execution case"	"newscrime"
"1"	"Iowan convicted of murder claims his life-sentence was served once he died, was revived in medical emergency. The court disagrees."	"newscrime"
"0"	"'Baby Shark' Devoured Your Brain. Your Wallet Is Harder to Swallow."	"finance-companies"
"0"	"This Thanksgiving, We're Tearing Our Potatoes Instead of Cutting Them"	"tipsandtricks"
"1"	"American Airlines pilot retiring after 35 years gives his wings to Central Florida toddler with Down syndrome"	"newsworld"
"0"	"This Veteran Found His Long-Lost Love After 75 Years"	"causes"
"0"	"Kansas lands commitment from five-star guard Bryce Thompson"	"basketball_ncaa"
"0"	"The Bakery Behind Doubletree's Famous Chocolate Chip Cookie Bakes More Than 100 Million Cookies A Year"	"foodnews"
"1"	"A Seattle man broke into an office building, ate $200 worth of chocolate, and collapsed in a sugar coma"	"foodnews"
"0"	"Justin Bieber Says Popeyes Chicken Sandwich Is 'Not Worth the Hype'"	"foodnews"
"0"	"Lisa Vanderpump Reveals Why She Left RHOBH: 'I Don't Have Room in My Life for Nastiness'"	"tvnews"
"0"	"Here's the Very Best of Oprah's Favorite Things"	"shop-holidays"
"1"	"California cops respond to 2 homeless men shot with arrows: report"	"newscrime"
"0"	"Your Thanksgiving Guests Will Be Very Thankful for Our Favorite Turkey Recipes"	"recipes"
"1"	"16 of the Most Historically Inaccurate Movies Ever"	"movies-gallery"
"0"	"105 Black Friday Deals You Can Start Shopping Today"	"shop-holidays"
"0"	"Report: Red Sox manager Alex Cora, Mets' Carlos Beltrán implicated in Astros sign-stealing scheme"	"baseball_mlb"
"0"	"Stella McCartney Deleted a Meghan Markle Instagram Post After Followers Called Her Out"	"lifestyleroyals"
"0"	"How Big Is Your Turkey? Most Americans Pick This Smaller Size, Says Survey"	"tipsandtricks"
"0"	"The Most Popular Family Dinners from Every Decade"	"recipes"
"0"	"Eerie photos of an abandoned airport that hasn't been touched in 25 years"	"newsphotos"
"1"	"Boeing says up to 50 planes grounded globally over cracks"	"finance-companies"
"0"	"Christopher Johnson has hitched his reputation to Adam Gase"	"football_nfl"
"0"	"These Loaded Mashed Potatoes Will Win Thanksgiving"	"videos"
"0"	"Oprah's list of favorite things is full of great holiday gifts under $50"	"finance-savemoney"
"0"	"Why This Couple Is Getting a 'Sleep Divorce'"	"lifestylevideo"
"0"	"Hannah Brown on Being Surrounded By Exes Tyler Cameron and Colton Underwood"	"tv-celebrity"
"0"	"Gwen Stefani's biggest career moments"	"music-gallery"
"0"	"Beat the crowds at these abandoned U.S. national parks"	"ustravel"
"1"	"Halloween snowstorm wallops the Midwest"	"weathertopstories"
"0"	"The 50 cheapest places to buy land in America"	"finance-real-estate"
"0"	"10 Thanksgiving dishes you should just buy at the store"	"quickandeasy"
"1"	"11-year-old boy dies after being shot in chest"	"newscrime"
"1"	"Uh-Oh! Carrie Ann Inaba Falls on 'Dancing With the Stars'"	"tv-celebrity"
"0"	"Comics - 'Half Full' by Maria Scrivan"	"humor"
"0"	"Report: Giants hire Gabe Kapler as new manager"	"baseball_mlb"
"1"	"Here Are the Biggest Deals We're Anticipating for Black Friday"	"shop-holidays"
"0"	"College Football Playoff projection: Alabama's chances still high after LSU loss"	"football_ncaa"
"1"	"The 25 most iconic film quotes"	"movies-gallery"
"0"	"Daisy Ridley plays coy about engagement speculation"	"movies-celebrity"
"0"	"Watch: Draymond Green becomes first player ever ejected from Chase Center"	"basketball_nba"
"0"	"Popeyes Has Blessed Us With A Boozy Pie To Pair With Its Returned Chicken Sandwich"	"foodnews"
"0"	""The Joy of Cooking" and its recipe for success"	"foodnews"
"0"	"Hailey Bieber Sends Aunt Hilaria Baldwin Love After Her Second Miscarriage"	"celebrity"
"1"	"3 killed in overnight shootings in Palm Bay"	"newscrime"
"0"	"I Decided to Stop Cooking Thanksgiving Dinner, and It Was Seriously the Best Decision"	"newstrends"
"0"	"Nothing Says Fall Like This Dairy-Free Pumpkin Pie"	"recipes"
"0"	"The 1 reason you shouldn't hesitate to claim Social Security early"	"finance-retirement"
"1"	"Opinion: Browns' Freddie Kitchens, Jets' Adam Gase could be headed for one-and-done territory"	"football_nfl"
"1"	"We Could Watch These "Wheel Cakes" Being Made All Day"	"foodnews"
"0"	"4 reasons you shouldn't max out your 401(k)"	"finance-saving-investing"
"0"	"Survivor Contestant Accused of 'Inappropriate Touching,' 2 Players Admit to Using Allegations to Win"	"tvnews"
"0"	"Subway just released a sandwich with green eggs and ham"	"foodnews"
"0"	"Police name suspect wanted in fatal stabbing at Popeyes in Oxon Hill"	"newscrime"
"0"	"Heartbreak for 49ers K Chase McLaughlin, who shanks chance to cement hero status"	"football_nfl"
"1"	"Horrific details emerge in 'barbaric' murder of 1999 Jane Doe"	"newscrime"
"0"	"Emilia Clarke Stunned in a Cut-Out Dress at the 'Last Christmas' Premiere"	"lifestylecelebstyle"
"0"	"2019 People's Choice Awards fashion hits and misses"	"awards"
"0"	"Mother of missing 5-year-old Taylor Williams now person of interest in child's disappearance"	"newscrime"
"0"	"Report: Padres priced out of Strasburg sweepstakes"	"baseball_mlb"
"0"	"My husband and I have a 'family meeting' every week, and it saved our marriage after I became a mom"	"voices"
"0"	"Prince Harry and Meghan Markle just shared a never-before-seen photo of baby Archie with his 'Grandpa' Prince Charles to celebrate his birthday"	"lifestyleroyals"
"1"	"Reports: LSU LB Michael Divinity removed from team days before Alabama game"	"football_ncaa"
"0"	"Stromboli vs. Calzone: What's the Real Difference Between These Italian Favorites?"	"foodnews"
"0"	"Jennifer Lopez Just Got a Teeny Chop to Her Blond Lob, but it Changed the Entire Look"	"lifestylecelebstyle"
"0"	"Why Prince Harry Wore His Remembrance Poppy Differently from the Rest of the Royal Family"	"lifestyleroyals"
"0"	"The world's first hybrid cruise ship is currently on its maiden voyage⁠ take a look inside"	"travelnews"
"1"	"See the secret airplane bedrooms where flight attendants sleep on long-haul flights"	"travelnews"
"0"	"Tourists needed in Venice after flooding, locals say"	"travelnews"
"0"	"These Two New Oreo Flavors Are Coming in 2020 and We're OBSESSED"	"foodnews"
"0"	"Former U.S. President Carter recovering in hospital after successful brain procedure"	"newsus"
"0"	"My Immigrant Parents Wanted A Better Life For Me. This Is Why I Chose My Path Over Theirs."	"voices"
"0"	"Joanna Gaines' Friensdgiving Casserole Recipe Has Us Ready to Throw a Party Tonight"	"recipes"
"0"	"10 Tasty Side Dishes for Your Holiday Ham"	"recipes"
"0"	"My Husband Doesn't Like What I Wear and It's Making Me Feel Terrible"	"advice"
"1"	"Applebee's Is Selling Boneless Wings For 25 Cents Each Because There Are So Many Sports On Right Now"	"foodnews"
"0"	"Top 10 storylines for college football Week 12"	"football_ncaa"
"1"	"Girl, 7, critically wounded in shooting while trick-or-treating in Little Village on Southwest Side; suspect in custody"	"newscrime"
"0"	"Fudge vs Ganache: What's the Difference?"	"tipsandtricks"
"1"	"Prince Harry and Meghan Markle just shared a never-before-seen photo of baby Archie with his 'Grandpa' Prince Charles to celebrate his birthday"	"lifestyleroyals"
"0"	"38 men who were worthy competitors for John Legend's Sexiest Man Alive title"	"celebrity"
"1"	"Celebrity chef 'Salt Bae' will pay $230,000 to four ex-servers"	"foodnews"
"1"	"50 Weird but Wonderful Facts That Will Leave You Totally Amazed"	"lifestyledidyouknow"
"0"	"Widow claims Carnival Cruise Line hired unlicensed doctor, and now her husband is dead"	"newscrime"
"0"	"The Most Talked-About Celebrity Hair Transformations"	"lifestylecelebstyle"
"1"	"Ranking the 25 best films with surprise endings"	"movies-gallery"
"0"	"Whale swims beneath surfers, but do they even notice?"	"more_sports"
"0"	"Owner shocked after his 60s Porsche roadster gets stolen from classic car show in Pleasanton"	"autosnews"
"0"	"81 Bean Recipes You'll Be Making All Year Long"	"recipes"
"0"	"Fashion hits and misses from the 2019 Country Music Association Awards"	"cma-awards"
"0"	"Drake RESPONDS to Fans Booing Him Off Stage"	"musicvideos"
"0"	"Copycat Cracker Barrel Chicken and Dumplings Recipe"	"recipes"
"1"	"Star Anise: What It Is, and How to Use this Strange-Looking Spice"	"tipsandtricks"
"1"	"Louisville police: 2 arrested after man found shot to death on street near Newburg Road"	"newscrime"
"0"	"Cashman: Yankees will pursue free agents Cole, Strasburg"	"baseball_mlb"
"0"	"Biggest celeb weddings of the last decade"	"celebrity"
"0"	"The son of a Chinese billionaire has been banned from flying first class, playing golf, buying property, or going clubbing"	"newsworld"
"0"	"Scared Rabbit Abandoned In Box Clings To His Favorite Teddy Bear"	"lifestylebuzz"
"0"	"We Tried 9 Packaged Stuffings and There Was a Clear Winner"	"tipsandtricks"
"0"	"'It's not over': Sarah Palin says she is fighting to repair her marriage"	"newsus"
"0"	"WWE Wrestler Jordan Myles Quits in Expletive-Filled Rant as He Brands the Company Racist"	"tvnews"
"0"	"We tried McDonald's new Snickerdoodle McFlurry, and here's our honest review"	"newstrends"
"1"	"Fudge vs Ganache: What's the Difference?"	"tipsandtricks"
