"1"	"Winners and losers from Game 1 of the World Series"	"baseball_mlb"
"0"	"Why 17-Year-Old Can't Get Out of Her Seatbelt"	"viral"
"0"	"AP Interview: Evo Morales wants UN mediation in Bolivia"	"newsworld"
"1"	"Sears says it has secured a $250 million lifeline, will close 96 stores"	"finance-companies"
"1"	"Jennifer Aniston on why she joined Instagram: 'I'm just trying to build content'"	"popculture"
"0"	"Secrets for Scoring Hotel Room Upgrades"	"video"
"1"	"Subtle Signs You May Have Clogged Arteries"	"medical"
"1"	"Jess Lost 75 Pounds Without Counting Calories and Did This 1 Inspiring Thing Before Every Meal"	"weightloss"
"1"	"Justin Verlander: 'I want to hang out with' Texans quarterback Deshaun Watson"	"baseball_mlb"
"0"	"The Most Popular Potluck Dessert from Every Decade"	"recipes"
"1"	"Duchess Meghan Describes 'Really Challenging' Life as New Royal: I'm Not OK"	"lifestyleroyals"
"0"	"Corbyn launches plan to give free broadband to everyone in Britain"	"newsworld"
"1"	"Assessing the offseason for the Boston Red Sox"	"baseball_mlb"
"0"	"Ukraine 'invisible' as impeachment hearings focus on Washington drama"	"newsworld"
"1"	"MLB bans women who flashed their chests behind home plate during Game 5 of World Series"	"baseball_mlb"
"0"	"Opinion: Baylor football back on top four years after sexual assault scandal rocked campus"	"football_ncaa"
"0"	"Nurses face an epidemic of workplace violence"	"markets"
"0"	"NBA dynamic duos: What pairings are rocking, struggling?"	"basketball_nba"
"0"	"A third of boomers make this critical retirement mistake"	"finance-saving-investing"
"0"	"Lamar Odom is Engaged to Girlfriend Sabrina Parr -- See Her Stunning Ring!"	"tvvideos"
"1"	"Here's What Bill Belichick Told Patriots' Defense In Sideline Huddles Vs. Jets"	"football_nfl"
"0"	"Selfies In Sports"	"more_sports"
"0"	"7-Year-Old Activist Calling on Crayola to Be More Eco-Friendly"	"lifestyle"
"1"	"Trent Brown allegations test Raiders owner's stand against domestic abuse"	"football_nfl"
"0"	"If you were shocked by Kodak Black's prison term, wait and see what comes next"	"newscrime"
"1"	"What Tom Brady, Lamar Jackson Told Each Other After Patriots-Ravens"	"football_nfl"
"1"	"10 players receive qualifying offers"	"baseball_mlb"
"0"	"Iran moves on ultra-cheap petrol, starts rationing"	"newsworld"
"1"	"Maleficent: Mistress of Evil delivers an empty, CG-dazzled fairytale"	"reviews"
"0"	"Lena Waithe Reveals She Secretly Married Her Longtime Love"	"tv-celebrity"
"1"	"Demi Moore Names Male Co-Star Who Didn't Deserve to Make More Money Than Her"	"tvnews"
"1"	"Red Sox prospect awaits word on deferment from Navy"	"baseball_mlb"
"1"	"Maryland man, 46, gets probation after he killed a father and his four daughters when his SUV crossed a median and slammed into their minivan"	"newscrime"
"1"	"With Carlos Beltran hire it's clear the Mets learned nothing from the Mickey Callaway mess"	"baseball_mlb"
"0"	"The world's most profitable company is about to go public"	"finance-companies"
"0"	"There's a place in the US where its been over 80 degrees since March"	"weathertopstories"
"0"	"Ohio GOP lawmakers want to ban all abortions, charge doctors who perform them with murder"	"newsus"
"0"	"The Coolest Way to See NYC Is in a Vintage Car From the Roaring '20s on This Midtown Tour"	"ustravel"
"0"	"Female Thunderbird pilot inspiring others to chase their dreams"	"newsgoodnews"
"0"	"New Trump rule to make more health care rates public"	"health-news"
"0"	"Opinion: NFL should suspend Browns' Myles Garrett for rest of season   at minimum   for helmet swing"	"football_nfl"
"1"	"Kevin Jonas Gets Tattoo Dedicated to Wife Danielle -- See the New Ink!"	"music-celebrity"
"0"	"6 Trump associates have been convicted in Mueller-related investigations"	"newspolitics"
"0"	"Taylor Swift Says Scooter Braun, Scott Borchetta Are Blocking Her From Playing Old Hits at AMAs"	"musicnews"
"1"	"Winners, losers from Steelers' win over Dolphins on 'Monday Night Football'"	"football_nfl"
"0"	"Kristen Bell's Cozy Look Is a Lesson in Winter Airport Fashion"	"lifestylecelebstyle"
"1"	"Shaquille O'Neal donates home to family of Atlanta boy paralyzed in shooting"	"basketball_nba"
"0"	"Pregnant Eva Amurri Martino Reveals Split From Husband Kyle Martino"	"movies-celebrity"
"0"	"Missing woman's husband arrested after carpet found soaked with blood, bleach"	"newscrime"
"0"	"California and nearly two dozen other states sue Trump administration for the right to set fuel-efficiency standards"	"newsus"
"1"	"A Year of Wins! MLS Stars Alex Morgan and Servando Carrasco Expecting a Daughter"	"entertainment-celebrity"
"0"	"Billionaires' success boils down to 3 simple traits, a new report says"	"personalfinance"
"0"	"Southwest's Spring Travel Sale Includes $39 One-way Tickets"	"travelnews"
"0"	"How to Brine a Turkey & Why You Should"	"tipsandtricks"
"0"	"The Real Reason McDonald's Keeps the Filet-O-Fish on Their Menu"	"restaurantsandnews"
"1"	"'Wheel of Fortune' fans can't believe all three contestants missed puzzle"	"popculture"
"0"	"End Of An Era As Chevy Has Built The Last Front-Engined Corvette"	"autossports"
"0"	"Pete Davidson, Kaia Gerber Are Dating, Trying to Stay 'Low Profile'"	"tv-celebrity"
"1"	"Winners, losers from Patriots' shutout win over Jets on Monday Night Football"	"football_nfl"
"0"	"Epic 'Jeopardy!' rematch gets off to a hot start"	"popculture"
"0"	"Texas Dad Says Apple Watch Changed Autistic Son's Life"	"newsgoodnews"
"1"	"MLB playoffs: Nationals' Victor Robles delivers in NLCS Game 3"	"baseball_mlb"
"0"	"House to hear from US official who said he overheard Trump, Sondland call"	"newspolitics"
"0"	"Meghan Markle and Hillary Clinton Secretly Spent the Afternoon Together at Frogmore Cottage"	"lifestyleroyals"
"1"	"Helen Mirren Says it Was 'Very Flattering' to Be Mistaken for Keanu Reeves' Girlfriend"	"movies-celebrity"
"1"	"California gets ready for more wildfires and power outages as the weather refuses to cooperate"	"newsus"
"1"	"Gastonia, N.C. woman's social media post about stranger's act of kindness goes viral"	"newsgoodnews"
"1"	"6 NFL teams that should have a fire sale at the trade deadline"	"football_nfl"
"0"	"Envoy Was 'Obstacle' to Trump, Schiff Says: Impeachment Update"	"newspolitics"
"1"	"Amelia Bambridge: Body of missing backpacker found in sea"	"newsworld"
"1"	"Lady Gaga Opens Up to Oprah About Trauma, Self-Harm, and Choosing Kindness"	"music-celebrity"
"0"	"Wisconsin bus driver saves children wandering in snow, as deadly Arctic air mass grips US"	"newsgoodnews"
"0"	"Prague locals tire of tourists, 30 years after end of Communism"	"internationaltravel"
"0"	"I Overate at Dinner Until I Started Doing This 1 Simple Thing on Sundays (It Takes 10 Minutes!)"	"nutrition"
"0"	"Stephanie Parze's Car Is at Home. So Is Her Phone. But She's Missing."	"newscrime"
"0"	"Here's how much and who you should be tipping at American hotels"	"traveltips"
"0"	"Someone Finally Invented a Jar Lid That Won't Get Stuck"	"foodnews"
"1"	"Michigan apples being recalled in eight states for possible Listeria contamination"	"healthnews"
"1"	"Joey King: Filming 'Kissing Booth 2' With Ex Jacob Elordi Was 'Worth It'"	"movies-celebrity"
"1"	"Jimmy Carter hospitalized after fall at Georgia home"	"newsus"
"1"	"Martin worries about amputation after breaking right leg"	"golf"
"1"	"Opinion: Astros still don't get it, and must pay a steeper price beyond firing assistant"	"baseball_mlb"
"1"	"James Van Der Beek and Wife Kimberly on Expecting Baby No. 6: It Often Requires an 'Explanation'"	"tv-celebrity"
"0"	"These are the new cars that depreciate least"	"autosresearchguides"
"1"	"Before his execution, a death row inmate told his victim's family he forgives them"	"newscrime"
"0"	"Did Trump just commit witness tampering? I asked 7 legal experts."	"newspolitics"
"1"	"Saquon Barkley, Evan Engram are back for Giants; Sterling Shepard remains out"	"football_nfl"
"1"	"Holocaust survivor under guard amid death threats"	"newsworld"
"1"	"I Crash Dieted a Few Weeks Before My Wedding, and I've Never Felt Such Regret"	"voices"
"1"	"Umpire Jeff Nelson released from hospital after suffering concussion in ALCS Game 3"	"baseball_mlb"
"0"	"Your Thanksgiving Guests Will Be Very Thankful for Our Favorite Turkey Recipes"	"recipes"
"1"	"Jimmy Garoppolo addresses Erin Andrews interview by saying he uses 'baby' 500 times a game"	"football_nfl"
"1"	"Sure, it was the Jets, but that was the best performance of the season"	"football_nfl"
"0"	"THEN AND NOW: What all your favorite '90s stars are doing today"	"celebrity"
"0"	"U.S. Troops Will Die If They Remain in Syria, Bashar Al-Assad Warns"	"newsworld"
"0"	"Please Don't Yell at Your Dog!"	"lifestylebuzz"
"1"	"Gambler robbed after women spike drink at South Florida casino"	"newscrime"
"0"	"Oregon may face ICE push-back on new limits for courthouse arrests"	"newsus"
"1"	"High tides surge through Venice, locals rush to protect art"	"weathertopstories"
"1"	"Fetuses found in package intercepted at SFO; woman arrested in smuggling scheme"	"newscrime"
"1"	"Miranda Lambert Reveals the Real Reason Behind Her Secret Wedding: 'It's Not for Everybody Else'"	"music-celebrity"
"0"	"Experts Explain Why You Might Want to Stop Sleeping on Your Stomach and How to Do It"	"wellness"
"0"	"5 arrested in connection with deadly shooting at Airbnb Halloween party"	"newscrime"
"1"	"The Astros are in everyone's heads, whether the Yankees are tipping pitches or not"	"baseball_mlb"
"1"	"Mom who touted daughter's 'bucket list' accused in her death"	"newscrime"
"0"	"Australia's fragile koala colonies are being ravaged by brush fires: 'It's a national tragedy'"	"causes-disaster-relief"
"0"	"50 Worst Movie Sequels of All Time"	"movies-gallery"
"0"	"Morris Commercial Introduces Sentimental Electric Morris JE Van"	"autosenthusiasts"
"1"	"Tristan Thompson Drops Flirty Comment on Ex Khloe Kardashian's Instagram"	"tv-celebrity"
"0"	"Father-daughter first dance medley had every guest on their feet"	"viral"
"0"	"DHS Sued for Answers About Its Use of DNA Testing at the Border"	"newsus"
"1"	"Korean Pop Star Sulli Dies at 25"	"musicnews"
"0"	"10 reasons it's better to rent rather than buy a home"	"finance-real-estate"
"0"	"22 Smart Tax Moves to Make Before the End of the Year"	"finance-taxes"
"1"	"Kelly Stafford details recovery from brain surgery in ESPN essay"	"football_nfl"
"0"	"The Kardashians Face Backlash Over 'Insensitive' Family Food Fight in KUWTK Clip"	"tv-celebrity"
"0"	"Surviving Santa Clarita school shooting victims on road to recovery: Latest"	"newsus"
"1"	"Teen 'Jeopardy!' champ donates $10,000 to cancer research in honor of Alex Trebek"	"tvnews"
"0"	"Meghan Markle's Lawyers Debunk Multiple False Tabloid Stories in New Court Documents"	"lifestyleroyals"
"0"	"Audience applauds, GOP microphone turned off at end of Yovanovitch hearing"	"newspolitics"
"1"	"Winners and losers from Game 6 of World Series"	"baseball_mlb"
"1"	"Report: Patrick Mahomes to miss at least three weeks with knee injury"	"football_nfl"
"0"	"It's the Latin Grammys 20th Anniversary, and the Red Carpet Was as Extra as We Expected and More!"	"awardstyle"
"1"	"Ranking the hottest coaching seats in the NFL"	"football_nfl"
"0"	"Christopher Reeve's Son Remembers Dad 15 Years After His Death: His Legacy 'Will Always Live On'"	"movies-celebrity"
"0"	"LeBron James: 'Everyone had doubt' whether an NBA team would sign Carmelo Anthony"	"basketball_nba"
"0"	"Maze of tunnels reveals remains of ancient Jerusalem"	"travelnews"
"1"	"Nearly half of the Jets roster is on the team's injury report"	"football_nfl"
"0"	"Spot the Dog One Out - Pooch Fades Into the Crowd as Sheep Stop Traffic"	"animals"
"0"	"Ready to Try CrossFit? Give This Beginner's WOD a Try."	"fitness"
"0"	"A birthday, a walk to school and a blast that tore an Afghan family apart"	"newsworld"
"0"	"Trump's Washington hotel has fallen behind competitors, with rooms running nearly half empty, marketing materials show"	"newsus"
"1"	"Report: Patriots trade for Mohamed Sanu, send second-round pick to Falcons"	"football_nfl"
"1"	"If you want baseball like it used to be, this is the World Series for you"	"baseball_mlb"
"0"	"Kate Middleton Shows Off Motherly Side as She Bonds with Families at Opening of Children's Hospice"	"lifestyleroyals"
"1"	"Singer Lauren Alaina Has Lost 25 Lbs. on Dancing with the Stars: 'None of My Clothes Fit'"	"tv-celebrity"
"0"	"Who is Marie Yovanovitch? Ambassador testifying at the impeachment hearing"	"newspolitics"
"0"	"'Charlie's Angels' stars: Where are they now?"	"movies-gallery"
"0"	"Why This Couple Is Getting a 'Sleep Divorce'"	"lifestylevideo"
"1"	"Report: Police investigating woman's death after Redskins' player Montae Nicholson took her to hospital"	"football_nfl"
"0"	"Raise Billions From Billionaires? Tax Experts Say It's Not That Simple"	"finance-taxes"
"0"	"Trump asks justices for temporary block of House subpoena"	"newspolitics"
"0"	"George Conway and Trump Jr. trade personal insults during impeachment hearing"	"newspolitics"
"0"	"Steelers vs. Browns highlights | Week 11"	"football_nfl_videos"
"1"	"Elizabeth Warren to Bill Gates: I'll explain my wealth tax to you"	"elections-2020-us"
"1"	"Why ex-NFL star Kellen Winslow II finally pleaded guilty to sex crimes"	"football_nfl"
"1"	"Jennifer Aniston Just Gave a Rare Look at Her Natural Hair Texture"	"lifestylebuzz"
"0"	"Kate Middleton Took Public Transit to Her Royal Engagement Today"	"lifestyleroyals"
"0"	"Metal detectorists discover haul of gold coins worth at least 100k"	"viral"
"0"	"This was uglier than a brawl. And Myles Garrett deserves suspension for rest of year after helmet attack."	"football_nfl"
"0"	"A 16-second spasm of violence leaves 2 dead at Saugus High School"	"newsus"
"1"	"2019 MLB award predictions: Our picks for Rookie of the Year, Cy Young, MVP"	"baseball_mlb"
"1"	"Demi Lovato Just Proved She's the Queen of Halloween"	"music-celebrity"
"0"	"Report: Carmelo Anthony returning to NBA with Trail Blazers"	"basketball_nba"
"1"	"NFL world reacts to officials handing Packers win over Lions"	"football_nfl"
"1"	"Lawsuits, payouts, opioids crisis: what happened to Johnson & Johnson?"	"finance-companies"
"0"	"Treasury yields tick higher amid uncertainty over US-China trade deal"	"markets"
"0"	"12-year-old Missouri girl hit by police car dies nearly a month after accident"	"newsus"
"0"	"7 possible landing spots for Anthony Rendon"	"baseball_mlb"
"1"	"Eagles' Fletcher Cox chased would-be assailant off with shotgun"	"football_nfl"
"1"	"10 Exercises You Should Never Do Again, According to Trainers"	"fitness"
"1"	"MLB Free Agent Reliever Market Already Shrinking"	"baseball_mlb"
"1"	"Joe Girardi Teared Up Paying Tribute to CC Sabathia"	"baseball_mlb"
"0"	"The 5 Secrets to Perfect Pumpkin Pie"	"tipsandtricks"
"1"	"Doctors warn addiction of 'human Ken doll' has gotten dangerous"	"medical"
"1"	"Shawn Mendes Took a Selfie With a Cuddly Quokka: See The Photo"	"music-celebrity"
"1"	"Andy Reid has no regrets for calling quarterback sneak"	"football_nfl"
"1"	"Man on stepson's surprise play: "It took my voice away""	"newsgoodnews"
"0"	"Bold predictions for Week 12 in college football"	"football_ncaa"
"1"	"'The Little Mermaid Live!': TV Review"	"tv-reviews"
"1"	"Single dad adopts 5 siblings so they can stay together"	"newsgoodnews"
"1"	"Man battling cancer wins $200,000 lottery on his last day of chemotherapy"	"newsgoodnews"
"0"	"Prince Harry Talked to Another Royal About His Desire for Privacy"	"lifestyleroyals"
"0"	"Archie's Photo Album: Prince Harry, Duchess Meghan's Royal Baby"	"lifestyleroyals"
"0"	"Report: Myles Garrett facing lengthy suspension, could be five games"	"football_nfl"
"1"	"'Sons Of Anarchy' Star Ron Perlman Files for Divorce After 38 Years of Marriage"	"tv-celebrity"
"1"	"Dow stock crash 1929: October marks 90 years, and could it fall again?"	"finance-saving-investing"
"1"	"The first thing 14 lottery winners have bought after finding out they were rich"	"personalfinance"
"1"	"Death of 32-Year-Old Mom of 5 and Teacher Leads to 40K Books Being Donated to Kids in Need"	"lifestylemindandsoul"
"0"	"Daring rescue attempt when dog winds up on roof"	"viral"
"0"	"Studies show these are the best and worst states for your retirement"	"finance-retirement"
"0"	"What 40 Celebrities Look Like Without Their Signature Looks"	"lifestylecelebstyle"
"0"	"Debunking the week's tabloid stories: Nov. 15, 2019"	"celebrity"
"0"	"LASIK eye surgery should be taken off market, ex-FDA adviser says"	"health-news"
"0"	"READ: Memo of Trump's first call with Zelensky"	"newspolitics"
"1"	"4-year-old hero jumps in pool to save his little sister from drowning"	"newsgoodnews"
"1"	"Man Pulled From Path Of BART Train Grateful To His Rescuer"	"newsgoodnews"
"0"	"What Not to Miss on the Harry Potter Studio Tour"	"traveltips"
"0"	"What Happens When Your Cruise Has to Rescue Another Ship"	"voices"
"0"	"Dozens of Colorado sheriffs say they won't enforce red flag gun law"	"newsus"
"1"	"Trace Adkins ties the knot in New Orleans"	"music-celebrity"
"1"	"Three takeaways from the Nationals' Game 3 win over Cardinals"	"baseball_mlb"
"0"	"Homeless woman living in SUV with dogs moves into apartment with community's help"	"newsgoodnews"
"0"	"14-year-old baker gives cupcakes to homeless"	"newsgoodnews"
"0"	"Camila Cabello Explains the Sweet Meaning Behind Her First Tattoo"	"music-celebrity"
"1"	"The Sante Fe High School massacre suspect isn't fit to stand trial and will get psychiatric treatment, attorney says"	"newsus"
"0"	"Thieves Steal $40K Worth Of Equipment From Volunteer Fire Station"	"newscrime"
"1"	"I Stopped Eating Dairy, Sugar, and Gluten For 21 Days - Here's What Happened After"	"nutrition"
"0"	"Mustang: all the wild and wonderful offshoots - US edition"	"autosenthusiasts"
"1"	"Property Brothers' J.D. Scott Marries Annalee Belle in Vintage Theatre-Themed Wedding"	"tv-celebrity"
"0"	"Will you get dementia? Many may not understand their risk"	"health-news"
"1"	"Browns' Odell Beckham Jr. said it was his 'dream' to be teammates with Tom Brady"	"football_nfl"
"1"	"'Old Town Road' becomes the second country single to reach top-selling Diamond status"	"musicnews"
"1"	"Johnson & Johnson to recall baby powder for traces of asbestos"	"finance-companies"
"0"	"Whoopi Goldberg Doesn't Stress About The View's Tense Debates"	"more_sports"
"0"	"3 Indiana judges suspended after a night of drinking turned into a White Castle brawl"	"newsus"
"1"	"12 things that could save us money if we weren't lazy"	"finance-savemoney"
"0"	"You can start cooking your pasta in cold water   Alton Brown has been doing it for years"	"tipsandtricks"
"1"	"Lion Air crash report points to Boeing, pilots, maintenance"	"newsworld"
"0"	"Unwanted tourist types: The kinds of travelers becoming more unwelcome"	"travelarticle"
"0"	"How to Watch the Leonid Meteor Shower This Weekend"	"science"
"0"	"Survivor Contestants Missy Byrd and Elizabeth Beisel Apologize For Their Actions"	"tvnews"
"0"	"Alex Rodriguez Jokingly Talks About Marrying Jennifer Lopez During Super Bowl Halftime Show"	"tv-celebrity"
"1"	"30 Best Black Friday Deals from Costco"	"shop-holidays"
"0"	"100+ Street Style Shots to Inspire Your Winter Look (Because You Deserve Better Than a Sweater and Jeans)"	"lifestylefashion"
"1"	"Don't Count Out the Nationals in the World Series Just Yet"	"baseball_mlb"
"1"	"Grey's Recap: Till Death Do Us Part"	"tv-recaps"
"0"	"Model, 23, Didn't Know She Was Pregnant Until She Gave Birth to a Full-Term Baby in Her Bathroom"	"health-news"
"0"	"Washington police announce arrest of 'Potomac River rapist'"	"newscrime"
"0"	"Golfer and girlfriend pull amazing trick shot"	"viral"
"1"	"Country Star Kip Moore Is Ripped And He's Never Used a Trainer"	"fitness"
"1"	"Yardbarker's NFL Week 6 game-by-game analysis, grades"	"football_nfl"
"0"	"Comics - 'Half Full' by Maria Scrivan"	"humor"
"1"	"Why Yankees can have hope with Justin Verlander on mound for Astros in Game 5"	"baseball_mlb"
"1"	"Qantas test flight completes record 19-hour non-stop flight from New York to Sydney"	"travelnews"
"1"	"Here's Exactly What Kristen Bell Eats in a Day to Make 39 Look Like 29"	"nutrition"
"0"	"Myles Garrett is getting suspended. Could he also be charged with a crime?"	"football_nfl"
"0"	"Stars   They're Just Like Us!"	"celebrity"
"0"	"Dow tops 28,000 for first time, capping 4-week win streak"	"markets"
"0"	"Police find 26 children behind false wall at Colorado day care"	"newscrime"
"0"	"Chris Evans' Hilarious Reason Why He Continues Acting"	"video"
"1"	"13 Reasons Why's Christian Navarro Slams Disney for Casting 'the White Guy' in The Little Mermaid"	"movienews"
"1"	"Bride asks her 4 grandmothers to be flower girls"	"newsgoodnews"
"1"	"NBA suspends Suns C Deandre Ayton 25 games for banned substance"	"basketball_nba"
"1"	"Report: Yankees believe Astros were stealing signs by whistling in Game 1 of ALCS"	"baseball_mlb"
"0"	"At NATO summit, Trump to stress US allies' defense spending"	"newsworld"
"0"	"He was a member of a boy band in the 90s. Now he's an ER doctor in Dallas"	"health-news"
"0"	"The 30 best shows of Comedy Central's 30 years"	"humor"
"0"	"Man suspected of fatal shooting said he was man from 'Joker'"	"newscrime"
"1"	"Whitney Way Thore Responds After Trolls Shamed Her for Attempting a Power Snatch"	"wellness"
"0"	"12 Cars Lose Consumer Reports' Recommendation Over Reliability Issues"	"autosnews"
"1"	"Alabama student who called in bomb threat to LSU-Florida game faces up to 20 years in prison"	"football_ncaa"
"1"	"Far-reaching snowstorm may take shape over US"	"weathertopstories"
"1"	"'Go back to work': Outcry over deaths on Amazon's warehouse floor"	"finance-companies"
"1"	"Minnesota School Districts Considering 'Online Snow Days'"	"newsus"
"1"	"Wendy's Is Turning 50 Years Old, And Is Gifting Us With Free Food Through 2020"	"foodnews"
"1"	"Miguel Cervantes' Wife Reveals Daughter, 3, 'Died in My Arms' After Entering Hospice Care"	"tv-celebrity"
"0"	"'National tragedy': Surveillance, staffing under review after deaths at VA hospital"	"newsus"
"1"	"Will the Dolphins go 0-16? Ranking Miami's six best chances to avoid a winless 2019 season"	"football_nfl"
"0"	"Federal Prosecutors Probe Giuliani's Links to Ukrainian Energy Projects"	"newspolitics"
"1"	"Giancarlo Stanton wants Yankees to sign both Gerrit Cole, Stephen Strasburg"	"baseball_mlb"
"0"	"Taylor Swift Rep Hits Back at Big Machine, Claims She's Actually Owed $7.9 Million in Unpaid Royalties"	"musicnews"
"0"	"The Most Stunning Evening Gowns in Miss America History"	"lifestylecelebstyle"
"0"	"How much turkey do you need to buy per person?"	"tipsandtricks"
"0"	"Bill Plaschke: Trout and Bellinger deserve MVPs, but fans deserve more in postseason"	"baseball_mlb"
"1"	"Panera Bread worker fired after TikTok exposed frozen mac and cheese"	"foodnews"
"1"	"Mississippi woman found after being missing for days by writing S.O.S. with rocks"	"newsus"
"0"	"Texas parole board recommends delaying Rodney Reed execution"	"newscrime"
"1"	"Opinion: MLB needs to address Houston Astros' troubling history of toxic behavior"	"baseball_mlb"
"1"	"17 Hallmark Movies That Are Totally Worth Watching"	"tv-gallery"
"1"	"'I Lost 125 Pounds And Now I'm A Bodybuilder'"	"weightloss"
"0"	"California man convicted of torture-murder dies on death row"	"newscrime"
"1"	"Miley Cyrus and Cody Simpson Pack on the PDA as She Helps Him Get Ready for Halloween"	"music-celebrity"
"0"	"Man sets Guinness World Record for highest standing jump"	"viral"
"0"	"How Google Interferes With Its Search Algorithms and Changes Your Results"	"finance-companies"
"0"	"Trump defends Yovanovitch attack: 'I have freedom of speech'"	"newspolitics"
"0"	"Celebrity PDA of 2019"	"celebrity"
"0"	"Ford v Ferrari: the forgotten car at the heart of the Le Mans '66 clash"	"autosenthusiasts"
"0"	"Drug trafficking through Venezuela has skyrocketed, says U.S. military chief"	"newsus"
"1"	"The Jose Cuervo Express Is Hosting A Special Day Of The Dead Train Ride With Tequila Tastings And Live Music"	"cocktails"
"0"	"Koalas face threat from historic brush fires"	"weathertopstories"
"0"	"How to Get Rid of Skin Tags, According to a Dermatologist"	"medical"
"0"	"Selena Gomez Stands Up for Taylor Swift Amid Her Music Battle: 'It's Greed, Manipulation and Power'"	"music-celebrity"
"1"	"Mac Engel: As long as these results are acceptable, Dallas Cowboys will continue to be losers"	"football_nfl"
"0"	"30 Stuffing Recipes That'll Complete Your Thanksgiving Feast"	"recipes"
