"0"	"Under Construction in Texas: The First New Section of Border Wall"	"newsus"	"DONNA, Texas   Two giant construction cranes tower over harvested sugar cane fields, topped by a pair of checkered flags flapping in the wind. At a distance along this flat, rural stretch of the Rio Grande Valley in South Texas, the two structures standing between the cranes resemble forlorn drive-in movie screens. The twin panels of 18-foot-tall steel beams do not look like much   the only signs indicating it is a construction site warn "Road...""
"1"	"16 Secrets Olive Garden Doesn't Want You to Know"	"restaurantsandnews"	"Here's everything you've wanted to know about your favorite breadstick-serving restaurant."
"1"	"The Strangest Things You Can Buy at Walmart"	"shop-apparel"	"We found the weirdest, wackiest, and most scratch-your-head-confusing items residing in the aisles of Walmart. Check 'em out! The post 24 Strangest Things You Can Buy at Walmart appeared first on Reader's Digest."
"0"	"Fear spreads among Iraqi protesters as government cracks down, keeps death toll secret"	"newsworld"	"Crowds have begun to shrink in the face of violence, arrests and threats."
"0"	"Scarlett Johansson Regrets Being "Hyper-Sexualized" Early in Her Career"	"movienews"	"Johansson joined Jennifer Lopez, Renée Zellweger, Lupita Nyong'o, Laura Dern and Awkwafina for the Oscar Actress Roundtable."
"0"	"PEOPLE's Sexiest Men Alive: Still Sexy After All These Years"	"celebrity"	"PEOPLE's Sexiest Men Alive With Their Younger Selves"
"0"	"Lung cancer symptoms all women should keep on their radar"	"medical"	"Just because you're not a smoker, doesn't mean you're immune."
"1"	"The healthiest fast food option at every well-known chain"	"restaurantsandnews"	"Did you know a White Castle Original Slider has fewer calories than a chocolate milkshake? We all crave fast food every now and again, but some menu options are undeniably healthier than others. Here we look at every major fast food chain and point out the surprising main meal menu items that will help you cut the calories."
"1"	"5 Ways Cruise Lines Are Becoming More Environmentally Friendly"	"travelnews"	"Industry considers impact as it looks to the future."
"1"	"Fire Ants and Spiders Inspire Metal That Can't Sink"	"science"	"Scientists have looked to nature for inspiration on a new water repellent metal that could be used to create unsinkable ships, flotation devices, and long-lasting electronic monitoring devices in oceans."
"0"	"Porsche launches into second story of New Jersey building, killing 2"	"newsus"	"The Porsche went airborne off a median in Toms River, causing it to crash into a red brick building."
"0"	"US, South Korea could scale back joint drills: Esper"	"newsworld"	"US military exercises with South Korea could be scaled back to aid diplomacy with the nuclear-armed North, Defense Secretary Mark Esper said on his way to Seoul, as Pyongyang said it was running out of patience. Seoul and Tokyo are both major US allies, democracies and market economies faced with an overbearing China and nuclear-armed North Korea."
"0"	"The History Behind Your Favorite Thanksgiving Foods"	"foodnews"	"You'll never believe which foods aren't even native to America."
"1"	"Elderly woman defends her right to drink"	"advice"	"Dear Amy: I'm 88 years old. I live alone and am independent. Can family members restrict an 88- year-old widowed mother's wine consumption, just because a doctor says it might cause a liver problem some day?"
"0"	"Three school workers charged in death of special needs student"	"newscrime"	"The student was reportedly restrained face-down for nearly an hour before becoming unresponsive"
"0"	"A US cargo ship carrying 1,400 tonnes of TNT that sank at the end of the River Thames in 1944 is posing a threat to London from its salty grave"	"newsworld"	"75 years ago the SS Richard Montgomery went down at the end of the River Thames with 1,400 tonnes of TNT onboard. Its payload is becoming unstable."
"0"	"Trump says he's not watching impeachment hearing   then critiques it"	"newspolitics"	"President Donald Trump on Wednesday dismissed the House's impeachment proceedings as a "hoax" and said he was "too busy to watch"   and then blasted Democrats' choice of questioners at a hearing he said he hadn't been briefed on."
"0"	"Kristen Stewart is planning to propose to her girlfriend, plus more celeb love life news for early November 2019"	"celebrity"	"Keanu Reeves and girlfriend go public, Kylie Jenner's relationship with Drake turns romantic, Reba McEntire, Nina Dobrev and Ian Ziering end relationships."
"0"	"Donald Trump Jr slams The View Host Sunny Hostin by asking what it's like to be paid by a network that 'protected pedophile - rapist Jeffrey Epstein' in war of words on Twitter"	"tvnews"	"Donald Trump Jr continued his war of words with The View host Sunny Hostin after his appearance on the show this week where he was criticized for naming the Ukrainian whistle-blower."
"0"	"How Republican Defenses of Trump on Impeachment Have Shifted Over Time"	"newspolitics"	"Democrats paint the changing defense as evidence of its weakness. Republicans attribute it to another source: disorganization"
"1"	"12 Tons of Pizza Toppings Recalled Over Listeria Contamination Fears"	"health-news"	"The USDA released a class I notice after samples of affected products tested positive for a potentially deadly bacteria."
"0"	"Protesters blockade universities, business district as chaos grips Hong Kong"	"newsworld"	"Protesters blockade universities, business district as chaos grips Hong Kong"
"0"	"97-year-old WWII veteran takes ride in B-17 bomber for Veteran's Day"	"newsus"	"A World War II veteran celebrated Veteran's Day by taking a flight to yesterday -- in an aircraft that first saw combat at the time of his service."
"1"	"America's Most and Least Popular Senators"	"newspolitics"	"Senators represent the interests of the residents of their home state on Capitol Hill by crafting and voting on new laws and by approving or rejecting cabinet and judicial nominations made by the president."
"1"	"Southwest Airlines evacuates Chicago flight after blown tires: reports"	"travelnews"	"Southwest Airlines evacuated a flight Monday morning at Chicago's Midway International Airport, blaming a hydraulic issue with the landing gear."
"1"	"Hurricane-like storm in the Mediterranean threatens Egypt, Israel"	"weathertopstories"	"Egypt and Israel are preparing for the onset of heavy rains and strong winds as a rare "medicane" barrels toward them."
"1"	"Road built by biblical villain uncovered in Jerusalem"	"travelnews"	"A long-buried street that led pilgrims to the Jewish Temple 2,000 years ago was commissioned by Roman governor Pontius Pilate."
"0"	"LeBron James becomes first Lakers to get 4 triple-double in 1st 10 games"	"basketball_nba"	"LeBron James made more franchise history for the Los Angeles Lakers even in their first loss in eight games."
"1"	"18 things to avoid at the dollar store"	"finance-savemoney"	"Some dollar-store items, such as toys and power cords, just aren't worth buying despite their super-cheap prices   maybe because they'll break, run out faster than expected, risk the health and safety of a loved one, or just disappoint you after the effort of going to a store and cruising aisles expecting quality."
"1"	"Two Columbus statues vandalized on Columbus Day"	"newsus"	"The statue in San Francisco was doused in red paint with a sign that read, "Destroy all monuments of genocide and kill all colonizers.""
"0"	"We made a 3-course feast using Chrissy Teigen's recipes, and had the best homemade pizza we've ever tasted"	"foodnews"	"We recreated three recipes from Chrissy Teigen's new website, Cravings By Chrissy Teigen, to see if they lived up to the hype."
"0"	"4 injured in shooting at adult club in Kansas City, Missouri"	"newscrime"	"Authorities are investigating a shooting outside an adult entertainment club in northeast Kansas City, Missouri, that left four people injured. The Kansas City Star reports the shooting outside Baccala's strip club happened around 2:40 a.m. Sunday. Kansas City, Missouri, police say one victim was found in front of the club."
"0"	"How to prevent the flu, according to doctors"	"medical"	"Your best line of defense against the flu this season is to get vaccinated."
"0"	"AP sources: Deval Patrick mulling Democratic White House run"	"elections-2020-us"	"Former Massachusetts Gov. Deval Patrick is considering making a late run for the Democratic presidential nomination, according to two people with knowledge of his deliberations, underscoring some Democrats' deep uncertainty about the party's current crop of contenders."
"0"	"Analysis: Only 3 Senate Republicans aren't defending Trump from the impeachment inquiry. Here's why."	"newspolitics"	"Mitt Romney, Susan Collins and Lisa Murkowski have refused to sign a resolution denouncing the House Democratic effort."
"1"	"Hawk Can't Understand Why This Little 'Bunny' Isn't Scared Of Him"	"lifestylebuzz"	"This fearsome bird of prey has clearly never met a bunny nearly as brave as this one."
"0"	"9 Vegetables You Shouldn't Eat Raw"	"nutrition"	"Are raw foods healthier than cooked foods?"
"1"	"50 Shelter Dogs That Need Homes Before 2020"	"lifestylepetsanimals"	"These adorable dogs are looking for their forever families. Welcome one of them into your home before the new year for lots of love and licks. The post 50 Shelter Dogs That Need Homes Before 2020 appeared first on Reader's Digest."
"1"	"Anheuser-Busch accuses MillerCoors of stealing recipes"	"finance-companies"	"In a heavily redacted court filing Thursday, Anheuser-Busch claims MillerCoors illegally obtained the recipes through one of its employees, who used to work for Anheuser-Busch."
"0"	"Saquon Barkley refusing to be shut down for season despite injuries"	"football_nfl"	"Barkley was held to a career-worst one yard on 13 carries in Sunday's loss to the New York Jets."
"0"	"Best Dive Bar in Every State"	"beverages"	"The real challenge in compiling a list of America's best dive bars comes in defining just what a dive bar is and isn't."
"0"	"Pregnant 'Little People, Big World' star Tori Roloff slams body-shaming trolls"	"tv-celebrity"	"Tori Roloff calls hateful messages "disgusting" and "detrimental""
"1"	"Mid-Engine C8 Corvette Production Postponed Until February 2020"	"autosnews"	"The car was supposed to be hitting dealers by the end of 2019. That's no longer happening."
"0"	"Sears is laying off hundreds of corporate employees after announcing 96 store closings"	"finance-companies"	"Sears gathered employees in a room at a San Francisco office on Wednesday and told them all that they would lose their jobs, according to a source."
"1"	"14 Weird Rules Fast-Food Employees Have to Follow"	"restaurantsandnews"	"Fast food may seem easy, but there are quite a few intricate rules employees have to follow."
"0"	"A body-language expert says Meghan Markle is "politely disconnecting" from the public, and honestly, we would too"	"lifestyleroyals"	"Can we blame her? Meghan Markle is supposedly "politely disconnecting" from the public as seen in her body language, and girl, you do you."
"0"	"49ers' Jaquiski Tartt rips ball from Seattle's D.K. Metcalf on amazing play"	"football_nfl"	"D.K. Metcalf is a big, strong dude. We know that from all the viral pictures of his physique before the Seattle Seahawks drafted him earlier this year."
"0"	"10 Common Causes of Itchy, Red Bumps and Skin Rashes"	"medical"	"If they last for over two weeks, or they go away and come back, it's a good idea to visit your dermatologist."
"0"	"Jane Fonda Opens Up About the Possibility of Spending Her 82nd Birthday in Jail"	"movies-celebrity"	"The actress and activist has been protesting in Washington D.C. every Friday, in the name of spreading awareness about climate change."
"0"	"Clemson routs NC State, claims ACC Atlantic title"	"football_ncaa_videos"	"Clemson vs. NC State: For the fifth consecutive year, the Clemson Tigers have won the ACC Atlantic Division and will head to the ACC Championship game."
"0"	"Eerie photos of an abandoned airport that hasn't been touched in 25 years"	"newsphotos"	"The airport in Abkhazia   a disputed region of Georgia   was built in the 1960s, but was abandoned after a violent war in the early 1900s."
"1"	"Halloween storm to dump 1st snow of season in parts of Midwest"	"weathertopstories"	"After a brief clip of wintry weather races through the central Plains and western Great Lakes to start the week, a much larger and more impactful winterlike storm will close out October."
"1"	"7 chefs revealed their favorite jarred pasta sauces"	"tipsandtricks"	"Though they prefer the homemade stuff, we asked chefs what they like to toss pasta in when they don't have time to cook."
"0"	"The 50 best burritos in America"	"restaurantsandnews"	"The best burritos in America are well-constructed, made with fresh ingredients, and have becomed beloved in their home towns."
"0"	"Why This Couple Is Getting a 'Sleep Divorce'"	"lifestylevideo"	"A New Jersey couple is getting an unusual "divorce." Liz and Rich Alterman have been happily married for almost 20 years. They have three children and are now on the brink of getting "sleep divorced.""
"0"	"Kendall Jenner Wore the Tiniest Dress to Go Jewelry Shopping"	"lifestylebuzz"	"No fall layers to see here."
"1"	"Thieves break into French cathedral using tree trunk strapped to car"	"newsworld"	"Thieves used a tree trunk strapped to a car to smash the door of a cathedral in the South of France"
"0"	"Five questions the second College Football Playoff rankings will answer"	"football_ncaa"	"The second College Football Playoff rankings will answer five key questions Thursday after a big weekend that saw several changes to the Lan"
"1"	"California's legal weed profits going up in smoke"	"markets"	"Nearly three years after California legalized marijuana, the profit outlook for this budding business looks cloudy."
"0"	"18 Quiet Dogs That Don't Bark (Too Much)"	"lifestylepetsanimals"	"Looking for a dog that keeps its bark on the down-low? Animal behaviorists say these quiet breeds could be a perfect match. The post 18 Quiet Dogs That Don't Bark (Too Much) appeared first on Reader's Digest."
"0"	"The flu vaccine is not 100% effective but you should still get it every year"	"medical"	"The flu vaccine is usually 40% to 60% effective, but some years it can be as low as 20% effective. It's still your best defense against the flu."
"0"	"Highways on Fire. Semesters Cut Short. A Recession. Can Hong Kong Heal?"	"newsworld"	"HONG KONG   Storefronts closed for weekend demonstrations are now shuttered, for weeks or even permanently. Protesters are occupying major roads, rail tracks, bridges and tunnels, cutting off critical thoroughfares for commuters and commerce on a daily basis. Universities are telling students not to come back for the rest of the semester. Nearly six months into the antigovernment protests, life in Hong Kong has dramatically changed, pushing the..."
"0"	"Meteor streaks through the sky over St. Louis"	"weathertopstories"	"Hundreds reported seeing a bright flash of light across the sky in at least two counties"
"0"	"EXTRA SHARP: One-Bowl Peanut Butter Cookies"	"videos"	"These peanut butter-packed cookies with crisp edges and chewy centers are sure to be your new go-to."
"0"	"11 Symptoms of Shingles You Might Be Ignoring"	"medical"	"Symptoms of shingles sometimes, but not always, include a painful rash caused by a reactivation of the chicken pox virus. Here are other signs."
"0"	"The one reason to claim Social Security at 62 that no one ever talks about"	"finance-retirement"	"Should you claim early if you don't really need the money? Maybe yes."
"1"	"U.S. bill would provide Puerto Rico a path to statehood"	"newsus"	"U.S. bill would provide Puerto Rico a path to statehood"
"0"	"Top Putin aide named by MH17 airliner investigators"	"newsworld"	"An international investigation into the 2014 downing of Malaysia Airlines flight MH17 on Thursday released a series of phone intercepts, including one between a top aide to Russian President Vladimir Putin and pro-Russian rebels accused in the crash."
"0"	"Martha Stewart shares the family favorites she serves during the holidays, including adding cream cheese to her mashed potatoes"	"foodnews"	"Martha Stewart swears by family recipes for Thanksgiving, Christmas, and Hanukkah dishes   from potato pancakes to mashed potatoes."
"1"	"Why You Shouldn't Ever Go for the Cheapest Brake Pads"	"autosbuying"	"Brakes are the most important part of your car. Here's why you shouldn't cut costs on them."
"1"	"Police warn against THC-laced Halloween candy"	"newsus"	"Police in Pennsylvania are urging parents to be extra cautious with their Halloween candy this year."
"0"	"Prince Harry and Meghan Markle just shared a never-before-seen photo of baby Archie with his 'Grandpa' Prince Charles to celebrate his birthday"	"lifestyleroyals"	"The Duke and Duchess of Sussex shared a new photo of Archie, Harry, and Charles to mark the Prince of Wales' 71st birthday on Thursday."
"0"	"Jamie Dimon: The '60 Minutes' interview"	"finance-companies"	"The chairman and CEO of JPMorgan Chase tells Lesley Stahl he's optimistic about the economy and explains why he's not running for president"
"0"	"Red and Blue Economies Are Heading in Sharply Different Directions"	"markets"	"At a quick glance, red and blue metropolitan areas are performing equally well on average in the most watched indicators of labor market health. Employment growth in the year ending in the first quarter of 2019 was 1.4 percent in both Democratic-leaning and Republican-leaning metro areas, and the unemployment rate in both types of places is roughly equivalent. Silicon Valley (blue) is booming. So is Provo, Utah (red). But below the surface, red..."
"0"	"Roommate, her boyfriend charged in death of missing Atlanta student"	"newscrime"	"Missing Atlanta student Alexis Crawford was found dead."
"0"	"Atlanta college student Alexis Crawford was choked to death, dumped in park, police say"	"newscrime"	"Authorities say Alexis Crawford and her roommate Jordyn Jones had a physical altercation and Jones' boyfriend intervened and choked Crawford to death."
"0"	"2019 CMA Awards: See all the photos from the red carpet"	"cma-awards"	"2019 CMA Awards: See all the photos from the red carpet"
"0"	"Fast food cashier and manager fired for refusing to serve police officer"	"newsus"	"Two fast food employees have been fired after one of them refused to serve a police officer who wanted to order food from the establishment."
"0"	"2021 Kia Optima Raises the Style Bar for Mid-Size Sedans"	"autosmidsize"	"The new Optima looks as good as we'd hoped given the promising teaser photos."
"0"	"Tom Brady's trainer hints at how long QB intends to keep playing"	"football_nfl"	"Tom Brady continues to defy Father Time, but the end of his career has to come at some point, right?"
"0"	"Harry and Meghan Revive Feud Rumors By Staying Away From the Royal Family's Christmas"	"lifestyleroyals"	"So, what are you doing for Christmas?"
"0"	"Uighur researchers say China running hundreds more camps"	"newsworld"	"Uighur activists said Tuesday they have documented nearly 500 camps and prisons run by China to detain the ethnic group, alleging that China could be holding far more than the commonly cited figure of one million people. Rights advocates have generally estimated that China is detaining more than one million Uighurs and members of other predominantly Muslim Turkic ethnicities."
"1"	"25 of the Most Haunted Places in America"	"traveltripideas"	"Get ready for goosebumps!"
"0"	"Amazon will be opening a new grocery store, and it's not Whole Foods"	"finance-companies"	"Months after reports surfaced that Amazon would be opening a new set of supermarkets , the company says it will open a new grocery in Los Angeles."
"0"	"Chipotle Says It Will Keep Serving Carne Asada into Early 2020, Fans Rejoice"	"foodnews"	"Chipotle announced that their latest menu addition, carne asada steak, would stick around, and people are rejoicing on social."
"1"	"6 Silent Symptoms of Colon Cancer You Might Be Missing"	"medical"	"Nearly 140,000 people are diagnosed with colorectal cancer in America."
"0"	"Hall of Fame catcher Mike Piazza agrees to manage Team Italy"	"baseball_mlb"	"Baseball Hall of Fame catcher Mike Piazza, a 12-time All-Star, will manage Italian national baseball team for its upcoming international tournaments."
"0"	"Meghan Markle Says That Archie Has Two Teeth and Is Crawling"	"lifestyleroyals"	"The cutest? Or the cutest ever?"
"0"	"I Was A Psychic Phone Line Operator. Here's What Really Happened Behind The Scenes."	"voices"	"A phone psychic reveals the behind-the-scenes of the job."
"0"	"Bolivians jam streets to celebrate president's resignation"	"newsworld"	"Jubilant crowds packed the streets of La Paz Sunday to celebrate the abrupt resignation of Bolivian President Evo Morales, Latin America's longest serving leader, after weeks of protest over his disputed re-election. "THIS is my only flag," shouted a young masked man in a white helmet, waving the Bolivia's red, yellow and green emblem."
"1"	"Miguel Cervantes' Wife Reveals Daughter, 3, 'Died in My Arms' After Entering Hospice Care"	"tv-celebrity"	"Miguel Cervantes' Wife Reveals Daughter 'Died in My Arms' After Hospice Care"
"0"	"Robyn Crawford Says She Felt Like She Was 'Losing' Whitney Houston When Singer Married Bobby Brown"	"music-celebrity"	"The late Whitney Houston's longtime friend, Robyn Crawford, is opening up about the complicated relationship she had with Bobby Brown."
"0"	"Winds fan ferocious fires in Australia's most populous state"	"weathertopstories"	"Ferocious wildfires were burning at emergency-level intensity across Australia's most populous state and into Sydney's suburbs on Tuesday as authorities warned most people in their paths that there was no longer time to flee."
"0"	"Ask Mr. Dad: Your child is a brat … and it's your fault"	"advice"	"Dear Mr. Dad: I'm a single dad with a 9-year-old daughter who's with me half the time. Before the divorce, she was a sweet kid and a pleasure to be around. But lately she's become a terror, throwing tantrums when she doesn't get what she wants - and I think it's because her mother is spoiling her. How do I deal with her? And what can I say to her mom to get this behavior to stop? A: As you ..."
"0"	"Trump urges Iran to release ex-FBI agent Levinson"	"newsworld"	"President Trump took to Twitter late Sunday to urge Iran to release the retired FBI agent who had been missing in the country since 2007 and said it would be a very positive step toward easing tensions between the two countries since provocations on the Strait of Hormuz."
"0"	"WH plans "aggressive" strategy for open impeachment hearings"	"newspolitics"	"Staff will be set up to "react in real time" with a "rapid response.""
"0"	"With Medical Bills Skyrocketing, More Hospitals Are Suing for Payment"	"finance-healthcare"	"WISE, Va.   When a judge hears civil cases at the courthouse in this southwest Virginia town two days a month, many of the lawsuits have a common plaintiff: the local hospital, Ballad Health, suing patients over unpaid medical bills. On a Thursday in August, 102 of the 160 cases on the docket were brought by Ballad."
"0"	"In Divided Hong Kong, Apps Help to Avoid Eating With the Enemy"	"newsworld"	"In a city split by months of protests, consumers now have a way to identify which businesses appear to share their views, putting shops on alert and offering Hongkongers a way to show their colors."
"0"	"Relieving the Stigma of Epilepsy"	"medical"	"Epilepsy-related stigma stems from misunderstanding the medical facts."
"0"	"25 Biggest Grocery Store Mistakes Making You Gain Weight"	"nutrition"	"From picking up free goodies to navigating the wrong aisles, these grocery shopping mistakes could be one of the sneaky reasons you're gaining weight."
"0"	"Hey, Millennials, look out below! Gen Z may already be catching up in the salary race"	"finance-career"	"Gen Zers are closing the pay gap with millennials even though they have far less experience. They're making the most of a tight labor market."
"0"	"The 50 cheapest places to buy land in America"	"finance-real-estate"	"Find out where you can get parcels of land for $10,000 or less."
"1"	"If You Don't Eat a Banana Every Day, This Might Convince You to Start"	"nutrition"	"An apple a day keeps the doctor away? Not so much. Try this fruit, instead."
"0"	"Moby gets another shocking animal rights tattoo"	"music-celebrity"	"Moby is showing off another new animal rights tattoo, and it's as startling as the first."
"1"	"Nationwide recall of Xanax due to possible 'foreign substance'"	"health-news"	"Drugmaker Mylan cites risk of infection posed by unnamed material in popular anti-anxiety prescription drug."
"1"	"What Happens If Your Oxygen Mask Doesn't Inflate on a Flight?"	"traveltips"	"Ever wondered what happens if your oxygen mask doesn't inflate during an in-flight emergency? Here's what you need to know."
"0"	"New Report Exposes Dolphin Cruelty in Travel Industry"	"travelnews"	"Behind the Smile says unsuspecting tourists are fueling a multibillion-dollar industry while travel companies reap the rewards."
"0"	"The Volkspod VW Beetle Minibikes Are Part Creepy, Part Adorable"	"autosmotorcycles"	"The people's pods."
"0"	"Is it really easier for men to lose weight? Experts explain"	"weightloss"	"There are reasons men and women lose weight differently   and it starts with puberty."
"1"	"I visited the new American Dream megamall on its opening day and it was eerily empty"	"travelnews"	"The American Dream megamall opened to the public last week. Here's what to expect from one of the largest malls in the US."
