"1"	"Iowa paid a security firm to break into a courthouse, then arrested employees when they succeeded"	"newsus"	"A pair of security workers at a prominent cybersecurity company were contracted by the state of Iowa to conduct "penetration tests" of certain municipal buildings in September, particularly courthouses."
"0"	"One of America's biggest solar panel makers quits manufacturing"	"finance-companies"	"SunPower Corp., one of America's largest solar-panel makers, is giving up its manufacturing business to focus on installing rooftop solar systems."
"0"	"At donor dinner, Giuliani associate said he discussed Ukraine with Trump, according to people familiar with his account"	"newspolitics"	"After Lev Parnas and Igor Fruman told the president that they thought the U.S. ambassador to Ukraine was unfriendly to him, Trump immediately suggested firing her, people familiar with Parnas's account said."
"0"	"What Happens To Your Brain And Body When You're Stressed About Money"	"personalfinance"	"Americans are stressed out. And, in many cases, money is the top cause of that stress."
"0"	"'At 237 Lbs., I Was Embarrassed To Go To The Gym. So I Did An At-Home BeachBody Program And Lost 117 Lbs.'"	"voices"	""I wanted to be me again.""
"0"	"Christmas tree decorating ideas for every style and budget"	"lifestylehomeandgarden"	"Whether you love creating a traditional show-stopper or prefer to keep it country, we've got a Christmas tree decorating idea that will make yours stand out from the festive crowd."
"0"	"UN urges Lebanon to build gov't of "competence", banks close"	"newsworld"	"The United Nations urged Lebanon on Tuesday to form a competent new government better able to seek international aid after weeks of protests against the ruling elite, warning the country was in a critical financial and economic situation."
"0"	"Whoopi Goldberg Addresses 'The View' Tension: 'If We Were Fighting, You'd Actually Know It'"	"tvnews"	"The co-host is assuring fans that it's all good between her and the other ladies on the show."
"0"	"Celebrity Engagements of 2019"	"celebrity"	"Love is abloom in 2019! Stars such as Tim Tebow, who is set to wed former Miss Universe Demi-Leigh Nel-Peters, and Hamilton's Anthony Ramos will soon be walking down the aisle after popping the question to their respective loved ones. Scroll through to see who else is put a ring on it this year and get the story behind their sweet proposals."
"0"	"15 mouthwatering photos of stylish restaurants around the world"	"restaurantsandnews"	"Here's a look inside some of the world's most colorful, impeccably designed eateries that will inspire your next trip."
"0"	"The Disney+ 'Lady and the Tramp' remake: A guide to the new cast members"	"movies-gallery"	"Learn more about the stars of the Disney+ live-action remake."
"0"	"The best burger and fries joint in your state"	"restaurantsandnews"	"There can't be any meal quite as satisfying as a juicy burger and crispy, fresh fries. But where can you find the best? We've chosen the top burger and fries joints in every single state to help make sure your next order is absolutely delicious."
"0"	"Three Classic Cars Stolen From CA Car Show"	"autosclassics"	"A crowded car show is the last place you'd expect classic cars to be stolen."
"1"	"I went to Peter Luger after it received zero stars from New York Times"	"restaurantsandnews"	"The burger was so juicy I had to wipe my fingers after every bite. And everyone from regulars to tourists couldn't stop singing Peter Luger's praises."
"0"	"Marie Osmond 'chipped off a piece' of her kneecap when she fell on stage during performance"	"tv-celebrity"	"Marie Osmond reveals that she chipped her knee when she fell during her Las Vegas residency performance last week."
"0"	"60+ Restaurants Where Veterans Eat for Free on Veterans Day This Year"	"personalfinance"	"Active military and veterans can score free donuts, burgers, pizza and more with their military ID."
"0"	"Why You Should Cook Turkey Breast This Year, Not the Whole Bird."	"tipsandtricks"	"Instead of wrestling a massive 25-pound bird into your oven, we propose that you roast a turkey breast instead. Yes, just the breast. Here's why (and how to do it)."
"0"	"What It Was Like Inside the Homes of the Pilgrims"	"lifestylehomeandgarden"	"There's a lot of folklore surrounding the first Thanksgiving, and plenty of lively debate. When did it actually occur? Was this meeting with the Wampanoags truly amicable? Did they really eat turkey? Despite, or perhaps because of, this murky history, we continue to be fascinated with the Pilgrims and life in 17th-century America. While we all learned about the Mayflower, the Pilgrims, and that first Thanksgiving way back in elementary school, what do we really know about the day-to-day lives of these English settlers? Here are a few things that may surprise you about home life in early America."
"0"	"Here's the Very Best of Oprah's Favorite Things"	"shop-holidays"	"This holiday season, we're thankful for Oprah."
"0"	"This Thanksgiving, We're Tearing Our Potatoes Instead of Cutting Them"	"tipsandtricks"	"Torn edges capture more flavor."
"1"	"The son of a Chinese billionaire has been banned from flying first class, playing golf, buying property, or going clubbing"	"newsworld"	"Wang Sicong, the heir of Chinese real estate mogul Wang Jianlin's estimated $12.5 billion fortune, is said to have a personal debt of $21.6 million."
"1"	"25 Stars You Didn't Know Got Their Start in Commercials"	"tv-gallery"	"Most stars have to pay their dues before hitting the big leagues. Find out which A-listers got their start in ads for Burger King, Lisa Frank, and more!"
"0"	"Everyday heroes step up to help lone Waffle House employee"	"restaurantsandnews"	"Sometimes you just have to be the change you wish to see in a Waffle House."
"0"	"Astros' Verlander, Mets' deGrom win 2nd Cy Young Awards"	"baseball_mlb"	"Astros' Verlander, Mets' deGrom win 2nd Cy Young Awards"
"0"	"Prince Charles just turned 71   here are the best photos from every year of his royal career so far"	"lifestyleroyals"	"Prince Charles, heir to the throne, celebrates his 71st birthday on Thursday. Here are all the best photos from every year of his career."
"1"	"South Florida principal who made controversial comments about the Holocaust is fired"	"newsus"	"The South Florida principal who stirred national controversy after refusing to say the Holocaust was a "factual, historical event" was fired Wednesday during a school board meeting at the recommendation of the district's superintendent."
"0"	"Here Are the Biggest Deals We're Anticipating for Black Friday"	"shop-holidays"	"The Black Friday deals for 2019 have already begun leaking out. Get a sneak peek at what to expect from popular retailers like Costco, Walmart, and Best Buy. Browse our guide and use it to plan your attack for the biggest shopping event of the year."
"0"	"Watch Kelly Clarkson's Kids Interview Their Hero Jason Momoa In The Cutest Video Ever"	"entertainment-celebrity"	"Kelly Clarkson's kids were in for a huge treat on Wednesday's The Kelly Clarkson Show when they got to meet their icon, Jason Momoa. Watch their adorable interview with Aquaman himself below."
"0"	"What to Cook This Week (November 11 to November 17)"	"recipes"	"This week, let's keep dinner simple: Delicious mainstays like chicken and pasta that make use of tons of pantry ingredients."
"0"	"Simple Solutions to Help You Get Rid of Ants for Good"	"lifestylehomeandgarden"	"Kick pesky ants out of your house and back to their colony with these easy, expert-approved tricks."
"0"	"10 Gazans dead as Israel hit on militant chief sparks rocket barrage"	"newsworld"	"Israel's military killed a commander from Palestinian militant group Islamic Jihad in a strike on his home in the Gaza Strip on Tuesday, triggering exchanges of fire in a violent escalation that left another nine Gazans dead. Islamic Jihad is the second most-powerful militant group in the Gaza Strip after Hamas."
"0"	"Deer-like animal thought lost to science photographed for first time in 30 years"	"newsworld"	"Scientists had thought the silver-backed chevrotain, which had been among a list of 25 "most wanted" lost species compiled by Global Wildlife Conservation (GWC), had fallen victim to habitat loss and intensive hunting."
"0"	"Predicting the College Football Rankings for Week 12: Minnesota Climbs, Penn State Drops"	"football_ncaa"	"Here's what we predict the College Football Playoff rankings will look like in Week 12. The post Predicting the College Football Rankings for Week 12: Minnesota Climbs, Penn State Drops appeared first on Stadium."
"0"	"I Have Smiling Depression This Is What It Feels Like"	"voices"	""I function but do not feel. My face says I'm happy, but inside I want to cry.""
"0"	"Mixed-race mother reveals strangers question whether she's related to her fair-skinned daughter - including a suspicious church-goer who asked the girl: 'Is this your Mummy?'"	"lifestylebuzz"	"Davina Moon, 32, from Surrey, who has a mixed heritage including Sri Lanka and Ireland, told how society often treats her differently because she doesn't look like her children."
"1"	"Small cans lead to big sales for Coca-Cola"	"finance-companies"	"Good things came in small sizes for Coca-Cola last quarter. The company reported sales that topped forecasts, thanks in part to a double-digit increase in volume for its 7.5-ounce mini cans."
"0"	"The cost to become a US citizen is going up 61 percent"	"markets"	"Critics call the proposed $1,170 application cost "an unprecedented weaponization of government fees.""
"0"	"How to Make Your Green Bean Casserole More Gourmet"	"tipsandtricks"	"Is there a more controversial Thanksgiving side dish than the green bean casserole? Midwesterners, who love themselves a hotplate, say it's the perfect comfort food green beans gussied up with cream of mushroom soup while detractors would gladly leave it at the other end of the table (right next to the canned cranberry sauce). Even if you think you don't like it, you might change your mind when you try a fresh green bean casserole recipe made..."
"0"	"Kodak Black Sentenced to Over 3 Years in Prison in Weapons Case"	"music-celebrity"	"Rapper Kodak Black has been sentenced to more than three years in federal prison after pleading guilty to weapons charges stemming from his arrest just before a scheduled concert performance in May."
"0"	"Five games in Week 11 that will impact the College Football Playoff race"	"football_ncaa"	"Week 11 has intriguing games that will impact the College Football Playoff, led by Alabama-LSU, plus Big Ten clash between Penn State and Minnesota."
"0"	"The best independent bakery in every state"	"restaurantsandnews"	"When you want the best bread, the flakiest pastries and comforting cream cakes it's time to turn to the experts   and an independent, local bakery is sure to hit the spot. Here is our favorite in every state for tempting treats you wouldn't dare to make at home."
"0"	"Weird And Wild Photos From The Lone Star Motorcycle Rally"	"autosmotorcycles"	"20 photos of the crazy motorcycles, costumes, and attendees from the rally in Galveston, Texas."
"1"	"American Airlines cabin crew fear return of Boeing 737 Max"	"travelnews"	"Lori Bassani, who leads the Association of Professional Flight Attendants, wrote to Boeing CEO Dennis Muilenburg about the ongoing 737 Max crisis."
"1"	"Meet Bobe, the other dog at the Baghdadi raid"	"newsworld"	"Conan, the heroic dog who helped chase down ISIS leader Abu Bakr al-Baghdadi, wasn't the only canine forever changed by the US operation outside Idlib, Syria, last weekend."
"0"	"Is the Alabama Football Dynasty Ending?"	"football_ncaa_videos"	"Is the Alabama football dynasty ending? Max Browne joins the show to discuss some of the signs the Crimson Tide are slowing down."
"1"	"Mexican ex-border state governor extradited to US"	"newscrime"	"MEXICO CITY (AP)   Mexico says it has extradited a former governor of the border state of Coahuila to face money-laundering and fraud charges in South Texas."
"0"	"Starbucks' Holiday Cups Are Back and They're Very 'Merry'   See the 4 New Designs"	"restaurantsandnews"	"Starbucks Holiday Cups Return in 4 New Designs"
"1"	"Stop! Read This Guide Before You Buy an Air Fryer."	"tipsandtricks"	"Shopping for air fryers? Or maybe air fryer toaster ovens? Our air fryer buying guide will help you find the perfect appliance for your needs."
"0"	"Family told to take down Christmas display because it's too soon to decorate"	"lifestylebuzz"	"A Texas couple was told by their homeowners association to pump the brakes on their Christmas cheer."
"0"	"The best mac and cheese in every state"	"foodnews"	"Whether you're looking for a heap of truffle-infused macaroni or a reliable side dish, here are Yelp's best mac-and-cheese spots in each state."
"0"	"PG&E is offering $13.5 billion in compensation to wildfire victims"	"finance-companies"	"Bankrupt utility giant PG&E Corp. is offering $13.5 billion in compensation to the victims of wildfires sparked by its power lines as part of a restructuring plan, according to people with knowledge of the situation."
"0"	"31 Dumb Things That Are Keeping You From Becoming Wealthy"	"personalfinance"	"These small financial mistakes chip away at your wealth."
"0"	"My Third Husband Is 102 Years Old. Here's What Our Marriage Is Like."	"voices"	"When I was 65 years old, I married a man 25 years my senior. This was thethird marriage for both of us, and he was almost 90. Mutual friends introducedus ― his best friend was married to my best friend ― because we were bothwidows, and apparently I needed more of a social life.It started out innocently as two friends hanging out. He liked to take me outto fancy Los Angeles restaurants. He had his handyman fix everything for me,and he brought his..."
"1"	"What's on the ballot across the country on Tuesday"	"newspolitics"	"Voters head to the polls across the country on Tuesday to decide a host of critical elections that will shape social and fiscal policy - and offer an early hint about the state of the electorate a year before the 2020 presidential election."
"0"	"Tristan Thompson Gushes Over Ex Khloe Kardashian After Her People's Choice Win"	"tv-celebrity"	"Khloe's ex and the father of her child raved about her in an Instagram post."
"0"	"Amazon's $1.5 million political gambit backfires in Seattle City Council election"	"finance-companies"	"Amazon's $1.5 million political gambit backfires in Seattle City Council election"
"0"	"3 retirement numbers you absolutely need to know"	"finance-retirement"	"These numbers can be the key to a happy and comfortable retirement."
"1"	"Robert Blake's Daughter Speaks Out for First Time About 'Traumatic Childhood' After Mom's Murder"	"tv-celebrity"	"Robert Blake's Daughter Speaks Out for First Time"
"0"	"American suspected of ISIS connections trapped in no man's land between Turkish, Greek borders: reports"	"newsworld"	"A U.S. citizen suspected of being a member of ISIS, is reportedly stuck in a heavily militarized no-man's land between the borders of the country that kicked him out, Turkey, and the one that refuses to accept him, Greece, officials say."
"0"	"Petition To 'Bring Back' Don Cherry Gains Traction After Hockey Commentator Fired For Comments About Immigrants"	"icehockey_nhl"	"Cherry's dismissal was announced on Monday by Sportsnet following his comments during his 'Coach's Corner' segment on Saturday's 'Hockey Night in Canada' program."
"1"	"Secrets shopping malls don't want you to know"	"lifestylesmartliving"	"Everything about the shopping mall is designed to draw you in, slow you down, and get you to spend big bucks"
"0"	"7-year-old Boy Fighting for His Life After Falling 9 Floors From Apartment Window"	"newsus"	"The boy suffered several broken bones and internal bleeding after falling from a Bronx River Houses apartment building in New York City."
"0"	"This Is Your Body On The Flu"	"medical"	"Flu experts share what happens once you're exposed to the flu including why it triggers some of those unpleasant symptoms."
"0"	"Why Your Older Tattoo Can Cause a New Infection or Allergy"	"medical"	"It's not just new tattoos that can cause skin irritation."
"1"	"12 Things You Probably Never Knew About The City of Chicago"	"lifestyledidyouknow"	"Did you know the city was home to the first-ever ferris wheel?"
"0"	"Mother of missing Florida girl charged; human remains found"	"newscrime"	"Police searching for a 5-year-old Florida girl who was reported missing last week by her mother found human remains in rural Alabama, authorities said Tuesday."
"0"	"The Top Winter Wonderlands You Should Visit This Holiday"	"traveltripideas"	"Find the best alpine views at these wintry destinations."
"0"	"Is This Expense Busting Your Budget?"	"finance-savemoney"	"Hint: It's something many of us spend far too much money on."
"0"	"Democrats aim to impeach Trump by Christmas"	"newspolitics"	"House Democrats are moving aggressively to wrap up their historic, weeks-long investigation into President Trump before 2020, potentially setting up a climactic vote to impeach him just before Christmas."
"0"	"How Ducati influenced the 2020 Corvette's design"	"autossports"	"The design team behind the mid-engine C8 Chevy Corvette Stingray looked to the fabled Italian motorcycle manufacturer for inspiration."
"0"	"Marlboro Man Bob Norris dies at 90, having reportedly never been a smoker"	"tv-celebrity"	"Robert "Bob" Norris, who played the iconic Marlboro Man for more than a decade in the '60s, has died at his Colorado ranch at 90. Norris landed the high-profile ad campaign for the Philip Morris cigarette brand by happenstance, as his son, Bobby Norris, told the local CBS affiliate, KKTV."
"0"	"A rock in Omaha became an overnight attraction thanks to the cars that can't seem to avoid it"	"newsus"	"The boulder, which rests inconspicuously in a parking lot in Omaha, has become the hottest new tourist attraction and meme thanks to its vibrant group of fans."
"0"	"E.P.A. to Limit Science Used to Write Public Health Rules"	"newsus"	"Want climate news in your inbox? Sign up here for Climate Fwd:, our email newsletter. WASHINGTON   The Trump administration is preparing to significantly limit the scientific and medical research that the government can use to determine public health regulations, overriding protests from scientists and physicians who say the new rule would undermine the scientific underpinnings of government policymaking. A new draft of the Environmental..."
"0"	"'Brutal' Arctic blast is affecting 200 million people from Chicago to Texas, and it isn't over yet"	"weathertopstories"	"The Arctic blast is bringing record-breaking cold and snow across the US. Schools are delayed, flights canceled and 200 million will feel the freeze."
"0"	"Is Miss USA Ready for Its First Woman In a Wheelchair?"	"lifestylebuzz"	"Madeline Delp opens up to Glamour about finding a formal gown that works with her disability, dealing with bladder incontinence on stage, and competing for the crown this weekend at the Miss North Carolina USA pageant, the last step before making it to Miss USA 2020."
"0"	"Please Don't Yell at Your Dog!"	"lifestylebuzz"	"A new study shows it can cause long-term psychological impacts."
"0"	"DNA reveals ancient Rome was full of migrants"	"video"	"DNA gathered in Italy and representative of the past 12,000 years revealed that ancient Rome was full of migrants."
"0"	"Russell Crowe's property scorched by Australian bushfires"	"movies-celebrity"	"Russell Crowe's property scorched by Australian bushfires"
"0"	"Mulvaney Seeks Court Guidance Over House Demand for Testimony"	"newspolitics"	"President Donald Trump's acting Chief of Staff Mick Mulvaney asked a judge to determine whether he must comply with a House Intelligence committee subpoena to testify in its impeachment hearings."
"0"	"Speed Camera Photos Help Man Get His Stolen Bike Back"	"autosmotorcycles"	"... but not how you probably think."
"0"	"Support for marijuana legalization is at an all-time high in a new poll"	"newsus"	"Two-thirds of Americans support marijuana legalization, according to two recent polls."
"1"	"11 Symptoms of Shingles You Might Be Ignoring"	"medical"	"Symptoms of shingles sometimes, but not always, include a painful rash caused by a reactivation of the chicken pox virus. Here are other signs."
"0"	"How to make your own mozzarella cheese"	"foodanddrink"	"Mozzarella is an approachable cheese to make from fresh milk that seems a little like magic."
"0"	"Colorado's buffalo mascot, Ralphie V, gets the boot for being too fast"	"football_ncaa"	"Ralphie V's 12-year tenure as Colorado's live mascot is coming to an end due to safety concerns. Ralphie was running too fast for her handlers."
"1"	"Classic candy bars we wish they'd bring back"	"newstrends"	"It's always disappointing finding out your favourite candy has been discontinued. We still have chocolate-shaped holes in our lives left by the Pearson's Candy Seven Up Bar and Cadbury's Time Out. From retro classics to much-loved limited-edition flavours, these are the discontinued bars we want to make a comeback."
"1"	"Gabbard Lawyers Demand Clinton Retract 'Defamatory' Russian Asset Comments"	"elections-2020-us"	"Gabbard received bipartisan criticism over her foreign policy, especially her view that Syria's Bashar al Assad is "not an enemy" of the U.S."
"0"	"32 Crucial Tips for Traveling to Foreign Countries"	"traveltips"	"More and more Americans are traveling abroad."
"0"	"The 15 Longest Nonstop Flights in the World"	"traveltrivia"	"Do you think you could handle being stuck inside a metal tube for this long?"
"0"	"After push from Perry, backers got huge gas deal in Ukraine"	"newspolitics"	"Two political supporters of U.S. Energy Secretary Rick Perry secured a potentially lucrative oil and gas exploration deal from the Ukrainian government soon after Perry proposed one of the men as an adviser to the country's new president."
"0"	"Suicide bomber attacks Indonesian police station, wounding 6"	"newsworld"	"MEDAN, Indonesia (AP)   A suicide bomber blew himself up at a busy police station in Indonesia's third-largest city on Wednesday, wounding at least six people. The attack came during a counterterrorism crackdown and as authorities were on heightened alert for possible attacks against police and places of worship following a militant attack last month."
"1"	"Dean Foods files for bankruptcy"	"finance-companies"	"Dean Foods, America's largest milk producer, is filing for bankruptcy."
"1"	"Video captures terrifying moment woman slips at Grand Canyon"	"viral"	"Emily Koford was visiting the national park with her mom when a step backward left her clinging to the rocks."
"0"	"40 Foods Men Over 40 Should Avoid Like the Plague"	"nutrition"	"Reading nutrition labels will help you make smarter food choices."
"0"	"9 signs you've shifted from frugal to cheap"	"finance-savemoney"	"Your frugal ways used to be endearing to your friends. Now they're just annoying."
"0"	"Nationals GM Mike Rizzo on White House visit: 'We weren't trying to make a political statement'"	"baseball_mlb"	"The team's visit to the White House was met with criticism, particularly catcher Kurt Suzuki's decision to wear a MAGA hat on stage."
"0"	"AP: Thousands face life-threatening floods from aging dams"	"newsus"	"On a cold morning last March, Kenny Angel got a frantic knock on his door. Two workers from a utility company in northern Nebraska had come with a stark warning: Get out of your house. Just a little over a quarter-mile upstream, the 92-year-old Spencer Dam was straining to contain the swollen, ice-covered Niobrara River after an unusually intense snow and rainstorm."
"0"	"Ilhan Omar blasts Pete King as an 'Islamophobe' after he announces retirement: 'Good riddance'"	"elections-2020-us"	"Rep. Ilhan Omar (D-Minn.) on Monday denounced Rep. Pete King (R-N.Y.) as an "Islamophobe" after the longtime GOP lawmaker announced that he would not seek re-election in 2020. Omar, who earlier this year became one of the first Muslim women sworn into Congress, specifically called out controversial statements King made about the Muslim community and Eric Garner during his long tenure in Congress."Peter King is an Islamophobe who held...""
"0"	"This Veteran Found His Long-Lost Love After 75 Years"	"causes"	"Grab a tissue. This romance between a World War II veteran and his long-lost love spans decades and proves that time can't erase true love. The post This Veteran Found His Long-Lost Love After 75 Years appeared first on Reader's Digest."
"0"	"I went to Peter Luger after it received zero stars from New York Times"	"restaurantsandnews"	"The burger was so juicy I had to wipe my fingers after every bite. And everyone from regulars to tourists couldn't stop singing Peter Luger's praises."
"0"	"My Sister and I Were Adopted From Korea, and Our Bond Is Unbreakable"	"causes"	"We have a photo taken at Halloween."
"0"	"Climate change could end mortgages as we know them"	"finance-real-estate"	"The traditional 30-year home loan   along with city and state budgets   face a grave threat from growing climate risks"
"0"	"Evo Morales of Bolivia Accepts Asylum in Mexico"	"newsworld"	"Evo Morales, the former president of Bolivia who resigned under pressure from street protests and the military, was granted asylum in Mexico on Monday, departing from the country at a time when it is deeply polarized and leaderless."
"1"	"The Best Roller Coasters Around the World"	"traveltripideas"	"Today, roller coasters have become instruments of adrenaline (or torture, depending on your perspective). They break speed records, hurl passengers through space, and some are even designed to trick riders."
"0"	""The Joy of Cooking" and its recipe for success"	"foodnews"	"Updating one of the most successful cookbooks ever published has been a family tradition since 1931"
