"0"	"I Was Adopted Here's What Everyone Gets Wrong About Adoption"	"lifestylefamilyandrelationships"	"While adoption is wonderful in many ways, it comes with its own set of unique challenges. Sometimes, those challenges come from other people making incorrect assumptions. The post I Was Adopted Here's What Everyone Gets Wrong About Adoption appeared first on Reader's Digest."
"0"	"Joanna Gaines reveals her family's favorite recipes in new cookbook"	"foodnews"	"The cookbook is available for pre-order on Amazon now."
"1"	"The 50 Foods That Sabotage Your Sleep"	"nutrition"	"No one ever likes to toss and turn! Staying away from these foods will guarantee a better night's rest."
"0"	"Long-term celebrity couples who won't get married"	"celebrity"	"These committed celeb couples have opted not to tie the knot."
"0"	"Do Women Really Have Different Heart Attack Symptoms Than Men?"	"health-news"	"A new study looking at patient-reported symptoms yields some surprising results."
"0"	"Copycat Cracker Barrel Chicken and Dumplings Recipe"	"recipes"	"Craving some comfort food from Cracker Barrel? Skip the restaurant and make this copycat chicken and dumplings recipe instead!"
"1"	"Early symptoms of dementia: Be aware of subtle signs"	"mentalhealth"	"Would you be able to recognize the symptoms of this creeping affliction?"
"1"	"We Tried Cinnamon Coke And Cranberry Sprite And One Of Them Is About To Become Your New Favorite"	"newstrends"	"Here's how we felt about them."
"0"	"Why You Shouldn't Ever Go for the Cheapest Brake Pads"	"autosbuying"	"Brakes are the most important part of your car. Here's why you shouldn't cut costs on them."
"0"	"'Priceless' finds that turned out to be worthless"	"markets"	"From a bottle of rare Scotch whisky to a fake Picasso painting, we take a look at items from around the world that were believed to be highly valuable... but turned out to be worthless."
"0"	"What $1,000 invested in Snap, Lyft and other unicorn IPOs is worth today"	"finance-top-stocks"	"Find out which companies are up and which are way down."
"1"	"10 Amazing Things at Walmart You Can't Buy Anywhere Else"	"shop-all"	"We rounded up the coolest, most unique, and most affordable items you can find only at Walmart. Get ready…get set…shop! The post 10 Amazing Things at Walmart You Can't Buy Anywhere Else appeared first on Reader's Digest."
"0"	"7 Type 2 Diabetes Symptoms That Are So Subtle, You Might Miss Them"	"medical"	"They sometimes sneak into your life in a way that makes them tough to notice."
"0"	"Massachusetts fire lieutenant dies battling house fire"	"newsus"	"An early morning fire in a three-story home has left a Massachusetts fire lieutenant dead and another firefighter in serious condition."
"0"	"2009 CMA Awards fashion flashback"	"cma-awards"	"See what the stars wore to the Country Music Association Awards 10 years ago."
"0"	"Frackers Prepare to Pull Back, Exacerbating a Slowdown in U.S. Oil Growth"	"markets"	"After pushing U.S. oil and natural-gas production to record levels, some shale companies are doing the unthinkable: They are planning to pump less."
"0"	"We tried every single appetizer at Olive Garden and ranked them from worst to best"	"restaurantsandnews"	"We ordered the entire starter menu from the popular Italian-American chain and rated them based on taste, shareability, and overall value."
"1"	"Think Twice Before Flying with Your Pet. Here's Why."	"travelnews"	"Thinking about taking Fido, Fluffy, or any four-legged friend with you on a plane? Don't book a ticket before reading this! The post Think Twice Before Flying with Your Pet. Here's Why. appeared first on Reader's Digest."
"1"	"JFK is America's largest mail room. Here's how customs searches 1 million mail packages a day for drugs and counterfeit goods."	"video"	"Just like arriving international passengers have to go through customs, so does international mail. And Customs & Border Protection searches all of them for illegal goods like counterfeit items and drugs. Take a peek inside America's largest mail room."
"0"	"Democrats face make-or-break moment on impeachment"	"newspolitics"	"Democrats have reached a make-or-break moment on impeachment.For the first time, Democrats will bring their impeachment inquiry to the American public on Wednesday as they seek to showcase the most damaging testimony about President Trump's contacts with Ukraine and elevate their case that he is unfit for office.After weeks of closed-door witness depositions, the stakes are high for Democrats to deliver not just in terms of drawing in..."
"0"	"'I Stayed Off Social Media Entirely Because Of My Weight. Then I Discovered Intermittent Fasting And Lost 109 Lbs.'"	"voices"	"After going through years of cancer treatment, Alicia Latrice Smith says she gained a lot of weight. She tweaked her diet   and lost 109 pounds."
"0"	"Dean Foods files for bankruptcy"	"finance-companies"	"Dean Foods, America's largest milk producer, is filing for bankruptcy."
"0"	"Kris Jenner Celebrates Corey Gamble's 39th Birthday with Kim, Kourtney and Khloé Kardashian"	"tv-celebrity"	"Kris Jenner Celebrates Corey Gamble's Birthday"
"0"	"Sean Spicer Admits He's Somewhat 'Relieved' to Be Eliminated from Dancing with the Stars"	"tvnews"	"DWTS: Sean Spicer Says He's Somewhat 'Relieved' to Be Eliminated"
"0"	"What Menopause Does to Women's Brains"	"wellness"	"Two-thirds of Alzheimer's patients are women. My foggy 53-year-old brain could help explain why."
"0"	"The biggest wastes of money in 2019"	"personalfinance"	"Relive 2019 with this look at some of the biggest wastes of money of the year."
"0"	"'Absolutely Terrifying': 3 Students Describe Moments After Shots Rang Out At Saugus High School"	"newsus"	"The three unidentified girls said they ran away as far as they could when they heard gunshots in the quad of Saugus High School."
"1"	"Cities with the worst commutes in America"	"newsus"	"Stacker analyzed 2017 American Community Survey data on average commutes across the country, including cities categorized by the U.S. Census Bureau as urban areas."
"0"	"'One in a million' deer captured on camera in Michigan woods"	"newsus"	"Retired Michigan lawmaker and amateur photographer Steven Lindberg took pictures of a deer. That deer had three antlers."
"0"	"Husband, 106, and wife, 105, are named world's oldest living couple"	"lifestylebuzz"	"John Henderson joked that that secret to their longevity could be never having kids."
"1"	"Wendy's Is Rolling Out Birthday Cake Frostys for Its 50th Anniversary"	"foodnews"	"Get your dipping fries ready."
"1"	"Horse dies after training track incident at Santa Anita"	"more_sports"	"ARCADIA, Calif. (AP) A fifth horse has died at Santa Anita this fall, the 35th overall fatality since Dec. 26 at the Southern California racetrack."
"0"	"Indian court gives disputed religious site to Hindus"	"newsworld"	"India's Supreme Court is due to rule on Saturday on the ownership of a centuries-old religious site claimed by both majority Hindus and Muslims, a dispute that has cast a shadow of suspicion over the two communities for decades."
"0"	"Deadly Arctic blast breaks records set more than 100 years ago"	"weathertopstories"	"It was literally freezing in Florida and Alabama and parts of Maine, Michigan and New York were digging out a foot of snow. Blame an Arctic air mass."
"0"	"The highlights and lowlights from the world of comedy in the 2010s"	"humor"	"Along with the great films, sitcoms and talk shows, there have been scandals, untimely deaths, cancellations both real and metaphorical, terrible sequels and comedies based on cell phone games."
"0"	"Supreme Court refuses to block lawsuit against gun manufacturer brought by Sandy Hook families"	"finance-companies"	"The Supreme Court refused to shield Remington Arms Co. from potential liability for the 2012 school shooting that left 26 dead in Newtown, Conn."
"0"	"How To Make Texas Chicken-Fried Steak & Creamed Gravy By Rachael"	"videos"	"Chicken-fried steak & gravy gets some Texas spice PLUS a side of cheesy, bacon-studded hasselback potatoes."
"1"	"Far-reaching snowstorm may take shape over US"	"weathertopstories"	"A winterlike pattern will continue to unfold across much of the eastern two-thirds of the nation into next week as a brutal one-two punch of bitterly cold air plunging into the United States will set the stage for another major storm."
"1"	"23 Ways You're Wasting Money at Costco"	"finance-savemoney"	"The warehouse club can save you money, or it can cost you money if you're not careful."
"0"	"Auburn coach Gus Malzahn on open Arkansas job: 'Nothing's changed'"	"football_ncaa"	""I love Auburn, like I have said in the past. I love my players. We've got a bright future here. Nothing's changed.""
"0"	"Georgia executes man convicted of killing convenience store clerk"	"newscrime"	"Georgia executes man convicted of killing convenience store clerk"
"0"	"Who tore down the Berlin Wall? Not David Hasselhoff, but Germans still love him"	"travelnews"	"David Hasselhoff's legacy in Germany is inextricably linked to the fall of the Berlin Wall. Here's why he's still beloved by many Germans."
"1"	"Feds probe international supply chain, link to THC products, as vaping injuries surpass 1,600 and 34 are dead"	"newsus"	"Vaping THC products a known risk for lung injuries but FDA and CDC investigators still don't know all substances harming people"
"0"	"Man cuffed for eating sandwich on train platform gets an apology"	"newsus"	"Bay Area Rapid Transit was slammed for its handling of a man who was handcuffed and cited for eating a sandwich"
"1"	"Unexpected Signs of an Unhealthy Heart"	"medical"	"Preventing heart disease has been at the forefront of researchers' agendas for years, involving things like physical activity, diet, and genetics"
"0"	"Mexico makes arrests in massacre of American women, children: minister"	"newsworld"	"Mexico makes arrests in massacre of American women, children: minister"
"0"	"Bode Miller delivered his twin boys after midwife didn't make it time for the birth"	"more_sports"	"Bode Miller added yet another impressive title to his list of accomplishments Friday."
"0"	"Protesters demonstrate against Donald Trump Jr.'s appearance at UCLA"	"newsus"	"Chanting "humanity first," dozens of people protested outside the UCLA hall on Sunday where Donald Trump Jr. was speaking as part of a promotional tour for his new book. Trump, who is promoting his book "Triggered: How the Left Thrives on Hate and Wants to Silence Us," spoke at Moore Hall on the Westwood campus as part of an event hosted by the conservative student group Turning ..."
"0"	"Officials: At least 13 dead in Slovakia bus crash"	"newsworld"	"A bus collided with a truck in Slovakia on Wednesday, killing at least 13 people and injuring at least 20 more. Online news site tvnoviny.sk reported that the bus was carrying high school students."
"0"	"For a healthy heart, eat the biggest meal early in the day"	"health-news"	"For a healthy heart, women should consume most daily calories before 6 p.m., a new study suggests."
"0"	"7 reasons not to be embarrassed about your debt"	"personalfinance"	"Don't be ashamed. Take control of your debt instead."
"1"	"Disturbing 911 call leaks from attempted invasion of home of Eagles' Cox"	"football_nfl"	"Philadelphia Eagles defensive star Fletcher Cox was given the scare of a lifetime when his home was invaded last week."
"0"	"Ree Drummond Says a Low-Carb Diet Is the Secret to Her Incredible Weight Loss"	"weightloss"	"The Pioneer Woman's new cookbook is out now!"
"1"	"Hunters receive ominous warning as fall season gets underway"	"more_sports"	"Montana wildlife officials have cautioned hunters, as the fall pheasant season gets underway, that they should anticipate bear encounters."
"1"	"42 Strange Symptoms That Can Signal a Serious Disease"	"medical"	"So often your lumps, bumps, rashes, and red spots are harmless. Occasionally, they're a sign of something far more serious. Here's how to tell the difference."
"0"	"50 amazing gifts for every type of person and budget"	"shop-holidays"	"Let the product experts at Reviewed help you find the perfect gifts for everyone on your list."
"0"	"Disney+ Launch Stumbles With Widespread Tech Issues"	"tvnews"	"If you had issues trying to watch Disney+, you're not the only one. Disney's new streaming service ran into tech issues for many customers soon after launching early on Tuesday morning, delaying their ability to watch their favorite shows and movies after months of anticipation. Eager customers shared several different error messages on Twitter, with some users being met with an "unable to connect" alert. Others were greeted with: "Error. Sorry...""
"0"	"This little Montana town is full of Power Wagons and Mustangs"	"autosenthusiasts"	"You never know what sorts of treasures hide down that unpaved backroad."
"0"	"A master suite with an 'open-concept' bathroom that has no doors   or privacy   is asking for $1,200/month in rent"	"lifestylebuzz"	"People took to Twitter to share confusion about an "open-concept" bathroom featured in a Facebook rental listing."
"1"	"Military spouse details home front struggles"	"advice"	"Dear Amy: I am entering my 14th year as a military spouse. Four years ago, I created a "home base" in my hometown area because I could no longer handle military life. This happened after several intense episodes of depression and anxiety, exacerbated by the death of one of my best military spouse friends."
"0"	"'Sesame Street' turns 50: Our favorite celebrity visitors to the neighborhood"	"tv-gallery"	"As "Sesame Street" celebrates its 50th anniversary, we look at the show's legacy of inclusion and why it still resonates with kids in 2019."
"0"	"17 restaurants that will be open on Thanksgiving"	"restaurantsandnews"	"Don't feel like cooking this year? You can spend Thanksgiving at a number of restaurants that will remain open this year."
"0"	"The facts behind GOP claims about Ukraine and 2016 likely to surface this week"	"newspolitics"	"The facts behind GOP claims about Ukraine and 2016 are likely to surface this week during the public impeachment hearings."
"0"	"Disney is betting everything on its Disney+ streaming service"	"finance-companies"	"On Nov. 12, the company will launch Disney+, hoping to prove to investors   and the world   that it has a strong vision for the future."
"0"	"We tasted this plant-based ice cream and can happily report it's delicious"	"foodnews"	"You scream, I scream, we all scream for... plant-based ice cream?"
"1"	"The Most Haunted Place in Every State (Don't Visit These Alone!)"	"traveltripideas"	"We dare you to check these out!"
"0"	"Les Miles Has Some Thoughts on the Shape of the Earth"	"football_ncaa"	"Sports are filled with some weirdos and, as such, we're privy to plenty of divergent thoughts on the shape of the Earth. Kyrie Irving made big news by doubling down on a conspiracy theory before backing away from it and apologizing. Les Miles, long a fellow who marches to the beat of his own drum, got philosophical or maybe literal about the topography contour of our planet in response to a fairly simple question today. Les Miles on what he's..."
"0"	"See what your favorite stars look like without makeup"	"celebrity"	"They get glammed up for red carpet events, but in their downtime, celebrities from Katie Holmes to Emma Stone prefer to let their natural beauty take center stage. Yes, just like you, stars do occasionally allow the world to see their foundation-free skin and mascara-less lashes to celebrate their freckles, little imperfections and inside-out glow, usually by way of the makeup-free selfie. They even sometimes celebrate their bare-facedness with hashtags like #wokeuplikethis and #nofilter. To see these stars without makeup   including Kate Hudson, Kim Kardashian, Gigi Hadid and all the stars you see above   check out the gallery now. For the latest beauty and style trends subscribe to our new podcast 'Get Tressed With Us' below! 34 Of Your Favorite Celebrities With Or Without Makeup!"
"1"	"Take a sneak peek at construction of the Rams' stunning new stadium"	"football_nfl"	"SoFi Stadium, a 298-acre sports-and-entertainment complex, is scheduled to open in July 2020 and will be home to the Los Angeles Rams and Chargers."
"0"	"Beat the crowds at these abandoned U.S. national parks"	"ustravel"	"These 7 spots might have lost their national status but you can still explore their rich history and natural beauty."
"1"	"14 celebrities who got rejected by 'Saturday Night Live' and went on to become famous in their own right"	"tv-gallery"	"Even though these stars auditioned for the popular NBC series and were turned down, they've had huge careers in the comedy world."
"0"	"Republicans shrug off growing evidence, stand with Trump against impeachment"	"newspolitics"	"The public phase of the House impeachment inquiry will test the unity of the GOP, which has so far backed the party leader."
"0"	"105 Most Popular Sodas Ranked by How Toxic They Are"	"nutrition"	"From classics like Coke and A&W to cult favorites, we reveal which soda is worst for your health."
"0"	"Instagram-famous pilot reveals secrets people don't know about the job"	"travelnews"	"Maria Fagerström, a pilot and Instagram influencer, shared some things passengers don't usually know about the job."
"0"	"Do not try this at home: How to turn $3,000 into $1.7 million"	"finance-saving-investing"	"Reddit's Wall Street Bets group learned a valuable lesson in responsible investing this week and, after years of encouraging and celebrating extreme risk-taking, the crew has finally embraced a more conservative approach. Just kidding. YOLO!"
"0"	"Andre Drummond: "I would enjoy playing for the rest of my career in Detroit.""	"basketball_nba"	"What other teams will step up to pay him next summer?"
"0"	"These Two New Oreo Flavors Are Coming in 2020 and We're OBSESSED"	"foodnews"	"These new Oreo flavors are just what we were craving and we didn't even know it!"
"0"	"'It's not over': Sarah Palin says she is fighting to repair her marriage"	"newsus"	"Former Alaska Gov. Sarah Palin said she learned her husband, Todd, wanted a divorce in an email from his lawyer and that the two are seeking counseling."
"0"	"This Is How Long Wine Lasts After You've Opened The Bottle"	"beverages"	"How long does open wine last? Is the rule of thumb different for red and white wines? We have the answers, plus a few tricks to keep your vino tasting fresh after you've popped the cork."
"0"	"Facing lawsuit, DeVos erases student loans for 1,500"	"newsus"	"Education Secretary Betsy DeVos on Friday said she will forgive loans for more than 1,500 borrowers who attended a pair of for-profit colleges that shut down last year."
"0"	"Subway just released a sandwich with green eggs and ham"	"foodnews"	"This new sandwich brings the classic dish from Dr. Seuss to life."
"0"	"Celebrity plastic surgery transformations"	"entertainment-celebrity"	"See how stars like Sharon Osbourne, Cardi B, Pauly D, Kim Zolciak-Biermann, Gisele Bundchen, Kanye West and others have altered their looks."
"0"	"Super-Rare 1976 Ferrari 308 GTB Vetroresina Selling For Under $200K"	"autosclassics"	"This is believed to be the lowest-sequence VIN of the U.S.-sold Vetroresinas!"
"1"	"Former Furman football player accused of drawing swastikas, bringing guns to campus"	"more_sports"	"A former Furman University football player was out on bond for allegedly bringing guns on campus when he was arrested in relation to vandalism charge."
"1"	"A heartbreaking photo of a dog riding a bus alone went viral, and now people want to adopt her"	"lifestylebuzz"	"A kennel is seeking the dog's owner. If no one comes forward, she will be put up for adoption."
"0"	"Carrie Underwood Praises Miranda Lambert as 'Super Supportive': 'We Lift Each Other Up'"	"cma-awards"	"Carrie Underwood Praises Miranda Lambert as 'Super Supportive'"
"1"	"Chuck Woolery: Supporting Trump 'pretty much destroyed my career'"	"tv-celebrity"	"Supporting President Trump and taking a conservative stance in public ruined Chuck Woolery's career and got him shadow-banned from Twitter, said the former game show host on "Fox & Friends," Wednesday."
"0"	"Red tide, the toxic algae bloom that kills wildlife, returns to southwest Florida"	"newsus"	"Southwest Florida is warily watching the return of red tide, a toxic algae bloom that cost businesses nearly $150 million in losses last year"
"0"	"The Queen's Dressmaker Reveals She Uses Gin to Clean the Royal Jewels"	"lifestyleroyals"	"The Queen's Jewels Are Polished with Gin and Water"
"0"	"A Russian professor was pulled from a river. Police said a woman's arms were found in his rucksack"	"newsworld"	"Russian law enforcement agencies are questioning a prominent historian over the death of a former student in the city of St. Petersburg, in a case that has grabbed headlines across the country."
"0"	"Whodunit in the Library: Someone Keeps Hiding the Anti-Trump Books"	"newsus"	"From her office next to the public computer terminals, Bette Ammon finds herself peering through a window to watch patrons moving through the Coeur d'Alene library's nonfiction stacks."
"0"	"Zooey Deschanel and Property Brothers star boyfriend Jonathan Scott make red carpet debut at Critics Choice Documentary Awards"	"tv-celebrity"	"The 39-year-old looked blissfully happy as she cuddled up to the 6ft 5ins Canadian celebrity. 41, before the Critics' Choice Documentary Awards at BRIC in Brooklyn, New York City, on Sunday."
"0"	"Supreme Court Appears Ready to Let Trump End DACA Program"	"newsus"	"WASHINGTON   The Supreme Court's conservative majority appeared ready on Tuesday to side with the Trump administration in its efforts to shut down a program protecting about 700,000 young undocumented immigrants known as Dreamers. The court's liberal justices probed the administration's justifications for ending the program, expressing skepticism about its rationales for doing so. But other justices, including President Trump's two appointees,..."
"0"	"California regulators to open inquiry into power outages"	"newsus"	"California regulators will vote Wednesday on whether to open an investigation into pre-emptive power outages that blacked out large parts of the state for much of October as strong winds sparked fears of wildfires."
"1"	"Michigan pays UCLA $1.5M to cancel home-and-home series"	"football_ncaa"	"The Bruins and Wolverines were supposed to meet in 2022 and 2023, but Michigan paid $1.5 million to cancel the series."
"0"	"Jennifer Lopez Just Got a Teeny Chop to Her Blond Lob, but it Changed the Entire Look"	"lifestylecelebstyle"	"In September, Jennifer Lopez debuted a new hairstyle at the premiere of Hustlers."
"0"	"Judge calls USC dad a 'thief,' gives longest prison sentence so far in college admissions scandal"	"newscrime"	"Toby MacFarlane, a California real estate executive, received six months for his actions in the college admissions scandal. It's the longest so far."
"1"	"These Restaurants Are Rumored To Be Haunted By Spirits"	"restaurantsandnews"	"Get into the Halloween spirit with a reservation at one of these spooky spots."
"0"	"Disney World Decorates The Parks With More Than 40,000 Items Overnight In Only 7 Hours"	"travelnews"	"The installation of 40,000 decorations is unreal."
"0"	"American woman apparently strangled in the Dominican Republic"	"newsworld"	"Colleagues say Patricia Anton brought joy and laughter to the school she worked in, as police hunt leads in what they say looks like a deadly robbery at her home"
"1"	"12 Things to NEVER do While Driving"	"autosownership"	"Most of these things are no-brainer mistakes that you should avoid while driving. Unfortunately, there's no shortage of apparently brainless drivers on our roads. Here are the things you should NEVER do while driving."
"1"	"Undetectable drugs might have role in horse racing deaths"	"more_sports"	"Horse racing has never experienced a year like this one. A spike of deaths at Santa Anita, Keeneland and tracks in New York, mixed with a controversial finish in the Kentucky Derby that prompted a lawsuit, have left the sport with a crisis-a-week feel. This week, there is plenty more anxiety as attention turns to the Breeders' Cup races, horse racing's version of the Super Bowl."
"0"	"7 Signs & Symptoms of Kidney Stones You Need to Know"	"medical"	"This health condition can land you in a world of pain."
"0"	"Poland asks Netflix to make changes to documentary about Nazi death camp guard"	"newsworld"	"Poland asks Netflix to make changes to documentary about Nazi death camp guard"
"0"	"Republican Mark Sanford drops out of presidential race"	"elections-2020-us"	"Sanford, a Trump critic, failed to catch traction in the Republican primary."
"1"	"Hard Rock Hotel New Orleans collapse: Former site engineer weighs in"	"newsus"	"Structural engineer Walter Zehner worked on the project before it became a planned Hard Rock Hotel. A look at what he thinks could have happened:"
"0"	"The stock market's 10-year run became the best bull market ever this month"	"markets"	"The current bull market, which started March 9, 2009, has enjoyed a whopping 468% gain for the S&P 500 through the first day of November."
"0"	"4 frat deaths this month. 2 this week alone. What's going on with fraternity hazing?"	"newsus"	"As a wave of young men nationally die in circumstances that appear to be related to fraternities, experts are unsure what to do next"
"0"	"Kanye West is teaming up with pastor Joel Osteen: Details"	"music-celebrity"	"The rapper and the megachurch leader are planning to speak together at Houston's Lakewood Church."
"1"	"13 Polite Habits That Grocery Store Employees Secretly Dislike"	"tipsandtricks"	"Bag these behaviors! They know you mean well, but the employees at your favorite grocery store wish you'd stop doing these things."
