"0"	"Dog Throws A Total Tantrum When She Realizes Mom Wants To Take The Stairs"	"lifestylebuzz"	"Aurora Angel Beste Nala has always been the friendliest dog, and loves going out on adventures and meeting new people."
"0"	"Mexico's security strategy called into question after Mormon killings and other violence"	"newsworld"	"After three women and six children were slaughtered on a remote dirt road in Mexico, relatives and members of their small religious community stood around the smoldering carnage for hours before local authorities arrived."
"0"	"691,145 Californians left last year: What state did they go to?"	"finance-real-estate"	"Look at the comings and goings as a ratio of ins to outs. Tiny Idaho wins this race with 497 arrivals from the Golden State for every 100 former Gem State residents who moved to California."
"0"	"45 Abandoned Places Around the World That Are Eerily Beautiful"	"traveltripideas"	"It's okay to be awed and creeped out at the same time."
"1"	"18 things flight attendants wish you would stop doing"	"traveltips"	"From crowding the galley to walking around barefoot, here are things people do on a plane that are frustrating for these airline pros."
"0"	"Pregnant firefighter tackles bushfires: 'I don't care if you don't like it'"	"newsworld"	"A young pregnant firefighter has defended her decision to continue fighting bushfires raging across Australia, saying: "I don't care if you don't like it.""
"0"	"Photos of the Day"	"newsworld"	"Our top photos from the last 24 hours."
"0"	"The Trendiest Hair Colors for Winter, From Mulled Wine to Greige Blonde"	"lifestylebeauty"	"Greige blonde, cold brew brown, icy platinum you can't go wrong with these trending shades."
"0"	"Cassius Winston posts heartfelt message to late brother on Instagram"	"basketball_ncaa"	"Remarkably, Winston was able to play in Sunday's game just a day after his brother passed. The senior played 26 minutes and registered a double-double with 17 points and 11 assists."
"0"	"WWE Wrestler Jordan Myles Quits in Expletive-Filled Rant as He Brands the Company Racist"	"tvnews"	"WWE Wrestler Jordan Myles Quits, Calls Company Racist"
"1"	"Scotch whisky distributors face US tariffs after today"	"markets"	"Whisky makes up 12.4% of all exports to the US from the UK."
"0"	"Seahawks knock 49ers from unbeaten ranks with 27-24 OT win"	"football_nfl"	"Jason Myers kicked a 42-yard field goal after Chase McLaughlin missed a kick earlier in overtime, and the Seattle Seahawks handed the San Francisco 49ers their first loss of the season with a 27-24 victory on Monday night."
"1"	"Trump Organization ordered to pay $290,000 after losing battle against Scottish wind farm"	"newspolitics"	"President Trump has a long-standing disdain for windmills, including the ones he said would harm views from his golf course."
"1"	"NFL officiating stinks. Here are 10 ways to fix it."	"football_nfl"	"The NFL generated approximately $15 billion in revenue in 2018, so it's long past time the league allots some of that money to fix its officiating problems, Chris Mueller writes."
"0"	"Why Prince Harry Wore His Remembrance Poppy Differently from the Rest of the Royal Family"	"lifestyleroyals"	"Why Prince Harry's Poppy Was Worn on His Cap"
"0"	"15 Abandoned Places That You Can See Only in Pictures"	"lifestyledidyouknow"	"Long before the advent of the internet and Google Maps, vast reaches of the world were cloaked in mystery. Though today there's little uncharted territory left to discover, there are still secret locales scattered throughout the United States places that mistakes, hubris, miscalculations, and the sweep of time have transformed into ghost towns that are now too dangerous or difficult to visit. Read on to learn about 15 abandoned places you can explore only through photographs unless, that is, you're willing to risk a trespassing charge (something we strongly discourage). Though abandoned, many of these locations are still private property, and while some aren't technically off-limits, concerns about toxins, deteriorating structures, and other dangers should offer a strong deterrent."
"0"	"Americans now have a record $14 trillion in debt"	"personalfinance"	"US households are now sitting on a record $14 trillion in mortgages, credit cards, student loans and other forms of debt."
"0"	"How to Choose Piston Rings and Gap Them Correctly"	"autosenthusiasts"	"Why is piston ring selection and endgap so important to performance and longevity? Doing it right will make more power and your engine last longer."
"0"	"Lori Loughlin's 'Stress Is Only Mounting' Ahead of Pretrial Hearing"	"tv-celebrity"	"Lori Loughlin's 'Stress Is Only Mounting' Ahead of Pretrial Hearing"
"0"	"Top 10 storylines for college football Week 12"	"football_ncaa"	"This Saturday is going to be a blast to watch unfold. These are the biggest stories we're following in college football Week 12."
"0"	"What's the Best Oil for Frying?"	"tipsandtricks"	"Here, we bring you a heated debate on the best frying oil, plus a community-approved winner."
"0"	"Fox legal analyst Napolitano emerges as Trump critic"	"newsus"	"NEW YORK (AP)   More than two decades into his career as a commentator at Fox News Channel, Andrew Napolitano reached a milestone of sorts when he was called a "fool" on his own network. Not to his face, of course. But Tucker Carlson guest Joseph diGenova's dismissal of Napolitano for saying that soliciting campaign aid from a foreign government is against the law illustrates the awkward place that the former New Jersey Superior Court judge..."
"0"	"Bolsonaro asks Brazilians 'not to give ammunition' to freed Lula"	"newsworld"	"Brazil's President Jair Bolsonaro asked his supporters Saturday "not to give ammunition to the scoundrel," the day after popular leftist leader Luiz Inacio Lula da Silva walked free from jail. Breaking his silence on the release of his arch-nemesis, Bolsonaro told his Twitter followers: "Lovers of freedom and good, we are a majority. We cannot make mistakes." He added Lula was "momentarily free, but guilty.""
"0"	"Rip Taylor's Cause of Death Revealed, Memorial Service Scheduled for Later This Month"	"tvnews"	"The comedian died at the age of 84 last month."
"1"	"Bill O'Reilly said he doubts mom works 4 jobs. She says he 'doesn't have a clue'"	"personalfinance"	"Gina Giambone says she actually juggles 5 part-time gigs to earn enough for her and her adult special-needs daughter"
"0"	"Report: Cam Newton considering surgery for injured foot"	"football_nfl"	"Panthers quarterback Cam Newton has been placed on injured reserve. Now that he's done for the season, it sounds like he may be reconsidering how he attacks his recovery. According to Ian Rapoport at NFL Network, Newton is now considering surgery for his left foot. "Almost certainly out for the season, Newton is now considering surgery to repair the Lisfranc injury in his foot, sources say. The procedure, which would come in the next week or...""
"0"	"Subtle Signs You May Have Clogged Arteries"	"medical"	"These surprising clues can point to clogged arteries and underlying heart disease."
"1"	"Biggest Native American tribes in the U.S. today"	"lifestyledidyouknow"	"Native American origins reach far back to late in the ice age when the first humans ventured across the Bering Strait and into what is now North America. Stacker has compiled a list of the 42 most prominent Native American tribes today based on 2010 Census data."
"1"	"Stars Who Served in the Military"	"entertainment-celebrity"	"Adam Driver, Jeff Bridges, Ice-T and more stars who served in the military."
"0"	"Tamron Hall Talks Leaving the Today Show, Jokes About Megyn Kelly's Reported Multimillion Payout"	"tvnews"	"Tamron Hall Talks Losing the Today Show"
"0"	"From Idris Elba to Richard Gere: All the Sexiest Man Alive Covers"	"celebrity"	"Some are familiar faces (Ben! Brad!) and some are shockers (here's looking at you, Richard!). Check out who's been named Sexiest through the years"
"1"	"Adobe Exposed Data of More Than 7 Million Software Users"	"newsscienceandtechnology"	"Adobe Inc. exposed the data of 7.5 million of its creative-software customers, a person familiar with the matter said, in the latest example of a company leaving consumer information visible on the internet."
"0"	"How to Make Homemade Potato Chips in a Snap"	"recipes"	"Make crispy potato chips with your air fryer. This classic lunch side just got a whole lot better (and crunchier)."
"1"	"DeVos held in contempt for violating judge's order on student loans"	"newsus"	"A federal judge on Thursday held Education Secretary Betsy DeVos in contempt of court and imposed a $100,000 fine for violating an order to stop collecting on the student loans owed by students of a defunct for-profit college."
"0"	"30 best Netflix shows for binge watching over the holidays"	"tv-gallery"	"The unprecedented density of the catalog of films and television shows on Netflix provides plenty of content for families to binge-watch during this holiday season. See what Stacker has to say about the top 30 ranked television shows you can stream online."
"0"	"Most countries aren't hitting 2030 climate goals, and everyone will pay the price"	"weathertopstories"	"Untold human suffering is in our future as nations miss their Paris Agreement targets by a long shot."
"0"	"Country music's biggest scandals"	"music-awards"	"From Wynonna Judd's husband's arrest to the Dixie Chicks' vent about George W. Bush, relive country's biggest scandals."
"1"	"Boeing prepares key test for Starliner spacecraft"	"newsscienceandtechnology"	"A successful pad-abort test is a critical milestone on the road to readying Boeing's Starliner capsule for launch"
"0"	"Answers remain elusive in Virginia Beach shooting rampage"	"newsus"	"Independent auditor's report says gunman didn't display warning signs."
"0"	"This Sturdy Cutting Board Will Last for a Lifetime and It's On Super Sale Right Now"	"tipsandtricks"	"It also makes the perfect holiday gift."
"0"	"Stars who've had more than one wedding with the same spouse"	"entertainment-celebrity"	"See which celebs exchanged vows with their significant others more than once."
"0"	"The Sexiest Photos Ever of Our 29 Sexiest Men Alive"	"celebrity"	"Warning: lots of heat ahead"
"1"	"New York writer who accused Trump of sexual assault sues him for defamation"	"newspolitics"	"After E. Jean Carroll detailed alleged incident this summer, Trump denied ever meeting her."
"0"	"The Most Stunning Evening Gowns in Miss America History"	"lifestylecelebstyle"	"See the evolution from the 1920s through 2019."
"0"	"Thanksgiving side dishes: 11 unique recipes to try this season"	"foodnews"	"While there will always be dishes you're unwilling to leave off your table, consider changing it up with these unique Thanksgiving side dishes."
"0"	"House GOP asks for Hunter Biden and whistleblower to testify in impeachment probe"	"newspolitics"	"Also Saturday, Trump said he would 'probably' release a transcript of an earlier call with the with Ukrainian president ahead of public hearings scheduled for next week."
"0"	"Charles Rogers, former Michigan State football, Detroit Lions star, dead at 38"	"football_nfl"	"Charles Rogers, the former Michigan State football star whom the Detroit Lions selected with the second overall pick in 2003 NFL draft, has died."
"1"	"Buckingham Palace has a bizarre tradition of taking an MP hostage when the Queen enters Parliament in case something bad happens to her"	"lifestyleroyals"	"MP Stuart Andrew was held hostage at the palace while Her Majesty delivered a speech at the State Opening of Parliament on Monday."
"0"	"13 Popular Foods People Hated Eating 100 Years Ago"	"foodnews"	"Culinary trends are just as fickle as fashion. Find out which gourmet foods you love used to only be fed to animals or prisoners. The post 13 Popular Foods People Hated Eating 100 Years Ago appeared first on Reader's Digest."
"0"	"The Most Popular Family Dinners from Every Decade"	"recipes"	"Find a quintessential family dinner for every decade over the past 100 years. The post The Most Popular Family Dinner from Every Decade appeared first on Taste of Home."
"1"	"Ex-SS guard on trial: I saw people led into gas chamber"	"newsworld"	"A 93-year-old former guard at the Nazis' Stutthof concentration camp testified at his trial Friday that he once saw people being led into the gas chamber, followed by screaming and banging sounds behind the locked door."
"1"	"4th suspect arrested as UK truck deaths case probe deepens"	"newsworld"	"LONDON (AP)   A fourth person was arrested in connection with the deaths of 39 people found in the back of a container truck in southeastern England, British police said Friday as the investigation into one of the country's worst human smuggling cases geared up. Police said a 48-year-old man from Northern Ireland was arrested Friday at England's Stansted Airport on suspicion of manslaughter and conspiracy to traffic people."
"0"	"How to Smoke a Turkey"	"tipsandtricks"	"The swoonworthy results and surprising ease of cooking an entire turkey over a wood-infused fire should make you rethink cranking up the oven."
"0"	"'DACA is everything': Dreamers, families rally as Supreme Court takes up its future"	"newsus"	""We are here to tell the justices that this is more than just a work permit," said a mother, 29, with DACA status. "This is about keeping families together.""
"0"	"Flight Delayed After Man Sneaks Aboard and Locks Himself in Bathroom"	"travelnews"	"An unidentified man without boarding pass or passport managed to stow himself away inside an airplane bathroom on an international flight bound for Dublin."
"0"	"This Record-Breaking 1800-HP Land Speed Car Is Coming up for Sale"	"autosenthusiasts"	"The 1968 Challenger II set a 448-mph speed record last year, and now, it can be yours."
"0"	"Fire Destroys Classic Porsche Cars And Parts Worth $3 Million"	"autosenthusiasts"	"Well-known for their vintage Porsche builds, Benton Performance has burnt down to the ground along with a bunch of irreplaceable vintage Porsche cars and parts."
"0"	"President Trump to discuss Israeli-American relations at South Florida event"	"newspolitics"	"President Donald Trump will headline a convention on Israeli-American relations at The Diplomat in Hollywood, Fla., on Dec. 7 during what could be a tumultuous time in his administration."
"0"	"Lance Altimeter Is A Delicious Drop-In Truck Camper Debuting At SEMA"	"autosenthusiasts"	"The all-in-one Overlanding package sleeps four and is fully equipped for an off-grid weekend."
"0"	"No. 1 milk company declares bankruptcy amid drop in demand"	"finance-companies"	"Dean Foods blamed a decadeslong drop in milk consumption that has seen people turn to alternatives like soda, juice and almond milk."
"0"	"2019 CMA Awards: See the best photos from inside and backstage"	"cma-awards"	"2019 CMA Awards: See the best photos from inside and backstage"
"0"	"Houston prosecutor fired after asking about crime victim's immigration status"	"newsus"	"A Houston prosecutor was fired Friday after he allegedly refused to bring charges against a man accused of attempted sexual assault because he believed the victim was living in the United States illegally."
"0"	"Seven dead in Iraq as security forces clear protest sites"	"newsworld"	"Seven protesters were killed Saturday in Iraq as security forces cleared protest sites in Baghdad and Basra after political leaders agreed to stand by the embattled government by any means. The leaders, sources told AFP, also agreed to put an end to rallies rocking Iraq's capital and its south since October 1 and demanding an overhaul of the political system."
"0"	"This Is What It's Like to Give Up Alcohol For a Week"	"voices"	"I don't often examine my drinking, but I was curious about the less obvious effects of alcohol on my life. This is what I learned from a week of sobriety."
"0"	"Disney+: All the Original TV Shows and Movies Set for Streaming Platform (Photos)"	"tv-gallery"	"Direct-to-consumer offering will house programming from Marvel Studios, Pixar and Lucasfilm"
"0"	"Celine Dion Shares What She Misses Most About Late Husband Rene Angelil"	"music-celebrity"	"'Rene will always be with me, but I'm not in pain.'"
"0"	"Kiss Cancel 'End of the Road' Tour of Australia and New Zealand Due to Illness"	"musicnews"	"Kiss won't be playing Australia and NZ after all."
"0"	"French Baguettes From a Vending Machine? 'What a Tragedy.'"	"newsworld"	"The lights inside the village bakery used to come on before dawn, an hour or so before the smell of baking bread would waft into neighbors' homes. The storefront door would soon be heard, opening and closing, the rhythm as predictable as the life stirring awake across the French countryside. But everything changes."
"1"	"Parents changing pleas as prosecutors threaten more charges in college admissions case"	"newsus"	"LOS ANGELES - Federal prosecutors are ratcheting up pressure on parents who have maintained their innocence in the college admissions scandal with a warning they intend to file additional criminal charges as early as next week, according to sources familiar with the discussions."
"1"	"Starbucks Is Selling A Phantom Frappuccino For Halloween That's Topped With Green Slime"	"restaurantsandnews"	"It's scary how much I want to try this."
"0"	"A guide to the cast of 'High School Musical: The Musical - The Series'"	"tv-gallery"	"Meet the actors and actresses on the new Disney+ High School Musical-inspired show."
"0"	"Taylor testifies he was told Trump cared more about 'investigations' than Ukraine"	"newspolitics"	"William Taylor said U.S. Ambassador to the European Union Gordon Sondland told a member of his staff in July that President Trump cared more about an investigation into former Vice President Joe Biden than he did about Ukraine."
"0"	"6 Very Good Recipes That Prove an Air Fryer Belongs in Your Kitchen"	"recipes"	"I'm a gadget geek, so it's no surprise that I was fascinated by the air fryer when it first came on the scene. Especially since I'm also a busy cook; if a gadget doesn't make my life easier, then I've got no time for it. (Too few hours in the day to mess with one that messes with me!) I am all about ruthless efficiency, in other words. Mostly, I loved the concept of frying without oil. And so began a period of intensive experimentation. (Thereby..."
"0"	"20 Winter Wedding Color Schemes That Will Take Your Breath Away"	"lifestyleweddings"	"Funny, now I'm suddenly in the mood for a glass of champagne."
"0"	"National Cappuccino Day 2019: Deals from Starbucks, Dunkin' Donuts and More"	"foodnews"	"The cappuccino is named after the Capuchin friars, whose robes were the color of the espresso mixed with frothed milk."
"0"	"Ex-Astros say team electronically stole signs during 2017 season"	"baseball_mlb"	"While the Astros have denied the numerous sign-stealing allegations against them, the former members of their World Series team described the practice they used that season in detail."
"0"	"Nikki Haley claims top aides tried to recruit her to 'save the country' by undermining Trump"	"indepth"	"In a new book, the potential White House aspirant slams Rex Tillerson as 'exhausting' and John Kelly as suspicious of her access to the president, and argues they should have quit if they disagreed with him."
"0"	"Chick-fil-A's Peppermint Chocolate Chip Milkshake Is Finally Back For The Holidays"	"restaurantsandnews"	"Is it too cold for milkshakes?"
"1"	"The 5 college majors American students most regret picking"	"finance-career-education"	"English, communications, biological sciences and law were among the most regretted college majors, according to a recent survey. On the upside, students who focused on computer science, business, engineering and health administration felt very good about their choices."
"0"	"8 Things You Do That Might Be Messing Up Your Flu Shot"	"medical"	"Read this before you roll up your sleeve."
"1"	"Why Kate & Meghan Were on Different Balconies for Remembrance Sunday"	"lifestyleroyals"	"There's no scandal here. It's all about the order of precedence."
"1"	"Why Prince Harry Wore His Remembrance Poppy Differently from the Rest of the Royal Family"	"lifestyleroyals"	"Why Prince Harry's Poppy Was Worn on His Cap"
"0"	"Here's How to Make White Sauce for Pasta That's Better Than at Any Restaurant"	"recipes"	"White sauce (aka bechamel) is creamy, dreamy and surprisingly easy to make at home. Here's how to do it yourself."
"0"	"Lisa Vanderpump Reveals Why She Left RHOBH: 'I Don't Have Room in My Life for Nastiness'"	"tvnews"	"Lisa Vanderpump Reveals Why She Left RHOBH"
"0"	"The Queen Had This Hilarious Reaction to (Unnecessary) Mouth-to-Mouth Resuscitation"	"lifestyle"	"The Queen had a hilarious reaction when someone tried to save her life. Buzz60's Keri Lumm reports."
"1"	"JetBlue, Norwegian Air pair up to make transatlantic bookings simpler"	"travelnews"	"Norwegian Air, JetBlue tie up to make transatlantic bookings simpler"
"0"	"Here's the Best Small Town in Every State"	"traveltripideas"	"From Los Alamos, California, to Shelter Island, New York, these are the best small towns INSIDER found in every state."
"0"	"Report: Giants hire Gabe Kapler as new manager"	"baseball_mlb"	"The Giants have reportedly chosen Gabe Kapler to manage the team in 2020. He beat out Joe Espada and Matt Quataro for the job."
"0"	"Police, protesters face off in renewed clashes in Hong Kong"	"newsworld"	"Police and protesters battled outside university campuses and several thousand demonstrators blocked roads as they took over a central business district at lunchtime on Tuesday in another day of protest in Hong Kong. The clashes followed an especially violent day in Hong Kong's five months of anti-government demonstrations, in which police shot one protester and a man was set on fire."
"0"	"Wheel of Fortune's Pat Sajak Says the 'Worst Has Passed' Following Emergency Intestine Surgery"	"tvnews"	"Pat Sajak Says 'Worst Has Passed' Following Emergency Surgery"
"0"	"Luxury rentals only the superrich can afford"	"finance-real-estate"	"The world's costliest luxury lettings come with eye-watering rents only a billionaire could contemplate   mere millionaires need not apply."
"0"	"I'm 55 and have no retirement savings: What should I do?"	"finance-retirement"	"Just because you start the race late doesn't mean you can't win."
"0"	"If You're Over 40 And About To Start Weight Lifting For The First Time, Here Are 5 Things You Need To Know"	"wellness"	"Over 40? 5 Things You Need to Know about Lifting Weights for the First Time."
"0"	"This is Chick-fil-A's most-ordered menu item"	"foodnews"	"There may be a lot of things you don't know about Chick-fil-A, but if there's one thing you definitely know about the fast food chain, it's that it has a massive following. Chick-fil-A is quickly growing and has become the third-most profitable chain restaurant in America. With millions of devoted fans and diners, we had to ask: What is Chick-fil-A's most popular menu item? 10 Ways Fast Food Chains Are Playing With Your Head The most-ordered..."
"0"	"A $30,000 handbag. A disastrous wine spill. And now, a country club is suing its own waiter."	"markets"	"The pink Hermès Kelly clutch was worth $30,000, a lawsuit says. But it was soiled at a "very, very, very rich country club.""
"0"	"C8 Corvette Dyno Test Follow-Up: What Really Happened"	"autosnews"	"Key parameters were botched, but the C8's still plenty powerful"
"0"	"We tried McDonald's new Snickerdoodle McFlurry, and here's our honest review"	"newstrends"	"On the heels of the 2019 holiday season, McDonald's announced a brand new seasonal McFlurry   the first one to get a nationwide release in seven years. After a successful trial run in several markets over the summer, the Snickerdoodle McFlurry launched exclusively on Uber Eats. The frozen treat will be more widely available in-house later this month, but is it worth the wait? The 20 Most Over-the-Top Fast Food Menu Items of All Time We tried the..."
"0"	"The climate crisis will profoundly affect the health of every child alive today, report says"	"newsworld"	"The climate crisis is already hurting our health and it could burden generations to come with lifelong health problems, a new report finds. It could challenge already overwhelmed health systems and undermine much of the medical progress that has been made in the last century."
"1"	"Riders Rescued After Universal Orlando's "Rip Ride Rockit" Roller Coaster Breaks Down"	"travelarticle"	"It was a rough start to the day for some people at Universal Studios in Orlando."
"1"	"What Gas Stations Were Like In 1957"	"autosenthusiasts"	"This vintage documentary is fascinating."
"0"	"Trump wants to win even more rural votes in 2020. Democrats are scrambling to catch up"	"newselection2020"	"Corey Bauch is eager to explain why he regrets not voting for Donald Trump. The 44-year old-agreed to meet with me last week in this rural Wisconsin town (population of 1,500), where he has lived most of his life. As we talked, horse-drawn buggies from the local Amish community rolled past a small outpost of stores, on their way to nearby farms. The libertarian Bauch was one of ..."
"0"	"I tried to eat like Kate Middleton for a week, but I couldn't get through it without cheating"	"nutrition"	"Following Kate Middleton's diet helped me feel energized throughout the week, but there were some meals I could only stomach once."
"0"	"Unexpected Signs of an Unhealthy Heart"	"medical"	"Preventing heart disease has been at the forefront of researchers' agendas for years, involving things like physical activity, diet, and genetics"
