"0"	"Scared Rabbit Abandoned In Box Clings To His Favorite Teddy Bear"	"lifestylebuzz"	"RSPCA When someone spotted a box on the side of a road in London last week, they were alarmed when they thought they saw something moving around inside it."
"0"	"Warren's wealth tax could drive billionaires to funds she hates"	"markets"	"Sen. Elizabeth Warren's proposed wealth tax could be a gift to an industry she has accused of looting Americans -- private equity."
"0"	"GOP senator defends calling Pelosi 'dumb': 'What I said was accurate'"	"newspolitics"	"Sen. John Kennedy (R-La.) defended remarks this week in which he called Speaker Nancy Pelosi (D-Calif.) "dumb," saying that his comments were "accurate.""
"0"	"Bachelor in Paradise's Carly Waddell and Evan Bass Welcome Son Charles Wolfe"	"tv-celebrity"	"Bachelor in Paradise's Carly Waddell and Evan Bass Welcome a Son"
"0"	"How to get the best Costco Black Friday 2019 deals"	"finance-savemoney"	"Win Black Friday and leave your budget intact."
"0"	"My Husband Doesn't Like What I Wear and It's Making Me Feel Terrible"	"advice"	"My husband considers himself something of fashionista and always criticizes what I wear. What can I do about it."
"0"	"'It's not over': Sarah Palin says she is fighting to repair her marriage"	"newsus"	"Former Alaska Gov. Sarah Palin said she learned her husband, Todd, wanted a divorce in an email from his lawyer and that the two are seeking counseling."
"1"	"Iowan convicted of murder claims his life-sentence was served once he died, was revived in medical emergency. The court disagrees."	"newscrime"	"An Iowa convicted of murder was rushed from prison to the hospital where his heart was restarted five times. Now he claims he should be freed"
"0"	"Cracker Barrel Has Two Thanksgiving Options This Year, and They Both Sound Delicious"	"restaurantsandnews"	"Don't feel like cooking a turkey this year? You can order a Cracker Barrel Thanksgiving dinner to bring home, or eat at the restaurant on T-Day."
"1"	"Kelly Ripa responds to backlash over son in 'extreme poverty' joke"	"tv-celebrity"	"Kelly RIpa is defending a joke she made about her son on "Jimmy Kimmel Live!""
"1"	"Alibaba breaks Singles Day record of more than $30 billion in sales"	"finance-companies"	"Alibaba hit $12 billion in sales in the first hour of its annual shopping extravaganza on November 11."
"0"	"Pete Davidson, Kaia Gerber seen on yet another date: Fresh details on their new romance"	"tv-celebrity"	"The comedian and the model are together in NYC again as reports claim Kaia is 'super into him' and 'giddy' about their hangouts."
"0"	"Amber Heard requests Johnny Depp undergo a mental health evaluation"	"movies-celebrity"	"Johnny Depp says the request is an invasion of privacy"
"0"	"Signs of Dementia: 8 Tips For Talking to Your Older Parents"	"mentalhealth"	"When a parent begins to exhibit early signs of dementia or Alzeimer's, it's difficult for families to address it. These tips will make the process easier."
"0"	"Kaia Gerber Attends Pete Davidson's Comedy Show in Brooklyn"	"movies-celebrity"	"Kaia Gerber Attends Pete Davidson's Comedy Show in Brooklyn"
"0"	"Is retirement dying? The old work model is disappearing for Boomers, Gen Xers"	"finance-retirement"	"More Americans are opting to work well into retirement, a growing trend that threatens to upend the old workforce model."
"0"	"Harry Potter's Matthew Lewis Has the Best Response to Tom Felton's Fear of Aging"	"movies-celebrity"	"Harry Potter star Matthew Lewis had a hilarious reply to former co-star Tom Felton's recent Instagram post. See his response!"
"1"	"As L.A. ports automate, some workers are cheering on the robots"	"markets"	"The arrival of robots at the nation's largest marine terminal, a 484-acre facility run by Danish conglomerate A.P. Moller-Maersk, is exposing a stark economic divide between two sets of Southern California workers."
"0"	"Miranda Lambert gets candid about her public divorce and secret wedding, plus more news"	"entertainment-celebrity"	"Miranda Lambert on what really stung about her split from Blake Shelton. Plus, more celebrity news for Nov. 13, 2019."
"1"	"Trent Brown allegations test Raiders owner's stand against domestic abuse"	"football_nfl"	"A 6-foot-8, 360-pound NFL player is accused of slapping, punching and choking his live-in partner, the mother of his child. Multiple times. Police were reportedly called. Now a civil lawsuit has been filed. Mark Davis, what's your move? The allegations that broke Wednesday morning that Raiders offensive tackle Trent Brown was the aggressor in multiple incidents of domestic abuse are the latest disruption for a Raiders team that has seen its..."
"0"	"Biggest celeb weddings of the last decade"	"celebrity"	"Take a look back at the most memorable and extravagant celeb weddings that went down in the 2010s."
"0"	"Carrie Underwood Praises Miranda Lambert as 'Super Supportive': 'We Lift Each Other Up'"	"cma-awards"	"Carrie Underwood Praises Miranda Lambert as 'Super Supportive'"
"1"	"Why the Patriots made a very un-Patriots trade for Mohamed Sanu"	"football_nfl"	"The Patriots haven't traded a second-round pick for an age 30 player since ... Corey Dillon."
"0"	"Broadway Actress Laurel Griggs Dies at Age 13"	"musicnews"	"Broadway star Laurel Griggs has died, according to multiple reports. She was 13."
"0"	"E.P.A. to Limit Science Used to Write Public Health Rules"	"newsus"	"Want climate news in your inbox? Sign up here for Climate Fwd:, our email newsletter. WASHINGTON   The Trump administration is preparing to significantly limit the scientific and medical research that the government can use to determine public health regulations, overriding protests from scientists and physicians who say the new rule would undermine the scientific underpinnings of government policymaking. A new draft of the Environmental..."
"0"	"We tried McDonald's new Snickerdoodle McFlurry, and here's our honest review"	"newstrends"	"On the heels of the 2019 holiday season, McDonald's announced a brand new seasonal McFlurry   the first one to get a nationwide release in seven years. After a successful trial run in several markets over the summer, the Snickerdoodle McFlurry launched exclusively on Uber Eats. The frozen treat will be more widely available in-house later this month, but is it worth the wait? The 20 Most Over-the-Top Fast Food Menu Items of All Time We tried the..."
"0"	"White House to use webcams to create live feed of border wall construction"	"newsus"	"The Jared Kushner proposal has been met by objections from the U.S. Army Corps of Engineers and border officials."
"1"	"Gary McCord speaks out loudly about being dropped from CBS golf team: 'Bottom line, they fired me'"	"golf"	"Gary McCord says that he was surprised by CBS' decision and disappointed with the way the network handled the situation after working there 30-plus years"
"0"	"Must-see moments from star-studded 2019 People's Choice Awards"	"peopleandplaces"	"E!'s People's Choice Awards was full of must-see moments like Jennifer Aniston thanking "Friends" and Kevin Hart's emotional acceptance speech."
"0"	"Chick-fil-A owner fights back against 'slowest drive-thru' accusations"	"foodnews"	"The owner of two Chick-fil-A restaurants in Ohio isn't taking accusations against the company sitting down."
"0"	"The Amazing All-You-Can-Eat Restaurant in Every State"	"restaurantsandnews"	"If you feel the indulgence of an all-you-can-eat restaurant calling out to you, there's one within your home state to enjoy. Whether it's comfort food, seafood, an international favorite such as sushi or Indian, or an over-the-top Brazilian steakhouse, here are 50 buffets well worth stopping in for a visit."
"0"	"Taliban to release 2 professors in prisoner swap"	"newsworld"	"Kevin King, a U.S. citizen, and Timothy Weeks were kidnapped at gunpoint from the American University of Afghanistan in Kabul in August 2016."
"0"	"Highlights of the 2019 SEMA Show in Las Vegas"	"autossema"	"SEMA is the United Nations conference of all things aftermarket, and here's some of the best stuff we spotted."
"1"	"A wellness influencer told her Instagram followers that shampoo causes weight gain, but nutrition experts are calling her comments 'madness'"	"wellness"	"Her post raises concerns of "fear-mongering," according to one expert. And that the lack of regulation on social media is a growing problem."
"0"	"White Castle Is Bringing Back Its Mac & Cheese Nibblers And Sloppy Joe Sliders This Winter"	"restaurantsandnews"	"It's eating season."
"0"	"Wendy's Is Rolling Out Birthday Cake Frostys for Its 50th Anniversary"	"foodnews"	"Get your dipping fries ready."
"0"	"Climate change might hit the economy harder and faster than thought"	"markets"	"The economic effects of global warming may arrive sooner and with a bigger impact than previously thought, according to Oxford Economics in a report that compares recent scientific research with the economic literature on the costs of climate change."
"1"	"Kelly Ripa Jokes Son Michael Is Experiencing 'Extreme Poverty' in Brooklyn"	"tv-celebrity"	"Kelly Ripa Jokes Son Michael Is Experiencing 'Extreme Poverty' in Brooklyn"
"1"	"Demi Moore Says Her 'Addiction' to Ashton Kutcher Was 'Devastating': 'It Took Me Away Emotionally'"	"tv-celebrity"	"Demi Moore Says Her 'Addiction' to Ashton Kutcher Was 'Devastating'"
"0"	"Abandoned farms for sale with plenty of promise"	"finance-real-estate"	"If you fancy snapping up your own farm without breaking the bank, these abandoned properties might just be of interest."
"1"	"Matt Cassel shares why it's a bad idea to get in a prank war with Tom Brady"	"football_nfl"	"Tom Brady and Matt Cassel enjoyed a solid working relationship during their time as teammates, even remaining friends after Cassel was traded to the Chiefs following the 2008 season."
"0"	"The world's largest trade deal could be signed in 2020"	"markets"	"RCEP involves all 10 ASEAN countries and five of the bloc's major trading partners: Australia, China, Japan, New Zealand and South Korea."
"0"	"How a military family honors the memory of wife's fallen first husband"	"lifestylebuzz"	""Never let his memory fade away": How one war widow's life came full circle in love and loss"
"0"	"Sarah Hyland documents painful tattoo removal"	"tv-celebrity"	"It looks like she's removing a dinosaur tattoo"
"1"	"World Series 2019: Celebs Cheering for the Washington Nationals, From Bill Nye to Jon Bernthal (Photos)"	"celebrity"	"D.C. politicians and Beltway journalists like David Gregory, Chuck Todd and Mitch McConnell all hope the team can beat the Houston Astros"
"1"	"Shia LaBeouf Thanks Officer Who Arrested Him in 2017 for 'Changing My Life' in Emotional Speech"	"movies-awards"	"Shia LaBeouf Thanks Cop Who Arrested Him for 'Changing My Life'"
"0"	"Jane Fonda Opens Up About the Possibility of Spending Her 82nd Birthday in Jail"	"movies-celebrity"	"The actress and activist has been protesting in Washington D.C. every Friday, in the name of spreading awareness about climate change."
"0"	"The Giudice family reunites and more ICYMI celeb news"	"entertainment-celebrity"	"Giudice family reunites in Italy, Keanu Reeves has a girlfriend, Kevin O'Leary sued over boating accident and more news you might have missed this week."
"0"	"Here's the Nickname for People Living in Every State"	"lifestyledidyouknow"	"Whether you're a resident, a visitor, or you're just passing through, here's what you should and shouldn't call the folks who live in every U.S. state."
"0"	"Decline of local journalism is likely increasing voter polarization"	"newsus"	"In May 2017, former Republican Rep. Leonard Lance crossed party lines and voted against the GOP health care repeal, a proposal deeply unpopular with voters in New Jersey's 7th District, which he had represented in Washington for nearly a decade. A year later, Lance again joined Democrats to oppose the Republican tax cut bill. Although he supported portions of the bill and its overall intent, he decided to vote against it because it would hurt..."
"0"	"We made a 3-course feast using Chrissy Teigen's recipes, and had the best homemade pizza we've ever tasted"	"foodnews"	"We recreated three recipes from Chrissy Teigen's new website, Cravings By Chrissy Teigen, to see if they lived up to the hype."
"0"	"105 Most Popular Sodas Ranked by How Toxic They Are"	"nutrition"	"From classics like Coke and A&W to cult favorites, we reveal which soda is worst for your health."
"1"	"The Amazing All-You-Can-Eat Restaurant in Every State"	"restaurantsandnews"	"If you feel the indulgence of an all-you-can-eat restaurant calling out to you, there's one within your home state to enjoy. Whether it's comfort food, seafood, an international favorite such as sushi or Indian, or an over-the-top Brazilian steakhouse, here are 50 buffets well worth stopping in for a visit."
"0"	"20 stocks that could double your money in 2020"	"finance-top-stocks"	"Big gains could be just a click of the buy button away."
"1"	"Northern Michigan father of 7 wins $80M Powerball jackpot"	"newsus"	"Phillip Chippewa, 54, of Suttons Bay matched the winning Powerball numbers drawn Sept. 21."
"1"	"Twitter Had Feelings About Mark Zuckerberg's Micro-Bangs"	"lifestylebuzz"	"Facebook founder Mark Zuckerberg debuted a new haircut on the House floor on Wednesday, and Twitter quickly took note with an avalanche of memes and quips."
"0"	"The economic picture is darkening in states critical to Trump's reelection bid"	"markets"	"A closer look at key battleground states could spell trouble for the candidate, whose populist economic proposals have been central to his campaign."
"0"	"49 Celebrity Couples Who Make It Work Despite Huge Age Gaps"	"celebrity"	"We're talking 16+ years..."
"0"	"How tracking your money can make you richer"	"personalfinance"	"It's something everyone can (and should) be doing to build wealth."
"0"	"Stocks close higher on optimism over China trade deal"	"markets"	"Stocks ended at record highs Thursday after the world's two largest economies reportedly agreed to remove existing trade tariffs, sparking a huge rotation into equities and out of bonds."
"1"	"Failed operation underlines Mexico chaos"	"newsworld"	"A daring operation to capture one of Mexico's most powerful drug lords failed disastrously when armed cartel members launched a deadly counterattack, laying siege to the northern city of Culiacan and taking several security officers hostage."
"1"	"UCLA ends 11-year drought against Stanford with 34-16 win"	"football_ncaa"	"STANFORD, Calif. (AP)   Dorian Thompson-Robinson passed for two touchdowns and ran for another in helping UCLA end an 11-year drought against Stanford with a 34-16 victory over the Cardinal on Thursday. Jack West became Stanford's third different starting quarterback of the season, the first time that's happened since 1974. After early success, his inconsistent play led to a stalled offense. Thompson-Robinson passed for 192 yards and rushed for..."
"1"	"After Thursday morning rant, Antonio Brown backtracks on comments"	"football_nfl"	"Brown took to social media Thursday morning with an expletive-laden rant calling out the NFL. In an attempt at damage control later in the day, Brown clarified his stance."
"0"	"The Daily Northwestern Apologizes to Student Protesters for Reporting"	"newsus"	"Editors at Northwestern University's campus newspaper apologized on Sunday for its coverage of student demonstrators, which they said was invasive and "hurt students," spurring a swift backlash from professional journalists and a broader reckoning over reporting practices and diversity in newsrooms."
"0"	"FBI busts $6 million iPhone and iPad counterfeit ring"	"newsus"	"The FBI busted a counterfeit ring centered on iPhones and iPads that reportedly cost Apple over $6.1 million."
"0"	"A rock in Omaha became an overnight attraction thanks to the cars that can't seem to avoid it"	"newsus"	"The boulder, which rests inconspicuously in a parking lot in Omaha, has become the hottest new tourist attraction and meme thanks to its vibrant group of fans."
"0"	"The Bakery Behind Doubletree's Famous Chocolate Chip Cookie Bakes More Than 100 Million Cookies A Year"	"foodnews"	"And they keep the recipe a complete secret."
"0"	"Utah death-row inmate featured in best-selling book dies"	"newscrime"	"SALT LAKE CITY (AP)   A Utah death-row inmate who killed his brother's wife and her toddler because of his strong polygamist beliefs in a case made famous by the book "Under the Banner of Heaven" has died of natural causes, prison officials said Monday. Ron Lafferty, 78, died at the state prison in the Salt Lake City suburb of Draper, Utah Department of Corrections spokeswoman Kaitlin Felsted said. The state attorney general's office had..."
"0"	"15 key questions for NFL Week 10"	"football_nfl"	"Now that we're reaching Week 10 of the NFL season, they're numerous teams start that are providing us with some interesting storylines. What's worth watching in Week 10? Here are 15 key questions."
"1"	"Chrissy Teigen Predicts The Office's Jim and Pam Are Divorced Now, Sends Twitter into a Tailspin"	"tv-celebrity"	"Chrissy Teigen Predicts The Office's Jim and Pam Are Divorced"
"0"	"'I Have Waited 68 Years to See This': How Honor Flights Help Veterans Reflect"	"newsus"	"In 2004, shortly after the national World War II Memorial was completed, Earl Morse, a retired Air Force captain working at the Department of Veterans Affairs clinic in Springfield, Ohio, realized that many of the veterans he knew would never get to see it. So he persuaded pilots at his local flying club to ferry a handful of veterans to Washington on small planes, and accompany them to the National Mall."
"0"	"Here's the Best Small Town in Every State"	"traveltripideas"	"From Los Alamos, California, to Shelter Island, New York, these are the best small towns INSIDER found in every state."
"0"	"Where will Odell Beckham be playing in 2020?"	"football_nfl"	"Browns receiver Odell Beckham has vowed that 2020 will be the best year of his life. And so the next question becomes whether he'll be playing for the Browns during the best year of his life. It's not a stretch to think that Beckham or the Browns or both will decide to move on after [more]"
"0"	"Buffalo Wild Wings reopens after manager is killed in chemical accident"	"newsus"	"The Buffalo Wild Wings in Burlington reopened late Saturday morning after its general manager died Thursday evening in an accident involving cleaning chemicals, according to restaurant representatives. Ryan Baldera, 32, was overcome by the fumes and died after being rushed to Lahey Hospital, according to the Burlington Fire Department. Sign up for our Newsletters Representatives of the Buffalo Wild Wings told Josh Brogadir, of NewsCenter 5, that..."
"0"	"How Celebs Are Dressing for Winter In New York, On a Scale of Kaley Cuoco to Kanye"	"lifestylecelebstyle"	"The past 24 hours have been a wild ride, fashion-wise, in NYC."
"1"	"Brazil oil auction a 'total disaster' as bidders stay away"	"markets"	"Brazil's largest-ever auction of oil deposits flopped, sending the real tumbling, after state-controlled Petroleo Brasileiro SA did most of the bidding while other major oil companies stayed away."
"0"	"Atlanta college student Alexis Crawford was choked to death, dumped in park, police say"	"newscrime"	"Authorities say Alexis Crawford and her roommate Jordyn Jones had a physical altercation and Jones' boyfriend intervened and choked Crawford to death."
"0"	"Why is American internet access so much more expensive than the rest of the world?"	"markets"	"Thomas Philippon, author of "The Great Reversal: How America Gave Up on Free Markets," explains"
"0"	"105 Black Friday Deals You Can Start Shopping Today"	"shop-holidays"	"Save with early bird deals from stores like Walmart, Target, Amazon, Costco, Sam's Club, Kohl's, Sears, JCPenney, and Macy's, which are offering deep Black Friday discounts on the hottest products on your Christmas list   and your wish list   starting on Thanksgiving, or even sooner."
"0"	"4 takeaways from the Seahawks' wild, overtime win over the 49ers"	"football_nfl"	"If the NFC championship is a rematch of this Monday Night Football game, we're in for a treat. The Seattle Seahawks' 27-24 overtime win over the San Francisco 49ers in Week 10 was wild, messy and exciting. It may have been the most fun game of the season."
"1"	"Illegal vapes traced to California woman who was CBD pioneer"	"newsus"	"CARLSBAD, Calif. (AP)   Some of the people rushing to emergency rooms thought the CBD vape they inhaled would help like a gentle medicine. Others puffed it for fun. What the vapors delivered instead was a jolt of synthetic marijuana, and with it an intense high of hallucinations and even seizures."
"1"	"How the 'Avalanche Method' Can Help You Shed Debt"	"personalfinance"	"Learn how you can benefit from this trusted system for demolishing debt."
"0"	"Man still in love with ex is tempted to test the water"	"advice"	"Dear Abby: I have been divorced for 26 years. I have been engaged a couple of times since but never made it back to the altar. My ex-wife has now permanently separated from her second husband. I have helped her financially and emotionally through a couple of stressful situations in the interim due to her second husband. I became available again myself about 18 months ago, so I have been considering inviting her to dinner to help her relax and..."
"0"	"Watch Kelly Clarkson's Kids Interview Their Hero Jason Momoa In The Cutest Video Ever"	"entertainment-celebrity"	"Kelly Clarkson's kids were in for a huge treat on Wednesday's The Kelly Clarkson Show when they got to meet their icon, Jason Momoa. Watch their adorable interview with Aquaman himself below."
"1"	"Kawhi Leonard vs. Raptors will be the rarest kind of reunion of a star and his ex"	"basketball_nba"	"When the Toronto Raptors became the first NBA franchise outside the U.S. to win the championship last June, Mfiondu Kabengele was in Florida. Wanting to experience the celebration unfolding in Toronto, the city that was a 50-minute drive from his Ontario hometown, the 6-foot-10 center from Florida State grabbed his laptop and logged into a website of a Canadian television provider. "People ...""
"1"	"South Florida principal who made controversial comments about the Holocaust is fired"	"newsus"	"The South Florida principal who stirred national controversy after refusing to say the Holocaust was a "factual, historical event" was fired Wednesday during a school board meeting at the recommendation of the district's superintendent."
"0"	"'Baby Trump' balloon slashed at Alabama appearance"	"newsus"	"TUSCALOOSA, Ala. (AP)   A towering "Baby Trump" protest balloon was knifed and deflated by someone unhappy with its appearance during President Donald Trump's Saturday trip to Alabama, organizers said."
"0"	"Mixed-race mother reveals strangers question whether she's related to her fair-skinned daughter - including a suspicious church-goer who asked the girl: 'Is this your Mummy?'"	"lifestylebuzz"	"Davina Moon, 32, from Surrey, who has a mixed heritage including Sri Lanka and Ireland, told how society often treats her differently because she doesn't look like her children."
"0"	"My husband and I have a 'family meeting' every week, and it saved our marriage after I became a mom"	"voices"	"Writer Melissa Petro found the first year of full-time motherhood overwhelming. To repair their relationship, her and her husband had family meetings."
"0"	"Trump, Erdogan to meet as thorny issues stress relations"	"newsworld"	"Turkish President Recep Tayyip Erdogan and President Donald Trump will meet as relations between the two NATO allies are at their lowest point in decades, with Turkey rebuffing the U.S. and turning toward Russia on security issues and Ankara facing a Washington backlash over attacks on Kurdish civilians during its incursion into Syria last month."
"1"	"Kevin Spacey Won't Be Charged in Sexual Assault Case After Accuser Dies"	"movies-celebrity"	"The Los Angeles County District Attorney's Office has formally dropped a case against actor Kevin Spacey, after the accuser died."
"0"	"Joe Giudice Calls His Family 'Italian Strong' During Reunion with Wife Teresa and Their Daughters"	"tv-celebrity"	"Joe Giudice Shares Sweet Photo During Family Reunion in Italy"
"1"	"Rob Lowe reflects on the infamous scandal that changed his life: 'It got me sober'"	"tv-celebrity"	""Honestly, I do," Rob Lowe said of his sex tape from the late 80s, "'cause it got me sober. Sober got me married.""
"0"	"Game over! Mariah Carey outdid every kid on TikTok with her 'Fantasy challenge'"	"music-celebrity"	"The challenge was to match dance moves to Mariah Carey's 1995 song. No kid delivered it with quite the same sass as the "queen" could."
"0"	"Ruth Bader Ginsburg misses court due to illness"	"newsus"	"Supreme Court Justice Ruth Bader Ginsburg was not on the bench for oral arguments Wednesday due to illness, according to Chief Justice John Roberts."
"1"	"No, Pizza Chains Are Not Using Glue To Make Cheese Pulls Look Stretchier"	"foodnews"	"Here's how it really works."
"0"	"Week in celebrity photos for Nov. 4-8, 2019"	"celebrity"	"Week in celebrity photos for Nov. 4-8, 2019"
"1"	"Greg Schiano reportedly making 'significant demands' in Rutgers talks"	"football_ncaa"	"Ex-Tennessee HC Butch Jones remains fallback plan if Schiano talks implode."
"0"	"Supreme Court refuses to block lawsuit against gun manufacturer brought by Sandy Hook families"	"finance-companies"	"The Supreme Court refused to shield Remington Arms Co. from potential liability for the 2012 school shooting that left 26 dead in Newtown, Conn."
"0"	"Lisa Vanderpump Reveals Why She Left RHOBH: 'I Don't Have Room in My Life for Nastiness'"	"tvnews"	"Lisa Vanderpump Reveals Why She Left RHOBH"
