"1"	"Teresa Guidice shows off in sexy 'Game of Thrones' Halloween costume"	"tv-celebrity"	"Days after her husband was released from ICE custody, Teresa Giudice showed off her 'Game of Thrones' costume"
"0"	"Pregnant firefighter tackles bushfires: 'I don't care if you don't like it'"	"newsworld"	"A young pregnant firefighter has defended her decision to continue fighting bushfires raging across Australia, saying: "I don't care if you don't like it.""
"0"	"Kevin Hart Says He's a ''Different'' Person While Revealing Details From ''Humbling'' Car Crash Recovery"	"movies-celebrity"	"Kevin Hart discusses the life "altering" effects that the Labor Day car crash has had on him and his family, after making appearance at 2019 PCAs"
"1"	"Neil Patrick Harris Has Surgery on His Hand After a Sea Urchin Accident While on Holiday"	"tv-celebrity"	"Neil Patrick Harris Has Surgery After a Sea Urchin Accident"
"0"	"Queen Elizabeth Shows Rare Display of Emotion"	"lifestylevideo"	"After Meghan Markle was seen standing separately from Queen Elizabeth, Kate Middleton and Duchess Camilla during Monday's Remembrance Day Service, many royal watchers wondered if the Duchess of Sussex has been snubbed."
"0"	"Cowboys to be among NFL teams in attendance for Colin Kaepernick's workout"	"football_nfl"	"Despite owner Jerry Jones' stance of mandating players stand for the anthem, the Cowboys will be in attendance for Colin Kaepernick's workout."
"0"	"Tourists, Venetians slosh through flooded lagoon city"	"weathertopstories"	"Tourists and Venetians alike donned high boots and took to strategically placed raised walkways on Tuesday to slosh through the high water that has hit much of the lagoon city."
"0"	"Marlboro Man Bob Norris dies at 90, having reportedly never been a smoker"	"tv-celebrity"	"Robert "Bob" Norris, who played the iconic Marlboro Man for more than a decade in the '60s, has died at his Colorado ranch at 90. Norris landed the high-profile ad campaign for the Philip Morris cigarette brand by happenstance, as his son, Bobby Norris, told the local CBS affiliate, KKTV."
"0"	"These Two New Oreo Flavors Are Coming in 2020 and We're OBSESSED"	"foodnews"	"These new Oreo flavors are just what we were craving and we didn't even know it!"
"1"	"I visited the new American Dream megamall on its opening day and it was eerily empty"	"travelnews"	"The American Dream megamall opened to the public last week. Here's what to expect from one of the largest malls in the US."
"0"	"You'll Be Captivated by Ciara's Best Hair and Makeup Looks"	"lifestylecelebstyle"	"Ciara has been one of our beauty crushes since she released her hit "Goodies" in 2004, but in the past few years, she's been responsible for some seriously head-turning hair and makeup looks."
"1"	"A Chocolate-Themed Cruise Is Setting Sail In 2020 So Book Your Vacations Day Now"	"foodnews"	"Book your vacation days ASAP."
"0"	"The Latest Weight Loss Pills That Work And the Ones That Don't"	"nutrition"	"When diet and exercise aren't working, the answer may be at the drugstore."
"0"	"This holiday gift could make your child more than $50,000"	"finance-mutual-funds"	"How a small investment now can make your children's lives much easier when they're older."
"0"	"Kanye West is teaming up with pastor Joel Osteen: Details"	"music-celebrity"	"The rapper and the megachurch leader are planning to speak together at Houston's Lakewood Church."
"1"	"We made a 3-course feast using Chrissy Teigen's recipes, and had the best homemade pizza we've ever tasted"	"foodnews"	"We recreated three recipes from Chrissy Teigen's new website, Cravings By Chrissy Teigen, to see if they lived up to the hype."
"0"	"Thanksgiving side dishes: 11 unique recipes to try this season"	"foodnews"	"While there will always be dishes you're unwilling to leave off your table, consider changing it up with these unique Thanksgiving side dishes."
"0"	"US Coast Guard is searching for two missing boaters after a storm capsized their vessel"	"newsus"	"A search is underway for two missing boaters after a storm capsized a vessel off the southeastern coast of Florida on Friday, the US Coast Guard said."
"1"	"I Decided to Stop Cooking Thanksgiving Dinner, and It Was Seriously the Best Decision"	"newstrends"	"Last year during the holidays, I started the most brilliant tradition with my family (in my opinion, at least)."
"0"	"Hilaria Baldwin Shares Emotional Video Revealing She Had a Miscarriage"	"tv-celebrity"	"Hilaria Baldwin Shares Emotional Video Revealing She Had a Miscarriage"
"0"	"My wife and I have bailed out our son, yet we have the daughter-in-law from hell"	"personalfinance"	"'We have lent them considerable money, but his wife now denies it was a loan.'"
"0"	"100 vintage baby names coming back into style"	"lifestyleparenting"	"Stacker looks at 100 vintage baby names coming back into style along with their origins and some of the more popular bearers of that name. The Bible, literature, and royalty are just a few sources for these vintage names."
"0"	"Don't be fooled: Costco says $75 coupon is a scam"	"finance-companies"	"Wholesale retailer Costco is warning customers about a new scam that is promising shoppers a $75 coupon."
"0"	"Bucs release former first-round pick Vernon Hargreaves"	"football_nfl"	"TAMPA   Two days after he was benched for not hustling to a make a tackle, the Bucs released starting cornerback Vernon Hargreaves Tuesday morning. The 11th overall pick in 2016 from the University of Florida, Hargreaves struggled to hold up his reputation as a ball hawk in the NFL with only two career interceptions in four seasons. Hargreaves was informed of the decision Tuesday morning at ..."
"1"	"A bet on America: The sports gambling gold rush"	"markets"	"The boardwalk in Atlantic City, New Jersey, looks like a forgotten film set. Scant tourists look in vain for its Prohibition-era glory."
"0"	"'We always believe': Win over 49ers proves Seattle Seahawks' mindset is more than just lip service"	"football_nfl"	"The Seattle Seahawks once again rallied for a win, this time over the previously unbeaten 49ers. And this Seattle team is for real, writes Mike Jones."
"1"	"Plans pushed back to explode 2 cranes in New Orleans"	"newsus"	"NEW ORLEANS (AP)   Plans have been pushed back a day to bring down two giant, unstable construction cranes in a series of controlled explosions before they can topple onto historic New Orleans buildings, the city's fire chief said Friday, noting the risky work involved in placing explosive on the towers. With the possibility of winds picking up due to a tropical storm in the Gulf of Mexico, officials had hoped to bring the cranes down Friday...."
"0"	"Insiders predict: NFL week 10 winners"	"football_nfl"	"We've entered the portion of the season where peeking at the playoff picture following each game wouldn't be considered too premature. The Patriots suffering their first loss makes things a bit more interesting in the AFC, while the still-undefeated 49ers face a major test this week against a division rival. We take a look at the Week 10 NFL slate, and the betting lines accompanying it."
"1"	"I looked into 'house hacking' to live for free, but there are a few reasons I've decided it's not for me"	"finance-real-estate"	"House hacking is where you utilize your primary residence to help you earn income, so you can live for free or drastically reduce expenses."
"1"	"Ava DuVernay, Netflix Sued Over Portrayal of Interrogation Technique in 'When They See Us'"	"tvnews"	"Ava DuVernay and Netflix are being sued for defamation by the company behind the interrogation technique featured in the limited series "When They See Us." John E. Reid and Associates, the company behind the Reid Technique, take issue with the way their interrogation system is described as "universally rejected" in the show and portrayed as a method to extract false confessions from suspects. "When They See Us" is a dramatization of the case of..."
"0"	"25 Biggest Grocery Store Mistakes Making You Gain Weight"	"nutrition"	"From picking up free goodies to navigating the wrong aisles, these grocery shopping mistakes could be one of the sneaky reasons you're gaining weight."
"0"	"All eyes on Texas governor as calls grow to halt execution"	"newscrime"	"AUSTIN, Texas (AP)   In his five years as Texas' governor, Republican Greg Abbott has overseen the execution of nearly 50 prisoners while only once sparing a condemned man's life."
"0"	"A$AP Rocky Will Return to Sweden to Perform"	"musicnews"	"A$AP Rocky isn't wasting any time in returning to see his fans in Sweden."
"0"	"50 amazing gifts for every type of person and budget"	"shop-holidays"	"Let the product experts at Reviewed help you find the perfect gifts for everyone on your list."
"0"	"Pensions Venture Into Risky Corners of the Market in Hunt for Returns"	"finance-retirement"	"Some pension-fund managers are venturing further into unusual investment territory as this year's plunge in bond yields makes it even harder to find decent long-term returns."
"1"	"Dez Bryant plans to reach out to NFL teams in two weeks"	"football_nfl"	"The former Cowboys' WR1 is just looking for a chance."
"1"	"Ninja History Student Writes Term Paper in Invisible Ink   Gets an 'A'"	"lifestylebuzz"	"The university freshman sent her education into stealth mode."
"0"	"Ahead of this week's rematch, Tom Brady says he's still not quite over Super Bowl loss to Eagles"	"football_nfl"	"Plus, maybe you shouldn't expect to see a trick play from the Patriots."
"0"	"Peter Schmuck: Success won't spoil this Ravens team, because Lamar Jackson won't let it"	"football_nfl"	"BALTIMORE - The Ravens have every right to be sky-high after scoring back-to-back victories over two of the best teams in the NFL, but that doesn't mean they're going to come back down any time soon. Sure, the Cincinnati Bengals have been kryptonite to the Ravens in the recent past, but the winless team Lamar Jackson and Co. will face Sunday won't bear any resemblance to the ones that ..."
"0"	"One-and-done for Adam Gase? New York Jets fans have had enough"	"football_nfl"	"As the NFL enters Week 10, Jets fans are eager to move on from Adam Gase, while Ravens fans can't get enough of MVP candidate Lamar Jackson."
"0"	"Prince Harry and Meghan Markle just shared a never-before-seen photo of baby Archie with his 'Grandpa' Prince Charles to celebrate his birthday"	"lifestyleroyals"	"The Duke and Duchess of Sussex shared a new photo of Archie, Harry, and Charles to mark the Prince of Wales' 71st birthday on Thursday."
"0"	"These countries blew massive windfalls"	"markets"	"From oil to gas and other natural resources, these governments haven't spent windfalls wisely."
"1"	"The Sante Fe High School massacre suspect isn't fit to stand trial and will get psychiatric treatment, attorney says"	"newsus"	"Dimitrios Pagourtzis is accused of killing eight students and two teachers at his Texas high school last year."
"1"	"Lane Kiffin seemed to enjoy getting fined $5K for a blind ref meme, calls out LeBron James"	"football_ncaa"	"This is classic Lane Kiffin."
"0"	"We Should Have Seen This '90s Hair Trend Coming"	"lifestylebeauty"	"Flipped out ends or the "hair flip" is making a comeback. See how celebrities are wearing this retro hairstyle here."
"0"	"U.S.-born ISIS bride thinks she 'deserves a second chance'"	"newsus"	"Hoda Muthana says in an interview with NBC News that she worries for the future of her 2-year-old son, Adam, and wants to return home to Alabama."
"0"	"THEN AND NOW: What all your favorite '90s stars are doing today"	"celebrity"	"These heartthrobs and fan favorites made the 1990s one of the best decades of the century. Here's what they're up to now."
"1"	"'Joker' Takes R-Rated Box Office Record…and Possibly Another No. 1 Weekend"	"movienews"	"Warner Bros./Village Roadshow's "Joker" is going where no R-Rated film has gone before, passing the rating record set by "Deadpool 2" this weekend as it heads for $800 million worldwide. Along the way, it might also take one more No. 1 on the domestic weekend charts. Right now, "Joker" is in a virtual tie with Disney's "Maleficent: Mistress of Evil," with both films currently projected by industry estimates to earn $19 million this weekend...."
"0"	"36 Old Words We Use Today but with New Meanings"	"lifestyledidyouknow"	"Words sometimes have two meanings, as Led Zeppelin sang in "Stairway to Heaven.""
"0"	"Jennifer Lopez Debuted the Sleek Seasonal Bob You'll Want to Copy"	"lifestylecelebstyle"	"*calling my hair stylist*"
"1"	"This Percentage of Americans Have Never Left the State They Were Born"	"lifestylebuzz"	"For some, home really is the best place in the universe. The post This Percentage of Americans Have Never Left the State They Were Born appeared first on Reader's Digest."
"0"	"New Hampshire woman enlists candidates to send cards to troops"	"newsus"	"The Military Holiday Card Challenge collects tens of thousands of well-wishes for service members around the world"
"1"	"Uber CEO's defense of Saudi murder sparks calls for boycott"	"finance-companies"	"Uber Technologies Inc. Chief Executive Officer Dara Khosrowshahi said in an interview on the television show "Axios on HBO" that the murder of journalist Jamal Khashoggi was "a mistake" by the Saudi Arabian government, and compared it to Uber's accident with a self-driving car that killed a woman."
"0"	"Roommate, her boyfriend charged in death of missing Atlanta student"	"newscrime"	"Missing Atlanta student Alexis Crawford was found dead."
"0"	"31 Award-Winning Pictures That Elevate The Wedding Photography Game"	"lifestylebuzz"	"The best wedding photography makes you feel something inside: a silly shotmakes you laugh, a love-filled snap make you smile and an emotional one tugsat your heartstrings. Fearless Photographers, a website that showcases the best in wedding photography, recently released its latest collection of top-notch images."
"0"	"Hate crimes remain at heightened levels, FBI report finds"	"newsus"	"The number of hate crime incidents reported to the FBI last year remain at the heightened levels they surged to in 2017, according to statistics released Tuesday by the bureau."
"0"	"Chick-fil-A's Peppermint Chocolate Chip Milkshake Is Finally Back For The Holidays"	"restaurantsandnews"	"Is it too cold for milkshakes?"
"0"	"Groom Makes The Most Heartfelt Vows To His 9-Year-Old Stepdaughter"	"lifestylebuzz"	"Jimmy Gisondi made not one, but two sets of vows on his wedding day: first to his new wife, Kelsea, then to his new stepdaughter, Olivia."
"1"	"Leonard Fournette turns charming video into brutal roast of Blake Bortles"	"football_nfl"	"Blake Bortles and one lucky Jaguars fan have one thing in common."
"0"	"19 hysterical winners from this year's Comedy Wildlife Photography Awards"	"lifestylebuzz"	"The annual Comedy Wildlife Photography Awards compile the most hilariously candid photos of animals in the wild for a cause."
"0"	"Matthew Stafford won't play vs. Bears because of fractured bones in back"	"football_nfl"	"Detroit Lions QB Matthew Stafford had the second-longest starting streak among QBs at 136 consecutive games, a streak that started in 2011."
"0"	"We tried every single appetizer at Olive Garden and ranked them from worst to best"	"restaurantsandnews"	"We ordered the entire starter menu from the popular Italian-American chain and rated them based on taste, shareability, and overall value."
"0"	"Robert Freeman, Beatles Album Cover Photographer, Dies at 82"	"musicnews"	"Paul McCartney said Freeman "was one of our favorite photographers during the Beatles years who came up with some of our most iconic album covers.""
"1"	"The son of a Chinese billionaire has been banned from flying first class, playing golf, buying property, or going clubbing"	"newsworld"	"Wang Sicong, the heir of Chinese real estate mogul Wang Jianlin's estimated $12.5 billion fortune, is said to have a personal debt of $21.6 million."
"0"	"Market timing and the importance of doing nothing"	"finance-saving-investing"	"Investors, as a whole, actually earn less than the funds that they invest in. Here's how to avoid that fate."
"0"	"Boomers Want to Stay Home. Senior Housing Now Faces a Budding Glut."	"finance-real-estate"	"The rise of technologies that help the elderly stay in their homes threatens to upend one of commercial real estate's biggest bets: Aging baby boomers will leave their residences in droves for senior housing."
"0"	"China's pork crisis is bigger than you think"	"markets"	"African swine fever in world's second largest economy has shaken global meat markets, reports Tanner Brown."
"0"	"NFL still a long way from calling London home"	"football_nfl"	"The league's international series has been a big success, but there are many logistical obstacles to putting a team there permanently."
"1"	"John Legend Gets Grilled by Chrissy Teigen, Reveals If He Would've Married Her Without a Prenup"	"tv-celebrity"	"John Legend and Chrissy Teigen are asking each other the hard questions."
"1"	"4 reasons you shouldn't max out your 401(k)"	"finance-saving-investing"	"Making high-dollar contributions to your 401(k) can cost you."
"0"	"Dog Learning to Talk By Using a Custom Soundboard to Speak: 'I'm in Constant Amazement'"	"lifestylebuzz"	"Stella the dog's owner, a speech-language pathologist, says the canine already knows 29 words and can form phrases"
"1"	"These YouTube Channels are Changing How We Learn to Cook"	"foodnews"	"Thanks to the video platform, it's easier than ever to master both simple and advanced techniques at home."
"0"	"Arby's tells parents that 'only well behaved children' are allowed"	"restaurantsandnews"	"A location of the fast-food chain said only those who remained seated and kept food on their trays would be welcome."
"0"	"The 6 Best Food Documentaries on Netflix Right Now"	"newstrends"	"Time to get streaming."
"1"	"Michelle Pfeiffer initially blamed herself after #MeToo moment: 'I should've known'"	"movies-celebrity"	"Michelle Pfeiffer is opening up about an uncomfortable and inappropriate moment with a "high-powered" industry person."
"0"	"In New York, Trump tells veterans "nation is forever in your debt""	"newspolitics"	"President Trump is the first sitting president to attend the New York City Veterans Day Parade"
"0"	"How To Avoid These 14 Home Renovation Horror Stories"	"finance-real-estate"	"Creating your dream home? Avoid these costly nightmares."
"0"	"The 24 Most Keto-Friendly Restaurants in America"	"restaurantsandnews"	"Instead of caving and ordering fettuccini alfredo, check out the menu at one of America's most keto-friendly restaurants."
"0"	"The Next-Gen Weed Cafe Making Cannabis Cuisine Classy"	"restaurantsandnews"	"Meet Andrea Drummer, the chef of the country's first-ever legal cannabis restaurant."
"1"	"The 'Whimpering' Terrorist Only Trump Seems to Have Heard"	"newspolitics"	"It was a vivid scene worthy of the ending of a Hollywood thriller, the image of a ruthless terrorist mastermind finally brought to justice "whimpering and crying and screaming all the way" to his death. But it may be no more true than a movie script."
"0"	"Why Everyone in the Royal Family Is Wearing a Red Poppy Pin This Week"	"lifestyleroyals"	"Why the Royal Family Wears Red Poppy Pins"
"0"	"The Volkspod VW Beetle Minibikes Are Part Creepy, Part Adorable"	"autosmotorcycles"	"The people's pods."
"0"	"I've had it with this former friend"	"lifestylefamily"	"Dear Miss Manners: How do I appropriately disengage from a friendship of 15 years? The person in question, one time too many, rudely intruded into both my home and my enjoyment with another friend. After bumping into my friend at an event, this person put her on the spot, grilled her for where and when we planned to get together, and then announced she would join us. And upon arriving at my home, she walked in without waiting to be greeted at..."
"0"	"Rape victim rejects judge's offer: $150,000 for her, reduced sentence for attacker"	"newscrime"	"A Louisiana judge asked a rape survivor if she would consider a $150,000 restitution payment from her attacker. She refused, saying the attack has left her "broken.""
"0"	"Pregnant Maren Morris Shares Sonogram Video of Her Baby Boy: 'I Got a Wave Today'"	"music-celebrity"	"Pregnant Maren Morris Shares Sonogram Video: 'I Got a Wave Today'"
"0"	"Ed Orgeron says viral video of postgame speech 'shouldn't happen'"	"football_ncaa"	"As for the content of the speech, Orgeron said it was an emotional moment in a family environment that was not meant for public consumption."
"0"	"2020 Democratic Voters Divided Down Demographic Lines"	"elections-2020-us"	"As Democratic voters assess their choices for the 2020 presidential nominee, they are dividing into clear groups by ideology, race and other personal qualities. As a result, three candidates are dominating the primary contest."
"1"	"The Next-Gen Weed Cafe Making Cannabis Cuisine Classy"	"restaurantsandnews"	"Meet Andrea Drummer, the chef of the country's first-ever legal cannabis restaurant."
"0"	"I Was A Psychic Phone Line Operator. Here's What Really Happened Behind The Scenes."	"voices"	"A phone psychic reveals the behind-the-scenes of the job."
"0"	"Jane Fonda Avoids Fifth Arrest While Protesting in D.C."	"tv-celebrity"	"This week, the actress was joined by Ben & Jerry's co-founders, Ben Cohen and Jerry Greenfield, among others, during her climate change demonstrations."
"0"	"Father of Atatiana Jefferson dies of heart attack, family spokesperson says"	"newsus"	"The father of Atatiana Jefferson, the black woman who was fatally shot by a Fort Worth police officer, died of a heart attack, a spokesperson said."
"0"	"Beathard hurt back trying to prepare 49ers defense for Wilson"	"football_nfl"	"Seattle Seahawks quarterback Russell Wilson is one of a kind. San Francisco 49ers backup C.J. Beathard found that out the hard way this week."
"1"	"Gina Rodriguez apologizes after using n-word in Instagram video"	"tv-celebrity"	"Gina Rodriguez was singing along to a Fugees song when she uttered the word."
"1"	"Miguel Cervantes' Wife Reveals Daughter, 3, 'Died in My Arms' After Entering Hospice Care"	"tv-celebrity"	"Miguel Cervantes' Wife Reveals Daughter 'Died in My Arms' After Hospice Care"
"0"	"The Last Days of Legal Cockfighting in Puerto Rico"	"newsus"	"Hiram Figueroa rears roosters to fight, a Puerto Rican tradition from the time of the Spanish colonists that he learned as a teenager half a century ago and later taught his son. Together, they exercise their birds, clip their feathers and give them delicate sponge baths."
"1"	"Dave Hyde: Here's why the Dolphins have become Vegas' least-favorite team"	"football_nfl"	"The Miami Dolphins are two-to-one favorites to remain winless this year. That seems right. "They've only got a few games left you think they could win," said Adam Burns, the head oddsmaker of the website sportsbetting.ag. They have one-to-three betting odds of winning the No. 1 draft pick in 2020. That seems right. "Especially since they just lost to Washington," Burns said. They're also a ..."
"0"	"15 states where poverty is worse than you might think"	"markets"	"Developed in 1963, the official poverty rate is based on pre-tax income thresholds related to the cost of a minimum food diet and the number of individuals who depend on that income."
"0"	"NFL Cheerleaders"	"football_nfl"	"NFL Cheerleaders"
"0"	"Eerie photos of an abandoned airport that hasn't been touched in 25 years"	"newsphotos"	"The airport in Abkhazia   a disputed region of Georgia   was built in the 1960s, but was abandoned after a violent war in the early 1900s."
"0"	"Hernandez: Anthony Davis' impact on LeBron James apparent even when he doesn't play"	"basketball_nba"	"Never was Anthony Davis' value to the Lakers as clear as it was Wednesday night at Staples Center. And Davis didn't play a minute. In a game he spent confined to the sidelines in street clothes, his influence was visible in LeBron James. Specifically, in how youthful the nearly 35-year-old James looked in the Lakers' second game in as many nights. With Davis sidelined by a troublesome right ..."
"0"	"Owner shocked after his 60s Porsche roadster gets stolen from classic car show in Pleasanton"	"autosnews"	"Since 1983, thousands of car lovers have come from all over to the Goodguys Rod & Custom Association shows, never dreaming their antique collector's items would be stolen."
"0"	"Fed likely to defy history with steady rates through elections"	"markets"	"Federal Reserve Chairman Jerome Powell is likely to signal again this week that monetary policy is on hold, buttressing the belief that he may steer clear of action through 2020."
"1"	"Carlos Correa lost his mind while saving Astros vs. Yankees in ALCS"	"baseball_mlb"	"Carlos Correa hit the game-winning home run in Game 2 of the ALCS, lifting the Astros over the Yankees to even the series. And he doesn't remember."
"1"	"Nevada gambling bosses move to bar Wynn from casino industry"	"finance-companies"	"The complaint filed Monday by the state's Gaming Control Board lists sexual misconduct allegations that have been lodged against the mogul since January 2018. The complaint asks Nevada's Gaming Commission, which acts on the board's recommendations and has final say on licensing, to fine Wynn and revoke his status as being found suitable to be licensed in the industry."
"0"	"Richest 1% of Americans Close to Surpassing Wealth of Middle Class"	"newsus"	"The U.S.'s historic economic expansion has so enriched one-percenters they now hold almost as much wealth as the middle- and upper-middle classes combined."
"1"	"You Can Get Free Taco Bell Next Week Here's How"	"foodnews"	"For one day only, you can get a free Taco Bell taco, thanks to the World Series. Even if you're not a baseball fan, you'll love this deal."
