"0"	"Matthew Stafford uncertain for Week 10"	"football_nfl"	"The Lions quarterback Matthew Stafford has not missed a start since the 2010 season but Week 10 is uncertain."
"0"	"Watch: Nick Bosa does the Dak Prescott hip routine in pregame warmups"	"football_nfl"	"Nick Bosa is a funny guy who enjoys messing around. That was evident on Monday night."
"1"	"The one restaurant you need to visit in every state"	"restaurantsandnews"	"These 51 restaurants best represent regional culture and cuisine, making them a must stop for any food lover."
"0"	"3 retirement numbers you absolutely need to know"	"finance-retirement"	"These numbers can be the key to a happy and comfortable retirement."
"0"	"Stars who've had more than one wedding with the same spouse"	"entertainment-celebrity"	"See which celebs exchanged vows with their significant others more than once."
"0"	"Michael Bennett on adjusting to Cowboys: After Patriots, learning any defense is easy"	"football_nfl"	"Michael Bennett has acclimated to playing on the Dallas Cowboys' defensive line after a midseason trade from the New England Patriots."
"0"	"The SoftBank Effect: How $100 Billion Left Workers in a Hole"	"finance-companies"	"For five years, Sunil Solankey, a retired captain in the Indian Army, had run the 20-room Four Sight Hotel in a New Delhi suburb. Business was steady, but he longed to make the establishment a destination for lucrative business travelers. Last year, a hospitality start-up called Oyo told Mr. Solankey that it would turn the Four Sight into a flagship hotel for corporate customers. It guaranteed him monthly payments whether the rooms were booked..."
"0"	"Evo Morales of Bolivia Accepts Asylum in Mexico"	"newsworld"	"Evo Morales, the former president of Bolivia who resigned under pressure from street protests and the military, was granted asylum in Mexico on Monday, departing from the country at a time when it is deeply polarized and leaderless."
"0"	"Pete Carroll praises "breakout game" from Jadeveon Clowney"	"football_nfl"	"Seahawks coach Pete Carroll says defensive end Jadeveon Clowney showed exactly why Seattle traded for him on Monday night. Clowney picked up a fumble and ran it in for a touchdown and had a sack and hit 49ers quarterback Jimmy Garoppolo five times on Monday night. Carroll loved it. "I think it's a breakout game. [more]""
"1"	"Winners, losers from Steelers' win over Dolphins on 'Monday Night Football'"	"football_nfl"	"The Steelers surged late in the second quarter and went into halftime down 14-10. Then, the second half belonged to the home team, and the Pittsburgh-friendly crowd went home satisfied after watching the Steelers win, 27-14."
"0"	"U.S. Supreme Court weighs Comcast appeal in Byron Allen racial bias lawsuit"	"newsus"	"U.S. Supreme Court weighs Comcast appeal in Byron Allen racial bias lawsuit"
"0"	"Subway gets into bitter battle with store owners"	"finance-companies"	"Subway, once the most successful fast-food company in America, has had some tough years as revenue has declined and the number of Subway locations has fallen."
"1"	"60 Clever Uses for Salt That Don't Involve Cooking"	"lifestylehomeandgarden"	"From relieving rashes to removing stains to restoring household items to their original luster, salt does more than just season food. The post 60 Clever Uses for Salt That Don't Involve Cooking appeared first on Reader's Digest."
"1"	"Mama June enters plea in cocaine case..."	"tv-celebrity"	"Mama June was not present at the courthouse, but her lawyer entered a not guilty plea."
"0"	"Jimmy Garoppolo: OT loss can be a "reality check""	"football_nfl"	"Jimmy Garoppolo likes things consistent, and the 49ers have been. But on a night when his starting tackles were back on the field, he was without his favorite targets in the passing game, and he turned in one of his worst performances of the season, with three turnovers in an overtime loss to the Seahawks. [more]"
"1"	"Report: Mariota, Winston 'likely' done as 'franchise leaders'"	"football_nfl"	"Marcus Mariota and Jameis Winston are not only on the way out within their organizations; they're no longer seen as potential franchise passers."
"0"	"San Francisco's new DA pledges not to prosecute public urination, other quality-of-life-crimes"	"newsus"	"San Francisco's newly elected district attorney has promised to not prosecute public urination and other quality-of-life crimes that have plagued the highly-priced Bay Area amid a crippling homelessness crisis affecting urban communities across California."
"0"	"4 reasons you shouldn't max out your 401(k)"	"finance-saving-investing"	"Making high-dollar contributions to your 401(k) can cost you."
"0"	"I ordered clothes from those cheap online stores, and I'm not sold"	"voices"	"As an avid brick-and-mortar shopper, my eyes were opened when I tried an $8 formal dress, a $4 blouse, and other clothes for less than $10."
"0"	"Malik McDowell sentenced to 11 months in jail"	"football_nfl"	"Free agent defensive lineman Malik McDowell was sentenced to 11 months in jail and three years of probation Wednesday after pleading guilty to a series of crimes earlier this year in Michigan, Brady Henderson of ESPN reports. McDowell never played a down in the NFL. After the Seahawks drafted him 35th overall in 2017, McDowell [more]"
"0"	"Ex-DII walk-on worked at potato chip factory before Raiders"	"football_nfl"	"He paid $80 for a CFL tryout that turned into a three-year stint with the Hampton Tiger-Cats before signing with the NFL's New Orleans Saints in 2016."
"0"	"Joanna Gaines's Second Magnolia Cookbook Is Officially Available For Preorder"	"foodnews"	"Oh, happy day!"
"0"	"No bulletproof vests and poor pay: Rural police struggle to recruit new officers"	"newsus"	"Attracting recruits to work for rural police departments is increasingly difficult, especially as most new officers choose to work in better staffed and better paying urban areas."
"1"	"If You Don't Eat a Banana Every Day, This Might Convince You to Start"	"nutrition"	"An apple a day keeps the doctor away? Not so much. Try this fruit, instead."
"0"	"Timberwolves beat Pistons 120-114, spoiling Griffin's return"	"basketball_nba"	"DETROIT (AP)   The Minnesota Timberwolves shot an abysmal 6 of 45 from 3-point range in a loss to Denver over the weekend. That evened out in a hurry against Detroit. Andrew Wiggins scored 33 points, and Minnesota spoiled Blake Griffin's return Monday night, beating the Pistons 120-114. The Timberwolves shot 8 of 10 from beyond the arc in the first quarter to take a 15-point lead, and they held Detroit at bay after that. "We talked this morning...""
"0"	"Chuck Woolery: Supporting Trump 'pretty much destroyed my career'"	"tv-celebrity"	"Supporting President Trump and taking a conservative stance in public ruined Chuck Woolery's career and got him shadow-banned from Twitter, said the former game show host on "Fox & Friends," Wednesday."
"0"	"Alexis Crawford: Clark Atlanta student filed a police report on unwanted kissing before she vanished"	"newscrime"	"A Clark Atlanta University student who was found dead in a park had filed a police report describing unwanted kissing and touching days before she went missing, authorities said."
"1"	"Marlboro Man Bob Norris dies at 90, having reportedly never been a smoker"	"tv-celebrity"	"Robert "Bob" Norris, who played the iconic Marlboro Man for more than a decade in the '60s, has died at his Colorado ranch at 90. Norris landed the high-profile ad campaign for the Philip Morris cigarette brand by happenstance, as his son, Bobby Norris, told the local CBS affiliate, KKTV."
"0"	"Widow Sues Truth Aquatics Owner In Conception Boat Fire That Killed 34"	"newsus"	"The widow of a man who died in when a dive boat caught fire off the Santa Barbara coast and left 34 people dead is suing the vessel's owners."
"1"	"Rachael Ray finally opens restaurant with no physical location"	"foodnews"	"Rachael Ray is the anomaly among TV celebrity chefs in that she's never opened a restaurant. Fans have asked for it, but Ray says it's just never been in the cards. Starting today, though, you can eat food designed by Rachael Ray… just not in an actual restaurant."
"0"	"My Third Husband Is 102 Years Old. Here's What Our Marriage Is Like."	"voices"	"When I was 65 years old, I married a man 25 years my senior. This was thethird marriage for both of us, and he was almost 90. Mutual friends introducedus ― his best friend was married to my best friend ― because we were bothwidows, and apparently I needed more of a social life.It started out innocently as two friends hanging out. He liked to take me outto fancy Los Angeles restaurants. He had his handyman fix everything for me,and he brought his..."
"1"	"The stock market keeps setting new highs in a rally no one saw coming"	"newsus"	"Of the 17 forecasters that CNBC tracks for S&P 500 price, just three have targets that are above where the broad-market index traded Monday."
"0"	"Tom Brady says he is not expecting Rob Gronkowski to return"	"football_nfl"	"Brady addressed the rumor that never seems to end."
"1"	"Chrissy Teigen Gushes Over John Legend After He Misses His Flight to be With Her"	"music-celebrity"	"Grab the tissues! This is a story straight out of a romantic comedy."
"0"	"'One in a million' deer captured on camera in Michigan woods"	"newsus"	"Retired Michigan lawmaker and amateur photographer Steven Lindberg took pictures of a deer. That deer had three antlers."
"1"	"Kissimmee team builds python sensors that could help Everglades snake hunters"	"newsus"	"As Donna Kalil tracks pythons in the Everglades, she uses skills refined over more than 250 swamp hunts in three years to capture the snakes. A team of researchers in Kissimmee hopes to add some high-tech options for python hunters like Kalil, including infrared cameras and perhaps even snake-seeking drones one day. The team has developed a sensor-based camera system that could more clearly reveal the Burmese pythons to hunters working to..."
"0"	"This is Chick-fil-A's most-ordered menu item"	"foodnews"	"There may be a lot of things you don't know about Chick-fil-A, but if there's one thing you definitely know about the fast food chain, it's that it has a massive following. Chick-fil-A is quickly growing and has become the third-most profitable chain restaurant in America. With millions of devoted fans and diners, we had to ask: What is Chick-fil-A's most popular menu item? 10 Ways Fast Food Chains Are Playing With Your Head The most-ordered..."
"0"	"Gwen Stefani Sets the Record Straight on That Diamond Ring at 2019 People's Choice Awards"	"music-celebrity"	"Gwen Stefani was spotted wearing a diamond ring on that finger during the 2019 People's Choice Awards. Hear what she had to say about the bling."
"0"	"Young homebuyers are vanishing from the US"	"finance-real-estate"	"Faced with higher property prices and piles of student debt, Americans are getting older and older before they buy a home."
"1"	"Tamron Hall says she 'never dealt' cocaine after reports say she confessed to doing so"	"tv-celebrity"	"Tamron Hall issued a statement in response to the Daily Mail reporting that she confessed to facilitating the sale of cocaine as a teenager."
"0"	"Justice Dept. rolls out new program to combat gun violence"	"newsus"	"MEMPHIS, Tenn. (AP)   Attorney General William Barr announced a new initiative Wednesday that would better enforce the U.S. gun background check system, coordinate state and federal gun cases and ensure prosecutors quickly update databases to show when a defendant can't possess a firearm because of mental health issues. The push, known as Project Guardian, was unveiled at a news conference in Memphis, Tennessee, alongside officials from the..."
"0"	"Snow crab sells for record price in Japan"	"foodnews"	"A "five shining star" snow crab was auctioned off in Tottori, Japan for a record-breaking 5 million yen ($46,000). wide."
"1"	"Landry: 'We're gonna win' vs. Patriots was not a guarantee"	"football_nfl"	"Browns WR Jarvis Landry said "we're gonna win" vs. the Patriots, but his statement was an indication of Cleveland's mindset rather than a guarantee."
"0"	"Why Jan. 2 will be the busiest day of the year for UPS"	"finance-companies"	"UPS expects online shoppers to return merchandise they've purchased at a record-setting rate during and after the holiday season fueled by increase use of ecommerce sites like Amazon, which empower customers to receive and send packages back to retailers all season long."
"0"	"I Never Imagined Being A Grandmother At 35. Here's How It Changed My Life."	"voices"	""She's a baby with a baby!" my mom joked to the cashier when I was 18. We wereshopping for maternity clothes for me, and looking back now, I guess I was ababy. But at the time I thought I had a plan.I met Larry when I was 16, working my first job at Red Lobster. I was ahostess and he worked in the kitchen. He was 20, kind and living in anapartment with friends. We started dating and then decided to get married onlya year later. My mom wanted us..."
"0"	"Hannah Brown on Whether She's Sworn Off Musicians After Dating Jed Wyatt (Exclusive)"	"tv-celebrity"	"The 'Bachelorette' was surrounded by plenty of eligible bachelors at Wednesday's CMA Awards."
"0"	"Meghan Markle and Prince Harry Won't Spend Christmas with Queen Elizabeth at Sandringham This Year"	"lifestyleroyals"	"They'll hang out with baby Archie and Meghan's mother, Doria Ragland, instead."
"0"	"Matthew Koma's New Tattoo for His Kids Will Melt Your Heart"	"tv-celebrity"	"Matthew Koma's New Tattoo for His Kids Will Melt Your Heart"
"0"	"691,145 Californians left last year: What state did they go to?"	"finance-real-estate"	"Look at the comings and goings as a ratio of ins to outs. Tiny Idaho wins this race with 497 arrivals from the Golden State for every 100 former Gem State residents who moved to California."
"0"	"Ford v Ferrari: the real story"	"autosnews"	"The film about the epic Le Mans rivalry promises to be a must for car fans - and this is the real story behind it"
"0"	"My Immigrant Parents Wanted A Better Life For Me. This Is Why I Chose My Path Over Theirs."	"voices"	"My father's family left Greece and emigrated to the United States when he wasa teenager. As many come to learn when pursuing the American dream, it wasn'tall rainbows and white picket fences. My grandparents, who didn't speakEnglish at the time, struggled to adjust to their new life far from friendsand family. While they spent 12 to 14 hours a day working toward the betterlife that they had dreamed of, my dad skipped out on his high school..."
"0"	"Top storylines for Week 11 in the NFL"	"football_nfl"	"We're heading toward crunch time of the NFL season and Week 11 has some huge games on the schedule."
"0"	"Broncos claim CB Cyrus Jones, waive CB Coty Sensabaugh"	"football_nfl"	"The Broncos have claimed cornerback Cyrus Jones off waivers from the Ravens and are waiving fellow defensive back, Coty Sensabaugh even though he had some great career highlights."
"1"	"Chrissy Teigen Apologizes for Her 'Tone Deaf' Joke About Her Mom"	"tv-celebrity"	""I'm sorry and I will do better to not be such an a------.""
"0"	"A master suite with an 'open-concept' bathroom that has no doors   or privacy   is asking for $1,200/month in rent"	"lifestylebuzz"	"People took to Twitter to share confusion about an "open-concept" bathroom featured in a Facebook rental listing."
"0"	"Chris Paul feels he got 'stabbed in the back' with trade from Rockets"	"basketball_nba"	"Paul has been traded three times in his career (four if you include the Lakers veto)."
"1"	"Former NBA first-round pick Jim Farmer arrested in sex sting operation"	"basketball_nba"	"Farmer, 55, was booked for trafficking a person for a commercial sex act."
"0"	"This Veteran Found His Long-Lost Love After 75 Years"	"causes"	"Grab a tissue. This romance between a World War II veteran and his long-lost love spans decades and proves that time can't erase true love. The post This Veteran Found His Long-Lost Love After 75 Years appeared first on Reader's Digest."
"0"	"Can Patrick Mahomes climb back into the MVP race?"	"football_nfl"	"Not long ago, Chiefs quarterback Patrick Mahomes was the odds-on favorite to win the league MVP award. Now, after missing two games and more than half of a third, his candidacy faces an uphill climb. But he'll be back on Sunday at Tennessee, and despite the time he has missed Mahomes still has a chance [more]"
"1"	"'Bad on them, bad on the brand': How Dak Prescott, Daniel Jones view MNF microphone"	"football_nfl"	"The issue with ESPN's sound bite was not Sam Darnold's sentiment but the NFL's CBA aims to protect players from potentially embarrassing footage."
"1"	"Halle Berry, 53, flaunts chiseled abs on Instagram: See the pic"	"movies-celebrity"	"Halle Berry is trying to motivate her social media followers with her incredible abs."
"1"	"Detroit Lions' Darius Slay: 'Nobody's safe' after Quandre Diggs trade"	"football_nfl"	"A two-time Pro Bowler, Darius Slay did not directly answer when asked Thursday whether he wants to stay with the Detroit Lions at the trade deadline"
"0"	"Miley Cyrus Undergoes Vocal Cord Surgery, Will Require Weeks of Silence to Recover: Sources"	"music-celebrity"	"Miley Cyrus Undergoes Vocal Cord Surgery: Sources"
"0"	"The cost to become a US citizen is going up 61 percent"	"markets"	"Critics call the proposed $1,170 application cost "an unprecedented weaponization of government fees.""
"1"	"Attorney for implicated Angels employee: Tyler Skaggs 'an addict who overdosed'"	"baseball_mlb"	"The attorney for an Angels employee who reportedly provided opioids to Tyler Skaggs described the pitcher as "an addict who overdosed." Eric Kay, who has worked for the team in media relations for 24 years, engaged Newport Beach criminal defense attorney Michael Molfetta nearly two months ago out of concern that he might be made a "scapegoat " in the investigation into the ..."
"0"	"2019 People's Choice Awards fashion hits and misses"	"awards"	"See all the best and worst dressed stars at the 2019 People's Choice Awards."
"1"	"4 takeaways from the Seahawks' wild, overtime win over the 49ers"	"football_nfl"	"If the NFC championship is a rematch of this Monday Night Football game, we're in for a treat. The Seattle Seahawks' 27-24 overtime win over the San Francisco 49ers in Week 10 was wild, messy and exciting. It may have been the most fun game of the season."
"0"	"The 102-Year-Old Hawaiian Hotel Where Pork Chops Are King"	"restaurantsandnews"	""The pork chops are so ono here," said Kaniela "Danny" Akaka. He removed a straw paniolo hat as his wife Anna presented me with an orchid lei in the lobby at Manago Hotel. Danny always gets the pork chops. She prefers the fried opelu. I wanted the butterfish. We've been ordering the same dinner in the cherry wood paneled dining room of this guesthouse for the past two decades. It's a regular gathering place for friends and family, called ohana..."
"0"	"Fox legal analyst Napolitano emerges as Trump critic"	"newsus"	"NEW YORK (AP)   More than two decades into his career as a commentator at Fox News Channel, Andrew Napolitano reached a milestone of sorts when he was called a "fool" on his own network. Not to his face, of course. But Tucker Carlson guest Joseph diGenova's dismissal of Napolitano for saying that soliciting campaign aid from a foreign government is against the law illustrates the awkward place that the former New Jersey Superior Court judge..."
"0"	"Starbucks unveils its 2019 holiday cups"	"finance-companies"	"The cups will be available starting Thursday, November 7, and the company is encouraging fans to get the reusable one"
"0"	"Kristen Stewart is planning to propose to her girlfriend, plus more celeb love life news for early November 2019"	"celebrity"	"Keanu Reeves and girlfriend go public, Kylie Jenner's relationship with Drake turns romantic, Reba McEntire, Nina Dobrev and Ian Ziering end relationships."
"1"	"Eight corporate jets: What is this, the '80s?"	"finance-companies"	"Activist investor D.E. Shaw puts Emerson Electric's crusty corporate habits on display. It's not a good look."
"1"	"Duchess Meghan Describes 'Really Challenging' Life as New Royal: I'm Not OK"	"lifestyleroyals"	"Duchess Meghan Describes 'Really Challenging' Life as New Royal: I'm Not OK"
"0"	"Greg Hardy loses UFC fight in Moscow"	"mma"	"Former Panthers and Cowboys defensive end Greg Hardy had another UFC fight today in Moscow, and it did not go well. Hardy was matched up with one of the UFC's top heavyweights, the Russian Alexander Volkov, and Volkov picked him apart for an easy victory. It was a unanimous decision, with all three judges awarding [more]"
"0"	"Photos of Celebrities at the Airport Are Here to Inspire Your Holiday Travel Style"	"lifestylecelebstyle"	"Even the rich and famous aren't spared the most annoying place in the world: the airport."
"1"	"Cold weather: 70% of the country will experience freezing temperatures this week"	"weathertopstories"	"Roughly 70% of the US will experience freezing temperatures this week as an Arctic blast hits two thirds of the country. Over 240 million people are under winter warnings, watches and advisories."
"0"	"The Geno Smith coin toss conspiracy is the dumbest thing in Seahawks' win over 49ers"	"football_nfl"	"Did Geno Smith say "heads" or "tails" in the coin flip for overtime?"
"0"	"Week in celebrity photos for Nov. 11-15, 2019"	"celebrity"	"Week in celebrity photos for Nov. 11-15, 2019"
"1"	"Writers resign from Deadspin en masse in wake of 'stick to sports' demand"	"newsus"	"The site's future is uncertain after a number of writers left following new editorial mandates."
"1"	"Pot or not? Busts highlight growing confusion over hemp"	"newsus"	"NEW YORK (AP)   The CBD craze might be leaving the war on drugs a bit dazed and confused. The extract that's been showing up in everything from candy to coffee is legally derived from hemp plants, which look and smell an awful lot like that other cannabis   marijuana. They're so similar, police officers and the field tests they use on suspected drugs sometimes can't tell the difference. Case in point, New York City police boasted on social media..."
"0"	"Dean Foods files for bankruptcy"	"finance-companies"	"Dean Foods, America's largest milk producer, is filing for bankruptcy."
"0"	"Juul is laying off 650 people in a $1 billion cost-cutting plan"	"finance-companies"	"Juul on Tuesday announced an update to its major restructuring effort that includes layoffs and deep cost cutting. It's the latest development in a series of shakeups since September as Juul attempts to revamp its strategy in the face of heightened scrutiny of vaping."
"0"	"Here's the Very Best of Oprah's Favorite Things"	"shop-holidays"	"This holiday season, we're thankful for Oprah."
"0"	"3 awful reasons to take Social Security benefits at 65"	"finance-retirement"	"If these are the reasons you're claiming benefits at 65, you may want to rethink that decision."
"0"	"Actress Accuses Roman Polanski of Raping Her in 1975"	"movies-celebrity"	"'Devil Fish' actor Valentine Monnier accuses the 'Officer and a Spy' director of violently raping her in 1975 in a Friday story in Le Parisien."
"1"	"Discover the abandoned circus-themed house cloaked in secrets"	"lifestyledidyouknow"	"Hidden deep in a valley in New York's Catskill Mountains, this abandoned circus-themed house is the stuff of nightmares. We can just imagine Pennywise, the terrifying clown from It, roaming its haunting halls. Intrepid urban explorer and photographer Bryan Sansivero has captured the mansion, its outbuildings and grounds in all their eerie glory. Are you brave enough to take a tour?"
"0"	"Brian Hoyer to start as Colts rule out Jacoby Brissett"	"football_nfl"	"The Colts will be without quarterback Jacoby Brissett on Sunday. Brissett was ruled out today, the Colts announced."
"0"	"I ate one of Meghan Markle's favorite foods from Toronto here's what I thought"	"foodnews"	"The food at Terroni was good and the prices were surprisingly affordable, but the service was disappointing."
"1"	"Dean McDermott: 'Monogamy Is Hard' After 13-Year Marriage to Tori Spelling"	"tv-celebrity"	"Dean McDermott: 'Monogamy Is Hard' After 13-Year Marriage to Tori Spelling"
"0"	"Obamacare early sign-ups plunge as Trump-backed lawsuit challenges constitutionality"	"finance-healthcare"	"ACA open enrollment began Nov. 1 and will run until Dec. 15 for most states."
"1"	"Stephen Curry calls out Michael Jordan for being a 'hater'"	"sports_news"	"While the opinion of arguably the greatest NBA player of all time is certainly noteworthy, most people disagree with Jordan."
"0"	"13 low-paying jobs that actually pay off in retirement"	"finance-career"	"These jobs tend to offer generous retirement plans."
"0"	"I'm extremely introverted, but I challenged myself to be more outgoing for a week, and it made me feel more confident"	"voices"	"I went from not speaking to anyone for an entire day to seeing movies by myself, chatting up strangers, and correcting my coffee order."
"1"	"A Michelin-starred chef is crafting $3 lunches for thousands of public school kids"	"foodnews"	"Dan Giusti was chef at the world's "best restaurant" where people spend over $350 to dine. Now, he feeds kids beef enchiladas and jelly sandwiches."
"0"	"Charlize Theron Just Ditched Her Bowl Cut for a Bright Blonde Pixie"	"lifestylecelebstyle"	"She looks like a whole new woman...again!"
"0"	"The 22 Wildest Celebrity Hair Transformations of the Last Decade"	"lifestylebeauty"	"The 2010s have seen a ton of celebrity hair changes, but who's had the best hair transformations of the decade?"
"0"	"17 photos that show the ugly truth of living in a tiny house"	"lifestylehomeandgarden"	"From cramped lofts that are hard to access to small appliances, this is what it's really like to live in a tiny house."
