"0"	"Family of woman missing since 2006 refocuses search after new tip"	"newsus"	"Orange County police searched Fischer Lake in West Orange County, but did not find anything."
"1"	"Ian Ziering and Wife Erin Split After 9 Years of Marriage"	"tv-celebrity"	"The 'BH90210' actor and his estranged wife both addressed their split on Instagram on Thursday."
"0"	"Thanksgiving Recipe Searches Reveal America's Holiday Tastes"	"foodnews"	"Cooks across America are already planning Thanksgiving menus, according to an analysis of Google Trends search terms."
"1"	"I stayed in one of Italy's ghost towns that's selling off homes for $1, and I was treated like royalty"	"traveltripideas"	"I stayed in Sambuca, the charming Sicilian town which has received the most widespread media coverage for its $1 housing scheme."
"0"	"Here Are the Biggest Deals We're Anticipating for Black Friday"	"shop-holidays"	"The Black Friday deals for 2019 have already begun leaking out. Get a sneak peek at what to expect from popular retailers like Costco, Walmart, and Best Buy. Browse our guide and use it to plan your attack for the biggest shopping event of the year."
"0"	"Emilia Clarke Stunned in a Cut-Out Dress at the 'Last Christmas' Premiere"	"lifestylecelebstyle"	"Clarke finished the look with a sleek ponytail and minimal heels."
"0"	"'Lots of Tears!' Teresa Giudice Details Reuniting With Husband Joe in Italy"	"tv-celebrity"	"'Lots of Tears!' Teresa Giudice Details Reuniting With Husband Joe in Italy"
"0"	"Restaurants Are Dealing With an Avalanche of Special Requests. One Chef Has Had Enough."	"restaurantsandnews"	"It's not all about you."
"0"	"I went to Peter Luger after it received zero stars from New York Times"	"restaurantsandnews"	"The burger was so juicy I had to wipe my fingers after every bite. And everyone from regulars to tourists couldn't stop singing Peter Luger's praises."
"0"	"55 Restaurants That Serve an Amazing Thanksgiving Dinner"	"restaurantsandnews"	"If you love Thanksgiving and the food but don't love the cooking or cleanup, get an easy gourmet celebration at one of these restaurants nationwide. Many feasts feature local twists on old favorites, such as Turducken gumbo and Cajun fried turkey in New Orleans and even vegan-friendly offerings in Seattle."
"1"	"Michael Bennett on adjusting to Cowboys: After Patriots, learning any defense is easy"	"football_nfl"	"Michael Bennett has acclimated to playing on the Dallas Cowboys' defensive line after a midseason trade from the New England Patriots."
"0"	"As L.A. ports automate, some workers are cheering on the robots"	"markets"	"The arrival of robots at the nation's largest marine terminal, a 484-acre facility run by Danish conglomerate A.P. Moller-Maersk, is exposing a stark economic divide between two sets of Southern California workers."
"0"	"See what your favorite stars look like without makeup"	"celebrity"	"They get glammed up for red carpet events, but in their downtime, celebrities from Katie Holmes to Emma Stone prefer to let their natural beauty take center stage. Yes, just like you, stars do occasionally allow the world to see their foundation-free skin and mascara-less lashes to celebrate their freckles, little imperfections and inside-out glow, usually by way of the makeup-free selfie. They even sometimes celebrate their bare-facedness with hashtags like #wokeuplikethis and #nofilter. To see these stars without makeup   including Kate Hudson, Kim Kardashian, Gigi Hadid and all the stars you see above   check out the gallery now. For the latest beauty and style trends subscribe to our new podcast 'Get Tressed With Us' below! 34 Of Your Favorite Celebrities With Or Without Makeup!"
"1"	"Mint Chocolate Twinkies Are Here for the Holidays, and They've Already Been Spotted in Stores!"	"foodnews"	"Mint Chocolate Twinkies are a sweet, minty twist on the classic treat we all can't get enough of."
"0"	"Abandoned 'unicorn' puppy has a tail on its head"	"animals"	"Abandoned 'unicorn' puppy has a tail on its head"
"0"	"NFL mock draft 2020: Where will Tua Tagovailoa, Joe Burrow, other Alabama, LSU players land?"	"football_nfl"	"In our latest NFL mock draft for 2020, eight players from Alabama and LSU, including the star QBs, land in the first round."
"0"	"Report: Cam Newton considering surgery for injured foot"	"football_nfl"	"Panthers quarterback Cam Newton has been placed on injured reserve. Now that he's done for the season, it sounds like he may be reconsidering how he attacks his recovery. According to Ian Rapoport at NFL Network, Newton is now considering surgery for his left foot. "Almost certainly out for the season, Newton is now considering surgery to repair the Lisfranc injury in his foot, sources say. The procedure, which would come in the next week or...""
"0"	"Stella McCartney Deleted a Meghan Markle Instagram Post After Followers Called Her Out"	"lifestyleroyals"	"Stella McCartney deleted a photo of Meghan Markle on Remembrance Day following backlash from Instagram followers."
"0"	"10 of the best fast-food taco chains across the US"	"newstrends"	"Fast-food chains like Del Taco and Taco John's serve quick and reliable tacos for an affordable price."
"0"	"Google Is Collecting Personal Health Data Of Millions of People"	"finance-healthcare"	"Google is teaming with one of the country's largest health-care systems on an ambitious project named "Project Nightingale" to collect and crunch detailed health information of millions of Americans across 21 states."
"0"	"Rep. Ilhan Omar is accused of 'dog whistle' anti-Semitism after she posts tweet implying billionaire businessman Leon Cooperman is only supporting Michael Bloomberg's presidential run because he is Jewish"	"newspolitics"	"Rep. Ilhan Omar came under fire on Saturday for sharing a tweet revealing billionaire Leon Cooperman will back Michael Bloomberg's 2020 bid and allegedly implying it's because he is Jewish."
"0"	"The healthiest fast food option at every well-known chain"	"restaurantsandnews"	"Did you know a White Castle Original Slider has fewer calories than a chocolate milkshake? We all crave fast food every now and again, but some menu options are undeniably healthier than others. Here we look at every major fast food chain and point out the surprising main meal menu items that will help you cut the calories."
"0"	"Demi Lovato Goes Instagram Official With Boyfriend Austin Wilson: See Their Sweet Synchronized Posts"	"music-celebrity"	"This is the singer's first social media-official romance since her July 2018 overdose."
"0"	"ICE is ignoring California's ban on private immigrant detention centers"	"newsus"	"LOS ANGELES - Last month, California became the first state to kick out privately run immigrant detention centers. A new law that also bans private prisons prohibits new contracts or changes to existing ones after Jan. 1 and phases out existing detention facilities entirely by 2028. But on Oct. 16, five days after Gov. Gavin Newsom signed Assembly Bill 32 into law, U.S. Immigration and Customs ..."
"1"	"Popeyes mocks Chick-fil-A for National Sandwich Day blunder, reignites sandwich wars"	"foodnews"	"Popeyes is mocking Chick-fil-A as the chicken sandwich wars heat up once again before National Sandwich Day."
"0"	"Mexico makes arrests in massacre of American women, children: minister"	"newsworld"	"Mexico makes arrests in massacre of American women, children: minister"
"0"	"PG&E is offering $13.5 billion in compensation to wildfire victims"	"finance-companies"	"Bankrupt utility giant PG&E Corp. is offering $13.5 billion in compensation to the victims of wildfires sparked by its power lines as part of a restructuring plan, according to people with knowledge of the situation."
"1"	"Tiger Woods starts slow as Jason Day runs away with Japan Skins title with $210K"	"golf"	"Tiger Woods didn't have any issues with his knee."
"1"	"Bill Murray Applied To Work At An Airport P.F. Chang's And They're Totally Down To Hire Him"	"foodnews"	"Dude loves a lettuce wrap."
"0"	"Husband, 106, and wife, 105, are named world's oldest living couple"	"lifestylebuzz"	"John Henderson joked that that secret to their longevity could be never having kids."
"0"	"Wisconsin bus driver saves children wandering in snow, as deadly Arctic air mass grips US"	"newsgoodnews"	"As bitter cold took hold across the Midwest earlier this week, a sharp-eyed bus driver in Wisconsin was credited with helping rescue two children who were very underdressed for the weather conditions."
"0"	"2 White House officials say Mulvaney helped coordinate Ukraine pressure campaign"	"newspolitics"	"House Democrats on Friday released the closed-door testimony of Army. Lt. Col. Alexander Vindman, a White House official who raised alarms after the July 25 call."
"0"	"Winners, losers from Seahawks' wild overtime win over 49ers on 'Monday Night Football'"	"football_nfl"	"There were turnovers galore in this instant classic. Now the Seahawks are just one game behind the 49ers in the loss column, and there are no more undefeated teams in the NFL."
"1"	"Former Los Angeles police chief named interim in Chicago"	"newsus"	"CHICAGO (AP)   Chicago's mayor on Friday named former Los Angeles police Chief Charlie Beck to serve as Chicago's interim police superintendent, a day after the city's top police officer announced he is retiring. Mayor Lori Lightfoot said Beck was the perfect choice for the job leading the police force in the nation's third-largest city. She noted that he implemented many of the same reforms in Los Angeles that Chicago has undertaken in recent..."
"0"	"Hyatt is eliminating travel-sized plastic toiletries"	"travelnews"	"Hyatt is the latest international hotel brand to ditch travel-sized toiletries from its rooms, following Holiday Inn-owner InterContinental Group and Marriott International."
"0"	"NFL teams have a winning record when playing their backup QBs this year"	"football_nfl"	"It's a common refrain from NFL fans: If we lose our starting quarterback, we're screwed. But that isn't the case, at all. In fact, NFL teams actually have a winning record this season when forced to go to a backup because of an injury to their starter. So far this season, 35 games have been [more]"
"0"	"The 2019 NFL Season"	"football_nfl"	"The 2019 NFL Season"
"1"	"SNL just released every appearance of Bill Hader as Stefon ever"	"humor"	"Watch every SNL Stefon sketch featuring Bill Hader"
"1"	"Bears' Khalil Mack calls out Eagles C Jason Kelce's controversial tactics in offsides penalties"	"football_nfl"	"The Chicago Bears doomed themselves early in the first half in a 22-14 loss to the Philadelphia Eagles. While the Bears offense had a historically bad first half performance   netting just 9 total yards   the defense had its share of struggles with five pre-snap penalties in the first half against the Eagles. Bears outside linebacker Khalil Mack isn't one to point fingers for the defense's struggles, but when asked about those pre-snap..."
"1"	"'A passionate guy': Ex-NASCAR team owner found dead in Ohio River near Louisville"	"racing"	"Lonnie Troxell, of a racing team from 2000-2005 that competed in the NASCAR Craftsman Truck Series, was found floating in the Ohio River Tuesday."
"0"	"Lori Loughlin's 'Stress Is Only Mounting' Ahead of Pretrial Hearing"	"tv-celebrity"	"Lori Loughlin's 'Stress Is Only Mounting' Ahead of Pretrial Hearing"
"0"	"PEOPLE's Sexiest Men Alive: Still Sexy After All These Years"	"celebrity"	"PEOPLE's Sexiest Men Alive With Their Younger Selves"
"1"	"Russell Wilson credits 'incredible force' Jadeveon Clowney after wildest game of career"	"football_nfl"	"The Seahawks won a memorable game against the previously unbeaten 49ers, with QB Russell Wilson praising defensive star Jadeveon Clowney."
"0"	"Joanna Gaines reveals her family's favorite recipes in new cookbook"	"foodnews"	"The cookbook is available for pre-order on Amazon now."
"0"	"This is the country's least favorite flavor of Skittles"	"foodnews"	"Red reigns supreme."
"0"	"T-Mobile CEO John Legere in talks to take over top job at WeWork"	"finance-companies"	"T-Mobile and Sprint are hoping to complete their merger soon. But the man positioned to head that new company is in talks to lead another major undertaking: a rescue mission for WeWork."
"1"	"Chance the Rapper on 'SNL': 3 Sketches You Have to See"	"humor"	"If Saturday Night Live episodes were named like installments of Friends, this episode would be called "The One With The Giggles." With Chance the Rapper the biggest offender, everyone had a hard time keeping it together for the majority of the episode. That laughter was part of an overall shaggy episode that has its fair share of missed lines, reading flubs, missed camera shots, and prop issues. This didn't lead to a lack of laughter inside the..."
"0"	"Stop! Read This Guide Before You Buy an Air Fryer."	"tipsandtricks"	"Shopping for air fryers? Or maybe air fryer toaster ovens? Our air fryer buying guide will help you find the perfect appliance for your needs."
"0"	"Wild turkeys are terrorizing a town; MLB player calls on the New Jersey governor for help"	"newsus"	"Todd Frazier, MLB all-star, joined town residents sounding off about wild turkey terror. Now, they're asking New Jersey Gov. Phil Murphy for help."
"0"	"Mezcal vs. Tequila What Are the Differences?"	"foodnews"	"We spoke with a tequila afficionado to take a deeper dive into the mezcal vs. tequila debate. Find out the key differences here."
"0"	"Boeing stock soars: It still thinks 737 Max will fly next month"	"finance-top-stocks"	"Boeing still believes it can get permission before the end of this year to fly the 737 Max again."
"0"	"Police Don't Do a Good Job Tracking Hate Crimes. A New Report Calls on Congress to Take Action."	"newsus"	"A report made public Wednesday by the U.S. Commission on Civil Rights called on Congress to adopt legislation that would use funding to incentivize police departments across the country to produce annual accountings of hate crimes...."
"1"	"Viral video of churro vendor sparks major NYPD backlash"	"newscrime"	"A video has gone viral on Twitter after footage of a woman selling churros within a Brooklyn subway was arrested by NYPD. The video was shared on social media by Sofia Newman on Friday and the tweet read, "Tonight as I was leaving Broadway Junction, I saw three or four police officers (one of them was either a plainclothes cop or someone who worked at the station) gathered around a crying woman and her churro cart. Apparently, it's illegal to...""
"1"	"Dan Dakich suspended from ESPN's The Fan for not adhering to 'journalistic principles'"	"more_sports"	"Dan Dakich, the former IU player and coach-turned radio show host has been suspended from his afternoon sports talk show for this week."
"1"	"Watch: Kevin Harlan's call of streaking cat on 'MNF' is epic"	"football_nfl"	"This might legitimately be the best thing we've ever heard from Mr. Harlan."
"0"	"Long-term celebrity couples who won't get married"	"celebrity"	"These committed celeb couples have opted not to tie the knot."
"0"	"This Simple Hack Will Keep Spiders Out of Your House"	"lifestylesmartliving"	"It's chemical-free! The post This Simple Hack Will Keep Spiders Out of Your House appeared first on Reader's Digest."
"0"	"The 25 richest families in America"	"personalfinance"	"Stacker compiled a list of the 25 richest American families using 2019 data from Forbes. From winemakers to oil tycoons, find out which American families have a combined net worth of more than $721.5 billion."
"0"	"Piracy crackdown may be next front in streaming wars"	"finance-companies"	"Controlling user access to platforms (password sharing) will be a priority as major conglomerates bet on new direct-to-consumer digital services."
"0"	"Selena Gomez and Julia Michaels Share a Kiss Before Getting Matching Arrow Tattoos"	"music-celebrity"	"Selena Gomez and Julia Michaels Get Matching Arrow Tattoos"
"0"	"The News In Cartoons"	"newsopinion"	"News as seen through the eyes of the nation's editorial cartoonists."
"0"	"Seth Rogen, Seth MacFarlane Roast Charlize Theron During Bawdy American Cinematheque Ceremony"	"movies-celebrity"	"As Charlize Theron accepted the 33rd American Cinematheque honor at the Beverly Hilton on Friday night, the atmosphere more resembled a roast than a reverential evening celebrating the cinematic achievements of an Oscar winner. Presenters like Seth Rogen, Kristen Stewart and Seth MacFarlane shared bawdy jokes and reveals about what it's really like working with"
"1"	"Markazi: Ex-UCLA gymnast Katelyn Ohashi wonders if her viral moment could have been profitable"	"more_sports"	"Katelyn Ohashi was ice skating when her life changed. As the UCLA gymnast tried to relax at a rink last January, her phone would not stop buzzing. One notification from Twitter turned into hundreds within minutes. A video of her floor routine the previous night in Anaheim   a perfect 10   had gone viral; she was trending on Twitter. "I don't have my notifications on but I was getting all these ...""
"1"	"Charles Barkley savagely tells Klay Thompson the Warriors won't make the playoffs"	"basketball_nba"	"Charles Barkley lost all faith in the Warriors after watching one half against the Clippers."
"0"	"Missing California hiker found dead at top of glacier just weeks before baby was due"	"newsus"	"A missing hiker from Huntington Beach California was found dead on Thursday at the top of the Darwin glacier in the Inyo National Forest."
"1"	"JFK is America's largest mail room. Here's how customs searches 1 million mail packages a day for drugs and counterfeit goods."	"video"	"Just like arriving international passengers have to go through customs, so does international mail. And Customs & Border Protection searches all of them for illegal goods like counterfeit items and drugs. Take a peek inside America's largest mail room."
"0"	"McDonald's Is Going to Add Chicken to Its Breakfast Menu in 2020"	"foodnews"	"Here's the rumor from McDonald's HQ. The post McDonald's Plans to Add Chicken to Its Breakfast Menu in 2020 appeared first on Taste of Home."
"0"	"65 Best Fall Soups That Will Warm You and Your Family Up All Season Long"	"recipes"	"These hearty bowls are the perfect companion for a rainy fall night."
"0"	"Answers remain elusive in Virginia Beach shooting rampage"	"newsus"	"Independent auditor's report says gunman didn't display warning signs."
"1"	"Trent Richardson headlines list of surprising names not taken in XFL Draft"	"football_nfl"	"The XFL Draft concluded with no teams taking a chance on Trent Richardson despite his success in the AAF."
"0"	"Kaley Cuoco Says Having 'Separate Lives' Has Helped Her Marriage to Karl Cook"	"tv-celebrity"	"Kaley Cuoco and husband Karl Cook couldn't be a more perfect match."
"0"	"'Self-Partnered' Is a Meaningless New Way to Say You're Single"	"lifestylerelationships"	"Emma Watson describes herself as "self-partnered," but do single people really need a new word?"
"0"	"97-year-old WWII veteran takes ride in B-17 bomber for Veteran's Day"	"newsus"	"A World War II veteran celebrated Veteran's Day by taking a flight to yesterday -- in an aircraft that first saw combat at the time of his service."
"0"	"American Outdoor to split into two firms, separating its gun business"	"finance-companies"	"American Outdoor Brands Corp. said it will split into two publicly traded companies, one focused on firearms and the other on outdoor products, in an effort to reverse a stock-market decline amid rising pressure for tougher U.S. gun restrictions."
"1"	"How To Open a Can Without a Can Opener"	"tipsandtricks"	"All it takes is a metal spoon and some elbow grease."
"0"	"Do you have the right to recline your airline airplane seat? No, and here's why"	"traveltips"	"If you're seated in Economy, then reclining your airline seat is unacceptable. It's rude   and it's wrong, since we're officially out of space."
"1"	"Yankees plan to go all relievers in ALCS Game 4 vs. Astros"	"baseball_mlb"	"The Yankees plan to use their bullpen against Houston from the start in Game 4 of the AL Championship Series. With the best-of-seven series tied 1-1, Luis Severino starts Game 3 on Tuesday against Gerrit Cole."
"1"	"Frustrated Antonio Brown has active morning on Twitter"	"football_nfl"	"Receiver Antonio Brown continues to wait for his next opportunity, and he continues to be justifiably frustrated by the fact that the NFL's slow-moving investigation is essentially keeping Brown suspended without pay."
"0"	"A look inside Starbucks' newest Reserve Roastery in Chicago"	"restaurantsandnews"	"Starbucks will open its sixth roastery on Friday in Chicago."
"1"	"Deadly Arctic blast breaks records set more than 100 years ago"	"weathertopstories"	"It was literally freezing in Florida and Alabama and parts of Maine, Michigan and New York were digging out a foot of snow. Blame an Arctic air mass."
"1"	"Do not try this at home: How to turn $3,000 into $1.7 million"	"finance-saving-investing"	"Reddit's Wall Street Bets group learned a valuable lesson in responsible investing this week and, after years of encouraging and celebrating extreme risk-taking, the crew has finally embraced a more conservative approach. Just kidding. YOLO!"
"0"	"A teen received a response to a message in a bottle he wrote 9 years ago after it traveled over 3,000 miles"	"lifestylebuzz"	"The bottle, which was placed into the ocean on a beach in Rockport, Massachusetts, was found off the coast of France."
"0"	"Stars   They're Just Like Us!"	"celebrity"	"Stars   They're Just Like Us!"
"1"	"Felicity Huffman Released From Prison Before End of 14-Day Sentence"	"tv-celebrity"	"The actress served 11 days of her two-week sentence."
"1"	"Joe Giudice's Shocking Transformation Revealed in First Photo Since ICE Release"	"tv-celebrity"	"Joe Giudice's Shocking Transformation Revealed in First Photo Since ICE Release"
"1"	"5 ways to get free access to services like Netflix, HBO, Hulu, Disney Plus, and Apple TV Plus"	"tv-gallery"	"With the streaming market growing increasingly difficult to navigate, telecom and tech companies are offering free streaming to sweeten their deals."
"1"	"Feds take down the world's 'largest dark web child porn marketplace'"	"newsworld"	"Prosecutors say the vast on-line store was run by Jong Woo Son, currently serving a prison sentence in South Korea on charges related to child pornography."
"0"	"Emma Stone transforms into a young Cruella de Vil as she ditches the character's iconic black and white hair for a brunette wig on the set of Disney's live action film in London"	"movienews"	"The La La Land star, 31, looked every inch the villainess as she ditched her fiery red locks for a brunette wig and silk paisley patterned headscarf."
"0"	"Steph Curry will need a second surgery, expects to return this season"	"basketball_nba"	"The star guard updated the media on his status Monday night."
"0"	"John Legend Leads a Pack of Gorgeous Men in the Sexiest Man Alive Issue: From Sterling to Jason, Peek at 10 More Hot Guys"	"celebrity"	"Get to know some of our picks for Men of the Year"
"1"	"Emily Ratajkowski Is Being Sued for $150,000 Over an Instagram Photo"	"movies-celebrity"	"What's more? The photographer is also asking for all of the profits the model made off of his work."
"0"	"National Cappuccino Day 2019: Deals from Starbucks, Dunkin' Donuts and More"	"foodnews"	"The cappuccino is named after the Capuchin friars, whose robes were the color of the espresso mixed with frothed milk."
"0"	"Why Do Cats Meow?"	"lifestylepetsanimals"	"Cats scratch, purr, and sleep, but haven't you always wondered, "why do cats meow"?"
"0"	"Arkansas town renames a bridge after Maleah Davis"	"newsus"	"Red Lake Bridge will now be known as Maleah Davis Memorial Bridge."
"0"	"Jets HC Adam Gase isn't at risk of losing his job"	"football_nfl"	"Things certainly haven't worked out during Adam Gase's first season in New York, but it sounds like the Jets head coach isn't at risk of losing his job."
"0"	"Jamie Dimon: The '60 Minutes' interview"	"finance-companies"	"The chairman and CEO of JPMorgan Chase tells Lesley Stahl he's optimistic about the economy and explains why he's not running for president"
"0"	"15 people who became billionaires in 2019   and 14 who lost their status in the three-comma club"	"markets"	"A proliferation of IPOs created several new billionaires in 2019, but a turbulent stock market also knocked many entrepreneurs out of the billionaire ranks."
"0"	"Josh Gordon Admits Patriots' Decision To Waive Him Was Surprising"	"football_nfl"	"The New England Patriots made a move that was surprising to fans just weeks ago and it appears the player who got let go had a similar reaction"
"0"	"Meghan Markle and Prince Harry Honor Veterans Day Through Instagram"	"lifestyleroyals"	"The Duke and Duchess of Sussex posted a touching tribute to American vets."
"1"	"Mohamed Sanu Can't Contain Excitement Over Trade To Patriots On Twitter"	"football_nfl"	"It was a good day for New England Patriots fans and perhaps and even better day for Mohamed Sanu. Patriots fans awoke on Tuesday morning basking in the glory of"
"0"	"This Arctic blast is in its final day. But the cold isn't over quite yet"	"weathertopstories"	"The hundreds of millions of people gripped by the Arctic blast can begin to peel off a layer or two of clothing starting Thursday."
"0"	"US held record number of migrant children in custody in 2019"	"newsus"	"The 3-year-old girl traveled for weeks cradled in her father's arms, as he set out to seek asylum in the United States."
"0"	"Meghan Markle and Prince Harry Reunite with Kate Middleton and Prince William for Remembrance Service"	"lifestyleroyals"	"Meghan Markle, Harry Reunite Kate and William at Remembrance Day"
