"1"	"Rainbow Baby! Shawn Johnson, Andrew East Welcome 1st Child After Miscarriage"	"tv-celebrity"
"1"	"Fetuses found in package intercepted at SFO; woman arrested in smuggling scheme"	"newscrime"
"0"	"Mom vs. Gingerbread House"	"videos"
"1"	"Justin Theroux Gushes Over Dog Kuma's 'First Premiere': See Her Steal the Show in ET's Interview"	"movies-celebrity"
"1"	"Joe Giudice 'Feels Like a Weight Has Been Lifted' After ICE Release, Source Says"	"tv-celebrity"
"1"	"Foster mom charged with murder in death of twins found in car"	"newscrime"
"0"	"Husband, 106, and wife, 105, are named world's oldest living couple"	"lifestylebuzz"
"0"	"Andrew Yang's Campaign Has a Lot of Money. Now What?"	"markets"
"0"	"A body-language expert says Meghan Markle is "politely disconnecting" from the public, and honestly, we would too"	"lifestyleroyals"
"0"	"UK Labour Party says it has experienced a 'large-scale cyber attack' on its digital platforms"	"newsscienceandtechnology"
"0"	"These Are the Best Snacks We Tried in 2019"	"recipes"
"1"	"Why Prince William Is Making Headlines for His Fashion for the First Time in Pakistan!"	"lifestyleroyals"
"0"	"How to Peel a Pomegranate Without Making a Total Mess"	"tipsandtricks"
"0"	"13 Trader Joe's Party Staples For Busy Hosts"	"newstrends"
"1"	"'Lots of Tears!' Teresa Giudice Details Reuniting With Husband Joe in Italy"	"tv-celebrity"
"1"	"Pippa Middleton Takes Baby Son to Cranial Osteopath: 'I Was Fascinated to See How Calming It Was'"	"health-news"
"0"	"Impeachment Hearings Open With Revelation on Trump's Ukraine Pressure"	"newspolitics"
"0"	"How Russia Meddles Abroad for Profit: Cash, Trolls and a Cult Leader"	"newsworld"
"0"	"The Sexiest Photos Ever of Our 29 Sexiest Men Alive"	"celebrity"
"1"	"Stars   They're Just Like Us!"	"celebrity"
"0"	"He was a member of a boy band in the 90s. Now he's an ER doctor in Dallas"	"health-news"
"0"	"Mom named person of interest in 5-year-old girl's disappearance"	"newscrime"
"1"	"Coast Guard searches for man who fell from cruise off Texas"	"newsus"
"1"	"A 'one in a million' yellow cardinal, dubbed 'Sunny,' seen in Florida"	"newsus"
"1"	"How tall are your favorite male stars?"	"entertainment-celebrity"
"0"	"Selena Gomez Opens Up About Being Body Shamed for Gaining Weight Amidst Lupus Battle"	"wellness"
"0"	"This little Montana town is full of Power Wagons and Mustangs"	"autosenthusiasts"
"0"	"Nigel Farage offers Boris Johnson a truce, boosting prospects for Conservatives in December election"	"newsworld"
"1"	"Fans are crazy in love with Ciara and Russell Wilson's Beyoncé and Jay-Z Halloween costumes"	"music-celebrity"
"0"	"These are the new cars that depreciate least"	"autosresearchguides"
"1"	"J.Lo Just Posted A Sweaty Gym Selfie That Proves Her Workouts Are Definitely Paying Off"	"fitness"
"0"	"Eerie photos of an abandoned airport that hasn't been touched in 25 years"	"newsphotos"
"0"	"As top free agents hit the market, Scott Boras says MLB's system is 'corrupt'"	"baseball_mlb"
"0"	"10 Thanksgiving dishes you should just buy at the store"	"quickandeasy"
"0"	"My Third Husband Is 102 Years Old. Here's What Our Marriage Is Like."	"voices"
"0"	"All the hats Duchesses Kate and Meghan have worn in 2019"	"lifestyleroyals"
"0"	"Can you answer these real Jeopardy questions about TV shows?"	"tv-gallery"
"1"	"Chinese hitmen jailed over repeatedly outsourced murder"	"newsworld"
"1"	"Daisy Ridley plays coy about engagement speculation"	"movies-celebrity"
"0"	"US Coast Guard is searching for two missing boaters after a storm capsized their vessel"	"newsus"
"0"	"Fire Destroys Classic Porsche Cars And Parts Worth $3 Million"	"autosenthusiasts"
"1"	"Woman wanted for robbery found murdered; suspected male accomplice sought"	"newscrime"
"0"	"Fed likely to defy history with steady rates through elections"	"markets"
"0"	"The Right Way to Wrap Anything in Bacon"	"tipsandtricks"
"0"	"The 11 Biggest Myths About Cellulite You Need to Stop Believing"	"wellness"
"0"	"8 Secret Spots You Never Knew Existed in Disney Parks"	"traveltips"
"0"	"Emilia Clarke Stunned in a Cut-Out Dress at the 'Last Christmas' Premiere"	"lifestylecelebstyle"
"0"	"49 Celebrity Couples Who Make It Work Despite Huge Age Gaps"	"celebrity"
"0"	"This Italian Beach is Going to Start Charging Admission"	"travelnews"
"1"	"What to Cook This Weekend: October 25 27, 2019"	"recipes"
"0"	"The son of a Chinese billionaire has been banned from flying first class, playing golf, buying property, or going clubbing"	"newsworld"
"1"	"Restaurant Does The Sweetest Thing For Lonely Cat Who Needed A Friend"	"lifestylebuzz"
"0"	"'DACA is everything': Dreamers, families rally as Supreme Court takes up its future"	"newsus"
"0"	"If You're Over 40 And About To Start Weight Lifting For The First Time, Here Are 5 Things You Need To Know"	"wellness"
"0"	"The New Krispy Kreme Winter Menu Includes A Donut With Brownie Batter And White Chocolate Filling"	"recipes"
"0"	"The Best Holiday Dessert from Every State"	"recipes"
"0"	"2020 Kia Telluride Pros and Cons Review: The Heartland Kia"	"autossuvs"
"0"	"Abandoned farms for sale with plenty of promise"	"finance-real-estate"
"0"	"Man locked up 11 years for robberies he didn't do walks free"	"newscrime"
"0"	"Things you might not know (but should!) about Jeff Goldblum"	"movies-celebrity"
"1"	"Woman Texts Dead Father's Phone for 4 Years & Finally Receives an Emotional Reply"	"lifestylefamilyandrelationships"
"0"	"Could this court case be the key to finding Dubai's missing princesses?"	"newsworld"
"1"	"Kylie Jenner hits Drake's Halloween party amid flirtation rumors, plus more news"	"celebrity"
"1"	"Prince Harry Tears Up as He Remembers Keeping Meghan Markle's Pregnancy a Secret"	"lifestyleroyals"
"0"	"SEMA 2019: Cars and Trucks Gone Wild"	"autossema"
"0"	"Trump puts economic growth at center of his 2020 campaign"	"markets"
"1"	"Japan's ancient and mysterious royal regalia"	"lifestyleroyals"
"1"	"San Diego State University freshman hurt in fraternity incident dies"	"newsus"
"0"	"16 Classic Italian Soup Recipes That Will Warm You Right Up"	"recipes"
"0"	"2020 GMC Sierra 3500HD Review: The Good, the Bad, and the Ugly"	"autostrucks"
"0"	"Groom Makes The Most Heartfelt Vows To His 9-Year-Old Stepdaughter"	"lifestylebuzz"
"0"	"California cops respond to 2 homeless men shot with arrows: report"	"newscrime"
"1"	"Channing Tatum, Jessie J look smitten in Pacific Park date selfies, plus more news"	"entertainment-celebrity"
"1"	"These YouTube Channels are Changing How We Learn to Cook"	"foodnews"
"0"	"LASIK eye surgery should be taken off market, ex-FDA adviser says"	"health-news"
"1"	"Celebs' Craziest Halloween Costumes, From Beyoncé to Kylie Jenner"	"celebrity"
"0"	"Today in History: November 14"	"newsworld"
"0"	"'He's working': White House says Trump is not watching first public impeachment hearing"	"newspolitics"
"0"	"Hey, Millennials, look out below! Gen Z may already be catching up in the salary race"	"finance-career"
"1"	"Chrissy Teigen Gushes Over John Legend After He Misses His Flight to be With Her"	"music-celebrity"
"0"	"The Most Popular Family Dinners from Every Decade"	"recipes"
"0"	"This 'new' strain of HIV is actually a good thing"	"health-news"
"0"	"Justice Dept. rolls out new program to combat gun violence"	"newsus"
"0"	"Jeffrey Epstein's Estate May Set Up a Program to Pay Accusers"	"newsus"
"1"	"Olympic swimmer Ryan Lochte went from earning millions to living paycheck-to-paycheck   here's what he learned"	"personalfinance"
"1"	"Man threatened school to distract from robbery, police say"	"newscrime"
"0"	"9 Incredible Places You'd Never Even Think To Spend Thanksgiving"	"ustravel"
"0"	"10 Gazans dead as Israel hit on militant chief sparks rocket barrage"	"newsworld"
"1"	"85 Easy Christmas Appetizers That Will Delight All of Your Holiday Party Guests"	"recipes"
"0"	"Turkey's Erdoğan showed propaganda film about Kurds during White House meeting: report"	"newsworld"
"1"	"Arkansas man seen walking out of court hearing, running away, as jury deliberated"	"newscrime"
"0"	"Famous Celebs Who Started as Child Actors"	"celebrity"
"0"	"Muslim woman says Denver arena worker told her to remove hijab, refused to let her enter"	"newsus"
"0"	"NFL Week 11 Power Rankings: Upsets rule, and a new team at the top"	"football_nfl"
"0"	"This Italian Beach Will Charge Entry Fee to Combat Overtourism"	"video"
"1"	"Authorities release sketch of 'possible witness' in case of missing girl"	"newscrime"
"1"	"College gymnast dies following training accident in Connecticut"	"newsus"
"0"	"Chiefs got vintage Mahomes but left door open for Raiders in AFC West"	"football_nfl"
"1"	"Jessica Simpson's latest Birdie Mae post suggests she's done having kids, plus more news"	"entertainment-celebrity"
"0"	"50 amazing gifts for every type of person and budget"	"shop-holidays"
"1"	"Lisa Vanderpump Reveals Why She Left RHOBH: 'I Don't Have Room in My Life for Nastiness'"	"tvnews"
"0"	"Answers remain elusive in Virginia Beach shooting rampage"	"newsus"
"0"	"30 quick appetizers for last-minute guests"	"recipes"
"1"	"Halle Berry Shares Photo of 6-Pack Abs on Instagram and Her Fans are Freaking Out"	"fitness"
"1"	"Iconic couples of the decade"	"entertainment-celebrity"
"0"	"You'll Be Captivated by Ciara's Best Hair and Makeup Looks"	"lifestylecelebstyle"
"0"	"The 21 most iconic CMA Awards performances"	"cma-awards"
"1"	"He was a member of a boy band in the 90s. Now he's an ER doctor in Dallas"	"health-news"
"0"	"Comics - 'Bliss' by Harry Bliss"	"humor"
"1"	"The Pioneer Woman makes 5 of her favorite comfort-food recipes"	"recipes"
"0"	"The world's favorite cities people are fleeing"	"finance-real-estate"
"0"	"Boy uses his Make-A-Wish to get special space that other schoolchildren can use"	"newsgoodnews"
"1"	"Top tips for cooking tasty turkey"	"tipsandtricks"
"0"	"Report: Election vendors are 'prime targets,' need oversight"	"elections-2020-us"
"1"	"Missouri man missing for a week found alive in car that crashed into ravine"	"newsus"
"0"	"Spain's King Felipe VI and Queen Letizia's royal visit to Cuba: Best photos"	"lifestyleroyals"
"0"	"Raised an only child, Southgate woman, 92, learns she has 19 half siblings"	"newsgoodnews"
"1"	"2 charged in murder of Alabama girl Kamille 'Cupcake' McKinney"	"newscrime"
"1"	"Walmart releases Black Friday ad with $129 Apple Watch, TV deals, electronics doorbusters"	"finance-companies"
"0"	"Deval Patrick Will Enter 2020 Presidential Race on Thursday"	"elections-2020-us"
"0"	"Comics - 'Pluggers' by Gary Brookins"	"humor"
"0"	"The 1 reason you shouldn't hesitate to claim Social Security early"	"finance-retirement"
"0"	"Israel says overnight strike on Gaza house killed Islamic Jihad commander"	"newsworld"
"0"	"A former royal bodyguard shared the challenges that come with protecting the royal family"	"newsoffbeat"
"0"	"Red and Blue Economies Are Heading in Sharply Different Directions"	"markets"
"1"	"This Wedding Photo of a Canine Best Man Captures Just How Deep a Dog's Love Truly Is"	"lifestylebuzz"
"0"	"How a little-known GOP lawmaker became a point man in Trump's impeachment defense"	"newspolitics"
"1"	"Two Under 2! Tori Bates Reveals She Is Pregnant   and 'Thrilled' to Welcome a Second Son"	"tv-celebrity"
"0"	"These companies are revolutionizing how people get paid"	"finance-companies"
"0"	"See All the Best Looks From the 2019 People's Choice Awards"	"awardstyle"
"1"	"Melanie Griffith, 62, shows off her insane figure in lingerie selfie, plus more news"	"celebrity"
"1"	"Kevin Spacey Won't Be Charged in Sexual Assault Case After Accuser Dies"	"movies-celebrity"
"0"	"Neil Young Says U.S. Citizenship Application Delayed By Marijuana Use"	"music-celebrity"
