"0"	"A teen received a response to a message in a bottle he wrote 9 years ago after it traveled over 3,000 miles"	"lifestylebuzz"
"0"	"Funny celeb pics for November 2019"	"humor"
"1"	"Police search of apartments fails to locate missing girl"	"newscrime"
"1"	"Dog Tries To Jump On Recliner With Dad   And It Doesn't Quite Go As Planned"	"lifestylebuzz"
"0"	"In Defense Of Left Foot-Braking During Normal Street Driving"	"autosenthusiasts"
"0"	"Ala. lawmen help get hitchhiking disabled veteran to doctor's appointment across state"	"newsgoodnews"
"0"	"Denver to pay United Airlines pilot $300G after wrongful arrest on indecent exposure charge"	"newscrime"
"0"	"MSNBC brings George Conway as analyst for Trump hearing"	"newspolitics"
"1"	"Bradley Cooper Makes Rare Public Appearance With Daughter Lea"	"movies-celebrity"
"1"	"American woman apparently strangled in the Dominican Republic"	"newsworld"
"1"	"Why I stopped shopping at Marshall's and Trader Joe's"	"finance-savemoney"
"0"	"Our 30 Favorite Recipes for Brussels Sprouts"	"recipes"
"0"	"Deion Sanders hasn't talked to Florida State about job he's a rumored candidate for"	"football_ncaa"
"0"	"How the 2020 Corvette C8 Turned This Vette Hater Into a Believer"	"autosnews"
"0"	"Massachusetts fire lieutenant dies battling house fire"	"newsus"
"0"	"The 20-Minute Fresh Tomato Sauce You'll Actually Want to Make This Winter"	"tipsandtricks"
"0"	"15 of the Best Towing Vehicles That Aren't Trucks"	"autosresearchguides"
"1"	"#SquashGoals! Adorable Snaps of Celebrity Kids at the Pumpkin Patch"	"entertainment-celebrity"
"0"	"Neuron Shows Off Electric Semi And Truck With Tesla Design Cues"	"autosnews"
"0"	"Christopher Johnson has hitched his reputation to Adam Gase"	"football_nfl"
"1"	"Trace Adkins ties the knot in New Orleans"	"music-celebrity"
"0"	"With two Cy Young Awards, Jacob deGrom on Cooperstown path"	"baseball_mlb"
"0"	"1990s Mall Rats Will Definitely Remember These Iconic Stores and Activities"	"lifestyledidyouknow"
"0"	"I moved from the US to the UK. Here are the 8 things that surprised me the most."	"voices"
"0"	"Ex-Astros say team electronically stole signs during 2017 season"	"baseball_mlb"
"0"	"French Pastry Diet For Weight Loss: Does It Work?"	"nutrition"
"0"	"'Priceless' finds that turned out to be worthless"	"markets"
"0"	"Tourists needed in Venice after flooding, locals say"	"travelnews"
"0"	"Ohio State star Chase Young to miss one more game, return vs. Penn State"	"football_ncaa"
"1"	"A 13-year-old murder suspect who escaped in North Carolina is back in custody"	"newscrime"
"0"	"Prince Charles just turned 71   here are the best photos from every year of his royal career so far"	"lifestyleroyals"
"0"	"Hunter Biden could be collateral damage as Trump impeachment hearings begin"	"newspolitics"
"1"	"Woman who livestreamed fatal California crash is arrested again"	"newscrime"
"0"	"Bolivia's Jeanine Anez declares herself acting president as Evo Morales vows to fight from abroad"	"newsworld"
"0"	"Wendy's Is Rolling Out Birthday Cake Frostys for Its 50th Anniversary"	"foodnews"
"0"	"She posted for help with a quilt. More than 1,000 answered"	"newsgoodnews"
"1"	"Halloween Wedding, but Make It Classy - These Grooms Pulled It Off With Their Rustic Big Day"	"lifestyleweddings"
"1"	"Baby Bump! Laura Prepon, Ben Foster Expecting Baby No. 2"	"tv-celebrity"
"1"	"Celebs celebrate Halloween 2019"	"entertainment-celebrity"
"0"	"What to care/not care about from Week 10: Cowboys' crucial error wastes Dak's brilliance"	"football_nfl"
"0"	"Hannah Brown on Whether She's Sworn Off Musicians After Dating Jed Wyatt (Exclusive)"	"tv-celebrity"
"1"	"Hannah Brown Is 'Manifesting' a 'DWTS' Win With Mirrorball Inspired Dress (Exclusive)"	"awardstyle"
"0"	"Predicting the College Football Rankings for Week 12: Minnesota Climbs, Penn State Drops"	"football_ncaa"
"1"	"Kaitlynn Carter Recalls Falling in Love With Miley Cyrus in Candid Essay"	"tv-celebrity"
"0"	"The Disney+ 'Lady and the Tramp' remake: A guide to the new cast members"	"movies-gallery"
"0"	"Joe Giudice Says It Was 'Painful' Watching Real Housewives of New Jersey from Prison"	"tv-celebrity"
"0"	"Hernandez: Anthony Davis' impact on LeBron James apparent even when he doesn't play"	"basketball_nba"
"0"	"These Loaded Mashed Potatoes Will Win Thanksgiving"	"videos"
"0"	"'It's not over': Sarah Palin says she is fighting to repair her marriage"	"newsus"
"0"	"How to spend your retirement savings without triggering a tax penalty"	"finance-taxes"
"0"	"Week in celebrity photos for Nov. 11-15, 2019"	"celebrity"
"0"	"9 Amazing Transgender Women Who Changed History"	"lifestyledidyouknow"
"1"	"Charles Rogers, former Michigan State football, Detroit Lions star, dead at 38"	"football_nfl"
"0"	"Navy Submarine, Missing for 75 Years, Is Found Off Okinawa"	"newsworld"
"0"	"49ers still don't know if Jimmy Garoppolo is Super Bowl-ready"	"football_nfl"
"1"	"Hailey Bieber Uses This One Piece of Gym Equipment to Make Her Butt Workout More Intense"	"fitness"
"0"	"Porsche launches into second story of New Jersey building, killing 2"	"newsus"
"0"	"17 Outdated Office Etiquette Rules That Are So Laughable Today"	"lifestylecareer"
"0"	"Sneaky ways all-inclusive resorts get you to spend money"	"video"
"0"	"Amazon's $1.5 million political gambit backfires in Seattle City Council election"	"finance-companies"
"0"	"What's coming in impeachment: The inquiry goes public"	"newspolitics"
"1"	"Christie Brinkley's Ex-Husband Peter Cook, 60, Engaged to Alba Jancou, 21"	"tv-celebrity"
"0"	"Here are the best cruise lines for families, couples and those on a budget"	"travelnews"
"1"	"There are doubts about China's promise to purchase more US farm products"	"markets"
"1"	"Atlanta college student Alexis Crawford was choked to death, dumped in park, police say"	"newscrime"
"1"	"Rob Kardashian Appears Thinner at Kim Kardashian's Birthday Party in Rare Video"	"tv-celebrity"
"1"	"Get a Load of the Most Memorable Moments From the 2019 People's Choice Awards"	"awards"
"0"	"Kevin Hart Says He's a ''Different'' Person While Revealing Details From ''Humbling'' Car Crash Recovery"	"movies-celebrity"
"0"	"Kanye West is teaming up with pastor Joel Osteen: Details"	"music-celebrity"
"0"	"How to Make Sure You Have a Seat Next to Your Family on Your Next Flight"	"traveltips"
"0"	"John Legend Leads a Pack of Gorgeous Men in the Sexiest Man Alive Issue: From Sterling to Jason, Peek at 10 More Hot Guys"	"celebrity"
"0"	"U.S. grand jury drops case against Colorado police for killing suspect"	"newsus"
"1"	"Duchess Meghan Describes 'Really Challenging' Life as New Royal: I'm Not OK"	"lifestyleroyals"
"0"	"Why is American internet access so much more expensive than the rest of the world?"	"markets"
"0"	"Why Do Cats Meow?"	"lifestylepetsanimals"
"1"	"Maricopa County Sheriff's Office receives 2 reports of contaminated Halloween candy"	"newsus"
"1"	"High court weighs whether teen sniper deserves re-sentencing"	"newscrime"
"1"	"Markazi: Ex-UCLA gymnast Katelyn Ohashi wonders if her viral moment could have been profitable"	"more_sports"
"0"	"People's Choice Awards 2019: Red Carpet Fashion"	"awards"
"0"	"31 Award-Winning Pictures That Elevate The Wedding Photography Game"	"lifestylebuzz"
"0"	"The 24 Most Beautiful Castles in Europe"	"traveltripideas"
"0"	"Salt & Vinegar Mashed Potatoes Are More Addictive Than Potato Chips"	"recipes"
"0"	"Mulvaney won't sue over impeachment, declines to cooperate"	"newspolitics"
"0"	"Oregon school bus driver accused of DUI after crashing bus with 10 students"	"newscrime"
"1"	"Britney Spears Does The Splits Like a Boss in Workout Video"	"music-celebrity"
"0"	"Just like NFL's deal with Jay-Z, the Colin Kaepernick workout looks like a PR trap"	"football_nfl"
"0"	"Disney+ surpasses 10 million sign-ups since launch"	"finance-companies"
"0"	"Welcome to the World! All of the Celebrity Babies Who've Made Their Debuts in 2019"	"celebrity"
"0"	"The Queen's Dressmaker Reveals She Uses Gin to Clean the Royal Jewels"	"lifestyleroyals"
"0"	"Guaido backers enter Venezuela embassy in Brasilia, sparking standoff"	"newsworld"
"1"	"Abandoned 'unicorn' puppy has a tail on its head"	"animals"
"0"	"Stromboli vs. Calzone: What's the Real Difference Between These Italian Favorites?"	"foodnews"
"0"	"Easy Turkey Breast Recipes To Make When You Don't Feel Like Cooking A Whole Bird"	"quickandeasy"
"0"	"We Had a Babysitter Come to Our Hotel Room at Disney World, and It Was SO Worth It"	"voices"
"0"	"Why the College Football Playoff selection committee can't make a case for Alabama"	"football_ncaa"
"0"	"Japan Wants You To Stop Buying All Its Skyline GT-Rs"	"autosenthusiasts"
"0"	"How Cowboys QB Dak Prescott's words have helped WR Amari Cooper's toe-tapping catches"	"football_nfl"
"0"	"Thierry Henry named Montreal Impact manager"	"soccer"
"1"	"Hearty Fall Soups That'll Have You Ready for Cooler Weather"	"recipes"
"1"	"17 photos that show the ugly truth of living in a tiny house"	"lifestylehomeandgarden"
"0"	"Subtle Signs You're Eating Too Much Sugar"	"nutrition"
"0"	"Big celebrity money moments of the last decade"	"entertainment-celebrity"
"1"	"Aubrey O'Day Responded to Critics Who Say Plastic Surgery Has Dramatically Changed Her Appearance"	"wellness"
"0"	"Warren proposes 'corporate perjury' law related to industry-funded research"	"elections-2020-us"
"0"	"Copycat Cracker Barrel Chicken and Dumplings Recipe"	"recipes"
"1"	"McDonald's celebrates Happy Meal's 40th anniversary by bringing back retro toys"	"restaurantsandnews"
"1"	"Adorable baby monkey tries and fails to jump away from mom's grasp"	"animals"
"1"	"Meghan and Harry to take 'family time' off, says royal source"	"lifestyleroyals"
"1"	"Duchess Meghan Returns to Public Eye After Africa Tour Documentary Airs"	"lifestyleroyals"
"0"	"60+ Restaurants Where Veterans Eat for Free on Veterans Day This Year"	"personalfinance"
"0"	"Your turkey timeline: what to do and when for the perfect holiday roast"	"tipsandtricks"
"1"	"Jennifer Lopez Cuddles with Daughter Emme as Fiancé Alex Rodriguez Grabs Dinner with His Girls"	"movies-celebrity"
"0"	"Why it's nearly impossible for cruise workers to sue employers"	"travelnews"
"0"	"Stars Who Served in the Military"	"entertainment-celebrity"
"0"	"13 low-paying jobs that actually pay off in retirement"	"finance-career"
"1"	"Kylie Jenner and Travis Scott Were a 'Great Team' During Night Out with Daughter Stormi (Exclusive)"	"celebrity"
"1"	"Lots of good terns: Bird ready to fly off endangered list"	"newsgoodnews"
"1"	"They Woke Up Like This: Celebs' Best Makeup-Free Selfies"	"entertainment-celebrity"
"0"	"Les Miles Has Some Thoughts on the Shape of the Earth"	"football_ncaa"
"0"	"Shakira reflects on her career-threatening injury, depression in 2017"	"music-celebrity"
"0"	"'Dancing with the Stars': Why Sean Spicer survives despite the lowest judge scores"	"tvnews"
"0"	"This Is the Worst Thing You Can Do If You're Trying to Lose Body Fat and Build Muscle"	"fitness"
"1"	"15 celebrities you probably forgot guest-starred on 'Will & Grace'"	"tv-gallery"
"0"	"The Latest: Judge denies new claim in Georgia execution case"	"newscrime"
"0"	"Are Meg Ryan and John Mellencamp Back On? Actress Seen with Engagement Ring After Breakup"	"movies-celebrity"
"1"	"Cat Tries To Stop Parents From Going On Trip Without Her"	"lifestylebuzz"
"0"	"A 22-year-old's heart stopped for 12 minutes. Doctors used hypothermia to help."	"health-news"
"1"	"Adorable husky has the best snow day ever"	"animals"
"1"	"The biggest celebrity stories of the last decade"	"celebrity"
"0"	"Carrie Underwood Praises Miranda Lambert as 'Super Supportive': 'We Lift Each Other Up'"	"cma-awards"
"1"	"Kristen Stewart is planning to propose to her girlfriend, plus more celeb love life news for early November 2019"	"celebrity"
"1"	"Miley Cyrus and Cody Simpson Pack on the PDA as She Helps Him Get Ready for Halloween"	"music-celebrity"
"0"	"Ferrari's New Key Is Literally Just a Big Ferrari Badge"	"autosnews"
"0"	"What Happens When a Plane Collides with a Flock of Birds?"	"travelnews"
"0"	"Health Benefits of Nutritional Yeast and How to Use It"	"nutrition"
"1"	"Game over! Mariah Carey outdid every kid on TikTok with her 'Fantasy challenge'"	"music-celebrity"
"1"	"He's the First African American to Receive a Face Transplant. His Story Could Change Health Care"	"health-news"
"0"	"Cowboys have questionable red zone calls in loss to Vikings"	"football_nfl"
"0"	"For the Most Even Seasoning, Use a Spice Strainer"	"tipsandtricks"
"0"	"E.P.A. to Limit Science Used to Write Public Health Rules"	"newsus"
"0"	"The world's first hybrid cruise ship is currently on its maiden voyage⁠ take a look inside"	"travelnews"
"0"	"10 reasons it's better to rent rather than buy a home"	"finance-real-estate"
"1"	"Car of Marine linked to Virginia slaying is found in South Carolina, authorities say"	"newscrime"
"1"	"Wells Adams Reveals the One Bachelor Nation Member Definitely Invited to His Wedding"	"tv-celebrity"
"0"	"Qantas test flight from London to Sydney breaks record"	"travelnews"
"1"	"'Pioneer Woman' star Ree Drummond shows off weight loss in new selfie"	"weightloss"
"0"	"Stella McCartney Deleted a Meghan Markle Instagram Post After Followers Called Her Out"	"lifestyleroyals"
"0"	"The 10 Most Popular Wines in America, Ranked"	"beverages"
"0"	"Supreme Court refuses to block lawsuit against gun manufacturer brought by Sandy Hook families"	"finance-companies"
"0"	"After Supreme Court hearing on DACA, California weighs in with walkouts, pledges of support for immigrants"	"newsus"
"0"	"Turkey-Shaped Butter Is Here to Complete Your Thanksgiving Spread"	"foodnews"
"0"	"Top takeaways from Sunday's Week 10 NFL action"	"football_nfl"
"0"	"81 Bean Recipes You'll Be Making All Year Long"	"recipes"
"1"	"Hailey Baldwin wore three show-stopping dresses during her wedding, and put a unique twist on each one"	"lifestylecelebstyle"
"0"	"France, Germany, Britain urge Iran to reverse nuclear deal breaches"	"newsworld"
"0"	"The Worst Cities for Black Americans"	"newsus"
"1"	"Miley Cyrus: 'I always thought I had to be gay' because men 'were evil, but it's not true'"	"music-celebrity"
"0"	"Tesla Pickup Truck: 6 Features it Needs to Beat the Rivian R1T"	"autosnews"
"0"	"Hong Kong police shoot at pro-democracy protesters"	"newsworld"
"0"	"4 reasons you shouldn't max out your 401(k)"	"finance-saving-investing"
"0"	"Protesters blockade universities, business district as chaos grips Hong Kong"	"newsworld"
"1"	"'A sad day': Louisiana deputy and his school teacher wife face 60 counts of child porn and child rape accusations"	"newscrime"
"0"	"Rep. Tim Ryan endorses Biden in Democratic primary"	"elections-2020-us"
"0"	"2020 Ford Mustang Shelby GT350 vs. GT500: Which Is the Better Sports Car?"	"autosenthusiasts"
"1"	"13 Animal Adoptions That Will Melt Your Heart"	"lifestylepetsanimals"
"0"	"Fast food cashier and manager fired for refusing to serve police officer"	"newsus"
"0"	"Why you should give up alcohol for one month: From improved sleep to a glowing complexion - this is EXACTLY what happens to your body when you ditch booze for just four weeks"	"wellness"
"1"	"Celebrity beach cruising for 2019"	"celebrity"
"0"	"'It's the biggest gift I've ever gotten:' Iraq War veteran who lost leg and suffered significant trauma will come home to a hero's house in Glastonbury"	"newsgoodnews"
"0"	"I've had it with this former friend"	"lifestylefamily"
"1"	"Broadway Star Laurel Griggs Suffered Asthma Attack Before She Died at Age 13"	"music-celebrity"
"0"	"Every touchdown from every Week 10 game"	"football_nfl_videos"
"1"	"Uh-Oh! Carrie Ann Inaba Falls on 'Dancing With the Stars'"	"tv-celebrity"
"0"	"Where Does Deval Patrick Stand on the Issues?"	"elections-2020-us"
"1"	"Jenelle Evans' Teen Mom Co-Stars React to Her Split From David Eason"	"tv-celebrity"
"1"	"Woman doused with gasoline, set afire at Florida Taco Bell. Police arrest suspect"	"newscrime"
"1"	"Prince Harry acknowledges tensions with William in ITV interview"	"lifestyleroyals"
"0"	"The Key to Mastering Goulash, the World's Most Famous Stew"	"recipes"
"1"	"A bodybuilder showed how fitness influencers can make their bodies look Instagram-perfect in before-and-after photos"	"fitness"
"0"	"Kiss Cancel 'End of the Road' Tour of Australia and New Zealand Due to Illness"	"musicnews"
"0"	"'Grandma Joy,' grandson share photos of US as they try visiting all national parks"	"newsgoodnews"
"0"	"Thunberg, teen climate activist, leaves US aboard catamaran"	"newsus"
"1"	"Liam Hemsworth moves on from Miley Cyrus with Australian 'Dynasty' actress, plus more celeb love life news for mid-October 2019"	"celebrity"
"0"	"Biggest California earthquake in two decades ruptured on at least 24 faults"	"newsus"
"1"	"Lori Loughlin's Daughters No Longer Enrolled at USC"	"tv-celebrity"
"0"	"Travel etiquette: The final word on the right to recline"	"traveltips"
"1"	"Here's Jennifer Lopez Wearing the Most Extra Bejeweled Wedding Dress"	"lifestylebuzz"
"1"	"What Kids Did a Decade Ago That They Don't Do Anymore"	"lifestyledidyouknow"
"0"	"6 Reasons to Run On the Treadmill Instead of Outside"	"fitness"
"0"	"Next up in impeachment hearings: A parade of key witnesses"	"newspolitics"
"0"	"Dad took 11-month-old to drug deal as 'human shield'. The baby was shot."	"newscrime"
"0"	"Jennifer Lopez Just Got a Teeny Chop to Her Blond Lob, but it Changed the Entire Look"	"lifestylecelebstyle"
"0"	"17 Movie Soundtracks Every Kid from the '80s Loved"	"music-gallery"
"1"	"Foie Gras Is Banned by New York City"	"foodnews"
"0"	"Trailer with nearly 100,000 meals for homeless veterans stolen: Report"	"newscrime"
"0"	"Rare 1838 coin could sell for $500K"	"newsus"
"1"	"12 Photos Show What It's Really Like To Grow Up Trans"	"lifestyleparenting"
"1"	"WeWork staff, facing job cuts, outraged at founder's payout"	"finance-companies"
"0"	"A surprising 9-0, Baylor's rise to a showdown with Oklahoma was three years in the making"	"football_ncaa"
"1"	"25 candid photos of icons who shaped pop culture"	"celebrity"
"0"	"Chrissy Teigen's weekend was basically a clapback double-header, plus more news"	"entertainment-celebrity"
"0"	"Chrysler prodded sellers to absorb glut of 40,000 unordered cars, dealers say"	"finance-companies"
"1"	"Felicity Huffman Is Scheduled to Be Released from Prison on October 27 After Serving 13 Days"	"newsus"
"0"	"Boeing stock soars: It still thinks 737 Max will fly next month"	"finance-top-stocks"
"0"	"'This win was for you': Josh Gordon shares emotional post about death of his brother"	"football_nfl"
"1"	"Chicago-bound Flight Turns Around Over the Atlantic After Crew Finds Suspicious Cell Phone"	"newsus"
"0"	"'I Have Waited 68 Years to See This': How Honor Flights Help Veterans Reflect"	"newsus"
"0"	"23 Worst Things You Can Say to a New Parent"	"lifestyleparenting"
"1"	"40+ Ridiculously Good Gluten-Free Thanksgiving Recipes"	"recipes"
"1"	"Tamron Hall Talks Leaving the Today Show, Jokes About Megyn Kelly's Reported Multimillion Payout"	"tvnews"
"1"	"Taliban to release 2 professors in prisoner swap"	"newsworld"
"0"	"Eleven charged in major drug ring bust: Country's largest seizure of carfentanil, police said"	"newscrime"
"0"	"What You Need to Know About the C8 Corvette's New Dual-Clutch Transmission"	"autossports"
"0"	"Beat the crowds at these abandoned U.S. national parks"	"ustravel"
"1"	"Lindsay Lohan shades Cody Simpson and Miley Cyrus on Instagram"	"music-celebrity"
"0"	"Read George Kent Full Opening Statement at the First Public Hearing in Trump's Impeachment Inquiry"	"newspolitics"
"0"	"Photos of the Day"	"newsworld"
"0"	"David Beckham Gives a Sneak Peek at His First Hotel, The Londoner Macao"	"travelnews"
"0"	"Four words from dermatologists that'll change your life: Stop showering every day"	"wellness"
"1"	"I Never Imagined Being A Grandmother At 35. Here's How It Changed My Life."	"voices"
"0"	"Taylor testifies he was told Trump cared more about 'investigations' than Ukraine"	"newspolitics"
"0"	"Science Says Men with This Body Type Have Healthier Hearts"	"health-news"
"1"	"38 men who were worthy competitors for John Legend's Sexiest Man Alive title"	"celebrity"
"0"	"Selfies In Sports"	"more_sports"
"0"	"How the 2020 Chevrolet Silverado 1500 Has Improved (and Where it Still Falls Behind)"	"autostrucks"
"0"	"West Hollywood school administrator embroiled in college admissions scandal pleads guilty"	"newscrime"
"1"	"Kelsey Grammer shreds 'Housewives' ex Camille, dubs her 'pathetic'"	"tv-celebrity"
"1"	"Kind Principal Writes Letter of Verification to Tooth Fairy After Student Loses Lost Tooth"	"newsgoodnews"
"0"	"The Full-Size 2022 Jeep Grand Wagoneer SUV Is Finally On Its Way"	"autossuvs"
"0"	"Why I love doing touristy things when I travel"	"voices"
"1"	"No, Hailey Bieber Didn't Throw Shade at Selena Gomez's New Song"	"music-celebrity"
"0"	"Iran launches nuclear enrichment at underground Fordow plant, IAEA confirms"	"newsworld"
"0"	"Dramatic Footage Shows Plane Skidding Off Runway at O'Hare Airport in Chicago"	"viral"
"0"	"See what your favorite stars look like without makeup"	"celebrity"
"0"	"Opinion: Consensus at the top of the College Football Playoff rankings, but who's No. 4?"	"football_ncaa"
"1"	"Which Royal Wore It Best?"	"lifestyleroyals"
"1"	"'Bring this baby home': A plea to kidnapper days into search for 3-year-old"	"newscrime"
"0"	"Taliban to release 2 professors in prisoner swap"	"newsworld"
"0"	"Report: Padres priced out of Strasburg sweepstakes"	"baseball_mlb"
"1"	"Prince Harry just hinted that he and Meghan Markle may want another baby"	"lifestyleroyals"
"0"	"Pompeo's Impeachment Role Draws Outcry From Diplomats, Staffers"	"newspolitics"
"1"	"Erin Andrews Rejects the Hate From a Twitter Troll Over Her 'DWTS' Outfit in the Best Way"	"tv-celebrity"
"1"	"Watch this dog jump for joy while going for a walk"	"viral"
"0"	"The Daily Northwestern Apologizes to Student Protesters for Reporting"	"newsus"
"0"	"3 castaway cows swam to North Carolina's Outer Banks to escape Hurricane Dorian"	"newsus"
"0"	"Gwen Stefani Sets the Record Straight on That Diamond Ring at 2019 People's Choice Awards"	"music-celebrity"
"0"	"What Menopause Does to Women's Brains"	"wellness"
"0"	"New Movies and TV Shows You'll Be Able to Cozy Up With on Netflix in November"	"movies-gallery"
"0"	"​'My Annoying Cough Turned Out To Be Lung Cancer'"	"ads-lung-health"
"0"	"After Today, the Vise Tightens on Trump's Ukraine Point Man"	"newspolitics"
"1"	"John Legend clarifies his recent Kanye West comments, plus more news"	"entertainment-celebrity"
"1"	"9 Amazing Transgender Women Who Changed History"	"lifestyledidyouknow"
"0"	"28 Easy Quinoa Meal Prep Ideas for a Hectic Week"	"recipes"
"0"	"The Top Thanksgiving Recipe from Every State"	"recipes"
"0"	"What the End of Bolivia's President Means for the Country"	"newsworld"
"1"	"Brainteaser challenges puzzlers to spot the reindeer headband in the sea of festive sweaters"	"lifestylebuzz"
"1"	"Puppy's priceless reaction after seeing owner wear facial mask"	"animals"
"0"	"Abandoned 'unicorn' puppy has a tail on its head"	"animals"
"0"	"Trump, Erdogan to meet as thorny issues stress relations"	"newsworld"
"0"	"Mulvaney Request to Join Subpoena Lawsuit Opposed by House"	"newspolitics"
"0"	"Biden campaign pushes foreign policy experience in new ad as impeachment probe begins"	"elections-2020-us"
"0"	"Jon Hamm and Kiernan Shipka's Reunion Will Miss Mad Men Even More"	"tv-celebrity"
"1"	"'Time was of the essence': Politicians add to reward for missing 3-year-old"	"newscrime"
"1"	"10 celebrities who used social media to launch their careers"	"celebrity"
"0"	"14-year-old baker gives cupcakes to homeless"	"newsgoodnews"
"0"	"Nikki Haley claims top aides tried to recruit her to 'save the country' by undermining Trump"	"indepth"
"1"	"Meghan McCain confronts Trump Jr.: 'You and your family have hurt a lot of people'"	"newspolitics"
"0"	"Santa Claus back at work in Germany answering Christmas mail"	"newsworld"
"0"	"Arctic cold to blame for at least four deaths. And the weather is only expected to get worse"	"weathertopstories"
"1"	"Baby dies of the same cancer his identical twin is currently battling"	"health-news"
"0"	"Is retirement dying? The old work model is disappearing for Boomers, Gen Xers"	"finance-retirement"
"1"	"Louisiana could become first state without abortion access next year"	"newsus"
"0"	"Disney+: All the Original TV Shows and Movies Set for Streaming Platform (Photos)"	"tv-gallery"
"0"	"The student famous for reselling Krispy Kreme doughnuts has been gifted a van for his doughnut deliveries"	"foodnews"
"0"	"A teenager thought his leukemia was a death sentence. A college football player saved his life."	"newsgoodnews"
"0"	"Cincinnati Teen Arrested After Allegedly Making Up Story about Missing Autistic 13-Year-Old Who Never Existed"	"newscrime"
"1"	"This Mom Had a Hilarious Response to a Man Who Told Her to 'Cover Up' While Breastfeeding in Public"	"wellness"
"1"	"Hailey Bieber Sends Aunt Hilaria Baldwin Love After Her Second Miscarriage"	"celebrity"
"1"	"TobyMac says late son 'had an untamable grand personality,' shares last text exchange"	"musicnews"
"1"	"Man who caught 'Chance the Snapper' in a Chicago park now has his own coloring book about the gator"	"newsus"
"0"	"San Francisco's new DA pledges not to prosecute public urination, other quality-of-life-crimes"	"newsus"
"1"	"Egypt uncovers 'huge cache' of ancient sealed coffins"	"newsworld"
"0"	"Here's the Thanksgiving dinner $50 buys you at Aldi, Costco, Walmart and more"	"tipsandtricks"
"1"	"School bus driver charged with DUI after crashing with 10 students on board"	"newscrime"
"0"	"10 Things You Should Never Do in an Airplane Bathroom"	"traveltips"
"0"	"Mollie Tibbetts' accused killer wants confession thrown out, claims he wasn't read rights"	"newscrime"
"1"	"Sopa de Lima Is the Answer to Your Fall Soup Prayers"	"recipes"
"0"	"45 Abandoned Places Around the World That Are Eerily Beautiful"	"traveltripideas"
