"0"	"Mother-in-law poses as teenage boy to catch man in child porn case"	"newscrime"
"0"	"Ford v Ferrari: the real story"	"autosnews"
"0"	"When You See Paris Jackson's Wheat-Blond Hair, You'll Run to the Salon"	"lifestylebeauty"
"1"	"Critically endangered baby gorilla born in Brazil zoo"	"animals"
"0"	"Hate crimes remain at heightened levels, FBI report finds"	"newsus"
"1"	"What It's Like to Give Birth after a Uterus Transplant"	"voices"
"1"	"50 Delicious Dutch Oven Recipes"	"recipes"
"0"	"Skillet casserole perfect for leftover Thanksgiving turkey"	"recipes"
"1"	"Week in celebrity photos for Oct. 28-Nov. 1, 2019"	"celebrity"
"0"	"Owner shocked after his 60s Porsche roadster gets stolen from classic car show in Pleasanton"	"autosnews"
"0"	"Supreme Court weighs fate of DACA, 700,000 young immigrants"	"newsus"
"0"	"GOP senators to meet with Turkey's Erdoğan, Trump amid tensions"	"newspolitics"
"1"	"Teresa Giudice Opens Up About Her Future With Husband Joe and the Cheating Rumors (Exclusive)"	"tv-celebrity"
"1"	"Two Stars, One Look! The Best Fashion Faceoffs"	"celebrity"
"0"	"Austin Rivers on his father Doc's ejection: 'made my night'"	"basketball_nba"
"1"	"A Texas mom is going to prison after putting her son through unnecessary medical procedures"	"newscrime"
"0"	"Powell's Warning to Congress About the Next Recession"	"markets"
"0"	"Celebrity Engagements of 2019"	"celebrity"
"1"	"Hilary Duff Addresses Reports She's Already Married to Matthew Koma (Exclusive)"	"tv-celebrity"
"1"	"Trump's 'bombshell' offer to family of British teen killed in car crash: Diplomat's wife is in next room"	"newsworld"
"0"	"Charles Rogers, former Michigan State football, Detroit Lions star, dead at 38"	"football_nfl"
"1"	"Dog missing since 2007 reunites with her owner"	"animals"
"1"	"Georgia executes man convicted of killing convenience store clerk"	"newscrime"
"1"	"'This is the male we're looking for': Video released in search for abducted girl"	"newscrime"
"0"	"Your Thanksgiving Guests Will Be Very Thankful for Our Favorite Turkey Recipes"	"recipes"
"0"	"Bloomberg Heads to Arkansas to File for 2020 Presidential Primary"	"elections-2020-us"
"0"	"Ford Mustang Mach-E: Ford's First All-Electric Crossover Finally Has a Name"	"autosnews"
"0"	"Flight Attendants Have a Secret Language You Didn't Know About"	"travelnews"
"1"	"Orangutan granted legal personhood moves to Florida"	"newsus"
"0"	"Stars who've had more than one wedding with the same spouse"	"entertainment-celebrity"
"0"	"Family Reunited With Dog Who Had Been Missing Since August While Waiting in Line to Adopt Cat"	"lifestylebuzz"
"1"	"Kate Middleton fired her longtime personal assistant amid split from Meghan Markle and Prince Harry"	"lifestyleroyals"
"0"	"Faroe Islands 'closed for maintenance' in April 2020"	"travelnews"
"1"	"Ronnie Ortiz-Magro Dodges Felony Domestic Violence Charge Over Alleged Fight With Jen Harley"	"tv-celebrity"
"1"	"Meghan Markle, Prince Harry, Kate Middleton and Prince William Are Set to Reunite This Week!"	"lifestyleroyals"
"0"	"40 Foods Men Over 40 Should Avoid Like the Plague"	"nutrition"
"0"	"Russell Westbrook takes shot at Patrick Beverley"	"basketball_nba"
"0"	"Obamacare early sign-ups plunge as Trump-backed lawsuit challenges constitutionality"	"finance-healthcare"
"0"	"Rally Planned After Second Woman Cited For Selling Churros In Subway"	"newscrime"
"0"	"2009 CMA Awards fashion flashback"	"cma-awards"
"0"	"Supreme Court Justices Couldn't Stop Interrupting Each Other During DACA Oral Arguments"	"newsus"
"0"	"NYPD has removed "illegal" database of juvenile fingerprints, Legal Aid attorneys say"	"newscrime"
"0"	"Arizona activist accused of guiding migrants 'further north' after border crossing"	"newsus"
"1"	"A teen received a response to a message in a bottle he wrote 9 years ago after it traveled over 3,000 miles"	"lifestylebuzz"
"0"	"Just Try Not Going Back for Seconds of This Over-the-Top Cabbage Gratin"	"recipes"
"0"	"Stella McCartney removes Instagram post plugging her $1,900 coat that Meghan Markle wore amid backlash"	"lifestyleroyals"
"0"	"Small Canadian island irate that Americans keep opening their mail"	"newsworld"
"0"	"Do Pilots Actually Avoid Flying Over the Bermuda Triangle?"	"video"
"0"	"The most famous celebrity kids born this decade"	"celebrity"
"0"	"How this couple built a $100 million company without killing each other"	"finance-companies"
"0"	"What's the Best Oil for Frying?"	"tipsandtricks"
"1"	"Surgeon Shocked After Doing Double Lung Transplant on Teen Vaper: 'Evil I Haven't Faced Before'"	"ads-lung-health"
"0"	"Poll finds negative views of Democrats' and Trump's handling of impeachment inquiry"	"newspolitics"
"0"	"The NFL Hot Seat: Sean McVay ran out of magic, and Jared Goff isn't helping"	"football_nfl"
"0"	"A master suite with an 'open-concept' bathroom that has no doors   or privacy   is asking for $1,200/month in rent"	"lifestylebuzz"
"0"	"2020 Lincoln Corsair Review: The Sleeper Hit of 2020 SUV of the Year Testing"	"autossuvs"
"0"	"The most memorable moments from the 2019 CMA Awards"	"cma-awards"
"0"	"Why I'm Done Celebrating The Accomplishments Of Couples"	"voices"
"0"	"Advocacy groups push Senate to include election security money in funding bill"	"elections-2020-us"
"0"	"Is the Alabama Football Dynasty Ending?"	"football_ncaa_videos"
"0"	"The 22 Wildest Celebrity Hair Transformations of the Last Decade"	"lifestylebeauty"
"0"	"Meghan Markle and Prince Harry Reunite with Kate Middleton and Prince William for Remembrance Service"	"lifestyleroyals"
"1"	"Emily Ratajkowski Is Being Sued for $150,000 Over an Instagram Photo"	"movies-celebrity"
"0"	"Dean Foods files for bankruptcy"	"finance-companies"
"1"	"Texas death row inmate Rodney Reed: The outcry from people seeking to stop Rodney Reed's execution is growing. The support has 'bolstered him,' his attorney says"	"newscrime"
"0"	"Instagram-famous pilot reveals secrets people don't know about the job"	"travelnews"
"0"	"Rudy Giuliani's globetrotting complicates US foreign policy"	"newspolitics"
"0"	"Watch the 'Footloose' Dance Warmup That Gets These High Schoolers Ready to Race"	"fitness"
"0"	"I Never Imagined Being A Grandmother At 35. Here's How It Changed My Life."	"voices"
"0"	"China's pork crisis is bigger than you think"	"markets"
"1"	"New Couple Alert? Drake and Kylie Jenner Appear Into Each Other at Party"	"celebrity"
"0"	"Heisman Watch: Joe Burrow is the frontrunner, and there's not a close second"	"football_ncaa"
"0"	"The Day in Sports: Wednesday, November 13, 2019"	"more_sports"
"1"	"Kylie Jenner and her bestie get surgery together, plus more news"	"entertainment-celebrity"
"0"	"Bucket-List Food Experiences in Every State"	"newstrends"
"0"	"Here's Exactly What Kristen Bell Eats in a Day to Make 39 Look Like 29"	"nutrition"
"0"	"Touting membership cards, Trump campaign steps up anti-impeachment Facebook ads"	"elections-2020-us"
"0"	"3 awful reasons to take Social Security benefits at 65"	"finance-retirement"
"1"	"Retired doctor, 67, gives birth in China after getting 'pregnant naturally'"	"health-news"
"1"	"Celebrities who were born on Halloween"	"entertainment-celebrity"
"0"	"Archie's Photo Album: Prince Harry, Duchess Meghan's Royal Baby"	"lifestyleroyals"
"0"	"Celebrity chef 'Salt Bae' will pay $230,000 to four ex-servers"	"foodnews"
"1"	"Take That! BIP's Hannah G. Claps Back After Mispronouncing 'Gnocchi'"	"tv-celebrity"
"0"	"Meghan Markle Chose a Black Brocade Dress For the Royal Family's Important Outing"	"lifestylebuzz"
"0"	"Officer accused of killing Oklahoma police chief in Florida"	"newscrime"
"1"	"An Awkward Moment As Meghan Markle Met A Curtsy Attempt With An American Greeting"	"lifestylevideo"
"0"	"Pete Davidson, Kaia Gerber seen on yet another date: Fresh details on their new romance"	"tv-celebrity"
"0"	"As Islamic Jihad and Israel Battled, Hamas, in a Twist, Sat on the Sidelines"	"newsworld"
"1"	"Sea Salt vs. Table Salt: Which One Is Better for You?"	"nutrition"
"0"	"Venice 'on its knees' after second-worst flood ever recorded"	"newsworld"
"0"	"Best royal photos of 2019"	"lifestyleroyals"
"0"	"Miranda Lambert Is at a 'Comfortable Place' After She 'Struggled with Ups and Downs in Weight'"	"health-news"
"1"	"Celeb kids' cutest Halloween costumes"	"celebrity"
"0"	"The best burger and fries joint in your state"	"restaurantsandnews"
"0"	"Climate change could end mortgages as we know them"	"finance-real-estate"
"0"	"How to Turn Getting Kicked Off an Overbooked Flight Into a Payday"	"video"
"1"	"Hannah Brown on Being Surrounded By Exes Tyler Cameron and Colton Underwood"	"tv-celebrity"
"0"	"2019 People's Choice Awards fashion hits and misses"	"awards"
"0"	"Americans now have a record $14 trillion in debt"	"personalfinance"
"0"	"2020 Jeep Gladiator Review: This Jeep Stands Out. Is That a Good Thing?"	"autostrucks"
"0"	"Whitney Way Thore Responds After Trolls Shamed Her for Attempting a Power Snatch"	"wellness"
"1"	"Welcome to the World! All of the Celebrity Babies Who've Made Their Debuts in 2019"	"celebrity"
"1"	"Cornell student, 18, found dead in gorge after frat party, reports say"	"newsus"
"0"	"Nonsmoking mom of 4 thought she had asthma, but it was late-stage lung cancer"	"ads-lung-health"
"0"	"Beijing slams Pompeo for 'Cold War thinking' in Berlin speech"	"newsworld"
"0"	"Longtime Republican Rep. Pete King won't seek reelection"	"elections-2020-us"
"0"	"Hero Police Officer Saves Driver From Fiery Crash"	"newsgoodnews"
"0"	"A Nutella Hotel Is Opening in California"	"travelnews"
"1"	"Here's What Happened When Rihanna and Drake Reunited at His Birthday Party"	"music-celebrity"
"0"	"How to get the best Costco Black Friday 2019 deals"	"finance-savemoney"
"1"	"Body of missing Alabama girl found; 2 being charged"	"newscrime"
"0"	"Meghan Markle and Prince Harry Won't Spend Christmas with Queen Elizabeth at Sandringham This Year"	"lifestyleroyals"
"1"	"Demi Lovato debuts new boyfriend, plus more celeb love life news for mid-November 2019"	"entertainment-celebrity"
"0"	"Comics - '9 to 5' by Harley Schwadron"	"humor"
"1"	"Mother of missing Florida girl charged; human remains found"	"newscrime"
"0"	"See every outfit Duchess Meghan wore in 2019"	"lifestyleroyals"
"1"	"I Was Misdiagnosed With an Allergy and Panic Attacks Until An X-Ray Revealed The Real Problem"	"voices"
"1"	"What to Cook This Week (November 11 to November 17)"	"recipes"
"0"	"Here's How to Season a Turkey So It Actually Tastes Like Something"	"tipsandtricks"
"0"	"One in 5 children live below the poverty line: Here are the states with the highest number of kids dependent on free lunches"	"causes-poverty"
"0"	"USA TODAY interview: Nikki Haley isn't running for president. That is, not yet."	"newselection2020"
"0"	"Read: William Taylor's opening statement at impeachment hearing"	"newspolitics"
"0"	"4 frat deaths this month. 2 this week alone. What's going on with fraternity hazing?"	"newsus"
"0"	"Pope blasts 'inhuman, un-Christian' rebirth of anti-Semitism"	"newsworld"
"1"	"Horrific details emerge in 'barbaric' murder of 1999 Jane Doe"	"newscrime"
"1"	"Deadly Arctic blast breaks records set more than 100 years ago"	"weathertopstories"
"0"	"Florida woman set boyfriend's house on fire after catching him cheating: report"	"newscrime"
"0"	"Harrods accused of ruining the spirit of Christmas after limiting Santa visits to customers who spend over $2,500"	"finance-companies"
"0"	"Kodak Black Sentenced to Over 3 Years in Prison in Weapons Case"	"music-celebrity"
"1"	"Celebrity Halloween costume fails"	"celebrity"
"0"	"Stop! Read This Guide Before You Buy an Air Fryer."	"tipsandtricks"
"1"	"Man accused of killing woman, recording it on SD card charged in 2nd Alaska murder"	"newscrime"
"0"	"2020 Ford Explorer launch hardly went according to plan, company admits"	"autosnews"
"0"	"The biggest royal news of 2019"	"lifestyleroyals"
"1"	"Young and the Restless Star William Wintersole Dies at 88"	"tvnews"
"1"	"Photos: NICU Babies Celebrate Halloween"	"newsgoodnews"
"0"	"SpaceX set to launch another 60 Starlink internet satellites"	"newsscienceandtechnology"
"0"	"A man lost 400,000 frequent flyer miles for sneaking a fat cat onto his flight in Russia"	"travelnews"
"0"	"Why Prince Harry Wore His Remembrance Poppy Differently from the Rest of the Royal Family"	"lifestyleroyals"
"0"	"The People's Choice Awards Red Carpet Was Like a Casting Call For the Hottest Dresses of the Year"	"awardstyle"
"0"	"Biggest celeb weddings of the last decade"	"celebrity"
"0"	"The biggest travel trends of the decade"	"travelnews"
"0"	"Please Don't Yell at Your Dog!"	"lifestylebuzz"
"1"	"Candid Celeb Pics You Need to See This Week"	"entertainment-celebrity"
"1"	"North Texas Couple Moving Into New Home Sees It Destroyed By Tornado"	"newsoffbeat"
"0"	"Trump says he's not watching impeachment hearing   then critiques it"	"newspolitics"
"0"	"Celebrity Christmas albums: From beloved classics to big surprises"	"music-gallery"
"1"	"Mother Is Freed After 15 Years in Prison for Father's Abuse"	"newscrime"
"0"	"Counting On's Josiah, Lauren Welcome 1st Child After Miscarriage"	"tv-celebrity"
"0"	"Today in History: November 12"	"newsworld"
"1"	"A father and his 6 children spent at least 9 years in a basement waiting for the world to end"	"newsworld"
"0"	"They bought a 1 euro house in Italy -- here's what happened next"	"travelnews"
"0"	"Rip Taylor's Cause of Death Revealed, Memorial Service Scheduled for Later This Month"	"tvnews"
"1"	"16 transgender celebrities who are changing television"	"tv-gallery"
"0"	"We Tested Canned Pumpkin Against the Fresh Stuff⁠ Here's the Winner"	"tipsandtricks"
"0"	"Model Belle Lucia   Who Was Shamed for Her Small Bump   Shares Her Post-Baby 'Pregnancy Transformation'"	"wellness"
"1"	"Austrian army says soldier mauled to death by service dogs"	"newsworld"
"0"	"Should Chevy Bring This Three-Row Blazer to the U.S.?"	"autossuvs"
"0"	"Ancient cup given to 1st marathon victor returned to Greece"	"newsworld"
"0"	"The Most Talked-About Celebrity Hair Transformations"	"lifestylecelebstyle"
"0"	"On a frigid night in Dallas, one man who used to be homeless ushered people to shelter"	"weathertopstories"
"0"	"Suspect arrested in murder of 6-year-old girl who was shot while asleep in her home"	"newscrime"
"0"	"The Most Amazing Photos of a Young Dolly Parton"	"cma-awards"
"1"	"Eva Mendes Gushes Over Photo of Longtime Love Ryan Gosling: 'Look at Him!'"	"movies-celebrity"
"0"	"Signs of Dementia: 8 Tips For Talking to Your Older Parents"	"mentalhealth"
"0"	"The 12 Texas cities everyone in the country is moving to"	"newsphotos"
"0"	"See All the Best Photos of Prince Charles's Trip to India"	"lifestyleroyals"
"0"	"Ohio-grown Christmas trees headed to troops overseas"	"newsgoodnews"
"0"	"Here's the Very Best of Oprah's Favorite Things"	"shop-holidays"
"0"	"Democrat Joe Biden proposes $1.3 trillion U.S. infrastructure plan"	"newselection2020"
"0"	"Today in History: November 13"	"newsworld"
"1"	"What Is Brown Butter and Should You Be Using It?"	"tipsandtricks"
"1"	"Lady Gaga, Jim Carrey, Christina Hendricks and Pete Davidson are all single again, plus more celeb love life news for late October 2019"	"celebrity"
"1"	"Snow crab sells for record price in Japan"	"foodnews"
"0"	"I wanted to learn to swim before I turned 30. Easier said than done."	"voices"
"0"	"Salted Fried Shrimp"	"recipes"
"0"	"Five questions the second College Football Playoff rankings will answer"	"football_ncaa"
"0"	"C8 Corvette Dyno Test Follow-Up: What Really Happened"	"autosnews"
"0"	"Dodge Put the Wrong Wheels on 173 New Challengers and Chargers"	"autosnews"
"0"	"For a healthy heart, eat the biggest meal early in the day"	"health-news"
"0"	"Nine student deaths has USC trying to quell rumors, prevent triggering students"	"newsus"
"1"	"20 Car Hacks That'll Make Driving So Much Better"	"autosownership"
"0"	"Fox legal analyst Napolitano emerges as Trump critic"	"newsus"
"0"	"65 Best Fall Soups That Will Warm You and Your Family Up All Season Long"	"recipes"
"0"	"9 signs you've shifted from frugal to cheap"	"finance-savemoney"
"1"	"The Weinstein Co. Gets Closer to Suing Harvey and Bob Weinstein"	"movienews"
"1"	"Four flight attendants were arrested in Miami's airport after bringing in thousands in cash, police say"	"newscrime"
"1"	"Are Kylie Jenner and Travis Scott rekindling their romance? Plus, more news"	"celebrity"
"0"	"10 Tasty Side Dishes for Your Holiday Ham"	"recipes"
"0"	"Sessions vows to 'work for' Trump endorsement"	"elections-2020-us"
"0"	"See inside a woman's 270-square-foot tiny home complete with 2 bedrooms and a walk-in closet"	"lifestylebuzz"
"0"	"Walmart hires off-duty officers ahead of El Paso reopening"	"newsus"
"0"	"3 stocks to buy even if markets keep climbing"	"finance-top-stocks"
"0"	"Redskins name rookie Dwayne Haskins starter for rest of season"	"football_nfl"
"0"	"American woman apparently strangled in the Dominican Republic"	"newsworld"
"0"	"Helping veterans launch startups: 'There's a level of resilience that a lot of people in the military have, which is great for running your own business'"	"newsgoodnews"
"0"	"Jamie Dimon: The '60 Minutes' interview"	"finance-companies"
"0"	"30 Cozy Vegetarian Soups We'll Be Eating All Winter Long"	"recipes"
"0"	"3 pieces of dated retirement advice you should ignore"	"finance-retirement"
"0"	"Every Team's Best Play | Week 10"	"football_nfl_videos"
"1"	"Celebrities dressed as other stars for Halloween"	"entertainment-celebrity"
"0"	"Trump crows after hearing, says diplomats stumped by 'impeachable' offense question"	"newspolitics"
"0"	"I ordered clothes from those cheap online stores, and I'm not sold"	"voices"
"1"	"'The face of heroin': Mom shares haunting before and after pics of addiction"	"health-news"
"1"	"WWE Wrestler Jordan Myles Quits in Expletive-Filled Rant as He Brands the Company Racist"	"tvnews"
"0"	"17 New Cars With the Coolest-Looking Engines"	"autosenthusiasts"
"0"	"Southwest pilots union says Boeing may be trying to hasten 737 MAX return"	"finance-companies"
"0"	"Powerful hard-liner: Iran should stop honoring nuclear deal"	"newsworld"
"1"	"Reese Witherspoon Celebrates Son Deacon's 16th Birthday With Touching Post"	"movies-celebrity"
"0"	"12 Military-Themed TV Shows to Binge-Watch on Veterans Day"	"tv-gallery"
"0"	"The Best Thanksgiving Brunch Recipes to Start Turkey Day off on a Delicious Note"	"recipes"
"1"	"Hailey Bieber Is Sending Subtle Support to Selena Gomez After New Music Release"	"musicnews"
"0"	"Lung Cancer Left Me in Limbo But It Won't Stop Me From Living My Life"	"ads-lung-health"
"0"	"6 Cost-Saving Tips for Traveling in Retirement"	"video"
"1"	"100+ Funny White Elephant Gifts That'll Leave Everyone Laughing Hard This Holiday Season"	"shop-holidays"
"1"	"Christina Anstead Reveals Son 'Will Sometimes Cry for Hours Straight': 'Newborn Life Is Hard'"	"tv-celebrity"
"0"	"Harry and Meghan Revive Feud Rumors By Staying Away From the Royal Family's Christmas"	"lifestyleroyals"
"1"	"Watch These Newborn Panda Cubs Open Their Eyes For the First Time"	"animals"
"0"	"Google Maps Says This Is the Worst Time to Leave for Thanksgiving Travel"	"traveltips"
"0"	"18 Things from 2009 We Miss"	"lifestyledidyouknow"
"0"	"Flamingo Ends Up In One Of The Coldest Parts Of Russia!"	"animals"
"1"	"2-year-old shot dead in Philadelphia day after 11-month-old shot 4 times"	"newscrime"
"1"	"Painting that Nazis stole from Jewish family recovered from N.Y. museum"	"newscrime"
"0"	"2020 Subaru Outback vs. 2019 Honda Passport: Which Is the Better Mid-Size Utility Vehicle?"	"autossuvs"
"1"	"Funny celeb pics for October 2019"	"humor"
"1"	"Georgia authorities search for convicted rapist and child molester who was released 'in error' from prison"	"newscrime"
"0"	"Stocks close little changed amid lingering trade worries"	"markets"
"0"	"Saudi promo video labels feminism, atheism, homosexuality as extremist ideas"	"newsworld"
"0"	"House Democrat: 'Sham' investigation of Bidens will not dominate impeachment hearings"	"newspolitics"
"1"	"Celebs' all-time most embarrassing pop culture moments"	"entertainment-celebrity"
"0"	"Nurse takes in man with autism so he can get a new heart"	"newsgoodnews"
"0"	"Shocking Daycare Rate List Sparks Outrage & Shines a Light on Child Care Crisis in America"	"lifestylebuzz"
"0"	"2019 Ford Ranger Pros and Cons Review: What a Powertrain!"	"autostrucks"
"1"	"20 award-winning photos of dogs from 2019's Dog Photographer of the Year competition"	"lifestylebuzz"
"0"	"I Donated Blood for the First Time at 27, and It Ended in Signs of Cardiac Arrest"	"voices"
"1"	"25 Gifts for the Ultimate Champagne Lover"	"beverages"
"1"	"'SOS' picked up on CCTV saves Aussie woman lost in bush"	"newsworld"
"1"	"Scientists freak out over deep sea feast"	"wonder"
"0"	"Experts crack mystery of ancient Egypt's sacred bird mummies"	"newsscienceandtechnology"
"0"	"Thanksgiving side dishes: 11 unique recipes to try this season"	"foodnews"
"0"	"US held record number of migrant children in custody in 2019"	"newsus"
"0"	"Kristina Went From 'Drastic Diets' to Losing 105 Pounds With WW - Here's How She Did It"	"weightloss"
"0"	"40+ Ridiculously Good Gluten-Free Thanksgiving Recipes"	"recipes"
"1"	"Lamar Odom Is Engaged to Sabrina Parr: See Her Ring!"	"celebrity"
"1"	"Stars who welcomed babies in 2019"	"celebrity"
"1"	"Zendaya, Nicole Kidman and More Best Dressed Stars at Elle's Women in Hollywood Event"	"lifestylecelebstyle"
"0"	"Elton John, Brad Pitt, and More Celebs Who Changed Their Names"	"celebrity"
"0"	"'Baby Shark' Devoured Your Brain. Your Wallet Is Harder to Swallow."	"finance-companies"
"0"	"Eager to witness 'history,' people, protesters huddle outside Trump impeachment inquiry hearing"	"newsus"
"0"	"Police arrest suspect in fatal stabbing over Popeyes chicken sandwich"	"newscrime"
"0"	"How to Cure Jet Lag, According to an Airline CEO"	"traveltips"
"1"	"Gigi Hadid Unfollows Tyler Cameron on Instagram 1 Month After Split"	"tv-celebrity"
"0"	"Trump juggles statecraft and impeachment on a historic day"	"newspolitics"
"1"	"Ehlers-Danlos syndrome: Here's what you need to know"	"health-news"
"1"	"Here Are the Biggest Deals We're Anticipating for Black Friday"	"shop-holidays"
"0"	"UK flooding: army to help recovery effort as more rain forecast"	"newsworld"
"1"	"Police identify suspect in Aniah Blanchard missing person case"	"newscrime"
"0"	"Look of the Day"	"lifestylebuzz"
"0"	"Fashion hits and misses from the 2019 Country Music Association Awards"	"cma-awards"
"0"	"Comics - 'Half Full' by Maria Scrivan"	"humor"
"0"	"Stephen Curry calls out Michael Jordan for being a 'hater'"	"sports_news"
"1"	"Chrissy Teigen's EPIC Reaction to Husband John Legend Being Named 2019 Sexiest Man Alive"	"video"
"1"	"Demi Lovato Goes Instagram Official With Boyfriend Austin Wilson: See Their Sweet Synchronized Posts"	"music-celebrity"
"1"	"These 34 Cool Kitchen Gadgets Make Perfect Gifts for Foodie Friends"	"tipsandtricks"
"1"	"Little Boy And His Dog BFF Win Halloween"	"lifestylebuzz"
"1"	"Prince Harry and Meghan Markle just shared a never-before-seen photo of baby Archie with his 'Grandpa' Prince Charles to celebrate his birthday"	"lifestyleroyals"
"0"	"Gwen Stefani and Blake Shelton Are Couples Goals at the 2019 CMA Awards"	"cma-awards"
"0"	"From Idris Elba to Richard Gere: All the Sexiest Man Alive Covers"	"celebrity"
"0"	"Kate Middleton's Maroon Trousers Gave Her a Pop of Color During Her Charity Outing"	"lifestyleroyals"
"0"	"Marcia Cross' anal cancer may have been linked to HPV. She wants people to know they could have the virus, too."	"health-news"
"0"	"'One in a million' deer captured on camera in Michigan woods"	"newsus"
"0"	"How a preacher sent gunmen into Burkina Faso's schools"	"newsworld"
"1"	"Lil Pump bit by snake on set of music video"	"musicnews"
"0"	"Surgeon Shocked After Doing Double Lung Transplant on Teen Vaper: 'Evil I Haven't Faced Before'"	"ads-lung-health"
"1"	"Ex-SS guard on trial: I saw people led into gas chamber"	"newsworld"
"1"	"Louisiana judge dismisses Nick Loeb's embryo lawsuit against Sofia Vergara: Details"	"tv-celebrity"
"0"	"Utah death-row inmate featured in best-selling book dies"	"newscrime"
"0"	"20 stocks that could double your money in 2020"	"finance-top-stocks"
"0"	"FAA threatened to ground 38 Southwest Airlines jets over maintenance concerns, report says"	"travelnews"
"0"	"The Day in Sports: Sunday, November 10, 2019"	"more_sports"
"0"	"Ree Drummond Says a Low-Carb Diet Is the Secret to Her Incredible Weight Loss"	"weightloss"
"0"	"Take action: Join MSN, LinkedIn and Team Rubicon in helping veterans become thriving civilians"	"causes-military-appreciation"
"0"	"WH plans "aggressive" strategy for open impeachment hearings"	"newspolitics"
"0"	"Frackers Prepare to Pull Back, Exacerbating a Slowdown in U.S. Oil Growth"	"markets"
"0"	"13 Ways You're Shortening the Life of Your Car"	"autosownership"
"0"	"'Not everyone's the star': Inside Landon Donovan's decision to coach the USL's San Diego Loyal"	"soccer"
"1"	"Scared Rabbit Abandoned In Box Clings To His Favorite Teddy Bear"	"lifestylebuzz"
"0"	"Former U.S. President Carter recovering in hospital after successful brain procedure"	"newsus"
"1"	"New search planned for missing 5-year-old"	"newsus"
"0"	"11 Fine-Dining Etiquette Rules You've Probably Broken Your Whole Life"	"videos"
"0"	"11 reasons to watch Week 11 of the 2019 NFL season"	"football_nfl_videos"
"0"	"These Are America's Favorite Liquor Brands"	"beverages"
"0"	"Report: Ohio State asks NCAA to reinstate star DL Chase Young immediately"	"football_ncaa"
"0"	"Mulvaney's move to join impeachment testimony lawsuit rankles Bolton allies"	"newspolitics"
"0"	"Gwen Stefani's Gown Says "Fashion Icon," So Like, No Doubt That's What She Is"	"awardstyle"
"0"	"Scarlett Johansson Regrets Being "Hyper-Sexualized" Early in Her Career"	"movienews"
"0"	"Female Thunderbird pilot inspiring others to chase their dreams"	"newsgoodnews"
