"1"	"Mixed martial arts star McGregor convicted of assault, fined 1,000 euro"	"mma"
"0"	"Deer-like animal thought lost to science photographed for first time in 30 years"	"newsworld"
"0"	"Rip Taylor's Cause of Death Revealed, Memorial Service Scheduled for Later This Month"	"tvnews"
"0"	"Teen survivor recalls horrifying details of ambush in Mexico that killed 9"	"newsworld"
"0"	"There's a Very Specific Meaning Behind Jane Fonda's Red Coat"	"lifestylebuzz"
"1"	"Demi Moore Names Male Co-Star Who Didn't Deserve to Make More Money Than Her"	"tvnews"
"0"	"How To Avoid These 14 Home Renovation Horror Stories"	"finance-real-estate"
"0"	"Gwen Stefani's Gown Says "Fashion Icon," So Like, No Doubt That's What She Is"	"awardstyle"
"0"	"From Idris Elba to Richard Gere: All the Sexiest Man Alive Covers"	"celebrity"
"1"	"Fresh Off the Boat Canceled After Six Seasons"	"tvnews"
"0"	"Lines of Desire: Follow the Trail to Real Estate Investment Success"	"newsbusiness"
"1"	"'I Am Not a Witch': Victims Testify on Ex-President's Brutal Roundups"	"newsworld"
"1"	"Man lost his house over $8.41 in unpaid property taxes"	"finance-real-estate"
"0"	"How a little-known GOP lawmaker became a point man in Trump's impeachment defense"	"newspolitics"
"1"	"Rising California gasoline prices highlight growing divide in US"	"markets"
"0"	"US Forest Service shuts down vandalized Georgia park feature"	"newsus"
"1"	"California cops respond to 2 homeless men shot with arrows: report"	"newscrime"
"0"	"Ford v Ferrari: the real story"	"autosnews"
"1"	"A Military Camera Said 'Made in U.S.A.' The Screen Was in Chinese."	"newsus"
"0"	"A master suite with an 'open-concept' bathroom that has no doors   or privacy   is asking for $1,200/month in rent"	"lifestylebuzz"
"0"	"California teen killed in gang-related shooting, 2 people charged with murder, police say"	"newscrime"
"0"	"California teen killed in gang-related shooting, 2 people charged with murder, police say"	"newscrime"
"0"	"Steph Curry seems to have added Michael Jordan to his list of haters"	"basketball_nba"
"1"	"Top Seattle news: Elderly couple's home hit with gunfire; Nordstrom opens NYC flagship; more"	"newsus"
"0"	"On a frigid night in Dallas, one man who used to be homeless ushered people to shelter"	"weathertopstories"
"0"	"Cassius Winston posts heartfelt message to late brother on Instagram"	"basketball_ncaa"
"0"	"Guaido backers enter Venezuela embassy in Brasilia, sparking standoff"	"newsworld"
"0"	"Every touchdown from every Week 10 game"	"football_nfl_videos"
"0"	"Unexpected Signs of an Unhealthy Heart"	"medical"
"0"	"37 Years After His Wife Is Found Dead with an Ax in Her Skull, Husband Is Arrested"	"newscrime"
"0"	"Raised an only child, Southgate woman, 92, learns she has 19 half siblings"	"newsgoodnews"
"1"	"Snohomish Co. mother warning other parents after stranger tries to lure daughter into car"	"newscrime"
"1"	"2nd serious crash in a week along Fall City Road in Preston raises concerns"	"autosnews"
"0"	"The Disney+ 'Lady and the Tramp' remake: A guide to the new cast members"	"movies-gallery"
"0"	"This Guy Lost 30 Pounds and Gained a Rock-Hard Six Pack"	"weightloss"
"0"	"12 Military-Themed TV Shows to Binge-Watch on Veterans Day"	"tv-gallery"
"1"	"Airline passengers share photos of their worst in-flight meals"	"travelnews"
"1"	"The Geno Smith coin toss conspiracy is the dumbest thing in Seahawks' win over 49ers"	"football_nfl"
"0"	"The NFL Hot Seat: Sean McVay ran out of magic, and Jared Goff isn't helping"	"football_nfl"
"1"	"Take That! BIP's Hannah G. Claps Back After Mispronouncing 'Gnocchi'"	"tv-celebrity"
"1"	"Mike 'The Situation' Sorrentino Fires Back After Steroid Accusations"	"tv-celebrity"
"0"	"Iconic Seattle Chain Rachel's Ginger Beer About to Open New Spot Near the Spheres"	"newstrends"
"0"	"Fast food cashier and manager fired for refusing to serve police officer"	"newsus"
"0"	"Gwen Stefani Sets the Record Straight on That Diamond Ring at 2019 People's Choice Awards"	"music-celebrity"
"0"	"A 'Harry Potter' fan transformed his bedroom into Dumbledore's office, and the before-and-after photos are magical"	"newsoffbeat"
"1"	"Jack Reacher is in deep trouble in Lee Child's 'Blue Moon'"	"entertainment-books"
"0"	"Comics - '9 to 5' by Harley Schwadron"	"humor"
"1"	"'It's time for this to stop' | SWAT officers thwart armored car robbery, suspect shot in SW Houston"	"newscrime"
"1"	"Singer Lauren Alaina Has Lost 25 Lbs. on Dancing with the Stars: 'None of My Clothes Fit'"	"tv-celebrity"
"1"	"2020 Nissan Titan XD Has Stronger Bones and More Muscle"	"autostrucks"
"1"	"California Nike store robbed by thieves who walked out with armfuls of merchandise"	"newscrime"
"0"	"Virginia doctor allegedly performed hysterectomies, tied fallopian tubes without consent"	"newscrime"
"0"	"30 home trends that ruled the last decade"	"lifestyledidyouknow"
"1"	"Pinterest stock plummets on disappointing results"	"finance-top-stocks"
"0"	"Meghan Markle Chose a Chic Black Ensemble for Remembrance Sunday Services"	"lifestyleroyals"
"1"	"Demi Moore Says Her 'Addiction' to Ashton Kutcher Was 'Devastating': 'It Took Me Away Emotionally'"	"tv-celebrity"
"0"	"97-year-old WWII veteran takes ride in B-17 bomber for Veteran's Day"	"newsus"
"0"	"For a healthy heart, eat the biggest meal early in the day"	"health-news"
"0"	"Stars who've had more than one wedding with the same spouse"	"entertainment-celebrity"
"0"	"How to Make Sure You Have a Seat Next to Your Family on Your Next Flight"	"traveltips"
"0"	"A $30,000 handbag. A disastrous wine spill. And now, a country club is suing its own waiter."	"markets"
"1"	"Deer stranded 5 miles offshore saved by Maine lobstermen"	"newsgoodnews"
"0"	"Big celebrity money moments of the last decade"	"entertainment-celebrity"
"0"	"Protesters blockade universities, business district as chaos grips Hong Kong"	"newsworld"
"1"	"Chicago teenager accused of shooting 7-year-old girl on Halloween faces court hearing Monday"	"newscrime"
"0"	"These 7 sports cars crushed their horsepower ratings in our dyno tests"	"autossports"
"0"	"E.P.A. to Limit Science Used to Write Public Health Rules"	"newsus"
"0"	"What Happens When a Plane Collides with a Flock of Birds?"	"travelnews"
"0"	"Nigel Farage offers Boris Johnson a truce, boosting prospects for Conservatives in December election"	"newsworld"
"1"	"Knight flight: Passenger dressed in full suit of armor, including chainmail and helmet, is spotted in departures at Atlanta airport…. Leaving travelers wondering how long it took him to get through security"	"travelnews"
"1"	"House Democrat criticizes Mississippi chicken plant raids"	"newsus"
"0"	"Every Food Gift on Oprah's Favorite Things List"	"foodnews"
"0"	"Pac-12 suspends referee after egregious mistake during Washington State vs. Cal game"	"football_ncaa"
"0"	"She posted for help with a quilt. More than 1,000 answered"	"newsgoodnews"
"0"	"Utah death-row inmate featured in best-selling book dies"	"newscrime"
"1"	"200 Shocking Home Photos You Have to See"	"lifestylehomeandgarden"
"0"	"Justice Dept. rolls out new program to combat gun violence"	"newsus"
"0"	"Read George Kent Full Opening Statement at the First Public Hearing in Trump's Impeachment Inquiry"	"newspolitics"
"0"	"19 hysterical winners from this year's Comedy Wildlife Photography Awards"	"lifestylebuzz"
"0"	"PEOPLE's Sexiest Men Alive: Still Sexy After All These Years"	"celebrity"
"0"	"How to Cure Jet Lag, According to an Airline CEO"	"traveltips"
"1"	"Tourist in Venice kidnaps local woman in row over exchange rate"	"travelnews"
"1"	"17 Arrested In Large Washington Drug Trafficking Bust"	"newscrime"
"1"	"Navy lieutenant and wife charged with defrauding the United States"	"newsus"
"0"	"Poland asks Netflix to make changes to documentary about Nazi death camp guard"	"newsworld"
"1"	"200 Shocking Home Photos You Have to See"	"lifestylehomeandgarden"
"0"	"3 Men Shot Just After Noon In Brainerd Neighborhood"	"newscrime"
"0"	"How the 2020 Corvette C8 Turned This Vette Hater Into a Believer"	"autosnews"
"0"	"Supreme Court refuses to block lawsuit against gun manufacturer brought by Sandy Hook families"	"finance-companies"
"0"	"U.S. proposes denying work permits to asylum seekers who enter illegally"	"newsus"
"0"	"Charles Rogers, former Michigan State football, Detroit Lions star, dead at 38"	"football_nfl"
"1"	"In Less Than a Decade, You Won't Be Able To Afford a Home in These Cities"	"finance-real-estate"
"0"	"Connelly: The ongoing, back door bid to commercialize our national parks"	"travelnews"
"1"	"11-year-old boy dies after being shot in chest"	"newscrime"
"0"	"This Is the Worst Thing You Can Do If You're Trying to Lose Body Fat and Build Muscle"	"fitness"
"1"	"3 reasons I bought a house after swearing I'd rent for life"	"finance-real-estate"
"0"	"Eager to witness 'history,' people, protesters huddle outside Trump impeachment inquiry hearing"	"newsus"
"1"	"Lindsay Lohan's dad weighs in on her relationship with the Saudi crown prince"	"movies-celebrity"
"1"	"51 children injured in chemical attack at Chinese kindergarten after man sprays caustic soda"	"newsworld"
"1"	"Dodge Put the Wrong Wheels on 173 New Challengers and Chargers"	"autosnews"
"1"	"Essex truck deaths: Police identify 39 people found dead in truck as Chinese nationals"	"newsworld"
"0"	"Khris Middleton expected to miss several weeks with leg injury"	"basketball_nba"
"0"	"Top 7 Mistakes to Avoid When Removing Snow"	"lifestylehomeandgarden"
"0"	"After push from Perry, backers got huge gas deal in Ukraine"	"newspolitics"
"1"	"They paid $800 a month to live without water or power in an abandoned L.A. church"	"finance-real-estate"
"1"	"Firestorm over massive pile of fire wood in Lake Stevens"	"finance-real-estate"
"1"	"Mayfield's postgame outfit gets all the memes"	"football_nfl"
"0"	"Stella McCartney Deleted a Meghan Markle Instagram Post After Followers Called Her Out"	"lifestyleroyals"
"1"	"A bodybuilder showed how fitness influencers can make their bodies look Instagram-perfect in before-and-after photos"	"fitness"
"0"	"How to Make Cornbread Without a Recipe"	"quickandeasy"
"1"	"Stowaway Discovered in Couple's Carry-On Luggage"	"travelnews"
"0"	"The son of a Chinese billionaire has been banned from flying first class, playing golf, buying property, or going clubbing"	"newsworld"
"0"	"Driver on the Street: Miss Peggy brightens Tacoma students' school days"	"newsoffbeat"
"0"	"Watch the 'Footloose' Dance Warmup That Gets These High Schoolers Ready to Race"	"fitness"
"1"	"Southwest 'Vigorously Denies' Accusation That Pilots Placed Hidden Camera in Bathroom"	"travelnews"
"0"	"Halle Berry Shares Photo of 6-Pack Abs on Instagram and Her Fans are Freaking Out"	"fitness"
"0"	"Deadly Arctic blast breaks records set more than 100 years ago"	"weathertopstories"
"0"	"The biggest wastes of money in 2019"	"personalfinance"
"0"	"Hunter Biden could be collateral damage as Trump impeachment hearings begin"	"newspolitics"
"0"	"Best country music albums of all time"	"cma-awards"
"0"	"These Are The Best Harley-Davidson Motorcycles You Can Get For The Cheap"	"autosmotorcycles"
"1"	"Man dies after stabbing in Maryland Popeyes; fight over chicken sandwich, sources say"	"newscrime"
"0"	"My Third Husband Is 102 Years Old. Here's What Our Marriage Is Like."	"voices"
"0"	"Sheriff's deputy charged with murder after man shot, killed"	"newscrime"
"0"	"See All the Best Photos of the Royal Family at Remembrance Sunday"	"lifestyleroyals"
"0"	"9 renovation tips to boost resale value"	"finance-real-estate"
"0"	"Small Plane Crashes In Lake Morton, Pilot Rescued By Kayaker"	"weathertopstories"
"1"	"Kelly Ripa Jokes Son Michael Is Experiencing 'Extreme Poverty' in Brooklyn"	"tv-celebrity"
"0"	"How Did Armistice Day Become Veterans Day in the United States?"	"newsus"
"0"	"Kim Kardashian Looked Minty Fresh in Versace at the People's Choice Awards"	"awardstyle"
"1"	"Man who advocated caning for adultery gets caned for adultery"	"newsus"
"1"	"A teen received a response to a message in a bottle he wrote 9 years ago after it traveled over 3,000 miles"	"lifestylebuzz"
"1"	"As Bad as WeWork Is, It Could Get Even Worse"	"finance-companies"
"0"	"Jerry Jones hopes loss to Vikings isn't 'terminal'"	"football_nfl"
"0"	"Stylish Living Room Ideas, From Floral to Family-Friendly"	"lifestylehomeandgarden"
"0"	"28 Dumb Ways You Could Lose It All by Trying To Get Rich"	"personalfinance"
"0"	"Anonymous anti-Trump book is already a hit and it's not on shelves until next week"	"newspolitics"
"1"	"Man in elderly mask threatened schools to distract police so he could rob a bank, police say"	"newscrime"
"0"	"45 Abandoned Places Around the World That Are Eerily Beautiful"	"traveltripideas"
"0"	"Harry and Meghan Revive Feud Rumors By Staying Away From the Royal Family's Christmas"	"lifestyleroyals"
"0"	"Off-Road Diesel Truck Showdown: GMC Sierra 1500 AT4 vs. Ram 1500 Rebel"	"autostrucks"
"1"	"Kate Beckinsale is a knockout in corset dress adorned with white feathers at 'Farming' premiere"	"lifestylecelebstyle"
"1"	"Boeing's 737 Max troubles deepen, weighing on airlines, suppliers"	"finance-companies"
"0"	"Just like NFL's deal with Jay-Z, the Colin Kaepernick workout looks like a PR trap"	"football_nfl"
"1"	"Authorities: 2 indicted in deputy slaying in US illegally"	"newscrime"
"1"	"NYPD Defends Officers Caught On Video Arresting Woman Selling Churros Inside Subway Station"	"newscrime"
"1"	"Four flight attendants were arrested in Miami's airport after bringing in thousands in cash, police say"	"newscrime"
"1"	"Man's trip to a cheese shop helps unravel missing persons case"	"newscrime"
"0"	"How I Got Lung Cancer at 31 Without Ever Smoking a Single Cigarette"	"health-cancer"
"0"	"USA TODAY interview: Nikki Haley isn't running for president. That is, not yet."	"newselection2020"
"0"	"Here Are the Biggest Deals We're Anticipating for Black Friday"	"shop-holidays"
"1"	"Man fatally burned in a fiery Tesla after door wouldn't open, lawsuit alleges"	"newsus"
"1"	"Chick-fil-A owner fights back against 'slowest drive-thru' accusations"	"foodnews"
"0"	"All eyes on Texas governor as calls grow to halt execution"	"newscrime"
"0"	"Neil Young Says U.S. Citizenship Application Delayed By Marijuana Use"	"music-celebrity"
"1"	"Florida kayaker rescues woman trapped overnight in submerged vehicle"	"newsus"
"0"	"Flight Attendants Have a Secret Language You Didn't Know About"	"travelnews"
"1"	"Son wears hot dog costume for school picture day after parents' dare"	"lifestylebuzz"
"0"	"2020 Ford Bronco: Everything we know about Ford's new SUV"	"autossuvs"
"0"	"These 30 Incredible Kids Really Changed the World"	"newsgoodnews"
"0"	"Do Pilots Actually Avoid Flying Over the Bermuda Triangle?"	"video"
"0"	"Russell Wilson vs. 49ers' No. 1 defense: Monday night's prime-time matchup"	"football_nfl"
"1"	"WSDOT Works To Clear Logjam Under Everett's Trestle Bridge"	"newsus"
"0"	"Sean Spicer Admits He's Somewhat 'Relieved' to Be Eliminated from Dancing with the Stars"	"tvnews"
"1"	"'Wheel of Fortune' fans can't believe all three contestants missed puzzle"	"popculture"
"0"	"Cincinnati Teen Arrested After Allegedly Making Up Story about Missing Autistic 13-Year-Old Who Never Existed"	"newscrime"
"1"	"Why You Should Always Close the Door Before You Go to Bed"	"wellness"
"0"	"Pentagon chief: No penalty for officer in impeachment probe"	"newspolitics"
"1"	"Ford posts lower profit and trims its full-year outlook"	"finance-companies"
"1"	"Las Vegas adopts ban on sleeping, camping on streets, sidewalks"	"newsus"
"0"	"Ala. lawmen help get hitchhiking disabled veteran to doctor's appointment across state"	"newsgoodnews"
"1"	"'I don't want a mess': Mexico broadcasts video of El Chapo's son's arrest"	"newsworld"
"0"	"Miami symphony oboe player dies after falling down stairs in concert hall minutes before performance"	"newsus"
"0"	"Gabbard Lawyers Demand Clinton Retract 'Defamatory' Russian Asset Comments"	"elections-2020-us"
"1"	"McDonald's apologizes for 'Sundae Bloody Sundae' Halloween promotion"	"finance-companies"
"0"	"'Stay alert': millions of Australians brace for 'catastrophic' bushfires"	"newsworld"
"1"	"Apartments for rent in Seattle: What will $2,200 get you?"	"newsus"
"1"	"Driver accused in crash that killed trooper surprises courtroom with apology"	"newscrime"
"0"	"Tristan Thompson Gushes Over Ex Khloe Kardashian After Her People's Choice Win"	"tv-celebrity"
"1"	"Everyday heroes step up to help lone Waffle House employee"	"restaurantsandnews"
"0"	"Alicia Keys Goes on 'Major Rant' Over Son's Fears of Being Judged for His Rainbow Manicure"	"music-celebrity"
"0"	"17 Outdated Office Etiquette Rules That Are So Laughable Today"	"lifestylecareer"
"0"	"How Russia Meddles Abroad for Profit: Cash, Trolls and a Cult Leader"	"newsworld"
"1"	"Designer says these $20 million shoes are the world's most expensive"	"markets"
"1"	"Tom Brady explains why he's angry at this point in the football season"	"football_nfl"
"1"	"Buy a Real Car Now Before They Become Extinct"	"personalfinance"
"1"	"Flight shaming is gaining traction and could cost airlines billions"	"finance-companies"
"0"	"11-year-old boy dies after being shot in chest"	"newscrime"
"1"	"Notorious Low Bridge Known For Decapitating Box Trucks Getting Raised"	"autosnews"
"0"	"Do You Know How to Hang Christmas Lights on Your Tree?"	"lifestylehomeandgarden"
"0"	"Rudy Giuliani's globetrotting complicates US foreign policy"	"newspolitics"
"1"	"Ex-SS guard on trial: I saw people led into gas chamber"	"newsworld"
"0"	"'Grandma Joy,' grandson share photos of US as they try visiting all national parks"	"newsgoodnews"
"0"	"A man lost 400,000 frequent flyer miles for sneaking a fat cat onto his flight in Russia"	"travelnews"
"0"	"Historic battlefields are finding new life as parks and refuges"	"newsworld"
"0"	"Trump Organization ordered to pay $290,000 after losing battle against Scottish wind farm"	"newspolitics"
"1"	"Kodak Black Sentenced to Over 3 Years in Prison in Weapons Case"	"music-celebrity"
"0"	"Tesla Pickup Truck: 6 Features it Needs to Beat the Rivian R1T"	"autosnews"
"0"	"How to Turn Getting Kicked Off an Overbooked Flight Into a Payday"	"video"
"0"	"The Daily Northwestern Apologizes to Student Protesters for Reporting"	"newsus"
"1"	"Joe Biden reportedly denied Communion at a South Carolina church because of his stance on abortion"	"newspolitics"
"0"	"A Navy weapons station full of WWII-era ammunition bunkers could be transformed into 13,000 new homes in the Bay Area"	"finance-real-estate"
"1"	"Dog Throws A Total Tantrum When She Realizes Mom Wants To Take The Stairs"	"lifestylebuzz"
"0"	"'Dancing with the Stars': Why Sean Spicer survives despite the lowest judge scores"	"tvnews"
"1"	"Is retirement dying? The old work model is disappearing for Boomers, Gen Xers"	"finance-retirement"
"1"	"A Navy weapons station full of WWII-era ammunition bunkers could be transformed into 13,000 new homes in the Bay Area"	"finance-real-estate"
"0"	"9 fashion trends inspired by the 2000s that are coming back in style"	"lifestylefashion"
"1"	"25 bathrooms? Former Clinton labor secretary says Bezos' mansion helps make case for soaking the rich"	"markets"
"1"	"Horrific details emerge in 'barbaric' murder of 1999 Jane Doe"	"newscrime"
"1"	"Why Are Dressers Vanishing from Hotel Rooms?"	"travelnews"
"0"	"These companies are revolutionizing how people get paid"	"finance-companies"
"1"	"Passenger shaming hasn't worked. So maybe it's time to try airline shaming."	"travelnews"
"0"	"See inside a woman's 270-square-foot tiny home complete with 2 bedrooms and a walk-in closet"	"lifestylebuzz"
"0"	"A former royal bodyguard shared the challenges that come with protecting the royal family"	"newsoffbeat"
"1"	"Krispy Kreme orders Minnesota student who bought, resold doughnuts to 'shut down operations'"	"foodnews"
"0"	"Kaley Cuoco Says Having 'Separate Lives' Has Helped Her Marriage to Karl Cook"	"tv-celebrity"
"1"	"'It's not America': 11 million go without a license because of unpaid fines"	"newsus"
"0"	"5 top reasons drivers get tickets in Puget Sound area"	"lifestylebuzz"
"1"	"5 charged in alcohol poisoning death of UC Irvine fraternity brother"	"newscrime"
"1"	"Bachelor in Paradise Stars Tayshia Adams and John Paul Jones Split"	"tv-celebrity"
"0"	"The Unexpected Tool That Stands Between You & Perfectly Round Cookies"	"tipsandtricks"
"1"	"Top Seattle news: Sawant declares victory; tunnel traffic down 35% since tolling began; more"	"newsus"
"0"	"Lung Cancer Left Me in Limbo But It Won't Stop Me From Living My Life"	"ads-lung-health"
"0"	"We Tried 9 Packaged Stuffings and There Was a Clear Winner"	"tipsandtricks"
"0"	"​'My Annoying Cough Turned Out To Be Lung Cancer'"	"ads-lung-health"
"0"	"Celebrate Sounders' MLS Cup victory on Tuesday with parade through downtown Seattle"	"newsus"
"0"	"4 injured in shooting at adult club in Kansas City, Missouri"	"newscrime"
"0"	"Cold weather: 70% of the country will experience freezing temperatures this week"	"weathertopstories"
"0"	"In Defense Of Left Foot-Braking During Normal Street Driving"	"autosenthusiasts"
"0"	"Dad took 11-month-old to drug deal as 'human shield'. The baby was shot."	"newscrime"
"0"	"Rare Mustang! 1968 Shelby GT500 Prototype"	"autosclassics"
"0"	"Climate change could end mortgages as we know them"	"finance-real-estate"
"0"	"What's coming in impeachment: The inquiry goes public"	"newspolitics"
"1"	"Man left his wife nothing, and her stepchildren told her to scram"	"personalfinance"
"1"	"South Florida principal who made controversial comments about the Holocaust is fired"	"newsus"
"0"	"Thousands of people have problems accessing Disney+, and they're not happy"	"finance-companies"
"1"	"27 Easy Ways to Upgrade Your Kitchen Without Remodeling"	"lifestylehomeandgarden"
"1"	"Chick-fil-A Apologizes to Customers for Promoting National Sandwich Day   Which Is on a Sunday"	"foodnews"
"1"	"Kevin Spacey Won't Be Charged in Sexual Assault Case After Accuser Dies"	"movies-celebrity"
"0"	"Les Miles Has Some Thoughts on the Shape of the Earth"	"football_ncaa"
"0"	"Washington Transit Advocates Push For PNW Bullet Train"	"autosnews"
"1"	"Woman accused of sneaking into Bronx Zoo lion exhibit arraigned"	"newscrime"
"0"	"Porsche launches into second story of New Jersey building, killing 2"	"newsus"
"0"	"Ilhan Omar blasts Pete King as an 'Islamophobe' after he announces retirement: 'Good riddance'"	"elections-2020-us"
"1"	"Iowan convicted of murder claims his life-sentence was served once he died, was revived in medical emergency. The court disagrees."	"newscrime"
"0"	"Officials: At least 13 dead in Slovakia bus crash"	"newsworld"
"1"	"Customers Are Trolling Papa John's Over Their Jack-O'-Lantern Pizzas"	"restaurantsandnews"
"1"	"Deer fatally attacks hunter who shot him"	"newsus"
"0"	"Bode Miller delivered his twin boys after midwife didn't make it time for the birth"	"more_sports"
"0"	"Myanmar accused at UN court of genocide against Rohingya"	"newsworld"
"0"	"How the Trump Administration Eroded Its Own Legal Case on DACA"	"newsus"
"0"	"This Is The Moment A Senior Shelter Dog Knew He Was Safe"	"newsgoodnews"
"0"	"Sounders MLS Cup Championship Parade Planned Tuesday"	"soccer_mls"
"0"	"Mulvaney Request to Join Subpoena Lawsuit Opposed by House"	"newspolitics"
"1"	"35 Pet Peeves Interior Designers Have About Your Home"	"lifestylehomeandgarden"
"0"	"Country music's biggest scandals"	"music-awards"
"0"	"Israel says overnight strike on Gaza house killed Islamic Jihad commander"	"newsworld"
"0"	"Hong Kong police shoot at pro-democracy protesters"	"newsworld"
"0"	"For three decades, one man, now 75, has cared for Philly's Vietnam and Korean War memorials"	"newsus"
"0"	"Lisa Vanderpump Reveals Why She Left RHOBH: 'I Don't Have Room in My Life for Nastiness'"	"tvnews"
"0"	"Our 50 Best Thanksgiving Recipes"	"recipes"
"0"	"Chrissy Teigen's weekend was basically a clapback double-header, plus more news"	"entertainment-celebrity"
"0"	"45 Easy Handmade Christmas Ornaments to Start Making Now"	"lifestylediy"
"0"	"Hannah Brown on Being Surrounded By Exes Tyler Cameron and Colton Underwood"	"tv-celebrity"
"0"	"38 men who were worthy competitors for John Legend's Sexiest Man Alive title"	"celebrity"
"0"	"MLB awards week: Our picks for MVP, Cy Young, Rookie of the Year and more"	"baseball_mlb"
"0"	"The Latest Weight Loss Pills That Work And the Ones That Don't"	"nutrition"
"0"	"'I Have Waited 68 Years to See This': How Honor Flights Help Veterans Reflect"	"newsus"
"0"	"Amazing houses for sale in surprising places"	"finance-real-estate"
"0"	"Daisy Ridley plays coy about engagement speculation"	"movies-celebrity"
"0"	"Lamar Odom Is Engaged to Sabrina Parr: See Her Ring!"	"celebrity"
"1"	"Chile protests: Presidential apology and promises of reform fail to quell anger"	"newsworld"
"0"	"18 Quiet Dogs That Don't Bark (Too Much)"	"lifestylepetsanimals"
"1"	"EU regulator expects to clear Boeing 737 MAX in January at earliest"	"finance-companies"
"1"	"TV reporter fired after climbing on cars live at auto show"	"autosnews"
"1"	"4 injured in shooting at adult club in Kansas City, Missouri"	"newscrime"
"1"	"State Trooper Stops Banana Car Driver, Gives Him $20 Instead of a Ticket"	"autosenthusiasts"
"1"	"Pregnant Florida woman uses AR-15 to fatally shoot armed intruder"	"newsus"
"0"	"How and When to Watch the House Impeachment Hearings"	"newspolitics"
"0"	"AP-NORC poll: Many youths say high school diploma is enough"	"newsus"
"0"	"University suspends 14 frats after college freshman ends up in hospital"	"newsus"
"0"	"Mulvaney's move to join impeachment testimony lawsuit rankles Bolton allies"	"newspolitics"
"0"	"Is the Alabama Football Dynasty Ending?"	"football_ncaa_videos"
"1"	"It's Easy to Overdose on Acetaminophen and It Can Kill You, New Study Says"	"health-news"
"0"	"Ahead of this week's rematch, Tom Brady says he's still not quite over Super Bowl loss to Eagles"	"football_nfl"
