"0"	"Meghan Markle Chose a Chic Black Ensemble for Remembrance Sunday Services"	"lifestyleroyals"	"She paired her outfit with a bold hat and a crimson poppy pin."
"0"	"Nikki Haley grilled over Trump's Ukraine conduct, truthfulness"	"newspolitics"	"During the interview, NBC News' Savannah Guthrie pushed back on the former U.N. ambassador's claim that she was often the only one to speak her mind to the president."
"0"	"Amazing houses for sale in surprising places"	"finance-real-estate"	"Properties that look like they belong in another country."
"0"	"'Priceless' finds that turned out to be worthless"	"markets"	"From a bottle of rare Scotch whisky to a fake Picasso painting, we take a look at items from around the world that were believed to be highly valuable... but turned out to be worthless."
"0"	"Hong Kong Colleges Become Besieged Citadels as Police Close In"	"newsworld"	"HONG KONG   Seething with anger, the black-clad students hurled gasoline bombs, threw bricks and even aimed flaming arrows at the riot police, who answered with tear-gas volleys and rubber bullets that hurtled into Hong Kong's university grounds for the first time. And with those battles on Monday and Tuesday at the territory's largest universities, another unspoken rule in the antigovernment protests that have been convulsing Hong Kong for six..."
"0"	"Jess Lost 75 Pounds Without Counting Calories and Did This 1 Inspiring Thing Before Every Meal"	"weightloss"	"Jess Dukes makes a list of her "whys" and reads them before every meal and every workout."
"1"	"Look of the day: Ashley Graham's latest sizzling maternity look & more celeb style"	"lifestylebuzz"	"Bella Hadid attended the CFDA/Vogue Fashion Fund Awards in an Alexander Wang jumpsuit embellished with nipple and belly-button jewels."
"0"	"The Most Stunning Evening Gowns in Miss America History"	"lifestylecelebstyle"	"See the evolution from the 1920s through 2019."
"0"	"Christopher Johnson has hitched his reputation to Adam Gase"	"football_nfl"	"Jets CEO Christopher Johnson broke his 182-day silence by confirming a Daily News report that he has no plans to fire Adam Gase. The team's acting owner, who took shelter amid the team's nightmarish first two months, made it clear that Gase will be back in 2020 despite growing unrest from a frustrated fan base at the team's poor play and lack of competitiveness during their 2-7 start. "I understand it," Johnson said of fans' frustrations in a..."
"0"	"Some migrants waiting in Mexico for U.S. court hearings caught crossing illegally"	"newsus"	"Roughly one in 10 migrants pushed back to Mexico to await U.S. court hearings under a Trump administration program have been caught crossing the border again, a top border official said on Thursday."
"0"	"Scarlett Johansson Regrets Being "Hyper-Sexualized" Early in Her Career"	"movienews"	"Johansson joined Jennifer Lopez, Renée Zellweger, Lupita Nyong'o, Laura Dern and Awkwafina for the Oscar Actress Roundtable."
"0"	"Why You Shouldn't Work For Money   and What To Work For Instead"	"lifestylecareer"	"Increase your money IQ by changing the way you think."
"0"	"Chevy Says This Isn't a Mid-Engine C8 Corvette Hybrid Prototype"	"autosnews"	"There are some curious electronic extremeties on this test mule."
"1"	"How President Trump reacted to getting loudly booed at the World Series"	"baseball_mlb"	"Video surfaced of his reaction."
"0"	"Widow Sues Truth Aquatics Owner In Conception Boat Fire That Killed 34"	"newsus"	"The widow of a man who died in when a dive boat caught fire off the Santa Barbara coast and left 34 people dead is suing the vessel's owners."
"0"	"Memphis judge rules in favor of TSSAA regarding James Wiseman, Ryan Boyce coaching link"	"basketball_ncaa"	"The TSSAA's coaching link rule was upheld by a Memphis judge regarding former East players James Wiseman and Ryan Boyce."
"0"	"After Saugus High School shooting, prayer unites a grieving community"	"newsus"	"A day that began with the shock of a school shooting in Santa Clarita ended in prayer for many families who gathered for vigils in the area. Standing before hundreds of people at Grace Baptist Church in Santa Clarita on Thursday night, Pastor David Hegg acknowledged that students and parents may be grappling with how to make sense of the shooting at Saugus High School, which left two students ..."
"0"	"Stocks That Would Have Made You Rich Today"	"finance-saving-investing"	"Here are the top stocks that you should have invested in."
"0"	"Rare 1838 coin could sell for $500K"	"newsus"	"When this coin was made in 1838, it was worth 50 cents. Now, it's worth an estimated half a million."
"0"	"The latest on Brad Pitt and Angelina Jolie's post-split relationship, plus more news"	"entertainment-celebrity"	"Brad Pitt reportedly wants to see his kids more than Angelina Jolie has made possible. Plus, more celebrity news for Nov. 14, 2019."
"0"	"School shootings were reported at 15 California schools since Sandy Hook"	"newsus"	"Since the horror unleashed by a gunman at Sandy Hook Elementary in Connecticut in 2012, some 16,000 students have experienced some sort of shooting in California."
"1"	"Refugees at a camp in Iraqi Kurdistan express anger over U.S. "betrayal""	"newsworld"	"NBC News went to a refugee camp where hundreds of Kurds are sheltering from Turkey's offensive."
"0"	"Barn Find: Large Collection Of Pontiac Firebirds Uncovered"	"autosclassics"	"A total of nine Firebirds were discovered in Minnesota and are now up for auction."
"0"	"LaMelo Ball is confident he'll be No. 1 pick in 2020 NBA Draft"	"basketball_nba"	"The 2020 NBA Draft is still eight months away, but LaMelo Ball thinks the debate for who the No. 1 pick should be is already settled."
"0"	"Draymond criticizes official for ejection: 'Don't tell me not to talk'"	"basketball_nba"	"Golden State Warriors forward Draymond Green made Chase Center history during Monday's loss to the Utah Jazz, becoming the first player ejected from a game in the new venue after arguing with an official. The three-time All-Star was given a second technical foul for continuing to plead his case after disagreeing with a blocking call, but it seems Green's spat with the official went beyond just that foul. "I disagreed with that call," Green told..."
"0"	"How much turkey do you need to buy per person?"	"tipsandtricks"	"When hosting Thanksgiving dinner, there are a lot of questions regarding the menu that may come up."
"0"	"Queen Elizabeth Just Rode Horseback at Age 93"	"lifestyleroyals"	"The British monarch isn't letting a small thing like age keep her from living her life."
"0"	"Raptors end Lakers' 7-game winning streak in 113-104 victory"	"basketball_nba"	"LOS ANGELES (AP)   The centerpiece of the Toronto Raptors' championship team works at Staples Center now. Two more key components of last season's sublime roster got injured right before the Raptors arrived in Los Angeles for the reunion. In the opening weeks of life after Kawhi, the defending champs are learning they might be deeper than even they realized. They definitely had enough to hold off Staples' marquee tenants in a remarkable..."
"0"	"Dean Foods files for bankruptcy"	"finance-companies"	"Dean Foods, America's largest milk producer, is filing for bankruptcy."
"0"	"Disney+: All the Original TV Shows and Movies Set for Streaming Platform (Photos)"	"tv-gallery"	"Direct-to-consumer offering will house programming from Marvel Studios, Pixar and Lucasfilm"
"0"	"Emilia Clarke Stunned in a Cut-Out Dress at the 'Last Christmas' Premiere"	"lifestylecelebstyle"	"Clarke finished the look with a sleek ponytail and minimal heels."
"0"	"Bannon calls Pelosi's impeachment strategy "actually quite brilliant""	"newspolitics"	"Bannon, the former White House chief strategist, called Pelosi a "master at political warfare""
"1"	"Trump education official to resign and call for mass student loan forgiveness"	"markets"	"A senior student-loan official in the Trump administration said he would resign Thursday and endorse canceling most of the nation's outstanding student debt, calling the student-loan system "fundamentally broken.""
"0"	"Cincinnati Teen Arrested After Allegedly Making Up Story about Missing Autistic 13-Year-Old Who Never Existed"	"newscrime"	""There was no missing person, the story was fabricated. The person who reported to offense has been arrested and our investigation has been closed," the Cincinnati Police Department confirmed."
"0"	"Sneaky ways all-inclusive resorts get you to spend money"	"video"	"All-inclusive resorts seem great. You pay an up-front price, then you get to spend a week drinking on the beach, dining under palm trees, and relaxing next to the pool. It can even feel like you're saving money. And for those with a big appetite, that's probably true. But for others, you could actually end up spending more."
"0"	"Faroe Islands 'closed for maintenance' in April 2020"	"travelnews"	"The Danish archipelago has come up with a solution to the problem of mass tourism: closing access to visitors."
"1"	"Bruce Willis brought Demi Moore to tears after reading her book"	"movies-celebrity"	"Demi wasn't sure how her ex would feel about her book until he called her."
"0"	"Prince Harry and Prince William's Rift Is "One of the Main Reasons" the Sussexes Are Skipping Royal Christmas"	"lifestyleroyals"	"Santa is shook."
"0"	"2021 Chevy Tahoe, Suburban To Debut On December 10"	"autossuvs"	"Both SUVs will ride on the GM T1 platform."
"0"	"Here Are The Best Cities For Police Officers In The Nation"	"newsus"	"A study by Security.org listed the best and worst cities for police officers. See how your city fared."
"0"	"The Disney+ 'Lady and the Tramp' remake: A guide to the new cast members"	"movies-gallery"	"Learn more about the stars of the Disney+ live-action remake."
"0"	"Jerry Jones hopes loss to Vikings isn't 'terminal'"	"football_nfl"	"The Cowboys had chances to win the game late, so Jones was obviously speaking from a place of great frustration."
"0"	"Bucs release former first-round pick Vernon Hargreaves"	"football_nfl"	"TAMPA   Two days after he was benched for not hustling to a make a tackle, the Bucs released starting cornerback Vernon Hargreaves Tuesday morning. The 11th overall pick in 2016 from the University of Florida, Hargreaves struggled to hold up his reputation as a ball hawk in the NFL with only two career interceptions in four seasons. Hargreaves was informed of the decision Tuesday morning at ..."
"0"	"Four words from dermatologists that'll change your life: Stop showering every day"	"wellness"	"Whoa. "It doesn't matter what time of year it is   your entire body does not need to be washed daily," says one derm (and she has backup)."
"0"	"Photos: DIY shields of Chile's protests"	"newsworld"	"Chilean protesters use everything from plywood and mirrors to the kitchen sink to shield themselves from riot police during demonstrations that have left at least 20 dead and wreaked billions of dollars of damage to public infrastructure and private businesses."
"0"	"Report: Carmelo Anthony returning to NBA with Trail Blazers"	"basketball_nba"	"After months on the open market and fans clamoring for an NBA return, Carmelo Anthony finally has a new home."
"0"	"Australia's Qantas operates 19 ½ hour London-Sydney flight"	"travelnews"	"PERTH, Australia (AP)   Australia's national carrier Qantas has completed a 19-and-a-half hour non-stop flight from London to Sydney, part of a series of tests to assess the effects of very long-haul flights."
"0"	"Roger Stone trial: Former top Trump official details campaign's dealings on WikiLeaks, and suggests Trump was in the know"	"newspolitics"	"Gates testifies he was told by Paul Manafort that Trump would be updated on disclosure of hacked Democratic emails as government rests its case."
"1"	"Is Ben Affleck Dating Musician Katie Cherry?"	"movies-celebrity"	"The pair has been photographed hanging out in recent weeks, but are they just friends?"
"0"	"Porzingis forgets which locker room to go to at Madison Square Garden"	"basketball_nba"	"After the buzzer went off to end the second quarter, instincts kicked in for Kristaps Porzingis."
"0"	"Les Miles Has Some Thoughts on the Shape of the Earth"	"football_ncaa"	"Sports are filled with some weirdos and, as such, we're privy to plenty of divergent thoughts on the shape of the Earth. Kyrie Irving made big news by doubling down on a conspiracy theory before backing away from it and apologizing. Les Miles, long a fellow who marches to the beat of his own drum, got philosophical or maybe literal about the topography contour of our planet in response to a fairly simple question today. Les Miles on what he's..."
"0"	"12 Tons of Pizza Toppings Recalled Over Listeria Contamination Fears"	"health-news"	"The USDA released a class I notice after samples of affected products tested positive for a potentially deadly bacteria."
"1"	"Week in celebrity photos for Oct. 21-25, 2019"	"entertainment-celebrity"	"Week in celebrity photos for Oct. 21-25, 2019"
"1"	"Demi Lovato Goes Instagram Official With Boyfriend Austin Wilson: See Their Sweet Synchronized Posts"	"music-celebrity"	"This is the singer's first social media-official romance since her July 2018 overdose."
"0"	"Next Ford F-150 Spied By Motor1.com Reader"	"autostrucks"	"Work continues on America's favorite truck."
"0"	"12-year-old tries to carjack woman at gunpoint at Memphis grocery store"	"newscrime"	"MEMPHIS, Tenn.   A 12-year-old boy is in Memphis Police custody after allegedly attempting to carjack a woman at gunpoint at an East Memphis grocery store. Memphis Police said a woman was at Kroger at 6660 Poplar Ave. around 4 p.m. when the boy, who was armed with a pistol, approached her and demanded her vehicle. Witnesses at the scene detained the boy before police arrived. The 12-year-old ..."
"1"	"Mayfield's postgame outfit gets all the memes"	"football_nfl"	"Social media had a field day with Baker Mayfield's postgame attire."
"0"	"I'd Choose This Rad Ford Edsel Camper Over a Motel Any Day"	"autosenthusiasts"	"And, no. It's not a one-off custom job."
"0"	"Austin Rivers on his father Doc's ejection: 'made my night'"	"basketball_nba"	"No one can troll harder than the coach's son, even when he's on the other team."
"0"	"Every outfit Duchess Kate has worn in 2019"	"lifestyleroyals"	"See Kate Middleton's style choices this year from glam gowns and coat dresses to re-wears, tiaras and hats."
"0"	"The SoftBank Effect: How $100 Billion Left Workers in a Hole"	"finance-companies"	"For five years, Sunil Solankey, a retired captain in the Indian Army, had run the 20-room Four Sight Hotel in a New Delhi suburb. Business was steady, but he longed to make the establishment a destination for lucrative business travelers. Last year, a hospitality start-up called Oyo told Mr. Solankey that it would turn the Four Sight into a flagship hotel for corporate customers. It guaranteed him monthly payments whether the rooms were booked..."
"0"	"Kate Middleton Shows Off Motherly Side as She Bonds with Families at Opening of Children's Hospice"	"lifestyleroyals"	"Kate Middleton Celebrates Opening of Children's Hospice"
"0"	"Liver transplant leads to unbreakable bond between strangers"	"newsgoodnews"	"In 2016, David Landes sent a desperate email in search of living liver transplant. When Mark Henderson heard Landes' story from a friend, he made the ultimate sacrifice. They both join the 3rd hour of TODAY to talk about the incredible act of kindness and the friendship that has come from it."
"0"	"I've had it with this former friend"	"lifestylefamily"	"Dear Miss Manners: How do I appropriately disengage from a friendship of 15 years? The person in question, one time too many, rudely intruded into both my home and my enjoyment with another friend. After bumping into my friend at an event, this person put her on the spot, grilled her for where and when we planned to get together, and then announced she would join us. And upon arriving at my home, she walked in without waiting to be greeted at..."
"0"	"Chipotle's new steak might become a permanent addition to the menu."	"foodnews"	"We tried Chipotle's carne asada, and found it to be a fresh and impressive addition to the chain's menu."
"0"	"Ask Jillian Michaels: I want to exercise more, but it's so difficult for me to overcome my natural laziness. How do you stay motivated every day to work out?"	"fitness"	"In a new advice column for Insider, fitness guru Jillian Michaels explains how she overcomes laziness and keeps herself motivated to exercise."
"1"	"Just in time for skating season, Trump's company scrubs his name from N.Y. ice rinks"	"newsus"	"For the first time since Trump took office, two of his businesses seem to downplay their connection to his name."
"0"	"He gave up gang violence for his daughter. On Sunday, she was killed in a Memphis club shooting."	"newscrime"	"After the death of his teen daughter who was shot at a club, Keland Nance   a youth gang interventionist   is left to raise his granddaughter."
"1"	"Russell Westbrook supports Astros at ALCS Game 2 in Houston"	"basketball_nba"	"Newly acquired Rockets star Russell Westbrook cheered on the hometown Houston Astros during Sunday's Game 2 of the ALCS at Minute Maid Park."
"0"	"Exclusive: Mother of 12-year-old accused of carjacking attempt talks to WREG"	"newscrime"	"MEMPHIS, Tenn.  The mother of a 12-year-old accused of trying to carjack a woman at an East Memphis Kroger spoke exclusively to WREG two days after the attack. "It broke my heart," she said. She says it may have been a cry for help, and that her son knows better than to put himself in danger. The mother of five said her family fallen on hard times and are living in a motel. She says her middle ..."
"0"	"Top 10 storylines for college football Week 12"	"football_ncaa"	"This Saturday is going to be a blast to watch unfold. These are the biggest stories we're following in college football Week 12."
"0"	"Atlanta college student Alexis Crawford was choked to death, dumped in park, police say"	"newscrime"	"Authorities say Alexis Crawford and her roommate Jordyn Jones had a physical altercation and Jones' boyfriend intervened and choked Crawford to death."
"0"	"Lebanon protesters angered by PM pick"	"newsworld"	"Lebanese protesters who have been demanding radical reform reacted with anger Friday to the reported designation of a new prime minister they regard as emblematic of a failed political system."
"0"	"San Diego State University freshman hurt in fraternity incident dies"	"newsus"	"SAN DIEGO - Dylan Hernandez, the 19-year-old San Diego State University freshman who required medical attention last week after an unspecified incident at one school's fraternities, has died, campus officials said on Monday. "His family gave their goodbyes late Sunday night," SDSU President Adela de la Torre said in a statement."
"0"	"This is it, this is the luckiest break in the history of golf"	"golf"	"Belgium's Thomas Detry was the beneficiary of one of the all-time luckiest bounces you'll ever see in golf, and maybe all of sports."
"0"	"Watch the 2020 Land Rover Defender hoon through the woods for No Time To Die"	"autosenthusiasts"	"The Defender will star in a chase sequence in the upcoming 25th James Bond film, which will be Daniel Craig's last."
"0"	"Welcome to the World! All of the Celebrity Babies Who've Made Their Debuts in 2019"	"celebrity"	"See who's made their debut so far this year"
"0"	"When I Speak Out Against Fat Shaming, I'm Told to 'Just Lose Weight'"	"voices"	"Weight loss isn't a solution to pervasive social bias. So why do we insist it is?"
"0"	"Police searching for suspect following southeast Memphis shooting"	"newscrime"	"MEMPHIS, Tenn.   One person was rushed to the hospital overnight following a shooting at a local food center. It happened at the Shelby Food Center at Shelby Drive and Hickory Hill Road just after 11 p.m. Monday. One person was found and taken to the Regional Medical Center. We don't know their condition. Police have not released any suspect information."
"0"	"The Coolest Way to See NYC Is in a Vintage Car From the Roaring '20s on This Midtown Tour"	"ustravel"	"A new tour company called Nowaday, in New York City, will take you around in a restored, vintage car."
"0"	"45 Abandoned Places Around the World That Are Eerily Beautiful"	"traveltripideas"	"It's okay to be awed and creeped out at the same time."
"1"	"Ford's 'Mustang-inspired' electric SUV teased ahead of November debut"	"autosnews"	"Ford carried out a nifty social media campaign -- and dropped an official image."
"1"	"This 2800-HP Turbocharged Hemi-Powered Supra Is the King of Flames"	"autosenthusiasts"	"When too much is not enough."
"0"	"Video shows a Boeing 737 plane carrying 196 people burst into flames just after landing at an Egyptian airport"	"travelnews"	"The plane, operated by EgyptAir and owned by Ukrainian budget airline SkyUp, burst into flames while it was still taxiing to its gate."
"0"	"Watch: Draymond Green becomes first player ever ejected from Chase Center"	"basketball_nba"	"Congratulations are in order for Draymond Green, who earned a very worthy distinction on Monday night."
"1"	"China denies it asked for Morey's firing over HK tweet"	"basketball_nba"	"China is refuting NBA Commissioner Adam Silver's claim that it demanded the firing of Houston Rockets general manager Daryl Morey."
"0"	"The 2019-20 NBA Season"	"basketball_nba"	"The 2019-20 NBA Season"
"0"	"Hernandez: Clippers' Kawhi Leonard, as usual, remains all business, even against the Raptors"	"basketball_nba"	"As he wiped the back of his neck with a towel, Kawhi Leonard confirmed what the box score made obvious. Playing against the Toronto Raptors on Monday night was an emotional experience. "Yeah, definitely," Leonard said to Fox Sports West's Jaime Maggio in an interview that was played over Staples Center's public-address system. Leonard was held by his former team to a season-low 12 points. He ..."
"0"	"10 NBA players off to a hot start"	"basketball_nba"	"At least a few are early contenders for honors such as Most Improved Player and Most Valuable Player, and a certain 24-year-old may finally be in the infancy of a long-awaited breakout year."
"0"	"Le'Veon Bell's advice to Antonio Brown: Try not to do too much over social media"	"football_nfl"	"Former Steelers teammates Antonio Brown and Le'Veon Bell have seen their careers unfold in very different ways. Bell, who now plays for the Jets, told #PFTPM on Tuesday that he has not kept in touch with Brown, who has played for and been released by both the Raiders and Patriots in 2019. Still, Bell offered [more]"
"1"	"Gregg Popovich wants NBA to relax dress code so he can coach in sweats"	"basketball_nba"	"Gregg Popovich has never been shy when it comes to speaking out about change. We often see that when addresses topics like racism and social injustice, but the San Antonio Spurs coach also cares about the little things."
"0"	"Here's What It Means If You Have Ridges on Your Nails"	"medical"	"They don't make for the prettiest of manicures, but are they something more than a cosmetic problem?"
"0"	"Halle Berry Shares Photo of 6-Pack Abs on Instagram and Her Fans are Freaking Out"	"fitness"	"The 53-year-old star worked hard for those washboard abs while training for her new movie, "Bruised.""
"0"	"Flight Attendants Have a Secret Language You Didn't Know About"	"travelnews"	"Here are some phrases only flight attendant use   and what they actually mean."
"0"	"'Velvety' Appearance of Woman's Palms Was a Sign of Lung Cancer"	"ads-lung-health"	"She had a condition called "tripe palms" and it's extremely rare."
"1"	"Trump is reportedly pardoning a Navy SEAL convicted of taking a photo with a dead ISIS fighter"	"newsus"	"Eddie Gallagher was acquitted of murdering the teenage ISIS fighter, and of shooting at civilians in Afghanistan."
"0"	"'Charlie's Angels' stars: Where are they now?"	"movies-gallery"	"We're checking up on former Charlie's Angels actresses to find out what they're up to today."
"0"	"U.S. Drones Appear to Show Turkish- Backed Forces Targeting Civilians"	"newsworld"	"U.S. military officials watched live drone feeds last month that appeared to show Turkish-backed Arab gunmen targeting civilians during their assault on Kurdish fighters in Syria, according to current and former officials familiar with the incidents."
"0"	"China's Commerce Ministry says trade war should be ended by removing tariffs"	"markets"	"China is still calling for the U.S. to roll back tariffs as part of any "phase one" agreement."
"0"	"What Joe Biden Actually Did in Ukraine"	"newspolitics"	"When Russia invaded Ukraine in early 2014, Vice President Joseph R. Biden Jr. pressed President Barack Obama to take decisive action, and fast, to make Moscow "pay in blood and money" for its aggression."
"0"	"Instagram-famous pilot reveals secrets people don't know about the job"	"travelnews"	"Maria Fagerström, a pilot and Instagram influencer, shared some things passengers don't usually know about the job."
"0"	"'National tragedy': Surveillance, staffing under review after deaths at VA hospital"	"newsus"	"After 10 patients died in a suspected serial killing case at a West Virginia VA hospital, the agency is reviewing surveillance and staffing protocols."
"0"	"Thanksgiving side dishes: 11 unique recipes to try this season"	"foodnews"	"While there will always be dishes you're unwilling to leave off your table, consider changing it up with these unique Thanksgiving side dishes."
"0"	"Gwen Stefani Reveals New Nickname for Her and Blake Shelton"	"music-celebrity"	"The singer said she is 'really excited' about the couple's new combined moniker."
"1"	"Lupita Nyong'o Reprises Her 'Us' Character Red to Terrify Fans at Halloween Horror Nights"	"movies-celebrity"	"The actress donned her iconic red jumpsuit to freak people out at Halloween Horror Nights at Universal Studios Orlando."
