"0"	"Trump DC hotel sales pitch boasts of millions to be made from foreign governments"	"newspolitics"	"In its effort to sell off the lease to the Trump International Hotel in Washington, the Trump Organization has put together a glossy investor brochure complete with pictures showcasing the hotel's grandiose architecture, its central location and its spa's Himalayan salt chamber."
"0"	"Sky Bars are coming back to stores and classic candy fans are freaking out"	"foodnews"	"Get your sweet tooth ready."
"0"	"Teresa Giudice Opens Up About Her Future With Husband Joe and the Cheating Rumors (Exclusive)"	"tv-celebrity"	"Teresa Giudice is taking her shaky relationship with husband Joe 'day by day.'"
"0"	"Survivor Contestants Missy Byrd and Elizabeth Beisel Apologize For Their Actions"	"tvnews"	"Survivor contestants Missy Byrd and Elizabeth Beisel posted apologies to Twitter after they were shown onscreen using a fellow contestant's assault story to their advantage in the game"
"1"	"Police get cooling off period before questioned in shootings"	"newsus"	"After a police officer fatally shoots someone, it can take days or even weeks before the public or his supervisors hear the officer's version of what happened. In many states, that so-called cooling off period is carved out in state law or in a police department's contract."
"0"	"8 Relationship Anxieties That Harm a Marriage   And How to Avoid Them"	"lifestylefamilyandrelationships"	"Feeling anxiety after having a baby is normal. Not dealing with that feeling is not."
"0"	"The week in entertainment history: Nov. 10-16"	"celebrity"	"Each week we take a look back through history at the world of entertainment to highlight major events, notable births and deaths."
"1"	"Eerie photos of an abandoned airport that hasn't been touched in 25 years"	"newsphotos"	"The airport in Abkhazia   a disputed region of Georgia   was built in the 1960s, but was abandoned after a violent war in the early 1900s."
"0"	"3 castaway cows swam to North Carolina's Outer Banks to escape Hurricane Dorian"	"newsus"	"Cows have been discovered near the Outer Banks, where they apparently washed up after swimming for several miles due to Hurricane Dorian"
"0"	"I'm 55 and have no retirement savings: What should I do?"	"finance-retirement"	"Just because you start the race late doesn't mean you can't win."
"0"	"The Latest Weight Loss Pills That Work And the Ones That Don't"	"nutrition"	"When diet and exercise aren't working, the answer may be at the drugstore."
"0"	"Comics - '9 to 5' by Harley Schwadron"	"humor"	"Daily comics: '9 to 5' by Harley Schwadron"
"0"	"'Lots of Tears!' Teresa Giudice Details Reuniting With Husband Joe in Italy"	"tv-celebrity"	"'Lots of Tears!' Teresa Giudice Details Reuniting With Husband Joe in Italy"
"0"	"A third of boomers make this critical retirement mistake"	"finance-saving-investing"	"And it's putting their retirement security at risk"
"1"	"A 'one in a million' yellow cardinal, dubbed 'Sunny,' seen in Florida"	"newsus"	"Only three yellow cardinal sightings are reported a year, making the bird's appearance a rare "one in a million" finding, an Auburn professor said."
"0"	"Watch Isaiah Thomas Receive Ovation At TD Garden Ahead Of Celtics-Wizards"	"basketball_nba"	"https://www.dailymotion.com/embed/video/x nww f BOSTON -- Isaiah Thomas hasn't been a member of the Celtics since being traded in to the Cleveland Cavaliers for Kyrie Irving. But Boston still has nothing"
"0"	"Ruth Bader Ginsburg misses court due to illness"	"newsus"	"Supreme Court Justice Ruth Bader Ginsburg was not on the bench for oral arguments Wednesday due to illness, according to Chief Justice John Roberts."
"0"	"After Today, the Vise Tightens on Trump's Ukraine Point Man"	"newspolitics"	"Republicans' most fruitful line of attack during the first day of congressional impeachment hearings for Donald Trump has put even more pressure on a forthcoming witness who has flailed under it thus far: donor-turned ambassador Gordon Sondland. As two senior State Department officials spent nearly six hours recounting their alarm with an effort by Trump's allies that they said undermined U.S. national interests in favor of promoting the..."
"1"	"Demi Lovato debuts new boyfriend, plus more celeb love life news for mid-November 2019"	"entertainment-celebrity"	"Anna Faris seemingly confirms engagement rumors, JWoww and boyfriend aren't back together after all, Porsha Williams admits fiancé cheated and more."
"1"	"South Carolina teen gets life in prison for deadly elementary school shooting"	"newsus"	"Jesse Osborne, the teenager responsible for a shooting at a South Carolina elementary school in 2016, was sentenced to life in prison."
"0"	"Arizona activist accused of guiding migrants 'further north' after border crossing"	"newsus"	"Arizona activist accused of guiding migrants 'further north' after border crossing"
"0"	"Cherry disappointed with MacLean's apology: 'He buried me'"	"icehockey_nhl"	"Don Cherry isn't happy with former Hockey Night in Canada partner Ron MacLean. MacLean publicly apologized Sunday for Cherry's offensive comments from the night prior. Cherry, who was fired by Sportsnet on Monday, said MacLean "buried" him with his response. "Very disappointing," Cherry told Global News on Tuesday. "We're still friends, but I was very disappointed in the way he handled it. I don't want to go and condemn him or anything like...""
"0"	"Walmart hires off-duty officers ahead of El Paso reopening"	"newsus"	"Walmart has quietly hired off-duty officers at its stores in El Paso, Texas, where a gunman police say targeted Mexicans opened fire in a store in August and killed 22 people. Walmart plans Thursday to reopen the store where the attack happened and amid ongoing lawsuits over safety. Walmart didn't have a guard in the store the day of the mass shooting."
"0"	"Kate Middleton's Maroon Trousers Gave Her a Pop of Color During Her Charity Outing"	"lifestyleroyals"	"Kate Middleton rocked some eye-catching statement trousers during a recent charity visit that were absolutely perfect for fall."
"0"	"French Pastry Diet For Weight Loss: Does It Work?"	"nutrition"	"Can French culture help America's obesity problem?"
"0"	"Opinion: NFL should suspend Browns' Myles Garrett for rest of season   at minimum   for helmet swing"	"football_nfl"	"The Browns won on Thursday, but only in the most literal sense. Pro Bowl defensive end Myles Garrett changed everything with the swing of a helmet."
"0"	"U.S. grand jury drops case against Colorado police for killing suspect"	"newsus"	"U.S. grand jury drops case against Colorado police for killing suspect"
"0"	"After push from Perry, backers got huge gas deal in Ukraine"	"newspolitics"	"Two political supporters of U.S. Energy Secretary Rick Perry secured a potentially lucrative oil and gas exploration deal from the Ukrainian government soon after Perry proposed one of the men as an adviser to the country's new president."
"0"	"U.S. Attorney General in Memphis to announce nationwide plan to reduce gun violence"	"newscrime"	"It's called Project Guardian and U.S. Attorney General William Barr is backing the initiative."
"1"	"Photos of Meghan Markle You've Probably Never Seen"	"lifestyleroyals"	"Remember her Deal or No Deal days?!"
"0"	"Should I tip 20% in a restaurant even if the service is mediocre?"	"personalfinance"	"'Our 30-something waiter forgot our drink orders, never returned for refills and only checked back once before dropping off the check in front of our guest.'"
"1"	"How Often Should You Change Synthetic Oil?"	"autosownership"	"There's more than one answer, so let us simplify it for you, starting with outlining the advantages of synthetic oil."
"0"	"Half of young people think high school is enough for a good job"	"finance-career-education"	"The labor market is the tightest in a generation, and the wage premium for college graduates has never been higher"
"0"	"How to Make Air-Fried Cookies"	"videos"	"Did you know that you can bake cookies in your air fryer? After a little bit of experimentation, Nicole is impressed with the results."
"1"	"This Woman Shared Her Weight and Body Fat Percentages Over 4 Years to Make an Important Point"	"weightloss"	"Kish Burries posted a three-part transformation photo to show that finding your sweet spot can take time."
"0"	"Ja Morant's game-winner the latest tantalizing sign of what's ahead for Memphis Grizzlies"	"basketball_nba"	"If the first 10 games of Ja Morant's professional career are any indication, his game-winner to beat Charlotte will be the first of many."
"0"	"American woman apparently strangled in the Dominican Republic"	"newsworld"	"Colleagues say Patricia Anton brought joy and laughter to the school she worked in, as police hunt leads in what they say looks like a deadly robbery at her home"
"0"	"Judge agrees Alabama Islamic State recruit is not US citizen"	"newsus"	"A judge agreed Thursday with President Donald Trump's administration that an Alabama woman who joined the Islamic State group was not a US citizen, leaving the 25-year-old and her son in limbo in Syria. Reggie Walton, a federal judge in Washington, agreed with the government's position that Hoda Muthana's father was still a diplomat when she was born, making her ineligible for US citizenship, a lawyer for Muthana said. The lawyer, Christina..."
"0"	"Nurse took in disabled teen, then tortured and killed her, police say."	"newscrime"	"Peggy Lynn Johnson was 23 when her body was found covered in burns and bruises along a Wisconsin road. Linda LaRoche has been charged in her murder."
"1"	"McDonald's apologizes for 'Sundae Bloody Sundae' Halloween promotion"	"finance-companies"	"McDonald's has canceled a promotion for a "Sundae Bloody Sundae" ice cream that was available in Portugal for Halloween."
"0"	"Iran launches nuclear enrichment at underground Fordow plant, IAEA confirms"	"newsworld"	"Iran launches nuclear enrichment at underground Fordow plant, IAEA confirms"
"0"	"Britney Spears Reveals Her Secret Cheat Meal In All Its Chocolaty Glory"	"healthnews"	"On November 10, Britney Spears, world-class pop star and bona fide fitness guru, shared a glimpse at her cheat meals, and yes, they look delicious."
"0"	"Taylor Swift Rep Hits Back at Big Machine, Claims She's Actually Owed $7.9 Million in Unpaid Royalties"	"musicnews"	"Taylor Swift's team responds to Big Machine's denial."
"0"	"10 reasons it's better to rent rather than buy a home"	"finance-real-estate"	"Forget building equity. Here are 10 reasons you want to rent instead."
"0"	"The 1 reason you shouldn't hesitate to claim Social Security early"	"finance-retirement"	"Seniors are often told to wait on Social Security, but here's a good argument for filing sooner."
"1"	"BMW 4 Series Coupe Spied With Exposed Front, Reveals Massive Grille"	"autosnews"	"Love it or loathe it, the kidney grille is going through some drastic changes."
"1"	"Golden Gums! 200-Year-Old Gold Teeth Made of Ivory & Gold Set to Go for Thousands at Auction!"	"viral"	"These false teeth dating back 200 years were made out of hippo or walrus ivory and set in gold, is expected to nab thousands of dollars at auction. Buzz60's Mercer Morrison has the story."
"0"	"'One in a million' deer captured on camera in Michigan woods"	"newsus"	"Retired Michigan lawmaker and amateur photographer Steven Lindberg took pictures of a deer. That deer had three antlers."
"0"	"Muslim woman says Denver arena worker told her to remove hijab, refused to let her enter"	"newsus"	"Gazella Bensreiti said the Pepsi Center employee told her to "take that thing off" and said she could not come in until she removed her hijab."
"0"	"6 Reasons to Run On the Treadmill Instead of Outside"	"fitness"	"Two words: heat and humidity."
"0"	"'Absolutely Terrifying': 3 Students Describe Moments After Shots Rang Out At Saugus High School"	"newsus"	"The three unidentified girls said they ran away as far as they could when they heard gunshots in the quad of Saugus High School."
"0"	"Evansville's upset at No. 1 Kentucky illustrates college basketball's uncertain landscape"	"basketball_ncaa"	"Two weeks, two No. 1 teams falling."
"0"	"Epic 'Jeopardy!' rematch gets off to a hot start"	"popculture"	"James Holzhauer and Emma Boettcher finally reunited in the Jeopardy! Tournament of Champions 2-night final. Boettcher knocked Holzhauer out of regular Jeopardy! play back in June, when he was only $58,484 short of Ken Jennings massive $2.62 million in winnings. Ever since that day fans have been hoping for a rematch. Leading up to the rematch, Holzhauer had playfully tweeted about getting his revenge. He got off to a hot start, answering 23 clues correctly. Boettcher was only able to get 13 correct answers, so going into "Final Jeopardy!" Holzhauer ($37,412) had nearly three times as much money as Boettcher ($13,200). Boettcher went all in with her wager for the category "Old Testament Book." The clue was, "By Hebrew word count, the longest book bears this name that led to a word for a long complaint or rant." Emma correctly answered, "What is Jeremiah?" Holzhauer also got the correct answer and bid $11,914, bringing his grand total for the first night to $49,326. Fans took to Twitter to discuss his dominant performance. It should be noted that there is a third contestant in the finals, Francois Barcomb. Unfortunately he ended the night with only $1,800 and it is highly unlikely he will pose much of a threat to the other juggernauts."
"0"	"California cops respond to 2 homeless men shot with arrows: report"	"newscrime"	"Two homeless men living at an encampment near San Francisco were shot with arrows early Sunday in an attack that was not random, a report said."
"0"	"The Easiest 2-Ingredient Pancake Recipe (Without Milk or Flour)"	"recipes"	"Whether you're working with an empty pantry or a dairy and gluten allergy, you can still make a stack of delicious pancakes. Here's how."
"0"	"Iran moves on ultra-cheap petrol, starts rationing"	"newsworld"	"Iran imposed petrol rationing and raised pump prices by at least 50 percent Friday, saying the move aims to help the needy with cash handouts and is not due to a budget deficit. - Divisive measure - Rouhani had tried hike fuel prices in the budget last December but was blocked by parliament in the wake of protests that rocked Iran for days."
"0"	"House to hear from US official who said he overheard Trump, Sondland call"	"newspolitics"	"In a closed-door deposition, House investigators will hear from David Holmes, the U.S. embassy official who overheard Trump and Sondland speak about "the investigations.""
"0"	"Between 1,000 to 2,000 people get the plague every year -- including about 7 in the US"	"health-news"	"The plague is fairly uncommon but not eradicated. WHO reports up to 2,000 people are infected every year, including an average of seven people in the US."
"0"	"How Did Armistice Day Become Veterans Day in the United States?"	"newsus"	"In 1954, in response to calls for recognition of veterans of World War II and the Korean War, President Dwight D. Eisenhower changed the name of the holiday to Veterans Day."
"0"	"MRI on left knee of Troy Daniels comes back negative, he's questionable tonight in Phoenix"	"basketball_nba"	"MRI on left knee of Los Angeles Lakers shooting guard Troy Daniels comes back negative, he's questionable tonight in Phoenix against the Suns."
"0"	"Trump admin preparing to take over private land for border wall"	"newsus"	"The Trump administration is preparing court filings to begin taking over private land to build its long-promised border wall as early as this week   without confirming how much it will pay landowners first."
"0"	"Prince Charles just turned 71   here are the best photos from every year of his royal career so far"	"lifestyleroyals"	"Prince Charles, heir to the throne, celebrates his 71st birthday on Thursday. Here are all the best photos from every year of his career."
"0"	"Carrie Underwood rocks CMAs and several gorgeous outfits as host"	"awardstyle"	"All of her looks were just stunning."
"0"	"Opinion: NFL owes Colin Kaepernick a fair shot at weekend workout in Atlanta"	"football_nfl"	"The NFL finally has a chance to do right by Colin Kaepernick, who will do on-field drills and interview at a workout all 32 teams were invited to."
"1"	"Tourists stabbed in Jordanian city near Roman ruins: police"	"newsworld"	"Several Spanish-speaking tourists were injured in a stabbing on Wednesday in Jerash, a Jordanian city popular with foreign visitors, along with a local guide and a security guard, police said, adding that a man had been arrested."
"1"	"New Couple Alert? Drake and Kylie Jenner Appear Into Each Other at Party"	"celebrity"	"New Couple Alert? Drake and Kylie Jenner Appear Into Each Other at Party"
"1"	"2020 Performance Car of the Year"	"autosresearch"	"Eleven worthy competitors, one surprising winner."
"0"	"14-year-old baker gives cupcakes to homeless"	"newsgoodnews"	"Michael Platt has been on Food Network, did a TED talk, and is constantly giving back to those in need with his one-for-one business"
"0"	"Mark Cuban is the latest billionaire to complain about Sen. Elizabeth Warren's wealth tax plan"	"markets"	"Billionaire investor Mark Cuban criticized 2020 presidential candidate and Massachusetts Sen. Elizabeth Warren's tax policies, suggesting in a series of tweets that they "divert attention from reality." Cuban keyed in on Warren's net worth, which at $12 million makes her the 4th richest member of the Democratic presidential field."
"1"	"These Are the Hardest Questions on the U.S. Citizenship Test"	"lifestyledidyouknow"	"It's no secret that the United States is a country of immigrants."
"0"	"Alibaba breaks Singles Day record of more than $30 billion in sales"	"finance-companies"	"Alibaba hit $12 billion in sales in the first hour of its annual shopping extravaganza on November 11."
"0"	"What Time Is The Televised Impeachment Hearing: Live Stream"	"newspolitics"	"The first televised hearing in the public impeachment inquiry is set to take place Wednesday. Here's the most important information."
"0"	"Joe Giudice Says It Was 'Painful' Watching Real Housewives of New Jersey from Prison"	"tv-celebrity"	"Joe Giudice Says It Was 'Painful' Watching RHONJ from Prison"
"1"	"What 40 Celebrities Look Like Without Their Signature Looks"	"lifestylecelebstyle"	"If you think Taylor Swift is unrecognizable, wait until you see Gwen Stefani."
"0"	"WWE Wrestler Jordan Myles Quits in Expletive-Filled Rant as He Brands the Company Racist"	"tvnews"	"WWE Wrestler Jordan Myles Quits, Calls Company Racist"
"1"	"SR-71 Blackbird: The Cold War spy plane that's still the world's fastest aircraft"	"newsus"	"During the Cold War, the SR-71 Blackbird spy plane could fly higher and faster than any other -- and 55 years after its first flight, it still does."
"0"	"Ohio GOP lawmakers want to ban all abortions, charge doctors who perform them with murder"	"newsus"	"Republicans in the Ohio House of Representatives have signed onto a bill to ban all abortions in Ohio and charge doctors who perform them with murder."
"1"	"Caterpillar just flashed the latest warning sign for the global economy"	"finance-top-stocks"	"The construction equipment titan   a bellwether for global industry   posted a 6% drop in sales and an 8% drop in profit per share."
"0"	"Ex-Browns receiver Antonio Callaway gets 10-game drug ban"	"football_nfl"	"Former Browns wide receiver Antonio Callaway has been suspended 10 games by the NFL for another violation of the league's substance-abuse policy. League spokesman Brian McCarthy said Friday that Callaway will begin serving the suspension immediately. The 22-year-old player was suspended four games earlier this season for a drug violation."
"0"	"Analysis: The 5 questions Gordon Sondland needs to answer"	"newspolitics"	"No. 1: Were you acting of your own volition, or at the direction of President Trump?"
"0"	"The world's only $100 billion utility owes its rise to wind power"	"finance-companies"	"Two decades ago, when coal ruled U.S. power generation, a Florida utility plowed some of its extra cash into a wind farm atop a desolate Oregon plateau."
"0"	"Who is Marie Yovanovitch? Ambassador testifying at the impeachment hearing"	"newspolitics"	"She was recalled from her post on the orders of the president, who called her 'bad news' in a phone call with his Ukrainian counterpart."
"0"	"How I Got Lung Cancer at 31 Without Ever Smoking a Single Cigarette"	"health-cancer"	"Rachael Malmberg was 31 when she received a deadly diagnosis. She is fighting her condition and has embarked upon a mission to educate others about the second leading cause of lung cancer and it has nothing to do with smoking."
"0"	"How to Brine a Turkey & Why You Should"	"tipsandtricks"	"There are lots of ways to cook your Thanksgiving turkey: smoke it, fry it, spatchcock it. But a traditional roast turkey is probably the most common option and perfectly delicious when you do it right."
"0"	"Australia's fragile koala colonies are being ravaged by brush fires: 'It's a national tragedy'"	"causes-disaster-relief"	"Rescuers wandering through charred eucalyptus trees in New South Wales found bleak signs of devastation: koalas incinerated while seeking refuge, leaving ash where conservationists hoped to tally the dead."
"0"	"I Have Smiling Depression This Is What It Feels Like"	"voices"	""I function but do not feel. My face says I'm happy, but inside I want to cry.""
"1"	"A couple's attempt to re-create a picture-perfect engagement photo with a bottle of Champagne totally backfired, but the result is going viral"	"lifestylebuzz"	"Alyssa Snodsmith, 24, and Collin Hewett, 23, shared their failed attempt to recreate a Pinterest picture for their engagement photo."
"1"	"15 Found Alive in Truck in U.K. as Authorities Identify 39 Migrants Found Dead Weeks Earlier"	"newsworld"	"Fifteen people were recovered alive in the back of a truck in the U.K. by police on Wednesday as police said they've identified the 39 people found dead in another truck weeks earlier."
"0"	"The Apple Crisp That Made Me Fall in Love With...Beets"	"recipes"	"I didn't always love beets. In fact, I used to loathe them. But it wasn't my fault. My first introduction to the root vegetable was via my father, the culprit for my aversion."
"1"	"Kylie Jenner hits Drake's Halloween party amid flirtation rumors, plus more news"	"celebrity"	"Kylie Jenner hits Drake's Halloween bash a week after the two were spotted flirting at his birthday party. Plus, more celebrity news for Nov. 1, 2019."
"1"	"Trump juggles statecraft and impeachment on a historic day"	"newspolitics"	"Projecting unusual calm in the middle of a political firestorm, President Donald Trump pleaded ignorance Wednesday about the first public impeachment hearing, unexpectedly insisting that he really wasn't paying attention to sworn testimony in the House Intelligence Committee that could determine whether he serves out his term in office. The disclaimer might be more credible if ..."
"0"	"American Outdoor to split into two firms, separating its gun business"	"finance-companies"	"American Outdoor Brands Corp. said it will split into two publicly traded companies, one focused on firearms and the other on outdoor products, in an effort to reverse a stock-market decline amid rising pressure for tougher U.S. gun restrictions."
"0"	"How to get Halle Berry's 6-pack abs without spending 4 hours a day at the gym"	"fitness"	"A combination of good nutrition, circuit training, and patience can help women sculpt their cores at any age, but it's not easy."
"1"	"Maryland AG sues Kushner apartment company, alleging thousands of violations while renting rodent-infested units"	"newsus"	"Maryland Attorney General Brian Frosh has sued an apartment management company owned by senior White House adviser and presidential son-in-law Jared Kushner, alleging it routinely used "unfair or deceptive" rental practices while running rodent-infested apartments in Baltimore and the surrounding region."
"0"	"The Most Popular Family Dinners from Every Decade"	"recipes"	"Find a quintessential family dinner for every decade over the past 100 years. The post The Most Popular Family Dinner from Every Decade appeared first on Taste of Home."
"0"	"Winthrop takes on ETSU"	"basketball_ncaa"	"Winthrop (2-1) vs. East Tennessee State (2-0) Freedom Hall Civic Center, Johnson City, Tennessee; Thursday, 7 p.m. EST BOTTOM LINE: Winthrop and East Tennessee State both look to put winning streaks together . Winthrop is coming off a big 61-59 win on Monday over No. 18 Saint Mary's. East Tennessee State is coming off a 92-75 win over UT Martin on Saturday. LEADING THE CHARGE: East Tennessee State's Patrick Good has averaged 17 points and two..."
"0"	"32 Things You Can Make in Your Air Fryer"	"recipes"	"Looking for a healthier alternative to deep frying? Meet the air fryer, your new favorite gadget. Check out these air fryer recipes for crispy chicken wings, fried pickles, coconut shrimp and desserts, too! The post 34 Air Fryer Recipes You Need to Try appeared first on Taste of Home."
"0"	"Steve Kerr on LeBron James: 'Probably the best athlete to ever walk this planet'"	"basketball_nba"	"Golden State Warriors coach Steve Kerr said that LeBron James is "probably the best athlete to ever walk this planet.""
"0"	"A birthday, a walk to school and a blast that tore an Afghan family apart"	"newsworld"	"Dunya, 10, and Hadis, 7, were among the 12 dead in Wednesday's suicide bombing in Kabul."
"0"	"15 of the Best Towing Vehicles That Aren't Trucks"	"autosresearchguides"	"Need to tow stuff but don't want a pickup? Here are a few of our favorites"
"1"	"Kate Middleton Wears Same Hat Diana Wore as She and Prince William Head to Pakistan Mountains"	"lifestyleroyals"	"Kate Middleton and Prince William Visit Melting Glacier Pakistan"
