"0"	"Israel says overnight strike on Gaza house killed Islamic Jihad commander"	"newsworld"	"Israel's military said Thursday that an overnight strike in Gaza that Palestinians officials say left eight members of the same family dead killed an Islamic Jihad commander."
"0"	"In Memphis, AG William Barr says he does not recall Trump request to defend Ukraine call"	"newspolitics"	"Barr was in Memphis Wednesday to announce Project Guardian, a gun-violence reduction initiative."
"0"	"Fidelity to baby boomers: Lay off the stocks"	"finance-saving-investing"	"Hey, baby boomers: lay off the stocks."
"0"	"A body-language expert says Meghan Markle is "politely disconnecting" from the public, and honestly, we would too"	"lifestyleroyals"	"Can we blame her? Meghan Markle is supposedly "politely disconnecting" from the public as seen in her body language, and girl, you do you."
"1"	"James Van Der Beek and Wife Kimberly on Expecting Baby No. 6: It Often Requires an 'Explanation'"	"tv-celebrity"	"James Van Der Beek and Wife Kimberly on Expecting Baby No. 6"
"1"	"Kristina Went From 'Drastic Diets' to Losing 105 Pounds With WW - Here's How She Did It"	"weightloss"	"Kristina had tried "drastic diets" and would stick to them for a while, but eventually she'd resort to "old habits and the weight would be put back on," she says."
"1"	"Clippers' Kawhi Leonard Planning to Trademark 'What It Do Baby' From His Viral Summer Video"	"basketball_nba"	"Leonard has a history of generating viral phrases, with several being the genesis for popular t-shirts as part of his clothing deal with New Balance."
"0"	"The Volkspod VW Beetle Minibikes Are Part Creepy, Part Adorable"	"autosmotorcycles"	"The people's pods."
"0"	"When You See Paris Jackson's Wheat-Blond Hair, You'll Run to the Salon"	"lifestylebeauty"	"Paris Jackson stepped out on Nov."
"0"	"Eager to witness 'history,' people, protesters huddle outside Trump impeachment inquiry hearing"	"newsus"	"Protesters wearing "arrest Trump" T-shirts and dozens of people anxious to witness the hearing crowded outside the hearing room at the U.S. Capitol."
"0"	"Sorry protein bars, but the banana is the MVP of pre-workout snacks"	"fitness"	"An oldie but goodie."
"0"	"Stella McCartney removes Instagram post plugging her $1,900 coat that Meghan Markle wore amid backlash"	"lifestyleroyals"	"The designer has been slammed for plugging her £1,545 belted wool Stella McCartney coat which was worn by Meghan Markle at the Cenotaph yesterday."
"0"	"What Not to Miss on the Harry Potter Studio Tour"	"traveltips"	"Why it is a must-do for even casual fans"
"0"	"Week in celebrity photos for Nov. 11-15, 2019"	"celebrity"	"Week in celebrity photos for Nov. 11-15, 2019"
"1"	"Chris Brown is having a yard sale at his house"	"music-celebrity"	"Police tried unsuccessfully to stop Chris Brown's yard sale."
"1"	"Jilmar Ramos-Gomez, US citizen detained by ICE, to get $190K"	"newsus"	"A Michigan city will pay $190,000 to a Marine veteran and United States citizen who was arrested by the police and turned over to Immigration and Customs Enforcement officials."
"0"	"21 Ways Restaurants Are Going to Change"	"restaurantsandnews"	"The restaurant business is full of challenges, not the least of which is the necessity for restaurateurs to keep up with the times."
"0"	"Southwest's Spring Travel Sale Includes $39 One-way Tickets"	"travelnews"	"Southwest Airlines wants you to start planning your 2020 travels."
"0"	"Look of the Day"	"lifestylebuzz"	"Jennifer Lopez elevated a Sally Lapointe turtleneck ($1,650; modaoperandi.com) by cinching it with a narrow belt and styling it with silky trousers..."
"0"	"Brett Kavanaugh calls Ruth Bader Ginsburg 'inspiration,' heaps gratitude on allies"	"newspolitics"	"In his first speech as a Supreme Court justice, Brett Kavanaugh heaped "gratitude" on his supporters and hailed Ruth Bader Ginsburg as an "inspiration.""
"1"	"Taylor Swift can't shake 'Shake It Off' copyright suit reinstated by federal court panel"	"music-celebrity"	"A federal appeals court panel Monday reinstated a dismissed copyright lawsuit claiming Taylor Swift's "Shake It Off" infringed on an earlier song."
"0"	"America's best inexpensive steakhouses"	"restaurantsandnews"	"Most steakhouses are far outside most people's price range, but there are plenty of steakhouses that are downright affordable."
"1"	"Phoenix police officer involved in viral video stop of couple fired"	"newscrime"	"Phoenix Chief Jeri Williams announced that the officer involved in a viral video stop of Dravon Ames and Iesha Harper has been fired."
"0"	"Kristen Bell's Cozy Look Is a Lesson in Winter Airport Fashion"	"lifestylecelebstyle"	"Kristen Bell wore the coziest sweater dress, combat boots, and wool coat to the airport, and you can shop her outfit at Nordstrom."
"0"	"Meghan Markle and Prince Harry Won't Spend Christmas with Queen Elizabeth at Sandringham This Year"	"lifestyleroyals"	"They'll hang out with baby Archie and Meghan's mother, Doria Ragland, instead."
"0"	"Video shows miraculous escape for train passengers"	"viral"	"Hundreds of Indian passengers had a narrow escape after two trains collided in Andhra Pradesh state."
"0"	"Support for marijuana legalization is at an all-time high in a new poll"	"newsus"	"Two-thirds of Americans support marijuana legalization, according to two recent polls."
"1"	"2020 Ferrari 488 GT3 Evo Debuts With Improved Aero"	"autosnews"	"Say Ciao to Ferrari's latest race car"
"1"	"Icon's electric 1949 Mercury and V8-powered 1949 Hudson are two sides of the same coin"	"autosclassics"	"These no-expense-spared custom cars from California's Icon 4x4 show us the best of the present and the future in classic cars."
"1"	"Becky G Slays in Versace at the 2019 Latin American Music Red Carpet"	"lifestylecelebstyle"	"The singer is being honored with the Evolution Award during the telecast."
"0"	"Vucevic, big 4th quarter sent Magic past 76ers 112-97"	"basketball_nba"	"ORLANDO, Fla. (AP)   Nikola Vucevic had 23 points and seven Orlando players scored in double figures as the Magic came up with a big fourth quarter and beat the Philadelphia 76ers 112-97 on Wednesday night. Aaron Gordon had 18 points and 13 rebounds for the Magic, and D.J. Augustin had 12 points and eight assists off the bench. Augustin, who was moved out of the starting lineup six games ago, played the entire fourth quarter. Josh Richardson led..."
"0"	"Jessica Simpson 'Relieved' After Daughter Maxwell and Son Ace Recover From Illness"	"music-celebrity"	"See the famous mama's new sweet post."
"1"	"Felicity Huffman Smiles as She Begins Community Service Following Prison Release"	"newscrime"	"The 56-year-old actress was released from prison last month."
"0"	"Shakira reflects on her career-threatening injury, depression in 2017"	"music-celebrity"	"Shakira said she went into a deep depression thinking she lost her voice for good."
"0"	"Chrissy Teigen's weekend was basically a clapback double-header, plus more news"	"entertainment-celebrity"	"Chrissy Teigen gives us two more lessons in the art of the clapback. Plus, more celebrity news for Nov. 12, 2019."
"0"	"Best country music albums of all time"	"cma-awards"	"Stacker has compiled a list of the best country albums of all time as per Billboard's Greatest of All Time Country Albums list. These ratings are based on albums' weekly performance on the Top Country Albums chart from January 1996 to June 2016."
"0"	"Nearly all toddlers, and the majority of babies, eat too much added sugar in the US, study says"	"healthnews"	"A new study found that 98% of toddlers and 61% of infants 6 to 11 months old have too much added sugar in their diets, mostly due to yogurt and fruit drinks."
"0"	"South Carolina teen gets life in prison for deadly elementary school shooting"	"newsus"	"Jesse Osborne, the teenager responsible for a shooting at a South Carolina elementary school in 2016, was sentenced to life in prison."
"1"	"This Mom Had a Hilarious Response to a Man Who Told Her to 'Cover Up' While Breastfeeding in Public"	"wellness"	"She did exactly what he asked."
"0"	"A $15 latte shows how the supply of premium coffee is shrinking"	"markets"	"The world is flooded with coffee, but it's mostly boring beans. For the hand-crafted, artisanal specialty brews, you have to pay up."
"0"	"Demi Lovato debuts new boyfriend, plus more celeb love life news for mid-November 2019"	"entertainment-celebrity"	"Anna Faris seemingly confirms engagement rumors, JWoww and boyfriend aren't back together after all, Porsha Williams admits fiancé cheated and more."
"1"	"NBA world reacts to Kyrie Irving dropping 50 in Nets debut"	"basketball_nba"	"Kyrie Irving lit up Barclays Center with a spectacular 50-point performance in his Nets debut, and the NBA world took notice."
"0"	"Pregnant firefighter tackles bushfires: 'I don't care if you don't like it'"	"newsworld"	"A young pregnant firefighter has defended her decision to continue fighting bushfires raging across Australia, saying: "I don't care if you don't like it.""
"0"	"Police: Woman reports in-home stabbing, identifies son as suspect"	"newscrime"	"A Memphis man is behind bars after police say he stabbed his mother multiple times in the head."
"1"	"Inside the world's largest plane, which has a wingspan longer than a football field and a mysterious new owner"	"newsphotos"	"The Stratolaunch is 238 feet long, 50 feet tall, and has a 385-foot wingspan. It made its first flight in April."
"0"	"Stromboli vs. Calzone: What's the Real Difference Between These Italian Favorites?"	"foodnews"	"We're putting an end to the stromboli vs. calzone debate once and for all. Find out the real differences between the two Italian dishes."
"0"	"The Day in Sports: Wednesday, November 13, 2019"	"more_sports"	"The Day in Sports: Wednesday, November 13, 2019"
"0"	"9 renovation tips to boost resale value"	"finance-real-estate"	"Making the right renovation decisions can help you sell your house quicker, and for more money."
"1"	"Why Lamborghini's new hybrid is bad for the environment"	"autosvideonew"	"The Lamborghini FKP 37 Sián is the automaker's first hybrid, but it's not eco-friendly. Electric motors increase performance but not efficiency."
"1"	"Dean Foods files for bankruptcy"	"finance-companies"	"Dean Foods, America's largest milk producer, is filing for bankruptcy."
"0"	"Chris Paul feels he got 'stabbed in the back' with trade from Rockets"	"basketball_nba"	"Paul has been traded three times in his career (four if you include the Lakers veto)."
"0"	"Amy Schumer Opens Up About How Motherhood Has Changed Her"	"movies-celebrity"	"The comic opened up to ET at a charity event in New York on Tuesday."
"0"	"Bad news, seniors: Your Medicare costs are going up"	"finance-insurance"	"It's probably the last thing enrollees want to hear, but better to know what you're in for."
"1"	"Deer fatally attacks hunter who shot him"	"newsus"	"In what officials are calling a bizarre incident, an Arkansas hunter was killed by a deer that he thought he had killed."
"0"	"Volvo S90 Facelift Spied Showing Small Design Tweaks"	"autosnews"	"A new lower fascia and revised lighting are among the more noticeable revisions."
"1"	"Lena Waithe Reveals She Secretly Married Her Longtime Love"	"tv-celebrity"	"Lena Waithe and longtime love Alana Mayo secretly got married! Watch the Masters of None star talk about their wedding on The Ellen DeGeneres Show with guest host John Legend here."
"0"	"'It's not over': Sarah Palin says she is fighting to repair her marriage"	"newsus"	"Former Alaska Gov. Sarah Palin said she learned her husband, Todd, wanted a divorce in an email from his lawyer and that the two are seeking counseling."
"1"	"Inside the Sheikh of Dubai's 800-acre Kentucky horse farm"	"finance-real-estate"	"I got a tour of Sheikh Mohammed of Dubai's 800-acre horse farm in Kentucky, where horses live in immaculate barns with skylights and personal fans."
"0"	"If You're Over 40 And About To Start Weight Lifting For The First Time, Here Are 5 Things You Need To Know"	"wellness"	"Over 40? 5 Things You Need to Know about Lifting Weights for the First Time."
"0"	"An ambassador fired: What to watch on Day 2 of impeachment"	"newspolitics"	"An ambassador, her firing and a pair of fixers. Those details stand at the center of Marie Yovanovitch's story, a personal ordeal she is describing to Americans and the world Friday as part of the Democrat-driven impeachment inquiry against President Donald Trump."
"0"	"U.S. proposes denying work permits to asylum seekers who enter illegally"	"newsus"	"U.S. proposes denying work permits to asylum seekers who enter illegally"
"0"	"Kansas lands commitment from five-star guard Bryce Thompson"	"basketball_ncaa"	"This is an important get for Kansas."
"0"	"Man who inherited 6 figures shares advice he'd give his younger self"	"personalfinance"	"Brandon Neth inherited around $123,000 from his late father and grandfather when he was 20. He spent most of it on cars, clothes, and restaurants."
"0"	"Schiff accuses Trump of 'witness intimidation'"	"newspolitics"	"House Intelligence Committee Chairman Adam Schiff issued a veiled threat against President Trump for tweeting about former Ukraine Ambassador Marie Yovanovich as she testified before the panel in Day Two of the public impeachment proceedings."
"0"	"Amari gets heroic birthday surprise"	"newsgoodnews"	"Meet this week's inspiring kid."
"0"	"Don't be fooled: Costco says $75 coupon is a scam"	"finance-companies"	"Wholesale retailer Costco is warning customers about a new scam that is promising shoppers a $75 coupon."
"0"	"Miranda Lambert gets candid about her public divorce and secret wedding, plus more news"	"entertainment-celebrity"	"Miranda Lambert on what really stung about her split from Blake Shelton. Plus, more celebrity news for Nov. 13, 2019."
"0"	"How to Watch the Leonid Meteor Shower This Weekend"	"science"	"Look up this weekend to catch shooting stars radiating from the constellation Leo."
"0"	"2 dead, 3 injured in a school shooting in Russia"	"newsworld"	"Russian police say a student has killed a fellow student and wounded three more in a shooting at a college before taking his own life. Russia's state Investigative Committee says the 19-year-old student in Blagoveshchensk near the border with China brought a hunting rifle to class Thursday and opened fire on students, shooting one dead and severely injuring three more."
"0"	"Qantas test flight from London to Sydney breaks record"	"travelnews"	"Australian airline Qantas has broken the record for the world's longest commercial airline passenger flight in both distance and time with a nonstop service carrying about 50 people from London to Sydney via a rare double sunset."
"0"	"Hugh Jackman Congratulates John Legend on Sexiest Man Alive While Poking Fun at Ryan Reynolds"	"movies-celebrity"	"Hugh Jackman Congratulates John Legend on Sexiest Man Alive"
"0"	"Stars who've lived with their parents"	"celebrity"	"Find out which adult celebs haven't minded sharing a roof with Mom or Dad."
"0"	"FCA And GM Unfazed By The Ford Bronco's Return"	"autosnews"	"Should they be worried?"
"1"	"Weird And Wild Photos From The Lone Star Motorcycle Rally"	"autosmotorcycles"	"20 photos of the crazy motorcycles, costumes, and attendees from the rally in Galveston, Texas."
"0"	"Taylor Swift Says Scooter Braun, Scott Borchetta Are Blocking Her From Playing Old Hits at AMAs"	"musicnews"	"Taylor Swift has taken to social media to tell fans that Scott Borchetta, her former label head at Big Machine Records, and his new partner Scooter Braun are trying to nix her plans for a retrospective performance at the American Music Awards, as well as denying the use of her recordings for a documentary she"
"0"	"See Princess Sofia of Sweden's Unexpected Green Leopard Print Dress   Complete with Tiara!"	"lifestyleroyals"	"Princess Sofia of Sweden's Leopard Print Dress with Tiara"
"0"	"We tried McDonald's new Snickerdoodle McFlurry, and here's our honest review"	"newstrends"	"On the heels of the 2019 holiday season, McDonald's announced a brand new seasonal McFlurry   the first one to get a nationwide release in seven years. After a successful trial run in several markets over the summer, the Snickerdoodle McFlurry launched exclusively on Uber Eats. The frozen treat will be more widely available in-house later this month, but is it worth the wait? The 20 Most Over-the-Top Fast Food Menu Items of All Time We tried the..."
"0"	"6 ways to use CO2 to cut emissions and generate trillions of dollars"	"markets"	"From concrete to fuels, CO2 from the air can replace CO2 from the ground."
"0"	"Japan Wants You To Stop Buying All Its Skyline GT-Rs"	"autosenthusiasts"	"In recent years, no thanks to the sudden availability of interesting Bubble Era and Gran Turismo generation cars being legally available in the United States, there's been a mass exodus of iconic cars from the domestic market."
"0"	"Country music's biggest scandals"	"music-awards"	"From Wynonna Judd's husband's arrest to the Dixie Chicks' vent about George W. Bush, relive country's biggest scandals."
"0"	"Selena Gomez Opens Up About Being Body Shamed for Gaining Weight Amidst Lupus Battle"	"wellness"	"The singer and actress is opening up feeling "attacked" while battling life-threatening health issues."
"0"	"Hilaria Baldwin Shares Emotional Video Revealing She Had a Miscarriage"	"tv-celebrity"	"Hilaria Baldwin Shares Emotional Video Revealing She Had a Miscarriage"
"0"	"This Guy Lost 30 Pounds and Gained a Rock-Hard Six Pack"	"weightloss"	"Pizza, Chinese take-out, McDonald's, ice cream, you name it   "If it isn't good for you, I would enjoy eating it in large quantities," says Chris Anderson."
"1"	"Judge calls USC dad a 'thief,' gives longest prison sentence so far in college admissions scandal"	"newscrime"	"Toby MacFarlane, a California real estate executive, received six months for his actions in the college admissions scandal. It's the longest so far."
"0"	"Russia Releases Norwegian, Lithuanians in Unusual Spy Swap"	"newsworld"	"Lithuania and Russia swapped spies at the Baltic nation's border on Friday, with two Lithuanian citizens and a Norwegian handed over in exchange for two Russians."
"0"	"See the most expensive watch ever sold at auction"	"viral"	"A Patek Philippe watch has sold for a record $31M at a charity auction hosted by Christie's in Switzerland."
"1"	"Survivor Contestant Accused of 'Inappropriate Touching,' 2 Players Admit to Using Allegations to Win"	"tvnews"	"Survivor Faces 'Inappropriate Touching' Scandal: Dan Accused by Kellee"
"0"	"Archie's Photo Album: Prince Harry, Duchess Meghan's Royal Baby"	"lifestyleroyals"	"So cute!"
"0"	"Meet Narwhal the Magical Unicorn Puppy"	"animals"	"See the 10-week-old puppy that's breaking the internet! Get details on the little pooch born with a bonus tail on his head."
"0"	"Report: Police investigating woman's death after Redskins' player Montae Nicholson took her to hospital"	"football_nfl"	"Police are investigating an apparent drug-overdose death of a woman after the Redskins' Montae Nicholson took her to a hospital, according to reports."
"0"	"This Is the Hottest Destination in America for a Road Trip"	"video"	"64 percent of Americans want to go on a spontaneous road trip with friends. A Sixt study looked at the most desirable road trip destinations. Buzz60's Sam Berman has the full story."
"0"	"Jokic, Nuggets hold on for 100-98 overtime win over Wolves"	"basketball_nba"	"MINNEAPOLIS (AP)   Nikola Jokic his a fadeaway jumper with 2.4 seconds left to give the Denver Nuggets a 100-98 overtime victory over the Minnesota Timberwolves on Sunday. Jokic had 20 points, six rebounds and seven assists to help Denver win its fourth straight game. Will Barton had 13 points, including a pair of 3s in overtime, and 12 rebounds. Paul Millsap scored all 14 of his points during a big third-quarter run and had 10 rebounds...."
"0"	"'Bluff City Law' episode 8 to feature an unexpected guest"	"tvnews"	"On "Bluff City Law" Monday, we finally meet Emerson's mother. She's the woman Elijah Strait had an affair with."
"1"	"Is Anyone Actually Buying The New Toyota Supra?"	"autosenthusiasts"	"In case you may not be aware, Toyota brought back the Supra."
"0"	"Teen girl accused in violent Orange Mound carjacking"	"newscrime"	"A teenage girl previously accused of stealing wigs is now is charged with a carjacking that left a Memphis man bloodied. Detectives didn't have to go very far to find the suspect   18-year-old Danahja Henderson   since she was in court for a previous offense. Police say Oct. 22, victim Lester Johnson was contacted by a young woman on Facebook asking for a ride from South ..."
"0"	"Experts Explain Why You Might Want to Stop Sleeping on Your Stomach and How to Do It"	"wellness"	"It may be time to make over your sleep habits   here's why and how to do it."
"0"	"Eating Enough of These Two Nutrients May Help Lower Your Risk of Lung Cancer"	"ads-lung-health"	"They're already found in some of your favorite foods."
"0"	"Warren Buffett buys a stake in Restoration Hardware"	"finance-top-stocks"	"Warren Buffett must really like comfy sofas and beds. The Oracle of Omaha's Berkshire Hathaway bought more than 1.2 million shares of high-end furniture retailer RH -- aka Restoration Hardware -- in the third quarter. It's a new position for Berkshire."
"0"	"You'll Be Captivated by Ciara's Best Hair and Makeup Looks"	"lifestylecelebstyle"	"Ciara has been one of our beauty crushes since she released her hit "Goodies" in 2004, but in the past few years, she's been responsible for some seriously head-turning hair and makeup looks."
"0"	"Bolivia's Jeanine Anez declares herself acting president as Evo Morales vows to fight from abroad"	"newsworld"	"Bolivian senator Jeanine Anez declared herself the country's acting leader Tuesday, despite a boycott by former President Evo Morales' allies that left the legislative chamber short of the legal minimum number of lawmakers required to appoint her."
"0"	"Russia lands forces at former U.S. air base in northern Syria"	"newsworld"	"Russia lands forces at former U.S. air base in northern Syria"
"0"	"Anthony Davis admits he is still feeling discomfort in his right shoulder"	"basketball_nba"	"Los Angeles Lakers superstar Anthony Davis admits he is still feeling discomfort in his right shoulder following loss to the Toronto Raptors."
"1"	"Family searches for missing mother last seen in Cordova"	"newscrime"	"MEMPHIS, Tenn.   A Collierville family is desperate for answers after a young mother disappeared. Memphis Police say 26-year-old Sarah Vinick was last seen Tuesday, leaving a residence on Trondheim Drive in Cordova. Her mother, Cynthia Vinick, said what makes this situation even more difficult is having to explain this situation to Sarah's 4-year-old daughter. She said she spoke to her ..."
"0"	"Kapler says he didn't do enough for alleged assault victim"	"baseball_mlb"	"New San Francisco Giants manager Gabe Kapler said Wednesday that he should have sought the guidance of experts four years ago when dealing with a 17-year-old girl who contacted him about an assault reportedly witnessed by Los Angeles Dodgers minor leaguers."
"0"	"Advocacy groups push Senate to include election security money in funding bill"	"elections-2020-us"	"A group of advocacy organizations is pushing the Senate to include election security funds in the upcoming continuing resolution (CR) to fund the government."
"0"	"Jennifer Lopez Just Got a Teeny Chop to Her Blond Lob, but it Changed the Entire Look"	"lifestylecelebstyle"	"In September, Jennifer Lopez debuted a new hairstyle at the premiere of Hustlers."
"1"	"An Alaskan moose hunter beat the odds at the Supreme Court. It cost $1.5 million."	"newsus"	"John Sturgeon fought the federal government for years after he was banned from using his hovercraft in a national preserve. But success at the high court doesn't come cheap. Here's how he did it."
"0"	"USA TODAY interview: Nikki Haley isn't running for president. That is, not yet."	"newselection2020"	"Interview: Nikki Haley just may be the only top Trump official who has maintained good relations with the president and yet defined some distance."
"0"	"The Day in Sports: Thursday, November 14, 2019"	"more_sports"	"The Day in Sports: Thursday, November 14, 2019"
"0"	"Camila Cabello and boyfriend Shawn Mendes get tattoos together: Photos"	"music-celebrity"	"The pop stars got inked together after four months of dating -- and this is Camilla's first tat!"
"0"	"Winners, losers from Seahawks' wild overtime win over 49ers on 'Monday Night Football'"	"football_nfl"	"There were turnovers galore in this instant classic. Now the Seahawks are just one game behind the 49ers in the loss column, and there are no more undefeated teams in the NFL."
"0"	"Here are the best cruise lines for families, couples and those on a budget"	"travelnews"	"U.S. News & World Report released its annual ranking of cruise lines, taking into account multiple factors, including amenities, cost and family-friendly features."
"0"	"Bold predictions for Week 12 in college football"	"football_ncaa"	"Expect the unexpected in college football each weekend. USA TODAY experts weigh in with their bold predictions for Week 12 of the season."
"1"	"Here's What It Means If You Have Ridges on Your Nails"	"medical"	"They don't make for the prettiest of manicures, but are they something more than a cosmetic problem?"
"0"	"How Google Interferes With Its Search Algorithms and Changes Your Results"	"finance-companies"	"Pressed by businesses, interest groups and governments, the internet giant uses blacklists, algorithm tweaks and an army of contractors to shape what you see."
"0"	"Supreme Court refuses to block lawsuit against gun manufacturer brought by Sandy Hook families"	"finance-companies"	"The Supreme Court refused to shield Remington Arms Co. from potential liability for the 2012 school shooting that left 26 dead in Newtown, Conn."
