"1"	"Queens boy, 14, shot dead playing hoops in South Jamaica housing project"	"newsus"	"A 14-year-old Queens boy was shot dead Saturday on the basketball court of a NYCHA project in South Jamaica, police said. Cops responded around 8 p.m. to the court behind 116-80 Guy R. Brewer Blvd. in the Baisley Park Houses and found the teen with a gunshot wound to his neck. Neighbors and the boyfriend of the teen's mother identified him as Amir Griffin. A woman who lives in the project and declined to give her name heard gunfire. “It's...“"
"1"	"Subtle Signs You May Have Clogged Arteries"	"medical"	"These surprising clues can point to clogged arteries and underlying heart disease."
"1"	"Man's trip to a cheese shop helps unravel missing persons case"	"newscrime"	"Kris Zocco's whereabouts the morning Kelly Dwyer was reported missing would be the first in a series of clues as to what may have happened to the 27-year-old woman"
"1"	"$16.8 Million In Campaign Funds Went To Trump Businesses, Latest Records Reveal"	"newspolitics"	"Not only have the U.S. and foreign governments spent money at properties owned by Donald Trump, but the president's own political campaign and affiliated political committees have also spent about $16.8 million at his businesses since he launched his 2016 bid for the presidency, according to an analysis of federal election spending records. Republican political campaigns and PACs have spent just under $1.8 million at Trump-owned businesses so..."
"1"	"'Habitual stowaway' arrested again at O'Hare, Chicago police say"	"newscrime"	"A woman arrested at O'Hare International Airport on Friday night was identified by Chicago police as "known habitual stowaway" Marilyn Hartman."
"1"	"Democrats grapple with impeachment timing as evidence piles up"	"newspolitics"	"As more witnesses come forward to spill more secrets, the more Democrats are nervously eyeing the dwindling congressional calendar and wondering: When should we be satisfied with what we have and bring articles of impeachment to the floor?"
"1"	"Unprecedented movement detected on California earthquake fault capable of 8.0 temblor"	"newsus"	"A major California fault capable of producing a magnitude 8 earthquake has begun moving for the first time on record, a result of this year's Ridgecrest earthquake sequence destabilizing nearby faults, Caltech scientists say in a new study released in the journal Science on Thursday. In the modern historical record, the 160-mile-long Garlock fault on the northern edge of the Mojave Desert has never been observed to produce either a strong..."
"1"	"Trump congratulates Mississippi's Reeves on election night win"	"newspolitics"	"President Trump on Tuesday congratulated Republican Tate Reeves on being elected governor of Mississippi, adding that a recent campaign rally and endorsement from the commander-in-chief helped push the GOP-candidate to victory in the state."
"1"	"Walmart Sparks Panic and Confusion in the Dish-Soap Aisle"	"finance-companies"	"Procter & Gamble didn't make enough dish soap, and Walmart is letting all its customers know about it."
"1"	"Birmingham couple charged with murder after abducted 3-year-old's body found in dumpster"	"newscrime"	"An Alabama couple have been charged with capital murder in the suffocation death of 3-year-old Kamille "Cupcake" McKinney who was found in a dumpster"
"1"	"Selena Gomez lands first No. 1 song on Billboard Hot 100 with 'Lose You to Love Me'"	"musicnews"	"Selena Gomez lands first Billboard Hot 100 No. 1 song"
"1"	"Celeb couples with big age gaps"	"celebrity"	"Age is just a number for some stars!"
"1"	"Space satellite crashes in front yard of Michigan home"	"newsscienceandtechnology"	"The debris fell to the ground on a farm in Merrill, Michigan, Saturday."
"1"	"Kevin Spacey Won't Be Charged in Sexual Assault Case After Accuser Dies"	"movies-celebrity"	"The Los Angeles County District Attorney's Office has formally dropped a case against actor Kevin Spacey, after the accuser died."
"1"	"Republicans urge Bevin to provide proof of election fraud or concede"	"newspolitics"	"A growing number of Republican lawmakers are urging Kentucky Gov. Matt Bevin, a fellow Republican, to either provide evidence of the voting "irregularities" he has alleged or concede Tuesday's election to Gov.-elect Andy Beshear, who defeated him by 5,189 votes."
"1"	"Pamela Anderson gets backlash after wearing a Native American headdress for Halloween"	"tv-celebrity"	"Pamela Anderson is under fire after posting risqué photos of herself wearing a Native American headdress in honor of Halloween. The Canadian actress and animal rights activist, who rose to fame for her role as a lifeguard on the series Baywatch, took to Twitter like many other celebrities to post photos of herself in her Halloween costume. In the first photo, the 51-year-old sports a pair of high-waisted underwear, and appears to be drenched in..."
"1"	"Can you spot the cat hiding among the bats in this spooky Halloween brainteaser?"	"lifestylebuzz"	"Gergely Dudás is a master of disguise   at least, when it comes to his art. His latest image features a cat hidden among bats. Can you pick it out?"
"1"	"Patrick Day in coma after suffering brutal knockout"	"more_sports"	"The junior middleweight underwent emergency brain surgery after being knocked out by Charles Conwell."
"1"	"Bette Midler mocks Lori Loughlin's college admission scandal"	"music-celebrity"	"In a new tweet, Bette Midler pokes fun at Lori Loughlin's involvement in the college admission scandal."
"1"	"John Stamos accidentally 'likes' Lori Loughlin-to-jail tweet"	"tv-celebrity"	"John Stamos said he didn't mean to like the tweet about Lori Loughlin's legal situation, and he's since unliked it."
"1"	"Prince Harry Has the Sweetest Response When Young Student Calls Him Handsome During Japan Trip"	"lifestyleroyals"	"Prince Harry Has Sweet Response When Student Calls Him Handsome"
"1"	"12 secrets behind Disneyland's most famous treats"	"foodnews"	"From the baking process to how treats make it onto the park's menu, here are some fascinating things you never knew about some famous Disney desserts."
"1"	"These Are the Fastest Drive-Thrus in America Ranked!"	"restaurantsandnews"	"Looking for a fast-food restaurant with the fastest drive-thru? You'll want to see this list of the average wait time at your favorite chains."
"1"	"Climate change has finally caught up to this Alaska village"	"weathertopstories"	""Many folks are not happy to be leaving the place they've known their whole lives." After 20 years of melting permafrost, residents of Newtok now must move."
"1"	"Video captures terrifying moment woman slips at Grand Canyon"	"viral"	"Emily Koford was visiting the national park with her mom when a step backward left her clinging to the rocks."
"1"	"Former Fox News hosts want out of non-disclosure agreements"	"newsus"	"In the wake of the Me Too movement, women are calling them unfair silencers that sweep sexual misconduct claims under the rug"
"1"	"Cincinnati school board candidate accused of 'pretending to be black' in his ads"	"newsus"	"A current CPS board member took to Twitter Sunday to say a candidate for the board "is a white guy pretending to be black to get votes" in ads."
"1"	"3 reasons I bought a house after swearing I'd rent for life"	"finance-real-estate"	"After living abroad for 11 years and enjoying a nomadic lifestyle, the author and her husband finally decided to buy a house in Jacksonville, Florida."
"1"	"She Fought for Muslim Women. Then She Was Found Dead."	"newsus"	"Ola Salem was, by all accounts, fearless. As a teenager, she stood up to the managers of an amusement park after she was not allowed on rides because she was wearing a head scarf."
"1"	"In photos: Elijah Cummings, 1951-2019"	"newspolitics"	"Rep. Elijah Cummings (D-Md.) has died at age 68."
"1"	"Outer Banks storms unearth old shipwreck from 'Graveyard of the Atlantic'"	"newsus"	"A recent storm on the Outer Banks unearthed an old shipwreck buried on the beach in Hatteras Island. A local bar shared photos of the old wooden ship in its final resting place in the area known as "The Graveyard of the Atlantic." "A Wreck across the street from The Wreck! A lot of sand has washed out with this Nor'Easter & look what's been exposed!" The Wreck Tiki Bar in Hatteras, North ..."
"1"	"Soldier wounded searching for Bergdahl dies"	"newsus"	"Allen's unit was ambushed when they were looking for Bergdahl after he deserted his base in 2009"
"1"	"Teen wins science competition with liquid bandage invention"	"health-news"	"Kara Fan beat nine other finalists and hundreds of students who submitted ideas in the 3M​ Young Scientist Challenge, winning $25,000."
"1"	"Niagara Falls: Boat stuck on rocks 101 years dislodged"	"weathertopstories"	"High winds and heavy rains dislodged the remains of a barge in the rapids above Niagara Falls that had been there 101 years."
"0"	"Taylor Swift Rep Hits Back at Big Machine, Claims She's Actually Owed $7.9 Million in Unpaid Royalties"	"musicnews"	"Taylor Swift's team responds to Big Machine's denial."
"1"	"Meghan McCain GOES IN on Donald Trump Jr. on 'The View'"	"popculture"	"The daytime talk show co-host sparred with the president's son during his stop by the show Thursday."
"1"	"Dog Tries To Jump On Recliner With Dad   And It Doesn't Quite Go As Planned"	"lifestylebuzz"	"Marybeth Parker He might be 5 years old, but Herbert is a huge baby at heart."
"1"	"The 3 Things Ina Garten Always Has in Her Freezer"	"tipsandtricks"	"And one of those things is vodka."
"1"	"Census Bureau Seeks Driver's License Data, Including Citizenship And Eye Color"	"newsus"	"The U.S. Census Bureau has asked several states to turn over driver's licenserecords that include personal data like eye color as part of President DonaldTrump's effort to obtain citizenship data.The Census Bureau said Tuesday that it requested the information as part ofits effort to use existing government records to compile data on citizenship.The agency said it was requesting the records to comply with Trump's Julyexecutive order asking it to..."
"0"	"Court puts hold on Rodney Reed's scheduled execution"	"newscrime"	"With new, compelling evidence in Reed's case, the call to halt his Nov. 20 execution has been building in recent weeks."
"1"	"Dad of 19-Year-Old Killed by Wife of U.S. 'Spy' Wants to Talk to Trump 'Man to Man'"	"newsworld"	"The little ribbons on the lapels of Harry Dunn's parents as they spoke to reporters in New York City Monday morning were Kawasaki green because that's the color of the motorbike their 19-year-old son was driving when he was killed. Dunn died on Aug. 27 when Anne Sacoolas, a 42-year-old American living at the Royal Air Force spy base in Croughton, England, hit him with her Volvo SUV while she was driving on the wrong side of the road. Sacoolas,..."
"0"	"66 Cool Tech Gifts Anyone Would Be Thrilled to Receive"	"shop-holidays"	"Let's face it: everyone wants the newest, coolest tech gadget on the market, and we don't blame 'em."
"1"	"President Trump says UFC reception was 'like walking into a Trump Rally'"	"mma"	"Despite hearing boos, President Trump compares reception from crowd at UFC 244 in New York to one at a campaign event. "Plenty of MAGA ...""
"1"	"After bishops call for married priests, pope urges new ways"	"newsworld"	"On the heels of a bold call by Amazon region bishops for married men to become priests, Pope Francis is urging openness to new ways, and in a possible slap at conservative critics who fear he is weakening the Catholic church's foundations, he cautions faithful against entering the "swampy waters of ideologies.""
"1"	"Prince Harry acknowledges tensions with William in ITV interview"	"lifestyleroyals"	"Britain's Prince Harry has acknowledged tensions with his older brother Prince William for the first time, saying they are on "different paths.""
"1"	"Kellyanne Conway defends her comments in viral phone interview: 'Exactly none of it is anyone's business'"	"newspolitics"	"White House counselor Kellyanne Conway stood by her statements during a phone conversation with a Washington Examiner reporter that went viral."
"1"	"Failed operation underlines Mexico chaos"	"newsworld"	"A daring operation to capture one of Mexico's most powerful drug lords failed disastrously when armed cartel members launched a deadly counterattack, laying siege to the northern city of Culiacan and taking several security officers hostage."
"1"	"Caterpillar just flashed the latest warning sign for the global economy"	"finance-top-stocks"	"The construction equipment titan   a bellwether for global industry   posted a 6% drop in sales and an 8% drop in profit per share."
"1"	"As his Alzheimer's looms, Charles and Pam Ogletree take one last walk in love"	"newsus"	"Ogletree was a giant of the law, a force of nature and for justice. Then came Alzheimer's, and the cruel unraveling."
"1"	"Jennifer Aniston Breaks Meghan Markle and Prince Harry's Instagram Record"	"tv-celebrity"	"You won't believe how many followers the actress got with just one selfie!"
"1"	"Archaeologists open ancient coffins in Egypt"	"science"	"After 30 ancient coffins were unearthed "completely by accident" in Egypt this week, archaeologists are now taking a closer look. Two of the coffins have been opened but what will experts find inside? NBC's Molly Hunter reports for Weekend TODAY."
"1"	"Yesterday's Soup Just Became Today's Pasta Sauce"	"tipsandtricks"	"A new book has a smart tip for making yesterday's soup exciting again and, in the process, avoiding Big Pot Fatigue."
"1"	"Missouri man missing for a week found alive in car that crashed into ravine"	"newsus"	"Ryan Linneman, of Lee's Summit, was found by a dirt bike rider in wreckage along Interstate 470 in Kansas City, Lee's Summit police said."
"1"	"Man who inherited 6 figures shares advice he'd give his younger self"	"personalfinance"	"Brandon Neth inherited around $123,000 from his late father and grandfather when he was 20. He spent most of it on cars, clothes, and restaurants."
"1"	"Six photographers share their favorite Audrey Hepburn images in a new book celebrating the Hollywood actress 26 years after her death"	"movies-celebrity"	"From playing cricket on set to posing in designer clothes, these stunning photos, all published in a new book, capture the timeless beauty of Audrey Hepburn, 26 years after her death at the age of 63."
"1"	"Celebrity kids then and now: See how they've grown"	"entertainment-celebrity"	"See what the children of Bobby Cannavale, Ray Liotta, Jude Law, Jamie Foxx, Sylvester Stallone, James Gandolfini and more stars look like now."
"1"	"Trump 'surprised' at pushback to hosting G-7 at his Doral resort, chief of staff says"	"newspolitics"	"President Donald Trump changed his mind about hosting a summit of world leaders at his own resort in Doral after being "surprised at the level of push-back" to last week's announcement, his acting chief of staff, Mick Mulvaney, said Sunday."
"0"	"Wilson deletes tweet of him standing over concussed Smith-Schuster"	"football_nfl"	"The fallout from one of the most bitter games in NFL history rages on."
"1"	"DNA Test Leads Man to Biological Parents He Thought Died 50 Years Ago: 'It Was Surreal'"	"lifestylebuzz"	"Man Finds Biological Parents He Thought Died 50 Years Ago"
"1"	"Joe Biden reportedly denied Communion at a South Carolina church because of his stance on abortion"	"newspolitics"	"Joe Biden has a complicated history with the Catholic Church."
"1"	"Divers Find Giant Mysterious 'Egg' Floating In Ocean"	"lifestylebuzz"	"A team of divers set off to explore a sunken World War II ship off the Norwegian coast, but what they found was something far more mysterious. While making their way back to shore, Ronald Raasch, Nils Baadness and Brynjar Aarnseth came face-to-face with a giant floating orb. The bubble hovered 17 meters (56 feet) below the surface and appeared to be see-through. The divers turned their flashlights on it and realized that the sphere was filled..."
"1"	"Trump recognizes Cummings during address at historically black college"	"newspolitics"	"President Trump offered his "warmest respects" to the family and friends of the late Rep. Elijah Cummings (D-Md.) on Friday as lawmakers and multiple former presidents and political figures paid tribute to the longtime Baltimore-area congressman.During a speech at a historically black college in Columbia, S.C., Trump recognized the Maryland congressman for his passion, recalling an Oval Office meeting during which he and the Democratic..."
"1"	"White House: John Kelly 'was totally unequipped to handle the genius of our great President'"	"newspolitics"	"President Donald Trump is disputing that former White House chief of staff John Kelly warned the President before he left the White House last year not to hire a replacement who wouldn't tell him the truth or that he would be impeached."
"1"	"Survivor Contestant Rudy Boesch Dies at 91 After Long Battle with Alzheimer's Disease"	"tvnews"	"Survivor's Rudy Boesch Dead at 91"
"1"	"Lawyers, Insurers and Advisers Vie With Scammers to Exploit the Elderly"	"markets"	"Phone fraudsters and greedy children aren't the only ones manipulating older Americans, and the threat to their assets is growing."
"1"	"Boxer Patrick Day dies after suffering traumatic brain injury in super welterweight fight"	"boxing"	"Boxer Patrick Day, 27, died on Wednesday after being knocked out against Charles Conwell on Saturday. He had surgery and had been in a coma."
"1"	"Harry Dunn's family launches legal action against the UK Foreign Office"	"newsworld"	"The family of a teenager killed in a road traffic collision that police believe involved a US diplomat's wife is launching legal action against the UK Foreign Office over its handling of the incident."
"1"	"Third Indiana Catholic school employee fired in growing scandal over LGBTQ staff"	"newsus"	"Unlike the others fired from Indianapolis-area Catholic schools, Kelley Fisher is straight and only expressed support for her fired colleagues."
"1"	"For the first time ever, a US cheese is named best in the world"	"foodnews"	"Forget the American love affair with Cheez Whiz, blocks of Velveeta and pasteurized processed cheese food slices. An organic blue cheese from Oregon has been named the world's top cheese."
"1"	"Cummings' widow responds to Trump's attacks, gets standing ovation"	"viral"	"Dr. Maya Rockeymoore Cummings, the widow of the late Rep. Elijah Cummings, appeared to respond to President Trump's previous attacks of her husband during a speech at his funeral."
"1"	"'Morbidly Obese' Cat Goes Viral for Refusing to Run on Underwater Treadmill in Hilarious Clip"	"lifestylebuzz"	"The very relatable video shows a large gray cat, nicknamed Cinder-block, using the absolute least amount of effort while being made to exercise"
"1"	"Nike hit with another damning op-ed: 'I was emotionally and physically abused'"	"finance-companies"	"Nike has been hit with another damning op-ed, highlighting the obstacles female athletes have faced through training with the company."
"1"	"Body of missing Alabama girl found; 2 being charged"	"newscrime"	"Investigators searching through garbage found the body of a 3-year-old girl who was missing more than a week, and authorities are charging two people with murder, police said Tuesday."
"1"	"12 Fall Landscaping Mistakes to Know and Avoid"	"lifestylehomeandgarden"	"Whether you have a green thumb when it comes to your home garden, or you can hardly tell the difference between a rose and a weed, you should know that there are certain landscaping tasks that need to be done right to keep your home exterior looking its best. But to do that, you must avoid the most common fall landscaping blunders."
"1"	"Miguel Cervantes' Wife Reveals Daughter, 3, 'Died in My Arms' After Entering Hospice Care"	"tv-celebrity"	"Miguel Cervantes' Wife Reveals Daughter 'Died in My Arms' After Hospice Care"
"1"	"Rainbow Baby! Shawn Johnson, Andrew East Welcome 1st Child After Miscarriage"	"tv-celebrity"	"Rainbow Baby! Shawn Johnson, Andrew East Welcome 1st Child After Miscarriage"
"1"	"Felicity Huffman begins prison sentence for college admissions scam"	"tv-celebrity"	"The actress will spend 14 days inside a federal lockup outside of San Francisco."
"1"	"Search resumes for worker missing in New Orleans Hard Rock Hotel building site collapse that killed 2"	"newsus"	"Rescuers resumed searching Sunday for a worker trapped in rubble after a deadly construction collapse in New Orleans, officials said, but the building's instability is making for a precarious situation."
"0"	"THEN AND NOW: What all your favorite '90s stars are doing today"	"celebrity"	"These heartthrobs and fan favorites made the 1990s one of the best decades of the century. Here's what they're up to now."
"1"	"Elizabeth Warren's Days Defending Big Corporations"	"markets"	"Elizabeth Warren had never taken on the federal government before. But in 1995, she found herself up against the Clinton administration, representing the Cleveland-based conglomerate LTV Steel. Even though LTV had sold off its coal mines during the 1980s, a new law required it to contribute to a health fund for retired miners. LTV believed that it should not have to pay. Those claims, the company said, should have been handled as part of its..."
"1"	"27 Nearly Forgotten Thanksgiving Recipes"	"recipes"	"Remember these vintage Thanksgiving recipes like oyster stuffing, sweet gelatin molds and Cornish game hens? The post 27 Nearly Forgotten Thanksgiving Recipes appeared first on Taste of Home."
"1"	"50 Delicious Dutch Oven Recipes"	"recipes"	"Put your favorite pot to work with these Dutch oven recipes. The post 50 Delicious Dutch Oven Recipes appeared first on Taste of Home."
"1"	"The Sante Fe High School massacre suspect isn't fit to stand trial and will get psychiatric treatment, attorney says"	"newsus"	"Dimitrios Pagourtzis is accused of killing eight students and two teachers at his Texas high school last year."
"1"	"Trump says he thought family of UK teen wanted meeting with diplomat's wife"	"newsworld"	""I thought they were -- based on what I thought -- that they wanted to meet," Trump told reporters of Harry Dunn's parents declining to meet with Anne Sacoolas."
"1"	"Deer fatally attacks hunter who shot him"	"newsus"	"In what officials are calling a bizarre incident, an Arkansas hunter was killed by a deer that he thought he had killed."
"1"	"21 Things You Never Knew About America's 'Royal' Families"	"lifestylesmartliving"	"We may not have monarchs in America, but we do have our own royals, from the Vanderbilt family to the Kennedys. Here's what you don't know about them."
"1"	"The new Joy Of Cooking keeps it in the family"	"foodnews"	"It's not entirely fair to say that Joy of Cooking is responsible for John Becker and Megan Scott's entire relationship. But it's also not entirely fair to say that it's not."
"1"	"Singer Lauren Alaina Has Lost 25 Lbs. on Dancing with the Stars: 'None of My Clothes Fit'"	"tv-celebrity"	"Lauren Alaina Has Lost 25 Lbs. on Dancing with the Stars"
"1"	"Facing Investigation, Giuliani Needed a Lawyer, but Firms Stayed Away"	"newspolitics"	"President Trump's personal lawyer, Rudolph W. Giuliani, said on Wednesday that he had assembled a legal team to represent him in the criminal investigation into his activities related to Ukraine, an announcement that came after weeks of sputtered attempts to find a lawyer willing to take him on as a client. Mr. Giuliani said on Twitter that he would be represented by three lawyers, including his longtime friend, Robert J. Costello. The hires..."
"0"	"3 Indiana judges suspended after a night of drinking turned into a White Castle brawl"	"newsus"	"Hours before they were to attend an educational conference in Indianapolis, three judges went out drinking for a few hours and decided to walk to a strip joint."
"1"	"13 Ways to Prep Your Yard Before Snow Season"	"lifestylehomeandgarden"	"If you want a lush lawn and a healthy garden come springtime, here's everything you need to do with your yard before winter hits."
"1"	"Kasich to Congress: 'Look in the mirror at how you want to be remembered'"	"newspolitics"	"Former Ohio Gov. John Kasich said his advice for fellow Republicans in Congress during the impeachment process was to "look in the mirror at how you want to be remembered.""
"1"	"Counting On's Kendra, Joe Duggar Welcome Baby No. 2"	"tv-celebrity"	"Counting On's Kendra, Joe Duggar Welcome Baby No. 2"
"1"	"20 Grocery Stores That Will Be Open On Thanksgiving For All Your Last-Minute Needs"	"tipsandtricks"	"Preparing a feast isn't always smooth sailing."
"1"	"Good Housekeeping Releases List Of Top Toys For 2019"	"lifestyle"	"Good Housekeeping puts kids to work testing out hundreds of new toys that get ranked for creativity, educational value, and safety. CBS2's Chris Wragge reports."
"1"	"Kamille 'Cupcake' McKinney's disappearance: Reward for information on missing Alabama girl increases as police search continues"	"newscrime"	"After a search of an apartment complex did not reveal new information about a missing 3-year-old girl, the police chief in Birmingham, Alabama, made an impassioned plea Wednesday for whoever took the girl to return her safely."
"1"	"Young and the Restless Star William Wintersole Dies at 88"	"tvnews"	"Soap Opera Star William Wintersole Dies at 88"
"1"	"The Search for a Gender Neutral Drive Thru Toy"	"foodnews"	"When families are asked whether a kid's meal is for a boy or girl, it means kids get toys based on stereotypes not their actual interests. Is it time to rethink drive-thru toys?"
