"1"	"Gabbard hits back at 'queen of warmongers' Clinton"	"newspolitics"	"Presidential candidate Rep. Tulsi Gabbard (D-Hawaii) did not hold back Friday when responding to 2016 nominee Hilary Clinton's suggestion that she is the "favorite of the Russians" for 2020, excoriating the former secretary of State as "the queen of warmongers" and "personification of the rot that has sickened the Democratic Party.""
"1"	"Joe Giudice Says Immigration Officers Took Selfies with Him After He Was Released"	"tv-celebrity"	"Joe Giudice: Immigration Officers Took Selfies with Me"
"1"	"Former Deadliest Catch Star Jerod Sechrist Arrested, Charged with Heroin Possession"	"tv-celebrity"	"Deadliest Catch: Jerod Sechrist Charged with Heroin Possession"
"1"	"Bill Plaschke: Mike Bohn brings USC integrity, which means he can't hire Urban Meyer"	"football_ncaa"	"LOS ANGELES_You ever heard of Mike Bohn? Me neither, and that's a good thing. The University of Southern California is apparently set on naming Bohn as its new athletic director, the smart hiring of a man who embodies the most important attribute for the new leader of the Trojans family. He's a complete stranger. He never played football at USC. He never coached football at USC. He never ..."
"0"	"The Unlikely Star of My Family's Thanksgiving Table"	"recipes"	"It's hard to remember life before broccoli cheese rice casserole. Or, B.B.C.R.C.E. (Before Broccoli Cheese Rice Casserole Era). What did the Kim clan have to look forward to every Thanksgiving before the cheesy family-favorite side dish entered our lives? Stuffing, maybe. Green bean casserole. Macaroni and cheese. Ham in cola, a quirky recipe from Nigella Lawson that she picked up from the American South. Certainly nothing from the Korean..."
"1"	"23 Foods That Help Lower High Blood Pressure"	"nutrition"	"Consuming less sodium may be important to help slash blood pressure levels, but eating more of these foods is good for your heart and arteries too. The post 23 Foods That Help Lower High Blood Pressure appeared first on The Healthy."
"1"	"Former US Senator Kay Hagan dead at 66"	"newspolitics"	"Former U.S. Sen. Kay Hagan, a one-time Capitol Hill intern who went on to become North Carolina's first Democratic female senator, died Monday at her Greensboro home. She was 66."
"1"	"65 Best Fall Soups That Will Warm You and Your Family Up All Season Long"	"recipes"	"These hearty bowls are the perfect companion for a rainy fall night."
"1"	"Queens Catholic school told 8-year-old student to lose his cornrows in order to stay in class: lawsuit"	"newsus"	"Thou shalt not covet, steal, or... wear braids. A furious Queens mom says a Catholic school discriminated against her 8-year-old son by telling him he couldn't wear his hair in cornrows."
"1"	"Judge in Purdue Pharma bankruptcy case extends lawsuit protection to Sacklers"	"newsus"	"The judge, Robert Drain, set aside concerns from officials representing about two dozen states and municipalities. They objected to the legal protection being extended to the Sacklers, who have not filed for personal bankruptcy."
"0"	"Ford v Ferrari: the forgotten car at the heart of the Le Mans '66 clash"	"autosenthusiasts"	"The Ferrari-beater you've probably never heard of"
"1"	"Predicting which of college football's 10 undefeated teams will lose in Week 9"	"football_ncaa"	"How many teams will still have a perfect record after Week 9?"
"1"	"Her cancer surgery was a success. Then a genetic condition let a chemo drug ravage her body"	"healthnews"	"Kerrie Prettitore's genetic mutation kept her body from breaking down the chemo drug 5-FU. A test for the mutation exists but is rarely used."
"1"	"Regis Philbin Lists Longtime Connecticut Estate at a Loss for $4.6 Million   See Inside!"	"tv-celebrity"	"Regis Philbin Lists $4.5 Million Connecticut Home   See the Property"
"1"	"Prince Harry and Meghan Markle are taking a royal respite"	"lifestyleroyals"	"Starting next week, Prince Harry and Meghan Markle are going AWOL."
"1"	"12 things that could save us money if we weren't lazy"	"finance-savemoney"	"From checking your credit report to comparison shopping, go the extra mile to keep your cash."
"1"	"This fast food chain has the best fries, according to customers"	"restaurantsandnews"	"We asked our readers who has the best fries in all of fast food, and Five Guys' fries snatched the potato cake right from McDonald's greasy grasp."
"1"	"Dying father watches son graduate from hospice bed"	"newsus"	"A father's dying wish to see his son's high school graduation was fulfilled from his hospice bed. A hospice and high school in Modesto, California, partnered so Paul Espinoza could see his son, also named Paul, receive his diploma."
"1"	"Family Members Plead for Help in Search for Missing Atlanta College Student: 'Just Come Home'"	"newsus"	"Family Pleads for Help in Search for Missing College Student"
"1"	"Louisiana heads into November runoff for governor's race"	"newspolitics"	"Edwards came just shy of the 50% needed to win Saturday's "jungle" primary outright"
"1"	"Ex-NFL player Winslow Jr takes plea deal before rape retrial"	"football_nfl"	"VISTA, Calif. (AP)   Former NFL player Kellen Winslow Jr. pleaded guilty Monday to raping an unconscious teen in 2003 and to sexual battery involving a 54-year-old hitchhiker in a deal that spared him the possibility of life in prison. Winslow initially hesitated and seemed to agonize over his decision. "I'm sorry. I'm just not thinking very clearly," Winslow told the judge at one point. He asked the judge for more time before he finally entered..."
"1"	"​20 Funny Things People in the 1970s Were Totally Guilty of Doing"	"lifestyledidyouknow"	"Here are 25 things that we all thought were perfectly acceptable back in the 70s that most of us wouldn't even dream of doing today."
"1"	"Montana Men Arrested With $4.25 Million Worth of Marijuana Go Free"	"newsus"	"Two Montana men arrested for possession of 900 pounds of marijuana had their charges dismissed when a judge ruled the seizure was illegal."
"1"	"Holocaust survivor under guard amid death threats"	"newsworld"	"Liliana Segre, 89, is assigned two police officers in Italy after hundreds of anti-Semitic messages."
"1"	"State Trooper Stops Banana Car Driver, Gives Him $20 Instead of a Ticket"	"autosenthusiasts"	"Is it a crime to be this ridiculous? Not in Kalamazoo, Michigan, where a 1993 Ford F-150 4x4 was turned into . . . this."
"1"	"A wave crashed over a couple during their beach wedding photo shoot, and now the stunning picture is going viral"	"lifestylebuzz"	"The couple, who say they met on Tinder, told Insider they would do the photo shoot "all over again in a heartbeat.""
"0"	"This stately home is having the ultimate yard sale"	"finance-real-estate"	"Nicky Haslam's English country estate, The Hunting Lodge, is filled with precious treasures and almost all of them will be sold at auction next month."
"1"	"40+ Ridiculously Good Gluten-Free Thanksgiving Recipes"	"recipes"	"There's no gluten here. But there are potatoes. And stuffing. And pies."
"1"	"Marines correct 74-year-old Iwo Jima error"	"newsworld"	"Historians determined that Cpl. Harold 'Pie' Keller was one of the six men who raised the flag."
"1"	"3 New Alison Roman Recipes You'll Be Making for the Rest of Your Life"	"recipes"	"Alison Roman knows a thing (or 15) about going viral. Consider her recipe for "The Stew": an unassuming chickpea-turmeric concoction that amassed some 5,000 hashtagged shout-outs on Instagram (many of which made their way to Roman's own feed, in screenshotted glory). And "The Chicken," with 500-plus reviews, in just over a month. Or take "The Cookies" the salted chocolate chunk shortbread ones that arguably catalyzed Roman's entrée to her..."
"1"	"New Delhi's toxic, polluted air chokes city's 20 million people, and the haze can be seen from space"	"newsworld"	"Toxic air is choking New Delhi, closing schools and colleges, forcing cars off the road and prohibiting planes from landing at the airport."
"0"	"Joshua Jackson and Jodie Turner-Smith spark marriage speculation"	"tv-celebrity"	"Joshua Jackson and Jodie Turner Smith may be secretly married."
"1"	"Road built by biblical villain uncovered in Jerusalem"	"travelnews"	"A long-buried street that led pilgrims to the Jewish Temple 2,000 years ago was commissioned by Roman governor Pontius Pilate."
"1"	"Simone Biles Shares Sweet Birthday Tribute for "Man of My Dreams" Stacey Ervin Jr."	"entertainment-celebrity"	"The accomplished gymnast has a lot to celebrate right now."
"1"	"The News In Cartoons"	"newsopinion"	"News as seen through the eyes of the nation's editorial cartoonists."
"1"	"An Awkward Moment As Meghan Markle Met A Curtsy Attempt With An American Greeting"	"lifestylevideo"	"Customs vary by country and a hug was lost in translation when Meghan Markle took the stage. Buzz60's Keri Lumm reports."
"1"	"Man left his wife nothing, and her stepchildren told her to scram"	"personalfinance"	"'His life insurance was supposed to go to my mother, but that policy was terminated a few months prior to his death due to a missed payment,' the woman's daughter told MarketWatch."
"1"	"98 Easy Fall Crafts You Can Do Right Now"	"lifestylehomeandgarden"	"Pine cones, pumpkins, burlap and more! These are our favorite fall crafts you can DIY today."
"1"	"Police Surprise Woman Who Anonymously Baked Pizzelle Cookies for Years in Heartwarming Video"	"lifestylebuzz"	"Once the Medford Police learned the identity of the mystery woman who baked for them, AKA the "Pizzelle Lady," they surprised her in this sweet viral video."
"1"	"The No. 1 Most Essential Kitchen Item, According To Rachael"	"tipsandtricks"	"Rach has created a ton of versatile cookware, but here's why the cast-iron skillet stands above the rest."
"1"	"I've been writing about tiny homes for a year and finally spent 2 nights in a 300-foot home to see what it's all about   here's how it went"	"voices"	"I stayed in a tiny house for three days to see what the fuss was all about, and I was surprised by what I saw."
"1"	"Fox News Is Trump's Chief TV Booster. So Why Is He Griping About It?"	"newspolitics"	"Fed up with the coverage on his favorite cable news station, President Trump decided late this summer that a direct intervention was needed. So he telephoned the chief executive of Fox News, Suzanne Scott, and let loose. In a lengthy conversation, Mr. Trump complained that Fox News was not covering him fairly, according to three people with knowledge of the call. Ms. Scott, who has led the cable network since last year, responded by urging Mr...."
"1"	"Michigan apples being recalled in eight states for possible Listeria contamination"	"healthnews"	"More than 2,000 cases Michigan apples, including popular varieties like Honeycrisp, are being recalled due to potential Listeria contamination."
"1"	"Arizona 'Wizard Rock,' missing 1-ton boulder, mysteriously returns"	"newsus"	"Forest officials in Arizona were mystified in October when local landmark Wizard Rock, a 1-ton boulder, suddenly vanished from its position along Highway 89 in Prescott."
"1"	"Dozens of Colorado sheriffs say they won't enforce red flag gun law"	"newsus"	"Several sheriffs in the state of Colorado are digging in their heels against a gun law that will go into effect January 1, allowing for the temporary confiscation of firearms if a gun owner shows dangerous or threatening behavior. 60 Minutes reports on red flag laws being adopted across the country, Sunday"
"1"	"Dignitaries honor Rep. Elijah Cummings in the US Capitol, remember 'the moral force of his life'"	"newspolitics"	"A choir sang from the balcony and light streamed in from a skylight Thursday as U.S. House and Senate leaders of both parties paused at the Capitol to honor the late Baltimore congressman and civil rights advocate Elijah Cummings, a sharecroppers' son who said he was shaped by his humble roots. "Elijah Cummings never forgot where he came from and never lost sight of where he ..."
