"0"	"Last survivor of the Hindenburg disaster dies at age 90"	"The last remaining survivor of the Hindenburg disaster, Werner Gustav Doehner, who suffered severe burns to his face, arms and legs before his mother managed to toss him and his brother from the burning airship, has died. Doehner, the last among 62 passengers and crew who escaped the May 6, 1937 fire, was 90. The fire killed his father, sister and 34 others. He was just 8 years old at the time of the crash."
"1"	"This Is What the 2020 Toyota Supra Should've Looked Like From the Start"	"That wing should be standard on every Supra. The fact that it isn't is a tragedy."
"1"	"2020 Ram 1500 EcoDiesel review: The best full-size truck adds efficiency and capability"	"The Ram 1500 is a solid full-size truck, and its new 3.0-liter diesel engine option only broadens its appeal."
"0"	"'Dream-Maker' Man Wants to Grant Wishes Through Social Media: 'I Do My Best for Everyone'"	"Charles Ressler Grants Wishes Through #DreamMaker Campaign"
"1"	"Trump says likely Baghdadi successor killed by U.S. troops"	"President Donald Trump said on Tuesday the U.S. military had killed the person who likely would have succeeded Abu Bakr al-Baghdadi as the leader of Islamic State."
"0"	"The Most Stunning Evening Gowns in Miss America History"	"See the evolution from the 1920s through 2019."
"1"	"Trump records 'strongly corroborate' sex assault claims, accuser says"	"President Trump's own records "strongly corroborate" the sexual assault accusations of Summer Zervos and belie the president's denials, a new court filing states"
"0"	"THEN AND NOW: What all your favorite '90s stars are doing today"	"These heartthrobs and fan favorites made the 1990s one of the best decades of the century. Here's what they're up to now."
"1"	"Trump attacks on Vindman trigger backlash"	"President Trump's aggressive attacks on a White House official who testified about his concerns over Trump's communications with Ukraine in the impeachment inquiry set off a furious backlash on Tuesday, with former Vice President Joe Biden calling the president's remarks "despicable."Trump described Lt. Col. Alexander Vindman, an active-duty member of the military who attended his deposition in uniform, as a "Never Trumper," while some allies..."
"0"	"How to Get Rid of Skin Tags, According to a Dermatologist"	"They seem harmless, but there's a very good reason you shouldn't ignore them. The post How to Get Rid of Skin Tags, According to a Dermatologist appeared first on Reader's Digest."
"0"	"DHS Sued for Answers About Its Use of DNA Testing at the Border"	""DHS has deployed this privacy-invasive technology without explaining how accurate the testing is, whether families can challenge the results, or how the program may be expanded in the future," said EFF Staff Attorney Saira Hussain."
"0"	"Stars   They're Just Like Us!"	"Stars   They're Just Like Us!"
"1"	"Bob Kingsley, Country Radio Legend, Dead at 80"	"Country radio legend Bob Kingley, the longtime host of the nationally syndicated program Bob Kingsley's Country Top 40, died early Thursday in Weatherford, Texas, following a lengthy battle with bladder cancer. He was 80 years old. A member of the Country Radio Broadcasters Hall of Fame, inducted in 1998, he later became only the format's fifth representative in the National Radio Hall of Fame in 2016. Kingsley was 18 and serving in the Air..."
"1"	"Pete Rose: Ban for betting on Cincinnati Reds 'cost me $100 million'"	"Pete Rose says, "I know I have no chance to go into the Hall of Fame until I die. And that's fine. Because I'm the one that made the mistake.""
"0"	"Celebrity PDA of 2019"	"See the stars kissing and hugging on the red carpet and out and about!"
"1"	"Feds take down the world's 'largest dark web child porn marketplace'"	"Prosecutors say the vast on-line store was run by Jong Woo Son, currently serving a prison sentence in South Korea on charges related to child pornography."
"1"	"Police find 26 children behind false wall at Colorado day care"	"The state of Colorado has suspended the license for Play Mountain Place daycare in Colorado Springs after they uncovered 26 children behind a false wall in the owner's basement, all under the age of three-years-old."
"0"	"No. 12 Seton Hall placed on 3 years' probation by NCAA"	"The NCAA has placed the men's basketball program at Seton Hall on probation for three years."
"1"	"Ex-NFL player Winslow Jr takes plea deal before rape retrial"	"VISTA, Calif. (AP)   Former NFL player Kellen Winslow Jr. pleaded guilty Monday to raping an unconscious teen in 2003 and to sexual battery involving a 54-year-old hitchhiker in a deal that spared him the possibility of life in prison. Winslow initially hesitated and seemed to agonize over his decision. "I'm sorry. I'm just not thinking very clearly," Winslow told the judge at one point. He asked the judge for more time before he finally entered..."
"0"	"Stephanie Parze's Car Is at Home. So Is Her Phone. But She's Missing."	"Her car was in the driveway. Her phone was on the couch. Her dog was running around. Everything about Stephanie Parze's home in New Jersey, her father says, seemed undisturbed   except that she was not there. The last time her mother saw Ms. Parze, they had kissed goodbye after a night out with friends and family, according to a report."
"1"	"Josh Hamilton arrested on felony charge of injury to a child"	"Former Rangers and Angels outfielder Josh Hamilton was arrested on Wednesday on a third-degree felony charge of injury to a child."
"0"	"Man suspected of fatal shooting said he was man from 'Joker'"	"Nevada authorities have said a man suspected of a fatal shooting last month was dressed as the Joker from the recently released movie of the same name and identified himself as the main character Arthur Fleck."
"1"	"Ben Affleck Has Slashed the Price on His 87-Acre Private Georgia Island Compound to $7.6M"	"Ben Affleck Selling His 87-Acre Georgia Estate for $8.9 Million"
"0"	"Envoy Was 'Obstacle' to Trump, Schiff Says: Impeachment Update"	"The House Intelligence Committee held its second public hearing on Friday to hear testimony by former U.S. Ambassador to Ukraine Marie Yovanovitch, who was removed from that post in May by President Donald Trump."
"0"	"Iran moves on ultra-cheap petrol, starts rationing"	"Iran imposed petrol rationing and raised pump prices by at least 50 percent Friday, saying the move aims to help the needy with cash handouts and is not due to a budget deficit. - Divisive measure - Rouhani had tried hike fuel prices in the budget last December but was blocked by parliament in the wake of protests that rocked Iran for days."
"0"	"Ford v Ferrari: the real story"	"The film about the epic Le Mans rivalry promises to be a must for car fans - and this is the real story behind it"
"0"	"Pittsburgh Steelers quarterback Mason Rudolph on 'TNF' incident: 'I thought it was pretty cowardly'"	"Pittsburgh Steelers quarterback Mason Rudolph tell us what he thinks about the "TNF" incident."
"0"	"I've been writing about tiny homes for a year and finally spent 2 nights in a 300-foot home to see what it's all about   here's how it went"	"I stayed in a tiny house for three days to see what the fuss was all about, and I was surprised by what I saw."
"1"	"Miller Lite offers free beer for unfollowing them, Natural Light joins in"	"This might be the easiest way to score a few free beers."
"1"	"Family of toddler who fell from cruise ship 'utterly crushed' after grandfather charged"	"The charge of negligent homicide was "like pouring salt on an open wound" for the girl's parents, the family's lawyer told NBC News."
"1"	"Panera Bread worker fired for exposing chain's frozen mac and cheese"	"Restaurant chain on the defensive after viral video depiction of its food preparation conflicts with brand's image"
"1"	"The Water on These Airlines Is so Bad You Shouldn't Even Wash Your Hands With It, Study Finds"	"Some airline water may actually make you sick."
"0"	"22 Smart Tax Moves to Make Before the End of the Year"	"Have you done your charitable giving for the year? Paid off medical bills? Those are just two smart tax moves you should make to lock in savings when the taxman comes to call in April. But you'll have to hurry if you want to make these last-minute plays work. Deadline is Dec. 31, and the clock is running."
"1"	"Trump's 'bombshell' offer to family of British teen killed in car crash: Diplomat's wife is in next room"	""The bombshell was dropped not soon after we walked in the room: Anne Sacoolas was in the building and was willing to meet with us," Dunn's mother said."
"1"	"ISIS names successor to slain leader al-Baghdadi"	"The militant group named Abu Ibrahim Hashimi al-Quraishi as the new leader in a message posted by its official media wing."
"0"	"Attorney: Garrett's actions against QB to be 'reviewed thoroughly'"	"Legal action could be taken against Garrett by Rudolph and his representatives"
"0"	"Surviving Santa Clarita school shooting victims on road to recovery: Latest"	"What should have been a normal Thursday spiraled into a nightmare for students and teachers at Saugus High School in Santa Clarita, California."
"1"	"One family built Forever 21 and fueled its collapse"	"When Forever 21 filed for bankruptcy last month, the fast fashion chain described its history in documents that read, at times, like a pitch for a memoir or a Netflix special. Photos of the company's husband and wife founders, Do Won and Jin Sook Chang, and their two daughters appeared under headings like "Forever Striving: A Story of Grit, Determination, and Passion." The filing emphasized the improbable success of the Changs, who immigrated to..."
"1"	"Drawn by the Salary, Women Flock to Trucking"	"Truck drivers typically are paid by the mile, regardless of gender. But safety issues remain."
"1"	"So you make $100,000? It still might not be enough to buy a home"	"A record number of six-figure-income families rent, as student debt and meager savings cloud their financial future. Because buying a house was historically a pathway to savings, this phenomenon could exacerbate the nation's wealth gap."
"1"	"Warren faces first sustained attack in debate that begins with unified condemnation of Trump"	"Sen. Elizabeth Warren came under sustained attack for the first time."
"0"	"Greek donkeys are still being abused as 'tourist taxis,' PETA claims"	"The animal rights group claims that legislation recently passed to protect the animals is not being enforced."
"0"	"The Coolest Way to See NYC Is in a Vintage Car From the Roaring '20s on This Midtown Tour"	"A new tour company called Nowaday, in New York City, will take you around in a restored, vintage car."
"1"	"John Legend clarifies his recent Kanye West comments, plus more news"	"John Legend explains what he told Vanity Fair about Kanye West, plus more celebrity news for Oct. 31, 2019."
"0"	"11 Regional Thanksgiving Recipes That Food Bloggers Swear By"	"Turkey may be the quintessential Thanksgiving dish, but it's not the only attraction feasters look forward to on this food coma-inducing holiday. Families nationwide anticipate the annual spread of grandma's best stuffing or dad's secret sweet potato recipe. What many Americans don't realize, though, is these staples can vary drastically by location. In some regions, families pack extra cream in their potatoes. In others, Thanksgiving sides come..."
"0"	"Here's how much and who you should be tipping at American hotels"	"To tip or not to tip: That is the question. Well, one of them. Here's everything you should know about hotel tipping in the U.S."
"1"	"LA firefighter banked $360,010 in overtime pay in one year, city audit finds"	"Eighteen employees of the Los Angeles Fire Department earned more than $200,000 in overtime pay last fiscal year, with one firefighter making $360,010 in overtime alone, according to an audit released Wednesday by City Controller Ron Galperin."
"1"	"The best truck stop eats in every state"	"Next time you're cruising down the interstate and it's time to refuel your tank, skip the chains as there are some real unexpected food treasures along the road. Here are the best truck stop roadside eats in every US state."
"1"	"Hundreds of thousands of people in California are downriver of a dam that 'could fail'"	"Hundreds of thousands of people live downriver from a dam in California that recently had its risk characterization changed "from low to high urgency of action" by the US Army Corps of Engineers."
"1"	"The 10 best NFL trade deadline deals of all-time"	"The NFL trade deadline has become a thing again. For about a quarter-century, it really wasn't. And while we're still not seeing deadline blockbusters like we did in the late-1980s, the deadline has been a lot busier in recent years than it was for the first decade-plus of the 21st century. Ahead of this year's Read more... The post The 10 best NFL trade deadline deals of all-time appeared first on The Comeback."
"0"	"LeBron James: 'Everyone had doubt' whether an NBA team would sign Carmelo Anthony"	"LeBron James had doubts Carmelo Anthony would get another chance to play in the NBA, had hoped Los Angeles Lakers would sign him last season."
"1"	"The toxic bubble of technical debt threatening America"	"Climate change will soon expose a crippling problem embedded in the nation's infrastructure. In fire-ravaged California, it already has."
"0"	"Model, 23, Didn't Know She Was Pregnant Until She Gave Birth to a Full-Term Baby in Her Bathroom"	"An Australian model recently had a life-changing surprise when she gave birth to a baby in her bathroom, despite not knowing that she had been carrying her daughter for nine months."
"1"	"Georgia tests new voting system before ambitious 2020 switch"	"DALLAS, Ga. (AP)   Voters and county election supervisors testing Georgia's new election machines gave favorable reviews Tuesday, despite a few glitches, as the state rushes to meet a court-ordered deadline to retire its outdated, paperless system before any votes are cast in 2020. State election officials piloted the $106 million system that combines touchscreens with paper ballots in six mostly rural counties holding elections for mayors, city..."
"1"	"Couple Cancels Wedding, Keeps $30K as "Donation" for Honeymoon Instead"	"In a viral Facebook post, a couple announces they're canceling their wedding, but keeping the $30,000 in gifts for a honeymoon instead."
"0"	"The Most Popular Potluck Dessert from Every Decade"	"Not surprisingly, many of these desserts are still found at potlucks today! The post The Most Popular Potluck Dessert from Every Decade appeared first on Taste of Home."
"1"	"'The Office' star Jenna Fischer responds to Chrissy Teigen's theory that Jim and Pam are divorced"	"Jenna, who played Pam opposite John Krasinski's Jim on the hit NBC sitcom, thinks Chrissy got it wrong."
"1"	"Justin Bieber uses Instagram to sell his house, plus more proof stars are nothing like us"	"Justin Bieber used Instagram to sell his house and even more reasons stars aren't like the rest of us in October 2019."
"0"	"Santa Clarita shooting: Unregistered guns found in home of Saugus suspect; motive a mystery"	"LOS ANGELES - The teenage shooter who opened fire at Saugus High School died Friday of a self-inflicted gunshot wound as investigators seized unregistered firearms from his home and tried to determine the origin of the handgun used in the deadly attack."
"1"	"Miranda Lambert Reveals the Real Reason Behind Her Secret Wedding: 'It's Not for Everybody Else'"	"Miranda Lambert Reveals Why She Secretly Married Brendan McLoughlin"
"0"	"At NATO summit, Trump to stress US allies' defense spending"	"President Donald Trump will try to convince U.S. allies that they should increase defense spending when he attends a meeting of NATO leaders next month in London, the White House said Friday."
"0"	"Pair Of 'New' 1987 Buick Grand Nationals Pulled From Garage After 30 Years"	"This pair of Grand Nationals have only 1,400 miles combined!"
"1"	"Just four excellent hot sauces"	"Not all hot sauces are excellent, however, and our favorite stand-bys don't work for every type of dish."
"0"	"Divers salvage 100-year-old liquor from WWI shipwreck"	"A team of ocean explorers says it has retrieved cognac and liqueur from a ship that was bound for Russia when it was sunk by a German submarine in 1917."
"1"	"How a 1,000-strong security force is protecting Kate and William during historic tour"	"The visit to Pakistan by the Duke of Duchess of Cambridge has sparked a major security operation."
"0"	"50 Best Movie Sequels of All Time"	"A successful film franchise can ensure box office earnings like few other movie offerings can."
"1"	"Watch: 'The View' Versus Donald Trump Jr.: Loud, Low Blows, Politics, Scandals And Great TV"	"Updated throughout, videos added Whoopi Goldberg wouldn't say his name, Sunny Hostin said he was lying, Abby Huntsman accused him of using "dictator" tactics. And Donald Trump Jr. gave it back, accusing Joy Behar of once wearing blackface and resurrected Goldberg's defense of Roman Polanski as not committing "rape rape," all in a"
"0"	"Watch as a Mob of Birds Turn Chaos into Order to Freak Out Predators"	"New research shows jackdaw mobs quickly become organized to drive away predators from their nests. Researchers say the new insight on collective behavior could help design autonomous vehicles like fire-fighting and search-and-rescue drones."
"0"	"Golfer and girlfriend pull amazing trick shot"	"Press LaBrie from Montreux, Nevada, USA, is a long drive golf pro who has recently started working on trick shots. He asked his girlfriend Adrianna Moritz to help him pull a challenging trick shot, and it worked brilliantly!"
"1"	"Man who inherited 6 figures shares advice he'd give his younger self"	"Brandon Neth inherited around $123,000 from his late father and grandfather when he was 20. He spent most of it on cars, clothes, and restaurants."
"0"	"Why This Couple Is Getting a 'Sleep Divorce'"	"A New Jersey couple is getting an unusual "divorce." Liz and Rich Alterman have been happily married for almost 20 years. They have three children and are now on the brink of getting "sleep divorced.""
"0"	"U.S. 'flexible' on military exercises with South Korea as North demands cancellation"	"The United States will consider changing plans to conduct joint military exercises with South Korea if that helps support diplomatic efforts to restart a dialogue with North Korea, Defense Secretary Mark T. Esper said Friday."
"1"	"20 award-winning photos of dogs from 2019's Dog Photographer of the Year competition"	"The 2019 winners show man's best friend in all their loving, inquisitive, and adorable glory."
"1"	"Raiders tackle Trent Brown sued for domestic violence"	"The Raiders have yet to release a statement on the matter."
"1"	"Why I stopped shopping at Marshall's and Trader Joe's"	"They're money pits. There, I said it."
"1"	"Katy Perry sued for $150k by photo agency for 3-year-old pic"	"Katy Perry allegedly posted a paparazzi photo without paying the fee, a photo agency claims."
"1"	"Meteorologist calls out body-shamer: 'I will not be strapping myself into a girdle'"	"Tracy Hinson won't be giving up bread or pasta any time soon."
"0"	"Ford v Ferrari: the forgotten car at the heart of the Le Mans '66 clash"	"The Ferrari-beater you've probably never heard of"
"0"	"Christian Yelich slams Yu Darvish after pitcher discussed at-bat vs. slugger"	"A pro-Chicago Cubs site insinuated that Christian Yelich was looking to the Brewers' bullpen in one instance to get some sort of signal while facing Cubs pitcher Yu Darvish."
"0"	"Homeless woman living in SUV with dogs moves into apartment with community's help"	"Two friends in suburn Philadelphia reached out to residents via the Nextdoor app to get food and housing for a former pharmacist with health issues living in an SUV."
"1"	"Nationals win first World Series title, storming back on Astros in Game 7, 6-2"	"After losing all three games in Washington over the weekend, the underdog Nationals became the first team in major league history to win the World Series by claiming four games on the road. Once again, they came from behind to do it."
"0"	"Meghan Markle's Lawyers Debunk Multiple False Tabloid Stories in New Court Documents"	"False, divisive, and completely untrue."
"1"	"Trump ended DACA. This woman is suing to stop him."	"As the US Supreme Court prepares to decide the fate of DACA recipients, one plaintiff is hopeful   and nervous   for the future."
"1"	"Ken Block's Home Garage Is Surprisingly Tasteful But Still On-Brand"	""My toys, my space.""
"0"	"Meghan Markle and Hillary Clinton Secretly Spent the Afternoon Together at Frogmore Cottage"	"Meghan Markle Invites Hillary Clinton to Her Frogmore Cottage Home"
"0"	"California and nearly two dozen other states sue Trump administration for the right to set fuel-efficiency standards"	"California and nearly two dozen other states on Friday sued the Environmental Protection Agency, arguing that the Trump administration doesn't have the legal authority to strip the nation's most populous state of its longstanding authority to set strict fuel-efficiency standards on cars and trucks."
"1"	"Congress Considers Delaying Spending Talks Until After Impeachment"	"Democrats and Republicans in Congress are deliberating whether to push the deadline to fund the government into early February to avoid having a budget fight amid an impeachment inquiry into President Donald Trump that's set to stretch at least into December."
"1"	"Peter Luger's says its steaks are still 'the best you can eat' after zero-star review from the New York Times"	"Pete Wells wrote that his fries were "mealy and bland" and that the Caesar salad's croutons were "straight out of the bag.""
"1"	"I went to Peter Luger after it received zero stars from New York Times"	"The burger was so juicy I had to wipe my fingers after every bite. And everyone from regulars to tourists couldn't stop singing Peter Luger's praises."
"0"	"Mustang: all the wild and wonderful offshoots - US edition"	"As Ford prepares to unveil the Mustang Mach E, we take a look at all the spin-offs the original pony car has inspired over the decades"
"1"	"Opinion: One thing we know at midpoint of NFL season is that it's time for Baker Mayfield to grow up"	"The Browns have hit the NFL midseason mark at 2-5 with Baker Mayfield tied with Tampa Bay's Jameis Winston for a league-high 12 interceptions."
"0"	"Kate Middleton Shows Off Motherly Side as She Bonds with Families at Opening of Children's Hospice"	"Kate Middleton Celebrates Opening of Children's Hospice"
"0"	"Maze of tunnels reveals remains of ancient Jerusalem"	"Controversial excavations under the Holy City uncover layers of history and stoke long-standing tensions."
"0"	"50 Worst Movie Sequels of All Time"	"Movie sequels and prequels are becoming more common than ever."
"0"	"Bill Gates tops Jeff Bezos as world's richest person with Amazon slide"	"This time it's official."
"0"	"Archie's Photo Album: Prince Harry, Duchess Meghan's Royal Baby"	"So cute!"
"1"	"A day in the life of the top real-estate broker in Miami, who commutes by ferry to the richest ZIP code in the US and sold more than $189 million of luxury homes in 2018"	"Dora Puig sells multimillion-dollar condos on Fisher Island, the richest ZIP code in the US, where the average income is $2.2 million."
"1"	"Eddie Van Halen thinks he developed cancer from sucking on metal guitar picks; a doctor disagrees"	"The guitarist lost a third of his tongue due to mouth cancer in 2000, and is reportedly receiving treatment for cancerous cells in his throat."
"0"	"Texas parole board recommends delaying Rodney Reed execution"	"The Texas Board of Pardons and Paroles on Friday recommended delaying the execution of inmate Rodney Reed, whose conviction is being questioned by new evidence that his supporters say raises serious doubts about his guilt."
"0"	"Democrats vow court fight to block new N.C. congressional map"	"North Carolina Republicans approved a new congressional map Friday that would cost the party at least two House seats and potentially roil the state's delegation   but Democrats immediately objected, saying it's still a GOP gerrymander."
"1"	"Eight corporate jets: What is this, the '80s?"	"Activist investor D.E. Shaw puts Emerson Electric's crusty corporate habits on display. It's not a good look."
"0"	"Federal Prosecutors Probe Giuliani's Links to Ukrainian Energy Projects"	"Federal prosecutors in New York are investigating whether Rudy Giuliani stood to personally profit from a Ukrainian natural-gas business pushed by two associates who also aided his efforts there to launch investigations that could benefit President Trump, people familiar with the matter said."
"1"	"Son wears hot dog costume for school picture day after parents' dare"	"A fourth-grader dressed up as a hotdog after his parents dared him to and the picture of his student ID quickly made him an internet sensation."
"1"	"Walmart Is Starting Black Friday Early This Year With Deals On Instant Pots, Air Fryers, And More"	"Are you team Instant Pot yet?!"
"0"	"The Volkspod VW Beetle Minibikes Are Part Creepy, Part Adorable"	"The people's pods."
"1"	"Tour the abandoned Outlaw House with an FBI connection"	"The home of a billionaire business mogul and a rumored FBI agent, there's more to this abandoned house in Mobile, Alabama, than meets the eye. Captured by intrepid photographer Leland Kent of Abandoned Southeast, step inside and unravel this curious tale for yourself..."
