"0"	"Support for Trump's impeachment unchanged after hearings begin: Reuters/Ipsos poll"	"The televised impeachment hearings that began this week in the U.S. House of Representatives do not appear to have changed many minds about President Donald Trump, with public support for his impeachment about the same before and after the first U.S. diplomats testified, according to a Reuters/Ipsos poll."
"1"	"10 Unexpected Ways To Bond With A Cat"	"I was around five or six when I realized   the hard way   that cats and dogs are on different sides of the pet spectrum. While you could wrestle around with a dog, cats generally prefer their own space. Of course, that doesn't mean that cats are unfriendly or antisocial. Just like everyone, cats come with their own unique personalities."
"0"	""Cake Boss" made Carlo's Bakery famous, but the New Jersey bakery was a staple for Italian pastries 100 years before the show aired -- here's why"	"Buddy Valastro is known from the TLC show "Cake Boss," but his small-town bakery, Carlo's Bakery, has been a staple in Hoboken, New Jersey, since 1910. The bakery is loved for more than its extraordinary cakes, wowing customers with its signature Italian pastries. Insider's Taryn Varricchio met up with the Cake Boss to find out what makes this historic bake shop iconic beyond its cakes."
"0"	"Will you get dementia? Many may not understand their risk"	"New research suggests many American adults inaccurately estimate their chances for developing dementia and do useless things to prevent it."
"1"	"17 photos that show the ugly truth of living in a tiny house"	"From cramped lofts that are hard to access to small appliances, this is what it's really like to live in a tiny house."
"0"	"Five Great Holiday Cruises Worth Taking"	"These trips will make it the merriest of seasons."
"1"	"Giancarlo Stanton wants Yankees to sign both Gerrit Cole, Stephen Strasburg"	"Arguing that a team "can never have too many" top-tier talents on the roster, Giancarlo Stanton recently suggested that the New York Yankees should not limit themselves to the pursuit of one free-agent ace and instead go after both Gerrit Cole and Stephen Strasburg."
"1"	"17 hours a day, 7 days a week: Cruise-ship workers describe the grueling conditions they face on the job"	"Business Insider spoke with 45 current and former employees of Carnival, Royal Caribbean, Norwegian, and other cruise lines."
"1"	"11 popular American-Chinese foods that you won't actually find in China"	"Here are some of the most popular American-Chinese dishes that aren't actually from China nor do they have authentic Chinese origins."
"1"	"The most powerful LGBTQ movies"	"From Boys Don't Cry and Milk to Love, Simon and The Kids Are All Right, these are the most moving films about members of the LGBTQ community."
"1"	"Hard Rock Hotel New Orleans collapse: Former site engineer weighs in"	"Structural engineer Walter Zehner worked on the project before it became a planned Hard Rock Hotel. A look at what he thinks could have happened:"
"1"	"14 celebrities who got rejected by 'Saturday Night Live' and went on to become famous in their own right"	"Even though these stars auditioned for the popular NBC series and were turned down, they've had huge careers in the comedy world."
"1"	"I Didn't Grow Up Eating Chips I Ate Crab Stick Crackers"	"In the great span of my snack-filled life, there's no other junk food that I've indulged in more than crab stick crackers. Yes, crab sticks. You know, those finger-sized logs of crab meat with an artificially colored coat of lipstick-red on top, and a glistening underbelly of white. Despite their name, there's no real crab in crab sticks; they're made from surimi a fish paste pounded out of white fish, bycatch, and other forms of sea life...."
"0"	"Missing woman's husband arrested after carpet found soaked with blood, bleach"	"Beau Rothwell has been charged with evidence tampering. Police said he was seen on video buying bleach and gloves the day before Jennifer Rothwell was reported missing."
