"0"	"14-year-old baker gives cupcakes to homeless"	"Michael Platt has been on Food Network, did a TED talk, and is constantly giving back to those in need with his one-for-one business"
"0"	"Wendy's Is Turning 50 Years Old, And Is Gifting Us With Free Food Through 2020"	"How thoughtful."
"0"	"Prince Andrew says he let the Royal Family down in his relationship with Jeffrey Epstein"	"The second son of Queen Elizabeth II spoke to the BBC in an interview recorded Thursday at Buckingham Palace."
"1"	"Bill O'Reilly said he doubts mom works 4 jobs. She says he 'doesn't have a clue'"	"Gina Giambone says she actually juggles 5 part-time gigs to earn enough for her and her adult special-needs daughter"
"1"	"San Diego Police Investigating Attack on Teen Syrian Refugee as Hate Crime"	"The suspect, who police described as a Hispanic male in his 20's, then fled the scene"
"1"	"Tom Draper, Black Music Industry Pioneer, Dies at 79"	"Tom Draper, whose tenures at RCA and Warner Bros. Records helped lay the foundation for today's black music industry, died Oct. 25 in Atlanta. He was 79."
"0"	"'Charlie's Angels' stars: Where are they now?"	"We're checking up on former Charlie's Angels actresses to find out what they're up to today."
"1"	"Johnny Depp Settles Legal Battle With Former Law Firm Bloom Hergott for 8 Figure Sum"	"Johnny Depp has settled a legal battle with his former lawyer Jake Bloom of Bloom Hergott on Wednesday, according to an attorney from Bloom's firm. An individual familiar with the matter tells TheWrap the settlement was for an amount just over eight figures. Depp sued Bloom in Oct. 2017 and the company costing the actor "tens of millions of dollars" through improperly collecting upwards of $30 million in legal fees during the course of their..."
"0"	"Man sets Guinness World Record for highest standing jump"	"Christopher Spell officially broke the Guinness World Record for the highest standing jump / highest box jump on 7/29/19. Incredible! Credit to 'againstoddsathletics'."
"1"	"​20 Funny Things People in the 1980s Were Totally Guilty of Doing"	"We were far from saints in the 80s. Here are 25 things that were perfectly acceptable in an age before social media and online buffoonery."
"1"	"Scarlett Johansson Says She Was 'Surprised' by Colin Jost's Proposal: 'He Killed It'"	"Scarlett Johansson Was 'Surprised' by Colin Jost's Proposal"
"1"	"20 dividend stocks for all baby boomers to retire on"	"Here are 20 companies that should offer investors who are retired or near retirement some added income to help make their golden years safe and sound."
"0"	"Boy uses his Make-A-Wish to get special space that other schoolchildren can use"	"Boy uses his Make-A-Wish to get special space that other schoolchildren can use"
"0"	"New Trump rule to make more health care rates public"	"The hospital industry says it will sue to stop it from taking effect."
"0"	"Why I'm Done Celebrating The Accomplishments Of Couples"	""What is real? How do you define real?" - Morpheus, The Matrix, 1999 I've had the "summer of six weddings." The "spring of seven baby showers." The "year with nine bachelorette weekends"   not parties, but whole weekends for some reason. And while I could tell tales of the financial strain imposed when a single person celebrates other people for their entire adulthood   and I do serve that tea boiling   instead I want to talk about feelings...."
"1"	"Orange vs. White Cheddar Cheese: What's The Difference, Anyway?"	"Americans love cheese, and we're eating more of it than ever: about 37 pounds per year per capita, in fact, more than double what we ate four decades ago, according to the U.S. Department of Agriculture."
"0"	"'A fighter': President Jimmy Carter's neighbors know they'll say goodbye one day, but not yet"	"The folks in President Jimmy Carter's hometown of Plains, Georgia, say he will bounce back yet again from the latest medical concern."
"0"	"Morris Commercial Introduces Sentimental Electric Morris JE Van"	"It's a premium all-electric van with retro styling and 200 miles (320 km) of range, capable of taking 1,000 kg of payload."
"1"	"Charge dropped against teacher seen on video punching student who called him racial slur"	"The decision to dismiss the case was based on a number of factors, including "the facts and circumstances surrounding the incident.""
"0"	"Prince Harry and Prince William's Rift Is "One of the Main Reasons" the Sussexes Are Skipping Royal Christmas"	"Santa is shook."
"1"	"A secretive family landing a $4 billion haul has everyone guessing"	"One of the world's richest and most discreet families must decide what to do with a massive pile of cash."
"1"	"Eric Tse, 24, just became a billionaire overnight"	"A 24-year-old business school graduate has just become an overnight billionaire."
"1"	"Billionaire's ugly divorce ignites battle over spectacular art trove"	"There is the $72 million apartment, so large it runs the full length of one side of the Plaza Hotel, with windows overlooking Central Park."
"1"	"Trump says he thought family of UK teen wanted meeting with diplomat's wife"	""I thought they were -- based on what I thought -- that they wanted to meet," Trump told reporters of Harry Dunn's parents declining to meet with Anne Sacoolas."
"1"	"Off the rails: MTA chairman accuses transit union head of 'drug scam' amid contract talks"	"Contract negotiations between the MTA and the city's largest transit workers union have turned into a drug war. Metropolitan Transportation Authority chairman Pat Foye sent an email to Transport Workers Union Local 100 president Tony Utano at 3:15 p.m. Sunday that accused the union boss of running a "Utano Specialty Drug Scam.""
"1"	"New Jersey Couple Sues Taco Bell Over Chalupa Prices"	"When is a $5 deal not a $5 deal?"
"1"	"We compared Wegmans and Trader Joe's private labels   and the winner was clear"	"We tasted eight products from Wegmans and Trader Joe's to see which store had the better in-house brand. Wegmans was the clear winner."
"0"	"Doctors warn addiction of 'human Ken doll' has gotten dangerous"	"Rodrigo Alves has spent more than $750,000 on 72 cosmetic surgeries."
"1"	"Guess What New Car James May Just Bought"	"Nope, it's not a Ferrari."
"0"	"Audience applauds, GOP microphone turned off at end of Yovanovitch hearing"	"Audience members at Friday's impeachment inquiry broke into applause after former U.S. Ambassador to Ukraine Marie Yovanovitch concluded her testimony.Even as Rep. Mike Conaway (R-Texas) repeatedly asked to be recognized, audience members applauded Yovanovitch and Intelligence Committee Chairman Adam Schiff (D-Calif.) gaveled the second public impeachment hearing closed.The crowd in the public seating - as well as some Democrats - stood up and..."
"0"	"Whoopi Goldberg Doesn't Stress About The View's Tense Debates"	"Whoopi Goldberg discusses the contentious debates on The View and playing a 108-year-old in the adaptation of Stephen King's The Stand."
"0"	"First Drive! Steeda transforms the Bullitt from leading man to action hero with the Steve McQueen Edition"	"Driving the first supercharged Steve McQueen Edition Bullitt reveals an modern Mustang action hero"
"0"	"Ex-Envoy to Ukraine 'Devastated' as Trump Vilified Her"	"The former United States ambassador to Ukraine told the House impeachment inquiry on Friday that she felt threatened by President Trump and "shocked, appalled, devastated" that he vilified her in a call with another foreign leader, as Mr. Trump attacked her in real time on Twitter, drawing a stern warning about witness intimidation from Democrats."
"1"	"America's middle class is addicted to a new kind of credit"	"The payday-loan business was in decline. Regulators were circling, storefronts were vanishing and investors were abandoning the industry's biggest companies en masse."
"1"	"It took me 96 hours to ride an Amtrak train from coast to coast. I'd do it again in a heartbeat."	"Four days aboard a cross-country Amtrak train was so much more relaxing than flying. If I had the time, I'd do it on every trip."
"0"	"Bill Russell finally accepts Basketball Hall of Fame ring"	"SPRINGFIELD, Mass. (AP)   Bill Russell finally accepted his Basketball Hall of Fame ring. The 11-time NBA champion, five-time MVP, Olympic gold medalist and two-time NCAA champ said on Twitter on Friday that he was presented with his Hall of Fame ring in a private ceremony. The 85-year-old Boston Celtics great didn't attend the induction ceremony in 1975. He said he didn't deserve to be the first black player inducted, tweeting: "I felt others...""
"0"	"You can start cooking your pasta in cold water   Alton Brown has been doing it for years"	"I put the Food Network star's unconventional trick for cooking pasta to the test and found that it actually works."
"1"	"WeWork set to sack 2,000 staff as anger toward founder Adam Neumann grows"	"Troubled office rental company to lay off 13% of its workforce to try to staunch massive losses   and few believe the cuts will stop there"
"1"	"Louisiana woman arrested for selling students doctor's notes to get out of class"	"An employee at a Louisiana medical clinic accused of selling students fake doctor's notes has been arrested. Belinda Gail Fondren remained behind bars Friday at the Vernon Parish Sheriff's Office Jail on a charge of filing or maintaining false public records."
"0"	"I'm A Queer Woman Dating A Trans Man   & No One Knows"	"I'm a queer woman partnered with a transgender man, but everyone assumes we're a heterosexual couple. On the surface, we're the quintessential Brooklyn duo: We have tasteful tattoos and piercings, we shop at food co-ops, we attend spin class together, and we're creative yet gainfully employed. But while this relationship afforded me the privilege of banal nonconformity, I lost a piece of myself when I got together with my once-gym buddy, James...."
"1"	"U.S. Marshals Auctioning Off 149 Vehicles From DC Solar Scam"	"The largest single car collection that the USMS has ever sold!"
"0"	"Fashion hits and misses from the 2019 Country Music Association Awards"	"From Nicole Kidman to Pink, see the best and worst dressed stars at the 2019 Country Music Association Awards."
"1"	"Ben Affleck has a new girlfriend after using the Raya dating app, plus more celeb love life news for late October 2019"	"Meg Ryan and John Mellencamp call it quits, Halsey and Evan Peters get serious, James McAvoy weds, Meghan King Edmonds accuses hubby of cheating and more."
"1"	"Yahoo data breach $117.5 million settlement: Get cash or monitoring"	"Yahoo users can now file a claim for a piece of the $117.5 million class action settlement related to data breaches between 2012 and 2016."
"0"	"California man convicted of torture-murder dies on death row"	"A 49-year-old inmate convicted of torturing and burning his victim alive has died on California's death row. Prison officials say Spencer Brasure was found unresponsive alone in his San Quentin State Prison cell shortly after midnight Thursday. Officials are awaiting an autopsy to determine the cause of death but say it doesn't appear to be foul play."
"1"	"Iowa's love affair with gas station pizza, explained"	"There are fancier pizzerias around, places with gratuitous amenities like tables and chairs and utensils that aren't wrapped in plastic. But ask any Iowan and they'll tell you: The best pizza in the state comes from gas stations."
"1"	"Awesome destinations where your dollar goes further"	"In the last 12 months, the world's economies have had a shake up. The tables have turned for currencies that were once strong against the dollar, and so adventurous Americans today can travel further for less. Got a bucket list trip in mind? Or perhaps you're just in the mood for something a bit different. We've sought out some of the incredible destinations where, as of September 2019, the dollar has grown in strength. Here are some great value destinations for American travellers this year."
"1"	"Help! My Daughter Stole My Granddaughter's College Fund."	"She refuses to say where the money went."
"1"	"'Wheel Of Fortune' Guest Delivers Hilarious, Off The Rails Introduction"	"We'd like to solve the puzzle, Pat: Blair Davis' loveless marriage? On Monday, "Wheel of Fortune" welcomed as a new contestant trucking business owner Blair Davis, who offered a biting introduction for himself. When host Pat Sajak asked the man from Cardiff, California, about his family, Davis plunged into one of the darkest personal summaries the show has likely ever heard. "I've been trapped in a loveless marriage for the last 12 years to an...""
"0"	"3 Indiana judges suspended after a night of drinking turned into a White Castle brawl"	"Hours before they were to attend an educational conference in Indianapolis, three judges went out drinking for a few hours and decided to walk to a strip joint."
"1"	"Former NFL lineman Justin Bannan arrested for attempted murder"	"Former NFL defensive lineman Justin Bannan is sitting in a Colorado jail, on charges of suspicion of attempted first-degree murder."
"1"	"The 2020 Ram 1500 EcoDiesel Is the McMansion of Pickup Trucks"	"Big, bold, and a little show-offy. And with the 3.0-liter diesel V-6, capable of 25 mpg."
"0"	"Video shows miraculous escape for train passengers"	"Hundreds of Indian passengers had a narrow escape after two trains collided in Andhra Pradesh state."
"1"	"All The Ways Life As A Teen Is Different Than It Was 50 Years Ago"	"The times they have a-changed."
"0"	"Ohio GOP lawmakers want to ban all abortions, charge doctors who perform them with murder"	"Republicans in the Ohio House of Representatives have signed onto a bill to ban all abortions in Ohio and charge doctors who perform them with murder."
"1"	"Lampert helps bankroll Sears as woes persist after bankruptcy"	"Exclusive: Lampert helps bankroll Sears as woes persist after bankruptcy - sources"
"1"	"Edward Snowden says he found no evidence of aliens in government databases"	"Whistleblower Edward Snowden said that he searched databases before he left his job as a contractor for the National Security Agency (NSA) and found no evidence that the government was hiding the existence of aliens."I know you want there to be aliens," Snowden told Joe Rogan during an interview for the "Joe Rogan Experience" podcast released Wednesday. "If we are hiding them - I had ridiculous access to the networks of the NSA, CIA, military,...""
"0"	"I Overate at Dinner Until I Started Doing This 1 Simple Thing on Sundays (It Takes 10 Minutes!)"	"Another reason Sunday is the best day to meal prep."
"1"	"Nick Lachey Bashes the Most 'Overrated' Boy Band, Says Vanessa Lachey Was an '*NSYNC Groupie'"	"The former 98 Degrees member also opened up about his one date with Kim Kardashian!"
"1"	"This Bride's BFFs Surprised Her With A Gigantic Chicken Nugget Bouquet In The Middle Of Her Wedding"	"This might be my dream wedding."
"0"	"The world's most profitable company is about to go public"	"The oil company that made Saudi Arabia rich is going public. Some say the timing couldn't be worse."
"0"	"The Unlikely Star of My Family's Thanksgiving Table"	"It's hard to remember life before broccoli cheese rice casserole. Or, B.B.C.R.C.E. (Before Broccoli Cheese Rice Casserole Era). What did the Kim clan have to look forward to every Thanksgiving before the cheesy family-favorite side dish entered our lives? Stuffing, maybe. Green bean casserole. Macaroni and cheese. Ham in cola, a quirky recipe from Nigella Lawson that she picked up from the American South. Certainly nothing from the Korean..."
"1"	"Vaping Illnesses Are Linked to Vitamin E Acetate, C.D.C. Says"	"A form of vitamin E has been identified as a "very strong culprit" in lung injuries related to vaping THC, health officials reported on Friday, a major advance in a frightening outbreak that has killed 40 people and sickened 2,051."
"0"	"Metal detectorists discover haul of gold coins worth at least 100k"	"This is the moment a metal detectorist looking for a friend's lost wedding ring discovered a haul of gold coins worth an estimated £100,000 and shouted - ''yee-ha - there's a f*cking fortune here!'. Paul Raynard, 44, screamed "'there's millions - this is the moment we dreamed of!" to best pal Michael Gwynne, 52, when he realised the scale of the find. Businessman Paul "broke down in tears" when he stumbled across his very own pot of gold - a cluster of 84 coins in a field near Ballycastle, Northern Ireland. Stunned Paul and Michael found the coins - dating back to the 1500s - whilst looking for the wedding ring a farmer friend had lost in his field."
"1"	"I tried most of Wegmans' fresh and made-to-order food options and some of it was better than a restaurant meal"	"I sampled pizza, a burger, salad, soup, and sushi from Wegmans' food court, and some of it was better than food I've eaten at restaurants."
"1"	"Capital One customers can't withdraw money after outage"	"Account holders at the bank said they can't use debit cards, access their accounts or pay bills"
"1"	"Inside Ken Fisher's private kingdom, where hardball culture reels in billions"	"The cold calls go out, hundreds a day, from a dank basement in the redwood hills south of San Francisco."
"1"	"15 Old-School Dishes Making a Comeback at Restaurants"	"You may never have tasted lobster thermidor, beef Wellington, oysters Rockefeller, or clams casino, but there's a reason your grandparents loved them for a special occasion. It's time to find out what you've been missing with these recipes and restaurants serving classic meals, appetizers, drinks, and desserts."
"1"	"Greatest eBay Listing Of 2019? Or In All Of Human History? You Decide!"	"This clever eBay ad made our day!"
"1"	"The Amazing All-You-Can-Eat Restaurant in Every State"	"If you feel the indulgence of an all-you-can-eat restaurant calling out to you, there's one within your home state to enjoy. Whether it's comfort food, seafood, an international favorite such as sushi or Indian, or an over-the-top Brazilian steakhouse, here are 50 buffets well worth stopping in for a visit."
"1"	"A white restaurant owner admitted to enslaving a black man. He got 10 years in prison."	"The restaurant owner burned the victim with tongs dipped in hot grease, punched him and assaulted him with pots and pans."
"1"	"Airport Worker Allegedly Tries to Sell Items Stolen from Passenger's Luggage on Facebook"	"An American Airlines passenger who thought her suitcase had been lost in transit, rediscovered her belongings in an unlikely place   for sale on Facebook Marketplace."
"0"	"MLB GM wants Jeff Luhnow 'banned for life' if he knew of Astros' sign-stealing"	"Another team executive said he wanted to see the league throw the book at the Astros."
"0"	"One New Thing to Check Out on Every Hawaiian Island"	"From new stargazing opportunities to exclusive hotel experiences, visitors will love the new things Hawaii offers."
"0"	"20 huge retailers that are no longer with us"	"The retail graveyard is expanding."
"0"	"Queen Elizabeth Just Rode Horseback at Age 93"	"The British monarch isn't letting a small thing like age keep her from living her life."
"1"	"Why Using Your Microwave's Popcorn Button Is a Bad Idea"	"Pressing the "popcorn" button couldn't be easier, but it almost definitely won't yield the best popcorn. Here's what you should do instead."
"0"	"How Google Interferes With Its Search Algorithms and Changes Your Results"	"Pressed by businesses, interest groups and governments, the internet giant uses blacklists, algorithm tweaks and an army of contractors to shape what you see."
"0"	"Sean "Diddy" Combs Pays Tribute to Kim Porter on 1-Year Anniversary of Her Death"	"Kim Porter unexpectedly died a year ago from lobar pneumonia."
"1"	"A heartbreaking photo of a dog riding a bus alone went viral, and now people want to adopt her"	"A kennel is seeking the dog's owner. If no one comes forward, she will be put up for adoption."
"1"	"I Was 24 & Had Just Scored My Dream Job In Fashion. Then An Accident In The Hamptons Changed Everything."	"One in four adults in the U.S. are living with a disability, but you wouldn't know it given the lack of representation in media, Hollywood, and the workforce. We're shedding light on the real stories   not the caricatures   of this dynamic and vibrant community of individuals. Read more stories from our Voices of Disability series. By the time I was 24, I was living a life that felt like a dream. I was pursuing a career in the fashion industry,..."
"0"	"Prague locals tire of tourists, 30 years after end of Communism"	"As Czechs prepare to mark 30 years since the Velvet Revolution ended Communism - ushering in a boom in tourism and considerable wealth along with it - not all local residents see the change as positive. Emily Spychal reports."
"1"	"I Was An NBA Wife. Here's How It Affected My Mental Health."	"I felt like I was a fraud, and being an NBA wife didn't help that. In fact, it nearly destroyed me."
"1"	"Atlantic City to transfer power amid corruption - yet again"	"For over a decade, things had been quiet in Atlantic City, the seaside gambling resort known as much for its colorful political corruption as for its slot machines and saltwater taffy."
"1"	"The NBA's rise in PED suspensions, explained"	"Three players have each been given 25 game suspensions this year."
"1"	"Stephen Strasburg goes from shutdown to World Series MVP"	"HOUSTON (AP)   The shutdown that shook baseball paid off for Stephen Strasburg and the Washington Nationals. It just took seven seasons. Strasburg was voted MVP of the World Series following the Nationals' 6-2 win over the Houston Astros in Game 7 on Wednesday night, the first title in the 51 seasons of the Washington/Montreal Expos franchise. Ending the most prolific of 10 big league seasons for the 31-year-old right-hander, Strasburg went 5-0..."
"0"	"The most talked about movie moments of the 2010s"	"Let's try to emphasize the positive, but there's one particular sequence that was so special in its awfulness, it had to go on this list. See if you can guess which one it is."
"1"	"How the Astros play Moneyball"	"At Rice University, Jimmy Disch, an associate professor of sport management, teaches a popular course called "Moneyball." The name, of course, is lifted from the book and movie about Billy Beane's use of statistical analysis applied to baseball. "Sabermetrics," as it's called, made the Oakland A's a competitive team in the late '90s, despite a shoestring budget. The Astros were early adopters in the sabermetrics revolution, and they continue to..."
"0"	"Watch These Two Love Birds Perform a Heart-Shaped Swan Dance"	"Were they already a couple or is this love at first sight? Buzz60's Tony Spitz has the details."
"1"	"One person wounded in shooting at Northern California high school, shooter still being sought"	"The shooting at Ridgway High School in Santa Rosa prompted lockdowns at nearby campuses."
"1"	"David Eason Calls Jenelle Evans 'Stupid' After Split"	"David Eason Calls Jenelle Evans 'Stupid' After Split"
"0"	"Nurses face an epidemic of workplace violence"	""I got punched in the face," said one emergency room nurse, while others worry for their safety"
"0"	"2019 Los Angeles Auto Show Preview"	"Get ready for the 2019 Los Angeles Auto Show"
"1"	"Lindsay Lohan's dad weighs in on her relationship with the Saudi crown prince"	"Michael Lohan denies that Lindsay is dating the controversial royal known as MBS but acknowledges that they're friends."
"1"	"6 Very Good Recipes That Prove an Air Fryer Belongs in Your Kitchen"	"I'm a gadget geek, so it's no surprise that I was fascinated by the air fryer when it first came on the scene. Especially since I'm also a busy cook; if a gadget doesn't make my life easier, then I've got no time for it. (Too few hours in the day to mess with one that messes with me!) I am all about ruthless efficiency, in other words. Mostly, I loved the concept of frying without oil. And so began a period of intensive experimentation. (Thereby..."
"0"	"Why did Santa Clarita shooting happen? Detectives search for motive"	"Investigators are still trying to determine why a 16-year-old Saugus High School student allegedly opened fire in a campus quad Thursday, killing two classmates and injuring three others before turning the weapon on himself."
"1"	"Chuck Schumer wants whistleblower protections for Ukraine expert Alexander Vindman after impeachment testimony"	"Senate Minority Leader Chuck Schumer called for a key witness in the impeachment inquiry into President Donald Trump to be given the same protections that are afforded to whistleblowers."
"0"	"US teacher killed in Dominican Republic had dream to retire there: Family"	"Patricia Anton, a teacher killed in the Dominican Republic, was remembered by her family."
"1"	"This Wedding Photo of a Canine Best Man Captures Just How Deep a Dog's Love Truly Is"	"When Mark Doublet made his dog, Marley, the best man at his wedding, he took his duties very seriously, and a photo of them together has gone viral."
"1"	"This 12-year-old food critic is harsh but he gives out thumbs up by the hundreds"	"This Instagram-famous food critic isn't kidding around when it comes to his viral reviews."
"0"	"Court puts hold on Rodney Reed's scheduled execution"	"With new, compelling evidence in Reed's case, the call to halt his Nov. 20 execution has been building in recent weeks."
"0"	"U.S. Troops Will Die If They Remain in Syria, Bashar Al-Assad Warns"	"President Donald Trump has said a force of Americans will remain in the east of the country to guard the oil fields there."
