"0"	"Daring rescue attempt when dog winds up on roof"	"viral"
"0"	"9 Amazing Transgender Women Who Changed History"	"lifestyledidyouknow"
"0"	"Please Don't Yell at Your Dog!"	"lifestylebuzz"
"0"	"29 Savory Tart and Quiche Recipes"	"recipes"
"0"	"Female Thunderbird pilot inspiring others to chase their dreams"	"newsgoodnews"
"0"	"Week in celebrity photos for Nov. 11-15, 2019"	"celebrity"
"0"	"What Menopause Does to Women's Brains"	"wellness"
"0"	"20 Style Lessons Chrissy Teigen Taught Us That We'll Remember Until the End of Time"	"lifestylecelebstyle"
"0"	"A 16-second spasm of violence leaves 2 dead at Saugus High School"	"newsus"
"0"	"Experts Explain Why You Might Want to Stop Sleeping on Your Stomach and How to Do It"	"wellness"
"0"	"Russian Law Sets To Improve Animal Welfare By Shutting Down Petting Zoos"	"animals"
"1"	"Tyler Cameron Is Voting for Hannah Brown on 'DWTS'"	"tv-celebrity"
"1"	"'A very intelligent animal': Meet the pig who escaped hog farm before devastating fire killed thousands"	"newsus"
"0"	"'After I Could Only Fit Into Extended-Size Wedding Gowns, I Started Keto And Lost Over 100 Lbs. In 16 Months'"	"voices"
"0"	"Report: Myles Garrett facing lengthy suspension, could be five games"	"football_nfl"
"0"	"Pittsburgh Steelers quarterback Mason Rudolph on 'TNF' incident: 'I thought it was pretty cowardly'"	"football_nfl_videos"
"1"	"Diane Kruger Calls Baby Girl Her 'Everything' in Rare Mother-Daughter Pic"	"movies-celebrity"
"0"	"What Not to Miss on the Harry Potter Studio Tour"	"traveltips"
"1"	"Biogen to submit Alzheimer's drug to FDA for approval"	"health-news"
"1"	"Katie Hill releases video on resignation from Congress: 'I never thought my imperfections would be weaponized and used to try to destroy me'"	"newspolitics"
"1"	"Baby boy beats the odds by waking from 5-day coma and smiling at his dad"	"lifestylefamily"
"0"	"Archie's Photo Album: Prince Harry, Duchess Meghan's Royal Baby"	"lifestyleroyals"
"0"	"Anne Barrell Shows You the Correct Way to Carve a Turkey"	"videos"
