"0"	"I'm Child-Free and Couldn't Be Happier About It. What's So Bad About That?"	"voices"
"1"	"Florida woman allegedly flees 2 car crashes, kills driver in 3rd crash"	"newscrime"
"0"	"Cold weather: 70% of the country will experience freezing temperatures this week"	"weathertopstories"
"0"	"Here's how social media tricks you into overspending"	"finance-savemoney"
"0"	"Best Photos of the World Series"	"baseball_mlb"
"0"	"I Donated Blood for the First Time at 27, and It Ended in Signs of Cardiac Arrest"	"voices"
"0"	"China's Commerce Ministry says trade war should be ended by removing tariffs"	"markets"
"0"	"Hey, Millennials, look out below! Gen Z may already be catching up in the salary race"	"finance-career"
"1"	"Crowd Throws Thousands of Rolls of Toilet Paper Onto Basketball Court for Technical Foul"	"basketball_nba_videos"
"0"	"A Man and His Shelby G.T. 350 51 Years On"	"autosclassics"
"0"	"Six pretenders entering the 2019 NFL home stretch"	"football_nfl"
"1"	"Elijah Cummings to be remembered by Obama, Clintons at funeral"	"newspolitics"
"1"	"Frustrated Antonio Brown has active morning on Twitter"	"football_nfl"
"1"	"Plainville Mother Found Stabbed To Death In Home, Son Charged In Murder"	"newscrime"
"1"	"ALCS Game 4 postponed for rain, Yanks-Astros resume Thursday"	"baseball_mlb"
"1"	"Yanks' Hicks gets 1st start since Aug. 3 in Game 3 of ALCS"	"baseball_mlb"
"0"	"Trump juggles statecraft and impeachment on a historic day"	"newspolitics"
"1"	"Report: Ezekiel Elliott's dad investigated after police shoot wild cat near his home"	"football_nfl"
"0"	"How to Turn Getting Kicked Off an Overbooked Flight Into a Payday"	"video"
"0"	"'Lots of Tears!' Teresa Giudice Details Reuniting With Husband Joe in Italy"	"tv-celebrity"
"0"	"This was uglier than a brawl. And Myles Garrett deserves suspension for rest of year after helmet attack."	"football_nfl"
"1"	"Mom warned officials son was taking gun to school. Now she faces charges."	"newsus"
"0"	"Bands' final albums before they broke up"	"music-gallery"
"0"	"Russell Wilson has MVP magic as Seahawks beat 49ers in OT classic"	"football_nfl"
"1"	"17 Arrested In Large Washington Drug Trafficking Bust"	"newscrime"
"0"	"The most famous celebrity kids born this decade"	"celebrity"
"1"	"What to care/not care about from Week 10: Cowboys' crucial error wastes Dak's brilliance"	"football_nfl"
"1"	"Jimmy Carter hospitalized after fall at Georgia home"	"newsus"
"0"	"Russell Wilson vs. 49ers' No. 1 defense: Monday night's prime-time matchup"	"football_nfl"
"1"	"Opioids in Baseball: "More people are going to die if this doesn't get fixed""	"baseball_mlb"
"0"	"2 dead, 3 injured in a school shooting in Russia"	"newsworld"
"0"	"Surviving Santa Clarita school shooting victims on road to recovery: Latest"	"newsus"
"1"	"37 Years After His Wife Is Found Dead with an Ax in Her Skull, Husband Is Arrested"	"newscrime"
"1"	"Best country music albums of all time"	"cma-awards"
"1"	"Charles Rogers, former Michigan State football, Detroit Lions star, dead at 38"	"football_nfl"
"0"	"Unidentified remains found in woods during search for missing 5-year-old"	"newscrime"
"0"	"Stocks close higher on optimism over China trade deal"	"markets"
"1"	"Three school workers charged in death of special needs student"	"newscrime"
"0"	"Massachusetts fire lieutenant dies battling house fire"	"newsus"
"0"	"The Hottest Tech Gifts This Holiday Season"	"shop-holidays"
"1"	"5 bold predictions for MLB's offseason"	"baseball_mlb"
"1"	"NFL Playoff Projection: Raiders have a clear path to the playoffs"	"football_nfl"
"0"	"Small Canadian island irate that Americans keep opening their mail"	"newsworld"
"0"	"Myanmar accused at UN court of genocide against Rohingya"	"newsworld"
"1"	"Solomon: Astros are Team October"	"baseball_mlb"
"0"	"The Sexiest Photos Ever of Our 29 Sexiest Men Alive"	"celebrity"
"0"	"Cows swept away by Hurricane Dorian found alive   but how?"	"lifestylebuzz"
"0"	"California cops respond to 2 homeless men shot with arrows: report"	"newscrime"
"0"	"Stars Who Served in the Military"	"entertainment-celebrity"
"1"	"Russell Wilson credits 'incredible force' Jadeveon Clowney after wildest game of career"	"football_nfl"
"0"	"Why Kate & Meghan Were on Different Balconies for Remembrance Sunday"	"lifestyleroyals"
"0"	"Flight Attendants Have a Secret Language You Didn't Know About"	"travelnews"
"0"	"Opinion: Baylor football back on top four years after sexual assault scandal rocked campus"	"football_ncaa"
"1"	"Vikings WR Thielen ruled out for 'SNF' matchup vs. Cowboys"	"football_nfl"
"1"	"A 13-year-old murder suspect who escaped in North Carolina is back in custody"	"newscrime"
"0"	"Inside the world's largest plane, which has a wingspan longer than a football field and a mysterious new owner"	"newsphotos"
"0"	"Jennifer Lopez Debuted the Sleek Seasonal Bob You'll Want to Copy"	"lifestylecelebstyle"
"1"	"Burning questions for Lions vs Packers on 'Monday Night Football'"	"football_nfl"
"1"	"The Latest: Storms lead to 3 deaths in eastern Oklahoma"	"newsus"
"1"	"MLB umpire Eric Cooper dead at 52"	"baseball_mlb"
"1"	"Atatiana Jefferson's funeral to be held Thursday, family attorney says"	"newsus"
"0"	"Winners, losers from Seahawks' wild overtime win over 49ers on 'Monday Night Football'"	"football_nfl"
"1"	"The decisions that have backfired on the Yankees in the ALCS"	"baseball_mlb"
"1"	"Wedding shooter may have been avenging late stepfather's murder, authorities say"	"newscrime"
"0"	"Astros can make history if Bregman wins MVP"	"baseball_mlb"
"0"	"Le'Veon Bell's advice to Antonio Brown: Try not to do too much over social media"	"football_nfl"
"0"	"The Geno Smith coin toss conspiracy is the dumbest thing in Seahawks' win over 49ers"	"football_nfl"
"0"	"Fox legal analyst Napolitano emerges as Trump critic"	"newsus"
"1"	"Rangers DH Shin-Soo Choo undergoes shoulder surgery"	"baseball_mlb"
"0"	"11 Fine-Dining Etiquette Rules You've Probably Broken Your Whole Life"	"videos"
"0"	"Mollie Tibbetts' accused killer wants confession thrown out, claims he wasn't read rights"	"newscrime"
"0"	"Don't be fooled: Costco says $75 coupon is a scam"	"finance-companies"
"1"	"Shia LaBeouf Thanks Officer Who Arrested Him in 2017 for 'Changing My Life' in Emotional Speech"	"movies-awards"
"0"	"Demi Lovato debuts new boyfriend, plus more celeb love life news for mid-November 2019"	"entertainment-celebrity"
"1"	"2 UConn Students Arrested After Shouting Racist Slur, Officials Say"	"newsus"
"1"	"One arrested, second at large in slaying of Andre Emmett Jr., police say"	"newscrime"
"0"	"As impeachment inquiry goes public, federal prosecutors quietly investigate Giuliani"	"newspolitics"
"0"	"San Diego State University freshman hurt in fraternity incident dies"	"newsus"
"0"	"The 50 cheapest places to buy land in America"	"finance-real-estate"
"1"	"Nick Jonas Shares Heartfelt Message to Friend Kevin Hart After Car Crash"	"movies-celebrity"
"1"	"Springer hits 3-run, go-ahead homer in ALCS Game 4"	"baseball_mlb"
"1"	"Subtle Signs You May Have Clogged Arteries"	"medical"
"1"	"Man paralyzed in police shooting in own home awarded $750K"	"newsus"
"0"	"Survivor Contestants Missy Byrd and Elizabeth Beisel Apologize For Their Actions"	"tvnews"
"1"	"'Tarzan' Actor Ron Ely: Actor's son allegedly killed his mother before deputies shot and killed him, sheriff's office says"	"tv-celebrity"
"0"	"The SoftBank Effect: How $100 Billion Left Workers in a Hole"	"finance-companies"
"0"	"'Priceless' finds that turned out to be worthless"	"markets"
"0"	"Taliban to release 2 professors in prisoner swap"	"newsworld"
"0"	"10 biggest disappointments of NFL Week 10"	"football_nfl"
"0"	"Opinion: NFL owes Colin Kaepernick a fair shot at weekend workout in Atlanta"	"football_nfl"
"1"	"Who won the AL MVP the year you were born?"	"baseball_mlb"
"0"	"College gymnast dies following training accident in Connecticut"	"newsus"
"0"	"The most talked about movie moments of the 2010s"	"movies-gallery"
"0"	"Neil Young Says U.S. Citizenship Application Delayed By Marijuana Use"	"music-celebrity"
"0"	"No. 1 milk company declares bankruptcy amid drop in demand"	"finance-companies"
"0"	"California teen killed in gang-related shooting, 2 people charged with murder, police say"	"newscrime"
"0"	"Harrods accused of ruining the spirit of Christmas after limiting Santa visits to customers who spend over $2,500"	"finance-companies"
"1"	"Meteorologist calls out body-shamer: 'I will not be strapping myself into a girdle'"	"lifestylebuzz"
"1"	"Kyle Shanahan blasts 49ers WRs over dropped passes"	"football_nfl"
"1"	"Boxer Patrick Day dies after suffering traumatic brain injury in super welterweight fight"	"boxing"
"0"	"John Legend Is PEOPLE's Sexiest Man Alive 2019: 'I'm Excited but a Little Scared at the Same Time'"	"music-celebrity"
"1"	"2 dead, 14 injured following New Mexico Navajo religious ceremony: report"	"newsus"
"0"	"Hong Kong police shoot at pro-democracy protesters"	"newsworld"
"1"	"Iowan convicted of murder claims his life-sentence was served once he died, was revived in medical emergency. The court disagrees."	"newscrime"
"0"	"Wisconsin bus driver saves children wandering in snow, as deadly Arctic air mass grips US"	"newsgoodnews"
"0"	"Rep. Tim Ryan endorses Biden in Democratic primary"	"elections-2020-us"
"0"	"Sears is laying off hundreds of corporate employees after announcing 96 store closings"	"finance-companies"
"1"	"Twitter Had Feelings About Mark Zuckerberg's Micro-Bangs"	"lifestylebuzz"
"1"	"Kevin Hart Spotted for the First Time Since Serious Car Accident: Pics"	"movies-celebrity"
"1"	"Best, worst QB performances from NFL Week 7"	"football_nfl"
"0"	"Video shows a Boeing 737 plane carrying 196 people burst into flames just after landing at an Egyptian airport"	"travelnews"
"0"	"40 Restaurant Meals You Should Never Eat After 40"	"nutrition"
"0"	"U.S. Troops Will Die If They Remain in Syria, Bashar Al-Assad Warns"	"newsworld"
"0"	"Israel says overnight strike on Gaza house killed Islamic Jihad commander"	"newsworld"
"0"	"Hyatt is eliminating travel-sized plastic toiletries"	"travelnews"
"0"	"Weird And Wild Photos From The Lone Star Motorcycle Rally"	"autosmotorcycles"
"0"	"Abandoned farms for sale with plenty of promise"	"finance-real-estate"
"0"	"Signs of Dementia: 8 Tips For Talking to Your Older Parents"	"mentalhealth"
"0"	"Porsche launches into second story of New Jersey building, killing 2"	"newsus"
"1"	"Bahareh Zare Bahari: Beauty queen says she will be killed if she is deported to Iran"	"newsus"
"0"	"37 Years After His Wife Is Found Dead with an Ax in Her Skull, Husband Is Arrested"	"newscrime"
"0"	"A former royal bodyguard shared the challenges that come with protecting the royal family"	"newsoffbeat"
"0"	"Big celebrity money moments of the last decade"	"entertainment-celebrity"
"0"	"Navy Submarine, Missing for 75 Years, Is Found Off Okinawa"	"newsworld"
"1"	"Man sentenced to 75 years in killing of 7-year-old Taylor Hayes"	"newscrime"
"1"	"Will Freddie Kitchens be one and done in Cleveland?"	"football_nfl"
"0"	"Divers salvage 100-year-old liquor from WWI shipwreck"	"travelarticle"
"0"	"2020 Ford Explorer launch hardly went according to plan, company admits"	"autosnews"
"0"	"See All the Best Photos of the Royal Family at Remembrance Sunday"	"lifestyleroyals"
"0"	"This Arctic blast is in its final day. But the cold isn't over quite yet"	"weathertopstories"
"0"	"Can you answer these real Jeopardy questions about TV shows?"	"tv-gallery"
"1"	"5 realistic deals we want to see before the NFL trade deadline"	"football_nfl"
"0"	"Widow Sues Truth Aquatics Owner In Conception Boat Fire That Killed 34"	"newsus"
"0"	"The Key to Mastering Goulash, the World's Most Famous Stew"	"recipes"
"0"	"Ala. lawmen help get hitchhiking disabled veteran to doctor's appointment across state"	"newsgoodnews"
"1"	"Zion, 8, saw his aunt Atatiana Jefferson get shot. Family is trying to help him cope"	"newsus"
"1"	"2 reported dead after plane that vanished from radar and crashed in North Carolina"	"newsus"
"0"	"Britney Spears Reveals Her Secret Cheat Meal In All Its Chocolaty Glory"	"healthnews"
"0"	"Suicide bomber attacks Indonesian police station, wounding 6"	"newsworld"
"1"	"CC Sabathia leaves possible last appearance with injury"	"baseball_mlb"
"0"	"Lawmakers, More Polite in Private, Get Aggressive in Public Hearing"	"newspolitics"
"0"	"11 reasons to watch Week 11 of the 2019 NFL season"	"football_nfl_videos"
"0"	"Family told to take down Christmas display because it's too soon to decorate"	"lifestylebuzz"
"0"	"60+ Restaurants Where Veterans Eat for Free on Veterans Day This Year"	"personalfinance"
"1"	"A man is in custody for an acid attack being investigated as a hate crime, bringing some relief to the south side Milwaukee neighborhood"	"newsus"
"1"	"ALCS Game 4: Yankee Stadium in October no match for Houston Astros"	"baseball_mlb"
"1"	"Why FSU fired football coach Willie Taggart with an $18 million buyout"	"football_ncaa"
"0"	"Today in History: November 12"	"newsworld"
"1"	"Cowboys have questionable red zone calls in loss to Vikings"	"football_nfl"
"0"	"The biggest wastes of money in 2019"	"personalfinance"
"0"	"105 Black Friday Deals You Can Start Shopping Today"	"shop-holidays"
"0"	"This little Montana town is full of Power Wagons and Mustangs"	"autosenthusiasts"
"0"	"10 Gazans dead as Israel hit on militant chief sparks rocket barrage"	"newsworld"
"0"	"Heisman Watch: Joe Burrow is the frontrunner, and there's not a close second"	"football_ncaa"
"0"	"LASIK eye surgery should be taken off market, ex-FDA adviser says"	"health-news"
"0"	"Lung Cancer Left Me in Limbo But It Won't Stop Me From Living My Life"	"ads-lung-health"
"1"	"Former justice of the peace slapped Yankees fan: police"	"newscrime"
"0"	"Stars who've had more than one wedding with the same spouse"	"entertainment-celebrity"
"0"	"Andrew Yang's Campaign Has a Lot of Money. Now What?"	"markets"
"0"	"Meteor streaks through the sky over St. Louis"	"weathertopstories"
"0"	"Russell Westbrook takes shot at Patrick Beverley"	"basketball_nba"
"0"	"Scarlett Johansson Regrets Being "Hyper-Sexualized" Early in Her Career"	"movienews"
"0"	"Walmart releases Black Friday ad with $129 Apple Watch, TV deals, electronics doorbusters"	"finance-companies"
"0"	"Top 10 storylines for college football Week 12"	"football_ncaa"
"0"	"U.S. grand jury drops case against Colorado police for killing suspect"	"newsus"
"0"	"The Most Amazing Photos of a Young Dolly Parton"	"cma-awards"
"0"	"Country music's biggest scandals"	"music-awards"
"0"	"Utah death-row inmate featured in best-selling book dies"	"newscrime"
"0"	"Iowa paid a security firm to break into a courthouse, then arrested employees when they succeeded"	"newsus"
"1"	"Should the Chiefs trade for Marcus Mariota?"	"football_nfl"
"0"	"These Are America's Favorite Liquor Brands"	"beverages"
"0"	"Eerie photos of an abandoned airport that hasn't been touched in 25 years"	"newsphotos"
"1"	"Minnesota boy, 6, found safe in dark cornfield after search"	"newsus"
"1"	"Man cuffed for eating sandwich on train platform gets an apology"	"newsus"
"0"	"University suspends 14 frats after college freshman ends up in hospital"	"newsus"
"1"	"2 charged with murder after man stabbed to death in Valley Station"	"newscrime"
"0"	"13 Reasons Why's Christian Navarro Slams Disney for Casting 'the White Guy' in The Little Mermaid"	"movienews"
"0"	"Palestinian death toll from Israeli strikes rises to 22: Gaza ministry"	"newsworld"
"1"	"Rodgers rips Packers' road focus after blowout loss to Bolts"	"football_nfl"
"1"	"Man fatally burned in a fiery Tesla after door wouldn't open, lawsuit alleges"	"newsus"
"0"	"Top 100 country songs of all time"	"cma-awards"
"1"	"Heidi Klum's 2019 Halloween Costume Transformation Is Mind-Blowing   But, Like, What Is It?"	"lifestylebuzz"
"1"	"Ian Ziering's Wife Erin Ludwig Files for Divorce Days After Split Announcement"	"tv-celebrity"
"0"	"Boeing stock soars: It still thinks 737 Max will fly next month"	"finance-top-stocks"
"0"	"NFL Week 11 Power Rankings: Upsets rule, and a new team at the top"	"football_nfl"
"1"	"Cowboys DT Antwaun Woods 'pissed' that Jason Garrett sent him home for tardiness"	"football_nfl"
"0"	"9 Amazing Transgender Women Who Changed History"	"lifestyledidyouknow"
"0"	"Groom Makes The Most Heartfelt Vows To His 9-Year-Old Stepdaughter"	"lifestylebuzz"
"0"	"Chick-fil-A owner fights back against 'slowest drive-thru' accusations"	"foodnews"
"0"	"Bold predictions for Week 12 in college football"	"football_ncaa"
"0"	"Ex-Astros say team electronically stole signs during 2017 season"	"baseball_mlb"
"0"	"America's Most and Least Popular Senators"	"newspolitics"
"0"	"One of America's biggest solar panel makers quits manufacturing"	"finance-companies"
"1"	"Man dead after shooting at Family Dollar in McKeesport"	"newscrime"
"0"	"You Need To Prioritize Sleep, According To Science"	"wellness"
"0"	"Cowboys have questionable red zone calls in loss to Vikings"	"football_nfl"
"0"	"The Best Backstage Moments From the 2019 E! People's Choice Awards"	"awards"
"0"	"American Outdoor to split into two firms, separating its gun business"	"finance-companies"
"1"	"Dramatic video shows California transit worker saving man from oncoming train"	"newsus"
"1"	"Reports: LSU LB Michael Divinity removed from team days before Alabama game"	"football_ncaa"
"1"	"Former U.S. President Carter recovering in hospital after successful brain procedure"	"newsus"
"1"	"Chris Paul feels he got 'stabbed in the back' with trade from Rockets"	"basketball_nba"
"0"	"Bucs release former first-round pick Vernon Hargreaves"	"football_nfl"
"0"	"2020 Ford Mustang Shelby GT350 vs. GT500: Which Is the Better Sports Car?"	"autosenthusiasts"
"0"	"Experts Explain Why You Might Want to Stop Sleeping on Your Stomach and How to Do It"	"wellness"
"0"	"High tides surge through Venice, locals rush to protect art"	"weathertopstories"
"0"	"Eleven charged in major drug ring bust: Country's largest seizure of carfentanil, police said"	"newscrime"
"0"	"2020 Ford Bronco: Everything we know about Ford's new SUV"	"autossuvs"
"0"	"The son of a Chinese billionaire has been banned from flying first class, playing golf, buying property, or going clubbing"	"newsworld"
"1"	"Porsche launches into second story of New Jersey building, killing 2"	"newsus"
"1"	"Wild-card Nationals head to World Series with sweep of Cards"	"baseball_mlb"
"0"	"Here are the best cruise lines for families, couples and those on a budget"	"travelnews"
"0"	"At donor dinner, Giuliani associate said he discussed Ukraine with Trump, according to people familiar with his account"	"newspolitics"
"0"	"The Real Reason McDonald's Keeps the Filet-O-Fish on Their Menu"	"restaurantsandnews"
"0"	"The 21 most iconic CMA Awards performances"	"cma-awards"
"0"	"Man who inherited 6 figures shares advice he'd give his younger self"	"personalfinance"
"0"	"A third of boomers make this critical retirement mistake"	"finance-saving-investing"
"1"	"Multiple Houses on Fire After Plane Crashes in NJ"	"newsus"
"0"	"Powerful side-by-side portraits show people over 100 years old next to their younger selves"	"lifestylebuzz"
"1"	"Convicted ex-NFL tight end Kellen Winslow II has CTE symptoms, his attorneys say"	"football_nfl"
"0"	"A new Astros sign-stealing clip may explain this 2017 George Springer home run"	"baseball_mlb"
"0"	"Steph Curry will need a second surgery, expects to return this season"	"basketball_nba"
"1"	"Wild turkeys are terrorizing a town; MLB player calls on the New Jersey governor for help"	"newsus"
"1"	"Tiger Woods starts slow as Jason Day runs away with Japan Skins title with $210K"	"golf"
"0"	"C8 Corvette Dyno Test Follow-Up: What Really Happened"	"autosnews"
"0"	"MLB free agents: Ranking the 79 best players in the 2019-2020 class"	"baseball_mlb"
"0"	"12 Cars Lose Consumer Reports' Recommendation Over Reliability Issues"	"autosnews"
"0"	"The Latest: Judge denies new claim in Georgia execution case"	"newscrime"
"1"	"The Jonas Brothers Slapped With $150,000 Lawsuit"	"musicnews"
"1"	"The Latest: Authorities: 1 dead after Alaska plane crash"	"newsus"
"0"	"2019 People's Choice Awards fashion hits and misses"	"awards"
"0"	"Celebrity plastic surgery transformations"	"entertainment-celebrity"
"0"	"Why the GM Meetings could be more active this season"	"baseball_mlb"
"1"	"Body of missing Alabama girl found; 2 being charged"	"newscrime"
"1"	"Off-duty investigator on leave after teens say he pulled a gun on them at skate park"	"newsus"
"1"	"Former Cowboys Pro Bowler Marion Barber arrested on criminal mischief charges"	"football_nfl"
"1"	"Asking price for Darius Slay 'incredibly high' before trade deadline"	"football_nfl"
"0"	"Cherry disappointed with MacLean's apology: 'He buried me'"	"icehockey_nhl"
"0"	"Joey Fatone explains the 'dumb idea' that led to pant-splitting 'DWTS' wardrobe malfunction"	"music-celebrity"
"1"	"Jennifer Lopez Debuted the Sleek Seasonal Bob You'll Want to Copy"	"lifestylecelebstyle"
"0"	"Stephen Curry calls out Michael Jordan for being a 'hater'"	"sports_news"
"0"	"What this week's 5 biggest upsets mean for the NFL playoff picture"	"football_nfl"
"0"	"51 children injured in chemical attack at China kindergarten"	"newsworld"
"1"	"Four flight attendants were arrested in Miami's airport after bringing in thousands in cash, police say"	"newscrime"
"1"	"Opinion: Zion Williamson's knee injury deflates Pelicans, NBA season before it begins"	"basketball_nba"
"1"	"Singer stands up to heckler who told her to take shirt off"	"popculture"
"0"	"Halle Berry Shares Photo of 6-Pack Abs on Instagram and Her Fans are Freaking Out"	"fitness"
"0"	"THEN AND NOW: What all your favorite '90s stars are doing today"	"celebrity"
"0"	"Maze of tunnels reveals remains of ancient Jerusalem"	"travelnews"
"0"	"US government says Roger Stone 'undermined' Russia inquiry"	"newspolitics"
"0"	"Ahead of this week's rematch, Tom Brady says he's still not quite over Super Bowl loss to Eagles"	"football_nfl"
"0"	"How much turkey do you need to buy per person?"	"tipsandtricks"
"1"	"Freshman Georgia Southern offensive lineman Jordan Wiggins dies at 18"	"football_ncaa"
"1"	"Uh-Oh! Carrie Ann Inaba Falls on 'Dancing With the Stars'"	"tv-celebrity"
"0"	"'Don't stay silent': Democrats lash out as GOP blocks gun measure amid school shooting"	"newsus"
"1"	"Student shot teen near California school, slipped into class"	"newscrime"
"1"	"3-year-old Alabama girl kidnapped from birthday party, believed to be in 'extreme danger'"	"newscrime"
"0"	"They bought a 1 euro house in Italy -- here's what happened next"	"travelnews"
"1"	"3 officers injured, 2 suspects arrested after police chase ends in fiery crash in Pacoima"	"newscrime"
"1"	"Police responding to reported shooting in Brentwood"	"newscrime"
"0"	"Cook leads Vikings to 28-24 prime-time road win over Cowboys"	"football_nfl"
"1"	"Homicide suspects 'exploited' blind spot to escape jail, authorities say"	"newscrime"
"1"	"2-year-old shot dead in Philadelphia day after 11-month-old shot 4 times"	"newscrime"
"1"	"Jalen Ramsey was complimentary in past of new teammate Jared Goff"	"football_nfl"
"0"	"Chipotle Says It Will Keep Serving Carne Asada into Early 2020, Fans Rejoice"	"foodnews"
"1"	"Golden Knights' Valentin Zykov suspended 20 games for PED violation"	"icehockey_nhl"
"1"	"'It's not over': Sarah Palin says she is fighting to repair her marriage"	"newsus"
"0"	"Top takeaways from Sunday's Week 10 NFL action"	"football_nfl"
"0"	"Man cuffed for eating sandwich on train platform gets an apology"	"newsus"
"0"	"For a healthy heart, eat the biggest meal early in the day"	"health-news"
"1"	"Parkland shooter's death penalty trial set to begin in January"	"newsus"
"0"	"Kiss Cancel 'End of the Road' Tour of Australia and New Zealand Due to Illness"	"musicnews"
"1"	"Plaschke: Hiring calm, cerebral Joe Maddon as manager was ideal for Angels team in turmoil"	"baseball_mlb"
"0"	"Justice Dept. rolls out new program to combat gun violence"	"newsus"
"0"	"Sheriff's deputy charged with murder after man shot, killed"	"newscrime"
"1"	"Carrie Underwood Praises Miranda Lambert as 'Super Supportive': 'We Lift Each Other Up'"	"cma-awards"
"1"	"At Least 3 Injured In Stampede At Travis Scott's Astroworld Music Festival"	"musicnews"
"0"	"Brian Cashman expresses interest in Madison Bumgarner"	"baseball_mlb"
"0"	"'Brutal' Arctic blast is affecting 200 million people from Chicago to Texas, and it isn't over yet"	"weathertopstories"
"1"	"High school soccer: Chloe DeLyser sets record for most goals scored"	"more_sports"
"0"	"Cowboys to be among NFL teams in attendance for Colin Kaepernick's workout"	"football_nfl"
"0"	"Kodak Black Sentenced to Over 3 Years in Prison in Weapons Case"	"music-celebrity"
"0"	"The most exclusive hotel in every state"	"traveltripideas"
"0"	"Why Prince Harry Wore His Remembrance Poppy Differently from the Rest of the Royal Family"	"lifestyleroyals"
"0"	"I'm A Queer Woman Dating A Trans Man   & No One Knows"	"voices"
"0"	"Chrissy Teigen's weekend was basically a clapback double-header, plus more news"	"entertainment-celebrity"
"1"	"Star Ohio State DE Chase Young will miss Maryland game 'due to possible NCAA issue'"	"football_ncaa"
"0"	"Owner shocked after his 60s Porsche roadster gets stolen from classic car show in Pleasanton"	"autosnews"
"1"	"Mac Engel: As long as these results are acceptable, Dallas Cowboys will continue to be losers"	"football_nfl"
"1"	"Video Details Brazen Attack by Mexican Cartel on Government Forces"	"newsworld"
"1"	"Patrick Mahomes hurts knee in Chiefs' win over Broncos"	"football_nfl"
"1"	"Louisiana could become first state without abortion access next year"	"newsus"
"0"	"Nikki Haley claims top aides tried to recruit her to 'save the country' by undermining Trump"	"indepth"
"1"	"Former Deadliest Catch Star Jerod Sechrist Arrested, Charged with Heroin Possession"	"tv-celebrity"
"1"	"'The Masked Singer' Recap: A Grammy Winner Is Revealed As The Skeleton"	"tv-recaps"
