"0"	"Opinion: Colin Kaepernick is about to get what he deserves: a chance"	"football_nfl"
"1"	"The Latest: Authorities identify 2 killed in Texas shooting"	"newscrime"
"1"	"Astros' Verlander 1st pitcher to go 0-5 in World Series"	"baseball_mlb"
"1"	"Broncos' John Elway: Drew Lock 'not ready' yet"	"football_nfl"
"1"	"'Wheel Of Fortune' Guest Delivers Hilarious, Off The Rails Introduction"	"tvnews"
"0"	"US Forest Service shuts down vandalized Georgia park feature"	"newsus"
"1"	"Ex-NFL player Winslow Jr takes plea deal before rape retrial"	"football_nfl"
"0"	"Here's the Best Small Town in Every State"	"traveltripideas"
"1"	"Girl, 7, critically wounded in shooting while trick-or-treating in Little Village on Southwest Side; suspect in custody"	"newscrime"
"1"	"2 murder suspects escape from jail, still on the run"	"newscrime"
"0"	"65 Best Fall Soups That Will Warm You and Your Family Up All Season Long"	"recipes"
"0"	"Could this court case be the key to finding Dubai's missing princesses?"	"newsworld"
"0"	"Kanye West is teaming up with pastor Joel Osteen: Details"	"music-celebrity"
"1"	"Jennifer Aniston on why she joined Instagram: 'I'm just trying to build content'"	"popculture"
"1"	"Steelers linebacker Anthony Chickillo arrested, facing assault charges"	"football_nfl"
"0"	"New Movies and TV Shows You'll Be Able to Cozy Up With on Netflix in November"	"movies-gallery"
"0"	"7 Easy-to-Miss Milestones That Indicate You're On Track to Becoming Successful"	"lifestylecareer"
"0"	"Why US miners are still digging new mines as coal prices plunge"	"finance-companies"
"1"	"Robert Blake's Daughter Speaks Out for First Time About 'Traumatic Childhood' After Mom's Murder"	"tv-celebrity"
"1"	"CTU Says Mayor 'Dashed Hopes' for Quick Settlement"	"newsus"
"0"	"Model, 23, Didn't Know She Was Pregnant Until She Gave Birth to a Full-Term Baby in Her Bathroom"	"health-news"
"0"	""The Joy of Cooking" and its recipe for success"	"foodnews"
"1"	"'We all had a good chuckle': Cowboys' 70-year-old defensive coordinator got his message across vs. Eagles"	"football_nfl"
"1"	"Miguel Cervantes' Wife Reveals Daughter, 3, 'Died in My Arms' After Entering Hospice Care"	"tv-celebrity"
"0"	"Supreme Court weighs fate of DACA, 700,000 young immigrants"	"newsus"
"0"	"Unexpected Signs of an Unhealthy Heart"	"medical"
"0"	"Dean Foods files for bankruptcy"	"finance-companies"
"1"	"Shooting at Halloween party leaves 4 dead, 4 injured"	"newscrime"
"1"	"Kevin Spacey Won't Be Charged in Sexual Assault Case After Accuser Dies"	"movies-celebrity"
"0"	"JuJu Smith-Schuster: Jalen Ramsey's right, I'm not Antonio Brown"	"football_nfl"
"0"	"Subprime mortgages keep minting cash for former Bear Stearns banker"	"markets"
"0"	"Lamar Odom Is Engaged to Sabrina Parr: See Her Ring!"	"celebrity"
"0"	"How a preacher sent gunmen into Burkina Faso's schools"	"newsworld"
"0"	"Taylor Swift Rep Hits Back at Big Machine, Claims She's Actually Owed $7.9 Million in Unpaid Royalties"	"musicnews"
"0"	"Why Do Cats Meow?"	"lifestylepetsanimals"
"0"	"Popeyes Has Blessed Us With A Boozy Pie To Pair With Its Returned Chicken Sandwich"	"foodnews"
"0"	"The McLaren Elva Is a $1.7 Million Topless, Windshield-less Hypercar"	"autosenthusiasts"
"0"	"Amazon's $1.5 million political gambit backfires in Seattle City Council election"	"finance-companies"
"1"	"Could Red Sox and Yankees make blockbuster trade?"	"baseball_mlb"
"0"	"Every Team's Best Play | Week 10"	"football_nfl_videos"
"0"	"'DACA is everything': Dreamers, families rally as Supreme Court takes up its future"	"newsus"
"0"	"The Day in Sports: Sunday, November 10, 2019"	"more_sports"
"1"	"A teen received a response to a message in a bottle he wrote 9 years ago after it traveled over 3,000 miles"	"lifestylebuzz"
"0"	"This is Chick-fil-A's most-ordered menu item"	"foodnews"
"0"	"Panthers QB Cam Newton would reportedly welcome trade to Bears"	"football_nfl"
"1"	"2 Cuyahoga County Corrections Officers plead guilty in assault of restrained inmate"	"newscrime"
"1"	"Nearly $400M worth of cocaine and marijuana intercepted by US Coast Guard"	"newsus"
"1"	"Triple Shooting In Dallas Leaves 2 Dead & Police Investigating"	"newscrime"
"0"	"Tamron Hall Talks Leaving the Today Show, Jokes About Megyn Kelly's Reported Multimillion Payout"	"tvnews"
"0"	"Justin Bieber Says Popeyes Chicken Sandwich Is 'Not Worth the Hype'"	"foodnews"
"0"	"Top Putin aide named by MH17 airliner investigators"	"newsworld"
"1"	"Report: Patriots trade for Mohamed Sanu, send second-round pick to Falcons"	"football_nfl"
"1"	"Marie Osmond 'chipped off a piece' of her kneecap when she fell on stage during performance"	"tv-celebrity"
"1"	"LAPD reports major police incident in Boyle Heights"	"newscrime"
"1"	"Cause determined in Jessi Combs' fatal speed record crash"	"autosnews"
"1"	"South Carolina teen gets life in prison for deadly elementary school shooting"	"newsus"
"0"	"Queen Elizabeth Just Rode Horseback at Age 93"	"lifestyleroyals"
"1"	"Lane Kiffin seemed to enjoy getting fined $5K for a blind ref meme, calls out LeBron James"	"football_ncaa"
"0"	"Analysis: Two Impeachments, but Two Radically Different Accusations"	"newspolitics"
"1"	"Doorcam Shows Man Frantically Warn Neighbors as Hillside Fire Approaches"	"weathertopstories"
"0"	"Every touchdown from every Week 10 game"	"football_nfl_videos"
"0"	"Where will the Colin Kaepernick story go from here?"	"football_nfl"
"1"	"Survivor Contestant Accused of 'Inappropriate Touching,' 2 Players Admit to Using Allegations to Win"	"tvnews"
"1"	"Mama June enters plea in cocaine case..."	"tv-celebrity"
"0"	"This is the dirtiest spot on a plane"	"video"
"0"	"Why it's nearly impossible for cruise workers to sue employers"	"travelnews"
"1"	"Astros dispute story that team executive taunted female reporters about Roberto Osuna"	"baseball_mlb"
"0"	"Meghan Markle and Hillary Clinton Secretly Spent the Afternoon Together at Frogmore Cottage"	"lifestyleroyals"
"0"	"Twins' Rocco Baldelli, Cardinals' Mike Shildt win MLB Manager of the Year awards"	"baseball_mlb"
"0"	"Raise Billions From Billionaires? Tax Experts Say It's Not That Simple"	"finance-taxes"
"0"	"Longtime Republican Rep. Pete King won't seek reelection"	"elections-2020-us"
"0"	"The stock market's 10-year run became the best bull market ever this month"	"markets"
"0"	"U.S. Drones Appear to Show Turkish- Backed Forces Targeting Civilians"	"newsworld"
"1"	"Officials: At least 13 dead in Slovakia bus crash"	"newsworld"
"0"	"Hannah Brown on Being Surrounded By Exes Tyler Cameron and Colton Underwood"	"tv-celebrity"
"0"	"The Most Stunning Evening Gowns in Miss America History"	"lifestylecelebstyle"
"1"	"Atlanta college student Alexis Crawford was choked to death, dumped in park, police say"	"newscrime"
"1"	"Hard Rock Hotel New Orleans collapse: Former site engineer weighs in"	"newsus"
"1"	"Yankees' Aaron Hicks to have Tommy John surgery, out eight to 10 months"	"baseball_mlb"
"1"	"MLB bans women who flashed their chests behind home plate during Game 5 of World Series"	"baseball_mlb"
"0"	"Scared Rabbit Abandoned In Box Clings To His Favorite Teddy Bear"	"lifestylebuzz"
"1"	"Missouri man missing for a week found alive in car that crashed into ravine"	"newsus"
"0"	"Lori Loughlin's 'Stress Is Only Mounting' Ahead of Pretrial Hearing"	"tv-celebrity"
"1"	"NFL fines Odell Beckham Jr. for ridiculous uniform infraction"	"football_nfl"
"1"	"Cases in which police officers were charged in shootings"	"newscrime"
"1"	"3rd Teen Arrested For Brutal Gang Attack That Left 79-Year-Old Man With Broken Ribs"	"newscrime"
"0"	"Giants hire Gabe Kapler as manager to replace Bruce Bochy"	"baseball_mlb"
"0"	"Jury in trial of Trump adviser Stone ends first day of deliberations without verdict"	"newspolitics"
"1"	"MLB: Astros weren't whistling to relay stolen Yankees signs in ALCS, report says"	"baseball_mlb"
"0"	"85 Thanksgiving Recipes You Can Make Ahead"	"quickandeasy"
"0"	"See the most expensive watch ever sold at auction"	"viral"
