"0"	"Pittsburgh Steelers quarterback Mason Rudolph on 'TNF' incident: 'I thought it was pretty cowardly'"	"football_nfl_videos"
"0"	"Lakers pull away with late 3-pointers to beat Suns 123-115"	"basketball_nba"
"1"	"Kevin Hart Says He's a ''Different'' Person While Revealing Details From ''Humbling'' Car Crash Recovery"	"movies-celebrity"
"0"	"Clinton warns U.K. headed for 'fascism' as politics turns nasty"	"newsworld"
"0"	"The 5 college majors American students most regret picking"	"finance-career-education"
"0"	"Loved One Gave You Down Payment Money? You'll Need a Mortgage Gift Letter"	"finance-real-estate"
"1"	"Why Teach Your Dog to Sit, When You Can Teach Them to Make a Sandwich Instead?"	"lifestylebuzz"
"0"	"Comics - 'Bliss' by Harry Bliss"	"humor"
"0"	"5 arrested in connection with deadly shooting at Airbnb Halloween party"	"newscrime"
"0"	"Amy Schumer Opens Up About How Motherhood Has Changed Her"	"movies-celebrity"
"0"	"Highway blockade reveals splits in Hong Kong protest movement"	"newsworld"
"0"	"My Husband Doesn't Like What I Wear and It's Making Me Feel Terrible"	"advice"
"0"	"How to Sell a House in Southern California: Make a Movie"	"finance-real-estate"
"1"	"World's oldest pearl to go on display in Abu Dhabi"	"newsworld"
"1"	"Cape Cod Study Finds No Easy Way to Stop Shark Attacks"	"newsus"
"1"	"2020 Ford Mustang Shelby GT350R first drive: Prescription strength grip and balance"	"autossports"
"0"	"Expect teams to target this weakness in Saquon Barkley's game"	"football_nfl"
"0"	"Mulvaney won't sue over impeachment, declines to cooperate"	"newspolitics"
"0"	"Ford v Ferrari: the real story"	"autosnews"
"0"	"Where Does Deval Patrick Stand on the Issues?"	"elections-2020-us"
"0"	"Chrissy Teigen's weekend was basically a clapback double-header, plus more news"	"entertainment-celebrity"
"0"	"DHS Sued for Answers About Its Use of DNA Testing at the Border"	"newsus"
"0"	"Here's the Best Small Town in Every State"	"traveltripideas"
"0"	"How this couple built a $100 million company without killing each other"	"finance-companies"
"0"	"The Geno Smith coin toss conspiracy is the dumbest thing in Seahawks' win over 49ers"	"football_nfl"
"1"	"Can you answer these real Jeopardy questions about TV shows?"	"tv-gallery"
"0"	"Why This Couple Is Getting a 'Sleep Divorce'"	"lifestylevideo"
"0"	"Less Than 1% of People Can Ace This Shapes Brain Teaser"	"lifestyledidyouknow"
"0"	"100 Best-Ever Thanksgiving Pies"	"recipes"
"0"	"High tides surge through Venice, locals rush to protect art"	"weathertopstories"
"0"	"FCA And GM Unfazed By The Ford Bronco's Return"	"autosnews"
"1"	"Orlando Scandrick rips Eagles: They have 'accountability issues'"	"football_nfl"
"0"	"Trust seeks seizure of Rudy Giuliani associate Lev Parnas's bail to repay $678K judgment"	"newspolitics"
"0"	"Google Maps Says This Is the Worst Time to Leave for Thanksgiving Travel"	"traveltips"
"0"	"3 pieces of dated retirement advice you should ignore"	"finance-retirement"
"0"	"Hannah Brown on Being Surrounded By Exes Tyler Cameron and Colton Underwood"	"tv-celebrity"
"0"	"Americans now have a record $14 trillion in debt"	"personalfinance"
"0"	"Today in History: November 15"	"newsworld"
"1"	"North Korea launches two projectiles into sea, Japan and South Korea say"	"newsworld"
"0"	"The 20 most festive places to spend the holidays in the US"	"travel"
"1"	"Chasing a Lamborghini Huracán Evo With a 200-MPH Ducati for 1200 Miles"	"autosmotorcycles"
"1"	"Coast Guard offloads $92 million worth of smuggled cocaine in San Diego"	"newsus"
"0"	"What Teens Did a Decade Ago That They Don't Do Anymore"	"lifestyledidyouknow"
"0"	"13 low-paying jobs that actually pay off in retirement"	"finance-career"
"1"	"One of FBI's Most Wanted fugitives offers surrender"	"newscrime"
"0"	"Tom Brady's trainer hints at how long QB intends to keep playing"	"football_nfl"
"0"	"'Absolutely Terrifying': 3 Students Describe Moments After Shots Rang Out At Saugus High School"	"newsus"
"0"	"Judge agrees Alabama Islamic State recruit is not US citizen"	"newsus"
"0"	"Broncos claim CB Cyrus Jones, waive CB Coty Sensabaugh"	"football_nfl"
"1"	"Opinion: Astros still don't get it, and must pay a steeper price beyond firing assistant"	"baseball_mlb"
"0"	"Bolivia's Jeanine Anez declares herself acting president as Evo Morales vows to fight from abroad"	"newsworld"
"1"	"Eminem Says He Sides With Chris Brown Over Rihanna Assault on Alleged Leaked Song"	"musicnews"
"1"	"10 of the best fast-food burger chains across the US"	"restaurantsandnews"
"0"	"Manafort's 2016 Gambit: A Back Channel From Trump Camp to Labor"	"newspolitics"
"0"	"Report: Police investigating woman's death after Redskins' player Montae Nicholson took her to hospital"	"football_nfl"
"0"	"Country music's biggest scandals"	"music-awards"
"0"	"All the hats Duchesses Kate and Meghan have worn in 2019"	"lifestyleroyals"
"0"	"40 Foods Men Over 40 Should Avoid Like the Plague"	"nutrition"
"0"	"7 possible landing spots for Anthony Rendon"	"baseball_mlb"
"0"	"30 Ultimate Things to Do in New York City"	"ustravel"
"1"	"You Asked: What's the Most Effective Machine to Use at the Gym?"	"fitness"
"0"	"I moved from the US to the UK. Here are the 8 things that surprised me the most."	"voices"
"0"	"Qantas test flight from London to Sydney breaks record"	"travelnews"
"0"	"Raise Billions From Billionaires? Tax Experts Say It's Not That Simple"	"finance-taxes"
"0"	"Ohio-grown Christmas trees headed to troops overseas"	"newsgoodnews"
"0"	"The most beautiful places to visit in the US"	"traveltripideas"
"1"	"How tall are your favorite male stars?"	"entertainment-celebrity"
"0"	"The Trendiest Hair Colors for Winter, From Mulled Wine to Greige Blonde"	"lifestylebeauty"
"0"	"How to get Halle Berry's 6-pack abs without spending 4 hours a day at the gym"	"fitness"
"0"	"Model, 23, Didn't Know She Was Pregnant Until She Gave Birth to a Full-Term Baby in Her Bathroom"	"health-news"
"0"	"Five Great Holiday Cruises Worth Taking"	"internationaltravel"
"0"	"NFL reportedly suspends Robert Nkemdiche two weeks"	"football_nfl"
"0"	"Eager to witness 'history,' people, protesters huddle outside Trump impeachment inquiry hearing"	"newsus"
"0"	"Every outfit Duchess Kate has worn in 2019"	"lifestyleroyals"
"0"	"How to Watch the Leonid Meteor Shower This Weekend"	"science"
"1"	"Does an apple a day really keep the doctor away?"	"wellness"
"0"	"19 Home Renovations That Give Owners the Most Joy"	"finance-real-estate"
"0"	"Prince Albert on Twins Jacques and Gabriella: They're Starting to Say, 'Are We There Yet?'"	"lifestyleroyals"
"1"	"'One in a million' deer captured on camera in Michigan woods"	"newsus"
"1"	"Woman Spots Deadly Animal Hiding In Photo Of Her Kids"	"lifestylebuzz"
"0"	"The Latest Weight Loss Pills That Work And the Ones That Don't"	"nutrition"
"0"	"Opinion: From 0-3 to the playoffs? Mike Tomlin has Steelers back on track to make NFL history"	"football_nfl"
"1"	"This Italian Beach Will Charge Entry Fee to Combat Overtourism"	"video"
"1"	"Five things we learned from the start of the college basketball season"	"basketball_ncaa"
"0"	"Report: Red Sox manager Alex Cora, Mets' Carlos Beltrán implicated in Astros sign-stealing scheme"	"baseball_mlb"
"0"	"'Load management' isn't actually a problem, but it might expose one"	"basketball_nba"
"0"	"Model Belle Lucia   Who Was Shamed for Her Small Bump   Shares Her Post-Baby 'Pregnancy Transformation'"	"wellness"
"0"	"Stella McCartney Deleted a Meghan Markle Instagram Post After Followers Called Her Out"	"lifestyleroyals"
"0"	"105 Black Friday Deals You Can Start Shopping Today"	"shop-holidays"
"0"	"How a preacher sent gunmen into Burkina Faso's schools"	"newsworld"
"0"	"Walmart hires off-duty officers ahead of El Paso reopening"	"newsus"
"0"	"2020 Ford Explorer launch hardly went according to plan, company admits"	"autosnews"
"1"	"A luxury travel company is hiring someone to stay in lavish homes around the world for $2,500 a week"	"travelnews"
"1"	"Why Baristas All Over the Country Are Telling Each Other Their Salaries"	"foodnews"
"0"	"At NATO summit, Trump to stress US allies' defense spending"	"newsworld"
"0"	"Georgia executes man convicted of killing convenience store clerk"	"newscrime"
"0"	"Gwen Stefani and Blake Shelton Are Couples Goals at the 2019 CMA Awards"	"cma-awards"
"1"	"Could You Survive the 50 Scariest Haunted House Attractions in the U.S.?"	"traveltripideas"
"0"	"Leaked Stephen Miller Emails to Breitbart Directed Race, Anti-Immigrant News Coverage"	"newsus"
"1"	"Where will the Colin Kaepernick story go from here?"	"football_nfl"
"1"	"Rihanna Slays in Sexy Black Bikini in Slow-Motion Video -- Watch!"	"music-celebrity"
"1"	"Pollution around the world: 30 shocking photos"	"causes-green-living"
"0"	"'Priceless' finds that turned out to be worthless"	"markets"
"0"	"What Happens When Your Cruise Has to Rescue Another Ship"	"voices"
"1"	"Teen given 8 years in prison for gang-related hate crime of student caught on tape"	"newscrime"
"0"	"Celebrity plastic surgery transformations"	"entertainment-celebrity"
"1"	"New Zealand's euthanasia bill passes, referendum to be held"	"newsworld"
"0"	"Who won the AL MVP the year you were born?"	"baseball_mlb"
"1"	"Ken Fisher's sexist comments have cost his company nearly $1 billion in assets"	"finance-companies"
"0"	"Stunning photos of 27 places around the world that you should visit before they disappear forever"	"traveltripideas"
"1"	"This Arctic blast is in its final day. But the cold isn't over quite yet"	"weathertopstories"
"0"	"Veterans in graduate school pay it forward to younger students"	"newsus"
"1"	"The 5 college majors American students most regret picking"	"finance-career-education"
"0"	"Heisman Watch: Joe Burrow is the frontrunner, and there's not a close second"	"football_ncaa"
"0"	"49ers' Ronald Blair done for the year with an ACL tear"	"football_nfl"
"1"	"Off to the World Series, these Nationals have proved everyone wrong"	"baseball_mlb"
"0"	"8 Secret Spots You Never Knew Existed in Disney Parks"	"traveltips"
"0"	"Carrie Underwood rocks CMAs and several gorgeous outfits as host"	"awardstyle"
"0"	"Scarlett Johansson Regrets Being "Hyper-Sexualized" Early in Her Career"	"movienews"
"0"	"A teen received a response to a message in a bottle he wrote 9 years ago after it traveled over 3,000 miles"	"lifestylebuzz"
"0"	"Father-daughter first dance medley had every guest on their feet"	"viral"
"1"	"Young homebuyers are vanishing from the US"	"finance-real-estate"
"0"	"Cincinnati Teen Arrested After Allegedly Making Up Story about Missing Autistic 13-Year-Old Who Never Existed"	"newscrime"
"0"	"Family Brings Snow Inside So Obsessed Indoor Cat Can Play In It"	"lifestylebuzz"
"0"	"Photos of the Day"	"newsworld"
"0"	"Oregon may face ICE push-back on new limits for courthouse arrests"	"newsus"
"0"	"Joey Fatone explains the 'dumb idea' that led to pant-splitting 'DWTS' wardrobe malfunction"	"music-celebrity"
"0"	"How the 2020 Corvette C8 Turned This Vette Hater Into a Believer"	"autosnews"
"0"	"Trump impeachment hearings: 5 key takeaways from the first day"	"newspolitics"
"0"	"What property buyers should know about land loans"	"finance-real-estate"
"0"	"Celine Dion Shares What She Misses Most About Late Husband Rene Angelil"	"music-celebrity"
"0"	"Protesters blockade universities, business district as chaos grips Hong Kong"	"newsworld"
"0"	"Chris Paul feels he got 'stabbed in the back' with trade from Rockets"	"basketball_nba"
"1"	"After seeing a FedEx worker walk 12 miles home for months, co-workers rally to buy her a car"	"newsgoodnews"
"1"	"They bought a 1 euro house in Italy -- here's what happened next"	"travelnews"
"0"	"Analysis: Two Impeachments, but Two Radically Different Accusations"	"newspolitics"
"1"	"A man lost 400,000 frequent flyer miles for sneaking a fat cat onto his flight in Russia"	"travelnews"
"0"	"An ambassador fired: What to watch on Day 2 of impeachment"	"newspolitics"
"0"	"The Easiest 2-Ingredient Pancake Recipe (Without Milk or Flour)"	"recipes"
"0"	"Prince Charles just turned 71   here are the best photos from every year of his royal career so far"	"lifestyleroyals"
"1"	"Indiana sees first mosquito-borne EEE death in 20 years: Health officials"	"newsus"
"0"	"Here's How to Make White Sauce for Pasta That's Better Than at Any Restaurant"	"recipes"
"1"	"These Are the Best Domestic Airlines for Families"	"travelnews"
"0"	"These Are the Best Places to Spend the Holidays, According to Travel Experts"	"video"
"0"	"'Not everyone's the star': Inside Landon Donovan's decision to coach the USL's San Diego Loyal"	"soccer"
"1"	"Sneaky reason why Ravens, not Patriots, are AFC's best"	"football_nfl"
"1"	"The 10 best countries to travel to in 2020"	"traveltripideas"
"0"	"On a frigid night in Dallas, one man who used to be homeless ushered people to shelter"	"weathertopstories"
"0"	"Which NFL teams would be a fit for Colin Kaepernick? Ranking all from 32 to 1"	"football_nfl"
"0"	"How to Winterize a House"	"finance-real-estate"
"1"	"Coast Guard searches for man who fell from cruise off Texas"	"newsus"
"0"	"Lightfoot Headed To Springfield To Lobby For Her Agenda; Changes To Chicago Casino And Real Estate Transfer Tax"	"financenews"
"0"	"20 Places to Go for Thanksgiving in America"	"traveltripideas"
"0"	"Car of Marine linked to Virginia slaying is found in South Carolina, authorities say"	"newscrime"
"0"	"'Charlie's Angels' stars: Where are they now?"	"movies-gallery"
"0"	"Weddle, Miller, Pederson among sportsmanship nominees"	"football_nfl"
"0"	"Meghan Markle and Prince Harry Won't Spend Christmas with Queen Elizabeth at Sandringham This Year"	"lifestyleroyals"
"0"	"1969 Chevrolet Camaro Z/28 emerges from a garage after sitting for over 30 years"	"autosclassics"
"0"	"The Most Popular Family Dinners from Every Decade"	"recipes"
"1"	"Mexico convulsed by second mass shooting in two days"	"newsworld"
"0"	"2020 Ford Mustang Shelby GT350 vs. GT500: Which Is the Better Sports Car?"	"autosenthusiasts"
"0"	"The latest on Brad Pitt and Angelina Jolie's post-split relationship, plus more news"	"entertainment-celebrity"
"1"	"Potential trade targets for all 32 NFL teams at the 2019 deadline, from A.J. Green to Trent Williams"	"football_nfl"
"1"	"A former Nazi bunker in Germany is being turned into a luxury hotel with a 5-storey roof garden"	"travelnews"
"0"	"My Immigrant Parents Wanted A Better Life For Me. This Is Why I Chose My Path Over Theirs."	"voices"
"0"	"'DACA is everything': Dreamers, families rally as Supreme Court takes up its future"	"newsus"
"1"	"Ex-SS guard on trial: I saw people led into gas chamber"	"newsworld"
"0"	"Fox legal analyst Napolitano emerges as Trump critic"	"newsus"
"0"	"We Tried 9 Packaged Stuffings and There Was a Clear Winner"	"tipsandtricks"
"1"	"Kareem Hunt cleared to practice ahead of Browns debut"	"football_nfl"
"0"	"What the End of Bolivia's President Means for the Country"	"newsworld"
"1"	"Can You Really Get Sick From Eating Raw Cookie Dough?"	"nutrition"
"0"	"Can you answer these real Jeopardy questions about TV shows?"	"tv-gallery"
"0"	"Poll: Most voters remain unmovable in impeachment views"	"newspolitics"
"0"	"U.S. Vows to Defend South Korea With Full Military Force Following Pyongyang Threats"	"newsworld"
"0"	"Opinion: Consensus at the top of the College Football Playoff rankings, but who's No. 4?"	"football_ncaa"
"0"	"Lines of Desire: Follow the Trail to Real Estate Investment Success"	"newsbusiness"
"1"	"Help! My Daughter Stole My Granddaughter's College Fund."	"advice"
"0"	"Fashion hits and misses from the 2019 Country Music Association Awards"	"cma-awards"
"0"	"2021 Ford Mustang Mach-E: This Electric SUV is a Mustang Family Member"	"autosnews"
"1"	"Donald Trump Jr. reflects on explosive 'View' chat: 'I don't think they like me much anymore'"	"tvnews"
"0"	"This Italian Beach Will Charge Entry Fee to Combat Overtourism"	"video"
"0"	"'It's the biggest gift I've ever gotten:' Iraq War veteran who lost leg and suffered significant trauma will come home to a hero's house in Glastonbury"	"newsgoodnews"
"0"	"NFL Playoff Projection: Raiders have a clear path to the playoffs"	"football_nfl"
"0"	"10 Gazans dead as Israel hit on militant chief sparks rocket barrage"	"newsworld"
"1"	"Frustrated with season so far, Melvin Gordon appears to regret his holdout"	"football_nfl"
"1"	"NFL trade deadline: 19 names to keep an eye on as 2019 cutoff for deals nears"	"newsus"
"0"	"20 stocks that could double your money in 2020"	"finance-top-stocks"
"0"	"America's Most and Least Popular Senators"	"newspolitics"
"0"	"The Queen's Dressmaker Reveals She Uses Gin to Clean the Royal Jewels"	"lifestyleroyals"
"0"	"Female Thunderbird pilot inspiring others to chase their dreams"	"newsgoodnews"
"0"	"Jimmy Carter 'up and walking' after hospitalization, pastor says"	"newsus"
"0"	"Former U.S. President Carter recovering in hospital after successful brain procedure"	"newsus"
"0"	"The Full-Size 2022 Jeep Grand Wagoneer SUV Is Finally On Its Way"	"autossuvs"
"0"	"The 30 best shows of Comedy Central's 30 years"	"humor"
"1"	"What viral budgets reveal about the rich"	"personalfinance"
"0"	"Is retirement dying? The old work model is disappearing for Boomers, Gen Xers"	"finance-retirement"
"0"	"Jon Huntsman expected to run for governor in Utah"	"newselection2020"
"0"	"Two sisters raise thousands to buy 108 Thanksgiving meals and turkeys for families in need"	"yearinoffbeatgoodnews"
"1"	"Family Brings Snow Inside So Obsessed Indoor Cat Can Play In It"	"lifestylebuzz"
"0"	"Impeachment Testimony Sends Talk Radio Shows to Familiar Sides"	"newspolitics"
"0"	"13 of the Best Places to Travel in December, January, and February"	"traveltripideas"
"1"	"Illegal vapes traced to California woman who was CBD pioneer"	"newsus"
"0"	"A Trump Tax Break To Help The Poor Went To a Rich GOP Donor's Superyacht Marina"	"markets"
"0"	"2009 CMA Awards fashion flashback"	"cma-awards"
"1"	"How much do you really need to save in an emergency fund? Probably not as much as you think"	"personalfinance"
"0"	"These 7 sports cars crushed their horsepower ratings in our dyno tests"	"autossports"
"0"	"How to Smoke a Turkey"	"tipsandtricks"
"1"	"Le'Veon Bell's advice to Antonio Brown: Try not to do too much over social media"	"football_nfl"
"0"	"Porzingis forgets which locker room to go to at Madison Square Garden"	"basketball_nba"
"0"	"2019 CMA Awards: See the best photos from inside and backstage"	"cma-awards"
"0"	"Americans back impeachment hearings. But age matters."	"newspolitics"
"0"	"Photos of the Day"	"newsworld"
"0"	"The 2019 NFL Season"	"football_nfl"
"0"	"'This tarnishes everything': Astros cheating allegations have baseball world demanding punishment"	"baseball_mlb"
"1"	"Kylie Jenner Throws Dinner for Caitlyn Jenner's 70th Birthday   See Which Kardashians Attended"	"tv-celebrity"
"1"	"A Louisiana man decided to steal an electric powered shopping cart from Walmart, police say"	"newscrime"
"0"	"How to Make Buttermilk At Home With Just 2 Ingredients"	"tipsandtricks"
"1"	"See what your favorite stars look like without makeup"	"celebrity"
"1"	"Boy uses his Make-A-Wish to get special space that other schoolchildren can use"	"newsgoodnews"
"0"	"Wendy's Is Rolling Out Birthday Cake Frostys for Its 50th Anniversary"	"foodnews"
"1"	"Trent Brown allegations test Raiders owner's stand against domestic abuse"	"football_nfl"
"0"	"Bands' final albums before they broke up"	"music-gallery"
"0"	"A decommissioned nuclear missile complex in Arizona that was abandoned for decades is now on sale for $400,000"	"finance-real-estate"
"0"	"EXTRA SHARP: One-Bowl Peanut Butter Cookies"	"videos"
"1"	"This Dreaded $8,000 Home Renovation Offers the Highest Return on Investment, According to Realtors"	"finance-real-estate"
"1"	"The Longest Running Horror Movie Franchises of All Time"	"movies-gallery"
"0"	"Stars who've played royals"	"tv-gallery"
"1"	"Survivor Contestants Missy Byrd and Elizabeth Beisel Apologize For Their Actions"	"tvnews"
"0"	"'Baby Shark' Devoured Your Brain. Your Wallet Is Harder to Swallow."	"finance-companies"
"0"	"Prince Harry Talked to Another Royal About His Desire for Privacy"	"lifestyleroyals"
"0"	"Here's the Thanksgiving dinner $50 buys you at Aldi, Costco, Walmart and more"	"tipsandtricks"
"0"	"Tourists needed in Venice after flooding, locals say"	"travelnews"
"0"	"'One in a million' deer captured on camera in Michigan woods"	"newsus"
"1"	"Drew Brees back to working with NFL ball in thumb rehab"	"football_nfl"
"1"	"11 Exercises and Workouts Mark Wahlberg Trains With to Stay in Top Shape"	"fitness"
"1"	"This 12-year-old food critic is harsh but he gives out thumbs up by the hundreds"	"foodnews"
"0"	"Brett Kavanaugh calls Ruth Bader Ginsburg 'inspiration,' heaps gratitude on allies"	"newspolitics"
"0"	"Arizona activist accused of guiding migrants 'further north' after border crossing"	"newsus"
"1"	"Mom Wakes Up to Find Intruder Bathing Her Toddler"	"newscrime"
"1"	"'SOS' picked up on CCTV saves Aussie woman lost in bush"	"newsworld"
"1"	"Inside the Sheikh of Dubai's 800-acre Kentucky horse farm"	"finance-real-estate"
"0"	"The Most Talked-About Celebrity Hair Transformations"	"lifestylecelebstyle"
"0"	"Atlanta college student Alexis Crawford was choked to death, dumped in park, police say"	"newscrime"
"0"	"Pregnant Maren Morris Shares Sonogram Video of Her Baby Boy: 'I Got a Wave Today'"	"music-celebrity"
"0"	"The 50 cheapest places to buy land in America"	"finance-real-estate"
"1"	"MLB free-agent predictions: Rankings, rumors for the top players on the market"	"baseball_mlb"
"0"	"Turkey's Erdoğan showed propaganda film about Kurds during White House meeting: report"	"newsworld"
"0"	"Signs of Dementia: 8 Tips For Talking to Your Older Parents"	"mentalhealth"
"0"	"THEN AND NOW: What all your favorite '90s stars are doing today"	"celebrity"
"0"	"The 12 Texas cities everyone in the country is moving to"	"newsphotos"
"0"	"How to Cure Jet Lag, According to an Airline CEO"	"traveltips"
"0"	"Bode Miller delivered his twin boys after midwife didn't make it time for the birth"	"more_sports"
"0"	"65 Best Fall Soups That Will Warm You and Your Family Up All Season Long"	"recipes"
"0"	"A Trump administration strategy led to the child migrant backup crisis at the border"	"newsus"
"1"	"Report: Man arrested in theft of Brady jersey was caught wearing it"	"football_nfl"
"0"	"Ranking the 11 most disappointing NFL teams of 2019"	"football_nfl"
"0"	"What It Was Like Inside the Homes of the Pilgrims"	"lifestylehomeandgarden"
"0"	"11 Unique and Quirky Cruise Destinations"	"traveltripideas"
"0"	"Comics - 'Pluggers' by Gary Brookins"	"humor"
"0"	"Police look for motive behind California school shooting"	"newsus"
"0"	"9 of the Best New Muscle Cars to Buy in 2020"	"autosresearchguides"
"0"	"House to hear from US official who said he overheard Trump, Sondland call"	"newspolitics"
"1"	"Airbnb said Wednesday it would verify all seven million of its listings worldwide after a deadly shooting at one of its California homes fueled fresh safety concerns about the lodging platform."	"finance-companies"
"0"	"American woman apparently strangled in the Dominican Republic"	"newsworld"
"0"	"They bought a 1 euro house in Italy -- here's what happened next"	"travelnews"
"0"	"Wynonna Judd's Daughter, 23, Released from Prison 6 Years Early After Being Granted Parole"	"music-celebrity"
"1"	"7 Things That Happen to Your Body When You Watch Scary Movies"	"wellness"
"0"	"2 officers injured in Aurora mass shooting return to duty"	"newsus"
"0"	"Archie's Photo Album: Prince Harry, Duchess Meghan's Royal Baby"	"lifestyleroyals"
"0"	"Trump, Erdogan to meet as thorny issues stress relations"	"newsworld"
"0"	"Nurse takes in man with autism so he can get a new heart"	"newsgoodnews"
"0"	"Hero Police Officer Saves Driver From Fiery Crash"	"newsgoodnews"
"1"	"Here's Why We Pass Out Candy on Halloween"	"foodnews"
"0"	"50 amazing gifts for every type of person and budget"	"shop-holidays"
"1"	"LA firefighter banked $360,010 in overtime pay in one year, city audit finds"	"newsus"
"0"	"Memphis declares James Wiseman ineligible while it works toward resolution with NCAA"	"basketball_ncaa"
"0"	"Muslim woman says Denver arena worker told her to remove hijab, refused to let her enter"	"newsus"
"1"	"Lufthansa strike cancels 1,300 flights, stranding thousands"	"travelnews"
"1"	"Missing Minnesota boy, 6, and his dog, found in cornfield by drone with thermal camera"	"newsus"
"1"	"Woman's Halloween 'devil teeth' turn into dental emergency"	"health-news"
"0"	"Disparity in home lending costs minorities millions"	"finance-real-estate"
"0"	"Jennifer Lopez Debuted the Sleek Seasonal Bob You'll Want to Copy"	"lifestylecelebstyle"
"0"	"9 Vegetables You Shouldn't Eat Raw"	"nutrition"
"0"	"Winners and losers in second College Football Playoff rankings include LSU and Alabama"	"football_ncaa"
"0"	"The stock market's 10-year run became the best bull market ever this month"	"markets"
"1"	"Kendall Jenner Wore the Tiniest Dress to Go Jewelry Shopping"	"lifestylebuzz"
"0"	"After Saugus High School shooting, prayer unites a grieving community"	"newsus"
"0"	"5 Things to Know About Visiting Lake Powell"	"traveltripideas"
"0"	"The Day in Sports: Thursday, November 14, 2019"	"more_sports"
"0"	"Family Holiday Get-Togethers Get a Bad Rap, but I Actually Really Love Mine"	"voices"
"0"	"Tua Tagovailoa again considered game-time decision with ankle injury"	"football_ncaa"
"0"	"Gwen Stefani Reveals New Nickname for Her and Blake Shelton"	"music-celebrity"
"0"	"Sign-stealing penalties could be "unlike anything seen in the sport's recent history""	"baseball_mlb"
"0"	"50 Things You Never Knew About Pizza"	"tipsandtricks"
"0"	"Massachusetts fire lieutenant dies battling house fire"	"newsus"
"0"	"12 Cars Lose Consumer Reports' Recommendation Over Reliability Issues"	"autosnews"
"0"	"​'My Annoying Cough Turned Out To Be Lung Cancer'"	"ads-lung-health"
