"1"	"11 Unique Holiday Traditions From Around The World"	"traveltripideas"
"0"	"Why Prince Harry Wore His Remembrance Poppy Differently from the Rest of the Royal Family"	"lifestyleroyals"
"1"	"Nurses reveal 10 things they wish they could tell patients, but can't"	"medical"
"1"	"Twitter Had Feelings About Mark Zuckerberg's Micro-Bangs"	"lifestylebuzz"
"1"	"David Bakhtiari was lobbying ref before decisive calls"	"football_nfl"
"1"	"Here Are the Biggest Deals We're Anticipating for Black Friday"	"shop-holidays"
"0"	"15 of the Best Towing Vehicles That Aren't Trucks"	"autosresearchguides"
"0"	"Why you're paying realtors too much commission   and what you can do about it"	"finance-real-estate"
"0"	"39 Appetizers for a Crowd That Are Easy and Unexpected"	"quickandeasy"
"0"	"Doing This One Simple Thing Can Help You Make Fewer Mistakes"	"health-news"
"1"	"Anthony Davis on possibly joining hometown Bulls: 'I mean, I am a free agent next year'"	"basketball_nba"
"1"	"Amazing motorhomes of the rich and famous"	"personalfinance"
"0"	"2020 GMC Sierra 3500HD Review: The Good, the Bad, and the Ugly"	"autostrucks"
"0"	"Family Reunited With Dog Who Had Been Missing Since August While Waiting in Line to Adopt Cat"	"lifestylebuzz"
"0"	"Shakira reflects on her career-threatening injury, depression in 2017"	"music-celebrity"
"0"	"Arctic cold to blame for at least four deaths. And the weather is only expected to get worse"	"weathertopstories"
"0"	"Cannabis Use Disorder is Rising in U.S. States Where Weed is Legal"	"health-news"
"0"	"Video shows tourists and locals wading through thigh-deep water in Venice during its worst flooding in more than 50 years"	"travelnews"
"0"	"2020 Kia Telluride Pros and Cons Review: The Heartland Kia"	"autossuvs"
"0"	"'Don't stay silent': Democrats lash out as GOP blocks gun measure amid school shooting"	"newsus"
"1"	"The best mac and cheese in every state"	"foodnews"
"0"	"The Hottest Tech Gifts This Holiday Season"	"shop-holidays"
"0"	"How to Make Cornbread Without a Recipe"	"quickandeasy"
"0"	"Rutabaga vs. Turnip: How to Tell the Difference Between These Yummy Vegetables"	"tipsandtricks"
"0"	"Here's Exactly What Kristen Bell Eats in a Day to Make 39 Look Like 29"	"nutrition"
"1"	"Model, 23, Didn't Know She Was Pregnant Until She Gave Birth to a Full-Term Baby in Her Bathroom"	"health-news"
"0"	"Drug trafficking through Venezuela has skyrocketed, says U.S. military chief"	"newsus"
"0"	"NFL, Kaepernick camp at odds over whether list of workout attendees was promised"	"football_nfl"
"0"	"The Unlikely Star of My Family's Thanksgiving Table"	"recipes"
"0"	"Harrods accused of ruining the spirit of Christmas after limiting Santa visits to customers who spend over $2,500"	"finance-companies"
"0"	"What Happens When a Plane Collides with a Flock of Birds?"	"travelnews"
"0"	"Pittsburghers Celebrate World Kindness Day By Honoring Mister Rogers"	"more_sports"
"1"	"Harley-Davidson Pan America and Bronx coming in late 2020"	"autosmotorcycles"
"0"	"2019 Los Angeles Auto Show Preview"	"autoslosangeles"
"0"	"85 Thanksgiving Recipes You Can Make Ahead"	"quickandeasy"
"1"	"'Monday Night Football' commentator under fire after belittling criticism of 49ers kicker for missed field goal"	"football_nfl"
"0"	"LASIK eye surgery should be taken off market, ex-FDA adviser says"	"health-news"
"0"	"Funny celeb pics for November 2019"	"humor"
"1"	"Bloodhound Shows The Car That Will Attempt 1,000 MPH"	"autosenthusiasts"
"0"	"Consumer prices rise most in 7 months on higher gas prices"	"markets"
"0"	"Joe Giudice Says It Was 'Painful' Watching Real Housewives of New Jersey from Prison"	"tv-celebrity"
"0"	"Southwest's Spring Travel Sale Includes $39 One-way Tickets"	"travelnews"
"0"	"Deval Patrick Joins the 2020 Race: 'This Won't Be Easy, and It Shouldn't Be'"	"elections-2020-us"
"0"	"Surviving Santa Clarita school shooting victims on road to recovery: Latest"	"newsus"
"1"	"Best all-inclusive resorts in the world"	"traveltripideas"
"0"	"This Italian Beach is Going to Start Charging Admission"	"travelnews"
"0"	"The world's only $100 billion utility owes its rise to wind power"	"finance-companies"
"1"	"A Texas mom is going to prison after putting her son through unnecessary medical procedures"	"newscrime"
"0"	"Japan Wants You To Stop Buying All Its Skyline GT-Rs"	"autosenthusiasts"
"1"	"Which teams are positioned to succeed vs. Patriots' defense?"	"football_nfl"
"0"	"Top 10 storylines for college football Week 12"	"football_ncaa"
"0"	"If You're Over 40 And About To Start Weight Lifting For The First Time, Here Are 5 Things You Need To Know"	"wellness"
"0"	"Schefter: Roger Goodell "feels bad" about Colin Kaepernick situation"	"football_nfl"
"0"	"Divers salvage 100-year-old liquor from WWI shipwreck"	"travelarticle"
"0"	"I'm extremely introverted, but I challenged myself to be more outgoing for a week, and it made me feel more confident"	"voices"
"0"	"20 Winter Wedding Color Schemes That Will Take Your Breath Away"	"lifestyleweddings"
"0"	"Experts Explain Why You Might Want to Stop Sleeping on Your Stomach and How to Do It"	"wellness"
"0"	"Maze of tunnels reveals remains of ancient Jerusalem"	"travelnews"
"0"	"Skillet casserole perfect for leftover Thanksgiving turkey"	"recipes"
"0"	"Nicole Kidman and Keith Urban Are Still Country's Hottest Couple at 2019 CMA Awards"	"cma-awards"
"0"	"20 Style Lessons Chrissy Teigen Taught Us That We'll Remember Until the End of Time"	"lifestylecelebstyle"
"0"	"9 Incredible Places You'd Never Even Think To Spend Thanksgiving"	"ustravel"
"0"	"Hannah Brown Is 'Manifesting' a 'DWTS' Win With Mirrorball Inspired Dress (Exclusive)"	"awardstyle"
"0"	"Pete Davidson, Kaia Gerber Are Dating, Trying to Stay 'Low Profile'"	"tv-celebrity"
"0"	"Liver transplant leads to unbreakable bond between strangers"	"newsgoodnews"
"0"	"How to Choose Piston Rings and Gap Them Correctly"	"autosenthusiasts"
"0"	"U.S. proposes denying work permits to asylum seekers who enter illegally"	"newsus"
"1"	"5 charged in alcohol poisoning death of UC Irvine fraternity brother"	"newscrime"
"0"	"Kristen Bell's Cozy Look Is a Lesson in Winter Airport Fashion"	"lifestylecelebstyle"
"1"	"Chick-fil-A Is Testing Three Amazing New Drinks"	"restaurantsandnews"
"0"	"Camille Grammer Accuses Ex-Husband Kelsey Grammer of 'Rewriting History'"	"tv-celebrity"
"0"	"6 Reasons to Run On the Treadmill Instead of Outside"	"fitness"
"0"	"Tennessee judge holds lawyer's baby as he swears her into the state bar in viral video"	"newsgoodnews"
"0"	"Trump DC hotel sales pitch boasts of millions to be made from foreign governments"	"newspolitics"
"1"	"Dean Foods files for bankruptcy"	"finance-companies"
"1"	"Venice 'on its knees' after second-worst flood ever recorded"	"newsworld"
"1"	"St. Regis Aspen is looking for a 'fur butler' for its Bernese mountain dog"	"travelnews"
"1"	"Aviation-Inspired Travel Experiences on the East and West Coast"	"traveltripideas"
"0"	"This little Montana town is full of Power Wagons and Mustangs"	"autosenthusiasts"
"0"	"10 Things to Know Before You Go to Las Vegas"	"traveltripideas"
"0"	"After Today, the Vise Tightens on Trump's Ukraine Point Man"	"newspolitics"
"1"	"Only Two Percent of the World's Population Have This Trait"	"medical"
"0"	"Bannon calls Pelosi's impeachment strategy "actually quite brilliant""	"newspolitics"
"1"	"The World's 10 Fastest Growing Tourist Destinations"	"traveltripideas"
"1"	"The son of a Chinese billionaire has been banned from flying first class, playing golf, buying property, or going clubbing"	"newsworld"
"0"	"35 haunting photos of abandoned shopping malls across America over last decade"	"lifestyledidyouknow"
"1"	"4-year-old hero jumps in pool to save his little sister from drowning"	"newsgoodnews"
"1"	"Eddie Van Halen thinks he developed cancer from sucking on metal guitar picks; a doctor disagrees"	"health-news"
"1"	"The 50 cheapest places to buy land in America"	"finance-real-estate"
"0"	"Dean Foods files for bankruptcy"	"finance-companies"
"1"	"Patriots' Josh Gordon Finally Responds To Persistent Fan On Twitter"	"football_nfl"
"0"	"Cincinnati Bengals cut veteran linebacker Preston Brown"	"football_nfl"
"0"	"13% of Americans say they know someone who died after they couldn't afford health care"	"newsus"
"0"	"Travel etiquette: The final word on the right to recline"	"traveltips"
"1"	"California authorities found and destroyed $1 billion worth of marijuana plants"	"newsus"
"1"	"Who needs to step up their game in Week 7?"	"football_nfl_videos"
"0"	"San Diego State University freshman hurt in fraternity incident dies"	"newsus"
"0"	"I ordered clothes from those cheap online stores, and I'm not sold"	"voices"
"0"	"Alicia Keys Returns as GRAMMY Awards Host for a Second Time"	"music-grammys"
"0"	"China's Commerce Ministry says trade war should be ended by removing tariffs"	"markets"
"1"	"2 escaped homicide suspects captured at Mexico border"	"newscrime"
"0"	"Four words from dermatologists that'll change your life: Stop showering every day"	"wellness"
"1"	"Woman Finds A Giant Wild Snake Just Chilling In Her Bed"	"lifestylebuzz"
"0"	"C8 Corvette Dyno Test Follow-Up: What Really Happened"	"autosnews"
"1"	"'It feels good to do the right thing': Store clerk returns $7,000 left in coat pocket"	"newsgoodnews"
"1"	"Off-duty Chicago police officer in clown makeup arrested on suspicion of slapping on-duty officer"	"newscrime"
"0"	"How to Peel a Pomegranate Without Making a Total Mess"	"tipsandtricks"
"0"	"We tried every single appetizer at Olive Garden and ranked them from worst to best"	"restaurantsandnews"
"0"	"Spot the Dog One Out - Pooch Fades Into the Crowd as Sheep Stop Traffic"	"animals"
"1"	"A man dies in Hawaii after falling into a lava tube in his yard"	"newsus"
"0"	"Can Work Stress Actually Be Good for You?"	"mentalhealth"
"0"	"Far from the spotlight, how presidential candidates spent the impeachment hearing"	"elections-2020-us"
"0"	"'A turning point in this hearing': Fox personalities speculate if Trump-Yovanovitch tweet could lead to witness intimidation charges"	"newspolitics"
"1"	"51 of the most unusual places to stay in the world"	"traveltripideas"
"1"	"These Are the Hardest Questions on the U.S. Citizenship Test"	"lifestyledidyouknow"
"0"	"U.S. service members can't sue military doctors. A terminally ill Green Beret is fighting to change that."	"newsus"
"1"	"Opinion: NFL owes Colin Kaepernick a fair shot at weekend workout in Atlanta"	"football_nfl"
"0"	"Illegal Botox manifested as 'leggings' seized at DHL"	"newscrime"
"0"	"Opinion: Other schools can learn from Oregon's hiring of Mario Cristobal"	"football_ncaa"
"0"	"Answers remain elusive in Virginia Beach shooting rampage"	"newsus"
"0"	"What Causes Vertigo? 15 Things Doctors Wish You Knew"	"medical"
"0"	"Walmart releases Black Friday ad with $129 Apple Watch, TV deals, electronics doorbusters"	"finance-companies"
"0"	"Baker Mayfield's wife clarified her 'fair weather fans' comment after the Browns' win"	"football_nfl"
"0"	"The McLaren Elva Is a $1.7 Million Topless, Windshield-less Hypercar"	"autosenthusiasts"
"0"	"WeWork tells investors it lost $1.25 billion in the third quarter"	"finance-companies"
"0"	"As Islamic Jihad and Israel Battled, Hamas, in a Twist, Sat on the Sidelines"	"newsworld"
"0"	"Christopher Johnson has hitched his reputation to Adam Gase"	"football_nfl"
"0"	"U.S. Drones Appear to Show Turkish- Backed Forces Targeting Civilians"	"newsworld"
"0"	"Trump juggles statecraft and impeachment on a historic day"	"newspolitics"
"0"	"Trump says he's not watching impeachment hearing   then critiques it"	"newspolitics"
"0"	"Cowboys to be among NFL teams in attendance for Colin Kaepernick's workout"	"football_nfl"
"0"	"The most famous celebrity kids born this decade"	"celebrity"
"0"	"Kanye West is teaming up with pastor Joel Osteen: Details"	"music-celebrity"
"1"	"Wendy's Is Rolling Out Birthday Cake Frostys for Its 50th Anniversary"	"foodnews"
"1"	"How Kristen Bell Deals With Halloween Candy In Her House"	"lifestylebuzz"
"1"	"A former royal bodyguard shared the challenges that come with protecting the royal family"	"newsoffbeat"
"1"	"A Military Camera Said 'Made in U.S.A.' The Screen Was in Chinese."	"newsus"
"0"	"The GOP attacked Ilhan Omar for calling Stephen Miller a 'white nationalist.' She says his leaked emails prove her right."	"newspolitics"
"0"	"Stocks That Would Have Made You Rich Today"	"finance-saving-investing"
"0"	"Winners, losers from Seahawks' wild overtime win over 49ers on 'Monday Night Football'"	"football_nfl"
"1"	"Doctors warn addiction of 'human Ken doll' has gotten dangerous"	"medical"
"0"	"Unwanted tourist types: The kinds of travelers becoming more unwelcome"	"travelarticle"
"1"	"General knowledge quiz: How many questions can you get right?"	"lifestylebuzz"
"1"	"Cannabis Use Disorder is Rising in U.S. States Where Weed is Legal"	"health-news"
"0"	"Five questions the second College Football Playoff rankings will answer"	"football_ncaa"
"1"	"Eagles player upset team missed out on Jalen Ramsey"	"football_nfl"
"0"	"GM Design Boss Says 26-Inch Wheels Are Coming"	"autosnews"
"0"	"What Not to Miss on the Harry Potter Studio Tour"	"traveltips"
"1"	"Apple is laying the groundwork for an iPhone subscription"	"finance-companies"
"0"	"Raised an only child, Southgate woman, 92, learns she has 19 half siblings"	"newsgoodnews"
"0"	"The Secret to Sticking with Keto"	"nutrition"
"0"	"These 30 Photos From the 2019 CMA Awards Will Make You Feel Like Part of the Show"	"cma-awards"
"0"	"What this week's 5 biggest upsets mean for the NFL playoff picture"	"football_nfl"
"1"	"Vereen turns down XFL opportunity, says salary too low"	"football_nfl"
"0"	"Matthew Koma's New Tattoo for His Kids Will Melt Your Heart"	"tv-celebrity"
"0"	"Suicide bomber attacks Indonesian police station, wounding 6"	"newsworld"
"1"	"Snow crab sells for record price in Japan"	"foodnews"
"0"	"Survivor Contestant Accused of 'Inappropriate Touching,' 2 Players Admit to Using Allegations to Win"	"tvnews"
"0"	"Do Women Really Have Different Heart Attack Symptoms Than Men?"	"health-news"
"0"	"Public impeachment testimony is set to begin. Here are the lawmakers to watch"	"newspolitics"
"0"	"Supreme Court refuses to block lawsuit against gun manufacturer brought by Sandy Hook families"	"finance-companies"
"1"	"Three school workers charged in death of special needs student"	"newscrime"
"1"	"A bodybuilder showed how fitness influencers can make their bodies look Instagram-perfect in before-and-after photos"	"fitness"
"0"	"Daring rescue attempt when dog winds up on roof"	"viral"
"1"	"Duchess Meghan Describes 'Really Challenging' Life as New Royal: I'm Not OK"	"lifestyleroyals"
"1"	"A tourist was fined for wearing a string bikini on a beach in the Philippines, but travelers get punished for the way they dress more often than you might think"	"travelnews"
"0"	"Boomers Want to Stay Home. Senior Housing Now Faces a Budding Glut."	"finance-real-estate"
"0"	"Surgeon Shocked After Doing Double Lung Transplant on Teen Vaper: 'Evil I Haven't Faced Before'"	"ads-lung-health"
"0"	"Bachelor in Paradise's Carly Waddell and Evan Bass Welcome Son Charles Wolfe"	"tv-celebrity"
"0"	"The 21 most iconic CMA Awards performances"	"cma-awards"
"0"	"Impeachment hearings go live on TV with the 1st witnesses"	"newspolitics"
"1"	"Jeff Bezos is set to lose his crown as world's richest person"	"markets"
"0"	"WWE Wrestler Jordan Myles Quits in Expletive-Filled Rant as He Brands the Company Racist"	"tvnews"
"0"	"GOP memo outlines party's plan to defend Trump ahead of public hearings"	"newspolitics"
"0"	"Antonio Brown offers to play catch with Colin Kaepernick in private workout"	"football_nfl"
"0"	"'Monday Night Football' commentator under fire after belittling criticism of 49ers kicker for missed field goal"	"football_nfl"
"0"	"Wisconsin bus driver saves children wandering in snow, as deadly Arctic air mass grips US"	"newsgoodnews"
"1"	"A bride and groom ordered $450 of Domino's pizza for their wedding meal because they 'couldn't decide on food'"	"lifestylebuzz"
"0"	"5 things to look for as public hearings begin in the House impeachment inquiry of President Donald Trump"	"newspolitics"
"0"	"Lisa Vanderpump Reveals Why She Left RHOBH: 'I Don't Have Room in My Life for Nastiness'"	"tvnews"
"1"	"I'm A Queer Woman Dating A Trans Man   & No One Knows"	"voices"
"0"	"The Daily Northwestern Apologizes to Student Protesters for Reporting"	"newsus"
"0"	"California crisis of fires, blackouts decades in the making"	"newsus"
"0"	"Geno Smith trolls over coin flip 'controversy'"	"football_nfl"
"0"	"Disney+: All the Original TV Shows and Movies Set for Streaming Platform (Photos)"	"tv-gallery"
"0"	"I Donated Blood for the First Time at 27, and It Ended in Signs of Cardiac Arrest"	"voices"
"0"	"A third of boomers make this critical retirement mistake"	"finance-saving-investing"
"0"	"Veterans Day turns jubilant for 70-year-old Army vet after he wins lottery in NC"	"newsgoodnews"
"0"	"Whitney Way Thore Responds After Trolls Shamed Her for Attempting a Power Snatch"	"wellness"
"1"	"The decisions that have backfired on the Yankees in the ALCS"	"baseball_mlb"
"1"	"Dangers of tattoos are more than just skin deep"	"medical"
"1"	"Bursting at the seams: inside an IS prison in Syria"	"newsworld"
"0"	"2020 Subaru Outback vs. 2019 Honda Passport: Which Is the Better Mid-Size Utility Vehicle?"	"autossuvs"
"1"	"85-year-old Michigan cowgirl still drives cattle across Wyoming"	"newsgoodnews"
"0"	"Stocks close little changed amid lingering trade worries"	"markets"
"0"	"One in 5 children live below the poverty line: Here are the states with the highest number of kids dependent on free lunches"	"causes-poverty"
"0"	"You can now rent a suite in a real-life royal palace on Airbnb, and it comes with a private butler"	"traveltripideas"
"1"	"Here's the Average Cost of an Engagement Ring in 2019, According to a Survey"	"lifestylebuzz"
"0"	"Evansville's upset at No. 1 Kentucky illustrates college basketball's uncertain landscape"	"basketball_ncaa"
"0"	"This was uglier than a brawl. And Myles Garrett deserves suspension for rest of year after helmet attack."	"football_nfl"
"0"	"Carrie Underwood Praises Miranda Lambert as 'Super Supportive': 'We Lift Each Other Up'"	"cma-awards"
"0"	"Why You Should Cook Turkey Breast This Year, Not the Whole Bird."	"tipsandtricks"
"0"	"Russian Law Sets To Improve Animal Welfare By Shutting Down Petting Zoos"	"animals"
"1"	"Best Ski Resorts in the US"	"traveltripideas"
"1"	"The One Food Men Should Eat Every Day"	"nutrition"
"1"	"Nationals, Astros have pushed the World Series to Game 7. Nobody should be surprised."	"baseball_mlb"
"0"	"Ohio GOP lawmakers want to ban all abortions, charge doctors who perform them with murder"	"newsus"
"0"	"Powerful side-by-side portraits show people over 100 years old next to their younger selves"	"lifestylebuzz"
"0"	"56 Hottest Holiday Gifts from Amazon"	"shop-holidays"
"0"	"Iran moves on ultra-cheap petrol, starts rationing"	"newsworld"
"0"	"Officials: At least 13 dead in Slovakia bus crash"	"newsworld"
"0"	"Pete Davidson, Kaia Gerber seen on yet another date: Fresh details on their new romance"	"tv-celebrity"
"1"	"Today in History: November 14"	"newsworld"
"0"	"Baker Mayfield quick to condemn teammate Myles Garrett for brawl, attack on Mason Rudolph"	"football_nfl"
"0"	"Powell's Warning to Congress About the Next Recession"	"markets"
"0"	"See the most expensive watch ever sold at auction"	"viral"
"0"	"The Day in Sports: Wednesday, November 13, 2019"	"more_sports"
"0"	"Look of the Day"	"lifestylebuzz"
"0"	"It's National Pickle Day So Here Are All The Ways To Celebrate The Momentous Occasion"	"foodnews"
"0"	"Spain's King Felipe VI and Queen Letizia's royal visit to Cuba: Best photos"	"lifestyleroyals"
"0"	"WH plans "aggressive" strategy for open impeachment hearings"	"newspolitics"
"1"	"Selena Gomez Opens Up About Being Body Shamed for Gaining Weight Amidst Lupus Battle"	"wellness"
"0"	"'After I Could Only Fit Into Extended-Size Wedding Gowns, I Started Keto And Lost Over 100 Lbs. In 16 Months'"	"voices"
"0"	"The Coolest Way to See NYC Is in a Vintage Car From the Roaring '20s on This Midtown Tour"	"ustravel"
"0"	"How Cowboys QB Dak Prescott's words have helped WR Amari Cooper's toe-tapping catches"	"football_nfl"
"0"	"Rare 1996 Chevrolet Corvette Grand Sport Convertible Up For Sale"	"autosclassics"
"0"	"In Less Than a Decade, You Won't Be Able To Afford a Home in These Cities"	"finance-real-estate"
"1"	"Flight shaming is gaining traction and could cost airlines billions"	"finance-companies"
"0"	"How To Make Baked Salt & Vinegar Smashed Potatoes By Gail Simmons"	"videos"
"1"	"Burning questions for Cowboys vs Giants on 'Monday Night Football'"	"football_nfl"
"0"	"Top Putin aide named by MH17 airliner investigators"	"newsworld"
"0"	"Teresa Giudice Opens Up About Her Future With Husband Joe and the Cheating Rumors (Exclusive)"	"tv-celebrity"
"0"	"99 of the world's most amazing bucket-list experiences for 2020"	"internationaltravel"
"0"	"Aviation-Inspired Travel Experiences on the East and West Coast"	"traveltripideas"
"0"	"10 tips on paying your mortgage off sooner"	"finance-real-estate"
"0"	"6 Cost-Saving Tips for Traveling in Retirement"	"video"
"0"	"Top 100 country songs of all time"	"cma-awards"
"0"	"Trump, Macron to meet after French president criticized NATO"	"newsworld"
"0"	"Why you're not rich: A financial therapist explains the mindset standing between you and your money goals"	"personalfinance"
"0"	"As top free agents hit the market, Scott Boras says MLB's system is 'corrupt'"	"baseball_mlb"
"1"	""The Rock" Just Shared His Gym Bag Essentials And Whipped Out a Bag of Hot Dogs"	"fitness"
"1"	"The Day in Sports: Wednesday, October 16, 2019"	"more_sports"
"1"	"Burning questions for Lions vs Packers on 'Monday Night Football'"	"football_nfl"
"1"	"Frustrated Antonio Brown has active morning on Twitter"	"football_nfl"
"0"	"Helping veterans launch startups: 'There's a level of resilience that a lot of people in the military have, which is great for running your own business'"	"newsgoodnews"
"0"	"See what your favorite stars look like without makeup"	"celebrity"
"0"	"South Carolina teen gets life in prison for deadly elementary school shooting"	"newsus"
"0"	"Trump puts economic growth at center of his 2020 campaign"	"markets"
"0"	"Takeaways so far from House public impeachment hearings"	"newspolitics"
"0"	"Bad news, seniors: Your Medicare costs are going up"	"finance-insurance"
"0"	"UK flooding: army to help recovery effort as more rain forecast"	"newsworld"
"0"	"Exactly Why You Keep Waking up in the Middle of the Night, According to Doctors"	"wellness"
"0"	"John Travolta Shares Rare Photo with Daughter Ella and Son Benjamin"	"movies-celebrity"
"0"	"Some believe Mason Rudolph, hit in head with his own helmet, isn't getting enough blame"	"football_nfl"
"1"	"10 Exercises You Should Never Do Again, According to Trainers"	"fitness"
"0"	"Miranda Lambert Is Pretty in Pink at 2019 CMA Awards With Husband Brendan McLoughlin"	"awardstyle"
"0"	"The problem with diamonds is they keep getting cheaper"	"markets"
"0"	"The Day in Sports: Tuesday, November 12, 2019"	"more_sports"
"1"	"What It's Like to Have 'Bad Skin' and Work on TV"	"voices"
"0"	"Chevy Icon Rod Saboury Gets 680 hp From His "Stacked" 1964 Corvette"	"autosclassics"
"0"	"Warren Buffett buys a stake in Restoration Hardware"	"finance-top-stocks"
"1"	"Some of the World's Best Beaches Are in Countries You May Not Expect"	"traveltripideas"
"0"	"Colin Kaepernick heads to Atlanta for workout"	"football_nfl"
"1"	"TSA Agents Stop Passenger With Loaded Gun Before Boarding Plane"	"travelnews"
"0"	"Thunberg, teen climate activist, leaves US aboard catamaran"	"newsus"
"0"	"Kodak Black Sentenced to Over 3 Years in Prison in Weapons Case"	"music-celebrity"
"1"	"Michael Irvin Suggests Cowboys Sign Antonio Brown: 'We Need Some H-E-L-P'"	"football_nfl"
"0"	"Celebrity property roundup: the winners and losers of 2019"	"finance-real-estate"
"0"	"How To Avoid These 14 Home Renovation Horror Stories"	"finance-real-estate"
"1"	"Predicting the Cy Young and MVP Winners in MLB"	"baseball_mlb_videos"
"0"	"Emilia Clarke Stunned in a Cut-Out Dress at the 'Last Christmas' Premiere"	"lifestylecelebstyle"
"0"	"Justice Dept. rolls out new program to combat gun violence"	"newsus"
"0"	"Here's how buying a home changed my view of money"	"finance-real-estate"
"1"	"Pete Carroll on Lamar Jackson as a runner: "It's a real nightmare""	"football_nfl"
"0"	"American Outdoor to split into two firms, separating its gun business"	"finance-companies"
"0"	"Treasury yields tick higher amid uncertainty over US-China trade deal"	"markets"
"0"	"Democrats face make-or-break moment on impeachment"	"newspolitics"
"0"	"Report: Election vendors are 'prime targets,' need oversight"	"elections-2020-us"
"1"	"Jason Mraz Grows Coffee That Sells for $199 Per Can"	"foodnews"
"1"	"The Astros-Nationals blockbuster trade that was almost a reality"	"baseball_mlb"
"0"	"Report: Giants hire Gabe Kapler as new manager"	"baseball_mlb"
"0"	"What 40 Celebrities Look Like Without Their Signature Looks"	"lifestylecelebstyle"
"0"	"Camila Cabello and boyfriend Shawn Mendes get tattoos together: Photos"	"music-celebrity"
"0"	"Could this court case be the key to finding Dubai's missing princesses?"	"newsworld"
"0"	"Cold weather: 70% of the country will experience freezing temperatures this week"	"weathertopstories"
"0"	"Le'Veon Bell set for limited practice Thursday"	"football_nfl"
"0"	"Miranda Lambert Is at a 'Comfortable Place' After She 'Struggled with Ups and Downs in Weight'"	"health-news"
"0"	"How the US betrayed the Marshall Islands, kindling the next nuclear disaster"	"newsworld"
"0"	"No, Not Everyone Is Beautiful, And We'd All Be Better Off If We Stopped Saying We Are"	"voices"
"0"	"The world's most profitable company is about to go public"	"finance-companies"
