"0"	"Patriots Players Strongly Support Colin Kaepernick's Potential Return To NFL"	"football_nfl"
"0"	"Sessions vows to 'work for' Trump endorsement"	"elections-2020-us"
"0"	"How to Make Sure You Have a Seat Next to Your Family on Your Next Flight"	"traveltips"
"1"	"The 10 best US cities to celebrate Halloween this year, ranked"	"travelarticle"
"1"	"Predicting the College Football Playoff Rankings for Week 11"	"football_ncaa"
"0"	"23 Worst Things You Can Say to a New Parent"	"lifestyleparenting"
"0"	"30 Best Black Friday Deals from Costco"	"shop-holidays"
"0"	"Kiss Cancel 'End of the Road' Tour of Australia and New Zealand Due to Illness"	"musicnews"
"1"	"NFL flexes 49ers-Packers to prime time in Week 12 for Eagles-Seahawks"	"football_nfl"
"0"	"U.S. weekly jobless claims rise to five-month high"	"markets"
"0"	"Malcolm Jenkins skeptical of NFL's Colin Kaepernick workout offer"	"football_nfl"
"0"	"Most Americans say they are struggling financially"	"personalfinance"
"0"	"South Bay students rally for 'Dreamers' as Supreme Court takes up landmark case"	"newsus"
"0"	"Matthew Stafford out of practice again on Thursday"	"football_nfl"
"0"	"Taylor testifies he was told Trump cared more about 'investigations' than Ukraine"	"newspolitics"
"0"	"Saquon Barkley refusing to be shut down for season despite injuries"	"football_nfl"
"0"	"Australia's Qantas operates 19 ½ hour London-Sydney flight"	"travelnews"
"0"	"9 signs you've shifted from frugal to cheap"	"finance-savemoney"
"1"	"A teenager thought his leukemia was a death sentence. A college football player saved his life."	"newsgoodnews"
"0"	"Sneaky ways all-inclusive resorts get you to spend money"	"video"
"0"	"U.S. grand jury drops case against Colorado police for killing suspect"	"newsus"
"1"	"The Grateful Dead's Bob Weir Is Unbelievably Shredded at 72"	"fitness"
"0"	"3 castaway cows swam to North Carolina's Outer Banks to escape Hurricane Dorian"	"newsus"
"0"	"Les Miles Has Some Thoughts on the Shape of the Earth"	"football_ncaa"
"0"	"Stand-in president 'brings back Bible' to Bolivian politics"	"newsworld"
"0"	"Latin GRAMMYs 2019: Best Moments of the Night!"	"ads-latingrammys"
"0"	"Win Weeknights with These Crazy-Delicious Instant Pot Recipes"	"quickandeasy"
"1"	"The Before-And-After Photos of This Man Who's Three Years Sober Will Amaze You"	"wellness"
"0"	"20 home renovations that kill your home's value"	"finance-real-estate"
"0"	"A $30,000 handbag. A disastrous wine spill. And now, a country club is suing its own waiter."	"markets"
"0"	"U.K. Politicians Fight First December Election in Almost a Century"	"newsworld"
"0"	"What to Cook This Weekend: November 15 17, 2019"	"recipes"
"1"	"The megaprojects that changed countries forever"	"markets"
"1"	"This Pomona College senior is living out of a converted school bus and saving $10,000 a year on student housing"	"lifestylebuzz"
"1"	"Cat "repeatedly" breaks his friends out of animal shelter"	"newsus"
"0"	"With two Cy Young Awards, Jacob deGrom on Cooperstown path"	"baseball_mlb"
"0"	"Native American tribes propose initiative to legalize sports betting in California"	"newsus"
"1"	"Boss pays off his employee's mortgage to allow him to retire early"	"newsgoodnews"
"0"	"Dangers of tattoos are more than just skin deep"	"medical"
"0"	"Russia lands forces at former U.S. air base in northern Syria"	"newsworld"
"0"	"Mom vs. Gingerbread House"	"videos"
"0"	"RNC plunges into Louisiana gov's race amid signs of trouble"	"elections-2020-us"
"0"	"See All the Best Photos of Prince Charles's Trip to India"	"lifestyleroyals"
"0"	"Lexus just revealed the pricing for its first-ever luxury yacht   and a fully-loaded model will cost $4.85 million. Here's a closer look at LY 650."	"autosnews"
"0"	"Watch: John Harbaugh shared awesome moment with Lamar Jackson"	"football_nfl"
"0"	"Taylor Swift Rep Hits Back at Big Machine, Claims She's Actually Owed $7.9 Million in Unpaid Royalties"	"musicnews"
"1"	"21 images that tell the story of the 2015 Paris attacks"	"newsworld"
"1"	"The woman behind '1,000 Places To See Before You Die' reveals top destinations to visit before everyone else does"	"traveltripideas"
"1"	"'Dejuiced' or not, Yankees baffled by these playoff baseballs in Game 3"	"baseball_mlb"
"0"	"Who will be best team in the NFL after Week 11?"	"football_nfl_videos"
"0"	"Trump's Washington hotel has fallen behind competitors, with rooms running nearly half empty, marketing materials show"	"newsus"
"0"	"How Ducati influenced the 2020 Corvette's design"	"autossports"
"1"	"Six pretenders entering the 2019 NFL home stretch"	"football_nfl"
"0"	"Bolivia unrest: Evo Morales denounces 'coup' as Jeanine Anez takes power"	"newsworld"
"0"	"Kentucky's loss to Evansville ranks as one of the biggest upsets in college hoops history"	"basketball_ncaa"
"0"	"These Are America's Favorite Liquor Brands"	"beverages"
"1"	"Police identify "fan" who punched Myles Garrett"	"football_nfl"
"0"	"Instagram-famous pilot reveals secrets people don't know about the job"	"travelnews"
"0"	"11 reasons to watch Week 11 of the 2019 NFL season"	"football_nfl_videos"
"1"	"NFL teams reportedly believe Browns could trade Odell Beckham if struggles continue"	"football_nfl"
"1"	"Cause determined in Jessi Combs' fatal speed record crash"	"autosnews"
"0"	"Is the Alabama Football Dynasty Ending?"	"football_ncaa_videos"
"0"	"How to Brine a Turkey & Why You Should"	"tipsandtricks"
"0"	"Hernandez: Anthony Davis' impact on LeBron James apparent even when he doesn't play"	"basketball_nba"
"0"	"Pompeo 'on shifting sand' as impeachment probe reveals his role in Ukraine pressure campaign"	"newspolitics"
"0"	"Rep. Tim Ryan endorses Biden in Democratic primary"	"elections-2020-us"
"0"	"How the biggest stars of the decade have changed"	"celebrity"
"0"	"Stocks close higher on optimism over China trade deal"	"markets"
"0"	"The 1 reason you shouldn't hesitate to claim Social Security early"	"finance-retirement"
"0"	"A former royal bodyguard shared the challenges that come with protecting the royal family"	"newsoffbeat"
"0"	"Widow Sues Truth Aquatics Owner In Conception Boat Fire That Killed 34"	"newsus"
"0"	"Meteor streaks through the sky over St. Louis"	"weathertopstories"
"0"	"A birthday, a walk to school and a blast that tore an Afghan family apart"	"newsworld"
"0"	"A Nutella Hotel Is Opening in California"	"travelnews"
"0"	"Disney World Decorates The Parks With More Than 40,000 Items Overnight In Only 7 Hours"	"travelnews"
"0"	"12 Photos Show What It's Really Like To Grow Up Trans"	"lifestyleparenting"
"0"	"Ferrari's New Key Is Literally Just a Big Ferrari Badge"	"autosnews"
"0"	"Jilmar Ramos-Gomez, US citizen detained by ICE, to get $190K"	"newsus"
"0"	"White House to use webcams to create live feed of border wall construction"	"newsus"
"0"	"Nunes brands impeachment hearing 'low-rent, Ukrainian sequel' to Russia collusion"	"newspolitics"
"0"	"The 15 Longest Nonstop Flights in the World"	"traveltrivia"
"0"	"9 Best Beaches in Charleston"	"traveltripideas"
"1"	"What Kids Did a Decade Ago That They Don't Do Anymore"	"lifestyledidyouknow"
"0"	"Lebanon protesters angered by PM pick"	"newsworld"
"0"	"200 Shocking Home Photos You Have to See"	"lifestylehomeandgarden"
"0"	"Harry and Meghan Revive Feud Rumors By Staying Away From the Royal Family's Christmas"	"lifestyleroyals"
"0"	"Report: Carmelo Anthony returning to NBA with Trail Blazers"	"basketball_nba"
"0"	"I Never Imagined Being A Grandmother At 35. Here's How It Changed My Life."	"voices"
