"1"	"Hours before passing, Elijah Cummings signed subpoenas directed to two US immigration agencies"	"In one of his last official acts before his death, the late House Oversight and Reform Committee Chairman Elijah Cummings signed two subpoenas for documents related to a temporary end to a policy change that allowed some immigrants with severe health issues to remain in the US."
"1"	"France says foiled September 11-inspired attack"	"France's interior minister said on Thursday that intelligence services had arrested a man for planning an attack inspired by plane attacks on the World Trade Center in New York in Sept. 2001."
"1"	"Still working '9 to 5,' Dolly Parton marks 50 years at Opry"	"NASHVILLE, Tenn. (AP)   Country superstar Dolly Parton is still working "9 to 5," and doing what she loves as she celebrated her 50th anniversary as a Grand Ole Opry member. The 73-year-old actress, singer and songwriter, who first played the Opry when she was just a teenager, played the longstanding radio show Saturday night in Nashville, Tennessee, in front of sold-out crowds. Hank Williams Jr., Lady Antebellum and Toby Keith performed in her..."
"0"	"Kristen Bell's Cozy Look Is a Lesson in Winter Airport Fashion"	"Kristen Bell wore the coziest sweater dress, combat boots, and wool coat to the airport, and you can shop her outfit at Nordstrom."
"1"	"This Mom Had a Hilarious Response to a Man Who Told Her to 'Cover Up' While Breastfeeding in Public"	"She did exactly what he asked."
"1"	"Cornell student, 18, found dead in gorge after frat party, reports say"	"A top Ivy League student was found dead Saturday afternoon in a New York gorge after he left a fraternity party and disappeared Thursday night, according to reports."
"1"	"Police Arrest Motorcyclist Who Led High-Speed Chase And Went Home Thinking He Escaped"	"A motorcyclist was arrested after leading California Highway Patrol units on a high-speed chase in Placerville on Saturday."
"1"	"How the Waltons, America's wealthiest family and heirs to the Walmart empire, live their lives"	"The Walmart heirs own lavish homes and work with the Walton Family Foundation to give back to their community."
"1"	"Maria Fire broke out minutes after utility company re-energized high-voltage power line"	"Southern California Edison says it turned power back on minutes before the Maria Fire erupted nearby in Ventura County"
"1"	"Video Details Brazen Attack by Mexican Cartel on Government Forces"	"Mexico's security forces appeared unprepared during their botched arrest of El Chapo's son, no match for the violent backlash from the Sinaloa drug cartel intent on freeing Ovidio Guzmán from capture."
"1"	"The Average Retirement Age in Every State"	"See how your state stacks up in the retirement race"
"1"	"25 Iconic Motorcycles From the Past 125 Years"	"Legendary brands like Harley-Davidson, Honda, Indian, and Triumph have left indelible marks on motorcycle history with bold, powerful, aesthetically breathtaking bikes. See if any of your favorites are here and find out which manufacturers laid tracks before them."
"1"	"Man dies after becoming stuck on top of 290-foot tall smokestack"	"A man dangling from the top of a 290 foot smoke stack for more than six hours, apparently suspended only by his pants, died shortly after he was rescued by authorities."
"1"	"Trump's visit to Chicago creates stir before he even arrives"	"President Donald Trump's visit to Chicago is stirring up a tempest even before he arrives in the city that he's repeatedly derided as the poster child of urban violence and dysfunctional Democratic politics."
"0"	"The world's most profitable company is about to go public"	"The oil company that made Saudi Arabia rich is going public. Some say the timing couldn't be worse."
"1"	"This Masked Man Hands Out $100 Bills to Strangers"	"Dr. MooMoo dons a mask for a good cause."
"1"	"Florida needs python hunters. A man in Iran is one of thousands applying for the job"	"MIAMI - When Florida issued a call for python hunters, applications came in from near and very, very far - Iran, for instance, where one man sees a chance to fulfill his childhood dream. Mohammad Asghari is one of 2,600 applicants worldwide hoping to become a "python removal agent" with the South Florida Water Management District, an effort that aims to control the state's booming Burmese ..."
"1"	"Martin worries about amputation after breaking right leg"	"Casey Martin's worst fear was realized earlier this month when he stepped awkwardly off a curb and fractured his right tibia."
"1"	"TV reporter fired after climbing on cars live at auto show"	"He climbed atop a Ford Thunderbird and 2020 Explorer, and dinged the door of another T-bird"
"1"	"Tennessee State student found shot in dorm has died"	"NASHVILLE, Tenn. (AP)   Authorities say a 19-year-old Tennessee State University student found shot in a campus dorm has died. Citing a school statement, news outlets report the student was found unconscious in a residence hall walkway at about noon on Sunday. Metro Nashville police say the man was taken to a hospital where medical staff determined he had been shot in the abdomen. He was then transferred to another medical center, where he later..."
"1"	"Shale gas fracking wasted 'millions of taxpayers' cash', say scientists"	"Scientists say research on carbon capture was always better environmental option"
"1"	"Jumbo Tankers Make Drops to Quell 75,000-Acre Kincade Fire"	"A Boeing 747 tanker capable of dropping more than 18,000 gallons of fire retardant flew over the Kincade Fire on Tuesday, October 29, in hopes of quelling the roughly 75,000-acre blaze. The Kincade Fire, which has been burning for five days, had reportedly destroyed more than 120 structures, including 57 homes. An estimated 185,000 people were forced to evacuate in Sonoma County. The fire was only 15 per cent contained on Tuesday. Governor of California Gavin Newsom on Sunday declared a statewide emergency due to multiple fires burning across the state. Dangerous winds were predicted to sweep across Sonoma County, according to reports. Into Wednesday, wind speeds could ramp up to 40 to 50 miles per hour with gusts of up to 70 miles per hour "creating erratic fire behavior." Credit: calfireairops via Storyful"
"0"	"Drug trafficking through Venezuela has skyrocketed, says U.S. military chief"	"Drug trafficking through Venezuela has increased dramatically and constitutes a threat to the security of the region, said the admiral in charge of the U.S. Southern Command, Craig S. Faller, after opening remarks at a Caribbean Nations Security Conference in Miami on Thursday."
"1"	"Nevada gambling bosses move to bar Wynn from casino industry"	"The complaint filed Monday by the state's Gaming Control Board lists sexual misconduct allegations that have been lodged against the mogul since January 2018. The complaint asks Nevada's Gaming Commission, which acts on the board's recommendations and has final say on licensing, to fine Wynn and revoke his status as being found suitable to be licensed in the industry."
"1"	"'I feel bad that I left': John Kelly warned Trump he would be impeached"	"John Kelly warned President Trump that hiring a "yes man" to succeed him as White House chief of staff would lead to impeachment and, in hindsight, regrets his decision to resign."
"1"	"Man who inherited 6 figures shares advice he'd give his younger self"	"Brandon Neth inherited around $123,000 from his late father and grandfather when he was 20. He spent most of it on cars, clothes, and restaurants."
"1"	"Mystery Woman Kissing Singer Usher Identified As Record Exec"	"He is newly single."
"1"	"Eric Tse, 24, just became a billionaire overnight"	"A 24-year-old business school graduate has just become an overnight billionaire."
"1"	"Vanna White Says Wheel of Fortune Fans Helped Her Cope After Tragic Death of Her Fiancé"	"Vanna White Says Wheel of Fortune Fans Helped Her Cope With the Tragic Plane Crash Death of Her Fiancé"
"1"	"Here's how the Fed rate cut affects you"	"For consumers, lower rates do mean cheaper loans, but you'll earn less interest on savings accounts and maybe lose buying power over time."
"1"	"Pitchman Anthony Sullivan Opens Hemp Farm to Grow CBD for Daughter with Rare Disease"	"He needed to find a replacement for the powerful drugs his 8-year-old daughter had been taking."
"1"	"Every suspended 3 months for drug of abuse"	"Matt Every was suspended for 12 weeks Friday for what the PGA Tour said was a violation of its conduct policy on drugs of abuse."
"1"	"Reunited after decades apart, high school sweethearts wed at 80"	"The couple broke up 63 years ago in high school, but were reunited and rekindled their love affair years after they were both widowed."
"1"	"As U.S. Leaves Allies in Syria, Kurdish Commander Struggles With Fallout"	"QAMISHLI, Syria   As United States troops continued their withdrawal from Syria on Sunday, a line of cars carried their routed former allies, terrified civilians and dead bodies out of a pulverized border town that had been besieged by Turkish forces for more than a week."
"1"	"Hundreds arrested ahead of verdict on Indian holy site"	"Indian police have arrested more than 500 people ahead of a Supreme Court ruling on a hotly disputed religious site in the holy city of Ayodhya, media reports said, with authorities fearing the verdict could trigger unrest."
"1"	"Boy, 8, reels in world record tiger shark"	"An 8-year-old boy reeled in a fish of a lifetime, and it will be a smallfry world record, assuming the IGFA approves it."
"1"	"Hailey Baldwin Claps Back at 'Fake Christian' Halloween Comments"	"Hailey Baldwin Claps Back at 'Fake Christian' Halloween Comments"
"1"	"Homeowner says a mystery object damaged his house. It didn't fall from a plane, FAA says"	"Authorities including the Federal Aviation Administration have not been able to identify a canister-type object that damaged a Kentucky man's home."
"1"	"The 50 Best One-Hit Wonders of All Time"	"Not every successful artist stays successful. Here are the best one-hit wonders from the 1950s all the way through the 2000s."
"1"	"40 conservative groups sign ethics complaint against Pelosi"	"A coalition of conservative groups have filed an ethics complaint against Speaker Nancy Pelosi (D-Calif.), arguing among other charges that she has usurped authority from the executive branch by "weaponiz[ing]" the impeachment process.In a complaint to the Office of Congressional Ethics, 40 conservative groups led by Jenny Beth Martin of Tea Party Patriots Action wrote to board chairman David Skaggs arguing that a vote scheduled for this week..."
"1"	"Oddball, Orphaned, and Overlooked Trucks"	"Classic Trucks takes a look at the oddball, orphaned, and overlooked trucks that dare to be different."
"0"	"Prince Harry Talked to Another Royal About His Desire for Privacy"	"Prince Albert of Monaco shares the personal advice he gave Harry when they met this month."
"1"	"Man wearing 'Jesus Saves' race bib collapses, saved by man named Jesus"	"The 25-year-old runner's heart stopped beating during the race."
"0"	"Porzingis forgets which locker room to go to at Madison Square Garden"	"After the buzzer went off to end the second quarter, instincts kicked in for Kristaps Porzingis."
"0"	"Queen Elizabeth Just Rode Horseback at Age 93"	"The British monarch isn't letting a small thing like age keep her from living her life."
"1"	"Woman, 78, gets 22 years for attempted murder of lawyer"	"A 78-year-old Louisiana woman has been sentenced to 22 years in prison for trying to kill her attorney. Patricia Currie of Mandeville was 75 when she raised a loaded shotgun toward Keith Couture in 2016."
"1"	"The Difference Between Green and Orange Antifreeze"	"What's the difference between different colors of antifreeze? Should different colors of coolant be mixed? Find out here."
"1"	"Jeff Bezos is set to lose his crown as world's richest person"	"Jeff Bezos is about to relinquish the title of world's richest person to Bill Gates, as Amazon.com Inc. stock tumbled in late trading Thursday."
"1"	"Maleficent: Mistress of Evil delivers an empty, CG-dazzled fairytale"	"Review: Maleficent: Mistress of Evil delivers empty, CG-dazzled fairytale"
"1"	"Family of toddler swept away at Tennessee park files lawsuit"	"COOKEVILLE, Tenn. (AP)   The family of a 2-year-old who was washed away by floodwaters at a Tennessee state park has filed a lawsuit against the state. Steven Pierce of Kentucky died after he and his father were swept away in a flash flood as they tried to evacuate from Cummins Falls State Park in June. News outlets report the lawsuit filed this week argues a "series of human errors" contributed to his death. It says greater safety measures..."
"1"	"A Northeast storm is intensifying into a bomb cyclone, forecasters say"	"A bomb cyclone is taking shape along the Eastern Seaboard and starting to make itself felt in the Northeast."
"0"	"This custom Indian Scout Bobber is called the Hasty Flaming Buffalo"	"Designed by Luuc Muis, it won Indian Motorcycles' custom bike contest"
"0"	"THEN AND NOW: What all your favorite '90s stars are doing today"	"These heartthrobs and fan favorites made the 1990s one of the best decades of the century. Here's what they're up to now."
"0"	"All the times royals have met A-list celebs"	"See all the moments the British royal family rubbed elbows with Hollywood stars."
"1"	"The Little-Known Airplane Feature That Could Save Your Life"	"Remembering this tiny device could be a big deal!"
