"0"	"South Carolina teen gets life in prison for deadly elementary school shooting"	"Jesse Osborne, the teenager responsible for a shooting at a South Carolina elementary school in 2016, was sentenced to life in prison."
"1"	"Dog Throws A Total Tantrum When She Realizes Mom Wants To Take The Stairs"	"Aurora Angel Beste Nala has always been the friendliest dog, and loves going out on adventures and meeting new people."
"1"	"Egypt uncovers 'huge cache' of ancient sealed coffins"	"Archaeologists have discovered more than 20 wooden coffins at a necropolis in Luxor, according to Egypt's Ministry of Antiquities."
"1"	"History of gold and which countries have the most"	"Find out more about the history of gold in the United States and which countries have the largest gold reserves today. This ranked list comes from 2018 data from the International Monetary Fund."
"0"	"Prince Charles just turned 71   here are the best photos from every year of his royal career so far"	"Prince Charles, heir to the throne, celebrates his 71st birthday on Thursday. Here are all the best photos from every year of his career."
"1"	"El Niño weather events are about to become more extreme thanks to climate change, study says"	"El Niños are a natural warming of sea water in the tropical Pacific Ocean that fuel weather extremes in the U.S. and around the world."
"1"	"Man Reveals Big American Muscle Car Barn Find"	"These classic cars are definitely not in showroom condition."
"1"	"'Go back to work': Outcry over deaths on Amazon's warehouse floor"	"Billy Foister died last month after a heart attack at work. The incident was just one in a series of recent accidents and fatalities"
"1"	"North Korea Warns American 'War Exercise' Will Violate Trump's Vow to Kim, Put Nuclear Talks 'On the Verge of Extinction'"	"Pyongyang warned that the planned aerial drill will "throw a wet blanket" on struggling negotiations."
"1"	"Danica Patrick shared a sweet message congratulating Aaron Rodgers on perfect game"	"Like just about everyone else, Danica was pretty impressed by Aaron Rodgers' Week 7 performance."
"1"	"Bruce Willis brought Demi Moore to tears after reading her book"	"Demi wasn't sure how her ex would feel about her book until he called her."
"1"	"How Often Should You Change Synthetic Oil?"	"There's more than one answer, so let us simplify it for you, starting with outlining the advantages of synthetic oil."
"0"	"Methane emissions from coalmines could stoke climate crisis   study"	"Millions of tonnes belched into atmosphere as policymakers overlook threat, researchers find"
"1"	"Far from Vietnam's boomtowns, a rural region looks to Europe's distant shores for escape"	"For decades, since the height of the Cold War, young adults have left this rural region in droves   not for Vietnam's booming cities but for more distant shores."
"1"	"Plane collides with pickup truck while landing, pilot killed"	"Witnesses reported the airplane was at an altitude of just 5 feet as it crossed a county road near the airstrip and struck a pickup truck."
"1"	"20 Celebs Who Have Had Actual Ghost Encounters"	"Don't try and tell these stars that ghosts don't exist, because they've seen all the paranormal proof they need to believe"
"0"	"Here's What It Means If You Have Ridges on Your Nails"	"They don't make for the prettiest of manicures, but are they something more than a cosmetic problem?"
"1"	"100+ Funny White Elephant Gifts That'll Leave Everyone Laughing Hard This Holiday Season"	"The pressure is on!"
"1"	"Brazilian 'forest guardian' killed by illegal loggers in ambush"	"Paulo Paulino Guajajara was killed by armed loggers in the Araribóia region in Maranhão"
"1"	"How Elizabeth Warren could 'vaporize' America's oil boom"	"Elizabeth Warren doesn't just pose a threat to Wall Street. Her rising 2020 polling numbers are also striking fear in the heart of Big Oil."
"1"	"Holocaust survivor under guard amid death threats"	"Liliana Segre, 89, is assigned two police officers in Italy after hundreds of anti-Semitic messages."
"0"	"Sterling K. Brown Emotionally Recalls Seeing His Dad for the Last Time Before His Death"	"Sterling K. Brown Recalls Last Moment He Saw His Dad Alive"
"1"	"Florida woman allegedly flees 2 car crashes, kills driver in 3rd crash"	"A Florida woman who killed a 53-year-old man after running a red light and smashing into his Lexus on Saturday morning was in the process of fleeing two earlier car accidents when she caused the fatal collision, police said."
"1"	"'Ghost kitchens' are taking over fast-food chains from Chick-fil-A to Wendy's"	"Wendy's became the latest fast-food chain to name-check ghost kitchens on Friday at the company's investor day."
"1"	"Hong Kong protesters trash Xinhua agency office in night of violence"	"Hong Kong protesters trash Xinhua agency office in night of violence"
"1"	"Texas man claims he nearly died after vicious attack by 'psychotic' cow: report"	"A Texas man who claims he was almost killed by his "psychotic" cow several weeks ago reportedly says he plans to continue caring for her despite sustaining broken ribs and a punctured lung following the latest attack."
"0"	"30 Best Black Friday Deals from Costco"	"Costco members love shopping at the warehouse store, and they'll love shopping there for holiday gifts just as much."
"1"	"He had been homeless for decades. Then old friends saw his photo in a newspaper."	"Coy Featherston's former classmate canvassed Austin for four days until she found him feeding pigeons outside a church."
"1"	"China Is Leasing an Entire Pacific Island. Its Residents Are Shocked."	"SYDNEY, Australia   The island of Tulagi served as a South Pacific headquarters for Britain then Japan, and during World War II, its natural deepwater harbor made it a military gem. Now, China is moving in with plans to effectively take control. Under a secretive deal signed last month with a provincial government in the Solomon Islands, a Beijing-based company with close ties to the Chinese Communist Party has secured exclusive development..."
"1"	"Rescuers hunt man missing after livestreaming Mt Fuji climb"	"Rescuers in Japan are searching for a man who appears to have fallen down part of Mount Fuji as he was live-streaming his climb up the country's highest peak, police said Wednesday."
"1"	"This Woman Got a Tattoo That Says "It's Called Vitiligo" to Stop Rude Remarks About Her Skin Condition"	"Dionne Lees had enough bewildered stares and tactless questions to justify getting a tattoo that succinctly explains to onlookers why her skin is missing pigment in some areas."
"0"	"Opinion: Colin Kaepernick is about to get what he deserves: a chance"	"The end may be near for the 3-year-old saga of Colin Kaepernick as the quarterback is scheduled to work out for teams on Saturday."
"1"	"Subtle Signs You May Have Clogged Arteries"	"These surprising clues can point to clogged arteries and underlying heart disease."
"0"	"Photos from space reveal what climate change looks like, from melting Arctic ice to rampant California fires"	"Extreme weather events like hurricanes, droughts, and wildfires are linked to climate change. Such phenomena can be seen from space."
"1"	"Hong Kong's leader backs police use of force as protesters plan 'illegal' march"	"Hong Kong's leader backs police use of force as protesters plan 'illegal' march"
"1"	"Alaska mine could generate $1 billion a year: Is it worth the risk to salmon?"	"A brown bear loped across rolling green tundra as Charles Weimer set down a light, single-engine helicopter on a remote hilltop."
"1"	"Get an exclusive first look at Prince's intimate posthumous memoir"	"See exclusive photos from Prince's posthumous memoir The Beautiful Ones"
"0"	"Highway blockade reveals splits in Hong Kong protest movement"	"Highway blockade reveals splits in Hong Kong protest movement"
"1"	"Taylor Swift moved Selena Gomez to tears with her friendship"	"The Beatles said it best, "I get by with a little help from my friends.""
"1"	"Rand Paul Called Out at California Restaurant During Lunch: 'Not Putting Up With Your Republican Bulls**t'"	"A pair of New Yorkers ridiculed Kentucky GOP Senator Rand Paul in a California restaurant."
"1"	"Police identify 2 suspects in murder of Andre Emmett last month"	"Two men accused of killing former Texas Tech and NBA player Andre Emmett were identified by Dallas police on Monday, the Dallas Morning News reported."
"1"	"Former NBA first-round pick Jim Farmer arrested in sex sting operation"	"Farmer, 55, was booked for trafficking a person for a commercial sex act."
"1"	"Here are the 96 Sears and Kmart stores that are closing next"	"Going-out-of-business sales in the 96 stores slated to close will begin Dec. 2."
"1"	"This Is What Queen Elizabeth Is Doing About the Prince William-Prince Harry Feud"	"According to royal insiders, Queen Elizabeth has directed Prince Charles to put a stop to the feud between William and Harry. Here's why she's so worried."
"1"	"Gronkowski suggests that he'll unretire if NFL legalizes CBD"	"As the clock continues to tick toward the deadline for a 2019 return from tight end Rob Gronkowski, Gronk has hinted that he'll return in 2020   if the NFL makes one specific change to its rules. Via Stefan Geller of the Boston Herald, Gronkowski called on the NFL to permit players to use CBD, [more]"
"1"	"1 dead, 8 others hospitalized in Salmonella outbreak likely tied to ground beef"	"The CDC said the latest Salmonella outbreak is not tied to one type or brand of ground beef."
"1"	"See inside the 300-square-foot tent that a couple transformed into a tiny home for their family"	"The family has lived in the tent for two years. It runs on solar power and features two beds, a composting toilet, and an outdoor shower."
"1"	"Remains of Coast Guardsman who died in WWII camp come home"	"Lt. Thomas J.E. Crotty's capture during World War II made him the first Coast Guard prisoner of war since the War of 1812. With his burial in his hometown of Buffalo this weekend, he may end up being the last of the Coast Guard's missing service members to be repatriated, a Coast Guard historian said."
"1"	"Niagara Falls: Boat stuck on rocks 101 years dislodged"	"High winds and heavy rains dislodged the remains of a barge in the rapids above Niagara Falls that had been there 101 years."
"1"	"Richard Gere, 70, and Wife Alejandra Silva, 36, Expecting Baby No. 2"	"Richard Gere, 70, and Wife Alejandra Silva, 36, Expecting Baby No. 2"
"1"	"Mom-of-4 with Incurable Cancer, 45, Plans Her Death with Dignity: 'I Want to Die on My Own Terms'"	"Hanna Olivas, 45, is a mother of four. Since April, she has been working with the right-to-die advocacy group Compassion & Choices because she wants to die on her own terms."
"1"	"Search resumes for worker missing in New Orleans Hard Rock Hotel building site collapse that killed 2"	"Rescuers resumed searching Sunday for a worker trapped in rubble after a deadly construction collapse in New Orleans, officials said, but the building's instability is making for a precarious situation."
"1"	"Teen breaks into German prison in bid to win back jailed ex"	"A teenager has broken into a German prison in an attempt to win back his ex-girlfriend. Prison authorities in the northwestern town of Vechta told news agency dpa the 18-year-old scaled a 4-meter (13-foot) wall last week to get to his ex's window."
"1"	"She lived for 99 years with organs in all the wrong places and never knew it"	"Rose Marie Bentley had a condition called situs inversus with levocardia, in which most vital organs are reversed   almost like a mirror inside the body."
"1"	"Kevin Spacey Won't Be Charged in Sexual Assault Case After Accuser Dies"	"The Los Angeles County District Attorney's Office has formally dropped a case against actor Kevin Spacey, after the accuser died."
"1"	"70,000 California wildfire victims may miss out on payments"	"As many as 100,000 Californians are eligible to receive payments for the damages they suffered from a series of devastating wildfires over the last several years."
"1"	"Former Tennessee Gov. Bredesen introduces renewable energy firm"	"A new business venture by former Tennessee Gov. Phil Bredesen takes on global warming by helping companies fund solar panels."
"0"	"Growth in global oil demand more than doubled in the third quarter, IEA reveals"	"Global oil demand in the third quarter of 2019 grew by 1.1 million barrels a day, more than double the previous quarter, according to the IEA."
"1"	"10 of the best fast-food burger chains across the US"	"Fast-food spots like Shake Shack and In-N-Out sell fresh burgers that keep customers coming back for more."
"1"	"State Trooper Stops Banana Car Driver, Gives Him $20 Instead of a Ticket"	"Is it a crime to be this ridiculous? Not in Kalamazoo, Michigan, where a 1993 Ford F-150 4x4 was turned into . . . this."
"1"	"Vanderbilt Children's Hospital CEO Luke Gregory dies at 63 after battling lymphoma"	"Luke Gregory oversaw a period of rapid growth at the Nashville hospital during his 8-year tenure."
"1"	"Soldier wounded searching for Bergdahl dies"	"Allen's unit was ambushed when they were looking for Bergdahl after he deserted his base in 2009"
"1"	"Rare Vixen Motorhome For Sale Is One Of Nicest We've Seen"	"One of about just 300 made."
"1"	"McDonald's apologizes for 'Sundae Bloody Sundae' Halloween promotion"	"McDonald's has canceled a promotion for a "Sundae Bloody Sundae" ice cream that was available in Portugal for Halloween."
"1"	"Opinion: A key tool to fighting the opioid crisis is in short supply"	"Naloxone can be administered by anyone trained to do so assuming, that is, someone has it on hand at the scene of the overdose."
"1"	"The Permian Basin is facing its biggest threat yet"	"Investors are tiring of America's fracking revolution."
"1"	"Freshman finds 1966 calendar behind shelf in dorm room"	"University of Tennessee student Alex Anastasi finds 1966 UT calendar hidden behind a shelf in her Reese Hall dorm room."
"1"	"Man Reunited With 310-Year-Old Violin After It Was Left on a Train"	"Stephen Morris could take a sigh of relief, when he was reunited with his 310-year-old violin on Friday night."
"1"	"Trio charged with first-degree homicide in weekend Springfield killing"	"According to Springfield Police Department Chief Jason Head, the killing was reported Sunday morning on Woodland Street."
"1"	"Two dead in Texas after helicopters collide while herding deer"	"Two people are dead and one injured after a pair of helicopters collided while herding deer over a ranch in south Texas on Wednesday, according to officials."
"1"	"K-9 Officer Tracked Down Missing 85-Year-Old Woman With Dementia Who'd Fallen Into a Ravine"	"The elderly woman had wandered away from her son's New Jersey home, police said."
"1"	"2 reported dead after plane that vanished from radar and crashed in North Carolina"	"Authorities in North Carolina have found the small plane that vanished from radar near the Raleigh-Durham International Airport on Sunday night -- two are reported dead."
"0"	"The Coolest Way to See NYC Is in a Vintage Car From the Roaring '20s on This Midtown Tour"	"A new tour company called Nowaday, in New York City, will take you around in a restored, vintage car."
"1"	"Disappeared in El Salvador: The return of a Cold War nightmare"	"The Central American nation is now a democracy. Why are disappearances soaring?"
"1"	"A man dies in Hawaii after falling into a lava tube in his yard"	"An elderly man died after falling into a lava tube on his property in Hilo, Hawaii, police announced on Wednesday."
"1"	"Surfing executive sentenced to prison in college admissions scam"	"Federal prosecutors in Boston said Wednesday that surfing executive Jeffrey Bizzack has been sentenced to two months in prison for participating in the massive college admissions scheme."
"1"	"Heidi Klum's 2019 Halloween Costume Transformation Is Mind-Blowing   But, Like, What Is It?"	"You might say she's scary good at playing dress-up, because Heidi Klum's 2019 Halloween costume is even more impressive than we could have imagined   and that's saying a lot, considering transformative Halloween costumes are kind of her thing. But this year Klum took it up one more notch as she shared her metamorphosis into,"
"0"	"Deere workers grapple with fallout from Trump's trade war"	"Deere workers grapple with fallout from Trump's trade war"
"1"	"Gretchen Wilson booted from New Mexico hotel"	"Gretchen Wilson railed against the hotel after getting kicked out for noise."
"1"	"My Father's Battle With Alzheimer's Revealed an Unsettling Truth About His Life"	"After her father is diagnosed with Alzheimer's disease, Sascha Rothchild finds a man consumed by secrets."
"1"	"Four-metre king cobra wrestled from sewer in Thailand"	"A feisty four-metre (13-foot) king cobra was pulled from a sewer in southern Thailand in an hour-long operation, a rescue foundation said Tuesday, describing the reptile as one of the largest they had ever captured. Kritkamon said the snake was more than four metres long, weighed 15 kilos (33 pounds), and was the third-largest they had found."
"1"	"TobyMac says late son 'had an untamable grand personality,' shares last text exchange"	"TobyMac's 21-year-old son, Truett Foster McKeean, died Wednesday in Nashville. The Christian star released a statement Thursday on the sudden death."
"0"	"High tides surge through Venice, locals rush to protect art"	"Exceptionally high tidal waters surged through Venice again on Friday, prompting the mayor to close St. Mark's Square and call for more donations for repairs just three days after the Italian lagoon city suffered its worst flooding in 50 years."
"0"	"The latest on Brad Pitt and Angelina Jolie's post-split relationship, plus more news"	"Brad Pitt reportedly wants to see his kids more than Angelina Jolie has made possible. Plus, more celebrity news for Nov. 14, 2019."
"0"	"VW ID.3 Electric Motor Is So Compact That Fits In A Sports Bag"	"From 2023 on, Volkswagen intends to produce 1.4 million of similar electric drive units annually."
"1"	"Dog The Bounty Hunter Is Cutting Out White Foods After His Recent Health Scare"	"Dog   real name Duane Chapman   is taking steps to make sure he's not part of the 15% of people diagnosed with pulmonary embolism who die as a result of it."
"1"	"A couple's attempt to re-create a picture-perfect engagement photo with a bottle of Champagne totally backfired, but the result is going viral"	"Alyssa Snodsmith, 24, and Collin Hewett, 23, shared their failed attempt to recreate a Pinterest picture for their engagement photo."
"1"	"Armed Man Wearing Body Armor Arrested At Dallas Trump Rally"	"Dallas police arrested an armed adult male wearing body armor at Trump's Keep America Great rally Thursday night."
"1"	"Pirates kidnap nine crew members from cargo ship off coast of Benin"	"Pirates boarded a shipping vessel and kidnapped nine crew members off the coast of Benin in West Africa early Saturday morning, according to J.J. Ugland, the Norwegian shipping company which owns the vessel."
"1"	"Former NFL lineman Justin Bannan arrested for attempted murder"	"Former NFL defensive lineman Justin Bannan is sitting in a Colorado jail, on charges of suspicion of attempted first-degree murder."
"0"	"The 30 best shows of Comedy Central's 30 years"	"Comedy Central has been on the air now for 30 years. Since Nov. 15, 1989   when it was The Comedy Channel   it has been the go-to network for comedy, from original programming and movies to favorites and cult classics in syndication."
"0"	"'National tragedy': Surveillance, staffing under review after deaths at VA hospital"	"After 10 patients died in a suspected serial killing case at a West Virginia VA hospital, the agency is reviewing surveillance and staffing protocols."
"1"	"Son wears hot dog costume for school picture day after parents' dare"	"A fourth-grader dressed up as a hotdog after his parents dared him to and the picture of his student ID quickly made him an internet sensation."
"1"	"The Latest: Powerful typhoon makes landfall in Japan"	"TOKYO (AP)   The Latest on Typhoon Hagibis (all times local): 7:30 p.m. A heavy downpour and strong winds are pounding Tokyo and surrounding areas as a powerful typhoon forecast to be Japan's worst in six decades made landfall southwest of Tokyo. Streets, beaches and train stations remained deserted Saturday, and store shelves were bare after people stocked up on water and food ahead of Typhoon Hagibis."
"1"	"Fact Checker: Trump's shiny new talking point about income growth"	"The president is touting numbers that favorably compare his record to Obama and Bush, but he's cherry-picking the data."
"1"	"Road built by biblical villain uncovered in Jerusalem"	"A long-buried street that led pilgrims to the Jewish Temple 2,000 years ago was commissioned by Roman governor Pontius Pilate."
"1"	"World's largest treehouse burns to the ground"	"The entire structure collapsed in less than 15 minutes"
"1"	"Jimmy Carter hospitalized after fall at Georgia home"	"Spokeswoman says former President Jimmy Carter hospitalized with a pelvic fracture after falling his home."
"1"	"Wayne Newton's house burglar sentenced to 22 years in prison"	"Wayne Newton now sleeps with a gun on his nightstand due to the burglary."
"1"	"Missouri man missing for a week found alive in car that crashed into ravine"	"Ryan Linneman, of Lee's Summit, was found by a dirt bike rider in wreckage along Interstate 470 in Kansas City, Lee's Summit police said."
"1"	"Stars we lost in 2019"	"These are the stars we lost this year."
"1"	"Jane Fonda Arrested While Protesting in D.C."	"The actress was demonstrating on the Capitol with the group Oil Change International."
"1"	"Photo of emotional nurse after 'particularly hard day' goes viral"	"Her sister revealed that she had just wrapped up four days worth of work that included assisting in the delivery of a stillborn baby."
"1"	"Jessica Simpson and 25 More Celebs Who Got Richer From Their Second Jobs"	"See which stars made very lucrative career switches."
"1"	"One Man Has Owned This 1964 Shelby Cobra for 50 Years"	"Bill Gise was thrilled to buy this 1964 Shelby Cobra half a century ago and his enthusiasm for it hasn't diminished a bit in the intervening years."
"1"	"Rescuers find body on Japan's Mount Fuji after searching for mountaineer who fell during livestream"	"A climber in Japan who appeared to fall while livestreaming his ascent of Mount Fuji may have been found after searchers recovered a body Wednesday, authorities said."
"1"	"'Tarzan' Actor Ron Ely: Actor's son allegedly killed his mother before deputies shot and killed him, sheriff's office says"	"The son of "Tarzan" actor Ron Ely killed his mother before he was shot and killed by deputies on Tuesday, according to the Santa Barbara County Sheriff's Office."
"1"	"Hulk Hogan's jet grounded after 'melted' brakes, blown tires"	"Hulk was headed to Saudi Arabia, but had a pit stop in Iceland."
"1"	"This luxurious tiny home on wheels was built for off-road vacations"	"The Opus 15 is a hybrid steel trailer with off-roading capabilities. It comes with an outdoor kitchen and three separate beds."
"0"	"Jennifer Nettles sparks further conversation about gender inequality in country radio play"	"At Wednesday night's Country Music Awards red carpet, Jennifer Nettles wore a message calling for equal radio play for women in country. The outfit is bringing another conversation about gender inequality in radio play and how it effects women breaking into the business. Up-and-coming singer Candi Carpenter has long been inspired by a great woman of country. You know the one. "I'm obsessed with Dolly Parton," said Carpenter. "Dolly always says...""
"1"	"The world's largest nuclear power producer is melting down"	"On the shores of the English channel in Normandy, engineers are struggling to fix eight faulty welds at a plant that's supposed to showcase France's savoir faire in nuclear power."
"1"	"Chinese ship leaves Vietnam's waters after disputed South China Sea surveys"	"A Chinese oil survey vessel that has been embroiled in a tense standoff with Vietnamese vessels in the South China Sea left Vietnamese-controlled waters on Thursday after more than three months, marine data showed."
"0"	"50 Things Popular Restaurant Chains Don't Want You to Know"	"You'll want to be aware of these restaurant secrets next time you go out to eat. (For example, you really don't have to ask for unsalted fries.)"
"1"	"Inside the world's largest plane, which has a wingspan longer than a football field and a mysterious new owner"	"The Stratolaunch is 238 feet long, 50 feet tall, and has a 385-foot wingspan. It made its first flight in April."
"1"	"Eliud Kipchoge runs 1:59 marathon, first to break 2 hours"	"Eliud Kipchoge became the first man to break two hours in a marathon in a non-record-eligible event."
"1"	"Man killed in canoeing accident on Tennessee River"	"SCOTTSBORO, Ala. (AP)   Authorities say a Tennessee man died when his canoe capsized on an Alabama river. News outlets report that the accident occurred Friday evening near Scottsboro on the Tennessee River. The Alabama Law Enforcement Agency says 51-year-old Gregory Lawson from Hixon, Tennessee was killed when the canoe capsized. A woman with Lawson was able to swim to shore for help. State authorities said Saturday that the incident remains..."
"1"	"Everyday heroes step up to help lone Waffle House employee"	"Sometimes you just have to be the change you wish to see in a Waffle House."
"1"	"Gold Suffers Worst Week in Two Years as Bulls Run for Cover"	"Gold headed for the biggest weekly loss in more than two years as progress in U.S-China trade talks hammered demand for havens."
"1"	"35 CEOs who never finished college"	"These CEOs forged their own unique career paths, from fashion leaders to tech magnates."
"0"	"9 renovation tips to boost resale value"	"Making the right renovation decisions can help you sell your house quicker, and for more money."
