"0"	"Supreme Court Appears Ready to Let Trump End DACA Program"	"WASHINGTON   The Supreme Court's conservative majority appeared ready on Tuesday to side with the Trump administration in its efforts to shut down a program protecting about 700,000 young undocumented immigrants known as Dreamers. The court's liberal justices probed the administration's justifications for ending the program, expressing skepticism about its rationales for doing so. But other justices, including President Trump's two appointees,..."
"0"	"Disney+: All the Original TV Shows and Movies Set for Streaming Platform (Photos)"	"Direct-to-consumer offering will house programming from Marvel Studios, Pixar and Lucasfilm"
"0"	"Analysis: Only 3 Senate Republicans aren't defending Trump from the impeachment inquiry. Here's why."	"Mitt Romney, Susan Collins and Lisa Murkowski have refused to sign a resolution denouncing the House Democratic effort."
"1"	"Eminem Says He Sides With Chris Brown Over Rihanna Assault on Alleged Leaked Song"	"Leaked audio of Eminem allegedly rapping that he'd side with Chris Brown over Rihanna assault is making rounds on social media and fans are not happy."
"1"	"Meet Angela Kelly, the Queen's Personal Wardrobe Advisor"	"Kelly is responsible for maintaining, curating, and designing the Queen's wardrobe."
"0"	"What Happens To Your Brain And Body When You're Stressed About Money"	"Americans are stressed out. And, in many cases, money is the top cause of that stress."
"0"	"Obamacare early sign-ups plunge as Trump-backed lawsuit challenges constitutionality"	"ACA open enrollment began Nov. 1 and will run until Dec. 15 for most states."
"0"	"Simple Solutions to Help You Get Rid of Ants for Good"	"Kick pesky ants out of your house and back to their colony with these easy, expert-approved tricks."
"1"	"Nearly $400M worth of cocaine and marijuana intercepted by US Coast Guard"	"The U.S. Coast Guard announced that it seized nearly $367 million of cocaine and about 11,000 pounds of marijuana worth an estimated $10.1 million at a Florida port."
"0"	"The Latest Weight Loss Pills That Work And the Ones That Don't"	"When diet and exercise aren't working, the answer may be at the drugstore."
"1"	"'Batwoman' star Ruby Rose says she was misdiagnosed while battling depression"	"Actress Ruby Rose is sharing her journey with depression, saying she's struggled with a series of mental health issues her entire life."
"1"	"Celebrity Halloween costume fails"	"Check out the stars' biggest Halloween costume fails."
"0"	"Stella McCartney Deleted a Meghan Markle Instagram Post After Followers Called Her Out"	"Stella McCartney deleted a photo of Meghan Markle on Remembrance Day following backlash from Instagram followers."
"0"	"The 21 most iconic CMA Awards performances"	"The artists might attend the Country Music Association Awards to score trophies, but fans are watching for one thing: the performances. Every year country music's brightest stars are at their musical best with incredible performances that range from tear-jerking to over-the-top glamorous."
"0"	"A woman was found dead with an ax in her head. 37 years later, her husband faces charges"	"James Krauseneck Jr. appeared in state Supreme Court Friday, accompanied by his daughter Sara, who was a toddler at the time of the killing."
"1"	"Meghan and Harry to take 'family time' off, says royal source"	"The Duke and Duchess of Sussex will take a break from royal duties towards the end of the year, dividing their time between the US and the UK."
"1"	"Paris Jackson Flashes Peace Sign After Hanging With Gwyneth Paltrow"	"she had a good night"
"0"	"Robert Kraft reportedly told Rob Gronkowski he wants him to come back before season's end"	"If Gronkowski decides to return, it would have to be by Nov. 30, one day before the Patriots' Week 13 game against the Texans."
"0"	"Everyday heroes step up to help lone Waffle House employee"	"Sometimes you just have to be the change you wish to see in a Waffle House."
"0"	"New findings parents need to know about screen time and kids"	"New research finds screen use can affect cognitive and language development and more in child development."
"0"	"I spent a day in Astoria, Queens, and saw why it's one of the world's coolest neighborhoods"	"I spent the day eating and walking around Astoria, Queens, to understand what all the hype is about   and left with a big smile and full stomach."
"0"	"Facing lawsuit, DeVos erases student loans for 1,500"	"Education Secretary Betsy DeVos on Friday said she will forgive loans for more than 1,500 borrowers who attended a pair of for-profit colleges that shut down last year."
"1"	"Vanna White hosts 'Wheel of Fortune' after Sajak has surgery"	"LOS ANGELES (AP)   "Wheel of Fortune" host Pat Sajak had to have emergency surgery, and his longtime co-host Vanna White will fill in for him while he recovers. The show said in a statement that Thursday's taping was canceled as the 73-year-old Sajak underwent successful surgery to correct a blocked intestine. The 62-year-old White stepped in as host when taping resumed Friday for episodes that will air starting Dec. 9."
"1"	"McDonald's Fires CEO Steve Easterbrook After Relationship With Employee"	"Steve Easterbrook has been fired as chief executive of McDonald's, the fast-food chain announced on Sunday, after he engaged in a consensual relationship with an employee that violated company policy."
"0"	"'I Have Waited 68 Years to See This': How Honor Flights Help Veterans Reflect"	"In 2004, shortly after the national World War II Memorial was completed, Earl Morse, a retired Air Force captain working at the Department of Veterans Affairs clinic in Springfield, Ohio, realized that many of the veterans he knew would never get to see it. So he persuaded pilots at his local flying club to ferry a handful of veterans to Washington on small planes, and accompany them to the National Mall."
"1"	"​20 Funny Things People in the 1970s Were Totally Guilty of Doing"	"Here are 25 things that we all thought were perfectly acceptable back in the 70s that most of us wouldn't even dream of doing today."
"1"	"GOP senator defends calling Pelosi 'dumb': 'What I said was accurate'"	"Sen. John Kennedy (R-La.) defended remarks this week in which he called Speaker Nancy Pelosi (D-Calif.) "dumb," saying that his comments were "accurate.""
"1"	"Police: Woman found dead behind Cincinnati school was wanted in Alabama robbery"	"A woman found dead near a Cincinnati high school has been identified as 18-year-old Baylee Wall, according to police in Daphne, Alabama. Wall was one of two suspects wanted in connection with an Oct. 21 hotel robbery in Daphne, a small city in the southwest part of the state near Mobile. According to authorities, Wall's alleged accomplice in the robbery, 25-year-old Gary Eubanks Jr., is still on the run. Officials say the pair robbed the..."
"0"	"French Baguettes From a Vending Machine? 'What a Tragedy.'"	"The lights inside the village bakery used to come on before dawn, an hour or so before the smell of baking bread would waft into neighbors' homes. The storefront door would soon be heard, opening and closing, the rhythm as predictable as the life stirring awake across the French countryside. But everything changes."
"0"	"Supreme Court Justices Couldn't Stop Interrupting Each Other During DACA Oral Arguments"	"The first interruptions came just minutes into the start of proceedings."
"0"	"Graham on the impeachment inquiry: 'I made my mind up. There's nothing there'"	"Sen. Lindsey Graham (R-S.C.) doubled down on his defense of President Trump amid the ongoing impeachment inquiry, arguing there's "nothing there" in the call between Trump and Ukrainian leaders to suggest the president did anything wrong. "You make your mind up about the phone call. I made my mind up. There's nothing there," Graham said in an interview Saturday with KCCI, a Des Moines CBS affiliate. "I'm trying to let the House know, 'You're...""
"0"	"A teen received a response to a message in a bottle he wrote 9 years ago after it traveled over 3,000 miles"	"The bottle, which was placed into the ocean on a beach in Rockport, Massachusetts, was found off the coast of France."
"1"	"Coast Guard searches for man who fell from cruise off Texas"	"The U.S. Coast Guard late Thursday said it was searching for a man who plunged into the Gulf of Mexico while the ship was about 47 miles off the coast of Galveston, Texas."
"1"	"See all the best photos of Prince William and Duchess Kate's royal tour of Pakistan"	"In October 2019, the Duke and Duchess of Cambridge traveled to the country once famously visited by the late Princess Diana."
"0"	"How To Avoid These 14 Home Renovation Horror Stories"	"Creating your dream home? Avoid these costly nightmares."
"1"	"Firemen totally nailed how to help this little girl stay calm after a car crash"	"Two northern California firefighters nailed the best way to help keep a little girl calm after a car crash."
"0"	"Florida woman set boyfriend's house on fire after catching him cheating: report"	"A Florida woman started a fire in her boyfriend's home after she caught him cheating on her with another woman, the Pensacola News Journal reported. According to the report, 47-year-old Pensacola resident Tyetha Moore was arrested and charged with first-degree arson after using gasoline to set her boyfriend's house on fire. The fire was reported at an unoccupied residence around 9 ..."
"0"	"THEN AND NOW: What all your favorite '90s stars are doing today"	"These heartthrobs and fan favorites made the 1990s one of the best decades of the century. Here's what they're up to now."
"0"	"Is it really easier for men to lose weight? Experts explain"	"There are reasons men and women lose weight differently   and it starts with puberty."
"1"	"Stephen Curry calls out Michael Jordan for being a 'hater'"	"While the opinion of arguably the greatest NBA player of all time is certainly noteworthy, most people disagree with Jordan."
"0"	"13 Ways You're Shortening the Life of Your Car"	"Put the brakes on these all-too-common mistakes to help keep your car on the road and out of the shop."
"0"	"105 Most Popular Sodas Ranked by How Toxic They Are"	"From classics like Coke and A&W to cult favorites, we reveal which soda is worst for your health."
"0"	"What It Was Like Inside the Homes of the Pilgrims"	"There's a lot of folklore surrounding the first Thanksgiving, and plenty of lively debate. When did it actually occur? Was this meeting with the Wampanoags truly amicable? Did they really eat turkey? Despite, or perhaps because of, this murky history, we continue to be fascinated with the Pilgrims and life in 17th-century America. While we all learned about the Mayflower, the Pilgrims, and that first Thanksgiving way back in elementary school, what do we really know about the day-to-day lives of these English settlers? Here are a few things that may surprise you about home life in early America."
"0"	"4 reasons you shouldn't max out your 401(k)"	"Making high-dollar contributions to your 401(k) can cost you."
"0"	"How to Turn Getting Kicked Off an Overbooked Flight Into a Payday"	"Overbooked flights and people being kicked out are now a common headline. Luckily, there are some ways you can be compensated for this. Veuer's Johana Restrepo has more."
"0"	"Nurse takes in man with autism so he can get a new heart"	"You can't get on the transplant list if you don't have a home or some kind of support system to help you post-surgery"
"1"	"The royal family refuses to watch 'The Crown' because it's too close to reality, according to a royal biographer"	"The third season of "The Crown" will premiere on Netflix on November 17 with Olivia Colman playing the Queen."
"0"	"The Best Backstage Moments From the 2019 E! People's Choice Awards"	"Check out Kevin Hart, Adam Sandler, Gwen Stefani and more backstage during the 2019 PCAs."
"1"	"What Tom Brady, Lamar Jackson Told Each Other After Patriots-Ravens"	"Tom Brady offered credit where it was due Sunday night in Baltimore. The Ravens handed Brady and the Patriots their first loss of the season in Week at M amp T Bank Stadium. The primetime"
"1"	"Meghan Markle's Lawyers Debunk Multiple False Tabloid Stories in New Court Documents"	"False, divisive, and completely untrue."
"1"	"Meghan Markle Says That Archie Has Two Teeth and Is Crawling"	"The cutest? Or the cutest ever?"
"1"	"Heidi Klum's 2019 Halloween Costume Transformation Is Mind-Blowing   But, Like, What Is It?"	"You might say she's scary good at playing dress-up, because Heidi Klum's 2019 Halloween costume is even more impressive than we could have imagined   and that's saying a lot, considering transformative Halloween costumes are kind of her thing. But this year Klum took it up one more notch as she shared her metamorphosis into,"
"1"	"Jussie Smollett fails to persuade judge to drop Chicago lawsuit seeking $130,000 fine"	"Jussie Smollett failed to persuade a federal judge to dismiss a civil suit by city seeking $130,000 for wasting police time."
"0"	"Here's the Best Small Town in Every State"	"From Los Alamos, California, to Shelter Island, New York, these are the best small towns INSIDER found in every state."
"1"	"Meteor streaks through the sky over St. Louis"	"Hundreds reported seeing a bright flash of light across the sky in at least two counties"
"1"	"Ohio voters express angst over impeachment"	"Support for impeachment may be on the rise, but the view from central Ohio is strikingly complicated and nuanced."
"0"	"Ree Drummond Says a Low-Carb Diet Is the Secret to Her Incredible Weight Loss"	"The Pioneer Woman's new cookbook is out now!"
"0"	"America's Most and Least Popular Senators"	"Senators represent the interests of the residents of their home state on Capitol Hill by crafting and voting on new laws and by approving or rejecting cabinet and judicial nominations made by the president."
"1"	"Nestor makes landfall on Florida island, heads north"	"TALLAHASSEE, Fla. (AP)   Nestor made landfall Saturday as a post-tropical cyclone after the former tropical storm spawned a tornado that damaged homes and a school in central Florida but spared an area of the Panhandle devastated one year ago by Hurricane Michael. The storm made landfall on St. Vincent Island, a nature preserve just off Florida's northern Gulf Coast in a lightly populated area of the state, the National Hurricane Center said...."
"0"	"There's a place in the US where its been over 80 degrees since March"	"The Weather Service reports the last time the daily high was below 80 degrees was on March 27 when the high only reached 78 degrees -- which, let's be honest, is still pretty warm."
"0"	"65 Best Fall Soups That Will Warm You and Your Family Up All Season Long"	"These hearty bowls are the perfect companion for a rainy fall night."
"1"	"Soldier wounded searching for Bergdahl dies"	"Allen's unit was ambushed when they were looking for Bergdahl after he deserted his base in 2009"
"0"	"Here's how social media tricks you into overspending"	"How social media causes overspend"
"1"	"Are Democrats Willing to Pay More in Taxes for Medicare for All?"	"Senator Elizabeth Warren has surged to the front of the Democratic pack by promising "big, structural change"   including a "Medicare for all" program that would bring health insurance to all Americans and eliminate private coverage. But at Tuesday's presidential debate, she again refused to say..."
"0"	"19 Home Renovations That Give Owners the Most Joy"	"These home upgrades score highly based on how happy homeowners are with them."
"1"	"Fearsome Sight: Bees Move Into Lion Statue in Perth"	"There aren't many things that are scarier than a lion. But a lion "packed full of bees" would definitely be on the list. Rihan Hoglin, of Hoglin Honey Bees, posted this video to Instagram after he and his team collected the statue from a property in Manning, a suburb of Perth, Western Australia, on October 21. The caption said, "You don't come across this every day … a lion statue packed full of bees. Wouldn't this be an awesome antitheft deterrent sitting in front of your house?" Hoglin told Storyful that he and his team had been called to remove the bees from the garden decoration by its 75-year-old owner, who happened to be "highly allergic to bee stings." The statue meant a great deal to its owner because it was a gift from her late grandson, Hoglin said. Hoglin Honey Bees removed the bees from the statue free of charge as a gesture of kindness. Credit: Hoglin Honey Bees via Storyful"
"1"	"Author Jennine Capó Crucet responds after white college students burn her book"	"Jennine Capó Crucet spoke about her book and white privilege at Georgia Southern University followed by a discussion with students and later saw some burned her book."
"1"	"Chicken recall: More than 2 million pounds recalled, may be contaminated with metal"	"Simmons Prepared Foods, Inc., based in Arkansas, is recalling more than 2 million pounds of its ready-to-cook chicken products, the USDA announced."
"1"	"Meghan Markle earns Duchess Camilla's support, royal expert says"	"Camilla, Duchess of Cornwall, has been a "pillar of support" to Meghan Markle after the Duchess of Sussex admitted in a shocking documentary that the ruthless press scrutiny meant she was "existing, not living.""
"0"	"60+ Restaurants Where Veterans Eat for Free on Veterans Day This Year"	"Active military and veterans can score free donuts, burgers, pizza and more with their military ID."
"1"	"Princess Charlotte Looks Identical to Her Cousin Lady Kitty Spencer as a Kid"	"Princess Charlotte may get her sassy attitude from her uncle Prince Harry, but her looks come directly from her cousin Lady Kitty Spencer."
"0"	"Republicans attempt to move impeachment inquiry away from Trump"	"A list of witnesses demanded Saturday fits a pattern for GOP lawmakers, who have focused heavily on pushing various conspiracy theories and attacking Democrats as unfairly partisan."
"0"	"Selena Gomez and Julia Michaels Share a Kiss Before Getting Matching Arrow Tattoos"	"Selena Gomez and Julia Michaels Get Matching Arrow Tattoos"
"1"	"Patrick Mahomes' injury comes at worst possible time for Chiefs"	"Even in if Patrick Mahomes misses only three weeks, his injury is a major blow for a snake-bitten, small-market team, Sam Robinson writes."
"1"	"Nationals pitcher criticized for missing playoff game for daughter's birth"	"Daniel Hudson said his family is his "top priority" after receiving criticism for missing a playoff game for the birth of his daughter."
"0"	"The Last Days of Legal Cockfighting in Puerto Rico"	"Hiram Figueroa rears roosters to fight, a Puerto Rican tradition from the time of the Spanish colonists that he learned as a teenager half a century ago and later taught his son. Together, they exercise their birds, clip their feathers and give them delicate sponge baths."
"1"	"The Infertility Secret I Kept From My Mother"	"Although I've always enjoyed almost sitcom-level chumminess with my mother, I've also always kept certain things secret from her. Total transparency does neither a mother nor a daughter any favors, which is why, when I was in high school, I kept my cigarettes hidden in a shoebox and threw away underwhelming report cards before she could see them. Later, after I'd moved out of the house, I continued to bury select items deep in my closet before..."
"1"	"Kamala Harris to Trump Jr: 'You wouldn't know a joke if one raised you'"	"The 2020 democratic hopeful was responding to the President's son calling her "The most disingenuous person in politics, after Hillary" for laughing at her own jokes"
"0"	"The Volkspod VW Beetle Minibikes Are Part Creepy, Part Adorable"	"The people's pods."
"0"	"Indian court gives disputed religious site to Hindus"	"India's Supreme Court is due to rule on Saturday on the ownership of a centuries-old religious site claimed by both majority Hindus and Muslims, a dispute that has cast a shadow of suspicion over the two communities for decades."
"0"	"Instagram-famous pilot reveals secrets people don't know about the job"	"Maria Fagerström, a pilot and Instagram influencer, shared some things passengers don't usually know about the job."
"0"	"Cheering crowds greet Japan's new emperor in rare parade"	"Thousands of people gathered in Tokyo on Sunday ahead of a rare open-top car parade featuring newly enthroned Emperor Naruhito and Empress Masako, with heavy security in place for the event."
"0"	"Child porn sting arrests 17, including two Disney employees"	""Each one of these arrests has removed a predator from our streets, and the internet," Polk County Sheriff Grady Judd said in a statement."
"1"	"Car of Marine linked to Virginia slaying is found in South Carolina, authorities say"	"A car belonging to a U.S. Marine who allegedly deserted his post last month in North Carolina -- and has been on the run since being accused of murdering his mother's boyfriend in Virginia -- has been located in South Carolina, authorities said Wednesday."
"0"	"100 vintage baby names coming back into style"	"Stacker looks at 100 vintage baby names coming back into style along with their origins and some of the more popular bearers of that name. The Bible, literature, and royalty are just a few sources for these vintage names."
"0"	"Report: Red Sox manager Alex Cora, Mets' Carlos Beltrán implicated in Astros sign-stealing scheme"	"On Tuesday, The Athletic reported that the Houston Astros engaged in an elaborate sign-stealing scheme that involved cameras, electronic transmissions and trash cans during their 2017 World Series run."
"1"	"Northern Michigan father of 7 wins $80M Powerball jackpot"	"Phillip Chippewa, 54, of Suttons Bay matched the winning Powerball numbers drawn Sept. 21."
"1"	"Family of woman missing since 2006 refocuses search after new tip"	"Orange County police searched Fischer Lake in West Orange County, but did not find anything."
"1"	"72 hours after PG&E outages began, nearly all customers have their lights back on"	"Nearly 72 hours after Pacific Gas and Electric Co. began a mass power cut-off in California that officials warned could last up to seven days, nearly all affected customers had their energy restored. On Friday night, PG&E said it had restored power to 98 percent of the 738,000 customer accounts in Central and Northern California that had lost it. In the Bay Area, 99 percent of customers had the lights back on. That left approximately 21,000..."
"1"	"New York Senator Chuck Schumer Mocks Trump Making Florida His New Home, Donald Jr. Fires Back"	""New York, New York. If you can make it there, you can make it anywhere... Trump can't," Schumer tweeted."
"0"	"17 Movie Soundtracks Every Kid from the '80s Loved"	"If you want a glimpse at youth culture in the '80s, look (and listen) no further than these essential movie soundtracks from the era."
"1"	"Patrick Day in coma after suffering brutal knockout"	"The junior middleweight underwent emergency brain surgery after being knocked out by Charles Conwell."
"1"	"Why President Trump's kids are probably celebrating his move to Florida"	"The No. 1 reason billionaires decide to move."
"1"	"'Ghost kitchens' are taking over fast-food chains from Chick-fil-A to Wendy's"	"Wendy's became the latest fast-food chain to name-check ghost kitchens on Friday at the company's investor day."
"0"	"The European Travel Experience Most People Don't Know About"	"You've heard about ship cruises and river cruises, but barge cruises just might be the best way to experience Europe. The post The European Travel Experience Most People Don't Know About appeared first on Reader's Digest."
"1"	"Prince Harry & Meghan Markle's Trusted Private Secretary Has Resigned"	"She stepped down from the esteemed role on Friday."
"1"	"DNA Test Leads Man to Biological Parents He Thought Died 50 Years Ago: 'It Was Surreal'"	"Man Finds Biological Parents He Thought Died 50 Years Ago"
"0"	"Camille Grammer Accuses Ex-Husband Kelsey Grammer of 'Rewriting History'"	"Camille Grammer Accuses Ex-Husband Kelsey Grammer of 'Rewriting History'"
"0"	"Winds fan ferocious fires in Australia's most populous state"	"Ferocious wildfires were burning at emergency-level intensity across Australia's most populous state and into Sydney's suburbs on Tuesday as authorities warned most people in their paths that there was no longer time to flee."
"1"	"Dean Foods files for bankruptcy"	"Dean Foods, America's largest milk producer, is filing for bankruptcy."
"0"	"The Studio Ghibli Fans Guide to Tokyo"	"Combining mythical storytelling and stunning visuals, Studio Ghibli is renowned as one of the world's greatest animation studios."
"0"	"Top 30 Mistakes DIYers Make When Remodeling a Kitchen"	"Get out of your own way by not falling for these kitchen remodeling mistakes."
"1"	"Video captures terrifying moment woman slips at Grand Canyon"	"Emily Koford was visiting the national park with her mom when a step backward left her clinging to the rocks."
"1"	"Family Marks 3 Years Since Unsolved Murder Of Sterling Heights Teen"	"Three years since the murder of a 15-year-old Sterling Heights girl in a drive-by shooting, her family is again pleading for tips to find justice. Jada Rankin's mother and other loved ones gathered Wednesday at Jada Simone Rankin Playground, a Detroit park named in the teen's honor. "My heart is so heavy and so broken; somebody decided to take my baby," mom Tawanna Rankin said, through tears. "I've been doing this for three whole...""
