"1"	"Buffalo Wild Wings reopens after manager is killed in chemical accident"	"The Buffalo Wild Wings in Burlington reopened late Saturday morning after its general manager died Thursday evening in an accident involving cleaning chemicals, according to restaurant representatives. Ryan Baldera, 32, was overcome by the fumes and died after being rushed to Lahey Hospital, according to the Burlington Fire Department. Sign up for our Newsletters Representatives of the Buffalo Wild Wings told Josh Brogadir, of NewsCenter 5, that..."
"1"	"'Dancing With the Stars': Sean Spicer still dancing with Trump support"	"The former White House spokesman has gone from "Dancing With the Stars" controversy to a power contestant. He explains the smiles and the spray tan."
"0"	"Taylor Swift Says Scooter Braun, Scott Borchetta Are Blocking Her From Playing Old Hits at AMAs"	"Taylor Swift has taken to social media to tell fans that Scott Borchetta, her former label head at Big Machine Records, and his new partner Scooter Braun are trying to nix her plans for a retrospective performance at the American Music Awards, as well as denying the use of her recordings for a documentary she"
"0"	"Camila Cabello and boyfriend Shawn Mendes get tattoos together: Photos"	"The pop stars got inked together after four months of dating -- and this is Camilla's first tat!"
"1"	"Three school workers charged in death of special needs student"	"The student was reportedly restrained face-down for nearly an hour before becoming unresponsive"
"1"	"Plans pushed back to explode 2 cranes in New Orleans"	"NEW ORLEANS (AP)   Plans have been pushed back a day to bring down two giant, unstable construction cranes in a series of controlled explosions before they can topple onto historic New Orleans buildings, the city's fire chief said Friday, noting the risky work involved in placing explosive on the towers. With the possibility of winds picking up due to a tropical storm in the Gulf of Mexico, officials had hoped to bring the cranes down Friday...."
"1"	"New Couple Alert? Drake and Kylie Jenner Appear Into Each Other at Party"	"New Couple Alert? Drake and Kylie Jenner Appear Into Each Other at Party"
"1"	"A Russian professor was pulled from a river. Police said a woman's arms were found in his rucksack"	"Russian law enforcement agencies are questioning a prominent historian over the death of a former student in the city of St. Petersburg, in a case that has grabbed headlines across the country."
"1"	"'I was scared for my life': Witnesses share what they saw during the Greenville party shooting"	"This is a breaking news story and will be updated throughout the day. A person who attended a homecoming party overnight in Greenville said the shooting that killed two and left 12 other people injured came "out of nowhere." The incident occurred near Texas A&M University-Commerce, but was not a school-sanctioned activity, according to the Hunt County Sheriff's Office. RELATED: 'It was complete chaos': Two dead, 14 injured in shooting at..."
"1"	"Property Brothers' J.D. Scott Marries Annalee Belle in Vintage Theatre-Themed Wedding"	"J.D. Scott is Married! Third Property Brother Ties Knot"
"1"	"$16.8 Million In Campaign Funds Went To Trump Businesses, Latest Records Reveal"	"Not only have the U.S. and foreign governments spent money at properties owned by Donald Trump, but the president's own political campaign and affiliated political committees have also spent about $16.8 million at his businesses since he launched his 2016 bid for the presidency, according to an analysis of federal election spending records. Republican political campaigns and PACs have spent just under $1.8 million at Trump-owned businesses so..."
"1"	"Actress Accuses Roman Polanski of Raping Her in 1975"	"'Devil Fish' actor Valentine Monnier accuses the 'Officer and a Spy' director of violently raping her in 1975 in a Friday story in Le Parisien."
"1"	"Father of Atatiana Jefferson dies of heart attack, family spokesperson says"	"The father of Atatiana Jefferson, the black woman who was fatally shot by a Fort Worth police officer, died of a heart attack, a spokesperson said."
"1"	"Kate Middleton Takes Prince George and Princess Charlotte Halloween Shopping at Local Supermarket"	"Kate Middleton Takes George and Charlotte Halloween Shopping"
"1"	"This Arctic blast is in its final day. But the cold isn't over quite yet"	"The hundreds of millions of people gripped by the Arctic blast can begin to peel off a layer or two of clothing starting Thursday."
"0"	"See inside a woman's 270-square-foot tiny home complete with 2 bedrooms and a walk-in closet"	"The tiny house is currently in Victoria, Australia, but it was built with wheels attached, allowing owner Dolly Rubiano to move it wherever she wants."
"1"	"California sheriff's deputy shot dead, ride-along injured in 'active shooter incident,' officials say"	"A police officer in Northern California was killed and another deputy was injured after an "active shooter" incident early Wednesday, according to officials."
"1"	"Prince Harry and Meghan Markle just shared a never-before-seen photo of baby Archie with his 'Grandpa' Prince Charles to celebrate his birthday"	"The Duke and Duchess of Sussex shared a new photo of Archie, Harry, and Charles to mark the Prince of Wales' 71st birthday on Thursday."
"0"	"5 reasons you might not want to book a cruise on a brand-new ship"	"There's nothing quite like the thrill of being on the maiden voyage of a new cruise ship."
"0"	"Kristen Stewart is planning to propose to her girlfriend, plus more celeb love life news for early November 2019"	"Keanu Reeves and girlfriend go public, Kylie Jenner's relationship with Drake turns romantic, Reba McEntire, Nina Dobrev and Ian Ziering end relationships."
"1"	"People Are Floored By The Unsettling Photoshop On This Kardashian-West Family Pic"	"There's a lot going on in the Kardashian-West family Halloween photo, which features the whole gang dressed as the Flintstones ― from Kim's Betty Rubble wig to Psalm's debut as Bamm-Bamm to Kanye apparently on one knee inside a somewhat unnerving Dino costume."
"0"	"Raised an only child, Southgate woman, 92, learns she has 19 half siblings"	"Self-proclaimed family historian, Robert Dumas, helps bring long-lost family together in metro Detroit."
"0"	"6 Very Good Recipes That Prove an Air Fryer Belongs in Your Kitchen"	"I'm a gadget geek, so it's no surprise that I was fascinated by the air fryer when it first came on the scene. Especially since I'm also a busy cook; if a gadget doesn't make my life easier, then I've got no time for it. (Too few hours in the day to mess with one that messes with me!) I am all about ruthless efficiency, in other words. Mostly, I loved the concept of frying without oil. And so began a period of intensive experimentation. (Thereby..."
"0"	"Lisa Vanderpump Reveals Why She Left RHOBH: 'I Don't Have Room in My Life for Nastiness'"	"Lisa Vanderpump Reveals Why She Left RHOBH"
"0"	"Meghan Markle Smudged Makeup on a Fan's Coat & He Reacted Perfectly"	"We've all been there."
"1"	"Costco is going to extremes to keep its rotisserie chickens at $4.99"	"At the back of Costco's stores, past the televisions, jewelry, jumbo-sized ketchup jugs and tubs of mixed nuts, is one of the retailer's most prized items: The rotisserie chicken that costs just $4.99."
"1"	"Why Prince Harry Wore His Remembrance Poppy Differently from the Rest of the Royal Family"	"Why Prince Harry's Poppy Was Worn on His Cap"
"1"	"Hackers use e-skimming to hover near online shopping carts"	"Holiday shoppers warned to watch out for e-skimming threats. Any business accepting online payments on their website is at risk, FBI says."
"0"	"Andrew Yang's Campaign Has a Lot of Money. Now What?"	"CONCORD, N.H.   Andrew Yang arrived for the first New Hampshire event of his presidential campaign in a Subaru with a dented fender. It was the spring of 2018, and he and three staff members had taken his car to Concord, where they were hoping a few dozen voters would be waiting for them at a coffee shop. Inside, they found one. She listened politely while Mr. Yang explained universal basic income, though she was mostly focused on her coffee and..."
"1"	"Did Tom Brady troll Robert Kraft with spa visit scene in Netflix show?"	"Did owner Robert Kraft give Tom Brady the okay to poke fun at Kraft's infamous Florida day spa incident?"
"0"	"Eerie photos of an abandoned airport that hasn't been touched in 25 years"	"The airport in Abkhazia   a disputed region of Georgia   was built in the 1960s, but was abandoned after a violent war in the early 1900s."
"0"	"How the Trump Administration Eroded Its Own Legal Case on DACA"	"WASHINGTON   When Attorney General Jeff Sessions appeared before news cameras at the Justice Department in early September 2017 to announce that President Trump was ending deportation protections for young undocumented immigrants, he knew the administration had left itself more legally vulnerable than it should have."
"1"	"Bannon calls Pelosi's impeachment strategy "actually quite brilliant""	"Bannon, the former White House chief strategist, called Pelosi a "master at political warfare""
"1"	"Jay Bilas calls the NCAA's proposal to pay athletes a bluff: It's 'frankly embarrassing'"	"ESPN college basketball analyst Jay Bilas doesn't buy the NCAA's latest move to change its rules so college athletes can profit off their likeness."
"1"	"Missing college student's parents meet with mother of Natalee Holloway"	"Investigators did not call the man a suspect, but said they wanted to identify him and speak with him in connection to Aniah Blanchard's disappearance."
"1"	"How I Got Lung Cancer at 31 Without Ever Smoking a Single Cigarette"	"Rachael Malmberg was 31 when she received a deadly diagnosis. She is fighting her condition and has embarked upon a mission to educate others about the second leading cause of lung cancer and it has nothing to do with smoking."
"0"	"California's wildfire, blackout crisis: Who's to blame?"	"The utility that serves more than 5 million electrical customers in one of the world's most technologically advanced areas is now faced again and again with a no-win decision: risk starting catastrophic deadly wildfires, or turn off the lights and immiserate millions of paying customers. Pacific Gas & Electric is in bankruptcy, facing $30 billion in liabilities, billions more in needed upgrades to its system and an uncertain path to safely..."
"1"	"Jimmy Carter released from hospital following treatment for injury from fall"	"Former President Jimmy Carter has been released from the hospital after being treated for an injury sustained during a fall at his home earlier this week, the Carter Center said Thursday."
"1"	"7-year-old Boy Fighting for His Life After Falling 9 Floors From Apartment Window"	"The boy suffered several broken bones and internal bleeding after falling from a Bronx River Houses apartment building in New York City."
"0"	"Bad news, seniors: Your Medicare costs are going up"	"It's probably the last thing enrollees want to hear, but better to know what you're in for."
"1"	"Mayfield's postgame outfit gets all the memes"	"Social media had a field day with Baker Mayfield's postgame attire."
"0"	"Best all-inclusive resorts in the world"	"Certain vacation destinations are known for having a wealth of all-inclusive resorts (the islands of Fiji and Jamaica come to mind). But resorts that wrap fun, food and drinks into a convenient package can be found all over the world. From a Cancun family favourite and an all-inclusive ski resort in the Alps to a far-flung locale that caters to scuba divers, you'll find a bit of everything on this roundup of the best all-inclusive resorts in the world."
"1"	"A part of Windsor Castle that's been closed to the public for over 150 years just reopened   and it's been completely revamped. Take a peek inside."	"Windsor Castle has been a royal residence for over 900 years. The Inner Hall is in a part of the castle that dates back to the mid-14th century."
"1"	"My Third Husband Is 102 Years Old. Here's What Our Marriage Is Like."	"When I was 65 years old, I married a man 25 years my senior. This was thethird marriage for both of us, and he was almost 90. Mutual friends introducedus ― his best friend was married to my best friend ― because we were bothwidows, and apparently I needed more of a social life.It started out innocently as two friends hanging out. He liked to take me outto fancy Los Angeles restaurants. He had his handyman fix everything for me,and he brought his..."
"0"	"Rare Mustang! 1968 Shelby GT500 Prototype"	"Craig Jackson has restored what is likely the rarest Shelby Mustang of all, this 1968 Shelby GT500 Lime Gold prototype."
"1"	"Four flight attendants were arrested in Miami's airport after bringing in thousands in cash, police say"	"Four American Airlines flight attendants were arrested at the Miami International Airport and charged with money laundering after bringing large amounts of cash into the country, police said."
"0"	"Rebirth, angst and the 'new normal' of California wildfires"	"California has long been seen as a golden land of opportunity. But this "new normal"   fires of enormous size and ferocity   is making everyone edgy and causing some to flee."
"0"	"Russell Wilson vs. 49ers' No. 1 defense: Monday night's prime-time matchup"	"What Russell Wilson does to a defense can't be replicated. Certainly not in practice. For example, 49ers backup C.J. Beathard attempted to simulate the Seahawks' quarterback on the scout team last week   trying to give the defense a sense of Wilson's scrambling style   and cornerback Richard Sherman said Beathard strained his back in the process. And Wilson can't be replicated in another game. The 49ers' last game was against Arizona rookie..."
"1"	"Former President Jimmy Carter suffers pelvic fracture after falling in Georgia home"	"Former President Jimmy Carter was taken to the Phoebe Sumter Medical Center for "observation and treatment," according to the Carter Center"
"1"	"Hernandez: Anthony Davis' impact on LeBron James apparent even when he doesn't play"	"Never was Anthony Davis' value to the Lakers as clear as it was Wednesday night at Staples Center. And Davis didn't play a minute. In a game he spent confined to the sidelines in street clothes, his influence was visible in LeBron James. Specifically, in how youthful the nearly 35-year-old James looked in the Lakers' second game in as many nights. With Davis sidelined by a troublesome right ..."
"1"	"DNA test reunites half brothers; both were cops in Florida"	"Two Florida police officers working in different parts of the state recently discovered they are half brothers, thanks to a DNA test. (Oct. 23)"
"0"	"Best Dive Bar in Every State"	"The real challenge in compiling a list of America's best dive bars comes in defining just what a dive bar is and isn't."
"0"	"Rape victim rejects judge's offer: $150,000 for her, reduced sentence for attacker"	"A Louisiana judge asked a rape survivor if she would consider a $150,000 restitution payment from her attacker. She refused, saying the attack has left her "broken.""
"0"	"Kodak Black Sentenced to Over 3 Years in Prison in Weapons Case"	"Rapper Kodak Black has been sentenced to more than three years in federal prison after pleading guilty to weapons charges stemming from his arrest just before a scheduled concert performance in May."
"0"	"17 Outdated Office Etiquette Rules That Are So Laughable Today"	"While they may have once been standard practice, these office etiquette rules are woefully outdated today. Find out which ones are meant to be broken."
"1"	"Pamela Anderson gets backlash after wearing a Native American headdress for Halloween"	"Pamela Anderson is under fire after posting risqué photos of herself wearing a Native American headdress in honor of Halloween. The Canadian actress and animal rights activist, who rose to fame for her role as a lifeguard on the series Baywatch, took to Twitter like many other celebrities to post photos of herself in her Halloween costume. In the first photo, the 51-year-old sports a pair of high-waisted underwear, and appears to be drenched in..."
"0"	"Joe Giudice Says It Was 'Painful' Watching Real Housewives of New Jersey from Prison"	"Joe Giudice Says It Was 'Painful' Watching RHONJ from Prison"
"0"	"The most exclusive hotel in every state"	"All these hotels have just one thing in common   guests just can't get enough of them. From celebrity favourites and ultra-small boutique stays to outrageously expensive suites, you'll have to either whip out the credit card or patiently wait to bag a night at one of these exclusive hotels in America."
"0"	"Don't be fooled: Costco says $75 coupon is a scam"	"Wholesale retailer Costco is warning customers about a new scam that is promising shoppers a $75 coupon."
"1"	"Arizona 'Wizard Rock,' missing 1-ton boulder, mysteriously returns"	"Forest officials in Arizona were mystified in October when local landmark Wizard Rock, a 1-ton boulder, suddenly vanished from its position along Highway 89 in Prescott."
"1"	"Iowa family discovers horrifying basement filled with blood"	"It's been two weeks and the blood and fat are still seeping into the basement of Nick Lestina's home."
"1"	"Miami symphony oboe player dies after falling down stairs in concert hall minutes before performance"	"A symphony oboe player in Florida died minutes before a season-opening concert performance was set to begin on Sunday after she fell down a flight of stairs, according to officials."
"0"	"Roman Catholic Priests Will Not Break Confession to Report Child Abuse, U.K. Inquiry Told"	"The Roman Catholic Church says it would reject any recommendation that would require priests to break confession to report child sexual abuse."
"0"	"Divers salvage 100-year-old liquor from WWI shipwreck"	"A team of ocean explorers says it has retrieved cognac and liqueur from a ship that was bound for Russia when it was sunk by a German submarine in 1917."
"1"	"The Latest: Storms lead to 3 deaths in eastern Oklahoma"	"Oklahoma State Bureau of Investigation spokeswoman Brooke Arbeitman says two teenage boys died of carbon monoxide poisoning late Sunday in Weleetka, about 80 miles (130 kilometers) east of Oklahoma City. She says the..."
"0"	"I Donated Blood for the First Time at 27, and It Ended in Signs of Cardiac Arrest"	"The blood donation staff were completely shocked by my reaction (this was clearly not normal) and called 911. I still firmly believe people should donate blood   but I don't think my body is physically meant to donate."
"0"	"Stars turning 70 in 2019"	"Seventy and sensational! Join us as we celebrate the stars who were born in 1949."
"0"	"Why You Should Go to New Orleans This Winter"	"With the openings of a new airport terminal and a museum devoted to a cocktail, not to mention less sticky weather, New Orleans is perfect for an off-season adventure."
"1"	"Prince Harry acknowledges tensions with William in ITV interview"	"Britain's Prince Harry has acknowledged tensions with his older brother Prince William for the first time, saying they are on "different paths.""
"1"	"Meghan Markle Personally Calls British Politician to Thank Her for Orchestrating Letter of 'Solidarity'"	"The Duchess of Sussex thanked the British female MP for supporting her amid media scrutiny."
"1"	"Nigerian police free 259 people from Islamic institution"	"Nigerian police have freed 259 people from an Islamic rehabilitation center in the southwestern city of Ibadan, police said on Tuesday, taking the number rescued from abusive institutions since September to nearly 1,500."
"1"	"Kevin Spacey Won't Be Charged in Sexual Assault Case After Accuser Dies"	"The Los Angeles County District Attorney's Office has formally dropped a case against actor Kevin Spacey, after the accuser died."
"1"	"Man dies after becoming stuck on top of 290-foot tall smokestack"	"A man dangling from the top of a 290 foot smoke stack for more than six hours, apparently suspended only by his pants, died shortly after he was rescued by authorities."
"0"	"45 Abandoned Places Around the World That Are Eerily Beautiful"	"It's okay to be awed and creeped out at the same time."
"1"	"Judge: Brad Pitt, others can be sued over New Orleans homes"	"The Times-Picayune/ The New Orleans Advocate reports Pitt and other foundation directors asked the court to remove them from the lawsuit, saying they weren't personally responsible for the construction."
"1"	"Buckingham Palace has a bizarre tradition of taking an MP hostage when the Queen enters Parliament in case something bad happens to her"	"MP Stuart Andrew was held hostage at the palace while Her Majesty delivered a speech at the State Opening of Parliament on Monday."
"0"	"We Tried 9 Packaged Stuffings and There Was a Clear Winner"	"Don't sleep on supermarket classics."
"1"	"A 9-year-old is facing five counts of murder. He didn't even know what 'alleged' meant."	"Criminal justice experts said it was extremely rare for prosecutors to bring such severe charges against a child."
"0"	"How to make your own mozzarella cheese"	"Mozzarella is an approachable cheese to make from fresh milk that seems a little like magic."
"0"	"105 Black Friday Deals You Can Start Shopping Today"	"Save with early bird deals from stores like Walmart, Target, Amazon, Costco, Sam's Club, Kohl's, Sears, JCPenney, and Macy's, which are offering deep Black Friday discounts on the hottest products on your Christmas list   and your wish list   starting on Thanksgiving, or even sooner."
"0"	"How this couple built a $100 million company without killing each other"	"When the boundaries between work and life get fuzzy."
"1"	"Man who inherited 6 figures shares advice he'd give his younger self"	"Brandon Neth inherited around $123,000 from his late father and grandfather when he was 20. He spent most of it on cars, clothes, and restaurants."
"0"	"Climate change might hit the economy harder and faster than thought"	"The economic effects of global warming may arrive sooner and with a bigger impact than previously thought, according to Oxford Economics in a report that compares recent scientific research with the economic literature on the costs of climate change."
"1"	"Supreme Court refuses to block lawsuit against gun manufacturer brought by Sandy Hook families"	"The Supreme Court refused to shield Remington Arms Co. from potential liability for the 2012 school shooting that left 26 dead in Newtown, Conn."
"1"	"Gunmen kill about 15 people in attack on Burkina Faso mosque"	"Gunmen killed about 15 people in an attack on a mosque in northern Burkina Faso during prayers on Friday evening, a security source and a local official told Reuters."
"0"	"More Americans say now is a bad time to buy a home"	"There was also a drop in the share of people who think now is a good time to sell a home, from 44% to 41%, according to a monthly survey by Fannie Mae."
"0"	"DACA advocates tailor their appeal to Chief Justice John Roberts -- with his own words"	"Lawyers trying to save an Obama-era program that defers the deportation of certain undocumented young adults are strategically directing their arguments to one man: Chief Justice John Roberts."
"0"	"Big celebrity money moments of the last decade"	"From bankruptcy filings and huge paydays to reaching billionaire status, read up on the most fascinating money news involving the stars from 2010 to 2019."
"0"	"These 30 Incredible Kids Really Changed the World"	"Proof that you can make a difference at any age."
"1"	"Experts crack mystery of ancient Egypt's sacred bird mummies"	"DNA analysis helps work out origin of nearly 6 million mummified ibises"
"0"	"Dad bans lollipops after 5-year-old son nearly choked to death"	"The boy was sitting near his mother when he began making choking noises."
"0"	"'At 237 Lbs., I Was Embarrassed To Go To The Gym. So I Did An At-Home BeachBody Program And Lost 117 Lbs.'"	""I wanted to be me again.""
"0"	"This Thanksgiving, We're Tearing Our Potatoes Instead of Cutting Them"	"Torn edges capture more flavor."
"1"	"Former Trump adviser who testified to Ukraine pressure campaign said she was victim of harassment"	"Fiona Hill told Congress that Rudy Giuliani and E.U. ambassador Gordon Sondland pursued a shadow policy on Ukraine."
"0"	"'Priceless' finds that turned out to be worthless"	"From a bottle of rare Scotch whisky to a fake Picasso painting, we take a look at items from around the world that were believed to be highly valuable... but turned out to be worthless."
"1"	"Neil Young Says U.S. Citizenship Application Delayed By Marijuana Use"	"Neil Young has revealed that his attempts to attain U.S. citizenship prior to the 2020 presidential election has been delayed in part due to the "good morale character" clause on the immigration application. "I want to be a dual citizen and vote. When I recently applied for American citizenship, I passed the test. It was a conversation where I was asked many questions. I answered them truthfully and passed," the rocker wrote Friday on his Neil..."
"1"	"California boy, 13, complained of bullying at school days before fatal sucker punch, attorney says"	"A 13-year-old boy who died last month after he was sucker-punched by classmates had complained of bullying to an administrator at his Southern California middle school days before the alleged assault, a lawyer representing his family said on Tuesday."
"0"	"The Top Winter Wonderlands You Should Visit This Holiday"	"Find the best alpine views at these wintry destinations."
