"1"	"How Did Lady Gaga's Gown End Up in Hotel's Lost and Found?"	"Lady Gaga's dress was the picture of old-fashioned Hollywood glamour as she took home the award for Best Song for "A Star Is Born" wearing a gorgeous Valentino gown. So how did that dress end up on the auction block in Los Angeles this week? A maid at the Beverly Hilton hotel claims she found the dress in Gaga's room the morning after the award ceremony and brought it to the lost and found. It went unclaimed for eight months and the hotel gave it back to the maid who put it up for auction."
"1"	"A body-language expert says Meghan Markle is "politely disconnecting" from the public, and honestly, we would too"	"Can we blame her? Meghan Markle is supposedly "politely disconnecting" from the public as seen in her body language, and girl, you do you."
"1"	"Rep. Katie Hill's lawyers send cease-and-desist letter to DailyMail.com over nude photos"	"The website is the second to publish alleged lewd photos of the Democratic congresswoman."
"0"	"85 Thanksgiving Recipes You Can Make Ahead"	"Short on time? Running out of oven space? Here are some make-ahead dishes for a seamless feast."
"0"	"2020 Ford Bronco: Everything we know about Ford's new SUV"	"It's only a matter of time until Ford pulls back the veil."
"1"	"Roommate, her boyfriend charged in death of missing Atlanta student"	"Missing Atlanta student Alexis Crawford was found dead."
"1"	"Missing California hiker found dead at top of glacier just weeks before baby was due"	"A missing hiker from Huntington Beach California was found dead on Thursday at the top of the Darwin glacier in the Inyo National Forest."
"1"	"Nigerian Women Say 'MeToo.' Critics Say 'Prove It.'"	"It was, she said, a secret that burned so badly she could no longer keep it inside. So at age 34, Busola Dakolo, a well-known Nigerian photographer, went on television and finally spoke. She said she had been raped twice as a teenager by her former pastor, Biodun Fatoyinbo, a church leader whose services draw thousands, and whose fans, admiring his flashy lifestyle, have taken to calling him "the Gucci pastor.""
"1"	"This Solo Dining Trend Is Changing the Way People Eat"	"Table for One is a column by Senior Editor Eric Kim, who loves cooking for himself and only himself and seeks to celebrate the beauty of solitude in its many forms. The stage has been set for a renaissance in solo dining. The South Koreans already have a word for it: honbap. A portmanteau of "alone" (honja) and "food" (bap), honbap is part of a larger loner trend that's overtaken Korea in the last two to three years, as more and more people are..."
"1"	"What Lines, Blemishes On Your Face Say About Your Health"	"According to the ancient medicinal approach of face mapping, your lines, blemishes and acnes tell a lot about your body. Here's how."
"0"	"25 Biggest Grocery Store Mistakes Making You Gain Weight"	"From picking up free goodies to navigating the wrong aisles, these grocery shopping mistakes could be one of the sneaky reasons you're gaining weight."
"0"	"3 retirement numbers you absolutely need to know"	"These numbers can be the key to a happy and comfortable retirement."
"1"	"California gets ready for more wildfires and power outages as the weather refuses to cooperate"	"Just as firefighters got a grip on a blaze that tore through the swanky Pacific Palisades, other Californians are at risk of unpredictable wildfires this week."
"0"	"Hannah Brown on Being Surrounded By Exes Tyler Cameron and Colton Underwood"	"ET spoke with the former Bachelorette after 'Dancing With the Stars' on Monday."
"1"	"Top 100 country songs of all time"	"Stacker counts down the top 100 country songs of all time. From old-school honky-tonk to modern country pop, this list covers the biggest hits in Billboard history."
"1"	"Snow crab sells for record price in Japan"	"A "five shining star" snow crab was auctioned off in Tottori, Japan for a record-breaking 5 million yen ($46,000). wide."
"1"	"Best and worst QB performances from NFL Week 6"	"The 13 games played so far in NFL Week 6 were highlighted by a couple of epic offensive showdowns, some flawless masterpieces and a few rotten eggs. We're diving into the best and worst quarterback performances from the weekend's action, starting with the man who led the Houston Texans over the Kansas City Chiefs."
"1"	"Hyatt is eliminating travel-sized plastic toiletries"	"Hyatt is the latest international hotel brand to ditch travel-sized toiletries from its rooms, following Holiday Inn-owner InterContinental Group and Marriott International."
"1"	"Texas police officer shoots woman to death inside her home"	"A Fort Worth police officer checking out a residence with an open door opened fire on a 28-year-old woman inside her home."
"1"	"LA firefighter banked $360,010 in overtime pay in one year, city audit finds"	"Eighteen employees of the Los Angeles Fire Department earned more than $200,000 in overtime pay last fiscal year, with one firefighter making $360,010 in overtime alone, according to an audit released Wednesday by City Controller Ron Galperin."
"1"	"Miley Cyrus clarifies Instagram remarks about sexuality being a choice, plus more news"	"Miley Cryus responds to criticism of Instagram comments about sexuality. Plus, more celebrity news for Oct. 21, 2019."
"0"	"Thousands of boys forced to beg by religious schools in Senegal"	"In Senegal, many boys sent to religious schools to learn the Quran end up living in squalor, forced by their teachers to beg for money and food."
"1"	"Outer Banks storms unearth old shipwreck from 'Graveyard of the Atlantic'"	"A recent storm on the Outer Banks unearthed an old shipwreck buried on the beach in Hatteras Island. A local bar shared photos of the old wooden ship in its final resting place in the area known as "The Graveyard of the Atlantic." "A Wreck across the street from The Wreck! A lot of sand has washed out with this Nor'Easter & look what's been exposed!" The Wreck Tiki Bar in Hatteras, North ..."
"1"	"How to Sell a House in Southern California: Make a Movie"	"Raj Qsar is eyeing the sky nervously. It's early afternoon in Corona Del Mar, Calif., and his six-man camera crew is on the clock only until sunset."
"0"	"Social Security: 5 smart ways to get more benefits"	"Your decisions can dictate the size of your Social Security benefit. Use these five smart strategies to increase yours."
"1"	"Horrific details emerge in 'barbaric' murder of 1999 Jane Doe"	"The young woman's abused body was discovered in a cornfield in the town of Raymond."
"1"	"MLB world reacts to Aníbal Sánchez losing no-hitter in eighth inning of NLCS Game 1"	"Washington Nationals' pitcher Anibal Sanchez stole the show of Game 1 of the NLCS and nearly became a part of MLB history before his no-hit bid was ended in the eighth."
"1"	"She fought for human rights on a tiny island that banned guns. Then she was shot dead."	"Rachelle Bergeron had been the only prosecutor in Yap, a Micronesian island about 550 miles southwest of Guam."
"0"	"2019 CMA Awards: See the best photos from inside and backstage"	"2019 CMA Awards: See the best photos from inside and backstage"
"0"	"A Texas woman was legally declared dead while still alive"	"Sherry Ellis found out she was dead November 1."
"1"	"Maryland man, 46, gets probation after he killed a father and his four daughters when his SUV crossed a median and slammed into their minivan"	"Alvin Hubbard III, 46, of Cambridge, Maryland, was sentenced to one year of probation after he killed a father and his four daughters when his SUV slammed into a family's minivan in 2018"
"0"	"Watergate redux? Trump impeachment inquiry heads for live TV"	"Back in 1973, tens of millions of Americans tuned in to what Variety called "the hottest daytime soap opera"   the Senate Watergate hearings that eventually led to President Richard Nixon's resignation. It was a communal experience, and by some estimates, more than 80% of Americans tuned in to at least part of the Watergate telecasts. They were offered by ABC, CBS and NBC, as well as PBS, which won acclaim and viewers by showing not only the..."
"0"	"Taylor Swift Rep Hits Back at Big Machine, Claims She's Actually Owed $7.9 Million in Unpaid Royalties"	"Taylor Swift's team responds to Big Machine's denial."
"0"	"Insiders predict: NFL week 10 winners"	"We've entered the portion of the season where peeking at the playoff picture following each game wouldn't be considered too premature. The Patriots suffering their first loss makes things a bit more interesting in the AFC, while the still-undefeated 49ers face a major test this week against a division rival. We take a look at the Week 10 NFL slate, and the betting lines accompanying it."
"1"	"He had been homeless for decades. Then old friends saw his photo in a newspaper."	"Coy Featherston's former classmate canvassed Austin for four days until she found him feeding pigeons outside a church."
"0"	"Ultimate property flippers: real estate deals that made fortunes"	"From savvy celebrities to real estate mogul mansions, take a look at these ultimate property flippers who made millions selling houses"
"0"	"38 men who were worthy competitors for John Legend's Sexiest Man Alive title"	"John Legend was revealed as People's Sexiest Man Alive this year, but here are 38 other undeniably sexy men we think deserved the title."
"0"	"​'My Annoying Cough Turned Out To Be Lung Cancer'"	""As soon as I was coming out of anesthesia, he told me it was cancerous.""
"0"	"Pelosi says Trump has admitted to bribery"	"House Speaker Nancy Pelosi said President Trump has admitted to actions that amount to bribery."
"1"	"Abandoned 'unicorn' puppy has a tail on its head"	"Abandoned 'unicorn' puppy has a tail on its head"
"0"	"Hey, Millennials, look out below! Gen Z may already be catching up in the salary race"	"Gen Zers are closing the pay gap with millennials even though they have far less experience. They're making the most of a tight labor market."
"1"	"A woman was found dead with an ax in her head. 37 years later, her husband faces charges"	"James Krauseneck Jr. appeared in state Supreme Court Friday, accompanied by his daughter Sara, who was a toddler at the time of the killing."
"1"	"Stella McCartney Deleted a Meghan Markle Instagram Post After Followers Called Her Out"	"Stella McCartney deleted a photo of Meghan Markle on Remembrance Day following backlash from Instagram followers."
"0"	"Man lost his house over $8.41 in unpaid property taxes"	"He miscalculated the interest on an old bill   the county treasurer foreclosed, sold the house and pocketed the proceeds"
"1"	"Fox News contributor: 'Most likely' outcome is Trump doesn't run in 2020"	"Fox News contributor Christopher Hahn predicted that President Trump will not run for reelection in 2020."
"1"	"Cows swept away by Hurricane Dorian found alive   but how?"	"A trio of wild cows believed to have been swept away by the storm surge from Hurricane Dorian have been found on a nearby island in North Carolina"
"0"	"Republican Mark Sanford drops out of presidential race"	"Sanford, a Trump critic, failed to catch traction in the Republican primary."
"1"	"3 arrested in $7 million mortgage fraud that targeted the elderly"	"Three people associated with Grand View Financial LLC have been indicted for running a mortgage fraud scheme throughout California, including San Diego County. The scam targeted many elderly and financially distressed homeowners by promising mortgage and foreclosure relief, with combined losses totaling $7 million, according to California Attorney General Xavier Becerra."
"0"	"Here Are the Biggest Deals We're Anticipating for Black Friday"	"The Black Friday deals for 2019 have already begun leaking out. Get a sneak peek at what to expect from popular retailers like Costco, Walmart, and Best Buy. Browse our guide and use it to plan your attack for the biggest shopping event of the year."
"1"	"The Before-And-After Photos of This Man Who's Three Years Sober Will Amaze You"	"Alcohol was destroying Kenny Dunn's life. Now three years clean, his sobriety progression photos and the inspiring story behind them are going viral."
"0"	"How to know when to refinance your mortgage"	"Not all borrowers benefit from a refi. Learn the pros and cons of a new home loan."
"1"	"Two teens arrested after Ohio woman is killed by large falling log at park"	"Victoria Schafer, 44, was on the stairs near Old Man's Cave in Hocking Hills State Park when the log struck her."
"0"	"691,145 Californians left last year: What state did they go to?"	"Look at the comings and goings as a ratio of ins to outs. Tiny Idaho wins this race with 497 arrivals from the Golden State for every 100 former Gem State residents who moved to California."
