"1"	"Accused killer's girlfriend reveals Colorado mom's last words"	"Krystal Lee, who was having an affair with Frazee, is expected back on the stand Thursday"
"0"	"Tribe members: Ancient bison kill site desecrated by mining"	"SARPY CREEK, Montana (AP)   When a coal company contractor working under federal oversight used a backhoe to dig up one of the largest known Native American bison killing grounds and make way for mining, investigators concluded the damage on the Crow Indian Reservation broke federal law and would cost $10 million to repair, according to documents obtained by The Associated Press. Eight years later, Colorado-based Westmoreland Coal has not made..."
"0"	"Ex-Astros say team electronically stole signs during 2017 season"	"While the Astros have denied the numerous sign-stealing allegations against them, the former members of their World Series team described the practice they used that season in detail."
"1"	"The 100 Best Snacks You're Not Making"	"This extensive collection of snacks ranges from savory to sweet to everything in between."
"1"	"Texas police hunt for killer after finding New Hampshire couple dead"	"James and Michelle Butler's bodies were found buried on a remote beach and their RV and truck were seen on surveillance video driving into Mexico."
"1"	"How does this busy animal rescue get by with just 4 full-time employees? It has 300 loyal volunteers."	"People ask the executive director of Lost Dog and Cat Rescue why her volunteers are so committed. "I don't always know how to answer," she said."
"0"	"Tamron Hall Talks Leaving the Today Show, Jokes About Megyn Kelly's Reported Multimillion Payout"	"Tamron Hall Talks Losing the Today Show"
"1"	"'Angel' car saves Arizona family after smashing into suspected drunk driver running red light, video shows"	"An Arizona driver who police praised as an "angel" may have saved the lives of a couple pushing a stroller in a crosswalk last week after video showed the car smashing into a suspected drunk driver speeding through a red light -- who came inches away from plowing into the family."
"1"	"Stars who quit being vegan"	"Find out which celebs didn't stick with an animal-product-free diet."
"0"	"Pittsburgh Steelers quarterback Mason Rudolph on 'TNF' incident: 'I thought it was pretty cowardly'"	"Pittsburgh Steelers quarterback Mason Rudolph tell us what he thinks about the "TNF" incident."
"1"	"4 High School Students Killed in Texas Car Crash That Also Injured 3: 'We Grieve Together'"	"4 High School Students Killed in Texas Car Crash"
"0"	"Americans back impeachment hearings. But age matters."	"The older they are, the more strongly they support the Ukraine inquiry."
"1"	"Megyn Kelly Slams NBC News on 'Tucker Carlson Tonight' for Matt Lauer Investigation, Harvey Weinstein Coverage"	"In Megyn Kelly's first televised interview since exiting NBC, the former Fox News and NBC News anchor took to "Tucker Carlson Tonight" Wednesday evening to criticize NBC News management for its handling of the outlet's Harvey Weinstein coverage and internal Matt Lauer investigation."
"1"	"14 celebrities who got rejected by 'Saturday Night Live' and went on to become famous in their own right"	"Even though these stars auditioned for the popular NBC series and were turned down, they've had huge careers in the comedy world."
"1"	"Stella McCartney removes Instagram post plugging her $1,900 coat that Meghan Markle wore amid backlash"	"The designer has been slammed for plugging her £1,545 belted wool Stella McCartney coat which was worn by Meghan Markle at the Cenotaph yesterday."
"1"	"Wisconsin bus driver saves children wandering in snow, as deadly Arctic air mass grips US"	"As bitter cold took hold across the Midwest earlier this week, a sharp-eyed bus driver in Wisconsin was credited with helping rescue two children who were very underdressed for the weather conditions."
"1"	"Felicity Huffman Smiles as She Begins Community Service Following Prison Release"	"The 56-year-old actress was released from prison last month."
"1"	"Ashley Graham Says She Has a Major Case of Pregnancy Brain But What Is That?"	"It's super common   but it's actually not a bad thing."
"0"	"Five questions the second College Football Playoff rankings will answer"	"The second College Football Playoff rankings will answer five key questions Thursday after a big weekend that saw several changes to the Lan"
"0"	"Dolly Parton Is Rocking a Thigh-High Slit at the CMA Awards and She Looks Incredible"	"This is why we love her."
"1"	"Lady Gaga Says 'Fame Is Prison' -- And Has Fans Speculating If New Music Is on the Way"	"The singer's fans are also wondering if she's talking about the pressures of the industry."
"0"	"12 Fall Landscaping Mistakes to Know and Avoid"	"Whether you have a green thumb when it comes to your home garden, or you can hardly tell the difference between a rose and a weed, you should know that there are certain landscaping tasks that need to be done right to keep your home exterior looking its best. But to do that, you must avoid the most common fall landscaping blunders."
"1"	"Kylie Jenner Throws Dinner for Caitlyn Jenner's 70th Birthday   See Which Kardashians Attended"	"Kim Kardashian, Kourtney Kardashian Attend Caitlyn Jenner's Birthday Dinner"
"0"	"John Legend Is PEOPLE's Sexiest Man Alive 2019: 'I'm Excited but a Little Scared at the Same Time'"	"John Legend Is PEOPLE's Sexiest Man Alive 2019"
"0"	"Roommate, her boyfriend charged in death of missing Atlanta student"	"Missing Atlanta student Alexis Crawford was found dead."
"1"	"Lamar Odom Is Engaged to Sabrina Parr: See Her Ring!"	"Lamar Odom Is Engaged to Sabrina Parr: See Her Ring!"
"1"	"This Masked Man Hands Out $100 Bills to Strangers"	"Dr. MooMoo dons a mask for a good cause."
"1"	"Woman, suspect dead at 'Tarzan' actor Ron Ely's California residence"	"Ron Ely, who portrayed Tarzan in the TV series in the 60s, was not harmed and is alive and well, a sheriff's office spokesman said."
"0"	"10 Gazans dead as Israel hit on militant chief sparks rocket barrage"	"Israel's military killed a commander from Palestinian militant group Islamic Jihad in a strike on his home in the Gaza Strip on Tuesday, triggering exchanges of fire in a violent escalation that left another nine Gazans dead. Islamic Jihad is the second most-powerful militant group in the Gaza Strip after Hamas."
"0"	"On a frigid night in Dallas, one man who used to be homeless ushered people to shelter"	"Monday night was harsh for many in Dallas as the strongest cold front of the season rolled through bringing below-freezing temperatures and single-digit wind chills. The city of Dallas opened up the Kay Bailey Hutchinson Convention Center for emergency overflow housing for the homeless in case other shelters filled up. A move the city hasn't made in cold weather situations and one that was applauded by local non-profits and faith leaders who..."
"1"	"Jason Momoa Says His Latest Role Made Him 'More Attentive' to His Wife Lisa Bonet"	"Jason Momoa Says He's 'More Attentive' to Wife Lisa Bonet"
"1"	"'Absent yourself': Transcripts reveal what Schiff told Gaetz when he crashed secure hearing"	"There was a tense back-and-forth when Republicans apparently burst into the room during impeachment inquiry testimony."
"1"	"Saddleridge fire is 19% contained near Los Angeles; Winds weaken"	"The Saddleridge fire near Los Angeles has consumed 7,500 acres though winds are easing up. Tens of thousands of people still can't return home."
"0"	"Billionaires' success boils down to 3 simple traits, a new report says"	"Intelligence isn't what makes billionaires successful, a new report by investment bank UBS and PricewaterhouseCoopers found."
"0"	"Nurse takes in man with autism so he can get a heart transplant"	"When Jonathan Pinkard met Lori Wood, he was homeless and was told he only had months to live. Lori decided to take him in to help him get a heart transplant. Steve Hartman has their story on the road."
"1"	"Nikki Haley claims top aides tried to recruit her to 'save the country' by undermining Trump"	"In a new book, the potential White House aspirant slams Rex Tillerson as 'exhausting' and John Kelly as suspicious of her access to the president, and argues they should have quit if they disagreed with him."
"1"	"Here's How The Queen Reportedly Reacted When She Found A Slug In Her Salad"	"The Queen of England may seem like an intimidating person to cook for, but she is said to have had a fairly calm reaction after finding a slug in her salad."
"0"	"Harry Potter's Matthew Lewis Has the Best Response to Tom Felton's Fear of Aging"	"Harry Potter star Matthew Lewis had a hilarious reply to former co-star Tom Felton's recent Instagram post. See his response!"
"1"	"'Baby Trump' balloon slashed at Alabama appearance"	"TUSCALOOSA, Ala. (AP)   A towering "Baby Trump" protest balloon was knifed and deflated by someone unhappy with its appearance during President Donald Trump's Saturday trip to Alabama, organizers said."
"1"	"Unexpected Signs of an Unhealthy Heart"	"Preventing heart disease has been at the forefront of researchers' agendas for years, involving things like physical activity, diet, and genetics"
"0"	"Dog Throws A Total Tantrum When She Realizes Mom Wants To Take The Stairs"	"Aurora Angel Beste Nala has always been the friendliest dog, and loves going out on adventures and meeting new people."
"0"	"A Guide to Vacationing on Christmas Island"	"...and why it should really be called Crab Island."
"0"	"SC sheriff arrested on domestic violence charge"	"The sheriff of Colleton County was arrested Saturday on a domestic violence charge, according to the South Carolina Law Enforcement Division. Robert Anderson Strickland faces a charge of second-degree domestic violence in connection with an incident Thursday, according to court documents. Sign up for our Newsletters An affidavit states that during an argument, Strickland assaulted the victim by "punching her in the face, with a closed fist, more...""
"1"	"Inside Megyn Kelly's Fight Against NBC Amid New Matt Lauer Allegations"	"Inside Megyn Kelly's Fight Against NBC Amid New Matt Lauer Allegations"
"1"	"Two horses killed, riders injured in a Los Angeles hit and run"	"A suspect is in custody after a hit-and-run left two horses dead and two riders injured."
"1"	"I Had Anxiety for 30 Years Till This One Eureka Moment Helped Me Recover"	"From the time I was a small child, anxiety was an ever-present problem. I tried to ignore it, then unsuccessfully tried to solve the problem myself."
"1"	"Meghan Markle and Prince Harry Reunite with Kate Middleton and Prince William for Remembrance Service"	"Meghan Markle, Harry Reunite Kate and William at Remembrance Day"
"0"	"U.S.-born ISIS bride thinks she 'deserves a second chance'"	"Hoda Muthana says in an interview with NBC News that she worries for the future of her 2-year-old son, Adam, and wants to return home to Alabama."
"0"	"The Day in Sports: Saturday, November 9, 2019"	"The Day in Sports: Saturday, November 9, 2019"
"1"	"Subtle Signs You May Have Clogged Arteries"	"These surprising clues can point to clogged arteries and underlying heart disease."
"0"	"Suspect arrested in murder of 6-year-old girl who was shot while asleep in her home"	"A suspect has been arrested for the murder of a 6-year-old girl who was asleep in her Cleveland home when she was fatally shot in the head, authorities said Wednesday."
"0"	"For a healthy heart, eat the biggest meal early in the day"	"For a healthy heart, women should consume most daily calories before 6 p.m., a new study suggests."
"0"	"For three decades, one man, now 75, has cared for Philly's Vietnam and Korean War memorials"	"No one is quite sure when Jim Moran became the caretaker of the Philadelphia Vietnam Veterans Memorial, especially Jim Moran. It just seems that for as long as the monument has been around, Moran, 75, has been there, picking up trash, watching out for vandals, and caring for Old Glory."
"1"	"Baby dies of the same cancer his identical twin is currently battling"	"Elijah and his brother, who were diagnosed at just 4 months old, shared an "unbreakable" love."
"1"	"The dark side of Dallas: Bus tour reveals hidden stories behind human trafficking"	"The 15-year-old girl planned to rendezvous with her trafficker at the food court at NorthPark Center. She was one of the estimated 400 teens sold for sex every day in the Dallas-Fort Worth area. She worked in a motel a quarter of a mile from Highland Park. The teen made $125 from a client but wasn't allowed to keep any of the money. The girl's pimp warned her not to spend any money on food. There are common misconceptions about sex trafficking:..."
"0"	"Harry and Meghan Revive Feud Rumors By Staying Away From the Royal Family's Christmas"	"So, what are you doing for Christmas?"
"0"	"Every touchdown from every Week 10 game"	"Watch Every Touchdown From Every Game presented by Amazon Prime during Week 10."
"0"	"Kendall Jenner Wore the Tiniest Dress to Go Jewelry Shopping"	"No fall layers to see here."
"0"	"American woman apparently strangled in the Dominican Republic"	"Colleagues say Patricia Anton brought joy and laughter to the school she worked in, as police hunt leads in what they say looks like a deadly robbery at her home"
"0"	"Mid-Engine C8 Corvette Production Postponed Until February 2020"	"The car was supposed to be hitting dealers by the end of 2019. That's no longer happening."
"0"	"Thanksgiving side dishes: 11 unique recipes to try this season"	"While there will always be dishes you're unwilling to leave off your table, consider changing it up with these unique Thanksgiving side dishes."
"0"	"Signs of Dementia: 8 Tips For Talking to Your Older Parents"	"When a parent begins to exhibit early signs of dementia or Alzeimer's, it's difficult for families to address it. These tips will make the process easier."
"1"	"Report: Police investigating woman's death after Redskins' player Montae Nicholson took her to hospital"	"Police are investigating an apparent drug-overdose death of a woman after the Redskins' Montae Nicholson took her to a hospital, according to reports."
"1"	"10 questions you should always ask at an open house"	"Attending an open house? Make the most of your visit by asking the right questions."
"1"	"Police identify person of interest in mysterious death of couple buried on beach"	"James Butler, 48, and his wife, 46-year-old Michelle Butler, were found buried in a shallow grave on a remote part of Padre Island."
"1"	"Hunter Biden Steps Down From Chinese Board as Trump Attacks"	"Hunter Biden is stepping down from the board of a Chinese-backed private equity company and promising to forgo all foreign work if his father, former U.S. Vice President Joe Biden, is elected president in 2020."
"1"	"Missing Minnesota boy, 6, and his dog, found in cornfield by drone with thermal camera"	"A missing 6-year-old boy from Minnesota and his dog were found Wednesday after hundreds of volunteers   including one who used his own drone with a thermal camera   searched for him for hours."
"0"	"How to Make Sure You Have a Seat Next to Your Family on Your Next Flight"	"Because no one wants to get split up."
"0"	"Beat the crowds at these abandoned U.S. national parks"	"These 7 spots might have lost their national status but you can still explore their rich history and natural beauty."
"0"	"'One in a million' deer captured on camera in Michigan woods"	"Retired Michigan lawmaker and amateur photographer Steven Lindberg took pictures of a deer. That deer had three antlers."
"0"	"This is it, this is the luckiest break in the history of golf"	"Belgium's Thomas Detry was the beneficiary of one of the all-time luckiest bounces you'll ever see in golf, and maybe all of sports."
"1"	"Deer-like animal thought lost to science photographed for first time in 30 years"	"Scientists had thought the silver-backed chevrotain, which had been among a list of 25 "most wanted" lost species compiled by Global Wildlife Conservation (GWC), had fallen victim to habitat loss and intensive hunting."
"1"	"Montana Men Arrested With $4.25 Million Worth of Marijuana Go Free"	"Two Montana men arrested for possession of 900 pounds of marijuana had their charges dismissed when a judge ruled the seizure was illegal."
"1"	"Queen Elizabeth Finally Had Her Dream Photoshoot, Thanks to Royal Dresser Angela Kelly"	"Her advisors worried that her casual pose would "bring the monarchy down." (It didn't.)"
"0"	"USA TODAY interview: Nikki Haley isn't running for president. That is, not yet."	"Interview: Nikki Haley just may be the only top Trump official who has maintained good relations with the president and yet defined some distance."
"0"	"This is Chick-fil-A's most-ordered menu item"	"There may be a lot of things you don't know about Chick-fil-A, but if there's one thing you definitely know about the fast food chain, it's that it has a massive following. Chick-fil-A is quickly growing and has become the third-most profitable chain restaurant in America. With millions of devoted fans and diners, we had to ask: What is Chick-fil-A's most popular menu item? 10 Ways Fast Food Chains Are Playing With Your Head The most-ordered..."
"1"	"Ruth Bader Ginsburg misses court due to illness"	"Supreme Court Justice Ruth Bader Ginsburg was not on the bench for oral arguments Wednesday due to illness, according to Chief Justice John Roberts."
"1"	"Meghan Markle and Hillary Clinton Secretly Spent the Afternoon Together at Frogmore Cottage"	"Meghan Markle Invites Hillary Clinton to Her Frogmore Cottage Home"
"1"	"The World's Largest Desert Is Covered In Ice"	"Not all deserts are hot, sandy places. In fact, the largest one on the planet is covered in ice."
"1"	"Poland asks Netflix to make changes to documentary about Nazi death camp guard"	"Poland asks Netflix to make changes to documentary about Nazi death camp guard"
"1"	"Several blasts of arctic cold will bring an early winter to millions across the US"	"Arctic cold blasts will hit much of the United States this week, bringing an early winter to millions with frosts, freezes and cold temperatures"
"1"	"The 'race whisperer'"	"A black activist convinced a neo-Nazi he'd save him from legal ruin. Then the real plan got underway."
"1"	"U.S. Marshals Auctioning Off 149 Vehicles From DC Solar Scam"	"The largest single car collection that the USMS has ever sold!"
"1"	"Cody Simpson Releases New Song Inspired by Miley Cyrus"	"The 22-year-old singer is gushing about his "Golden Thing!""
"1"	"Oreo just released a holiday cookie house kit   here's where to find it"	"Step aside, gingerbread."
"1"	"Miranda Lambert Reveals the Real Reason Behind Her Secret Wedding: 'It's Not for Everybody Else'"	"Miranda Lambert Reveals Why She Secretly Married Brendan McLoughlin"
"0"	"The most talked about movie moments of the 2010s"	"Let's try to emphasize the positive, but there's one particular sequence that was so special in its awfulness, it had to go on this list. See if you can guess which one it is."
"1"	"Parents changing pleas as prosecutors threaten more charges in college admissions case"	"LOS ANGELES - Federal prosecutors are ratcheting up pressure on parents who have maintained their innocence in the college admissions scandal with a warning they intend to file additional criminal charges as early as next week, according to sources familiar with the discussions."
"1"	"Truck Smashing Into Gas Station Could Be The Dumbest Crash Story Ever"	"It's not so much the crash. but what the driver does afterward."
"1"	"Utah death-row inmate featured in best-selling book dies"	"SALT LAKE CITY (AP)   A Utah death-row inmate who killed his brother's wife and her toddler because of his strong polygamist beliefs in a case made famous by the book "Under the Banner of Heaven" has died of natural causes, prison officials said Monday. Ron Lafferty, 78, died at the state prison in the Salt Lake City suburb of Draper, Utah Department of Corrections spokeswoman Kaitlin Felsted said. The state attorney general's office had..."
"1"	"Rosie O'Donnell: Barbara Walters Isn't 'Up to Speaking to People' Right Now"	"Rosie O'Donnell: Barbara Walters Isn't 'Up to Speaking to People' Right Now"
"0"	"Eight dead as Cyclone Bulbul smashes into India, Bangladesh coasts"	"Eight people died and more than two million others spent a night huddled in storm shelters as Cyclone Bulbul smashed into the coasts of India and Bangladesh with fierce gales and torrential rains, officials said Sunday."
"1"	"Duchess Meghan Describes 'Really Challenging' Life as New Royal: I'm Not OK"	"Duchess Meghan Describes 'Really Challenging' Life as New Royal: I'm Not OK"
"1"	"Harper happy for Nationals: 'Jealousy isn't good'"	"Bryce Harper has no regrets about leaving the Washington Nationals in free agency last offseason - even though his former team is now playing for a championship for the first time since 1933."
"1"	"Nunes Aide Is Leaking the Ukraine Whistleblower's Name, Sources Say"	"A top aide to Rep. Devin Nunes has been providing conservative politicians and journalists with information and misinformation about the anonymous whistleblower who triggered the biggest crisis of Donald Trump's presidency, two knowledgeable sources tell The Daily Beast."
"0"	"Do not try this at home: How to turn $3,000 into $1.7 million"	"Reddit's Wall Street Bets group learned a valuable lesson in responsible investing this week and, after years of encouraging and celebrating extreme risk-taking, the crew has finally embraced a more conservative approach. Just kidding. YOLO!"
"1"	"The son of a Chinese billionaire has been banned from flying first class, playing golf, buying property, or going clubbing"	"Wang Sicong, the heir of Chinese real estate mogul Wang Jianlin's estimated $12.5 billion fortune, is said to have a personal debt of $21.6 million."
"1"	"J.J. Watt has sobering quote after season-ending injury"	"The Houston Texans lost the rock of their team for the season during Sunday's win over the Oakland Raiders. Stud pass rusher and future Hall of Famer J.J."
"1"	"Former Deadliest Catch Star Jerod Sechrist Arrested, Charged with Heroin Possession"	"Deadliest Catch: Jerod Sechrist Charged with Heroin Possession"
"0"	"She posted for help with a quilt. More than 1,000 answered"	"The National Quilt Museum in Paducah, Kentucky, will display the finished product sometime next year"
"1"	"Lance Altimeter Is A Delicious Drop-In Truck Camper Debuting At SEMA"	"The all-in-one Overlanding package sleeps four and is fully equipped for an off-grid weekend."
"1"	"California wildfire compensation deadline looms, 70,000 victims may miss out on payments"	"Tens of thousands of California residents who are eligible to receive payments for damages sustained after a series of devastating wildfires are facing a hard deadline Monday to file claims that may leave many left without nothing."
"0"	"Hearing set for man charged in Alabama woman's disappearance"	"A man charged in the disappearance of a missing Alabama college student is due in court for a hearing that could reveal some evidence about the case."
"0"	"Can you answer these real Jeopardy questions about TV shows?"	"Culling data straight from the "Jeopardy!" archives, Stacker will provide a "clue" about TV shows and then present the answer in the form of a question on the following slide. Can you answer these real "Jeopardy!" questions about TV shows?"
"0"	"3 dead, dozens injured as Australia wildfires raze homes"	"Wildfires razing Australia's drought-stricken east coast have left three people dead, several missing and dozens injured, with over 150 homes destroyed, officials said Saturday."
"1"	"Kanye West is teaming up with pastor Joel Osteen: Details"	"The rapper and the megachurch leader are planning to speak together at Houston's Lakewood Church."
"0"	"This little Montana town is full of Power Wagons and Mustangs"	"You never know what sorts of treasures hide down that unpaved backroad."
"1"	"Bruce Willis brought Demi Moore to tears after reading her book"	"Demi wasn't sure how her ex would feel about her book until he called her."
"1"	"First construction of brand-new border wall in Texas begins"	"Construction on the Trump administration's first totally new border wall   where none existed previously   has started in Texas, just southeast of the town of McAllen along the Rio Grande river, U.S. Customs and Border Patrol has confirmed."
"0"	"Cold weather: 70% of the country will experience freezing temperatures this week"	"Roughly 70% of the US will experience freezing temperatures this week as an Arctic blast hits two thirds of the country. Over 240 million people are under winter warnings, watches and advisories."
"1"	"Hailey Baldwin wore three show-stopping dresses during her wedding, and put a unique twist on each one"	"Hailey Baldwin's three custom gowns were designed by Virgil Abloh of Off-White, Vera Wang, and Ralph & Russo."
"0"	"Christopher Johnson has hitched his reputation to Adam Gase"	"Jets CEO Christopher Johnson broke his 182-day silence by confirming a Daily News report that he has no plans to fire Adam Gase. The team's acting owner, who took shelter amid the team's nightmarish first two months, made it clear that Gase will be back in 2020 despite growing unrest from a frustrated fan base at the team's poor play and lack of competitiveness during their 2-7 start. "I understand it," Johnson said of fans' frustrations in a..."
"0"	"Pete Davidson, Kaia Gerber Are Dating, Trying to Stay 'Low Profile'"	"Pete Davidson, Kaia Gerber Are Dating, Trying to Stay 'Low Profile'"
