"1"	"Supreme Court leans toward expanding Clean Water Act to protect oceans from wastewater"	"Supreme Court justices, both conservative and liberal, appeared skeptical Wednesday of a Trump administration argument that the federal Clean Water Act should not apply to sewage plant wastewater that flows into the ground and eventually seeps into federally protected waters, such as rivers or oceans."
"0"	"THEN AND NOW: What all your favorite '90s stars are doing today"	"These heartthrobs and fan favorites made the 1990s one of the best decades of the century. Here's what they're up to now."
"1"	"'Climate change will not be on the agenda' of next G-7, White House says"	"While scientists continue to warn that climate change poses an existential threat to the planet, President Trump won't be talking about it at next year's G-7 summit at one of his Florida golf resorts. "Climate change will not be on the agenda," acting chief of staff Mick Mulvaney told reporters gathered in the White House briefing room Thursday, without elaborating. Mulvaney announced that the G-7 meetings would be held on June 10 and 11 at at..."
"1"	"Mormons urge Utah not to bar "conversion therapy" for LGBTQ minors"	"The church's stand is opposed by LGBTQ rights advocates, and the American Psychiatry Association and AMA, among others, also want the therapy banned"
"1"	"Schiff: Mulvaney comments on Ukraine aid have made things 'much, much worse'"	"House Intelligence Committee Chairman Adam Schiff (D-Calif.) said Thursday that acting White House chief of staff Mick Mulvaney's comments linked the withholding of aid to Ukraine to investigations into the 2016 election have made things "much worse" for the president. "I think Mr. Mulvaney's acknowledgment means that things have gone from very, very bad to much, much worse," Schiff, a key Democrat in the impeachment inquiry of President..."
"0"	"13 Reasons Why's Christian Navarro Slams Disney for Casting 'the White Guy' in The Little Mermaid"	"13 Reasons Why's Christian Navarro Slams Little Mermaid's Eric Casting"
"0"	"The most talked about movie moments of the 2010s"	"Let's try to emphasize the positive, but there's one particular sequence that was so special in its awfulness, it had to go on this list. See if you can guess which one it is."
"0"	"Last survivor of the Hindenburg disaster dies at age 90"	"The last remaining survivor of the Hindenburg disaster, Werner Gustav Doehner, who suffered severe burns to his face, arms and legs before his mother managed to toss him and his brother from the burning airship, has died. Doehner, the last among 62 passengers and crew who escaped the May 6, 1937 fire, was 90. The fire killed his father, sister and 34 others. He was just 8 years old at the time of the crash."
"1"	"State Department agrees to turn over Ukraine documents, potentially providing Democrats with impeachment fodder"	"The State Department has agreed to release documents related to President Trump's handling of aid to Ukraine."
"1"	"Sondland prepared to deny he was warned about Ukraine work"	"Gordon Sondland, the U.S. ambassador to the European Union, is prepared to tell lawmakers this week that top White House national security officials never personally raised concerns with him about his dealings with Rudy Giuliani in Ukraine, a person familiar with his account told The Associated Press on Tuesday. That statement would be contrary to earlier testimony that Sondland's actions set off alarms in the West Wing...."
"0"	"Court puts hold on Rodney Reed's scheduled execution"	"With new, compelling evidence in Reed's case, the call to halt his Nov. 20 execution has been building in recent weeks."
"1"	"Trump administration considers adding more countries to travel ban list"	"Trump administration officials are discussing adding more countries to the travel ban list, two sources tell CNN, potentially expanding the controversial ban that has been criticized as discriminating against Muslims."
"1"	"Egypt uncovers 'huge cache' of ancient sealed coffins"	"Archaeologists have discovered more than 20 wooden coffins at a necropolis in Luxor, according to Egypt's Ministry of Antiquities."
"1"	"James Comey Would Like to Help"	"The former F.B.I. director wants an end to the Trump presidency. And yes, he knows you might think he caused it."
"1"	"Lori Loughlin Is 'Absolutely Terrified' After Being Hit With New Charge"	"Lori Loughlin Is 'Absolutely Terrified' After Being Hit With New Charge"
"1"	"McDonald's apologizes for 'Sundae Bloody Sundae' Halloween promotion"	"McDonald's has canceled a promotion for a "Sundae Bloody Sundae" ice cream that was available in Portugal for Halloween."
"0"	"Report: Police investigating woman's death after Redskins' player Montae Nicholson took her to hospital"	"Police are investigating an apparent drug-overdose death of a woman after the Redskins' Montae Nicholson took her to a hospital, according to reports."
"0"	"How Google Interferes With Its Search Algorithms and Changes Your Results"	"Pressed by businesses, interest groups and governments, the internet giant uses blacklists, algorithm tweaks and an army of contractors to shape what you see."
"1"	"Green Beret awarded Medal of Honor for saving lives"	"Master Sergeant Matthew Williams and his team of green berets choppered into a remote Afghan valley in the spring of 2008. Their mission, part of which was recorded, was to capture or kill a senior terrorist leader. But nothing went right. To begin with, it was too rocky to land."
"1"	"White House Personnel Director Tells Trump Top DHS Picks Are Ineligible"	"The White House personnel office chief has told President Trump that his top two picks to fill the Homeland Security Secretary job aren't eligible under a federal law dictating who can fill the role without Senate confirmation."
"1"	"Barneys Is Sold for Scrap, Ending an Era"	"Authentic Brands Group will take control of the Barneys name   one that has been part of the Manhattan landscape since 1923   and license it to other companies like Saks Fifth Avenue. The firm B. Riley Financial is preparing to liquidate Barneys' high-end wares, at its five stores and two Warehouse locations, starting with private sale events for Barneys' "most loyal" shoppers next week."
"0"	"Opinion: Colin Kaepernick is about to get what he deserves: a chance"	"The end may be near for the 3-year-old saga of Colin Kaepernick as the quarterback is scheduled to work out for teams on Saturday."
"1"	"Asian American group sends cease-and-desist letter to California prison system"	"California Gov. Gavin Newsom vetoed the bill that would have barred the prison system from using resources to assist private prison corporations conducting immigration arrests."
"1"	"James Mattis mocks Trump's bone spurs"	"Former Defense Secretary James Mattis makes light of President Trump calling him "the world's most overrated general" during his keynote address at the annual Al Smith dinner, a philanthropic event where roasts are tradition."
"1"	"State Department official expected to appear as part of impeachment probe"	"A State Department official is scheduled to speak before three committees on Saturday in relation to the ongoing impeachment probe."
"1"	"McConnell resolution prods Trump to keep troops in Syria"	"Senate Majority Leader Mitch McConnell introduced legislation Tuesday denouncing Turkey's invasion of northern Syria and gently prodding President Donald Trump to halt his withdrawal of U.S. troops from the embattled country. But McConnell, R-Ky., said lawmakers should refrain from imposing sanctions on Turkey for now, saying, "We don't want to further drive a NATO ally into the arms of the Russians." That puts him into..."
"0"	"Pair Of 'New' 1987 Buick Grand Nationals Pulled From Garage After 30 Years"	"This pair of Grand Nationals have only 1,400 miles combined!"
"0"	"Archie's Photo Album: Prince Harry, Duchess Meghan's Royal Baby"	"So cute!"
"1"	"Judge urges House to negotiate with Trump in tax return fight"	"A U.S. judge on Wednesday told lawyers for the House of Representatives that it should try to reach a compromise with the Trump administration over access to the president's tax returns, saying the two branches of government are required to at least attempt to make a deal."
"1"	"Allies believe Trump gave 'green light' to Turkey despite US denials"	"President Trump betrayed the Syrian Kurds by allowing Turkey to launch a destabilizing offensive against U.S. partners, according to diplomats and analysts unpersuaded by U.S. claims that he had no choice."
"0"	"Joshua Jackson and Jodie Turner-Smith spark marriage speculation"	"Joshua Jackson and Jodie Turner Smith may be secretly married."
"0"	"The Unlikely Star of My Family's Thanksgiving Table"	"It's hard to remember life before broccoli cheese rice casserole. Or, B.B.C.R.C.E. (Before Broccoli Cheese Rice Casserole Era). What did the Kim clan have to look forward to every Thanksgiving before the cheesy family-favorite side dish entered our lives? Stuffing, maybe. Green bean casserole. Macaroni and cheese. Ham in cola, a quirky recipe from Nigella Lawson that she picked up from the American South. Certainly nothing from the Korean..."
"0"	"Taylor Swift Says Scooter Braun, Scott Borchetta Are Blocking Her From Playing Old Hits at AMAs"	"Taylor Swift has taken to social media to tell fans that Scott Borchetta, her former label head at Big Machine Records, and his new partner Scooter Braun are trying to nix her plans for a retrospective performance at the American Music Awards, as well as denying the use of her recordings for a documentary she"
"1"	"Previously secret documents detail alleged abuse of children in Border Patrol custody"	"SAN DIEGO - The American Civil Liberties Union has made public 35,000 pages of previously secret reports detailing allegations of abuse of minors by Border Patrol agents. The documents describe alleged instances of minors being beaten and robbed by agents, migrants hiding under bushes being run over by agents riding ATVs, and of minors being placed in detention with adults. At least one case ..."
"0"	"Oregon may face ICE push-back on new limits for courthouse arrests"	"Under a new rule enacted Thursday by Oregon Supreme Court Chief Justice Martha Walters, agents with U.S. Immigration and Customs Enforcement are forbidden from arresting immigrants inside or near the state's courthouses unless the agents first receive warrants from a judge."
"0"	"Meghan Markle and Hillary Clinton Secretly Spent the Afternoon Together at Frogmore Cottage"	"Meghan Markle Invites Hillary Clinton to Her Frogmore Cottage Home"
"0"	"Ford v Ferrari: the forgotten car at the heart of the Le Mans '66 clash"	"The Ferrari-beater you've probably never heard of"
"1"	"Schumer warns of impeachment-fueled shutdown"	"It's a nightmare scenario for Washington: A government shutdown smack in the middle of the House's impeachment inquiry of President Donald Trump."
"1"	"As Warren Gains in Race, Wall Street Sounds the Alarm"	"Warren's rise in the Democratic primary polls is rattling bankers, investors and their affluent clients, who see in the Massachusetts senator a formidable opponent who could damage not only their industry but their way of life."
"1"	"Shouting match erupts in Vindman deposition as Democrats accuse Republicans of trying to out whistleblower"	"Democrats and Republicans got into a shouting match behind closed doors on Tuesday while interviewing a witness in the impeachment investigation, with Democrats accusing Republicans of trying to out the anonymous whistleblower who sparked the impeachment inquiry, according to five sources from both parties."
"1"	"The Fragility of American Citizenship"	"Some people are learning that their birth or naturalization certificates aren't enough to prove citizenship a problem that the Fourteenth Amendment should ideally prevent."
"1"	"Man wearing MAGA hat arrested for dousing anti-Trump demonstrators with bear spray"	"A California man was arrested after authorities say he unloaded bear repellent into a crowd of anti-Trump protesters during a scuffle."
"1"	"Court rules for LA in lawsuit against Trump"	"A federal appeals court decided unanimously Thursday that the Trump administration may not force Los Angeles to help the government deport immigrants as a condition of receiving a federal police grant."
"1"	"Why President Trump's kids are probably celebrating his move to Florida"	"The No. 1 reason billionaires decide to move."
"1"	"Ohio voters express angst over impeachment"	"Support for impeachment may be on the rise, but the view from central Ohio is strikingly complicated and nuanced."
"1"	"Capital One customers can't withdraw money after outage"	"Account holders at the bank said they can't use debit cards, access their accounts or pay bills"
"1"	"Erdogan Walks Back Refusal to Meet Pence for Syria Talks"	"The Turkish president initially said he would talk only with President Donald Trump."
"1"	"Louisiana governor's race is the latest test of Trump's clout"	"On Saturday, the final governor's race of the year is the next test of how much Trump's clout can lift a candidate. In Kentucky, the GOP candidate lost, but in Mississippi, the Republican won"
"0"	"This stately home is having the ultimate yard sale"	"Nicky Haslam's English country estate, The Hunting Lodge, is filled with precious treasures and almost all of them will be sold at auction next month."
"1"	"Fake Facebook Ad Claiming Lindsey Graham Backs the Green New Deal is Actually a Test for Zuckerberg"	""It just shows you that only is Facebook not enforcing any kind of truth in advertising, there's no tools for people to get it to the fact-checkers that I can see and people believe it," the man behind the fake 90-second ad told Newsweek."
"0"	"3 Indiana judges suspended after a night of drinking turned into a White Castle brawl"	"Hours before they were to attend an educational conference in Indianapolis, three judges went out drinking for a few hours and decided to walk to a strip joint."
"1"	"Joe Biden reportedly denied Communion at a South Carolina church because of his stance on abortion"	"Joe Biden has a complicated history with the Catholic Church."
"1"	"Funeral services set for US Rep. Elijah Cummings"	"BALTIMORE (AP)   A wake and funeral for U.S. Rep. Elijah Cummings will be held next week at the church where he worshipped for nearly four decades. New Psalmist Baptist Church spokeswoman Joi Thomas said in an email that services for the Maryland Democrat are scheduled for Oct. 25. She said the wake will begin at 8 a.m., followed by the funeral at 10 a.m. Bishop Walter S. Thomas Jr., the church's pastor, will deliver the eulogy in the 4,000-seat..."
"1"	"Trump records 'strongly corroborate' sex assault claims, accuser says"	"President Trump's own records "strongly corroborate" the sexual assault accusations of Summer Zervos and belie the president's denials, a new court filing states"
"1"	"Just in time for skating season, Trump's company scrubs his name from N.Y. ice rinks"	"For the first time since Trump took office, two of his businesses seem to downplay their connection to his name."
"0"	"'This tarnishes everything': Astros cheating allegations have baseball world demanding punishment"	"The Houston Astros are facing public backlash over revelations that the team may have been using electronic means to steal signs."
"0"	"Bill Russell finally accepts Basketball Hall of Fame ring"	"SPRINGFIELD, Mass. (AP)   Bill Russell finally accepted his Basketball Hall of Fame ring. The 11-time NBA champion, five-time MVP, Olympic gold medalist and two-time NCAA champ said on Twitter on Friday that he was presented with his Hall of Fame ring in a private ceremony. The 85-year-old Boston Celtics great didn't attend the induction ceremony in 1975. He said he didn't deserve to be the first black player inducted, tweeting: "I felt others...""
"1"	"Supreme Court tosses challenge to Republican-drawn Michigan electoral maps"	"Supreme Court tosses challenge to Republican-drawn Michigan electoral maps"
"1"	"Soldier uses inflatable duck to surprise son with his military homecoming"	"This raffle was rigged, but everyone at the school was 100% behind it."
"1"	"California sheriff's deputy shot dead, ride-along injured in 'active shooter incident,' officials say"	"A police officer in Northern California was killed and another deputy was injured after an "active shooter" incident early Wednesday, according to officials."
"0"	"Dow tops 28,000 for first time, capping 4-week win streak"	"The Dow Jones Industrial Average ended at another record high Friday after White House economic adviser Larry Kudlow said China and the U.S. were getting close to reaching a trade deal."
"0"	"4 takeaways from Marie Yovanovitch's testimony"	"All the highlights, with fact-checking and analysis."
"1"	"Trump Wants Defense on Substance, Not Process, of Impeachment"	"President Trump said he has encouraged his GOP allies to defend him on the substance of the impeachment probe, instead of focusing on criticizing the process, ahead of another week of scheduled testimony from administration officials."
"1"	"The Latest: Trump credits 'tough love' for cease-fire deal"	"President Donald Trump is crediting his threat of sanctions on Turkey as "tough love" that led the country to agree to a five-day cease-fire in its battle with Kurds in northern Syria."
"1"	"James Cromwell Arrested While Protesting Dog Laboratory"	"The actor was charged with hindering proceedings by disorderly conduct at Texas A&M University."
"0"	"9 renovation tips to boost resale value"	"Making the right renovation decisions can help you sell your house quicker, and for more money."
"1"	"Pentagon leader appeals to Trump to allow military justice cases to proceed unfettered"	"Trump has expressed interest in taking action on cases in which service members have faced war-crimes or other serious charges."
"0"	"Home Values in These Cities Have Grown the Most Since the Last Recession"	"Home prices reached their lowest point in 2012 following the Great Recession. Many Americans who purchased homes during this time now are reaping the rewards. Here are five cities where home prices have increased in value since the last recession."
"1"	"Trump labels Tlaib a 'despicable human being'"	"President Trump attacked Rep. Rashida Tlaib (D-Mich.) on Twitter Sunday after she said in an interview that House Democrats have discussed jailing allies of the president who refused to comply with congressional subpoenas."A despicable human being!" Trump tweeted in a post that also retweeted commentary on the matter by White House social media director Dan Scavino, who accused Democrats of planning a "coup."A despicable human being!..."
"0"	"I Overate at Dinner Until I Started Doing This 1 Simple Thing on Sundays (It Takes 10 Minutes!)"	"Another reason Sunday is the best day to meal prep."
"1"	"Chick-fil-A cancels only UK shop after backlash"	"Chick-fil-A is being forced to abandon its first and only store in Britain just days after it was opened. Local LGBT rights activists protested the American chain over the policies of its religiously-conservative owners. Matthew Larotonda reports."
"1"	"Trump education official to resign and call for mass student loan forgiveness"	"A senior student-loan official in the Trump administration said he would resign Thursday and endorse canceling most of the nation's outstanding student debt, calling the student-loan system "fundamentally broken.""
"1"	"Armed Man Wearing Body Armor Arrested At Dallas Trump Rally"	"Dallas police arrested an armed adult male wearing body armor at Trump's Keep America Great rally Thursday night."
"0"	"South Carolina teen gets life in prison for deadly elementary school shooting"	"Jesse Osborne, the teenager responsible for a shooting at a South Carolina elementary school in 2016, was sentenced to life in prison."
"1"	"Exclusive: U.S. withholding $105 million in security aid for Lebanon - sources"	"U.S. President Donald Trump's administration is withholding $105 million in security aid for Lebanon, two U.S. officials said on Thursday, two days after the resignation of Lebanese Prime Minister Saad al-Hariri."
"1"	"As companies flee blue cities, middle class workers are hurt"	"Burdensome taxes will drive out even more businesses and harm local economies in the future."
"1"	"'Wheel Of Fortune' Guest Delivers Hilarious, Off The Rails Introduction"	"We'd like to solve the puzzle, Pat: Blair Davis' loveless marriage? On Monday, "Wheel of Fortune" welcomed as a new contestant trucking business owner Blair Davis, who offered a biting introduction for himself. When host Pat Sajak asked the man from Cardiff, California, about his family, Davis plunged into one of the darkest personal summaries the show has likely ever heard. "I've been trapped in a loveless marriage for the last 12 years to an...""
"1"	"Republicans' protest interrupts impeachment testimony"	"A senior Pentagon official who oversees U.S. defense policy on Ukraine and Russia testified privately in the Democratic-led U.S. House inquiry."
"0"	"The latest on Brad Pitt and Angelina Jolie's post-split relationship, plus more news"	"Brad Pitt reportedly wants to see his kids more than Angelina Jolie has made possible. Plus, more celebrity news for Nov. 14, 2019."
"1"	"Justice Dept. appeals order on Mueller grand jury testimony"	"The Justice Department is appealing a judge's order directing the department to produce to the House secret grand jury testimony from special counsel Robert Mueller's Russia investigation."
"1"	"Nunes Raised Steele Dossier in Sondland Hearing"	"During a closed-door impeachment meeting on Capitol Hill, Rep. Devin Nunes (R-CA) brought up a topic that surprised some attendees: the Steele dossier. The context, according to three sources familiar with the episode, was his effort to explain why President Trump might be "upset" about Ukraine. Nunes, the top Republican on the House Intelligence Committee that is leading the impeachment probe, said some of the dossier's contents dealt with..."
"1"	"Oleg Deripaska-Linked Firm Was Raided for Undisclosed U.S. Inquiry"	"U.S. prosecutors are seeking records from a company associated with Russian billionaire Oleg Deripaska as part of a previously unreported investigation, according to documents filed in a London court."
"1"	"Florida Can't Block Former Felons From Voting If They Owe Money And Can't Pay: Judge"	"Florida election officials can't block a group of nearly 20 people with felonyconvictions from registering to vote if they can't afford to repay theirfinancial obligations, a federal judge in Florida ruled on Friday.The ruling, a preliminary injunction, is a victory for voting rights groupsthat sued the state over a new law that required people with felonyconvictions to repay financial obligations before they could vote again."The court held...""
"0"	"What Happens When Your Cruise Has to Rescue Another Ship"	"Celebrity Cruises' 'Xpedition' ran aground in the Galapagos last week, but what followed was a master class in how to respond."
"1"	"China already snapping up U.S. farm goods, Trump claims"	"President Donald Trump boasted Sunday without providing evidence that China had "already begun" making large purchases of U.S. agricultural products as part of last week's tariff deal with Beijing."
"0"	"Pete Davidson, Kaia Gerber Are Dating, Trying to Stay 'Low Profile'"	"Pete Davidson, Kaia Gerber Are Dating, Trying to Stay 'Low Profile'"
"1"	"ISIS Leader Paid Rival for Protection but Was Betrayed by His Own"	"The Islamic State leader Abu Bakr al-Baghdadi was able to hide out in an unlikely part of Syria, the base of a rival group, because he was paying protection money to its members, according to receipts for the payments recovered by researchers."
"1"	"Boris Johnson wins key Brexit bill vote but faces another"	"LONDON (AP)   British Prime Minister Boris Johnson cleared one hurdle Tuesday when lawmakers approved his European Union divorce bill in principle in the House of Commons, but he faces another vote that could still derail his plans to take Britain out of the bloc on Oct. 31. The House of Commons voted 329-299 to send the European Union (Withdrawal Agreement) Bill on for further scrutiny and possible amendments. The government wants the Commons..."
"0"	"Browns' Garrett isn't only athlete to use equipment to fight in game"	"In 1969, Bruins player Ted Green was struck in the head with a stick and had to be rushed into emergency surgery."
"1"	"Election Day 2019: Most Important Races and What to Watch For"	"In elections that will determine policy, the political makeup of state legislatures and who lives in governors' mansions, voters will head to the polls Tuesday in states across the country."
"1"	"Facing Investigation, Giuliani Needed a Lawyer, but Firms Stayed Away"	"President Trump's personal lawyer, Rudolph W. Giuliani, said on Wednesday that he had assembled a legal team to represent him in the criminal investigation into his activities related to Ukraine, an announcement that came after weeks of sputtered attempts to find a lawyer willing to take him on as a client. Mr. Giuliani said on Twitter that he would be represented by three lawyers, including his longtime friend, Robert J. Costello. The hires..."
"1"	"President Trump says UFC reception was 'like walking into a Trump Rally'"	"Despite hearing boos, President Trump compares reception from crowd at UFC 244 in New York to one at a campaign event. "Plenty of MAGA ...""
"0"	"George Conway and Trump Jr. trade personal insults during impeachment hearing"	"Conservative commentator George Conway and Donald Trump Jr. squared off via Twitter during Marie Yovanovitch's public impeachment hearing Friday."
"1"	"Pence refuses House request to provide documents related to Ukraine call"	"The vice president's office says it won't cooperate with a "self-proclaimed impeachment inquiry.""
