"1"	"South Florida principal who made controversial comments about the Holocaust is fired"	"The South Florida principal who stirred national controversy after refusing to say the Holocaust was a "factual, historical event" was fired Wednesday during a school board meeting at the recommendation of the district's superintendent."
"1"	"Trump's visit to Chicago creates stir before he even arrives"	"President Donald Trump's visit to Chicago is stirring up a tempest even before he arrives in the city that he's repeatedly derided as the poster child of urban violence and dysfunctional Democratic politics."
"0"	"How To Make Garlic Bread Mac & Cheese By Rachael"	"Rach's fool-proof mac and cheese base gets a tasty dose of garlic breadcrumbs in this yummy comfort food mash-up."
"1"	"STDs at record high in the U.S."	"The CDC says STDs   including gonorrhea, syphilis and chlamydia   have hit a record high with more than 2.4 million reported cases. We explain why."
"1"	"Syria's Assad says Trump's transparency makes him 'best American president' ever"	"Syrian President Bashar Assad says he thinks Donald Trump is the "best American president" ever   because he's the "most transparent"."
"0"	"12 Cars Lose Consumer Reports' Recommendation Over Reliability Issues"	"The Ford F-150, Honda Passport, and others no longer have the designation, but 20 models gain it"
"1"	"Federal judge overturns ObamaCare transgender protections"	"A federal judge on Tuesday overturned ObamaCare protections for transgender patients, ruling that a 2016 policy violates the religious freedom of Christian providers.Judge Reed O'Connor in the Northern District of Texas vacated an Obama-era regulation that prohibited insurers and providers who receive federal money from denying treatment or coverage to anyone based on sex, gender identity or termination of pregnancy.It also required doctors..."
"0"	"30 Best Black Friday Deals from Costco"	"Costco members love shopping at the warehouse store, and they'll love shopping there for holiday gifts just as much."
"1"	"Ukrainian lawmakers are still advancing Trump's goal of probes into Bidens, 2016 election"	"Those working in common cause with the president's and Giuliani's campaign to get Ukraine to investigate Trump's political opponents are moving ahead."
"1"	"Russia questions language of "unusual" Trump letter to Erdogan"	"Russia questions language of "unusual" Trump letter to Erdogan"
"1"	"Nunes Aide Is Leaking the Ukraine Whistleblower's Name, Sources Say"	"A top aide to Rep. Devin Nunes has been providing conservative politicians and journalists with information and misinformation about the anonymous whistleblower who triggered the biggest crisis of Donald Trump's presidency, two knowledgeable sources tell The Daily Beast."
"0"	"Testimony and texts: How the Trump-Ukraine allegations fit together in a timeline"	"With so many current U.S. officials testifying in open hearings, here is how the Trump-Ukraine allegations fit together in a timeline."
"1"	"Fox News contributor: 'Most likely' outcome is Trump doesn't run in 2020"	"Fox News contributor Christopher Hahn predicted that President Trump will not run for reelection in 2020."
"1"	"Anonymous Trump official writing 'unprecedented' inside take"	"NEW YORK (AP)   The Trump administration official who wrote an anonymous essay about resistance from the inside has a book deal. The book, titled "A Warning", will come out Nov. 19, The Hachette Book Group imprint Twelve announced Tuesday. It will likely set off the biggest Washington guessing game since "Primary Colors," the fictionalized take on Bill Clinton's 1992 presidential campaign that turned out to be written by journalist Joe Klein...."
"1"	"Tim Ryan drops out of presidential race"	"Rep. Tim Ryan announced his decision to end his campaign, stating he would run again for his House seat."
"0"	"Ford v Ferrari: the real story"	"The film about the epic Le Mans rivalry promises to be a must for car fans - and this is the real story behind it"
"1"	"We all 'can get it wrong': Mike Pompeo suggests William Taylor misunderstood Ukraine controversy"	"Secretary of State Mike Pompeo cast doubt on the testimony of the top U.S. diplomat in Ukraine by suggesting that the envoy might have misread the diplomatic dialogues that sparked an impeachment inquiry."
"1"	"Donald Trump Jr. reflects on explosive 'View' chat: 'I don't think they like me much anymore'"	"After a heated appearance on "The View" Thursday, Donald Trump Jr. talked about the experience later that day with Sean Hannity on Fox News."
"1"	"Goldman predicts the Fed will make 2 big changes next week"	"The Fed likely will finish its "mid-cycle adjustment" and remove language that it will "act as appropriate to sustain the expansion," according to Goldman Sachs."
"0"	"Queen Elizabeth Just Rode Horseback at Age 93"	"The British monarch isn't letting a small thing like age keep her from living her life."
"0"	"There's a place in the US where its been over 80 degrees since March"	"The Weather Service reports the last time the daily high was below 80 degrees was on March 27 when the high only reached 78 degrees -- which, let's be honest, is still pretty warm."
"1"	"Boris Johnson Has a Brexit Deal. Now He Needs Parliament's Support."	"Britain and the European Union on Thursday agreed on the draft text of a Brexit deal, setting up a fateful showdown in the British Parliament on Saturday, where it was not clear that Prime Minister Boris Johnson could marshal the votes to nail down his plan after three anguished and politically damaging years of debate."
"1"	"Why the world's biggest beer maker is ditching paper labels in favor of a revolutionary labeling process"	"AB InBev, the drinks company that makes Beck's beer, is pioneering new technology to "tattoo" its brand onto 200,000 bottles using just ink"
"1"	"Iran downs drone over southern port city - IRNA"	"Iran has confirmed that its forces shot down a drone on Friday and said it belonged to a foreign country, state news agency IRNA reported."
"1"	"Wisconsin GOP-controlled Senate fires agriculture secretary"	"MADISON, Wis. (AP)   Wisconsin's Republican-controlled Senate fired the state agriculture secretary on Tuesday as the Democratic governor who appointed him watched quietly a row behind lawmakers, a dramatic and highly unusual appearance on the floor of the Senate chamber during debate. The vote to oust Gov. Tony Evers' Cabinet secretary was the latest in a series of skirmishes between the governor and the GOP that comes as Wisconsin is losing..."
"1"	"Lufthansa strike cancels 1,300 flights, stranding thousands"	"Lufthansa said that customers could rebook their flights, but passengers reported having trouble reaching the airline."
"1"	"Trump Expected To Attend UFC 244"	"United States President and Dana White homeboy Donald Trump will attend the UFC 244 pay-per-view (PPV) event on Nov. 2 in New York."
"1"	"Bob Kingsley, Country Radio Legend, Dead at 80"	"Country radio legend Bob Kingley, the longtime host of the nationally syndicated program Bob Kingsley's Country Top 40, died early Thursday in Weatherford, Texas, following a lengthy battle with bladder cancer. He was 80 years old. A member of the Country Radio Broadcasters Hall of Fame, inducted in 1998, he later became only the format's fifth representative in the National Radio Hall of Fame in 2016. Kingsley was 18 and serving in the Air..."
"0"	"Lebanon protesters angered by PM pick"	"Lebanese protesters who have been demanding radical reform reacted with anger Friday to the reported designation of a new prime minister they regard as emblematic of a failed political system."
"0"	"Meghan Markle's Lawyers Debunk Multiple False Tabloid Stories in New Court Documents"	"False, divisive, and completely untrue."
"1"	"Supreme Court to Rule on Trump's Power to Fire Head of Consumer Bureau"	"WASHINGTON   The Supreme Court announced on Friday that it would hear a challenge to the leadership structure of the Consumer Finance Protection Bureau, agreeing to decide whether the president is free to fire its director without cause. The bureau, the brainchild of Elizabeth Warren, then a law professor at Harvard and now a senator and presidential candidate, was created as part of the Dodd-Frank Act, which was passed in 2010 after the..."
"0"	"Why did Santa Clarita shooting happen? Detectives search for motive"	"Investigators are still trying to determine why a 16-year-old Saugus High School student allegedly opened fire in a campus quad Thursday, killing two classmates and injuring three others before turning the weapon on himself."
"0"	"Highway blockade reveals splits in Hong Kong protest movement"	"Highway blockade reveals splits in Hong Kong protest movement"
"1"	"Trump campaign threatens to sue CNN, citing Project Veritas videos"	"An attorney representing President Trump's reelection campaign sent a letter to CNN on Friday threatening to sue."
"1"	"Bolton Objected to Ukraine Pressure Campaign, Calling Giuliani 'a Hand Grenade'"	"The effort to pressure Ukraine for political help provoked a heated confrontation that alarmed John R. Bolton, then the national security adviser."
"1"	"Twitter offers alternative 'read the transcript' shirts"	"Trump campaign dresses supporters in "Read the Transcript" T-shirts. CNN's Jeanne Moos reports on human props."
"1"	"Hawaiian Reef Case at Supreme Court Could Limit Clean Water Act"	"A Supreme Court dispute involving a coral reef off Hawaii could impose major limits on the U.S. Clean Water Act, giving mines and coal-fired power plants what environmental advocates say would be a new license to pollute."
"0"	"Maze of tunnels reveals remains of ancient Jerusalem"	"Controversial excavations under the Holy City uncover layers of history and stoke long-standing tensions."
"0"	"Former North Carolina State, NBA player Anthony Grundy dies in stabbing, police say"	"Anthony Grundy starred at North Carolina State before playing professionally. He was killed in a stabbing Thursday in Louisville."
"1"	"'Go to confession': Scaramucci urges Mick Mulvaney to leave the White House"	"Anthony Scaramucci claimed he feels "bad" for Mick Mulvaney and urged him to resign from his position as acting White House chief of staff."
"1"	"Ukraine Knew of Aid Freeze by Early August, Undermining Trump Defense"	"KIEV, Ukraine   To Democrats who say that President Trump's decision to freeze $391 million in military aid was intended to bully Ukraine's leader into carrying out investigations for Mr. Trump's political benefit, the president and his allies have had a simple response: There was no quid pro quo because the Ukrainians did not know assistance had been blocked."
"0"	"Alex Rodriguez Jokingly Talks About Marrying Jennifer Lopez During Super Bowl Halftime Show"	"Alex Rodriguez Talks Marrying Jennifer Lopez During Super Bowl"
"1"	"Republican group slams Trump over Ukraine, G7 in new ads"	"A conservative group that has frequently criticized President Donald Trump is running two television and digital ads that accuse him of using the Oval Office for personal profit and calls on his fellow Republicans to condemn the solicitation of foreign interference in U.S. elections."
"0"	"Cannabis Use Disorder is Rising in U.S. States Where Weed is Legal"	"Cannabis use disorder is where a person's use of the drug negatively affects their life over the course of 12 months."
"1"	"National Rifle Association Responds to Democratic Victory in Virginia, Warns of "Life Under a Distant Tycoon's Thumb""	"The group was also outspent by organizations such as Everytown and Giffords, which invested heavily in the Virginia legislative races."
"1"	"Boris Johnson Loses a Critical Brexit Vote, Throwing the Process Into Disarray"	"Prime Minister Boris Johnson suffered a damaging setback Tuesday in his quest to take Britain out of the European Union, losing a critical vote in Parliament and putting his plans for Brexit on hold as Britain's three-year struggle to resolve the issue continued to defy any solution."
"1"	"Rudy Giuliani is looking for a defense attorney, sources say"	"Rudy Giuliani has been approaching defense attorneys for possible representation, according to three sources familiar with the matter."
"1"	"George Conway and Trump Jr. trade personal insults during impeachment hearing"	"Conservative commentator George Conway and Donald Trump Jr. squared off via Twitter during Marie Yovanovitch's public impeachment hearing Friday."
"1"	"Cummings' widow responds to Trump's attacks, gets standing ovation"	"Dr. Maya Rockeymoore Cummings, the widow of the late Rep. Elijah Cummings, appeared to respond to President Trump's previous attacks of her husband during a speech at his funeral."
"1"	"Trump blasts 'Never Trump' Republicans as 'human scum'"	"President Trump on Wednesday excoriated so-called Never Trump Republicans."
"1"	"California investigating Facebook, demands subpoenaed documents"	"California is investigating Facebook Inc's disclosure of user data to Cambridge Analytica and other partners, the state revealed on Wednesday in a court filing that demanded that the social media giant respond to its subpoena."
"1"	"Mitch McConnell snubbed by Elijah Cummings' pallbearer in handshake line at U.S. Capitol ceremony"	"A pallbearer appeared to refuse to shake Mitch McConnell's hand as Rep. Elijah Cummings was lying in state at the Capitol."
"0"	"Prince Harry Talked to Another Royal About His Desire for Privacy"	"Prince Albert of Monaco shares the personal advice he gave Harry when they met this month."
"1"	"Senate Republicans consider including Bidens in Trump impeachment trial"	"There's growing GOP interest in scrutinizing Hunter Biden's overseas business dealings as a counter to House Democrats' inquiry."
"0"	"Cows swept away by Hurricane Dorian found alive   but how?"	"A trio of wild cows believed to have been swept away by the storm surge from Hurricane Dorian have been found on a nearby island in North Carolina"
"1"	"Bed, Bath and Beyond Pulls 'Blackface Pumpkins From the Shelves"	"The pumpkins were removed from stores after an upstate New York community filed complaints."
"1"	"Sessions wins endorsement from key GOP senators"	"Eleven Senate Republicans Friday endorsed former Attorney General Jeff Sessions in his bid to regain the Senate seat in Alabama that he held for two decades, bucking a White House that has frowned on him running again."
"1"	"Roger Stone Lied to Congress After Helping Trump Win, Prosecutor Says"	"Roger Stone wasn't lying to Congress about his contact with WikiLeaks over stolen emails that helped Donald Trump win the presidency, his lawyer told a jury at the start of the longtime Republican operative's criminal trial."
"1"	"Watch: 'The View' Versus Donald Trump Jr.: Loud, Low Blows, Politics, Scandals And Great TV"	"Updated throughout, videos added Whoopi Goldberg wouldn't say his name, Sunny Hostin said he was lying, Abby Huntsman accused him of using "dictator" tactics. And Donald Trump Jr. gave it back, accusing Joy Behar of once wearing blackface and resurrected Goldberg's defense of Roman Polanski as not committing "rape rape," all in a"
"1"	"'Nothing-burger': US-China truce leaves big issues for later"	"President Donald Trump heralded a breakthrough in U.S.-China trade talks, and markets rallied in relief over a de-escalation in tensions between the world's two biggest economies. But closer inspection suggests there isn't much substance, at least not yet, to the temporary truce Trump announced Friday at the White House after the U.S. and China wrapped up their 13th round of trade talks. Yes, Trump agreed to suspend a tariff..."
"1"	"British lawmakers reject new election as EU agrees Brexit delay"	"The development comes just three days before Britain was due to become the first country ever to leave the 28-nation bloc on Oct 31."
"1"	"Florida county backs Trump, refuses to bring New York Times to library computers"	""Fake news, OK I agree with President Trump," Commissioner Scott Carnahan said. "I don't want the New York Times in this county.""
"1"	"Macabre Video of Fake Trump Shooting Media and Critics Is Shown at His Resort"	"A video depicting a macabre scene of a fake President Trump shooting, stabbing and brutally assaulting members of the news media and his political opponents was shown at a conference for his supporters at his Miami resort last week, according to footage obtained by The New York Times."
"1"	"US's Mnuchin to lead 5-nation trip, including controversial Saudi event"	"Treasury Secretary Steven Mnuchin will lead a US delegation next week on a five-country tour of the Middle East and India, including attending a Saudi investment conference he boycotted last year over the gruesome murder of a journalist, officials said Friday."
"0"	"High tides surge through Venice, locals rush to protect art"	"Exceptionally high tidal waters surged through Venice again on Friday, prompting the mayor to close St. Mark's Square and call for more donations for repairs just three days after the Italian lagoon city suffered its worst flooding in 50 years."
"1"	"Chinese Nuclear Stockpile Clouds Prospects for U.S.-Russia Deal"	"A key hurdle to extending a landmark nuclear treaty between the U.S. and Russia isn't Donald Trump or Vladimir Putin. It's China."
"1"	"The economic picture is darkening in states critical to Trump's reelection bid"	"A closer look at key battleground states could spell trouble for the candidate, whose populist economic proposals have been central to his campaign."
"1"	"Boris Johnson 'on brink of Brexit deal' after border concessions"	"Negotiators understood to have agreed in principle to customs border down Irish Sea"
"0"	"Treasury yields tick higher amid uncertainty over US-China trade deal"	"U.S. government debt prices were lower Friday morning, as traders monitored U.S.-China trade developments."
"0"	"Why I'm Done Celebrating The Accomplishments Of Couples"	""What is real? How do you define real?" - Morpheus, The Matrix, 1999 I've had the "summer of six weddings." The "spring of seven baby showers." The "year with nine bachelorette weekends"   not parties, but whole weekends for some reason. And while I could tell tales of the financial strain imposed when a single person celebrates other people for their entire adulthood   and I do serve that tea boiling   instead I want to talk about feelings...."
"1"	"What Elijah Cummings' death means for impeachment"	"The passing of House Oversight Chairman Elijah Cummings leaves a vacancy in the leadership of the congressional impeachment inquiry."
"0"	"Opinion: NFL had no choice but to send a clear message with Garrett punishment"	"The NFL decision to suspend Myles Garrett for the rest of the Cleveland Browns season was not surprise and sent a clear message from the NFL."
