"1"	"Scrutiny of vaccine exemptions banishes some from schools"	"Carl and Kerri Schwartz say they have good medical reason for not vaccinating their disabled 11-year-old son, Thorn, and until recently his local public school went along with their family doctor's advice. That changed, the Schwartzes said, when New York state did away with religious exemptions for vaccines in the middle of a measles outbreak, and then clamped down on medical exemptions like theirs."
"1"	"JLo is the most relatable with this smart style hack for fall weather"	"Fashion choices can be tricky at the beginning of fall. Deciding what ensemble best blends into the confetti-colored leaf pallette of the season and yet also accommodates the unpredictable windy weather is a tough challenge."
"1"	"How Chief Justice John Roberts would lead the Senate impeachment trial"	"The last time an American president was impeached, the chief justice of the Supreme Court   who presides over the Senate trial portion of an impeachment   drew attention mostly because of the four gold stripes on each sleeve of his black robe. Chief Justice William Rehnquist, 74 years old at the time, largely kept a low profile in 1999 during the Senate impeachment trial of President Bill Clinton. If and when President Trump is impeached by the..."
"1"	"WeWork staff, facing job cuts, outraged at founder's payout"	"WeWork will narrowly avoid financial ruin and in the process, reward its former leader, Adam Neumann, with as much as $1.2 billion. The reaction from his ex-colleagues, who are still facing the prospect of mass job cuts and a corporate crisis: "You've got to be kidding me.""
"1"	"The Best Photos from Kate Middleton and Prince William's Royal Tour of Pakistan"	"The royals are undertaking a five-day tour of the south Asian country."
"0"	"The most famous celebrity kids born this decade"	"See the most well-known children born in the last 10 years, from Blue Ivy Carter and the Cambridge kids to North West and more."
"0"	"The Most Stunning Evening Gowns in Miss America History"	"See the evolution from the 1920s through 2019."
"1"	"Already 6 Months! Prince Harry, Duchess Meghan's Son Is Trying to Talk"	"Already 6 Months! Prince Harry, Duchess Meghan's Son Is Trying to Talk"
"0"	"Spot the Dog One Out - Pooch Fades Into the Crowd as Sheep Stop Traffic"	"A group traveling along a remote road in Gjirokastër, Albania, on November 11 had to do a double-take as they passed a flock of sheep blocking traffic. There, among the sheep, was an equally white and fluffy dog who looked more than happy to join the crowd. A German visitor to the region, Matthias Goedeking, took the video and told Storyful that he and his traveling companions originally came across "a herd of sheep on the road and a shepherd who was visibly unhappy about that fact." When they spotted the dog in the crowd, they followed alongside the pooch for a while, before it disappeared   Where's Waldo? style   into the white mass of sheep surrounding it. Goedeking said a combination of very careful driving, the "shepherd banging his crook" on a railing, as well as "lots of honking the car" got him and his companions past the horde of furry creatures in the end. Credit: Matthias Goedeking via Storyful"
"1"	"'The face of heroin': Mom shares haunting before and after pics of addiction"	"Jennifer Salfen-Tracy distributed images of her son in the hopes of finding him and raising awareness about addiction."
"0"	"Unwanted tourist types: The kinds of travelers becoming more unwelcome"	"Not long ago, destinations welcomed most any kind of traveler. Not these days. From rowdy partiers to cruise ship hordes, more places are discouraging unwanted types of tourists."
"1"	"Eminem Says He Sides With Chris Brown Over Rihanna Assault on Alleged Leaked Song"	"Leaked audio of Eminem allegedly rapping that he'd side with Chris Brown over Rihanna assault is making rounds on social media and fans are not happy."
"0"	"Koalas face threat from historic brush fires"	"Hundreds of vulnerable koalas are feared dead or injured in the wake of brushfires that have torn through the eastern Australian coast in early November."
"0"	"66 Cool Tech Gifts Anyone Would Be Thrilled to Receive"	"Let's face it: everyone wants the newest, coolest tech gadget on the market, and we don't blame 'em."
"1"	"Jennifer Aniston Just Gave a Rare Look at Her Natural Hair Texture"	"She's got waves for days."
"1"	"Anti-Harry and Meghan hysteria driven by tabloid media and palace insiders, source claims"	"A source close to the Duke and Duchess of Sussex has hit out at what they called the hysterical reaction to comments Prince Harry made about his brother."
"0"	"Raise Billions From Billionaires? Tax Experts Say It's Not That Simple"	"One of the signature initiatives of Elizabeth Warren's presidential campaign is a wealth tax that, she says, would pay for many of the programs she proposes."
"0"	"Disney+: All the Original TV Shows and Movies Set for Streaming Platform (Photos)"	"Direct-to-consumer offering will house programming from Marvel Studios, Pixar and Lucasfilm"
"0"	"Best Bets: Previewing the best games of the weekend in college basketball"	"Let's get rich!"
"0"	"High tides surge through Venice, locals rush to protect art"	"Exceptionally high tidal waters surged through Venice again on Friday, prompting the mayor to close St. Mark's Square and call for more donations for repairs just three days after the Italian lagoon city suffered its worst flooding in 50 years."
"1"	"A Texas mom is going to prison after putting her son through unnecessary medical procedures"	"A Dallas mother made her son go through unnecessary medical procedures throughout the first years of his life, court documents say."
"0"	"The most talked about movie moments of the 2010s"	"Let's try to emphasize the positive, but there's one particular sequence that was so special in its awfulness, it had to go on this list. See if you can guess which one it is."
"1"	"Cause determined in Jessi Combs' fatal speed record crash"	"Occurred at speeds near 550 mph"
"0"	"I've been writing about tiny homes for a year and finally spent 2 nights in a 300-foot home to see what it's all about   here's how it went"	"I stayed in a tiny house for three days to see what the fuss was all about, and I was surprised by what I saw."
"1"	"Hillary Clinton blames racism for Meghan Markle's 'inexplicable' treatment by the media"	""Well, I think if the explanation is that she's biracial, then shame on everybody," the former First Lady told The Sunday Times."
"0"	"Camila Cabello Explains the Sweet Meaning Behind Her First Tattoo"	"The singer is sharing the significance behind her new ink."
"0"	"3 Indiana judges suspended after a night of drinking turned into a White Castle brawl"	"Hours before they were to attend an educational conference in Indianapolis, three judges went out drinking for a few hours and decided to walk to a strip joint."
"0"	"Trump attacks ambassador on Twitter as she testifies that his words in Ukraine call made her feel threatened"	"President Donald Trump on Friday lashed out at former U.S. Ambassador to Ukraine Marie Yovanovitch, as she testified in a public impeachment hearing in the House that his words about her in a phone call with the Ukraine president "sounded like a threat.""
"0"	"Chuck E. Cheese just got major makeover   and axed the animal band"	"The kid-friendly pizzeria is updating its menu, too."
"1"	"Keystone oil pipeline leaks 383,000 gallons in North Dakota"	"TC Energy's Keystone pipeline has leaked an estimated 383,000 gallons (1.4 million liters) of oil in northeastern North Dakota, marking the second significant spill in two years along the line that carries Canadian tar sands oil through seven states, regulators said Thursday. Crews on Tuesday shut down the pipeline after the leak was discovered, said Karl Rockeman, North Dakota's water quality division director."
"1"	"Meghan Markle says her friends warned her not to date Prince Harry because 'the British tabloids will destroy your life'"	"Meghan Markle has avoided talking about her issues with the press because she wanted to "adopt this British sensibility of a stiff upper lip.""
"0"	"What Happens When Your Cruise Has to Rescue Another Ship"	"Celebrity Cruises' 'Xpedition' ran aground in the Galapagos last week, but what followed was a master class in how to respond."
"0"	"THEN AND NOW: What all your favorite '90s stars are doing today"	"These heartthrobs and fan favorites made the 1990s one of the best decades of the century. Here's what they're up to now."
"0"	"Nurses face an epidemic of workplace violence"	""I got punched in the face," said one emergency room nurse, while others worry for their safety"
"0"	"11 Regional Thanksgiving Recipes That Food Bloggers Swear By"	"Turkey may be the quintessential Thanksgiving dish, but it's not the only attraction feasters look forward to on this food coma-inducing holiday. Families nationwide anticipate the annual spread of grandma's best stuffing or dad's secret sweet potato recipe. What many Americans don't realize, though, is these staples can vary drastically by location. In some regions, families pack extra cream in their potatoes. In others, Thanksgiving sides come..."
"1"	"Three takeaways from the Nationals' NLCS closeout win over the Cardinals"	"Washington will now await the winner of the Astros-Yankees series as it chases its title dreams."
"1"	"12 Netflix original TV shows that critics hate, but normal people love"	"Critical reception can often mean next to nothing to the common viewer, who will flock to panned Netflix original shows like "Insatiable.""
"0"	"The Real Reason McDonald's Keeps the Filet-O-Fish on Their Menu"	"It's something of an underdog story."
"1"	"Repair or replace: Here's a rule of thumb for when it's time to break up with your old car"	"Is there a sweet spot that tells you when it's time to stop putting money into an old car?"
"0"	"The world's only $100 billion utility owes its rise to wind power"	"Two decades ago, when coal ruled U.S. power generation, a Florida utility plowed some of its extra cash into a wind farm atop a desolate Oregon plateau."
"0"	"Here's What 'Cultural Appropriation' Actually Means   and Why It's Wrong"	"The questions you've been afraid to ask, answered."
"0"	"He was a member of a boy band in the 90s. Now he's an ER doctor in Dallas"	"Just when he attained everything he had ever wanted, he realized it wasn't what he wanted."
"0"	"Schiff accuses Trump of 'witness intimidation'"	"House Intelligence Committee Chairman Adam Schiff issued a veiled threat against President Trump for tweeting about former Ukraine Ambassador Marie Yovanovich as she testified before the panel in Day Two of the public impeachment proceedings."
"0"	"Selena Gomez Stands Up for Taylor Swift Amid Her Music Battle: 'It's Greed, Manipulation and Power'"	"'My heart is so heavy right now.'"
"0"	"Home Values in These Cities Have Grown the Most Since the Last Recession"	"Home prices reached their lowest point in 2012 following the Great Recession. Many Americans who purchased homes during this time now are reaping the rewards. Here are five cities where home prices have increased in value since the last recession."
"1"	"'E.T.' star arrested for DUI in Oregon"	"Henry Thomas, who starred as Elliott, was arrested on Oct. 21."
"1"	"3 reasons I bought a house after swearing I'd rent for life"	"After living abroad for 11 years and enjoying a nomadic lifestyle, the author and her husband finally decided to buy a house in Jacksonville, Florida."
"0"	"How to Watch the Leonid Meteor Shower This Weekend"	"Look up this weekend to catch shooting stars radiating from the constellation Leo."
"0"	"South Carolina teen gets life in prison for deadly elementary school shooting"	"Jesse Osborne, the teenager responsible for a shooting at a South Carolina elementary school in 2016, was sentenced to life in prison."
"0"	"Browns apologize to Mason Rudolph, call Myles Garrett's actions 'unacceptable'"	"Players often defend their teammates when commenting on an incident like the one we saw Thursday, but the immediate reaction from Mayfield and others proves just how far Garrett crossed the line."
"1"	"Boris Loses Control as Parliament Rejects Brexit Exit Plan"	"Boris Johnson's "do or die" pledge to take Britain out of the European Union by Oct. 31 was quashed by Parliament on Tuesday night, handing the initiative to the EU to trigger a British election. Johnson said he would call for a general election if British lawmakers refused to allow him to rush through his deal and the EU proposed a new extension of three months or more. Under a law passed in Westminster last month, Johnson is not allowed..."
"1"	"Meghan Markle Personally Calls British Politician to Thank Her for Orchestrating Letter of 'Solidarity'"	"The Duchess of Sussex thanked the British female MP for supporting her amid media scrutiny."
"1"	"Backyard bungalows are becoming big business for homeowners and builders"	"They're not just she-sheds or he-sheds or granny pods or tiny homes. The latest housing trend in the backyard is now front and center for a new breed of homebuilder and landlord."
"0"	"'This tarnishes everything': Astros cheating allegations have baseball world demanding punishment"	"The Houston Astros are facing public backlash over revelations that the team may have been using electronic means to steal signs."
"1"	"There's Only One Right Way to Clean a Cast-Iron Skillet"	"Read this before searing your next steak."
"0"	"Dominique Crenn Proves Fine Dining Does Not Have to Be a Meaty Domain"	"The Bay Area chef's latest move suggests that fish and produce can be the centrepiece of fine dining"
"1"	"Amtrak Launches 50-Percent Off Fall Getaway Flash Sale"	"The deal ends Wednesday."
"1"	"Celebs' Craziest Halloween Costumes, From Beyoncé to Kylie Jenner"	"YOU CANNOT UNSEE THIS."
"0"	"Ocasio-Cortez: 'Trump himself is clearly not satisfied with only one article of impeachment'"	"Rep. Alexandria Ocasio-Cortez (D-N.Y.) didn't hold back on Friday, taking a swipe at President Trump on Twitter after he tweeted about former U.S Ambassador to Ukraine Marie Yovanovitch and her career's work as a diplomatic official."
"1"	"Karamo Brown Says His Relationship with His Father 'Ended' for 10 Years After He Came Out as Gay"	"Karamo Brown's Relationship with His Father 'Ended' After He Came Out as Gay"
"1"	"Diaper rush: Conquering a $9 billion market no one wants to talk about"	"The time may not be far off when more adults need diapers than babies as the population grows older, potentially a huge opportunity for manufacturers of incontinence products -- if they can lift the stigma that has long constrained sales."
"0"	"Sterling K. Brown Emotionally Recalls Seeing His Dad for the Last Time Before His Death"	"Sterling K. Brown Recalls Last Moment He Saw His Dad Alive"
"0"	"Wendy's Is Turning 50 Years Old, And Is Gifting Us With Free Food Through 2020"	"How thoughtful."
"1"	"The most surprising confessions made by the Queen's dressmaker in her new tell-all book about life at Buckingham Palace"	"Angela Kelly began her post in 1994 as the Queen's senior dresser, before becoming Her Majesty's in-house designer."
"1"	"Why I stopped shopping at Marshall's and Trader Joe's"	"They're money pits. There, I said it."
"1"	"Meghan Markle Says That Archie Has Two Teeth and Is Crawling"	"The cutest? Or the cutest ever?"
"0"	"Texas High Schoolers Design and Build Prosthetic Arm for Student So She Can Play the Cello"	"Texas High Schoolers Build Prosthetic Arm for Student"
"1"	"Why Is the Ancient Nissan Frontier Still Popular?"	"There's a reason buyers still love the pickup truck that's old enough to have a driver's license."
"0"	"Iran moves on ultra-cheap petrol, starts rationing"	"Iran imposed petrol rationing and raised pump prices by at least 50 percent Friday, saying the move aims to help the needy with cash handouts and is not due to a budget deficit. - Divisive measure - Rouhani had tried hike fuel prices in the budget last December but was blocked by parliament in the wake of protests that rocked Iran for days."
"1"	"Pictures so perfect it's hard to believe they're real"	"Photos taken by people from across the world that capture amazing optical illusions."
"0"	"Report: Myles Garrett facing lengthy suspension, could be five games"	"Myles Garrett was guilty of one of the most aggressive and dangerous acts we have ever seen on a football field during Monday night's game between the Pittsburgh Steelers and Cleveland Browns."
"0"	"Taylor Swift Rep Hits Back at Big Machine, Claims She's Actually Owed $7.9 Million in Unpaid Royalties"	"Taylor Swift's team responds to Big Machine's denial."
"1"	"911 supervisor playing Netflix movie didn't send cops to attempted murder"	"A Coral Springs police dispatch supervisor was at work playing a Netflix movie when she didn't catch an incorrectly logged 911 call."
"0"	"Queen Elizabeth Just Rode Horseback at Age 93"	"The British monarch isn't letting a small thing like age keep her from living her life."
"0"	"9 renovation tips to boost resale value"	"Making the right renovation decisions can help you sell your house quicker, and for more money."
"1"	"Pizza Hut is testing a new round pizza box that looks like a spaceship and is meant to keep pizza fresher"	"Pizza Hut has partnered with Zume to test a new round pizza box that is supposed to keep pizza fresher and crispier. It's also compostable."
"1"	"Twitter Had Feelings About Mark Zuckerberg's Micro-Bangs"	"Facebook founder Mark Zuckerberg debuted a new haircut on the House floor on Wednesday, and Twitter quickly took note with an avalanche of memes and quips."
"0"	"Why This Couple Is Getting a 'Sleep Divorce'"	"A New Jersey couple is getting an unusual "divorce." Liz and Rich Alterman have been happily married for almost 20 years. They have three children and are now on the brink of getting "sleep divorced.""
"0"	"Five Great Holiday Cruises Worth Taking"	"These trips will make it the merriest of seasons."
"0"	"Here's how much and who you should be tipping at American hotels"	"To tip or not to tip: That is the question. Well, one of them. Here's everything you should know about hotel tipping in the U.S."
"1"	"Rosario Dawson and Members of Her Family Sued Over Alleged Transphobic Assault Against Handyman"	"Rosario Dawson and Her Family Sued Over Alleged Transphobic Attack"
"0"	"Opinion: Baylor football back on top four years after sexual assault scandal rocked campus"	"For many watching Saturday night, it will be difficult to get past the name Baylor when the undefeated Bears play Oklahoma. Perhaps that's fair."
"0"	"What Not to Miss on the Harry Potter Studio Tour"	"Why it is a must-do for even casual fans"
"0"	"'After I Could Only Fit Into Extended-Size Wedding Gowns, I Started Keto And Lost Over 100 Lbs. In 16 Months'"	""I can keep up with my children, and I couldn't do that before.""
"0"	"Archie's Photo Album: Prince Harry, Duchess Meghan's Royal Baby"	"So cute!"
"1"	"How Did the Diner Menu Get So Long?"	"You can get just about anything at an American diner. This illustrated history has some insights into why."
"1"	"Former NBA first-round pick Jim Farmer arrested in sex sting operation"	"Farmer, 55, was booked for trafficking a person for a commercial sex act."
"0"	"14-year-old baker gives cupcakes to homeless"	"Michael Platt has been on Food Network, did a TED talk, and is constantly giving back to those in need with his one-for-one business"
"1"	"Meghan Markle's estranged brother says 'she is only in Buckingham Palace with Harry because of her dad' after he 'paid for her education and fancy clothes'"	"Earlier this year, Thomas Markle Sr. leaked a private letter Meghan sent to him to the Mail on Sunday."
"1"	"95% of tested baby foods in the US contain toxic metals, report says"	"Tests of 168 baby foods by an advocacy group found 95% contain toxic metals that can lead a loss of IQ and developmental delays in infants."
"0"	"This is it, this is the luckiest break in the history of golf"	"Belgium's Thomas Detry was the beneficiary of one of the all-time luckiest bounces you'll ever see in golf, and maybe all of sports."
"0"	"Golfer and girlfriend pull amazing trick shot"	"Press LaBrie from Montreux, Nevada, USA, is a long drive golf pro who has recently started working on trick shots. He asked his girlfriend Adrianna Moritz to help him pull a challenging trick shot, and it worked brilliantly!"
"0"	"Celebrity PDA of 2019"	"See the stars kissing and hugging on the red carpet and out and about!"
"1"	"19 Mysterious Old Home Features That Aren't Useful Anymore"	"Many old homes have perplexing features that baffle their modern-day owners. Here we've solved 19 of those mysteries!!"
"1"	"Warren escalates Facebook fight with ad targeting Zuckerberg"	"Democratic presidential candidate Elizabeth Warren has escalated her tiff with Facebook by running an ad   on Facebook   taking aim at its CEO, Mark Zuckerberg."
"0"	"41 Delicious Sweet Potato Recipes You'll Want In Your Life ASAP"	"Some might say this root vegetable is the best thing about fall."
"1"	"Celebrity kids then and now: See how they've grown"	"See what the children of Bobby Cannavale, Ray Liotta, Jude Law, Jamie Foxx, Sylvester Stallone, James Gandolfini and more stars look like now."
"0"	"At NATO summit, Trump to stress US allies' defense spending"	"President Donald Trump will try to convince U.S. allies that they should increase defense spending when he attends a meeting of NATO leaders next month in London, the White House said Friday."
"1"	"Baby boy beats the odds by waking from 5-day coma and smiling at his dad"	"A baby boy's incredible tale of survival has gone viral and is inspiring thousands to donate to his cause. Emma Labuschagne, of Bristol, England, wrote on social media that her son, Michael, was born healthy in December of last year. However, at just 14 weeks old, he suffered sudden heart failure. "We watched our baby breathless, gasping for air while his heart stopped and paramedics worked to save his life. In that moment I did not think...""
"0"	"Meghan Markle's Lawyers Debunk Multiple False Tabloid Stories in New Court Documents"	"False, divisive, and completely untrue."
"0"	"Celebrity beach cruising for 2019"	"See all the stars who hit the beach this year!"
"1"	"Angels finalizing deal to hire Joe Maddon as manager"	"Joe Maddon was recently let go as Cubs manager after a five-year stint that included a World Series. He replaces Brad Ausmus, who lasted one year."
"1"	"'Slapped cheek' rash may be a sign your child has fifth disease"	"Parents alarmed by the symptoms may not have heard of the illness, but pediatricians see it quite often."
"1"	"Here Are the Biggest Deals We're Anticipating for Black Friday"	"The Black Friday deals for 2019 have already begun leaking out. Get a sneak peek at what to expect from popular retailers like Costco, Walmart, and Best Buy. Browse our guide and use it to plan your attack for the biggest shopping event of the year."
"1"	"Parking space sells for almost $1 million"	"Businessman Johnny Cheung has reportedly sold a 135-square-foot parking space in Hong Kong for a whopping $969,000 to an as-yet-undentified buyer."
"0"	"Police look for motive behind California school shooting"	"Police look for motive behind California school shooting"
"1"	"This Percentage of Americans Have Never Left the State They Were Born"	"For some, home really is the best place in the universe. The post This Percentage of Americans Have Never Left the State They Were Born appeared first on Reader's Digest."
"1"	"Kylie Jenner Throws Dinner for Caitlyn Jenner's 70th Birthday   See Which Kardashians Attended"	"Kim Kardashian, Kourtney Kardashian Attend Caitlyn Jenner's Birthday Dinner"
"1"	"Zooey Deschanel's Estranged Husband Jacob Pechenik Files for Divorce"	"The couple announced their separation in September."
"0"	"'Charlie's Angels' stars: Where are they now?"	"We're checking up on former Charlie's Angels actresses to find out what they're up to today."
"0"	"All the times royals have met A-list celebs"	"See all the moments the British royal family rubbed elbows with Hollywood stars."
"0"	"All the Things You Didn't Know About 'The Crown'"	"Claire Foy worried that joining the show was "the worst mistake" of her life."
"1"	"14 Parenting Rules the Royals Have to Follow"	"Even in our modern times, there are some traditions British royal parents can't escape."
"0"	"Stromboli vs. Calzone: What's the Real Difference Between These Italian Favorites?"	"We're putting an end to the stromboli vs. calzone debate once and for all. Find out the real differences between the two Italian dishes."
"0"	"Russia lands forces at former U.S. air base in northern Syria"	"Russia lands forces at former U.S. air base in northern Syria"
"1"	"Celebs react to Robert Forster death"	"Bryan Cranston, Aaron Paul, Samuel L. Jackson and more react to Robert Forster's death."
"0"	"Your Thanksgiving Guests Will Be Very Thankful for Our Favorite Turkey Recipes"	"What's Thanksgiving without the star of the show?"
"1"	"People Think the Skeleton on 'The Masked Singer' Is Christopher Meloni"	"We'll send in Benson to investigate."
"1"	"Old-fashioned Air Travel Perks We Miss"	"People who fly know that it can be terrible, with cramped planes, bad food, and broken inflight entertainment devices. It's true that there was a time when planes were spacious, with great service, gourmet food, free-flowing alcohol, and sometimes even piano bars. But the air-travel perks of yesteryear had downsides."
"1"	"Jaylen Brown addresses 'toxic masculinity' in sports"	"Celtics star wants to send a message that athletes have feelings   and mental health issues   like everyone else."
