"1"	"2020 Ram 1500 EcoDiesel review: The best full-size truck adds efficiency and capability"	"The Ram 1500 is a solid full-size truck, and its new 3.0-liter diesel engine option only broadens its appeal."
"0"	"Survivor Contestant Accused of 'Inappropriate Touching,' 2 Players Admit to Using Allegations to Win"	"Survivor Faces 'Inappropriate Touching' Scandal: Dan Accused by Kellee"
"1"	"Man fatally burned in a fiery Tesla after door wouldn't open, lawsuit alleges"	"The family of a Florida man who died in a fiery Tesla crash are suing the automaker."
"1"	"'Yabba Dabba Doo!' Kimye and Kids Rock Flintstone Halloween Costumes"	"Fall family fun! Kim Kardashian, Kanye West and their kids went all out with elaborate Flintstone family costumes for Halloween. "Yabba Dabba Doo!" the Keeping Up With the Kardashians star, 39, captioned a series of photos of herself with her children North, 6, Saint, 4, Chicago, 21 months, and Psalm, 5 months. "This family pic was such a challenge because Chicago was so scared of Dino! LOL We tried to explain and show her that it was just daddy but she didn't get the concept yet! So shout out to the photographer for editing her in & making our family Flinstones dreams come true!" While the reality star channeled Betty Rubble in a black wig and blue dress, her son looked just like Fred Flintstone. His older sister wore a red wig and all-white as Wilma Flintstone, and his younger one was all smiles as Bamm-Bamm Rubble. Kardashian held Psalm in a tiny version of the outfit. North also dressed up for Halloween with her cousin Penelope and their friend. Kourtney Kardashian's daughter, 7, rocked a long white wig and an angel-devil costume, while North was a straight devil in red fur. As for Kim, the makeup mogul debuted an extravagant Elle Woods costume, channeling Reese Witherspoon in Legally Blonde. The Selfish author even recreated the character's iconic Harvard video essay from the 2001 movie, wearing pink and green sequined bathing suits and a pink dress, all with a blonde wig. The KKW Beauty creator has passed on her love of fashion and beauty to her daughter North. The little one loves makeup, but her dad, 42, doesn't approve. "Her dad won't let her wear it," Kim told E! News in September. "I think he had it, he changed all the rules. I'd let her wear, you know, she has a little red for Christmas, I'd let her wear a red lip, or I'd let her do one pop of something. I'd let her if she's wearing a black dress, a black lip. Kylie [Jenner] would give her all of these lip kits, so I kind of got in trouble for that. So, it's now no more makeup." The Los Angeles native opened up about their disagreement further the following month, telling the outlet: "North is trying to get in on the makeup, but she's being blocked heavily because her dad has stopped all makeup for her until she is a teenager. It's a big discussion, a big fight in the household right now but it is what's best. I think as a parent you just learn and figure it out as you go and we realized we didn't really want her to wear makeup at a young age but she sees her mom putting on lipstick and lip gloss.""
"1"	"How Much Power Does the 2020 Chevrolet Corvette Really Make? We Take it to the Dyno and Find Out"	"A lot more, it turns out"
"0"	"Mustang: all the wild and wonderful offshoots - US edition"	"As Ford prepares to unveil the Mustang Mach E, we take a look at all the spin-offs the original pony car has inspired over the decades"
"0"	"Model, 23, Didn't Know She Was Pregnant Until She Gave Birth to a Full-Term Baby in Her Bathroom"	"An Australian model recently had a life-changing surprise when she gave birth to a baby in her bathroom, despite not knowing that she had been carrying her daughter for nine months."
"0"	"7 possible landing spots for Anthony Rendon"	"The most coveted position player hitting the open market this winter is undoubtedly third baseman Anthony Rendon. Rendon's expected price tag - and the fact a compensatory draft pick must be surrendered upon signing him - will eliminate a handful of suitors outright."
"0"	"Survivor Contestants Missy Byrd and Elizabeth Beisel Apologize For Their Actions"	"Survivor contestants Missy Byrd and Elizabeth Beisel posted apologies to Twitter after they were shown onscreen using a fellow contestant's assault story to their advantage in the game"
"1"	"'Go back to work': Outcry over deaths on Amazon's warehouse floor"	"Billy Foister died last month after a heart attack at work. The incident was just one in a series of recent accidents and fatalities"
"0"	"Opinion: NFL should suspend Browns' Myles Garrett for rest of season   at minimum   for helmet swing"	"The Browns won on Thursday, but only in the most literal sense. Pro Bowl defensive end Myles Garrett changed everything with the swing of a helmet."
"1"	"Kanye West Gets Ridiculed for Serving Sad, Soggy Pancakes at Expensive "Brunchella""	"On November 1, some who attended "Brunchella," a Kanye West performance in Louisiana, paid $55 for a brunch add-on and they were not happy with the results."
"0"	"10 reasons it's better to rent rather than buy a home"	"Forget building equity. Here are 10 reasons you want to rent instead."
"1"	"Presidential election model that got it wrong once in 40 years predicts Trump 2020 win"	"A presidential election model that incorrectly predicted just one election outcome since 1980 shows President Trump winning reelection in 2020."
"1"	"Inside TurboTax's 20-year fight to stop Americans from filing their taxes for free"	"The success of TurboTax rests on a shaky foundation, one that could collapse overnight if the U.S. government did what most wealthy countries did long ago and made tax filing simple and free for most citizens."
"0"	"Daring rescue attempt when dog winds up on roof"	"It took a lot of trust and time to get this scared pup off a two-story roof, but eventually he came down all thanks to one kind human."
"0"	"Bill Plaschke: Trout and Bellinger deserve MVPs, but fans deserve more in postseason"	"LOS ANGELES - The hometown sweep of baseball's Most Valuable Player awards Thursday officially anoints Los Angeles as the center of the baseball universe! No, actually, that would be Washington. The American League MVP victory by the Angels' Mike Trout and the National League MVP win by the Dodgers' Cody Bellinger validates Los Angeles as baseball's city of stars! Yeah, in a sky that goes ..."
"0"	"Impeachment inquiry: White House releases rough transcript of Trump's earlier call with Zelensky"	"Trump spoke with Zelensky in the hours after he won the presidency in April, preceding the July phone call between the two leaders that launched an impeachment inquiry."
"0"	"Lamar Odom is Engaged to Girlfriend Sabrina Parr -- See Her Stunning Ring!"	"The former basketball star revealed the news on Instagram."
"1"	"Climate change will break the housing market, says investor who predicted financial crisis"	"Risk to the housing market from underestimated climate change   and a chance to capitalize on these miscalculations   echoes lessons from the 2008 subprime-mortgage debacle."
"0"	"A 16-second spasm of violence leaves 2 dead at Saugus High School"	"Two students were killed and three other teens were wounded in a shooting at Saugus High School in Santa Clarita on Thursday morning, authorities said."
"0"	"A third of boomers make this critical retirement mistake"	"And it's putting their retirement security at risk"
"1"	"3-Row SUVs Compared: Explorer, Telluride, Palisade, Enclave, and CX-9"	"See how the latest 3-row SUVs from Ford, Kia, Hyundai, Buick, and Mazda measure up against their biggest competitors in features, handling, safety, and price."
"1"	"Official's homophobic slur ignites explosive reaction against Tennessee tourism hot spot"	"Commissioner Warren Hurst used a homophobic slur to describe presidential candidate Pete Buttigieg, setting off widespread criticism."
"1"	"Dad's Touching Post Explains How to Support Your Wife After She Has a Baby"	"Ted Gonder recently shared some advice on how to be a good husband and support your wife when she becomes a mom. His tips have gone viral on Facebook."
"1"	"Kansas City to vote on removing King's name from street"	"KANSAS CITY, Mo. (AP)   Kansas City residents will decide whether the city will remove the name of Dr. Martin Luther King Jr. from one of its most historic boulevards, less than a year after the street was renamed for the civil rights icon. Voters on Tuesday considered a ballot question that would reverse a city council decision in January to name a 10-mile (16.1 kilometer) boulevard on the city's mostly black east side for King and restore the..."
"1"	"The best-dressed characters of fall TV 2019"	"The best-dressed characters of fall TV 2019"
"1"	"'Serial Stowaway' Marilyn Hartman Held Without Bail After Latest Arrest At O'Hare"	""Serial stowaway" Marilyn Hartman was ordered held without bail after being arrested again at O'Hare International Airport."
"0"	"How Google Interferes With Its Search Algorithms and Changes Your Results"	"Pressed by businesses, interest groups and governments, the internet giant uses blacklists, algorithm tweaks and an army of contractors to shape what you see."
"0"	"These are the new cars that depreciate least"	"Don't want to lose a ton of money on your next new car? These are the new car models that hold the most value after five years."
"1"	"EXCLUSIVE: WhatsApp hacked to spy on top government officials of U.S. allies -sources"	"Senior government officials in multiple U.S.-allied countries were targeted earlier this year with hacking software that used Facebook Inc's WhatsApp to take over users' phones, according to people familiar with the messaging company's investigation."
"0"	"Opinion: Colin Kaepernick is about to get what he deserves: a chance"	"The end may be near for the 3-year-old saga of Colin Kaepernick as the quarterback is scheduled to work out for teams on Saturday."
"0"	"Video shows a Boeing 737 plane carrying 196 people burst into flames just after landing at an Egyptian airport"	"The plane, operated by EgyptAir and owned by Ukrainian budget airline SkyUp, burst into flames while it was still taxiing to its gate."
"1"	"Prince Harry acknowledges tensions with William in ITV interview"	"Britain's Prince Harry has acknowledged tensions with his older brother Prince William for the first time, saying they are on "different paths.""
"0"	"Thieves Steal $40K Worth Of Equipment From Volunteer Fire Station"	"Tens of thousands of dollars in gear stolen were from the Mountain View volunteer fire department."
"0"	"Pittsburgh Steelers quarterback Mason Rudolph on 'TNF' incident: 'I thought it was pretty cowardly'"	"Pittsburgh Steelers quarterback Mason Rudolph tell us what he thinks about the "TNF" incident."
"1"	"Jason Mitchell Opens Up About 'The Chi' Exit, Says #MeToo Movement Was Used as an "Ugly Weapon""	"Multiple misconduct claims were made against the actor, who was also dropped from Netflix western film 'Desperados.'"
"1"	"Officer in viral-video shoplifting incident to be fired: Police chief"	"The police chief of Phoenix said the Disciplinary Review Board's recommendation of a six-week unpaid suspension was not "sufficient" for Officer Chris Meyer."
"0"	"Lena Waithe Reveals She Secretly Married Her Longtime Love"	"Lena Waithe and longtime love Alana Mayo secretly got married! Watch the Masters of None star talk about their wedding on The Ellen DeGeneres Show with guest host John Legend here."
"1"	"TV shows we're most excited about for the rest of the year"	"From HBO originals like "His Dark Materials" to the new season of Netflix's "The Crown," here are some of the shows we can't wait to watch."
"0"	"Treasury yields tick higher amid uncertainty over US-China trade deal"	"U.S. government debt prices were lower Friday morning, as traders monitored U.S.-China trade developments."
"1"	"20 Car Hacks That'll Make Driving So Much Better"	"Whether you're gearing up for a road trip or just want to make your daily commute less of a chore, these car hacks will instantly improve your driving experience. The post 20 Car Hacks That'll Make Driving So Much Better appeared first on Reader's Digest."
"1"	"Princess Charlotte Looks Identical to Her Cousin Lady Kitty Spencer as a Kid"	"Princess Charlotte may get her sassy attitude from her uncle Prince Harry, but her looks come directly from her cousin Lady Kitty Spencer."
"1"	"Apple is laying the groundwork for an iPhone subscription"	"Apple could bundle hardware upgrades with services like iCloud storage or Apple TV+ content and hardware."
"0"	"The Unlikely Star of My Family's Thanksgiving Table"	"It's hard to remember life before broccoli cheese rice casserole. Or, B.B.C.R.C.E. (Before Broccoli Cheese Rice Casserole Era). What did the Kim clan have to look forward to every Thanksgiving before the cheesy family-favorite side dish entered our lives? Stuffing, maybe. Green bean casserole. Macaroni and cheese. Ham in cola, a quirky recipe from Nigella Lawson that she picked up from the American South. Certainly nothing from the Korean..."
"0"	"Prince Harry and Meghan Markle just shared a never-before-seen photo of baby Archie with his 'Grandpa' Prince Charles to celebrate his birthday"	"The Duke and Duchess of Sussex shared a new photo of Archie, Harry, and Charles to mark the Prince of Wales' 71st birthday on Thursday."
"0"	"There are 14 cheap days to fly left in 2019: When are they and what deals can you score?"	"There are 14 days left in 2019 that are so cheap for flights, you may want to haul out the carry-on one last time. See when you can score a deal."
"0"	"Mini Mister Rogers! Hospital Dresses Up Newborn Babies as Beloved TV Icon for World Kindness Day"	"Mister Rogers Babies: Hospital Dresses Up Newborns as TV Icon"
"0"	"The world's most profitable company is about to go public"	"The oil company that made Saudi Arabia rich is going public. Some say the timing couldn't be worse."
"0"	"Envoy Was 'Obstacle' to Trump, Schiff Says: Impeachment Update"	"The House Intelligence Committee held its second public hearing on Friday to hear testimony by former U.S. Ambassador to Ukraine Marie Yovanovitch, who was removed from that post in May by President Donald Trump."
"1"	"The Best Celebrity Halloween Costumes Ever"	"Some celebrities bring their A-game year after year."
"1"	"Hackers use e-skimming to hover near online shopping carts"	"Holiday shoppers warned to watch out for e-skimming threats. Any business accepting online payments on their website is at risk, FBI says."
"1"	"Doctors Want FDA To Warn Women About Cheese And Breast Cancer Link"	"Up to 12,000 members of Physicians Committee for Responsible Medicine agreed that the federal government should add label to cheese products that would warn women about the risk of having breast cancer."
"0"	"Brett Kavanaugh calls Ruth Bader Ginsburg 'inspiration,' heaps gratitude on allies"	"In his first speech as a Supreme Court justice, Brett Kavanaugh heaped "gratitude" on his supporters and hailed Ruth Bader Ginsburg as an "inspiration.""
"0"	"Pittsburghers Celebrate World Kindness Day By Honoring Mister Rogers"	"In celebration of World Kindness Day, Pittsburghers -- including adorable newborn babies -- are wearing cardigans to honor Mister Rogers."
"0"	"Dow tops 28,000 for first time, capping 4-week win streak"	"The Dow Jones Industrial Average ended at another record high Friday after White House economic adviser Larry Kudlow said China and the U.S. were getting close to reaching a trade deal."
"1"	"More than 18,000 TSA employees flock to private Facebook group to vent"	"Some of the posts called passengers, "pretty (expletive) stupid," while others wished their planes would "blow up.""
"1"	"25 bathrooms? Former Clinton labor secretary says Bezos' mansion helps make case for soaking the rich"	"Robert Reich served as labor secretary in the Clinton administration, where he was named by Time Magazine as one of the 10 most effective cabinet secretaries of the 20th century. He's a Rhodes scholar, a best-selling author, a documentarian and a professor of public policy at UC Berkeley. What he's not, apparently, is a fan of billionaires clinging to their riches."
"1"	"Prince Harry Reassures Meghan Markle About Her Post-Baby Body 5 Months After Giving Birth"	"The Duke of Sussex gave his wife some encouragement at this week's WellChild Awards."
"1"	"Sen. Johnson, ally of Trump and Ukraine, surfaces in crucial episodes in the saga"	"In a previously unreported contact, Johnson met in July with a former Ukrainian diplomat who has circulated unproven claims that Ukrainian officials helped Hillary Clinton in 2016."
"0"	"The latest on Brad Pitt and Angelina Jolie's post-split relationship, plus more news"	"Brad Pitt reportedly wants to see his kids more than Angelina Jolie has made possible. Plus, more celebrity news for Nov. 14, 2019."
"1"	"Keanu Reeves Holds Hands with Artist Alexandra Grant on the Red Carpet"	"Keanu Reeves Holds Hands with Frequent Collaborator and Artist"
"1"	"These 4 words are the key to becoming rich"	"It's surprisingly simple advice, but it will have you on your way to an increased net worth."
"0"	"WH record of Trump's 1st call with Ukraine president differs from earlier description"	"The White House released a record of an April call between President Donald Trump and Ukrainian President Volodymyr Zelenskiy."
"1"	"Iowan convicted of murder claims his life-sentence was served once he died, was revived in medical emergency. The court disagrees."	"An Iowa convicted of murder was rushed from prison to the hospital where his heart was restarted five times. Now he claims he should be freed"
"1"	"Giuliani needed Apple genius help to unlock his iPhone after named Trump cybersecurity adviser"	"Giuliani's handling of the situation calls into question his understanding of basic security measures, two former FBI cyber experts told NBC News."
"0"	"I'm A Queer Woman Dating A Trans Man   & No One Knows"	"I'm a queer woman partnered with a transgender man, but everyone assumes we're a heterosexual couple. On the surface, we're the quintessential Brooklyn duo: We have tasteful tattoos and piercings, we shop at food co-ops, we attend spin class together, and we're creative yet gainfully employed. But while this relationship afforded me the privilege of banal nonconformity, I lost a piece of myself when I got together with my once-gym buddy, James...."
