"0"	"5 Things You Didn't Know About Campbell's Iconic Green Bean Casserole"	"We even got our hands on the original 1955 recipe card from the test kitchen."
"0"	"5 arrested in connection with deadly shooting at Airbnb Halloween party"	"Police have arrested five suspects in the Halloween shooting at a California Airbnb that left five partygoers dead. The arrests came during a coordinated police operation in four Northern California cities, reported San Francisco ABC station KGO. Five partygoers were killed on Halloween night at a house in the affluent town of Orinda, just east of Berkeley, that had been rented through Airbnb."
"0"	"29 Savory Tart and Quiche Recipes"	"There's no better way to feature the season's fresh produce than in quiches, savory tarts, and galettes."
"1"	"Can You Name the U.S. State Without Its Vowels?"	"How well do you know the names of every state? Could you guess them if we removed all the vowels? Test your knowledge of U.S. state names."
"0"	"30 Best Black Friday Deals from Costco"	"Costco members love shopping at the warehouse store, and they'll love shopping there for holiday gifts just as much."
"1"	"Meghan Markle and Prince Harry Are 'Entitled' to Time Off, According to Archbishop"	"As far as the Archbishop of Canterbury is concerned, Meghan Markle and Prince Harry are "entitled" to time off."
"1"	"Customers Are Trolling Papa John's Over Their Jack-O'-Lantern Pizzas"	"This is truly scary."
"0"	"Report: Police investigating woman's death after Redskins' player Montae Nicholson took her to hospital"	"Police are investigating an apparent drug-overdose death of a woman after the Redskins' Montae Nicholson took her to a hospital, according to reports."
"1"	"4 habits that could wreck your finances beyond repair"	"Avoid these at all costs."
"0"	"Lemon Water Is Healthy, But It's Not a Miracle Weight Loss Drink"	"Glugging it down to lose weight? Here's what you should know."
"0"	"'A turning point in this hearing': Fox personalities speculate if Trump-Yovanovitch tweet could lead to witness intimidation charges"	"Multiple Fox News personalities speculated that President Trump's insulting tweet toward former U.S. Ambassador to Ukraine could result in witness tampering and witness intimidation charges."
"0"	"Kentucky woman charged in death of woman missing since May"	"A Kentucky woman has been charged in the death of a woman missing since spring whose remains may have been found last week."
"0"	"The 23 Best Kitchen Gifts Under $25 in 2019"	"How to give to the cooks, entertainers, and eaters in your life without spending a fortune."
"1"	"Analysis: Elizabeth Warren growing into front-runner status"	"Warren found herself defending the broad ambition she has laid out to remake the American economy and rebalance the nation's wealth."
"1"	"Selena Gomez Tells Fans 'I Do Not Stand for Women Tearing Women Down' After Dropping New Song"	"The singer took to Instagram Live on Wednesday and asked her fans to 'please be kind to everyone.'"
"0"	"Washington police announce arrest of 'Potomac River rapist'"	"A man known as the "Potomac River rapist" who sexually assaulted at least 10 women and murdered one in the Washington area in the 1990s has been arrested, police said Thursday. Giles Warrick, 60, was taken into custody on Wednesday in the state of South Carolina, Washington police chief Peter Newsham announced at a press conference."
"0"	"2020 Ford Mustang Shelby GT350 vs. GT500: Which Is the Better Sports Car?"	"Is the $12,460 more costly GT500 a better sports car than the already great GT350?"
"0"	"Pete Davidson, Kaia Gerber Are Dating, Trying to Stay 'Low Profile'"	"Pete Davidson, Kaia Gerber Are Dating, Trying to Stay 'Low Profile'"
"0"	"LASIK eye surgery should be taken off market, ex-FDA adviser says"	"An estimated 20 million Americans have undergone the procedure to correct nearsightedness and improve distance vision"
"1"	"When Costars Clash: 13 Onscreen Pairs Who Were Allegedly Feuding Offscreen"	"Chelsea and Heather, Jennie and Shannen, Nicki and Mariah   these celebs weren't afraid to speak their minds about their co-workers"
"0"	"What to Cook This Weekend: November 15 17, 2019"	"An autumnal palette of yellow, orange, and red makes us feel cozy so this weekend, we're putting those colors on our plates."
"1"	"Does Tire Rotation Include Tightening Lug Nuts? Michigan Court Thinks About It For Awhile, Concludes 'No'"	"In what will surely go down in history as one of the most Galaxy Brain court rulings of all time, a Michigan appeals court determined that a tire rotation does not, in fact, include tightening the lug nuts."
"1"	"10 Job Skills Worth Six-Figure Salaries"	"Learn these skills to get you closer to six figures."
"0"	"Read: Marie Yovanovitch's testimony at today's impeachment hearings"	"Former U.S. Ambassador to Ukrane Marie Yovanovitch is testifying to the House Intelligence Committee Friday."
"0"	"Someone Finally Invented a Jar Lid That Won't Get Stuck"	""Once people try it, they're hooked," the company claims."
"0"	"'Our entire community is changed forever': CA shooting victims face a new reality"	"Students at Saugus High School in Santa Clarita, California, say they're facing a new reality after a fellow student shot five classmates and them himself Thursday."
"1"	"Panera Bread worker fired after TikTok exposed frozen mac and cheese"	"On Friday, the poster said on Twitter that she was fired for the video, showing her place a frozen bag of macaroni and cheese into a vat of hot water."
"0"	"Maze of tunnels reveals remains of ancient Jerusalem"	"Controversial excavations under the Holy City uncover layers of history and stoke long-standing tensions."
"1"	"New Jersey Couple Sues Taco Bell Over Chalupa Prices"	"When is a $5 deal not a $5 deal?"
"0"	"How to make the most of a day trip in a new city: Charleston edition"	"Make the best of a spontaneous short trip by skipping the planning. Start walking, ask for directions and talk to people."
"0"	"85 Thanksgiving Recipes You Can Make Ahead"	"Short on time? Running out of oven space? Here are some make-ahead dishes for a seamless feast."
"0"	"How to Make Chicken Parm Spaghetti Squash"	"This family friendly spaghetti squash dinner is a delicious (and low-carb) twist on an old favorite: chicken Parmesan. Loads of melty cheese will make this dish an easy sell for the kids, and the veggie vessel means you're packing in plenty of nutrie"
"0"	"Steelers vs. Browns highlights | Week 11"	"Watch Pittsburgh Steelers vs. Cleveland Browns highlights from Week 11 of the 2019 season."
"1"	"Celebs celebrate Halloween 2019"	"Here's how the stars dressed up while celebrating Halloween this year!"
"0"	"Ready to Try CrossFit? Give This Beginner's WOD a Try."	"Top CrossFit athlete Spencer Hendel shares a workout to get you started."
"0"	"Best celebrity hair moments of 2019 (so far)"	"New year, new 'do! Nothing has the power to transform a look quite like a new hairstyle, which might explain why celebrities are constantly switching things up with fresh cuts, colors and lengths. In 2019, we've already seen stars like Rowan Blanchard and John Travolta go shorter (or, in the Saturday Night Fever star's case, bald!), Lady Gaga and Chris Messina walk the red carpet with striking new shades and Hilary Duff and Sarah Hyland show how subtle color shifts can make a big impact. And, if 2018's tress transformations were any indication, there is going to be so much more where that came from. Keep scrolling to see the best celebrity haircuts, color, extensions and more of 2019 so far!"
"0"	"Prince Charles just turned 71   here are the best photos from every year of his royal career so far"	"Prince Charles, heir to the throne, celebrates his 71st birthday on Thursday. Here are all the best photos from every year of his career."
"0"	"The Volkspod VW Beetle Minibikes Are Part Creepy, Part Adorable"	"The people's pods."
"1"	"Bed, Bath and Beyond Pulls 'Blackface Pumpkins From the Shelves"	"The pumpkins were removed from stores after an upstate New York community filed complaints."
"1"	"The 50 Most Common Last Names in America"	""What's in a name?""
"0"	"New Trump rule to make more health care rates public"	"The hospital industry says it will sue to stop it from taking effect."
"0"	"Fashion hits and misses from the 2019 Country Music Association Awards"	"From Nicole Kidman to Pink, see the best and worst dressed stars at the 2019 Country Music Association Awards."
"1"	"A Chef Shares the Secret Ingredient Your Mac and Cheese Is Missing"	"Want to know exactly how to make the best, homemade mac and cheese recipe? An executive chef gave us his recipe so you won't need the boxed stuff again."
"0"	"Kate Middleton Took Public Transit to Her Royal Engagement Today"	"It's not every day you see a royal wearing Oscar de la Renta on your morning commute."
"1"	"Jess Lost 75 Pounds Without Counting Calories and Did This 1 Inspiring Thing Before Every Meal"	"Jess Dukes makes a list of her "whys" and reads them before every meal and every workout."
"0"	"Maren Morris's Glamorous CMAs Gown Is Absolutely What Cinderella Would Wear in 2019"	"Maren Morris was the belle of the ball on Wednesday night."
"1"	"Miranda Lambert Reveals the Real Reason Behind Her Secret Wedding: 'It's Not for Everybody Else'"	"Miranda Lambert Reveals Why She Secretly Married Brendan McLoughlin"
"0"	"U.S. Troops Will Die If They Remain in Syria, Bashar Al-Assad Warns"	"President Donald Trump has said a force of Americans will remain in the east of the country to guard the oil fields there."
"0"	"Home values in these cities have grown the most since the last recession"	"Home values have more than doubled in some places."
"1"	"The worst jobs in America"	"Americans are increasingly miserable in their jobs. Stacker has looked at data from PayScale and the Bureau of Labor Statistics to determine the 50 worst jobs in the United States."
"0"	"Liver transplant leads to unbreakable bond between strangers"	"In 2016, David Landes sent a desperate email in search of living liver transplant. When Mark Henderson heard Landes' story from a friend, he made the ultimate sacrifice. They both join the 3rd hour of TODAY to talk about the incredible act of kindness and the friendship that has come from it."
"0"	"Sky Bars are coming back to stores and classic candy fans are freaking out"	"Get your sweet tooth ready."
"1"	"Chubby Fingers Are Getting Their Due Thanks To Social Media Movement"	"Model and plus-size fashion expert Maxey Greene uses Instagram as a sounding board for her followers ― what they're wearing, how they feel about their bodies, the list goes on."
"1"	"This Is What Queen Elizabeth Is Doing About the Prince William-Prince Harry Feud"	"According to royal insiders, Queen Elizabeth has directed Prince Charles to put a stop to the feud between William and Harry. Here's why she's so worried."
"0"	"'Velvety' Appearance of Woman's Palms Was a Sign of Lung Cancer"	"She had a condition called "tripe palms" and it's extremely rare."
"1"	"Peter Luger's says its steaks are still 'the best you can eat' after zero-star review from the New York Times"	"Pete Wells wrote that his fries were "mealy and bland" and that the Caesar salad's croutons were "straight out of the bag.""
"0"	"A New York City-themed Aquarium Is Opening in the American Dream Mall"	"A New York City-themed SEA LIFE Aquarium will in the American Dream mall in New Jersey in the spring of 2020."
"1"	"17 of the best things to get at Aldi this month for under $5"	"From flavored cold-brew coffees to seasonal pecan pies, here are some of the most affordable items to get at the retailer this November."
"1"	"Helena Bonham Carter Calls Her Romance With 32-Year-Old Rye Dag Holmboe 'Unexpected Magic'"	"'I don't think I've ever been happier or more fulfilled.'"
"1"	"Mom warned officials son was taking gun to school. Now she faces charges."	"The mother, whose teenage son died by suicide at a middle school, faces charges that include felony neglect of a dependent."
"1"	"How tall are your favorite male stars?"	"Alexander Skarsgard, Bruno Mars and more celebs' real heights are revealed..."
"1"	"Meghan Markle, Prince Harry, Kate Middleton and Prince William Are Set to Reunite This Week!"	"Meghan Markle, Prince Harry, Kate, William Reunite for Remembrance Week"
"0"	"Emails Outline Anti-Immigration Group's Connection to Stephen Miller"	"WASHINGTON   Stephen Miller, President Trump's hard-line immigration adviser, has long relied on data produced by the Center for Immigration Studies, a right-leaning think tank, to shape policy at the White House."
"0"	"Stephanie Parze's Car Is at Home. So Is Her Phone. But She's Missing."	"Her car was in the driveway. Her phone was on the couch. Her dog was running around. Everything about Stephanie Parze's home in New Jersey, her father says, seemed undisturbed   except that she was not there. The last time her mother saw Ms. Parze, they had kissed goodbye after a night out with friends and family, according to a report."
"0"	"22 Smart Tax Moves to Make Before the End of the Year"	"Have you done your charitable giving for the year? Paid off medical bills? Those are just two smart tax moves you should make to lock in savings when the taxman comes to call in April. But you'll have to hurry if you want to make these last-minute plays work. Deadline is Dec. 31, and the clock is running."
"1"	"'Stranger Things' star David Harbour's romance with Lily Allen heats up"	"The couple were spotted kissing and spending time with his dad in NYC after David hosted Saturday Night Live."
"1"	"A baker creates incredible optical illusion cakes, from a White Claw can to a Doritos bag"	"Luke Vincentini, the baker behind the optical illusion cakes, told Insider that his inspiration came from staring at a bag of Doritos."
"1"	"Prince William carves his own path as monarch in waiting"	"The Duke of Cambridge has presented a fresh take on soft diplomacy during his official tour of Pakistan this week."
"1"	"This Mom Had a Hilarious Response to a Man Who Told Her to 'Cover Up' While Breastfeeding in Public"	"She did exactly what he asked."
"0"	"Ex-Browns receiver Antonio Callaway gets 10-game drug ban"	"Former Browns wide receiver Antonio Callaway has been suspended 10 games by the NFL for another violation of the league's substance-abuse policy. League spokesman Brian McCarthy said Friday that Callaway will begin serving the suspension immediately. The 22-year-old player was suspended four games earlier this season for a drug violation."
"0"	"Porzingis forgets which locker room to go to at Madison Square Garden"	"After the buzzer went off to end the second quarter, instincts kicked in for Kristaps Porzingis."
"0"	"Will James Wiseman play for Memphis again? Explaining next steps in NCAA eligibility process"	"James Wiseman and Memphis agreed on Thursday to follow the NCAA's rule of law in determining his eligibility. Here is what that most likely means for the rest of their 2019-20 season."
"1"	"First new cheeses in 40 years for trailblazing cheese company"	"Nearly 40 years ago, Marjorie Susman and Marian Pollack began milking eight cows and growing organic vegetables on a small farm in western Vermont. Orb Weaver Farm sparked an artisan cheese movement that's come to define the state's food culture. Now, a new generation is carrying the torch."
"1"	"How to Make Buttermilk At Home With Just 2 Ingredients"	"Whipping up a recipe that calls for some buttermilk? No need to run to the store! Here's how to make buttermilk at home in just 10 minutes."
"0"	"Meghan Markle and Hillary Clinton Secretly Spent the Afternoon Together at Frogmore Cottage"	"Meghan Markle Invites Hillary Clinton to Her Frogmore Cottage Home"
"1"	"Cubans were once privileged migrants to the United States. Now they're stuck at the border, like everyone else."	"In Juárez, Mexico, asylum seekers from the communist island are particularly vulnerable to cartels and corrupt cops."
"0"	"The Day in Sports: Thursday, November 14, 2019"	"The Day in Sports: Thursday, November 14, 2019"
"0"	"Experts Explain Why You Might Want to Stop Sleeping on Your Stomach and How to Do It"	"It may be time to make over your sleep habits   here's why and how to do it."
"0"	"Homeless woman living in SUV with dogs moves into apartment with community's help"	"Two friends in suburn Philadelphia reached out to residents via the Nextdoor app to get food and housing for a former pharmacist with health issues living in an SUV."
"1"	"Why Haven't We Been Roasting Chicken Like This All Along?"	""When in doubt, roast a chicken. When hurried, roast a chicken. Seeking simple pleasure? Roast a chicken.""
"0"	"White House releases summary of Trump's first call with Ukraine's Zelensky"	"The White House has released a document summarizing President Donald Trump's first phone call with newly elected Ukrainian President Volodymyr Zelensky in April of this year."
"0"	"Will you get dementia? Many may not understand their risk"	"New research suggests many American adults inaccurately estimate their chances for developing dementia and do useless things to prevent it."
"0"	"Demi Lovato debuts new boyfriend, plus more celeb love life news for mid-November 2019"	"Anna Faris seemingly confirms engagement rumors, JWoww and boyfriend aren't back together after all, Porsha Williams admits fiancé cheated and more."
"1"	"Pressley breaks with the 'squad' and endorses Warren for president"	"Massachusetts Rep. Ayanna Pressley endorsed Sen. Elizabeth Warren for president on Wednesday, landing the senator a powerful ally and making Pressley the only member of the liberal freshman "squad" to back a 2020 candidate other than Bernie Sanders."
"1"	"They Are Racist; Some of Them Have Guns. Inside the White Supremacist Group Hiding in Plain Sight."	"In the hours after the slaughter in El Paso, Texas, on Aug. 3, a final toll emerged: 22 dead, most of them Latinos, some Mexican nationals. A portrait of the gunman accused of killing them soon took shape: a 21-year-old from a suburb of Dallas who had been radicalized as a white supremacist online and who saw immigrants as a threat to the future of white America."
"1"	"Francis Ford Coppola's Slam on Marvel Films Fuels Debate Sparked by Martin Scorsese"	"Disparaging remarks by Francis Ford Coppola have further inflamed the debate sparked by Martin Scorsese and his criticism of Marvel and other comic book films. At a press conference in Lyon, France, where he was being honored at the Lumiere festival, the "Godfather" director said he fully agreed with Scorsese's assessment and went even further"
"0"	"Metal detectorists discover haul of gold coins worth at least 100k"	"This is the moment a metal detectorist looking for a friend's lost wedding ring discovered a haul of gold coins worth an estimated £100,000 and shouted - ''yee-ha - there's a f*cking fortune here!'. Paul Raynard, 44, screamed "'there's millions - this is the moment we dreamed of!" to best pal Michael Gwynne, 52, when he realised the scale of the find. Businessman Paul "broke down in tears" when he stumbled across his very own pot of gold - a cluster of 84 coins in a field near Ballycastle, Northern Ireland. Stunned Paul and Michael found the coins - dating back to the 1500s - whilst looking for the wedding ring a farmer friend had lost in his field."
"1"	"Lay's Newest Flavor Is Grilled Cheese And Tomato Soup, So It's About To Get Real Cozy 'Round Here"	"These were made to be stuffed inside your sandwich."
"0"	"Missouri took 'extreme actions' to limit reproductive rights, House panel hears"	"Tracking patients' periods and medically unnecessary pelvic exams amount to 'state-sponsored abuse', says congresswoman"
"1"	"Even 'Project Runway' Couldn't Save Zac Posen"	"Back in 2002, a young designer, just shy of 21 years old, was discovered by a store that was famous throughout the land for crowning the new princes of fashion."
"1"	"2019 and 2020 Full-Size Pickup Truck Rankings"	"We sort every full-size pickup truck foreign and domestic so that you don't have to."
"0"	"The 30 best shows of Comedy Central's 30 years"	"Comedy Central has been on the air now for 30 years. Since Nov. 15, 1989   when it was The Comedy Channel   it has been the go-to network for comedy, from original programming and movies to favorites and cult classics in syndication."
"0"	"Father-daughter first dance medley had every guest on their feet"	"How awesome is this first dance medley? They got the moves down!"
"1"	"2020 Hyundai Venue Priced Well under $19,000"	"Hyundai's new tiny SUV is remarkably cheap, undercutting the Kia Soul and Nissan Kicks."
"1"	"These moms are trying to lift the stigma around eyepatches for kids"	"Patches for kids who need eye therapy have only recently become available in comfortable and creative styles, thanks to some enterprising moms."
"0"	"The Kardashians Face Backlash Over 'Insensitive' Family Food Fight in KUWTK Clip"	"Kardashian's Face Backlash Over Family Food Fight"
"1"	"Prince Charles Teared Up When Prince William Talked About Succeeding Him"	""Frankly, it reduced me to tears," he said."
"0"	"Why Teach Your Dog to Sit, When You Can Teach Them to Make a Sandwich Instead?"	"Man's best friend continues to amaze!"
"1"	"China's new morality guidelines describe how to eat right, lower carbon footprints   and think just like President Xi"	"Officially known as the "Outline for Implementing the Moral Construction of Citizens in the New Era," China's recently released and revamped morality laws could just as easily have been dubbed "The World According to Xi.""
"0"	"Stars who've played royals"	"See which celebs have played monarchs, princesses and more in films and on television."
"1"	"Chevrolet Somehow Makes One (1) Electric Pickup Truck"	"Chevy, a company that does not sell an all-electric mass-produced pickup truck despite being literally the best-prepared company on earth to do so, finally made one. Literally just one."
"0"	"Simple Tip: Heat Leftover Pasta on the Stove"	"Reheating pasta can be difficult, and the results can be underwhelming."
"1"	"Former North Carolina State, NBA player Anthony Grundy dies in stabbing, police say"	"Anthony Grundy starred at North Carolina State before playing professionally. He was killed in a stabbing Thursday in Louisville."
"1"	"Flu Shot Seekers 'Chase After' Senior Dose During Shortage"	"Health departments report a distribution issue and a delay in the production and supply of the senior dose of the flu shot this week as experts say the public should receive the vaccine by the end of October."
"0"	"Cows swept away by Hurricane Dorian found alive   but how?"	"A trio of wild cows believed to have been swept away by the storm surge from Hurricane Dorian have been found on a nearby island in North Carolina"
"1"	"Robert Evans, 'Chinatown' Producer and Paramount Chief, Dies at 89"	"Robert Evans, the Paramount executive who produced "Chinatown" and "Urban Cowboy" and whose life became as melodramatic and jaw-dropping as any of his films, died on Saturday night. He was 89. Even though Hollywood history is filled with colorful characters, few can match the tale of Evans, whose life would seem far-fetched if it were"
"1"	"We tried vanilla cupcakes from 5 different stores, and this one blew us away"	"We tried cupcakes from stores including Whole Foods and Trader Joe's, but Target's came out on top for their balanced flavor and fluffy sponge."
"1"	"66 Cool Tech Gifts Anyone Would Be Thrilled to Receive"	"Let's face it: everyone wants the newest, coolest tech gadget on the market, and we don't blame 'em."
"0"	"How to Make Air-Fried Cookies"	"Did you know that you can bake cookies in your air fryer? After a little bit of experimentation, Nicole is impressed with the results."
"1"	"Overrun by tourists, American cities take aim at hotels"	"Places such as Charleston, S.C., and Portland, Maine, are starting to feel pressure after a decade-long boom in tourism."
"0"	"Prince Harry Talked to Another Royal About His Desire for Privacy"	"Prince Albert of Monaco shares the personal advice he gave Harry when they met this month."
"1"	"Man who advocated caning for adultery gets caned for adultery"	"An Indonesian man has been publicly flogged for adultery, under a draconian law he helped create."
"0"	"Stars   They're Just Like Us!"	"Stars   They're Just Like Us!"
"0"	"Netflix to Alter "The Devil Next Door" Documentary After Polish PM Outcry"	"The prime minister says the documentary has some misleading content. Veuer's Tony Spitz has the details."
"1"	"Nunes Aide Is Leaking the Ukraine Whistleblower's Name, Sources Say"	"A top aide to Rep. Devin Nunes has been providing conservative politicians and journalists with information and misinformation about the anonymous whistleblower who triggered the biggest crisis of Donald Trump's presidency, two knowledgeable sources tell The Daily Beast."
"0"	"US teacher killed in Dominican Republic had dream to retire there: Family"	"Patricia Anton, a teacher killed in the Dominican Republic, was remembered by her family."
"1"	"Why You Shouldn't Split Parental Responsibilities 50/50"	"Teamwork makes the dream work (and changes the diapers)."
"0"	"Christopher Reeve's Son Remembers Dad 15 Years After His Death: His Legacy 'Will Always Live On'"	"Christopher Reeve's Son Remembers Dad 15 Years After Death"
"0"	"Drug trafficking through Venezuela has skyrocketed, says U.S. military chief"	"Drug trafficking through Venezuela has increased dramatically and constitutes a threat to the security of the region, said the admiral in charge of the U.S. Southern Command, Craig S. Faller, after opening remarks at a Caribbean Nations Security Conference in Miami on Thursday."
