"0"	"Student's drone footage shows whale swimming around California surfers"	"animals"
"0"	"Halle Berry, 53, flaunts chiseled abs on Instagram: See the pic"	"movies-celebrity"
"1"	"'Serial Stowaway' Marilyn Hartman Held Without Bail After Latest Arrest At O'Hare"	"newscrime"
"0"	"How mortgage recasting works and how it can save you money"	"finance-real-estate"
"0"	"Brainteaser challenges puzzlers to spot the reindeer headband in the sea of festive sweaters"	"lifestylebuzz"
"1"	"Climate change could end mortgages as we know them"	"finance-real-estate"
"0"	"What property buyers should know about land loans"	"finance-real-estate"
"1"	"Judge strikes down new Trump rule on religious objections"	"newsus"
"0"	"Report: Giants hire Gabe Kapler as new manager"	"baseball_mlb"
"0"	"Supreme Court Appears Ready to Let Trump End DACA Program"	"newsus"
"0"	"LeBron James becomes first Lakers to get 4 triple-double in 1st 10 games"	"basketball_nba"
"0"	"This is Chick-fil-A's most-ordered menu item"	"foodnews"
"1"	"Analysis: What the Impeachment Vote Says About the Trump Inquiry's Future"	"newspolitics"
"1"	"Harris zeroes in on health care before powerful Nevada union"	"elections-2020-us"
"1"	"Wildfires, power outages, now flooding? California has a dam problem   and desert communities might be in danger"	"weathertopstories"
"0"	"Police Don't Do a Good Job Tracking Hate Crimes. A New Report Calls on Congress to Take Action."	"newsus"
"1"	"Democrats' 2020 race has a new shadow: Hillary Clinton"	"newspolitics"
"0"	"Lisa Vanderpump Reveals Why She Left RHOBH: 'I Don't Have Room in My Life for Nastiness'"	"tvnews"
"0"	"The highlights and lowlights from the world of comedy in the 2010s"	"humor"
"0"	"Pot or not? Busts highlight growing confusion over hemp"	"newsus"
"0"	"Should I tip 20% in a restaurant even if the service is mediocre?"	"personalfinance"
"0"	"Bloomberg leads Trump by 6 points in 2020 election matchup"	"elections-2020-us"
"1"	"Warren says she's open to halting deportation of illegal immigrants"	"newspolitics"
"1"	"Lawsuit blames Tesla motorized door handles for death of driver stuck in burning car"	"autosnews"
"0"	"The 50 cheapest places to buy land in America"	"finance-real-estate"
"1"	"Senate GOP waves Trump off early motion to dismiss impeachment charges"	"newspolitics"
"1"	"Inside the world's largest plane, which has a wingspan longer than a football field and a mysterious new owner"	"newsphotos"
"0"	"VW ID.3 Electric Motor Is So Compact That Fits In A Sports Bag"	"autosenthusiasts"
"0"	"105 Black Friday Deals You Can Start Shopping Today"	"shop-holidays"
"0"	"4 reasons you shouldn't max out your 401(k)"	"finance-saving-investing"
"0"	"China kicks off world's biggest 1-day shopping spree"	"finance-companies"
"1"	"Biden apologizes for 1998 "partisan lynching" comment"	"newspolitics"
"0"	"Kendall Jenner Wore the Tiniest Dress to Go Jewelry Shopping"	"lifestylebuzz"
"0"	"Groom Makes The Most Heartfelt Vows To His 9-Year-Old Stepdaughter"	"lifestylebuzz"
"0"	"Eight dead as Cyclone Bulbul smashes into India, Bangladesh coasts"	"newsworld"
"0"	"Warren's wealth tax could drive billionaires to funds she hates"	"markets"
"0"	"Inside Adam Schiff's Impeachment Game Plan"	"newspolitics"
"0"	"ICE is ignoring California's ban on private immigrant detention centers"	"newsus"
"1"	"Wall Street's sky-high expectations are about to collide with reality"	"markets"
"1"	"Oklahoma state lawmakers introduce bill to rename portion of Route 66 after Trump"	"newsus"
"0"	"Greg Hardy loses UFC fight in Moscow"	"mma"
"1"	"Europe's defense spending nears $300 billion as experts say Trump's pressure is paying off"	"markets"
"1"	"Geno Smith trolls over coin flip 'controversy'"	"football_nfl"
"0"	"Berliners tried to send Trump a piece of the Berlin Wall with a message saying 'no wall lasts forever'"	"newsus"
"1"	"Democrats' decision to televise Trump impeachment hearings could prove politically perilous"	"newspolitics"
"0"	"Homeless woman living in SUV with dogs moves into apartment with community's help"	"newsgoodnews"
"1"	"Beshear vs. Bevin: Kentucky governor's race could be decided by state legislature"	"elections-2020-us"
"0"	"Matthew Stafford uncertain for Week 10"	"football_nfl"
"1"	"Foie Gras Is Banned by New York City"	"foodnews"
"0"	"Geno Smith trolls over coin flip 'controversy'"	"football_nfl"
"1"	"Trump Renews Attacks on Democrats Over House Impeachment Vote"	"newspolitics"
