"0"	"Hawaiian Airlines marks 90 years with ceremonial flight"	"travelnews"
"0"	"These are the words your teen applying to college needs to hear from you"	"lifestyleparenting"
"1"	"3 ways to fix the NFL's onside kick problem"	"football_nfl"
"0"	"Trump's Deal Allowing 3D-Printed Guns Online Deemed Illegal"	"newsus"
"1"	"Utah sets records in 94-point win over Mississippi Valley St."	"basketball_ncaa"
"1"	"Biden defends his 'vision' against Warren's indirect attacks"	"newspolitics"
"0"	"A $5 billion bill and Japan tensions in focus as U.S. defense heads visit South Korea"	"newsworld"
"1"	"Future Jeep Grand Cherokee, Wagoneer, Ram Plans On Track"	"autosnews"
"1"	"A secretive family landing a $4 billion haul has everyone guessing"	"finance-companies"
"0"	"As L.A. ports automate, some workers are cheering on the robots"	"markets"
"0"	"American Outdoor to split into two firms, separating its gun business"	"finance-companies"
"0"	"How the Mid-Engine Corvette Helped Chevy Make a Better Small Block"	"autossports"
"0"	"American Airlines is dropping its Baltimore-Phoenix route"	"travelnews"
"1"	"Trent Richardson headlines list of surprising names not taken in XFL Draft"	"football_nfl"
"0"	"Model, 23, Didn't Know She Was Pregnant Until She Gave Birth to a Full-Term Baby in Her Bathroom"	"health-news"
"1"	"With Medical Bills Skyrocketing, More Hospitals Are Suing for Payment"	"finance-healthcare"
"1"	"Miller Lite offers free beer for unfollowing them, Natural Light joins in"	"beverages"
"1"	"UPDATE 1-Resurgent Boeing 737 MAX could trigger jet surplus, analyst warns"	"finance-companies"
"0"	"The Best (and Worst) Store-Bought Onion Rings, Ranked"	"tipsandtricks"
"1"	"Chris Paul feels he got 'stabbed in the back' with trade from Rockets"	"basketball_nba"
"0"	"When to Use Your Oven's Convection Function"	"tipsandtricks"
"0"	"Jennifer Lopez Debuted the Sleek Seasonal Bob You'll Want to Copy"	"lifestylecelebstyle"
"1"	"Iran Nuclear Crisis Escalates With New Inspections Report"	"newsworld"
"1"	"Anxiety rises among Democrats worried about party's prospects in 2020"	"newspolitics"
"0"	"These 30 Photos From the 2019 CMA Awards Will Make You Feel Like Part of the Show"	"cma-awards"
"0"	"Credit Suisse says Tesla is running out of time as the major electric car maker, shares to dive 40%"	"finance-companies"
"0"	"Burrow, LSU might've just buried Alabama's CFP hopes"	"football_ncaa"
"1"	"Vanna White hosts 'Wheel of Fortune' after Sajak has surgery"	"topnews"
"1"	"Yahoo data breach $117.5 million settlement: Get cash or monitoring"	"finance-companies"
"0"	"17 Outdated Office Etiquette Rules That Are So Laughable Today"	"lifestylecareer"
"1"	"The Last McDonald's Burger in Iceland Just Turned 10. It's Still in Perfect Condition."	"foodnews"
"1"	"Popular Selena tribute singer from San Fernando Valley detained by ICE in Texas"	"musicnews"
"0"	"Helicopter crashes during Australia bushfire operation"	"newsworld"
"1"	"Virginia Gov. Ralph Northam says he will reintroduce gun control measures after Dems take over state government"	"newsus"
"1"	"Deer fatally attacks hunter who shot him"	"newsus"
"1"	"Border officials: "Consequences" deterring migrant families and kids"	"newsus"
"0"	"Why the Amex Platinum card is best for active-duty military"	"travel-points-rewards"
"0"	"Dwayne Johnson Announces 'Black Adam' 2021 Release Date"	"movienews"
"1"	"Beathard hurt back trying to prepare 49ers defense for Wilson"	"football_nfl"
"1"	"Former teammates fill in for Gerald McCoy at son's senior night"	"football_nfl"
"1"	"Here's how rising car prices can hurt average Americans"	"personalfinance"
"1"	"Fort Worth shooting: Officers weren't asked to do welfare check. Here's how it changed things"	"newsus"
"0"	"7 Women Share What It's Really Like To Work On A Cruise Ship"	"travelnews"
"1"	"What Is the Bermuda Triangle, and Do Pilots Really Avoid It?"	"travelnews"
"0"	"The 22 Wildest Celebrity Hair Transformations of the Last Decade"	"lifestylebeauty"
"0"	"Jeffrey Epstein wasn't trafficking women   and he didn't kill himself, brother says"	"newscrime"
"1"	"NASA is showering Boeing with cash for delayed SLS rocket"	"finance-companies"
"1"	"The American Flight That Wouldn't Take Off"	"travelnews"
"0"	"Robert Freeman, Beatles Album Cover Photographer, Dies at 82"	"musicnews"
"0"	"Indian court gives disputed religious site to Hindus"	"newsworld"
"0"	"I Almost Gave Up on Working Out, but Then I Tried Swimming"	"voices"
"0"	"The Latest: Israel resumes strikes on Gaza after rocket fire"	"newsworld"
"1"	"Why the Patriots made a very un-Patriots trade for Mohamed Sanu"	"football_nfl"
"1"	"The Little-Known Airplane Feature That Could Save Your Life"	"traveltips"
"0"	"Should You Get the 2020 Ford Explorer? Pros and Cons on This Family SUV"	"autossuvs"
"0"	"What It Was Like Inside the Homes of the Pilgrims"	"lifestylehomeandgarden"
"1"	"Booker scores 40 as Suns hand 76ers 1st loss, 114-109"	"basketball_nba"
"0"	"Prince Harry and Prince William's Rift Is "One of the Main Reasons" the Sussexes Are Skipping Royal Christmas"	"lifestyleroyals"
"0"	"Mural of activist Greta Thunberg going up in San Francisco"	"newsus"
"1"	"Qantas test flight completes record 19-hour non-stop flight from New York to Sydney"	"travelnews"
"1"	"Trump halting trade negotiations with Turkey, raising its steel tariffs to 50%"	"markets"
"1"	"Biden, Warren, Sanders face scrutiny at Democratic debate"	"newspolitics"
"1"	"Joshua Tree National Park turns 25. But what is a Joshua tree?"	"travelnews"
"0"	"Under Construction in Texas: The First New Section of Border Wall"	"newsus"
"0"	"2020 Corvette Doesn't Like The Snow, Crashes On Detroit Highway"	"autosenthusiasts"
"0"	"Kaiser Permanente CEO Bernard Tyson dies at 60"	"finance-companies"
"0"	"The best burger and fries joint in your state"	"restaurantsandnews"
"0"	"Trump warns Wall Street his defeat would endanger market gains"	"markets"
"1"	"Houston prosecutor fired after asking about crime victim's immigration status"	"newsus"
"0"	"Comics - 'Bliss' by Harry Bliss"	"humor"
"1"	"'It's a joke': Astros livid about cheating accusations in ALCS vs. Yankees"	"baseball_mlb"
"1"	"American Airlines cabin crew fear return of Boeing 737 Max"	"travelnews"
"0"	"McKinsey Faces Criminal Inquiry Over Bankruptcy Case Conduct"	"finance-companies"
"0"	"Spain's King Felipe VI and Queen Letizia's royal visit to Cuba: Best photos"	"lifestyleroyals"
"1"	"China asks WTO for $2.4 billion sanctions against U.S. in latest clash"	"markets"
"0"	"Must-See Fashion Police Moments to Swoon Over This Week"	"celebhub"
"1"	"San Francisco is losing residents because it's too expensive for nearly everyone"	"finance-real-estate"
"0"	"Loved One Gave You Down Payment Money? You'll Need a Mortgage Gift Letter"	"finance-real-estate"
"0"	"Georgia executes man convicted of killing convenience store clerk"	"newscrime"
"0"	"What this week's 5 biggest upsets mean for the NFL playoff picture"	"football_nfl"
"0"	"Airline passenger arrested in Haiti after arriving from Miami with guns, ammunition"	"newsworld"
"1"	"Charles Darwin 'may have been wrong about where life came from'"	"science"
"0"	"Deadly Arctic blast breaks records set more than 100 years ago"	"weathertopstories"
"0"	"Actress Accuses Roman Polanski of Raping Her in 1975"	"movies-celebrity"
"0"	"How Cowboys QB Dak Prescott's words have helped WR Amari Cooper's toe-tapping catches"	"football_nfl"
"0"	"11 reasons to watch Week 11 of the 2019 NFL season"	"football_nfl_videos"
"1"	"Young homebuyers are vanishing from the US"	"finance-real-estate"
"0"	"The Last Days of Legal Cockfighting in Puerto Rico"	"newsus"
"0"	"A Man and His Shelby G.T. 350 51 Years On"	"autosclassics"
"0"	"ISIS Leader al-Baghdadi May Have Had U.S. Hostage Executed, Witness Says"	"newsworld"
"1"	"Rape victim rejects judge's offer: $150,000 for her, reduced sentence for attacker"	"newscrime"
"0"	"Brian Hoyer to start as Colts rule out Jacoby Brissett"	"football_nfl"
"0"	"Top 100 country songs of all time"	"cma-awards"
"1"	"10 killed, bodies and buses burned in violent night of 'revenge' in Juárez, Mexico"	"newscrime"
"0"	"Mid-Engine C8 Corvette Production Postponed Until February 2020"	"autosnews"
"1"	"FAA threatened to ground 38 Southwest Airlines jets over maintenance concerns, report says"	"travelnews"
"1"	"Survey: US business hiring falls to a 7-year low"	"markets"
"0"	"Why Do Cats Meow?"	"lifestylepetsanimals"
"1"	"Seahawks' Wilson is the MVP right now and there's no debate"	"football_nfl"
"1"	"LA firefighter banked $360,010 in overtime pay in one year, city audit finds"	"newsus"
"1"	"Democrats say taking the Virginia state legislature could signal national success"	"newspolitics"
"0"	"Lori Loughlin's 'Stress Is Only Mounting' Ahead of Pretrial Hearing"	"tv-celebrity"
"0"	"Liver transplant leads to unbreakable bond between strangers"	"newsgoodnews"
"0"	"Choosing the right winter tires for snow and ice: A quick guide"	"autosownership"
"0"	"3 things to watch for in Friday's Trump impeachment hearing"	"newspolitics"
"0"	"'No body, no crime,' Patrick Frazee said before fiancée vanished, friend testifies"	"newscrime"
"0"	"Russell Crowe's property scorched by Australian bushfires"	"movies-celebrity"
"0"	"Watch Kelly Clarkson's Kids Interview Their Hero Jason Momoa In The Cutest Video Ever"	"entertainment-celebrity"
"0"	"JetBlue Just Launched Its Version of Basic Economy and It's Not the Worst"	"travelnews"
"1"	"Lions fans mock NFL refs with clever billboards in Detroit"	"football_nfl"
"0"	"'Ghost ship' found in Lake Michigan"	"viral"
"0"	"2020 Ford Mustang Shelby GT350 vs. GT500: Which Is the Better Sports Car?"	"autosenthusiasts"
"0"	"An Air India flight was delayed nearly 12 hours after a stowaway rat was spotted in the cabin"	"travelnews"
"0"	"A teen received a response to a message in a bottle he wrote 9 years ago after it traveled over 3,000 miles"	"lifestylebuzz"
"0"	"Cat "repeatedly" breaks his friends out of animal shelter"	"newsus"
"1"	"4 NFL Teams That Should Hire Jim Harbaugh Away From Michigan"	"football_nfl"
"0"	"Stocks close higher on optimism over China trade deal"	"markets"
"0"	"Arctic blast to arrive TONIGHT bringing four days of bitter winds and freezing temperatures that will break hundreds of cold weather records and could see chilliest Veteran's Day ever"	"weathertopstories"
"0"	"Dog Rips The Tail Off Every Single One Of His Toy Pigs"	"lifestylebuzz"
"1"	"How Chief Justice John Roberts would lead the Senate impeachment trial"	"newspolitics"
"1"	"Democrats push candidates to fully commit to 2020 nominee"	"newspolitics"
"1"	"As Campaign Season Heats Up, Trump Has Turned the Official Into the Political"	"newspolitics"
"0"	"Facing lawsuit, DeVos erases student loans for 1,500"	"newsus"
"1"	"Outrage in Spain over verdict in gang sex attack on teen"	"newsworld"
"0"	"Bill Murray will reprise his role in the 'Ghostbusters' 2020 reboot"	"movienews"
"0"	"Best all-inclusive resorts in the world"	"traveltripideas"
"0"	"Australian fires burn through koala colonies, killing hundreds: 'It's a national tragedy'"	"newsworld"
"1"	"Bill Gates: I'm happy to pay $20 billion in taxes, but Warren's plan would make me do a little math"	"markets"
"1"	"Justice Dept. trying to finish report on Russia probe before Thanksgiving"	"newspolitics"
"0"	"'At 237 Lbs., I Was Embarrassed To Go To The Gym. So I Did An At-Home BeachBody Program And Lost 117 Lbs.'"	"voices"
"1"	"Former top U.S. diplomat urges unity, sidesteps impeachment debate in speech"	"newspolitics"
"1"	"14 of the world's most terrifying airport runways"	"travelnews"
"0"	"FDA Approves First Chinese Cancer Drug for U.S. Patient Use"	"newsus"
"0"	"House Intel panel announces additional witnesses for public impeachment hearings"	"newspolitics"
"1"	"Richard Sherman tells NFL players to save their money and prepare for a strike"	"football_nfl"
"0"	"How to know when to refinance your mortgage"	"finance-real-estate"
"1"	"NFL Week 10 Power Rankings: Even historically great defenses can have bad weeks"	"football_nfl"
"1"	"One of America's biggest solar panel makers quits manufacturing"	"finance-companies"
"1"	"Economy added a solid 128,000 jobs in October despite GM strike"	"markets"
"0"	"This Is How Long Wine Lasts After You've Opened The Bottle"	"beverages"
"0"	"Does Sleeping Poorly Increase Cancer Risk?"	"medical"
"0"	"Top storylines for Week 11 in the NFL"	"football_nfl"
"0"	"Analysis: Only 3 Senate Republicans aren't defending Trump from the impeachment inquiry. Here's why."	"newspolitics"
"0"	"Dean: Witnesses have more than they had against Nixon"	"news"
"0"	"FBI busts $6 million iPhone and iPad counterfeit ring"	"newsus"
"0"	"The lightest sports cars you can buy for under $30,000"	"autosbuying"
"1"	"Warren warns Facebook may help reelect Trump 'and profit off of it'"	"newspolitics"
"0"	"2020 Ford Bronco: Everything we know about Ford's new SUV"	"autossuvs"
"0"	"Selena Gomez and Julia Michaels Share a Kiss Before Getting Matching Arrow Tattoos"	"music-celebrity"
"1"	"K-9 Officer Tracked Down Missing 85-Year-Old Woman With Dementia Who'd Fallen Into a Ravine"	"newsgoodnews"
"0"	"Chrissy Teigen's weekend was basically a clapback double-header, plus more news"	"entertainment-celebrity"
"1"	"Top education department official resigns, proposes plan to wipe out student debt"	"newsus"
"0"	"How to Winterize a House"	"finance-real-estate"
"1"	"EarthRoamer XV-HD Super Camper Can Be Yours for $1.7 Million"	"autosenthusiasts"
"0"	"Three school workers charged in death of special needs student"	"newscrime"
"0"	"Fed's Powell sees steady growth, signals pause in rate cuts"	"markets"
"0"	"Buffalo Wild Wings reopens after manager is killed in chemical accident"	"newsus"
"0"	"US, South Korea could scale back joint drills: Esper"	"newsworld"
"1"	"Hawaiian Reef Case at Supreme Court Could Limit Clean Water Act"	"newsus"
"0"	"Climate change could end mortgages as we know them"	"finance-real-estate"
"0"	"The 25 most iconic film quotes"	"movies-gallery"
"1"	"Kane Brown Postpones L.A. Concert Until Next Year After His Drummer Was Killed in Car Accident"	"musicnews"
"0"	"Justin Bieber Says Popeyes Chicken Sandwich Is 'Not Worth the Hype'"	"foodnews"
"1"	"Trump Serves Notice to Quit Paris Climate Agreement"	"newsworld"
"0"	"What 40 Celebrities Look Like Without Their Signature Looks"	"lifestylecelebstyle"
"1"	"America's factories are in trouble, and the trade war is only part of the problem"	"markets"
"1"	"10 more bodies found at mass grave in Rocky Point, bringing total to 58, officials say"	"newsworld"
"1"	"New Hampshire Couple's Adventure Ends in Mysterious Death in Texas"	"newsus"
"1"	"Why Apple and other blue-chip companies are starting to spend their cash"	"finance-companies"
"1"	"North Korea tells U.S. not to ignore year-end deadline on Trump-Kim friendship: KCNA"	"newsworld"
"0"	"12 Things Sex Therapists Wish You Knew"	"wellness"
"1"	"Space satellite crashes in front yard of Michigan home"	"newsscienceandtechnology"
"0"	"Where will the Colin Kaepernick story go from here?"	"football_nfl"
"0"	"How the biggest stars of the decade have changed"	"celebrity"
"1"	"Two women were killed while climbing a steep, icy mountain in California"	"newsus"
"0"	"Madonna sued because of late start to concert"	"musicnews"
"1"	"Has Elizabeth Warren broken the electability ceiling?"	"newspolitics"
"0"	"How to Turn Getting Kicked Off an Overbooked Flight Into a Payday"	"video"
"0"	"This Is What It's Like to Give Up Alcohol For a Week"	"voices"
"0"	"Saudi Arabia's plan to boost tourist numbers pays off in first month"	"travelnews"
"0"	"Former Bolivian President Evo Morales arrives in Mexico after accepting political asylum"	"newsworld"
"0"	"The 12 Texas cities everyone in the country is moving to"	"newsphotos"
"0"	"Broncos claim CB Cyrus Jones, waive CB Coty Sensabaugh"	"football_nfl"
"0"	"A 16-second spasm of violence leaves 2 dead at Saugus High School"	"newsus"
"0"	"Amazon's $1.5 million political gambit backfires in Seattle City Council election"	"finance-companies"
"0"	"WH plans "aggressive" strategy for open impeachment hearings"	"newspolitics"
"0"	"Opinion: NFL owes Colin Kaepernick a fair shot at weekend workout in Atlanta"	"football_nfl"
"0"	"Pakistan opens visa-free border crossing for India Sikhs"	"newsworld"
"1"	"As Trump moves to bully witnesses and derail impeachment, Democrats see obstruction"	"newspolitics"
"1"	"Chiefs' Mathieu calls out 49ers over easy schedule"	"football_nfl"
"1"	"This video of a runaway dog sled police chase is the most absurd, delightful thing you'll see today"	"newsus"
"1"	"Brazil oil auction a 'total disaster' as bidders stay away"	"markets"
"1"	"North Korea Warns American 'War Exercise' Will Violate Trump's Vow to Kim, Put Nuclear Talks 'On the Verge of Extinction'"	"newsworld"
"0"	"Mo'Nique Files Race and Sex Discrimination Suit Against Netflix"	"tvnews"
"1"	"Trump admin preparing to take over private land for border wall"	"newsus"
"1"	"New Jersey woman sues waiter for spilling wine on her Hermès handbag"	"newsus"
"1"	"Study: Third-Hand Smoke Can Damage Your Lungs"	"ads-lung-health"
"1"	"Democrats unveil procedures for Trump's impeachment inquiry, rebutting GOP attacks"	"newspolitics"
"1"	"Judge fast-tracks case over former White House official's refusal to testify in impeachment inquiry"	"newspolitics"
"1"	"Trump says he was kidding about a border wall in Colorado, Twitter fires back"	"newsus"
"0"	"Meghan Markle and Prince Harry Won't Spend Christmas with Queen Elizabeth at Sandringham This Year"	"lifestyleroyals"
"0"	"Why This Couple Is Getting a 'Sleep Divorce'"	"lifestylevideo"
"0"	"Erdogan says he returned Trump's threatening letter on Syria invasion"	"newspolitics"
"0"	"Alexis Crawford: Clark Atlanta student filed a police report on unwanted kissing before she vanished"	"newscrime"
"0"	"FCA And GM Unfazed By The Ford Bronco's Return"	"autosnews"
"0"	"Photos of the Day"	"newsworld"
"0"	"More Americans say now is a bad time to buy a home"	"finance-real-estate"
"1"	"Trump to spend $300 million on border wall "quality assurance""	"newsus"
"0"	"Still teaching at 95, Jimmy Carter draws devotees to church"	"newsus"
"1"	"Ready to Boost Stocks: Investors' Multitrillion Cash Hoard"	"newsus"
"1"	"Las Vegas prepares to welcome Raiders, but is it a bad bet?"	"football_nfl"
"0"	"Popular Selena tribute singer from San Fernando Valley detained by ICE in Texas"	"musicnews"
"1"	"Sessions wins endorsement from key GOP senators"	"elections-2020-us"
"0"	"Marlboro Man Bob Norris dies at 90, having reportedly never been a smoker"	"tv-celebrity"
"1"	"Ex-evangelical pastor says supporting Trump has been 'damaging' to church"	"newsus"
"1"	"Ruth Bader Ginsburg misses court due to illness"	"newsus"
"0"	"I Was A Psychic Phone Line Operator. Here's What Really Happened Behind The Scenes."	"voices"
"0"	"Miranda Lambert gets candid about her public divorce and secret wedding, plus more news"	"entertainment-celebrity"
"0"	"Jane Fonda Avoids Fifth Arrest While Protesting in D.C."	"tv-celebrity"
"0"	"Funny celeb pics for November 2019"	"humor"
"0"	"These Are America's Favorite Liquor Brands"	"beverages"
"0"	"Debunking the week's tabloid stories: Nov. 8, 2019"	"celebrity"
"0"	"Divers salvage 100-year-old liquor from WWI shipwreck"	"travelarticle"
"0"	"Chuck E. Cheese just got major makeover   and axed the animal band"	"foodnews"
"0"	"A man lost 400,000 frequent flyer miles for sneaking a fat cat onto his flight in Russia"	"travelnews"
"1"	"Elon Musk says he's going offline after questioning Twitter"	"finance-companies"
"1"	"Commuter plane crash on Alaska island critically injures 2"	"newsus"
"1"	"This Is The Moment A Senior Shelter Dog Knew He Was Safe"	"newsgoodnews"
"1"	"Facebook, other social media sites pressured to protect census"	"newspolitics"
"1"	"Alaska's Uneven Rural Law Enforcement System Often Leaves Remote Villages With No Cops"	"newsus"
"1"	"New York Senator Chuck Schumer Mocks Trump Making Florida His New Home, Donald Jr. Fires Back"	"newspolitics"
"0"	"The cost to become a US citizen is going up 61 percent"	"markets"
"1"	"The costume fits: 49ers are Super Bowl contenders"	"football_nfl"
"0"	"Wealthy investors are bracing for a sharp stock sell-off in 2020"	"markets"
"1"	"DOJ sues Walmart for allegedly discriminating against a Navy reserve officer"	"newsus"
"0"	"Don't be fooled: Costco says $75 coupon is a scam"	"finance-companies"
"0"	"Roman Catholic Priests Will Not Break Confession to Report Child Abuse, U.K. Inquiry Told"	"newsworld"
"0"	"Here Are the Biggest Deals We're Anticipating for Black Friday"	"shop-holidays"
"1"	"Trash to treasure: Everest garbage given new lease of life"	"newsworld"
"1"	"Beat the crowds at these abandoned U.S. national parks"	"ustravel"
"1"	"As L.A. ports automate, some workers are cheering on the robots"	"markets"
"0"	"Broadway Star Laurel Griggs Suffered Asthma Attack Before She Died at Age 13"	"music-celebrity"
"0"	"Fed likely to defy history with steady rates through elections"	"markets"
"1"	"Everyday heroes step up to help lone Waffle House employee"	"restaurantsandnews"
"1"	"Pac-12 suspends referee after egregious mistake during Washington State vs. Cal game"	"football_ncaa"
"1"	"Home prices are overheating again, causing buyers to turn away"	"finance-real-estate"
"1"	"As companies flee blue cities, middle class workers are hurt"	"finance-companies"
"1"	"Are Your Breasts Normal? We Asked An Expert"	"wellness"
"0"	"Highway blockade reveals splits in Hong Kong protest movement"	"newsworld"
"0"	"U.S.-born ISIS bride thinks she 'deserves a second chance'"	"newsus"
"0"	"50 Things You Never Knew About Pizza"	"tipsandtricks"
"1"	"The 2020 Ram 1500 EcoDiesel's Official MPG Numbers Are Impressive"	"autostrucks"
"1"	"Student barred from reselling Krispy Kreme now teaming up with the doughnut chain"	"foodnews"
"1"	"'Monday Night Football' commentator under fire after belittling criticism of 49ers kicker for missed field goal"	"football_nfl"
"1"	"Trump Tax Return Case Confronts Supreme Court With a Momentous Choice"	"newspolitics"
"0"	"Where will Odell Beckham be playing in 2020?"	"football_nfl"
"0"	"The Real Reason McDonald's Keeps the Filet-O-Fish on Their Menu"	"restaurantsandnews"
"1"	"Sunday in 60 | Week 7"	"football_nfl_videos"
"0"	"Bolivia's Jeanine Anez declares herself acting president as Evo Morales vows to fight from abroad"	"newsworld"
"1"	"25 bathrooms? Former Clinton labor secretary says Bezos' mansion helps make case for soaking the rich"	"markets"
"1"	"The 50 cheapest places to buy land in America"	"finance-real-estate"
"1"	"Their colleges closed   but their student loans didn't disappear. Then, they sued."	"newsus"
"0"	"The Dow was perfectly unchanged on Tuesday, a rare occasion on Wall Street"	"markets"
"1"	"Court rules for LA in lawsuit against Trump"	"newsus"
"1"	"Caracas Country Club: Where superrich await socialism's collapse"	"markets"
"0"	"Vanna White hosts 'Wheel of Fortune' after Sajak has surgery"	"topnews"
"0"	"7 Rules for How to Call in Sick to Work"	"wellness"
"0"	"2020 Ford Explorer launch hardly went according to plan, company admits"	"autosnews"
"1"	"Smugglers are sawing through new sections of Trump's border wall"	"newsus"
"0"	"Today in History: November 9"	"newsworld"
"0"	"'What I said was accurate': Sen. Kennedy defends calling Pelosi 'dumb'"	"newspolitics"
"1"	"Proposed HHS rule would roll back LGBTQ protections in adoption, foster care"	"newsus"
"1"	"Fox News contributor: 'Most likely' outcome is Trump doesn't run in 2020"	"newspolitics"
"0"	"Watch: Ohio offensive lineman does cartwheel during play"	"football_nfl"
"0"	"17 photos that show the ugly truth of living in a tiny house"	"lifestylehomeandgarden"
"1"	"NFL fines Tyreek Hill $10K for flashing peace sign at defense during TD again"	"football_nfl"
"1"	"Air Force's X-37B space plane lands after record 780 days in orbit"	"newsscienceandtechnology"
"0"	"Young homebuyers are vanishing from the US"	"finance-real-estate"
"0"	"4 injured in shooting at adult club in Kansas City, Missouri"	"newscrime"
"1"	"President Donald Trump greeted with boos at Game 5 of World Series, fans chant 'lock him up'"	"newspolitics"
"1"	"Trump education official to resign and call for mass student loan forgiveness"	"markets"
"0"	"John Legend Is PEOPLE's Sexiest Man Alive 2019: 'I'm Excited but a Little Scared at the Same Time'"	"music-celebrity"
"0"	"Red and Blue Economies Are Heading in Sharply Different Directions"	"markets"
"0"	"Insiders predict: NFL week 10 winners"	"football_nfl"
"0"	"Why US miners are still digging new mines as coal prices plunge"	"finance-companies"
"0"	"What Happens When a Plane Collides with a Flock of Birds?"	"travelnews"
"0"	"Chuck Woolery: Supporting Trump 'pretty much destroyed my career'"	"tv-celebrity"
"1"	"What Causes Vertigo? 15 Things Doctors Wish You Knew"	"medical"
"0"	"How Amazon's quest for more, cheaper products has resulted in a flea market of fakes"	"finance-companies"
"0"	"Navy Submarine, Missing for 75 Years, Is Found Off Okinawa"	"newsworld"
"1"	"Prison workers under investigation for allegedly mocking transgender inmates in private Facebook groups"	"newsus"
"0"	"The latest on Brad Pitt and Angelina Jolie's post-split relationship, plus more news"	"entertainment-celebrity"
"0"	"U.S. proposes denying work permits to asylum seekers who enter illegally"	"newsus"
"0"	"19 Home Renovations That Give Owners the Most Joy"	"finance-real-estate"
"0"	"Senior Trump official embellished résumé, had face on fake Time cover"	"newspolitics"
"0"	"Giuliani pens op-ed slamming 'unprecedented' impeachment inquiry"	"newspolitics"
"1"	"$166 water could dictate international iceberg law"	"markets"
"1"	"Sun Country Airlines to Add 12 New Routes in 2020"	"travelnews"
"0"	"Dog Throws A Total Tantrum When She Realizes Mom Wants To Take The Stairs"	"lifestylebuzz"
"0"	"100 best Westerns of all time"	"movies-gallery"
"0"	"All the Shows Hoping to Be the Next Game of Thrones"	"tv-gallery"
